20:55:19.001629 IP 10.0.0.1.47902 > 10.0.0.3.5001: Flags [S], seq 1849315734, win 42340, options [mss 1460,sackOK,TS val 3663508326 ecr 0,nop,wscale 9], length 0
20:55:19.002448 IP 10.0.0.3.5001 > 10.0.0.1.47902: Flags [S.], seq 1860412654, ack 1849315735, win 43440, options [mss 1460,sackOK,TS val 1027246508 ecr 3663508326,nop,wscale 9], length 0
20:55:19.006315 IP 10.0.0.1.47902 > 10.0.0.3.5001: Flags [.], ack 1, win 83, options [nop,nop,TS val 3663508342 ecr 1027246508], length 0
20:55:19.007172 IP 10.0.0.1.47902 > 10.0.0.3.5001: Flags [P.], seq 1:2897, ack 1, win 83, options [nop,nop,TS val 3663508343 ecr 1027246508], length 2896
20:55:19.007350 IP 10.0.0.3.5001 > 10.0.0.1.47902: Flags [.], ack 2897, win 82, options [nop,nop,TS val 1027246513 ecr 3663508343], length 0
20:55:19.007396 IP 10.0.0.1.47902 > 10.0.0.3.5001: Flags [P.], seq 2897:5793, ack 1, win 83, options [nop,nop,TS val 3663508343 ecr 1027246508], length 2896
20:55:19.007431 IP 10.0.0.3.5001 > 10.0.0.1.47902: Flags [.], ack 5793, win 78, options [nop,nop,TS val 1027246513 ecr 3663508343], length 0
20:55:19.007486 IP 10.0.0.1.47902 > 10.0.0.3.5001: Flags [P.], seq 5793:8689, ack 1, win 83, options [nop,nop,TS val 3663508343 ecr 1027246508], length 2896
20:55:19.007535 IP 10.0.0.3.5001 > 10.0.0.1.47902: Flags [.], ack 8689, win 74, options [nop,nop,TS val 1027246514 ecr 3663508343], length 0
20:55:19.007579 IP 10.0.0.1.47902 > 10.0.0.3.5001: Flags [P.], seq 8689:11585, ack 1, win 83, options [nop,nop,TS val 3663508343 ecr 1027246508], length 2896
20:55:19.007618 IP 10.0.0.3.5001 > 10.0.0.1.47902: Flags [.], ack 11585, win 70, options [nop,nop,TS val 1027246514 ecr 3663508343], length 0
20:55:19.009493 IP 10.0.0.1.47902 > 10.0.0.3.5001: Flags [P.], seq 11585:14481, ack 1, win 83, options [nop,nop,TS val 3663508343 ecr 1027246508], length 2896
20:55:19.009603 IP 10.0.0.3.5001 > 10.0.0.1.47902: Flags [.], ack 14481, win 82, options [nop,nop,TS val 1027246516 ecr 3663508343], length 0
20:55:19.024133 IP 10.0.0.1.47902 > 10.0.0.3.5001: Flags [P.], seq 14481:17377, ack 1, win 83, options [nop,nop,TS val 3663508360 ecr 1027246513], length 2896
20:55:19.024141 IP 10.0.0.1.47902 > 10.0.0.3.5001: Flags [P.], seq 17377:20273, ack 1, win 83, options [nop,nop,TS val 3663508360 ecr 1027246513], length 2896
20:55:19.024266 IP 10.0.0.3.5001 > 10.0.0.1.47902: Flags [.], ack 17377, win 82, options [nop,nop,TS val 1027246530 ecr 3663508360], length 0
20:55:19.024282 IP 10.0.0.3.5001 > 10.0.0.1.47902: Flags [.], ack 20273, win 78, options [nop,nop,TS val 1027246530 ecr 3663508360], length 0
20:55:19.024662 IP 10.0.0.1.47902 > 10.0.0.3.5001: Flags [P.], seq 20273:23169, ack 1, win 83, options [nop,nop,TS val 3663508361 ecr 1027246530], length 2896
20:55:19.024670 IP 10.0.0.1.47902 > 10.0.0.3.5001: Flags [P.], seq 23169:26065, ack 1, win 83, options [nop,nop,TS val 3663508361 ecr 1027246530], length 2896
20:55:19.024788 IP 10.0.0.3.5001 > 10.0.0.1.47902: Flags [.], ack 23169, win 94, options [nop,nop,TS val 1027246531 ecr 3663508361], length 0
20:55:19.024804 IP 10.0.0.3.5001 > 10.0.0.1.47902: Flags [.], ack 26065, win 106, options [nop,nop,TS val 1027246531 ecr 3663508361], length 0
20:55:19.024821 IP 10.0.0.1.47902 > 10.0.0.3.5001: Flags [P.], seq 26065:28961, ack 1, win 83, options [nop,nop,TS val 3663508361 ecr 1027246530], length 2896
20:55:19.024919 IP 10.0.0.3.5001 > 10.0.0.1.47902: Flags [.], ack 28961, win 117, options [nop,nop,TS val 1027246531 ecr 3663508361], length 0
20:55:19.024971 IP 10.0.0.1.47902 > 10.0.0.3.5001: Flags [P.], seq 28961:31857, ack 1, win 83, options [nop,nop,TS val 3663508361 ecr 1027246530], length 2896
20:55:19.025133 IP 10.0.0.3.5001 > 10.0.0.1.47902: Flags [.], ack 31857, win 128, options [nop,nop,TS val 1027246531 ecr 3663508361], length 0
20:55:19.025172 IP 10.0.0.1.47902 > 10.0.0.3.5001: Flags [P.], seq 31857:34753, ack 1, win 83, options [nop,nop,TS val 3663508361 ecr 1027246530], length 2896
20:55:19.025228 IP 10.0.0.3.5001 > 10.0.0.1.47902: Flags [.], ack 34753, win 140, options [nop,nop,TS val 1027246531 ecr 3663508361], length 0
20:55:19.025265 IP 10.0.0.1.47902 > 10.0.0.3.5001: Flags [P.], seq 34753:36201, ack 1, win 83, options [nop,nop,TS val 3663508361 ecr 1027246530], length 1448
20:55:19.025320 IP 10.0.0.3.5001 > 10.0.0.1.47902: Flags [.], ack 36201, win 145, options [nop,nop,TS val 1027246531 ecr 3663508361], length 0
20:55:19.025358 IP 10.0.0.1.47902 > 10.0.0.3.5001: Flags [P.], seq 36201:39097, ack 1, win 83, options [nop,nop,TS val 3663508361 ecr 1027246530], length 2896
20:55:19.025413 IP 10.0.0.3.5001 > 10.0.0.1.47902: Flags [.], ack 39097, win 146, options [nop,nop,TS val 1027246531 ecr 3663508361], length 0
20:55:19.025450 IP 10.0.0.1.47902 > 10.0.0.3.5001: Flags [P.], seq 39097:41993, ack 1, win 83, options [nop,nop,TS val 3663508361 ecr 1027246530], length 2896
20:55:19.025505 IP 10.0.0.3.5001 > 10.0.0.1.47902: Flags [.], ack 41993, win 142, options [nop,nop,TS val 1027246531 ecr 3663508361], length 0
20:55:19.025543 IP 10.0.0.1.47902 > 10.0.0.3.5001: Flags [P.], seq 41993:44889, ack 1, win 83, options [nop,nop,TS val 3663508361 ecr 1027246530], length 2896
20:55:19.025598 IP 10.0.0.3.5001 > 10.0.0.1.47902: Flags [.], ack 44889, win 138, options [nop,nop,TS val 1027246532 ecr 3663508361], length 0
20:55:19.025635 IP 10.0.0.1.47902 > 10.0.0.3.5001: Flags [P.], seq 44889:47785, ack 1, win 83, options [nop,nop,TS val 3663508361 ecr 1027246530], length 2896
20:55:19.025691 IP 10.0.0.3.5001 > 10.0.0.1.47902: Flags [.], ack 47785, win 134, options [nop,nop,TS val 1027246532 ecr 3663508361], length 0
20:55:19.025728 IP 10.0.0.1.47902 > 10.0.0.3.5001: Flags [.], seq 47785:49233, ack 1, win 83, options [nop,nop,TS val 3663508361 ecr 1027246530], length 1448
20:55:19.025782 IP 10.0.0.3.5001 > 10.0.0.1.47902: Flags [.], ack 49233, win 132, options [nop,nop,TS val 1027246532 ecr 3663508361], length 0
20:55:19.026256 IP 10.0.0.1.47902 > 10.0.0.3.5001: Flags [P.], seq 49233:52129, ack 1, win 83, options [nop,nop,TS val 3663508362 ecr 1027246531], length 2896
20:55:19.026329 IP 10.0.0.3.5001 > 10.0.0.1.47902: Flags [.], ack 52129, win 157, options [nop,nop,TS val 1027246532 ecr 3663508362], length 0
20:55:19.026368 IP 10.0.0.1.47902 > 10.0.0.3.5001: Flags [P.], seq 52129:55025, ack 1, win 83, options [nop,nop,TS val 3663508362 ecr 1027246531], length 2896
20:55:19.026434 IP 10.0.0.3.5001 > 10.0.0.1.47902: Flags [.], ack 55025, win 153, options [nop,nop,TS val 1027246532 ecr 3663508362], length 0
20:55:19.026471 IP 10.0.0.1.47902 > 10.0.0.3.5001: Flags [P.], seq 55025:57921, ack 1, win 83, options [nop,nop,TS val 3663508362 ecr 1027246531], length 2896
20:55:19.026526 IP 10.0.0.3.5001 > 10.0.0.1.47902: Flags [.], ack 57921, win 149, options [nop,nop,TS val 1027246532 ecr 3663508362], length 0
20:55:19.026565 IP 10.0.0.1.47902 > 10.0.0.3.5001: Flags [P.], seq 57921:60817, ack 1, win 83, options [nop,nop,TS val 3663508362 ecr 1027246531], length 2896
20:55:19.026619 IP 10.0.0.3.5001 > 10.0.0.1.47902: Flags [.], ack 60817, win 144, options [nop,nop,TS val 1027246533 ecr 3663508362], length 0
20:55:19.026689 IP 10.0.0.1.47902 > 10.0.0.3.5001: Flags [P.], seq 60817:63713, ack 1, win 83, options [nop,nop,TS val 3663508363 ecr 1027246531], length 2896
20:55:19.026760 IP 10.0.0.3.5001 > 10.0.0.1.47902: Flags [.], ack 63713, win 140, options [nop,nop,TS val 1027246533 ecr 3663508363], length 0
20:55:19.026798 IP 10.0.0.1.47902 > 10.0.0.3.5001: Flags [P.], seq 63713:66609, ack 1, win 83, options [nop,nop,TS val 3663508363 ecr 1027246531], length 2896
20:55:19.026846 IP 10.0.0.1.47902 > 10.0.0.3.5001: Flags [.], seq 66609:68057, ack 1, win 83, options [nop,nop,TS val 3663508363 ecr 1027246531], length 1448
20:55:19.026900 IP 10.0.0.1.47902 > 10.0.0.3.5001: Flags [.], ack 1, win 83, options [nop,nop,TS val 3663508363 ecr 1027246531], length 0
20:55:19.026963 IP 10.0.0.1.47902 > 10.0.0.3.5001: Flags [P.], seq 68057:70953, ack 1, win 83, options [nop,nop,TS val 3663508363 ecr 1027246531], length 2896
20:55:19.027011 IP 10.0.0.1.47902 > 10.0.0.3.5001: Flags [P.], seq 70953:73849, ack 1, win 83, options [nop,nop,TS val 3663508363 ecr 1027246531], length 2896
20:55:19.027082 IP 10.0.0.1.47902 > 10.0.0.3.5001: Flags [P.], seq 73849:76745, ack 1, win 83, options [nop,nop,TS val 3663508363 ecr 1027246532], length 2896
20:55:19.027129 IP 10.0.0.1.47902 > 10.0.0.3.5001: Flags [P.], seq 76745:79641, ack 1, win 83, options [nop,nop,TS val 3663508363 ecr 1027246532], length 2896
20:55:19.027178 IP 10.0.0.1.47902 > 10.0.0.3.5001: Flags [.], seq 79641:81089, ack 1, win 83, options [nop,nop,TS val 3663508363 ecr 1027246532], length 1448
20:55:19.027248 IP 10.0.0.1.47902 > 10.0.0.3.5001: Flags [.], seq 81089:82537, ack 1, win 83, options [nop,nop,TS val 3663508363 ecr 1027246532], length 1448
20:55:19.027318 IP 10.0.0.1.47902 > 10.0.0.3.5001: Flags [P.], seq 82537:86881, ack 1, win 83, options [nop,nop,TS val 3663508363 ecr 1027246532], length 4344
20:55:19.027376 IP 10.0.0.1.47902 > 10.0.0.3.5001: Flags [P.], seq 86881:91225, ack 1, win 83, options [nop,nop,TS val 3663508363 ecr 1027246532], length 4344
20:55:19.027561 IP 10.0.0.1.47902 > 10.0.0.3.5001: Flags [P.], seq 91225:94121, ack 1, win 83, options [nop,nop,TS val 3663508364 ecr 1027246533], length 2896
20:55:19.027789 IP 10.0.0.3.5001 > 10.0.0.1.47902: Flags [.], ack 94121, win 157, options [nop,nop,TS val 1027246534 ecr 3663508363], length 0
20:55:19.029153 IP 10.0.0.1.47902 > 10.0.0.3.5001: Flags [P.], seq 94121:97017, ack 1, win 83, options [nop,nop,TS val 3663508365 ecr 1027246533], length 2896
20:55:19.029229 IP 10.0.0.3.5001 > 10.0.0.1.47902: Flags [.], ack 97017, win 157, options [nop,nop,TS val 1027246535 ecr 3663508365], length 0
20:55:19.029347 IP 10.0.0.1.47902 > 10.0.0.3.5001: Flags [P.], seq 97017:101361, ack 1, win 83, options [nop,nop,TS val 3663508365 ecr 1027246534], length 4344
20:55:19.029420 IP 10.0.0.3.5001 > 10.0.0.1.47902: Flags [.], ack 101361, win 174, options [nop,nop,TS val 1027246535 ecr 3663508365], length 0
20:55:19.029458 IP 10.0.0.1.47902 > 10.0.0.3.5001: Flags [P.], seq 101361:107153, ack 1, win 83, options [nop,nop,TS val 3663508365 ecr 1027246534], length 5792
20:55:19.029522 IP 10.0.0.3.5001 > 10.0.0.1.47902: Flags [.], ack 107153, win 196, options [nop,nop,TS val 1027246535 ecr 3663508365], length 0
20:55:19.029560 IP 10.0.0.1.47902 > 10.0.0.3.5001: Flags [P.], seq 107153:112945, ack 1, win 83, options [nop,nop,TS val 3663508365 ecr 1027246534], length 5792
20:55:19.029616 IP 10.0.0.3.5001 > 10.0.0.1.47902: Flags [.], ack 112945, win 219, options [nop,nop,TS val 1027246536 ecr 3663508365], length 0
20:55:19.029724 IP 10.0.0.1.47902 > 10.0.0.3.5001: Flags [P.], seq 112945:118737, ack 1, win 83, options [nop,nop,TS val 3663508365 ecr 1027246534], length 5792
20:55:19.029779 IP 10.0.0.3.5001 > 10.0.0.1.47902: Flags [.], ack 118737, win 242, options [nop,nop,TS val 1027246536 ecr 3663508365], length 0
20:55:19.029816 IP 10.0.0.1.47902 > 10.0.0.3.5001: Flags [P.], seq 118737:123081, ack 1, win 83, options [nop,nop,TS val 3663508365 ecr 1027246534], length 4344
20:55:19.029871 IP 10.0.0.3.5001 > 10.0.0.1.47902: Flags [.], ack 123081, win 259, options [nop,nop,TS val 1027246536 ecr 3663508365], length 0
20:55:19.029909 IP 10.0.0.1.47902 > 10.0.0.3.5001: Flags [P.], seq 123081:128873, ack 1, win 83, options [nop,nop,TS val 3663508365 ecr 1027246534], length 5792
20:55:19.029963 IP 10.0.0.3.5001 > 10.0.0.1.47902: Flags [.], ack 128873, win 281, options [nop,nop,TS val 1027246536 ecr 3663508365], length 0
20:55:19.030200 IP 10.0.0.1.47902 > 10.0.0.3.5001: Flags [P.], seq 128873:131073, ack 1, win 83, options [nop,nop,TS val 3663508366 ecr 1027246535], length 2200
20:55:19.030272 IP 10.0.0.3.5001 > 10.0.0.1.47902: Flags [.], ack 131073, win 290, options [nop,nop,TS val 1027246536 ecr 3663508366], length 0
20:55:20.007086 IP 10.0.0.1.47902 > 10.0.0.3.5001: Flags [P.], seq 131073:138313, ack 1, win 83, options [nop,nop,TS val 3663509343 ecr 1027246536], length 7240
20:55:20.007162 IP 10.0.0.3.5001 > 10.0.0.1.47902: Flags [.], ack 138313, win 318, options [nop,nop,TS val 1027247513 ecr 3663509343], length 0
20:55:20.007263 IP 10.0.0.1.47902 > 10.0.0.3.5001: Flags [P.], seq 138313:145553, ack 1, win 83, options [nop,nop,TS val 3663509343 ecr 1027246536], length 7240
20:55:20.007321 IP 10.0.0.3.5001 > 10.0.0.1.47902: Flags [.], ack 145553, win 346, options [nop,nop,TS val 1027247513 ecr 3663509343], length 0
20:55:20.007431 IP 10.0.0.1.47902 > 10.0.0.3.5001: Flags [P.], seq 145553:154241, ack 1, win 83, options [nop,nop,TS val 3663509343 ecr 1027247513], length 8688
20:55:20.007488 IP 10.0.0.3.5001 > 10.0.0.1.47902: Flags [.], ack 154241, win 380, options [nop,nop,TS val 1027247513 ecr 3663509343], length 0
20:55:20.007518 IP 10.0.0.1.47902 > 10.0.0.3.5001: Flags [P.], seq 154241:162929, ack 1, win 83, options [nop,nop,TS val 3663509343 ecr 1027247513], length 8688
20:55:20.007562 IP 10.0.0.3.5001 > 10.0.0.1.47902: Flags [.], ack 162929, win 414, options [nop,nop,TS val 1027247514 ecr 3663509343], length 0
20:55:20.007591 IP 10.0.0.1.47902 > 10.0.0.3.5001: Flags [P.], seq 162929:171617, ack 1, win 83, options [nop,nop,TS val 3663509343 ecr 1027247513], length 8688
20:55:20.007635 IP 10.0.0.3.5001 > 10.0.0.1.47902: Flags [.], ack 171617, win 448, options [nop,nop,TS val 1027247514 ecr 3663509343], length 0
20:55:20.007664 IP 10.0.0.1.47902 > 10.0.0.3.5001: Flags [P.], seq 171617:174513, ack 1, win 83, options [nop,nop,TS val 3663509343 ecr 1027247513], length 2896
20:55:20.007707 IP 10.0.0.3.5001 > 10.0.0.1.47902: Flags [.], ack 174513, win 459, options [nop,nop,TS val 1027247514 ecr 3663509343], length 0
20:55:20.007900 IP 10.0.0.1.47902 > 10.0.0.3.5001: Flags [P.], seq 174513:186097, ack 1, win 83, options [nop,nop,TS val 3663509344 ecr 1027247513], length 11584
20:55:20.007975 IP 10.0.0.3.5001 > 10.0.0.1.47902: Flags [.], ack 186097, win 505, options [nop,nop,TS val 1027247514 ecr 3663509344], length 0
20:55:20.008005 IP 10.0.0.1.47902 > 10.0.0.3.5001: Flags [.], seq 186097:187545, ack 1, win 83, options [nop,nop,TS val 3663509344 ecr 1027247513], length 1448
20:55:20.008047 IP 10.0.0.3.5001 > 10.0.0.1.47902: Flags [.], ack 187545, win 510, options [nop,nop,TS val 1027247514 ecr 3663509344], length 0
20:55:20.008138 IP 10.0.0.1.47902 > 10.0.0.3.5001: Flags [P.], seq 187545:200577, ack 1, win 83, options [nop,nop,TS val 3663509344 ecr 1027247514], length 13032
20:55:20.008195 IP 10.0.0.3.5001 > 10.0.0.1.47902: Flags [.], ack 200577, win 561, options [nop,nop,TS val 1027247514 ecr 3663509344], length 0
20:55:20.008225 IP 10.0.0.1.47902 > 10.0.0.3.5001: Flags [P.], seq 200577:207817, ack 1, win 83, options [nop,nop,TS val 3663509344 ecr 1027247514], length 7240
20:55:20.008268 IP 10.0.0.3.5001 > 10.0.0.1.47902: Flags [.], ack 207817, win 590, options [nop,nop,TS val 1027247514 ecr 3663509344], length 0
20:55:20.008358 IP 10.0.0.1.47902 > 10.0.0.3.5001: Flags [P.], seq 207817:210713, ack 1, win 83, options [nop,nop,TS val 3663509344 ecr 1027247514], length 2896
20:55:20.008413 IP 10.0.0.3.5001 > 10.0.0.1.47902: Flags [.], ack 210713, win 601, options [nop,nop,TS val 1027247514 ecr 3663509344], length 0
20:55:20.008443 IP 10.0.0.1.47902 > 10.0.0.3.5001: Flags [P.], seq 210713:226641, ack 1, win 83, options [nop,nop,TS val 3663509344 ecr 1027247514], length 15928
20:55:20.008487 IP 10.0.0.3.5001 > 10.0.0.1.47902: Flags [.], ack 226641, win 663, options [nop,nop,TS val 1027247514 ecr 3663509344], length 0
20:55:20.008516 IP 10.0.0.1.47902 > 10.0.0.3.5001: Flags [P.], seq 226641:242569, ack 1, win 83, options [nop,nop,TS val 3663509344 ecr 1027247514], length 15928
20:55:20.008561 IP 10.0.0.3.5001 > 10.0.0.1.47902: Flags [.], ack 242569, win 725, options [nop,nop,TS val 1027247515 ecr 3663509344], length 0
20:55:20.008590 IP 10.0.0.1.47902 > 10.0.0.3.5001: Flags [.], seq 242569:244017, ack 1, win 83, options [nop,nop,TS val 3663509344 ecr 1027247514], length 1448
20:55:20.008632 IP 10.0.0.3.5001 > 10.0.0.1.47902: Flags [.], ack 244017, win 731, options [nop,nop,TS val 1027247515 ecr 3663509344], length 0
20:55:20.008733 IP 10.0.0.1.47902 > 10.0.0.3.5001: Flags [P.], seq 244017:261393, ack 1, win 83, options [nop,nop,TS val 3663509345 ecr 1027247514], length 17376
20:55:20.008791 IP 10.0.0.3.5001 > 10.0.0.1.47902: Flags [.], ack 261393, win 799, options [nop,nop,TS val 1027247515 ecr 3663509345], length 0
20:55:20.008821 IP 10.0.0.1.47902 > 10.0.0.3.5001: Flags [P.], seq 261393:262145, ack 1, win 83, options [nop,nop,TS val 3663509345 ecr 1027247514], length 752
20:55:20.008863 IP 10.0.0.3.5001 > 10.0.0.1.47902: Flags [.], ack 262145, win 804, options [nop,nop,TS val 1027247515 ecr 3663509345], length 0
20:55:21.007065 IP 10.0.0.1.47902 > 10.0.0.3.5001: Flags [P.], seq 262145:269385, ack 1, win 83, options [nop,nop,TS val 3663510343 ecr 1027247515], length 7240
20:55:21.007144 IP 10.0.0.3.5001 > 10.0.0.1.47902: Flags [.], ack 269385, win 833, options [nop,nop,TS val 1027248513 ecr 3663510343], length 0
20:55:21.007248 IP 10.0.0.1.47902 > 10.0.0.3.5001: Flags [P.], seq 269385:276625, ack 1, win 83, options [nop,nop,TS val 3663510343 ecr 1027247515], length 7240
20:55:21.007307 IP 10.0.0.3.5001 > 10.0.0.1.47902: Flags [.], ack 276625, win 861, options [nop,nop,TS val 1027248513 ecr 3663510343], length 0
20:55:21.007418 IP 10.0.0.1.47902 > 10.0.0.3.5001: Flags [P.], seq 276625:291105, ack 1, win 83, options [nop,nop,TS val 3663510343 ecr 1027248513], length 14480
20:55:21.007478 IP 10.0.0.3.5001 > 10.0.0.1.47902: Flags [.], ack 291105, win 918, options [nop,nop,TS val 1027248513 ecr 3663510343], length 0
20:55:21.007508 IP 10.0.0.1.47902 > 10.0.0.3.5001: Flags [P.], seq 291105:305585, ack 1, win 83, options [nop,nop,TS val 3663510343 ecr 1027248513], length 14480
20:55:21.007554 IP 10.0.0.3.5001 > 10.0.0.1.47902: Flags [.], ack 305585, win 974, options [nop,nop,TS val 1027248514 ecr 3663510343], length 0
20:55:21.007723 IP 10.0.0.1.47902 > 10.0.0.3.5001: Flags [P.], seq 305585:322961, ack 1, win 83, options [nop,nop,TS val 3663510344 ecr 1027248513], length 17376
20:55:21.007784 IP 10.0.0.3.5001 > 10.0.0.1.47902: Flags [.], ack 322961, win 1042, options [nop,nop,TS val 1027248514 ecr 3663510344], length 0
20:55:21.007814 IP 10.0.0.1.47902 > 10.0.0.3.5001: Flags [P.], seq 322961:325857, ack 1, win 83, options [nop,nop,TS val 3663510344 ecr 1027248513], length 2896
20:55:21.007858 IP 10.0.0.3.5001 > 10.0.0.1.47902: Flags [.], ack 325857, win 1053, options [nop,nop,TS val 1027248514 ecr 3663510344], length 0
20:55:21.007950 IP 10.0.0.1.47902 > 10.0.0.3.5001: Flags [P.], seq 325857:341785, ack 1, win 83, options [nop,nop,TS val 3663510344 ecr 1027248514], length 15928
20:55:21.008009 IP 10.0.0.3.5001 > 10.0.0.1.47902: Flags [.], ack 341785, win 1116, options [nop,nop,TS val 1027248514 ecr 3663510344], length 0
20:55:21.008096 IP 10.0.0.1.47902 > 10.0.0.3.5001: Flags [P.], seq 341785:362057, ack 1, win 83, options [nop,nop,TS val 3663510344 ecr 1027248514], length 20272
20:55:21.008154 IP 10.0.0.3.5001 > 10.0.0.1.47902: Flags [.], ack 362057, win 1195, options [nop,nop,TS val 1027248514 ecr 3663510344], length 0
20:55:21.008185 IP 10.0.0.1.47902 > 10.0.0.3.5001: Flags [P.], seq 362057:382329, ack 1, win 83, options [nop,nop,TS val 3663510344 ecr 1027248514], length 20272
20:55:21.008230 IP 10.0.0.3.5001 > 10.0.0.1.47902: Flags [.], ack 382329, win 1274, options [nop,nop,TS val 1027248514 ecr 3663510344], length 0
20:55:21.008260 IP 10.0.0.1.47902 > 10.0.0.3.5001: Flags [.], seq 382329:383777, ack 1, win 83, options [nop,nop,TS val 3663510344 ecr 1027248514], length 1448
20:55:21.008304 IP 10.0.0.3.5001 > 10.0.0.1.47902: Flags [.], ack 383777, win 1280, options [nop,nop,TS val 1027248514 ecr 3663510344], length 0
20:55:21.008420 IP 10.0.0.1.47902 > 10.0.0.3.5001: Flags [P.], seq 383777:393217, ack 1, win 83, options [nop,nop,TS val 3663510344 ecr 1027248514], length 9440
20:55:21.008478 IP 10.0.0.3.5001 > 10.0.0.1.47902: Flags [.], ack 393217, win 1316, options [nop,nop,TS val 1027248514 ecr 3663510344], length 0
20:55:22.007217 IP 10.0.0.1.47902 > 10.0.0.3.5001: Flags [P.], seq 393217:400457, ack 1, win 83, options [nop,nop,TS val 3663511343 ecr 1027248514], length 7240
20:55:22.007577 IP 10.0.0.3.5001 > 10.0.0.1.47902: Flags [.], ack 400457, win 1345, options [nop,nop,TS val 1027249513 ecr 3663511343], length 0
20:55:22.007712 IP 10.0.0.1.47902 > 10.0.0.3.5001: Flags [P.], seq 400457:407697, ack 1, win 83, options [nop,nop,TS val 3663511344 ecr 1027248514], length 7240
20:55:22.007831 IP 10.0.0.3.5001 > 10.0.0.1.47902: Flags [.], ack 407697, win 1373, options [nop,nop,TS val 1027249514 ecr 3663511344], length 0
20:55:22.007945 IP 10.0.0.1.47902 > 10.0.0.3.5001: Flags [P.], seq 407697:417833, ack 1, win 83, options [nop,nop,TS val 3663511344 ecr 1027249513], length 10136
20:55:22.008175 IP 10.0.0.3.5001 > 10.0.0.1.47902: Flags [.], ack 417833, win 1413, options [nop,nop,TS val 1027249514 ecr 3663511344], length 0
20:55:22.008216 IP 10.0.0.1.47902 > 10.0.0.3.5001: Flags [P.], seq 417833:422177, ack 1, win 83, options [nop,nop,TS val 3663511344 ecr 1027249513], length 4344
20:55:22.008341 IP 10.0.0.3.5001 > 10.0.0.1.47902: Flags [.], ack 422177, win 1430, options [nop,nop,TS val 1027249514 ecr 3663511344], length 0
20:55:22.008467 IP 10.0.0.1.47902 > 10.0.0.3.5001: Flags [P.], seq 422177:436657, ack 1, win 83, options [nop,nop,TS val 3663511344 ecr 1027249514], length 14480
20:55:22.008716 IP 10.0.0.3.5001 > 10.0.0.1.47902: Flags [.], ack 436657, win 1486, options [nop,nop,TS val 1027249515 ecr 3663511344], length 0
20:55:22.008846 IP 10.0.0.1.47902 > 10.0.0.3.5001: Flags [P.], seq 436657:454033, ack 1, win 83, options [nop,nop,TS val 3663511345 ecr 1027249514], length 17376
20:55:22.008929 IP 10.0.0.3.5001 > 10.0.0.1.47902: Flags [.], ack 454033, win 1554, options [nop,nop,TS val 1027249515 ecr 3663511345], length 0
20:55:22.008961 IP 10.0.0.1.47902 > 10.0.0.3.5001: Flags [P.], seq 454033:458377, ack 1, win 83, options [nop,nop,TS val 3663511345 ecr 1027249514], length 4344
20:55:22.009007 IP 10.0.0.3.5001 > 10.0.0.1.47902: Flags [.], ack 458377, win 1571, options [nop,nop,TS val 1027249515 ecr 3663511345], length 0
20:55:22.009183 IP 10.0.0.1.47902 > 10.0.0.3.5001: Flags [P.], seq 458377:472857, ack 1, win 83, options [nop,nop,TS val 3663511345 ecr 1027249515], length 14480
20:55:22.009284 IP 10.0.0.3.5001 > 10.0.0.1.47902: Flags [.], ack 472857, win 1628, options [nop,nop,TS val 1027249515 ecr 3663511345], length 0
20:55:22.009316 IP 10.0.0.1.47902 > 10.0.0.3.5001: Flags [.], seq 472857:474305, ack 1, win 83, options [nop,nop,TS val 3663511345 ecr 1027249515], length 1448
20:55:22.009360 IP 10.0.0.3.5001 > 10.0.0.1.47902: Flags [.], ack 474305, win 1633, options [nop,nop,TS val 1027249515 ecr 3663511345], length 0
20:55:22.009456 IP 10.0.0.1.47902 > 10.0.0.3.5001: Flags [P.], seq 474305:494577, ack 1, win 83, options [nop,nop,TS val 3663511345 ecr 1027249515], length 20272
20:55:22.009523 IP 10.0.0.3.5001 > 10.0.0.1.47902: Flags [.], ack 494577, win 1712, options [nop,nop,TS val 1027249515 ecr 3663511345], length 0
20:55:22.009574 IP 10.0.0.1.47902 > 10.0.0.3.5001: Flags [P.], seq 494577:514849, ack 1, win 83, options [nop,nop,TS val 3663511345 ecr 1027249515], length 20272
20:55:22.009626 IP 10.0.0.3.5001 > 10.0.0.1.47902: Flags [.], ack 514849, win 1792, options [nop,nop,TS val 1027249516 ecr 3663511345], length 0
20:55:22.009658 IP 10.0.0.1.47902 > 10.0.0.3.5001: Flags [.], seq 514849:516297, ack 1, win 83, options [nop,nop,TS val 3663511345 ecr 1027249515], length 1448
20:55:22.009722 IP 10.0.0.3.5001 > 10.0.0.1.47902: Flags [.], ack 516297, win 1797, options [nop,nop,TS val 1027249516 ecr 3663511345], length 0
20:55:22.009857 IP 10.0.0.1.47902 > 10.0.0.3.5001: Flags [P.], seq 516297:524289, ack 1, win 83, options [nop,nop,TS val 3663511346 ecr 1027249515], length 7992
20:55:22.009919 IP 10.0.0.3.5001 > 10.0.0.1.47902: Flags [.], ack 524289, win 1828, options [nop,nop,TS val 1027249516 ecr 3663511346], length 0
20:55:23.007137 IP 10.0.0.1.47902 > 10.0.0.3.5001: Flags [P.], seq 524289:531529, ack 1, win 83, options [nop,nop,TS val 3663512343 ecr 1027249516], length 7240
20:55:23.007220 IP 10.0.0.3.5001 > 10.0.0.1.47902: Flags [.], ack 531529, win 1857, options [nop,nop,TS val 1027250513 ecr 3663512343], length 0
20:55:23.007454 IP 10.0.0.1.47902 > 10.0.0.3.5001: Flags [P.], seq 531529:538769, ack 1, win 83, options [nop,nop,TS val 3663512343 ecr 1027249516], length 7240
20:55:23.007538 IP 10.0.0.3.5001 > 10.0.0.1.47902: Flags [.], ack 538769, win 1885, options [nop,nop,TS val 1027250513 ecr 3663512343], length 0
20:55:23.007729 IP 10.0.0.1.47902 > 10.0.0.3.5001: Flags [P.], seq 538769:553249, ack 1, win 83, options [nop,nop,TS val 3663512344 ecr 1027250513], length 14480
20:55:23.007791 IP 10.0.0.3.5001 > 10.0.0.1.47902: Flags [.], ack 553249, win 1942, options [nop,nop,TS val 1027250514 ecr 3663512344], length 0
20:55:23.007822 IP 10.0.0.1.47902 > 10.0.0.3.5001: Flags [P.], seq 553249:567729, ack 1, win 83, options [nop,nop,TS val 3663512344 ecr 1027250513], length 14480
20:55:23.007877 IP 10.0.0.3.5001 > 10.0.0.1.47902: Flags [.], ack 567729, win 1998, options [nop,nop,TS val 1027250514 ecr 3663512344], length 0
20:55:23.007976 IP 10.0.0.1.47902 > 10.0.0.3.5001: Flags [P.], seq 567729:586553, ack 1, win 83, options [nop,nop,TS val 3663512344 ecr 1027250514], length 18824
20:55:23.008036 IP 10.0.0.3.5001 > 10.0.0.1.47902: Flags [.], ack 586553, win 2072, options [nop,nop,TS val 1027250514 ecr 3663512344], length 0
20:55:23.008066 IP 10.0.0.1.47902 > 10.0.0.3.5001: Flags [P.], seq 586553:603929, ack 1, win 83, options [nop,nop,TS val 3663512344 ecr 1027250514], length 17376
20:55:23.008111 IP 10.0.0.3.5001 > 10.0.0.1.47902: Flags [.], ack 603929, win 2140, options [nop,nop,TS val 1027250514 ecr 3663512344], length 0
20:55:23.008141 IP 10.0.0.1.47902 > 10.0.0.3.5001: Flags [P.], seq 603929:606825, ack 1, win 83, options [nop,nop,TS val 3663512344 ecr 1027250514], length 2896
20:55:23.008184 IP 10.0.0.3.5001 > 10.0.0.1.47902: Flags [.], ack 606825, win 2151, options [nop,nop,TS val 1027250514 ecr 3663512344], length 0
20:55:23.008284 IP 10.0.0.1.47902 > 10.0.0.3.5001: Flags [P.], seq 606825:629993, ack 1, win 83, options [nop,nop,TS val 3663512344 ecr 1027250514], length 23168
20:55:23.008343 IP 10.0.0.3.5001 > 10.0.0.1.47902: Flags [.], ack 629993, win 2241, options [nop,nop,TS val 1027250514 ecr 3663512344], length 0
20:55:23.008381 IP 10.0.0.1.47902 > 10.0.0.3.5001: Flags [P.], seq 629993:653161, ack 1, win 83, options [nop,nop,TS val 3663512344 ecr 1027250514], length 23168
20:55:23.008428 IP 10.0.0.3.5001 > 10.0.0.1.47902: Flags [.], ack 653161, win 2332, options [nop,nop,TS val 1027250514 ecr 3663512344], length 0
20:55:23.008532 IP 10.0.0.1.47902 > 10.0.0.3.5001: Flags [P.], seq 653161:655361, ack 1, win 83, options [nop,nop,TS val 3663512345 ecr 1027250514], length 2200
20:55:23.008589 IP 10.0.0.3.5001 > 10.0.0.1.47902: Flags [.], ack 655361, win 2340, options [nop,nop,TS val 1027250515 ecr 3663512345], length 0
20:55:24.007074 IP 10.0.0.1.47902 > 10.0.0.3.5001: Flags [P.], seq 655361:662601, ack 1, win 83, options [nop,nop,TS val 3663513343 ecr 1027250515], length 7240
20:55:24.007151 IP 10.0.0.3.5001 > 10.0.0.1.47902: Flags [.], ack 662601, win 2369, options [nop,nop,TS val 1027251513 ecr 3663513343], length 0
20:55:24.007256 IP 10.0.0.1.47902 > 10.0.0.3.5001: Flags [P.], seq 662601:669841, ack 1, win 83, options [nop,nop,TS val 3663513343 ecr 1027250515], length 7240
20:55:24.007380 IP 10.0.0.3.5001 > 10.0.0.1.47902: Flags [.], ack 669841, win 2397, options [nop,nop,TS val 1027251513 ecr 3663513343], length 0
20:55:24.007493 IP 10.0.0.1.47902 > 10.0.0.3.5001: Flags [P.], seq 669841:684321, ack 1, win 83, options [nop,nop,TS val 3663513343 ecr 1027251513], length 14480
20:55:24.007551 IP 10.0.0.3.5001 > 10.0.0.1.47902: Flags [.], ack 684321, win 2454, options [nop,nop,TS val 1027251514 ecr 3663513343], length 0
20:55:24.007581 IP 10.0.0.1.47902 > 10.0.0.3.5001: Flags [P.], seq 684321:698801, ack 1, win 83, options [nop,nop,TS val 3663513343 ecr 1027251513], length 14480
20:55:24.007627 IP 10.0.0.3.5001 > 10.0.0.1.47902: Flags [.], ack 698801, win 2510, options [nop,nop,TS val 1027251514 ecr 3663513343], length 0
20:55:24.007721 IP 10.0.0.1.47902 > 10.0.0.3.5001: Flags [P.], seq 698801:719073, ack 1, win 83, options [nop,nop,TS val 3663513344 ecr 1027251514], length 20272
20:55:24.007780 IP 10.0.0.3.5001 > 10.0.0.1.47902: Flags [.], ack 719073, win 2589, options [nop,nop,TS val 1027251514 ecr 3663513344], length 0
20:55:24.007809 IP 10.0.0.1.47902 > 10.0.0.3.5001: Flags [P.], seq 719073:735001, ack 1, win 83, options [nop,nop,TS val 3663513344 ecr 1027251514], length 15928
20:55:24.007854 IP 10.0.0.3.5001 > 10.0.0.1.47902: Flags [.], ack 735001, win 2652, options [nop,nop,TS val 1027251514 ecr 3663513344], length 0
20:55:24.007884 IP 10.0.0.1.47902 > 10.0.0.3.5001: Flags [P.], seq 735001:739345, ack 1, win 83, options [nop,nop,TS val 3663513344 ecr 1027251514], length 4344
20:55:24.007927 IP 10.0.0.3.5001 > 10.0.0.1.47902: Flags [.], ack 739345, win 2669, options [nop,nop,TS val 1027251514 ecr 3663513344], length 0
20:55:24.008026 IP 10.0.0.1.47902 > 10.0.0.3.5001: Flags [P.], seq 739345:761065, ack 1, win 83, options [nop,nop,TS val 3663513344 ecr 1027251514], length 21720
20:55:24.008085 IP 10.0.0.3.5001 > 10.0.0.1.47902: Flags [.], ack 761065, win 2753, options [nop,nop,TS val 1027251514 ecr 3663513344], length 0
20:55:24.008115 IP 10.0.0.1.47902 > 10.0.0.3.5001: Flags [P.], seq 761065:782785, ack 1, win 83, options [nop,nop,TS val 3663513344 ecr 1027251514], length 21720
20:55:24.008161 IP 10.0.0.3.5001 > 10.0.0.1.47902: Flags [.], ack 782785, win 2838, options [nop,nop,TS val 1027251514 ecr 3663513344], length 0
20:55:24.008191 IP 10.0.0.1.47902 > 10.0.0.3.5001: Flags [.], seq 782785:784233, ack 1, win 83, options [nop,nop,TS val 3663513344 ecr 1027251514], length 1448
20:55:24.008234 IP 10.0.0.3.5001 > 10.0.0.1.47902: Flags [.], ack 784233, win 2844, options [nop,nop,TS val 1027251514 ecr 3663513344], length 0
20:55:24.008331 IP 10.0.0.1.47902 > 10.0.0.3.5001: Flags [P.], seq 784233:786433, ack 1, win 83, options [nop,nop,TS val 3663513344 ecr 1027251514], length 2200
20:55:24.008391 IP 10.0.0.3.5001 > 10.0.0.1.47902: Flags [.], ack 786433, win 2852, options [nop,nop,TS val 1027251514 ecr 3663513344], length 0
20:55:25.007080 IP 10.0.0.1.47902 > 10.0.0.3.5001: Flags [P.], seq 786433:793673, ack 1, win 83, options [nop,nop,TS val 3663514343 ecr 1027251514], length 7240
20:55:25.008244 IP 10.0.0.1.47902 > 10.0.0.3.5001: Flags [P.], seq 793673:800913, ack 1, win 83, options [nop,nop,TS val 3663514343 ecr 1027251514], length 7240
20:55:25.008433 IP 10.0.0.1.47902 > 10.0.0.3.5001: Flags [P.], seq 800913:811049, ack 1, win 83, options [nop,nop,TS val 3663514344 ecr 1027252513], length 10136
20:55:25.008578 IP 10.0.0.1.47902 > 10.0.0.3.5001: Flags [P.], seq 811049:825529, ack 1, win 83, options [nop,nop,TS val 3663514345 ecr 1027252514], length 14480
20:55:25.008668 IP 10.0.0.1.47902 > 10.0.0.3.5001: Flags [P.], seq 825529:829873, ack 1, win 83, options [nop,nop,TS val 3663514345 ecr 1027252514], length 4344
20:55:25.008804 IP 10.0.0.1.47902 > 10.0.0.3.5001: Flags [P.], seq 829873:848697, ack 1, win 83, options [nop,nop,TS val 3663514345 ecr 1027252514], length 18824
20:55:25.008895 IP 10.0.0.1.47902 > 10.0.0.3.5001: Flags [.], seq 848697:850145, ack 1, win 83, options [nop,nop,TS val 3663514345 ecr 1027252514], length 1448
20:55:25.009030 IP 10.0.0.1.47902 > 10.0.0.3.5001: Flags [P.], seq 850145:866073, ack 1, win 83, options [nop,nop,TS val 3663514345 ecr 1027252515], length 15928
20:55:25.009123 IP 10.0.0.1.47902 > 10.0.0.3.5001: Flags [P.], seq 866073:871865, ack 1, win 83, options [nop,nop,TS val 3663514345 ecr 1027252515], length 5792
20:55:25.009402 IP 10.0.0.1.47902 > 10.0.0.3.5001: Flags [P.], seq 871865:896481, ack 1, win 83, options [nop,nop,TS val 3663514345 ecr 1027252515], length 24616
20:55:25.009752 IP 10.0.0.1.47902 > 10.0.0.3.5001: Flags [P.], seq 896481:917505, ack 1, win 83, options [nop,nop,TS val 3663514345 ecr 1027252515], length 21024
20:55:26.007060 IP 10.0.0.1.47902 > 10.0.0.3.5001: Flags [P.], seq 917505:924745, ack 1, win 83, options [nop,nop,TS val 3663515343 ecr 1027252516], length 7240
20:55:26.007139 IP 10.0.0.3.5001 > 10.0.0.1.47902: Flags [.], ack 924745, win 2991, options [nop,nop,TS val 1027253513 ecr 3663515343], length 0
20:55:26.007243 IP 10.0.0.1.47902 > 10.0.0.3.5001: Flags [P.], seq 924745:931985, ack 1, win 83, options [nop,nop,TS val 3663515343 ecr 1027252516], length 7240
20:55:26.007303 IP 10.0.0.3.5001 > 10.0.0.1.47902: Flags [.], ack 931985, win 2991, options [nop,nop,TS val 1027253513 ecr 3663515343], length 0
20:55:26.007511 IP 10.0.0.1.47902 > 10.0.0.3.5001: Flags [P.], seq 931985:946465, ack 1, win 83, options [nop,nop,TS val 3663515343 ecr 1027253513], length 14480
20:55:26.007570 IP 10.0.0.3.5001 > 10.0.0.1.47902: Flags [.], ack 946465, win 2984, options [nop,nop,TS val 1027253514 ecr 3663515343], length 0
20:55:26.007600 IP 10.0.0.1.47902 > 10.0.0.3.5001: Flags [P.], seq 946465:960945, ack 1, win 83, options [nop,nop,TS val 3663515343 ecr 1027253513], length 14480
20:55:26.007645 IP 10.0.0.3.5001 > 10.0.0.1.47902: Flags [.], ack 960945, win 2968, options [nop,nop,TS val 1027253514 ecr 3663515343], length 0
20:55:26.008405 IP 10.0.0.1.47902 > 10.0.0.3.5001: Flags [P.], seq 960945:982665, ack 1, win 83, options [nop,nop,TS val 3663515344 ecr 1027253514], length 21720
20:55:26.008463 IP 10.0.0.3.5001 > 10.0.0.1.47902: Flags [.], ack 982665, win 2977, options [nop,nop,TS val 1027253514 ecr 3663515344], length 0
20:55:26.008493 IP 10.0.0.1.47902 > 10.0.0.3.5001: Flags [P.], seq 982665:997145, ack 1, win 83, options [nop,nop,TS val 3663515344 ecr 1027253514], length 14480
20:55:26.008537 IP 10.0.0.3.5001 > 10.0.0.1.47902: Flags [.], ack 997145, win 2961, options [nop,nop,TS val 1027253515 ecr 3663515344], length 0
20:55:26.008567 IP 10.0.0.1.47902 > 10.0.0.3.5001: Flags [P.], seq 997145:1004385, ack 1, win 83, options [nop,nop,TS val 3663515344 ecr 1027253514], length 7240
20:55:26.008610 IP 10.0.0.3.5001 > 10.0.0.1.47902: Flags [.], ack 1004385, win 2953, options [nop,nop,TS val 1027253515 ecr 3663515344], length 0
20:55:26.008724 IP 10.0.0.1.47902 > 10.0.0.3.5001: Flags [P.], seq 1004385:1027553, ack 1, win 83, options [nop,nop,TS val 3663515345 ecr 1027253514], length 23168
20:55:26.008783 IP 10.0.0.3.5001 > 10.0.0.1.47902: Flags [.], ack 1027553, win 2975, options [nop,nop,TS val 1027253515 ecr 3663515345], length 0
20:55:26.008869 IP 10.0.0.1.47902 > 10.0.0.3.5001: Flags [P.], seq 1027553:1048577, ack 1, win 83, options [nop,nop,TS val 3663515345 ecr 1027253515], length 21024
20:55:26.008955 IP 10.0.0.3.5001 > 10.0.0.1.47902: Flags [.], ack 1048577, win 2977, options [nop,nop,TS val 1027253515 ecr 3663515345], length 0
20:55:27.007069 IP 10.0.0.1.47902 > 10.0.0.3.5001: Flags [P.], seq 1048577:1055817, ack 1, win 83, options [nop,nop,TS val 3663516343 ecr 1027253515], length 7240
20:55:27.007150 IP 10.0.0.3.5001 > 10.0.0.1.47902: Flags [.], ack 1055817, win 2991, options [nop,nop,TS val 1027254513 ecr 3663516343], length 0
20:55:27.007283 IP 10.0.0.1.47902 > 10.0.0.3.5001: Flags [P.], seq 1055817:1063057, ack 1, win 83, options [nop,nop,TS val 3663516343 ecr 1027253515], length 7240
20:55:27.007516 IP 10.0.0.3.5001 > 10.0.0.1.47902: Flags [.], ack 1063057, win 2991, options [nop,nop,TS val 1027254513 ecr 3663516343], length 0
20:55:27.007651 IP 10.0.0.1.47902 > 10.0.0.3.5001: Flags [P.], seq 1063057:1077537, ack 1, win 83, options [nop,nop,TS val 3663516344 ecr 1027254513], length 14480
20:55:27.007712 IP 10.0.0.3.5001 > 10.0.0.1.47902: Flags [.], ack 1077537, win 2984, options [nop,nop,TS val 1027254514 ecr 3663516344], length 0
20:55:27.007743 IP 10.0.0.1.47902 > 10.0.0.3.5001: Flags [P.], seq 1077537:1092017, ack 1, win 83, options [nop,nop,TS val 3663516344 ecr 1027254513], length 14480
20:55:27.007790 IP 10.0.0.3.5001 > 10.0.0.1.47902: Flags [.], ack 1092017, win 2968, options [nop,nop,TS val 1027254514 ecr 3663516344], length 0
20:55:27.007886 IP 10.0.0.1.47902 > 10.0.0.3.5001: Flags [P.], seq 1092017:1113737, ack 1, win 83, options [nop,nop,TS val 3663516344 ecr 1027254514], length 21720
20:55:27.007947 IP 10.0.0.3.5001 > 10.0.0.1.47902: Flags [.], ack 1113737, win 2977, options [nop,nop,TS val 1027254514 ecr 3663516344], length 0
20:55:27.007977 IP 10.0.0.1.47902 > 10.0.0.3.5001: Flags [P.], seq 1113737:1128217, ack 1, win 83, options [nop,nop,TS val 3663516344 ecr 1027254514], length 14480
20:55:27.008022 IP 10.0.0.3.5001 > 10.0.0.1.47902: Flags [.], ack 1128217, win 2961, options [nop,nop,TS val 1027254514 ecr 3663516344], length 0
20:55:27.008052 IP 10.0.0.1.47902 > 10.0.0.3.5001: Flags [P.], seq 1128217:1136905, ack 1, win 83, options [nop,nop,TS val 3663516344 ecr 1027254514], length 8688
20:55:27.008096 IP 10.0.0.3.5001 > 10.0.0.1.47902: Flags [.], ack 1136905, win 2951, options [nop,nop,TS val 1027254514 ecr 3663516344], length 0
20:55:27.008196 IP 10.0.0.1.47902 > 10.0.0.3.5001: Flags [P.], seq 1136905:1160073, ack 1, win 83, options [nop,nop,TS val 3663516344 ecr 1027254514], length 23168
20:55:27.008256 IP 10.0.0.3.5001 > 10.0.0.1.47902: Flags [.], ack 1160073, win 2975, options [nop,nop,TS val 1027254514 ecr 3663516344], length 0
20:55:27.008286 IP 10.0.0.1.47902 > 10.0.0.3.5001: Flags [P.], seq 1160073:1179649, ack 1, win 83, options [nop,nop,TS val 3663516344 ecr 1027254514], length 19576
20:55:27.008332 IP 10.0.0.3.5001 > 10.0.0.1.47902: Flags [.], ack 1179649, win 2955, options [nop,nop,TS val 1027254514 ecr 3663516344], length 0
20:55:28.007082 IP 10.0.0.1.47902 > 10.0.0.3.5001: Flags [P.], seq 1179649:1186889, ack 1, win 83, options [nop,nop,TS val 3663517343 ecr 1027254514], length 7240
20:55:28.007166 IP 10.0.0.3.5001 > 10.0.0.1.47902: Flags [.], ack 1186889, win 2991, options [nop,nop,TS val 1027255513 ecr 3663517343], length 0
20:55:28.007275 IP 10.0.0.1.47902 > 10.0.0.3.5001: Flags [P.], seq 1186889:1194129, ack 1, win 83, options [nop,nop,TS val 3663517343 ecr 1027254514], length 7240
20:55:28.007342 IP 10.0.0.3.5001 > 10.0.0.1.47902: Flags [.], ack 1194129, win 2991, options [nop,nop,TS val 1027255513 ecr 3663517343], length 0
20:55:28.007458 IP 10.0.0.1.47902 > 10.0.0.3.5001: Flags [P.], seq 1194129:1208609, ack 1, win 83, options [nop,nop,TS val 3663517343 ecr 1027255513], length 14480
20:55:28.007644 IP 10.0.0.3.5001 > 10.0.0.1.47902: Flags [.], ack 1208609, win 2984, options [nop,nop,TS val 1027255514 ecr 3663517343], length 0
20:55:28.007698 IP 10.0.0.1.47902 > 10.0.0.3.5001: Flags [P.], seq 1208609:1223089, ack 1, win 83, options [nop,nop,TS val 3663517343 ecr 1027255513], length 14480
20:55:28.007775 IP 10.0.0.3.5001 > 10.0.0.1.47902: Flags [.], ack 1223089, win 2968, options [nop,nop,TS val 1027255514 ecr 3663517343], length 0
20:55:28.007899 IP 10.0.0.1.47902 > 10.0.0.3.5001: Flags [P.], seq 1223089:1246257, ack 1, win 83, options [nop,nop,TS val 3663517344 ecr 1027255514], length 23168
20:55:28.008081 IP 10.0.0.3.5001 > 10.0.0.1.47902: Flags [.], ack 1246257, win 2975, options [nop,nop,TS val 1027255514 ecr 3663517344], length 0
20:55:28.008157 IP 10.0.0.1.47902 > 10.0.0.3.5001: Flags [P.], seq 1246257:1259289, ack 1, win 83, options [nop,nop,TS val 3663517344 ecr 1027255514], length 13032
20:55:28.008204 IP 10.0.0.3.5001 > 10.0.0.1.47902: Flags [.], ack 1259289, win 2961, options [nop,nop,TS val 1027255514 ecr 3663517344], length 0
20:55:28.008234 IP 10.0.0.1.47902 > 10.0.0.3.5001: Flags [P.], seq 1259289:1269425, ack 1, win 83, options [nop,nop,TS val 3663517344 ecr 1027255514], length 10136
