21:09:26.265950 IP 10.0.0.1.41644 > 10.0.0.3.5001: Flags [P.], seq 2414913255:2414920495, ack 3770252268, win 83, options [nop,nop,TS val 4187298532 ecr 273779432], length 7240
21:09:26.266036 IP 10.0.0.1.41644 > 10.0.0.3.5001: Flags [P.], seq 7240:14480, ack 1, win 83, options [nop,nop,TS val 4187298532 ecr 273779432], length 7240
21:09:26.267439 IP 10.0.0.1.41644 > 10.0.0.3.5001: Flags [P.], seq 14480:17376, ack 1, win 83, options [nop,nop,TS val 4187298534 ecr 273780433], length 2896
21:09:26.267528 IP 10.0.0.1.41644 > 10.0.0.3.5001: Flags [P.], seq 1448:4344, ack 1, win 83, options [nop,nop,TS val 4187298534 ecr 273780433], length 2896
21:09:26.267634 IP 10.0.0.1.41644 > 10.0.0.3.5001: Flags [P.], seq 4344:7240, ack 1, win 83, options [nop,nop,TS val 4187298534 ecr 273780433], length 2896
21:09:26.267640 IP 10.0.0.1.41644 > 10.0.0.3.5001: Flags [.], seq 7240:8688, ack 1, win 83, options [nop,nop,TS val 4187298534 ecr 273780433], length 1448
21:09:26.267821 IP 10.0.0.1.41644 > 10.0.0.3.5001: Flags [P.], seq 8688:13032, ack 1, win 83, options [nop,nop,TS val 4187298534 ecr 273780433], length 4344
21:09:26.267828 IP 10.0.0.1.41644 > 10.0.0.3.5001: Flags [.], seq 13032:14480, ack 1, win 83, options [nop,nop,TS val 4187298534 ecr 273780433], length 1448
21:09:26.267834 IP 10.0.0.1.41644 > 10.0.0.3.5001: Flags [.], seq 17376:18824, ack 1, win 83, options [nop,nop,TS val 4187298534 ecr 273780433], length 1448
21:09:26.268089 IP 10.0.0.1.41644 > 10.0.0.3.5001: Flags [P.], seq 18824:23168, ack 1, win 83, options [nop,nop,TS val 4187298534 ecr 273780433], length 4344
21:09:26.268095 IP 10.0.0.1.41644 > 10.0.0.3.5001: Flags [.], seq 23168:24616, ack 1, win 83, options [nop,nop,TS val 4187298534 ecr 273780433], length 1448
21:09:26.268101 IP 10.0.0.1.41644 > 10.0.0.3.5001: Flags [P.], seq 24616:27512, ack 1, win 83, options [nop,nop,TS val 4187298535 ecr 273780433], length 2896
21:09:26.268108 IP 10.0.0.1.41644 > 10.0.0.3.5001: Flags [.], seq 27512:28960, ack 1, win 83, options [nop,nop,TS val 4187298535 ecr 273780433], length 1448
21:09:26.268323 IP 10.0.0.1.41644 > 10.0.0.3.5001: Flags [P.], seq 28960:34752, ack 1, win 83, options [nop,nop,TS val 4187298535 ecr 273780434], length 5792
21:09:26.268329 IP 10.0.0.1.41644 > 10.0.0.3.5001: Flags [P.], seq 34752:40544, ack 1, win 83, options [nop,nop,TS val 4187298535 ecr 273780434], length 5792
21:09:26.268430 IP 10.0.0.1.41644 > 10.0.0.3.5001: Flags [P.], seq 40544:46336, ack 1, win 83, options [nop,nop,TS val 4187298535 ecr 273780434], length 5792
21:09:26.268522 IP 10.0.0.1.41644 > 10.0.0.3.5001: Flags [P.], seq 46336:52128, ack 1, win 83, options [nop,nop,TS val 4187298535 ecr 273780434], length 5792
21:09:26.268529 IP 10.0.0.1.41644 > 10.0.0.3.5001: Flags [.], seq 52128:53576, ack 1, win 83, options [nop,nop,TS val 4187298535 ecr 273780434], length 1448
21:09:26.268903 IP 10.0.0.1.41644 > 10.0.0.3.5001: Flags [P.], seq 53576:60816, ack 1, win 83, options [nop,nop,TS val 4187298535 ecr 273780434], length 7240
21:09:26.269467 IP 10.0.0.1.41644 > 10.0.0.3.5001: Flags [P.], seq 60816:70952, ack 1, win 83, options [nop,nop,TS val 4187298536 ecr 273780435], length 10136
21:09:26.269473 IP 10.0.0.1.41644 > 10.0.0.3.5001: Flags [P.], seq 70952:79640, ack 1, win 83, options [nop,nop,TS val 4187298536 ecr 273780435], length 8688
21:09:26.269479 IP 10.0.0.1.41644 > 10.0.0.3.5001: Flags [P.], seq 79640:91224, ack 1, win 83, options [nop,nop,TS val 4187298536 ecr 273780435], length 11584
21:09:26.269719 IP 10.0.0.1.41644 > 10.0.0.3.5001: Flags [P.], seq 91224:111496, ack 1, win 83, options [nop,nop,TS val 4187298536 ecr 273780435], length 20272
21:09:26.269725 IP 10.0.0.1.41644 > 10.0.0.3.5001: Flags [P.], seq 111496:128872, ack 1, win 83, options [nop,nop,TS val 4187298536 ecr 273780435], length 17376
21:09:26.269731 IP 10.0.0.1.41644 > 10.0.0.3.5001: Flags [P.], seq 128872:131072, ack 1, win 83, options [nop,nop,TS val 4187298536 ecr 273780435], length 2200
21:09:27.265965 IP 10.0.0.1.41644 > 10.0.0.3.5001: Flags [P.], seq 131072:138312, ack 1, win 83, options [nop,nop,TS val 4187299532 ecr 273780435], length 7240
21:09:27.266156 IP 10.0.0.1.41644 > 10.0.0.3.5001: Flags [P.], seq 138312:145552, ack 1, win 83, options [nop,nop,TS val 4187299533 ecr 273780435], length 7240
21:09:27.266407 IP 10.0.0.3.5001 > 10.0.0.1.41644: Flags [.], ack 138312, win 3326, options [nop,nop,TS val 273781431 ecr 4187299532], length 0
21:09:27.266429 IP 10.0.0.3.5001 > 10.0.0.1.41644: Flags [.], ack 145552, win 3326, options [nop,nop,TS val 273781432 ecr 4187299533], length 0
21:09:27.266680 IP 10.0.0.1.41644 > 10.0.0.3.5001: Flags [P.], seq 145552:155688, ack 1, win 83, options [nop,nop,TS val 4187299533 ecr 273781431], length 10136
21:09:27.266744 IP 10.0.0.3.5001 > 10.0.0.1.41644: Flags [.], ack 155688, win 3323, options [nop,nop,TS val 273781432 ecr 4187299533], length 0
21:09:27.266802 IP 10.0.0.1.41644 > 10.0.0.3.5001: Flags [P.], seq 155688:174512, ack 1, win 83, options [nop,nop,TS val 4187299533 ecr 273781432], length 18824
21:09:27.266809 IP 10.0.0.1.41644 > 10.0.0.3.5001: Flags [P.], seq 174512:193336, ack 1, win 83, options [nop,nop,TS val 4187299533 ecr 273781432], length 18824
21:09:27.266815 IP 10.0.0.1.41644 > 10.0.0.3.5001: Flags [.], seq 193336:194784, ack 1, win 83, options [nop,nop,TS val 4187299533 ecr 273781432], length 1448
21:09:27.266952 IP 10.0.0.3.5001 > 10.0.0.1.41644: Flags [.], ack 174512, win 3315, options [nop,nop,TS val 273781432 ecr 4187299533], length 0
21:09:27.266964 IP 10.0.0.3.5001 > 10.0.0.1.41644: Flags [.], ack 193336, win 3295, options [nop,nop,TS val 273781432 ecr 4187299533], length 0
21:09:27.266977 IP 10.0.0.3.5001 > 10.0.0.1.41644: Flags [.], ack 194784, win 3293, options [nop,nop,TS val 273781432 ecr 4187299533], length 0
21:09:27.267083 IP 10.0.0.1.41644 > 10.0.0.3.5001: Flags [P.], seq 194784:210712, ack 1, win 83, options [nop,nop,TS val 4187299533 ecr 273781432], length 15928
21:09:27.267089 IP 10.0.0.1.41644 > 10.0.0.3.5001: Flags [P.], seq 210712:229536, ack 1, win 83, options [nop,nop,TS val 4187299533 ecr 273781432], length 18824
21:09:27.267096 IP 10.0.0.1.41644 > 10.0.0.3.5001: Flags [P.], seq 229536:248360, ack 1, win 83, options [nop,nop,TS val 4187299534 ecr 273781432], length 18824
21:09:27.267102 IP 10.0.0.1.41644 > 10.0.0.3.5001: Flags [.], seq 248360:249808, ack 1, win 83, options [nop,nop,TS val 4187299534 ecr 273781432], length 1448
21:09:27.267258 IP 10.0.0.3.5001 > 10.0.0.1.41644: Flags [.], ack 210712, win 3317, options [nop,nop,TS val 273781433 ecr 4187299533], length 0
21:09:27.267271 IP 10.0.0.3.5001 > 10.0.0.1.41644: Flags [.], ack 229536, win 3298, options [nop,nop,TS val 273781433 ecr 4187299533], length 0
21:09:27.267281 IP 10.0.0.3.5001 > 10.0.0.1.41644: Flags [.], ack 249808, win 3329, options [nop,nop,TS val 273781433 ecr 4187299534], length 0
21:09:27.267283 IP 10.0.0.3.5001 > 10.0.0.1.41644: Flags [.], ack 248360, win 3278, options [nop,nop,TS val 273781433 ecr 4187299534], length 0
21:09:27.267325 IP 10.0.0.1.41644 > 10.0.0.3.5001: Flags [P.], seq 249808:262144, ack 1, win 83, options [nop,nop,TS val 4187299534 ecr 273781433], length 12336
21:09:27.267371 IP 10.0.0.3.5001 > 10.0.0.1.41644: Flags [.], ack 262144, win 3305, options [nop,nop,TS val 273781433 ecr 4187299534], length 0
21:09:28.265967 IP 10.0.0.1.41644 > 10.0.0.3.5001: Flags [P.], seq 262144:269384, ack 1, win 83, options [nop,nop,TS val 4187300532 ecr 273781433], length 7240
21:09:28.266043 IP 10.0.0.3.5001 > 10.0.0.1.41644: Flags [.], ack 269384, win 3326, options [nop,nop,TS val 273782431 ecr 4187300532], length 0
21:09:28.266140 IP 10.0.0.1.41644 > 10.0.0.3.5001: Flags [P.], seq 269384:276624, ack 1, win 83, options [nop,nop,TS val 4187300533 ecr 273781433], length 7240
21:09:28.266198 IP 10.0.0.3.5001 > 10.0.0.1.41644: Flags [.], ack 276624, win 3326, options [nop,nop,TS val 273782432 ecr 4187300533], length 0
21:09:28.266306 IP 10.0.0.1.41644 > 10.0.0.3.5001: Flags [P.], seq 276624:286760, ack 1, win 83, options [nop,nop,TS val 4187300533 ecr 273782431], length 10136
21:09:28.266364 IP 10.0.0.3.5001 > 10.0.0.1.41644: Flags [.], ack 286760, win 3323, options [nop,nop,TS val 273782432 ecr 4187300533], length 0
21:09:28.266446 IP 10.0.0.1.41644 > 10.0.0.3.5001: Flags [P.], seq 286760:301240, ack 1, win 83, options [nop,nop,TS val 4187300533 ecr 273782432], length 14480
21:09:28.266505 IP 10.0.0.3.5001 > 10.0.0.1.41644: Flags [.], ack 301240, win 3319, options [nop,nop,TS val 273782432 ecr 4187300533], length 0
21:09:28.266534 IP 10.0.0.1.41644 > 10.0.0.3.5001: Flags [P.], seq 301240:305584, ack 1, win 83, options [nop,nop,TS val 4187300533 ecr 273782432], length 4344
21:09:28.266577 IP 10.0.0.3.5001 > 10.0.0.1.41644: Flags [.], ack 305584, win 3313, options [nop,nop,TS val 273782432 ecr 4187300533], length 0
21:09:28.266668 IP 10.0.0.1.41644 > 10.0.0.3.5001: Flags [P.], seq 305584:333096, ack 1, win 83, options [nop,nop,TS val 4187300533 ecr 273782432], length 27512
21:09:28.266730 IP 10.0.0.3.5001 > 10.0.0.1.41644: Flags [.], ack 333096, win 3306, options [nop,nop,TS val 273782432 ecr 4187300533], length 0
21:09:28.266758 IP 10.0.0.1.41644 > 10.0.0.3.5001: Flags [P.], seq 333096:341784, ack 1, win 83, options [nop,nop,TS val 4187300533 ecr 273782432], length 8688
21:09:28.266802 IP 10.0.0.3.5001 > 10.0.0.1.41644: Flags [.], ack 341784, win 3296, options [nop,nop,TS val 273782432 ecr 4187300533], length 0
21:09:28.266830 IP 10.0.0.1.41644 > 10.0.0.3.5001: Flags [P.], seq 341784:360608, ack 1, win 83, options [nop,nop,TS val 4187300533 ecr 273782432], length 18824
21:09:28.266875 IP 10.0.0.3.5001 > 10.0.0.1.41644: Flags [.], ack 360608, win 3277, options [nop,nop,TS val 273782432 ecr 4187300533], length 0
21:09:28.266974 IP 10.0.0.1.41644 > 10.0.0.3.5001: Flags [P.], seq 360608:388120, ack 1, win 83, options [nop,nop,TS val 4187300533 ecr 273782432], length 27512
21:09:28.267035 IP 10.0.0.3.5001 > 10.0.0.1.41644: Flags [.], ack 388120, win 3306, options [nop,nop,TS val 273782432 ecr 4187300533], length 0
21:09:28.267063 IP 10.0.0.1.41644 > 10.0.0.3.5001: Flags [P.], seq 388120:393216, ack 1, win 83, options [nop,nop,TS val 4187300533 ecr 273782432], length 5096
21:09:28.267106 IP 10.0.0.3.5001 > 10.0.0.1.41644: Flags [.], ack 393216, win 3300, options [nop,nop,TS val 273782433 ecr 4187300533], length 0
21:09:29.266024 IP 10.0.0.1.41644 > 10.0.0.3.5001: Flags [P.], seq 393216:400456, ack 1, win 83, options [nop,nop,TS val 4187301532 ecr 273782433], length 7240
21:09:29.266151 IP 10.0.0.3.5001 > 10.0.0.1.41644: Flags [.], ack 400456, win 3326, options [nop,nop,TS val 273783432 ecr 4187301532], length 0
21:09:29.266248 IP 10.0.0.1.41644 > 10.0.0.3.5001: Flags [P.], seq 400456:407696, ack 1, win 83, options [nop,nop,TS val 4187301533 ecr 273782433], length 7240
21:09:29.266304 IP 10.0.0.3.5001 > 10.0.0.1.41644: Flags [.], ack 407696, win 3326, options [nop,nop,TS val 273783432 ecr 4187301533], length 0
21:09:29.266410 IP 10.0.0.1.41644 > 10.0.0.3.5001: Flags [P.], seq 407696:417832, ack 1, win 83, options [nop,nop,TS val 4187301533 ecr 273783432], length 10136
21:09:29.266467 IP 10.0.0.3.5001 > 10.0.0.1.41644: Flags [.], ack 417832, win 3323, options [nop,nop,TS val 273783432 ecr 4187301533], length 0
21:09:29.266547 IP 10.0.0.1.41644 > 10.0.0.3.5001: Flags [P.], seq 417832:432312, ack 1, win 83, options [nop,nop,TS val 4187301533 ecr 273783432], length 14480
21:09:29.266605 IP 10.0.0.3.5001 > 10.0.0.1.41644: Flags [.], ack 432312, win 3319, options [nop,nop,TS val 273783432 ecr 4187301533], length 0
21:09:29.266634 IP 10.0.0.1.41644 > 10.0.0.3.5001: Flags [P.], seq 432312:436656, ack 1, win 83, options [nop,nop,TS val 4187301533 ecr 273783432], length 4344
21:09:29.266675 IP 10.0.0.3.5001 > 10.0.0.1.41644: Flags [.], ack 436656, win 3313, options [nop,nop,TS val 273783432 ecr 4187301533], length 0
21:09:29.266764 IP 10.0.0.1.41644 > 10.0.0.3.5001: Flags [P.], seq 436656:464168, ack 1, win 83, options [nop,nop,TS val 4187301533 ecr 273783432], length 27512
21:09:29.266825 IP 10.0.0.3.5001 > 10.0.0.1.41644: Flags [.], ack 464168, win 3306, options [nop,nop,TS val 273783432 ecr 4187301533], length 0
21:09:29.266853 IP 10.0.0.1.41644 > 10.0.0.3.5001: Flags [P.], seq 464168:472856, ack 1, win 83, options [nop,nop,TS val 4187301533 ecr 273783432], length 8688
21:09:29.266895 IP 10.0.0.3.5001 > 10.0.0.1.41644: Flags [.], ack 472856, win 3296, options [nop,nop,TS val 273783432 ecr 4187301533], length 0
21:09:29.266923 IP 10.0.0.1.41644 > 10.0.0.3.5001: Flags [P.], seq 472856:491680, ack 1, win 83, options [nop,nop,TS val 4187301533 ecr 273783432], length 18824
21:09:29.266967 IP 10.0.0.3.5001 > 10.0.0.1.41644: Flags [.], ack 491680, win 3277, options [nop,nop,TS val 273783432 ecr 4187301533], length 0
21:09:29.267063 IP 10.0.0.1.41644 > 10.0.0.3.5001: Flags [P.], seq 491680:519192, ack 1, win 83, options [nop,nop,TS val 4187301534 ecr 273783432], length 27512
21:09:29.267123 IP 10.0.0.3.5001 > 10.0.0.1.41644: Flags [.], ack 519192, win 3306, options [nop,nop,TS val 273783433 ecr 4187301534], length 0
21:09:29.267150 IP 10.0.0.1.41644 > 10.0.0.3.5001: Flags [P.], seq 519192:524288, ack 1, win 83, options [nop,nop,TS val 4187301534 ecr 273783432], length 5096
21:09:29.267192 IP 10.0.0.3.5001 > 10.0.0.1.41644: Flags [.], ack 524288, win 3300, options [nop,nop,TS val 273783433 ecr 4187301534], length 0
21:09:30.265964 IP 10.0.0.1.41644 > 10.0.0.3.5001: Flags [P.], seq 524288:531528, ack 1, win 83, options [nop,nop,TS val 4187302532 ecr 273783433], length 7240
21:09:30.266041 IP 10.0.0.3.5001 > 10.0.0.1.41644: Flags [.], ack 531528, win 3326, options [nop,nop,TS val 273784431 ecr 4187302532], length 0
21:09:30.266138 IP 10.0.0.1.41644 > 10.0.0.3.5001: Flags [P.], seq 531528:538768, ack 1, win 83, options [nop,nop,TS val 4187302533 ecr 273783433], length 7240
21:09:30.266196 IP 10.0.0.3.5001 > 10.0.0.1.41644: Flags [.], ack 538768, win 3326, options [nop,nop,TS val 273784432 ecr 4187302533], length 0
21:09:30.266320 IP 10.0.0.1.41644 > 10.0.0.3.5001: Flags [P.], seq 538768:548904, ack 1, win 83, options [nop,nop,TS val 4187302533 ecr 273784431], length 10136
21:09:30.266377 IP 10.0.0.3.5001 > 10.0.0.1.41644: Flags [.], ack 548904, win 3323, options [nop,nop,TS val 273784432 ecr 4187302533], length 0
21:09:30.266460 IP 10.0.0.1.41644 > 10.0.0.3.5001: Flags [P.], seq 548904:563384, ack 1, win 83, options [nop,nop,TS val 4187302533 ecr 273784432], length 14480
21:09:30.266519 IP 10.0.0.3.5001 > 10.0.0.1.41644: Flags [.], ack 563384, win 3319, options [nop,nop,TS val 273784432 ecr 4187302533], length 0
21:09:30.266548 IP 10.0.0.1.41644 > 10.0.0.3.5001: Flags [P.], seq 563384:567728, ack 1, win 83, options [nop,nop,TS val 4187302533 ecr 273784432], length 4344
21:09:30.266591 IP 10.0.0.3.5001 > 10.0.0.1.41644: Flags [.], ack 567728, win 3313, options [nop,nop,TS val 273784432 ecr 4187302533], length 0
21:09:30.266682 IP 10.0.0.1.41644 > 10.0.0.3.5001: Flags [P.], seq 567728:595240, ack 1, win 83, options [nop,nop,TS val 4187302533 ecr 273784432], length 27512
21:09:30.266745 IP 10.0.0.3.5001 > 10.0.0.1.41644: Flags [.], ack 595240, win 3306, options [nop,nop,TS val 273784432 ecr 4187302533], length 0
21:09:30.266773 IP 10.0.0.1.41644 > 10.0.0.3.5001: Flags [P.], seq 595240:603928, ack 1, win 83, options [nop,nop,TS val 4187302533 ecr 273784432], length 8688
21:09:30.266816 IP 10.0.0.3.5001 > 10.0.0.1.41644: Flags [.], ack 603928, win 3296, options [nop,nop,TS val 273784432 ecr 4187302533], length 0
21:09:30.266845 IP 10.0.0.1.41644 > 10.0.0.3.5001: Flags [P.], seq 603928:622752, ack 1, win 83, options [nop,nop,TS val 4187302533 ecr 273784432], length 18824
21:09:30.266890 IP 10.0.0.3.5001 > 10.0.0.1.41644: Flags [.], ack 622752, win 3277, options [nop,nop,TS val 273784432 ecr 4187302533], length 0
21:09:30.266990 IP 10.0.0.1.41644 > 10.0.0.3.5001: Flags [P.], seq 622752:650264, ack 1, win 83, options [nop,nop,TS val 4187302533 ecr 273784432], length 27512
21:09:30.267051 IP 10.0.0.3.5001 > 10.0.0.1.41644: Flags [.], ack 650264, win 3306, options [nop,nop,TS val 273784432 ecr 4187302533], length 0
21:09:30.267080 IP 10.0.0.1.41644 > 10.0.0.3.5001: Flags [P.], seq 650264:655360, ack 1, win 83, options [nop,nop,TS val 4187302533 ecr 273784432], length 5096
21:09:30.267123 IP 10.0.0.3.5001 > 10.0.0.1.41644: Flags [.], ack 655360, win 3300, options [nop,nop,TS val 273784433 ecr 4187302533], length 0
21:09:31.266008 IP 10.0.0.1.41644 > 10.0.0.3.5001: Flags [P.], seq 655360:662600, ack 1, win 83, options [nop,nop,TS val 4187303532 ecr 273784433], length 7240
21:09:31.266120 IP 10.0.0.3.5001 > 10.0.0.1.41644: Flags [.], ack 662600, win 3326, options [nop,nop,TS val 273785432 ecr 4187303532], length 0
21:09:31.266234 IP 10.0.0.1.41644 > 10.0.0.3.5001: Flags [P.], seq 662600:669840, ack 1, win 83, options [nop,nop,TS val 4187303533 ecr 273784433], length 7240
21:09:31.266308 IP 10.0.0.3.5001 > 10.0.0.1.41644: Flags [.], ack 669840, win 3326, options [nop,nop,TS val 273785432 ecr 4187303533], length 0
21:09:31.266415 IP 10.0.0.1.41644 > 10.0.0.3.5001: Flags [P.], seq 669840:679976, ack 1, win 83, options [nop,nop,TS val 4187303533 ecr 273785432], length 10136
21:09:31.266471 IP 10.0.0.3.5001 > 10.0.0.1.41644: Flags [.], ack 679976, win 3323, options [nop,nop,TS val 273785432 ecr 4187303533], length 0
21:09:31.266551 IP 10.0.0.1.41644 > 10.0.0.3.5001: Flags [P.], seq 679976:694456, ack 1, win 83, options [nop,nop,TS val 4187303533 ecr 273785432], length 14480
21:09:31.266609 IP 10.0.0.3.5001 > 10.0.0.1.41644: Flags [.], ack 694456, win 3319, options [nop,nop,TS val 273785432 ecr 4187303533], length 0
21:09:31.266637 IP 10.0.0.1.41644 > 10.0.0.3.5001: Flags [P.], seq 694456:698800, ack 1, win 83, options [nop,nop,TS val 4187303533 ecr 273785432], length 4344
21:09:31.266679 IP 10.0.0.3.5001 > 10.0.0.1.41644: Flags [.], ack 698800, win 3313, options [nop,nop,TS val 273785432 ecr 4187303533], length 0
21:09:31.266768 IP 10.0.0.1.41644 > 10.0.0.3.5001: Flags [P.], seq 698800:726312, ack 1, win 83, options [nop,nop,TS val 4187303533 ecr 273785432], length 27512
21:09:31.266829 IP 10.0.0.3.5001 > 10.0.0.1.41644: Flags [.], ack 726312, win 3306, options [nop,nop,TS val 273785432 ecr 4187303533], length 0
21:09:31.266857 IP 10.0.0.1.41644 > 10.0.0.3.5001: Flags [P.], seq 726312:735000, ack 1, win 83, options [nop,nop,TS val 4187303533 ecr 273785432], length 8688
21:09:31.266899 IP 10.0.0.3.5001 > 10.0.0.1.41644: Flags [.], ack 735000, win 3296, options [nop,nop,TS val 273785432 ecr 4187303533], length 0
21:09:31.266927 IP 10.0.0.1.41644 > 10.0.0.3.5001: Flags [P.], seq 735000:753824, ack 1, win 83, options [nop,nop,TS val 4187303533 ecr 273785432], length 18824
21:09:31.266971 IP 10.0.0.3.5001 > 10.0.0.1.41644: Flags [.], ack 753824, win 3277, options [nop,nop,TS val 273785432 ecr 4187303533], length 0
21:09:31.267068 IP 10.0.0.1.41644 > 10.0.0.3.5001: Flags [P.], seq 753824:781336, ack 1, win 83, options [nop,nop,TS val 4187303534 ecr 273785432], length 27512
21:09:31.267185 IP 10.0.0.3.5001 > 10.0.0.1.41644: Flags [.], ack 781336, win 3306, options [nop,nop,TS val 273785433 ecr 4187303534], length 0
21:09:31.267213 IP 10.0.0.1.41644 > 10.0.0.3.5001: Flags [P.], seq 781336:786432, ack 1, win 83, options [nop,nop,TS val 4187303534 ecr 273785432], length 5096
21:09:31.267256 IP 10.0.0.3.5001 > 10.0.0.1.41644: Flags [.], ack 786432, win 3300, options [nop,nop,TS val 273785433 ecr 4187303534], length 0
21:09:31.279363 IP 10.0.0.1.41644 > 10.0.0.3.5001: Flags [F.], seq 786432, ack 1, win 83, options [nop,nop,TS val 4187303546 ecr 273785433], length 0
21:09:31.299081 IP 10.0.0.3.5001 > 10.0.0.1.41644: Flags [F.], seq 1, ack 786433, win 3334, options [nop,nop,TS val 273785464 ecr 4187303546], length 0
21:09:31.299141 IP 10.0.0.1.41644 > 10.0.0.3.5001: Flags [.], ack 2, win 83, options [nop,nop,TS val 4187303566 ecr 273785464], length 0
