21:09:56.339533 IP 10.0.0.1.41646 > 10.0.0.3.5001: Flags [P.], seq 2621441:2628681, ack 1, win 83, options [nop,nop,TS val 4187328606 ecr 273809506], length 7240
21:09:56.340901 IP 10.0.0.1.41646 > 10.0.0.3.5001: Flags [P.], seq 2628681:2635921, ack 1, win 83, options [nop,nop,TS val 4187328606 ecr 273809506], length 7240
21:09:56.341069 IP 10.0.0.1.41646 > 10.0.0.3.5001: Flags [P.], seq 2635921:2650401, ack 1, win 83, options [nop,nop,TS val 4187328608 ecr 273810506], length 14480
21:09:56.341159 IP 10.0.0.1.41646 > 10.0.0.3.5001: Flags [P.], seq 2650401:2664881, ack 1, win 83, options [nop,nop,TS val 4187328608 ecr 273810506], length 14480
21:09:56.341403 IP 10.0.0.1.41646 > 10.0.0.3.5001: Flags [P.], seq 2664881:2693841, ack 1, win 83, options [nop,nop,TS val 4187328608 ecr 273810507], length 28960
21:09:56.341494 IP 10.0.0.1.41646 > 10.0.0.3.5001: Flags [P.], seq 2693841:2701081, ack 1, win 83, options [nop,nop,TS val 4187328608 ecr 273810507], length 7240
21:09:56.341566 IP 10.0.0.1.41646 > 10.0.0.3.5001: Flags [P.], seq 2701081:2722801, ack 1, win 83, options [nop,nop,TS val 4187328608 ecr 273810507], length 21720
21:09:56.341712 IP 10.0.0.1.41646 > 10.0.0.3.5001: Flags [P.], seq 2722801:2752513, ack 1, win 83, options [nop,nop,TS val 4187328608 ecr 273810507], length 29712
21:09:57.339534 IP 10.0.0.1.41646 > 10.0.0.3.5001: Flags [P.], seq 2752513:2759753, ack 1, win 83, options [nop,nop,TS val 4187329606 ecr 273810507], length 7240
21:09:57.339889 IP 10.0.0.3.5001 > 10.0.0.1.41646: Flags [.], ack 2759753, win 4882, options [nop,nop,TS val 273811505 ecr 4187329606], length 0
21:09:57.340306 IP 10.0.0.1.41646 > 10.0.0.3.5001: Flags [P.], seq 2759753:2766993, ack 1, win 83, options [nop,nop,TS val 4187329606 ecr 273810507], length 7240
21:09:57.340364 IP 10.0.0.3.5001 > 10.0.0.1.41646: Flags [.], ack 2766993, win 4882, options [nop,nop,TS val 273811506 ecr 4187329606], length 0
21:09:57.340473 IP 10.0.0.1.41646 > 10.0.0.3.5001: Flags [P.], seq 2766993:2777129, ack 1, win 83, options [nop,nop,TS val 4187329607 ecr 273811505], length 10136
21:09:57.340530 IP 10.0.0.3.5001 > 10.0.0.1.41646: Flags [.], ack 2777129, win 4879, options [nop,nop,TS val 273811506 ecr 4187329607], length 0
21:09:57.340611 IP 10.0.0.1.41646 > 10.0.0.3.5001: Flags [P.], seq 2777129:2791609, ack 1, win 83, options [nop,nop,TS val 4187329607 ecr 273811506], length 14480
21:09:57.340668 IP 10.0.0.3.5001 > 10.0.0.1.41646: Flags [.], ack 2791609, win 4875, options [nop,nop,TS val 273811506 ecr 4187329607], length 0
21:09:57.340697 IP 10.0.0.1.41646 > 10.0.0.3.5001: Flags [P.], seq 2791609:2795953, ack 1, win 83, options [nop,nop,TS val 4187329607 ecr 273811506], length 4344
21:09:57.340778 IP 10.0.0.3.5001 > 10.0.0.1.41646: Flags [.], ack 2795953, win 4869, options [nop,nop,TS val 273811506 ecr 4187329607], length 0
21:09:57.340993 IP 10.0.0.1.41646 > 10.0.0.3.5001: Flags [P.], seq 2795953:2824913, ack 1, win 83, options [nop,nop,TS val 4187329607 ecr 273811506], length 28960
21:09:57.341072 IP 10.0.0.3.5001 > 10.0.0.1.41646: Flags [.], ack 2824913, win 4861, options [nop,nop,TS val 273811506 ecr 4187329607], length 0
21:09:57.341100 IP 10.0.0.1.41646 > 10.0.0.3.5001: Flags [P.], seq 2824913:2832153, ack 1, win 83, options [nop,nop,TS val 4187329607 ecr 273811506], length 7240
21:09:57.341142 IP 10.0.0.3.5001 > 10.0.0.1.41646: Flags [.], ack 2832153, win 4852, options [nop,nop,TS val 273811507 ecr 4187329607], length 0
21:09:57.341170 IP 10.0.0.1.41646 > 10.0.0.3.5001: Flags [P.], seq 2832153:2853873, ack 1, win 83, options [nop,nop,TS val 4187329607 ecr 273811506], length 21720
21:09:57.341215 IP 10.0.0.3.5001 > 10.0.0.1.41646: Flags [.], ack 2853873, win 4830, options [nop,nop,TS val 273811507 ecr 4187329607], length 0
21:09:57.341312 IP 10.0.0.1.41646 > 10.0.0.3.5001: Flags [P.], seq 2853873:2883585, ack 1, win 83, options [nop,nop,TS val 4187329608 ecr 273811506], length 29712
21:09:57.341372 IP 10.0.0.3.5001 > 10.0.0.1.41646: Flags [.], ack 2883585, win 4860, options [nop,nop,TS val 273811507 ecr 4187329608], length 0
21:09:58.339547 IP 10.0.0.1.41646 > 10.0.0.3.5001: Flags [P.], seq 2883585:2890825, ack 1, win 83, options [nop,nop,TS val 4187330606 ecr 273811507], length 7240
21:09:58.339626 IP 10.0.0.3.5001 > 10.0.0.1.41646: Flags [.], ack 2890825, win 4882, options [nop,nop,TS val 273812505 ecr 4187330606], length 0
21:09:58.339723 IP 10.0.0.1.41646 > 10.0.0.3.5001: Flags [P.], seq 2890825:2898065, ack 1, win 83, options [nop,nop,TS val 4187330606 ecr 273811507], length 7240
21:09:58.339782 IP 10.0.0.3.5001 > 10.0.0.1.41646: Flags [.], ack 2898065, win 4882, options [nop,nop,TS val 273812505 ecr 4187330606], length 0
21:09:58.339891 IP 10.0.0.1.41646 > 10.0.0.3.5001: Flags [P.], seq 2898065:2912545, ack 1, win 83, options [nop,nop,TS val 4187330606 ecr 273812505], length 14480
21:09:58.339950 IP 10.0.0.3.5001 > 10.0.0.1.41646: Flags [.], ack 2912545, win 4875, options [nop,nop,TS val 273812505 ecr 4187330606], length 0
21:09:58.339979 IP 10.0.0.1.41646 > 10.0.0.3.5001: Flags [P.], seq 2912545:2927025, ack 1, win 83, options [nop,nop,TS val 4187330606 ecr 273812505], length 14480
21:09:58.340025 IP 10.0.0.3.5001 > 10.0.0.1.41646: Flags [.], ack 2927025, win 4860, options [nop,nop,TS val 273812505 ecr 4187330606], length 0
21:09:58.340117 IP 10.0.0.1.41646 > 10.0.0.3.5001: Flags [P.], seq 2927025:2955985, ack 1, win 83, options [nop,nop,TS val 4187330607 ecr 273812505], length 28960
21:09:58.340180 IP 10.0.0.3.5001 > 10.0.0.1.41646: Flags [.], ack 2955985, win 4861, options [nop,nop,TS val 273812506 ecr 4187330607], length 0
21:09:58.340208 IP 10.0.0.1.41646 > 10.0.0.3.5001: Flags [P.], seq 2955985:2963225, ack 1, win 83, options [nop,nop,TS val 4187330607 ecr 273812505], length 7240
21:09:58.340271 IP 10.0.0.3.5001 > 10.0.0.1.41646: Flags [.], ack 2963225, win 4852, options [nop,nop,TS val 273812506 ecr 4187330607], length 0
21:09:58.340301 IP 10.0.0.1.41646 > 10.0.0.3.5001: Flags [P.], seq 2963225:2984945, ack 1, win 83, options [nop,nop,TS val 4187330607 ecr 273812505], length 21720
21:09:58.340350 IP 10.0.0.3.5001 > 10.0.0.1.41646: Flags [.], ack 2984945, win 4830, options [nop,nop,TS val 273812506 ecr 4187330607], length 0
21:09:58.340465 IP 10.0.0.1.41646 > 10.0.0.3.5001: Flags [P.], seq 2984945:3014657, ack 1, win 83, options [nop,nop,TS val 4187330607 ecr 273812506], length 29712
21:09:58.340528 IP 10.0.0.3.5001 > 10.0.0.1.41646: Flags [.], ack 3014657, win 4860, options [nop,nop,TS val 273812506 ecr 4187330607], length 0
21:09:59.339531 IP 10.0.0.1.41646 > 10.0.0.3.5001: Flags [P.], seq 3014657:3021897, ack 1, win 83, options [nop,nop,TS val 4187331606 ecr 273812506], length 7240
21:09:59.339608 IP 10.0.0.3.5001 > 10.0.0.1.41646: Flags [.], ack 3021897, win 4882, options [nop,nop,TS val 273813505 ecr 4187331606], length 0
21:09:59.339703 IP 10.0.0.1.41646 > 10.0.0.3.5001: Flags [P.], seq 3021897:3029137, ack 1, win 83, options [nop,nop,TS val 4187331606 ecr 273812506], length 7240
21:09:59.339762 IP 10.0.0.3.5001 > 10.0.0.1.41646: Flags [.], ack 3029137, win 4882, options [nop,nop,TS val 273813505 ecr 4187331606], length 0
21:09:59.339871 IP 10.0.0.1.41646 > 10.0.0.3.5001: Flags [P.], seq 3029137:3043617, ack 1, win 83, options [nop,nop,TS val 4187331606 ecr 273813505], length 14480
21:09:59.339930 IP 10.0.0.3.5001 > 10.0.0.1.41646: Flags [.], ack 3043617, win 4875, options [nop,nop,TS val 273813505 ecr 4187331606], length 0
21:09:59.339959 IP 10.0.0.1.41646 > 10.0.0.3.5001: Flags [P.], seq 3043617:3058097, ack 1, win 83, options [nop,nop,TS val 4187331606 ecr 273813505], length 14480
21:09:59.340005 IP 10.0.0.3.5001 > 10.0.0.1.41646: Flags [.], ack 3058097, win 4860, options [nop,nop,TS val 273813505 ecr 4187331606], length 0
21:09:59.340096 IP 10.0.0.1.41646 > 10.0.0.3.5001: Flags [P.], seq 3058097:3087057, ack 1, win 83, options [nop,nop,TS val 4187331607 ecr 273813505], length 28960
21:09:59.340159 IP 10.0.0.3.5001 > 10.0.0.1.41646: Flags [.], ack 3087057, win 4861, options [nop,nop,TS val 273813506 ecr 4187331607], length 0
21:09:59.340187 IP 10.0.0.1.41646 > 10.0.0.3.5001: Flags [P.], seq 3087057:3094297, ack 1, win 83, options [nop,nop,TS val 4187331607 ecr 273813505], length 7240
21:09:59.340230 IP 10.0.0.3.5001 > 10.0.0.1.41646: Flags [.], ack 3094297, win 4852, options [nop,nop,TS val 273813506 ecr 4187331607], length 0
21:09:59.340259 IP 10.0.0.1.41646 > 10.0.0.3.5001: Flags [P.], seq 3094297:3116017, ack 1, win 83, options [nop,nop,TS val 4187331607 ecr 273813505], length 21720
21:09:59.340306 IP 10.0.0.3.5001 > 10.0.0.1.41646: Flags [.], ack 3116017, win 4830, options [nop,nop,TS val 273813506 ecr 4187331607], length 0
21:09:59.340404 IP 10.0.0.1.41646 > 10.0.0.3.5001: Flags [P.], seq 3116017:3145729, ack 1, win 83, options [nop,nop,TS val 4187331607 ecr 273813506], length 29712
21:09:59.340467 IP 10.0.0.3.5001 > 10.0.0.1.41646: Flags [.], ack 3145729, win 4860, options [nop,nop,TS val 273813506 ecr 4187331607], length 0
21:10:00.339537 IP 10.0.0.1.41646 > 10.0.0.3.5001: Flags [P.], seq 3145729:3152969, ack 1, win 83, options [nop,nop,TS val 4187332606 ecr 273813506], length 7240
21:10:00.339616 IP 10.0.0.3.5001 > 10.0.0.1.41646: Flags [.], ack 3152969, win 4882, options [nop,nop,TS val 273814505 ecr 4187332606], length 0
21:10:00.339711 IP 10.0.0.1.41646 > 10.0.0.3.5001: Flags [P.], seq 3152969:3160209, ack 1, win 83, options [nop,nop,TS val 4187332606 ecr 273813506], length 7240
21:10:00.339770 IP 10.0.0.3.5001 > 10.0.0.1.41646: Flags [.], ack 3160209, win 4882, options [nop,nop,TS val 273814505 ecr 4187332606], length 0
21:10:00.339879 IP 10.0.0.1.41646 > 10.0.0.3.5001: Flags [P.], seq 3160209:3174689, ack 1, win 83, options [nop,nop,TS val 4187332606 ecr 273814505], length 14480
21:10:00.339938 IP 10.0.0.3.5001 > 10.0.0.1.41646: Flags [.], ack 3174689, win 4875, options [nop,nop,TS val 273814505 ecr 4187332606], length 0
21:10:00.339967 IP 10.0.0.1.41646 > 10.0.0.3.5001: Flags [P.], seq 3174689:3189169, ack 1, win 83, options [nop,nop,TS val 4187332606 ecr 273814505], length 14480
21:10:00.340013 IP 10.0.0.3.5001 > 10.0.0.1.41646: Flags [.], ack 3189169, win 4860, options [nop,nop,TS val 273814505 ecr 4187332606], length 0
21:10:00.340105 IP 10.0.0.1.41646 > 10.0.0.3.5001: Flags [P.], seq 3189169:3218129, ack 1, win 83, options [nop,nop,TS val 4187332607 ecr 273814505], length 28960
21:10:00.340168 IP 10.0.0.3.5001 > 10.0.0.1.41646: Flags [.], ack 3218129, win 4861, options [nop,nop,TS val 273814506 ecr 4187332607], length 0
21:10:00.340196 IP 10.0.0.1.41646 > 10.0.0.3.5001: Flags [P.], seq 3218129:3225369, ack 1, win 83, options [nop,nop,TS val 4187332607 ecr 273814505], length 7240
21:10:00.340239 IP 10.0.0.3.5001 > 10.0.0.1.41646: Flags [.], ack 3225369, win 4852, options [nop,nop,TS val 273814506 ecr 4187332607], length 0
21:10:00.340268 IP 10.0.0.1.41646 > 10.0.0.3.5001: Flags [P.], seq 3225369:3247089, ack 1, win 83, options [nop,nop,TS val 4187332607 ecr 273814505], length 21720
21:10:00.340315 IP 10.0.0.3.5001 > 10.0.0.1.41646: Flags [.], ack 3247089, win 4830, options [nop,nop,TS val 273814506 ecr 4187332607], length 0
21:10:00.340413 IP 10.0.0.1.41646 > 10.0.0.3.5001: Flags [P.], seq 3247089:3276801, ack 1, win 83, options [nop,nop,TS val 4187332607 ecr 273814506], length 29712
21:10:00.340510 IP 10.0.0.3.5001 > 10.0.0.1.41646: Flags [.], ack 3276801, win 4860, options [nop,nop,TS val 273814506 ecr 4187332607], length 0
21:10:01.339535 IP 10.0.0.1.41646 > 10.0.0.3.5001: Flags [P.], seq 3276801:3284041, ack 1, win 83, options [nop,nop,TS val 4187333606 ecr 273814506], length 7240
21:10:01.339614 IP 10.0.0.3.5001 > 10.0.0.1.41646: Flags [.], ack 3284041, win 4882, options [nop,nop,TS val 273815505 ecr 4187333606], length 0
21:10:01.339710 IP 10.0.0.1.41646 > 10.0.0.3.5001: Flags [P.], seq 3284041:3291281, ack 1, win 83, options [nop,nop,TS val 4187333606 ecr 273814506], length 7240
21:10:01.339768 IP 10.0.0.3.5001 > 10.0.0.1.41646: Flags [.], ack 3291281, win 4882, options [nop,nop,TS val 273815505 ecr 4187333606], length 0
21:10:01.339892 IP 10.0.0.1.41646 > 10.0.0.3.5001: Flags [P.], seq 3291281:3305761, ack 1, win 83, options [nop,nop,TS val 4187333606 ecr 273815505], length 14480
21:10:01.339951 IP 10.0.0.3.5001 > 10.0.0.1.41646: Flags [.], ack 3305761, win 4875, options [nop,nop,TS val 273815505 ecr 4187333606], length 0
21:10:01.339980 IP 10.0.0.1.41646 > 10.0.0.3.5001: Flags [P.], seq 3305761:3320241, ack 1, win 83, options [nop,nop,TS val 4187333606 ecr 273815505], length 14480
21:10:01.340027 IP 10.0.0.3.5001 > 10.0.0.1.41646: Flags [.], ack 3320241, win 4860, options [nop,nop,TS val 273815505 ecr 4187333606], length 0
21:10:01.340120 IP 10.0.0.1.41646 > 10.0.0.3.5001: Flags [P.], seq 3320241:3349201, ack 1, win 83, options [nop,nop,TS val 4187333607 ecr 273815505], length 28960
21:10:01.340182 IP 10.0.0.3.5001 > 10.0.0.1.41646: Flags [.], ack 3349201, win 4861, options [nop,nop,TS val 273815506 ecr 4187333607], length 0
21:10:01.340210 IP 10.0.0.1.41646 > 10.0.0.3.5001: Flags [P.], seq 3349201:3356441, ack 1, win 83, options [nop,nop,TS val 4187333607 ecr 273815505], length 7240
21:10:01.340254 IP 10.0.0.3.5001 > 10.0.0.1.41646: Flags [.], ack 3356441, win 4852, options [nop,nop,TS val 273815506 ecr 4187333607], length 0
21:10:01.340283 IP 10.0.0.1.41646 > 10.0.0.3.5001: Flags [P.], seq 3356441:3378161, ack 1, win 83, options [nop,nop,TS val 4187333607 ecr 273815505], length 21720
21:10:01.340330 IP 10.0.0.3.5001 > 10.0.0.1.41646: Flags [.], ack 3378161, win 4830, options [nop,nop,TS val 273815506 ecr 4187333607], length 0
21:10:01.340428 IP 10.0.0.1.41646 > 10.0.0.3.5001: Flags [P.], seq 3378161:3407873, ack 1, win 83, options [nop,nop,TS val 4187333607 ecr 273815506], length 29712
21:10:01.340491 IP 10.0.0.3.5001 > 10.0.0.1.41646: Flags [.], ack 3407873, win 4860, options [nop,nop,TS val 273815506 ecr 4187333607], length 0
21:10:02.339535 IP 10.0.0.1.41646 > 10.0.0.3.5001: Flags [P.], seq 3407873:3415113, ack 1, win 83, options [nop,nop,TS val 4187334606 ecr 273815506], length 7240
21:10:02.339613 IP 10.0.0.3.5001 > 10.0.0.1.41646: Flags [.], ack 3415113, win 4882, options [nop,nop,TS val 273816505 ecr 4187334606], length 0
21:10:02.339706 IP 10.0.0.1.41646 > 10.0.0.3.5001: Flags [P.], seq 3415113:3422353, ack 1, win 83, options [nop,nop,TS val 4187334606 ecr 273815506], length 7240
21:10:02.339763 IP 10.0.0.3.5001 > 10.0.0.1.41646: Flags [.], ack 3422353, win 4882, options [nop,nop,TS val 273816505 ecr 4187334606], length 0
21:10:02.339870 IP 10.0.0.1.41646 > 10.0.0.3.5001: Flags [P.], seq 3422353:3436833, ack 1, win 83, options [nop,nop,TS val 4187334606 ecr 273816505], length 14480
21:10:02.339927 IP 10.0.0.3.5001 > 10.0.0.1.41646: Flags [.], ack 3436833, win 4875, options [nop,nop,TS val 273816505 ecr 4187334606], length 0
21:10:02.339956 IP 10.0.0.1.41646 > 10.0.0.3.5001: Flags [P.], seq 3436833:3451313, ack 1, win 83, options [nop,nop,TS val 4187334606 ecr 273816505], length 14480
21:10:02.340000 IP 10.0.0.3.5001 > 10.0.0.1.41646: Flags [.], ack 3451313, win 4860, options [nop,nop,TS val 273816505 ecr 4187334606], length 0
21:10:02.340091 IP 10.0.0.1.41646 > 10.0.0.3.5001: Flags [P.], seq 3451313:3480273, ack 1, win 83, options [nop,nop,TS val 4187334607 ecr 273816505], length 28960
21:10:02.340152 IP 10.0.0.3.5001 > 10.0.0.1.41646: Flags [.], ack 3480273, win 4861, options [nop,nop,TS val 273816506 ecr 4187334607], length 0
21:10:02.340180 IP 10.0.0.1.41646 > 10.0.0.3.5001: Flags [P.], seq 3480273:3487513, ack 1, win 83, options [nop,nop,TS val 4187334607 ecr 273816505], length 7240
21:10:02.340222 IP 10.0.0.3.5001 > 10.0.0.1.41646: Flags [.], ack 3487513, win 4852, options [nop,nop,TS val 273816506 ecr 4187334607], length 0
21:10:02.340250 IP 10.0.0.1.41646 > 10.0.0.3.5001: Flags [P.], seq 3487513:3509233, ack 1, win 83, options [nop,nop,TS val 4187334607 ecr 273816505], length 21720
21:10:02.340296 IP 10.0.0.3.5001 > 10.0.0.1.41646: Flags [.], ack 3509233, win 4830, options [nop,nop,TS val 273816506 ecr 4187334607], length 0
21:10:02.340393 IP 10.0.0.1.41646 > 10.0.0.3.5001: Flags [P.], seq 3509233:3538945, ack 1, win 83, options [nop,nop,TS val 4187334607 ecr 273816506], length 29712
21:10:02.340455 IP 10.0.0.3.5001 > 10.0.0.1.41646: Flags [.], ack 3538945, win 4860, options [nop,nop,TS val 273816506 ecr 4187334607], length 0
21:10:03.339541 IP 10.0.0.1.41646 > 10.0.0.3.5001: Flags [P.], seq 3538945:3546185, ack 1, win 83, options [nop,nop,TS val 4187335606 ecr 273816506], length 7240
21:10:03.339616 IP 10.0.0.3.5001 > 10.0.0.1.41646: Flags [.], ack 3546185, win 4882, options [nop,nop,TS val 273817505 ecr 4187335606], length 0
21:10:03.339708 IP 10.0.0.1.41646 > 10.0.0.3.5001: Flags [P.], seq 3546185:3553425, ack 1, win 83, options [nop,nop,TS val 4187335606 ecr 273816506], length 7240
21:10:03.339764 IP 10.0.0.3.5001 > 10.0.0.1.41646: Flags [.], ack 3553425, win 4882, options [nop,nop,TS val 273817505 ecr 4187335606], length 0
21:10:03.339871 IP 10.0.0.1.41646 > 10.0.0.3.5001: Flags [P.], seq 3553425:3567905, ack 1, win 83, options [nop,nop,TS val 4187335606 ecr 273817505], length 14480
21:10:03.339929 IP 10.0.0.3.5001 > 10.0.0.1.41646: Flags [.], ack 3567905, win 4875, options [nop,nop,TS val 273817505 ecr 4187335606], length 0
21:10:03.339958 IP 10.0.0.1.41646 > 10.0.0.3.5001: Flags [P.], seq 3567905:3582385, ack 1, win 83, options [nop,nop,TS val 4187335606 ecr 273817505], length 14480
21:10:03.340002 IP 10.0.0.3.5001 > 10.0.0.1.41646: Flags [.], ack 3582385, win 4860, options [nop,nop,TS val 273817505 ecr 4187335606], length 0
21:10:03.340093 IP 10.0.0.1.41646 > 10.0.0.3.5001: Flags [P.], seq 3582385:3611345, ack 1, win 83, options [nop,nop,TS val 4187335607 ecr 273817505], length 28960
21:10:03.340154 IP 10.0.0.3.5001 > 10.0.0.1.41646: Flags [.], ack 3611345, win 4861, options [nop,nop,TS val 273817506 ecr 4187335607], length 0
21:10:03.340182 IP 10.0.0.1.41646 > 10.0.0.3.5001: Flags [P.], seq 3611345:3618585, ack 1, win 83, options [nop,nop,TS val 4187335607 ecr 273817505], length 7240
21:10:03.340224 IP 10.0.0.3.5001 > 10.0.0.1.41646: Flags [.], ack 3618585, win 4852, options [nop,nop,TS val 273817506 ecr 4187335607], length 0
21:10:03.340253 IP 10.0.0.1.41646 > 10.0.0.3.5001: Flags [P.], seq 3618585:3640305, ack 1, win 83, options [nop,nop,TS val 4187335607 ecr 273817505], length 21720
21:10:03.340299 IP 10.0.0.3.5001 > 10.0.0.1.41646: Flags [.], ack 3640305, win 4830, options [nop,nop,TS val 273817506 ecr 4187335607], length 0
21:10:03.340395 IP 10.0.0.1.41646 > 10.0.0.3.5001: Flags [P.], seq 3640305:3670017, ack 1, win 83, options [nop,nop,TS val 4187335607 ecr 273817506], length 29712
21:10:03.340458 IP 10.0.0.3.5001 > 10.0.0.1.41646: Flags [.], ack 3670017, win 4860, options [nop,nop,TS val 273817506 ecr 4187335607], length 0
21:10:04.339537 IP 10.0.0.1.41646 > 10.0.0.3.5001: Flags [P.], seq 3670017:3677257, ack 1, win 83, options [nop,nop,TS val 4187336606 ecr 273817506], length 7240
21:10:04.339613 IP 10.0.0.3.5001 > 10.0.0.1.41646: Flags [.], ack 3677257, win 4882, options [nop,nop,TS val 273818505 ecr 4187336606], length 0
21:10:04.339707 IP 10.0.0.1.41646 > 10.0.0.3.5001: Flags [P.], seq 3677257:3684497, ack 1, win 83, options [nop,nop,TS val 4187336606 ecr 273817506], length 7240
21:10:04.339764 IP 10.0.0.3.5001 > 10.0.0.1.41646: Flags [.], ack 3684497, win 4882, options [nop,nop,TS val 273818505 ecr 4187336606], length 0
21:10:04.339871 IP 10.0.0.1.41646 > 10.0.0.3.5001: Flags [P.], seq 3684497:3698977, ack 1, win 83, options [nop,nop,TS val 4187336606 ecr 273818505], length 14480
21:10:04.339929 IP 10.0.0.3.5001 > 10.0.0.1.41646: Flags [.], ack 3698977, win 4875, options [nop,nop,TS val 273818505 ecr 4187336606], length 0
21:10:04.339957 IP 10.0.0.1.41646 > 10.0.0.3.5001: Flags [P.], seq 3698977:3713457, ack 1, win 83, options [nop,nop,TS val 4187336606 ecr 273818505], length 14480
21:10:04.340002 IP 10.0.0.3.5001 > 10.0.0.1.41646: Flags [.], ack 3713457, win 4860, options [nop,nop,TS val 273818505 ecr 4187336606], length 0
21:10:04.340092 IP 10.0.0.1.41646 > 10.0.0.3.5001: Flags [P.], seq 3713457:3742417, ack 1, win 83, options [nop,nop,TS val 4187336607 ecr 273818505], length 28960
21:10:04.340152 IP 10.0.0.3.5001 > 10.0.0.1.41646: Flags [.], ack 3742417, win 4861, options [nop,nop,TS val 273818506 ecr 4187336607], length 0
21:10:04.340180 IP 10.0.0.1.41646 > 10.0.0.3.5001: Flags [P.], seq 3742417:3749657, ack 1, win 83, options [nop,nop,TS val 4187336607 ecr 273818505], length 7240
21:10:04.340222 IP 10.0.0.3.5001 > 10.0.0.1.41646: Flags [.], ack 3749657, win 4852, options [nop,nop,TS val 273818506 ecr 4187336607], length 0
21:10:04.340250 IP 10.0.0.1.41646 > 10.0.0.3.5001: Flags [P.], seq 3749657:3771377, ack 1, win 83, options [nop,nop,TS val 4187336607 ecr 273818505], length 21720
21:10:04.340296 IP 10.0.0.3.5001 > 10.0.0.1.41646: Flags [.], ack 3771377, win 4830, options [nop,nop,TS val 273818506 ecr 4187336607], length 0
21:10:04.340392 IP 10.0.0.1.41646 > 10.0.0.3.5001: Flags [P.], seq 3771377:3801089, ack 1, win 83, options [nop,nop,TS val 4187336607 ecr 273818506], length 29712
21:10:04.340455 IP 10.0.0.3.5001 > 10.0.0.1.41646: Flags [.], ack 3801089, win 4860, options [nop,nop,TS val 273818506 ecr 4187336607], length 0
21:10:05.339537 IP 10.0.0.1.41646 > 10.0.0.3.5001: Flags [P.], seq 3801089:3808329, ack 1, win 83, options [nop,nop,TS val 4187337606 ecr 273818506], length 7240
21:10:05.339616 IP 10.0.0.3.5001 > 10.0.0.1.41646: Flags [.], ack 3808329, win 4882, options [nop,nop,TS val 273819505 ecr 4187337606], length 0
21:10:05.339712 IP 10.0.0.1.41646 > 10.0.0.3.5001: Flags [P.], seq 3808329:3815569, ack 1, win 83, options [nop,nop,TS val 4187337606 ecr 273818506], length 7240
21:10:05.339771 IP 10.0.0.3.5001 > 10.0.0.1.41646: Flags [.], ack 3815569, win 4882, options [nop,nop,TS val 273819505 ecr 4187337606], length 0
21:10:05.339881 IP 10.0.0.1.41646 > 10.0.0.3.5001: Flags [P.], seq 3815569:3830049, ack 1, win 83, options [nop,nop,TS val 4187337606 ecr 273819505], length 14480
21:10:05.339940 IP 10.0.0.3.5001 > 10.0.0.1.41646: Flags [.], ack 3830049, win 4875, options [nop,nop,TS val 273819505 ecr 4187337606], length 0
21:10:05.339969 IP 10.0.0.1.41646 > 10.0.0.3.5001: Flags [P.], seq 3830049:3844529, ack 1, win 83, options [nop,nop,TS val 4187337606 ecr 273819505], length 14480
21:10:05.340015 IP 10.0.0.3.5001 > 10.0.0.1.41646: Flags [.], ack 3844529, win 4860, options [nop,nop,TS val 273819505 ecr 4187337606], length 0
21:10:05.340107 IP 10.0.0.1.41646 > 10.0.0.3.5001: Flags [P.], seq 3844529:3873489, ack 1, win 83, options [nop,nop,TS val 4187337607 ecr 273819505], length 28960
21:10:05.340169 IP 10.0.0.3.5001 > 10.0.0.1.41646: Flags [.], ack 3873489, win 4861, options [nop,nop,TS val 273819506 ecr 4187337607], length 0
21:10:05.340197 IP 10.0.0.1.41646 > 10.0.0.3.5001: Flags [P.], seq 3873489:3880729, ack 1, win 83, options [nop,nop,TS val 4187337607 ecr 273819505], length 7240
21:10:05.340241 IP 10.0.0.3.5001 > 10.0.0.1.41646: Flags [.], ack 3880729, win 4852, options [nop,nop,TS val 273819506 ecr 4187337607], length 0
21:10:05.340270 IP 10.0.0.1.41646 > 10.0.0.3.5001: Flags [P.], seq 3880729:3902449, ack 1, win 83, options [nop,nop,TS val 4187337607 ecr 273819505], length 21720
21:10:05.340317 IP 10.0.0.3.5001 > 10.0.0.1.41646: Flags [.], ack 3902449, win 4830, options [nop,nop,TS val 273819506 ecr 4187337607], length 0
21:10:05.340416 IP 10.0.0.1.41646 > 10.0.0.3.5001: Flags [P.], seq 3902449:3932161, ack 1, win 83, options [nop,nop,TS val 4187337607 ecr 273819506], length 29712
21:10:05.340480 IP 10.0.0.3.5001 > 10.0.0.1.41646: Flags [.], ack 3932161, win 4860, options [nop,nop,TS val 273819506 ecr 4187337607], length 0
21:10:06.340406 IP 10.0.0.3.5001 > 10.0.0.1.41646: Flags [.], ack 3933609, win 4888, options [nop,nop,TS val 273820506 ecr 4187338606], length 0
21:10:06.340464 IP 10.0.0.3.5001 > 10.0.0.1.41646: Flags [.], ack 3935057, win 4886, options [nop,nop,TS val 273820506 ecr 4187338606], length 0
21:10:06.340531 IP 10.0.0.3.5001 > 10.0.0.1.41646: Flags [.], ack 3936505, win 4884, options [nop,nop,TS val 273820506 ecr 4187338606], length 0
21:10:06.340582 IP 10.0.0.3.5001 > 10.0.0.1.41646: Flags [.], ack 3937953, win 4882, options [nop,nop,TS val 273820506 ecr 4187338606], length 0
21:10:06.340653 IP 10.0.0.3.5001 > 10.0.0.1.41646: Flags [.], ack 3939401, win 4880, options [nop,nop,TS val 273820506 ecr 4187338606], length 0
21:10:06.341059 IP 10.0.0.3.5001 > 10.0.0.1.41646: Flags [.], ack 3946641, win 4882, options [nop,nop,TS val 273820506 ecr 4187338606], length 0
21:10:06.341243 IP 10.0.0.3.5001 > 10.0.0.1.41646: Flags [.], ack 3961121, win 4875, options [nop,nop,TS val 273820507 ecr 4187338608], length 0
21:10:06.341318 IP 10.0.0.3.5001 > 10.0.0.1.41646: Flags [.], ack 3975601, win 4860, options [nop,nop,TS val 273820507 ecr 4187338608], length 0
21:10:06.341474 IP 10.0.0.3.5001 > 10.0.0.1.41646: Flags [.], ack 4004561, win 4861, options [nop,nop,TS val 273820507 ecr 4187338608], length 0
21:10:06.341545 IP 10.0.0.3.5001 > 10.0.0.1.41646: Flags [.], ack 4011801, win 4852, options [nop,nop,TS val 273820507 ecr 4187338608], length 0
21:10:06.341620 IP 10.0.0.3.5001 > 10.0.0.1.41646: Flags [.], ack 4033521, win 4830, options [nop,nop,TS val 273820507 ecr 4187338608], length 0
21:10:06.341783 IP 10.0.0.3.5001 > 10.0.0.1.41646: Flags [.], ack 4063233, win 4860, options [nop,nop,TS val 273820507 ecr 4187338608], length 0
21:10:07.339619 IP 10.0.0.3.5001 > 10.0.0.1.41646: Flags [.], ack 4070473, win 4882, options [nop,nop,TS val 273821505 ecr 4187339606], length 0
21:10:07.339775 IP 10.0.0.3.5001 > 10.0.0.1.41646: Flags [.], ack 4077713, win 4882, options [nop,nop,TS val 273821505 ecr 4187339606], length 0
21:10:07.339941 IP 10.0.0.3.5001 > 10.0.0.1.41646: Flags [.], ack 4092193, win 4875, options [nop,nop,TS val 273821505 ecr 4187339606], length 0
21:10:07.340015 IP 10.0.0.3.5001 > 10.0.0.1.41646: Flags [.], ack 4106673, win 4860, options [nop,nop,TS val 273821505 ecr 4187339606], length 0
21:10:07.340166 IP 10.0.0.3.5001 > 10.0.0.1.41646: Flags [.], ack 4135633, win 4861, options [nop,nop,TS val 273821506 ecr 4187339607], length 0
21:10:07.340236 IP 10.0.0.3.5001 > 10.0.0.1.41646: Flags [.], ack 4142873, win 4852, options [nop,nop,TS val 273821506 ecr 4187339607], length 0
21:10:07.340309 IP 10.0.0.3.5001 > 10.0.0.1.41646: Flags [.], ack 4164593, win 4830, options [nop,nop,TS val 273821506 ecr 4187339607], length 0
21:10:07.340485 IP 10.0.0.3.5001 > 10.0.0.1.41646: Flags [.], ack 4194305, win 4860, options [nop,nop,TS val 273821506 ecr 4187339607], length 0

