21:09:36.332906 IP 10.0.0.1.41646 > 10.0.0.3.5001: Flags [S], seq 1089216513, win 42340, options [mss 1460,sackOK,TS val 4187308599 ecr 0,nop,wscale 9], length 0
21:09:36.338622 IP 10.0.0.1.41646 > 10.0.0.3.5001: Flags [.], ack 802190598, win 83, options [nop,nop,TS val 4187308605 ecr 273790499], length 0
21:09:36.339524 IP 10.0.0.1.41646 > 10.0.0.3.5001: Flags [P.], seq 0:4344, ack 1, win 83, options [nop,nop,TS val 4187308606 ecr 273790499], length 4344
21:09:36.339665 IP 10.0.0.1.41646 > 10.0.0.3.5001: Flags [P.], seq 4344:8688, ack 1, win 83, options [nop,nop,TS val 4187308606 ecr 273790499], length 4344
21:09:36.339746 IP 10.0.0.1.41646 > 10.0.0.3.5001: Flags [P.], seq 8688:13032, ack 1, win 83, options [nop,nop,TS val 4187308606 ecr 273790499], length 4344
21:09:36.339827 IP 10.0.0.1.41646 > 10.0.0.3.5001: Flags [.], seq 13032:14480, ack 1, win 83, options [nop,nop,TS val 4187308606 ecr 273790499], length 1448
21:09:36.341229 IP 10.0.0.3.5001 > 10.0.0.1.41646: Flags [.], ack 4344, win 80, options [nop,nop,TS val 273790505 ecr 4187308606], length 0
21:09:36.341259 IP 10.0.0.3.5001 > 10.0.0.1.41646: Flags [.], ack 8688, win 75, options [nop,nop,TS val 273790505 ecr 4187308606], length 0
21:09:36.341284 IP 10.0.0.3.5001 > 10.0.0.1.41646: Flags [.], ack 13032, win 69, options [nop,nop,TS val 273790505 ecr 4187308606], length 0
21:09:36.341308 IP 10.0.0.3.5001 > 10.0.0.1.41646: Flags [.], ack 14480, win 67, options [nop,nop,TS val 273790505 ecr 4187308606], length 0
21:09:36.341817 IP 10.0.0.1.41646 > 10.0.0.3.5001: Flags [P.], seq 14480:20272, ack 1, win 83, options [nop,nop,TS val 4187308608 ecr 273790505], length 5792
21:09:36.341827 IP 10.0.0.1.41646 > 10.0.0.3.5001: Flags [P.], seq 20272:23168, ack 1, win 83, options [nop,nop,TS val 4187308608 ecr 273790505], length 2896
21:09:36.341960 IP 10.0.0.3.5001 > 10.0.0.1.41646: Flags [.], ack 20272, win 79, options [nop,nop,TS val 273790507 ecr 4187308608], length 0
21:09:36.341978 IP 10.0.0.3.5001 > 10.0.0.1.41646: Flags [.], ack 23168, win 75, options [nop,nop,TS val 273790507 ecr 4187308608], length 0
21:09:36.342096 IP 10.0.0.1.41646 > 10.0.0.3.5001: Flags [P.], seq 23168:36200, ack 1, win 83, options [nop,nop,TS val 4187308608 ecr 273790507], length 13032
21:09:36.342105 IP 10.0.0.1.41646 > 10.0.0.3.5001: Flags [P.], seq 36200:49232, ack 1, win 83, options [nop,nop,TS val 4187308608 ecr 273790507], length 13032
21:09:36.342224 IP 10.0.0.3.5001 > 10.0.0.1.41646: Flags [.], ack 36200, win 62, options [nop,nop,TS val 273790508 ecr 4187308608], length 0
21:09:36.342243 IP 10.0.0.3.5001 > 10.0.0.1.41646: Flags [.], ack 49232, win 49, options [nop,nop,TS val 273790508 ecr 4187308608], length 0
21:09:36.342364 IP 10.0.0.1.41646 > 10.0.0.3.5001: Flags [P.], seq 49232:55024, ack 1, win 83, options [nop,nop,TS val 4187308609 ecr 273790508], length 5792
21:09:36.342373 IP 10.0.0.1.41646 > 10.0.0.3.5001: Flags [P.], seq 55024:57920, ack 1, win 83, options [nop,nop,TS val 4187308609 ecr 273790508], length 2896
21:09:36.342382 IP 10.0.0.1.41646 > 10.0.0.3.5001: Flags [P.], seq 57920:67944, ack 1, win 83, options [nop,nop,TS val 4187308609 ecr 273790508], length 10024
21:09:36.342391 IP 10.0.0.1.41646 > 10.0.0.3.5001: Flags [P.], seq 67944:73736, ack 1, win 83, options [nop,nop,TS val 4187308609 ecr 273790508], length 5792
21:09:36.342629 IP 10.0.0.3.5001 > 10.0.0.1.41646: Flags [.], ack 55024, win 44, options [nop,nop,TS val 273790508 ecr 4187308609], length 0
21:09:36.342689 IP 10.0.0.1.41646 > 10.0.0.3.5001: Flags [P.], seq 73736:76632, ack 1, win 83, options [nop,nop,TS val 4187308609 ecr 273790508], length 2896
21:09:36.342865 IP 10.0.0.3.5001 > 10.0.0.1.41646: Flags [.], ack 76632, win 83, options [nop,nop,TS val 273790508 ecr 4187308609], length 0
21:09:36.342927 IP 10.0.0.1.41646 > 10.0.0.3.5001: Flags [P.], seq 76632:79640, ack 1, win 83, options [nop,nop,TS val 4187308609 ecr 273790508], length 3008
21:09:36.343007 IP 10.0.0.3.5001 > 10.0.0.1.41646: Flags [.], ack 79640, win 95, options [nop,nop,TS val 273790508 ecr 4187308609], length 0
21:09:36.343413 IP 10.0.0.1.41646 > 10.0.0.3.5001: Flags [P.], seq 79640:102808, ack 1, win 83, options [nop,nop,TS val 4187308610 ecr 273790508], length 23168
21:09:36.343500 IP 10.0.0.3.5001 > 10.0.0.1.41646: Flags [.], ack 102808, win 185, options [nop,nop,TS val 273790509 ecr 4187308610], length 0
21:09:36.343623 IP 10.0.0.1.41646 > 10.0.0.3.5001: Flags [P.], seq 102808:125976, ack 1, win 83, options [nop,nop,TS val 4187308610 ecr 273790508], length 23168
21:09:36.343712 IP 10.0.0.3.5001 > 10.0.0.1.41646: Flags [.], ack 125976, win 204, options [nop,nop,TS val 273790509 ecr 4187308610], length 0
21:09:36.343828 IP 10.0.0.1.41646 > 10.0.0.3.5001: Flags [P.], seq 125976:128280, ack 1, win 83, options [nop,nop,TS val 4187308610 ecr 273790508], length 2304
21:09:36.343910 IP 10.0.0.3.5001 > 10.0.0.1.41646: Flags [.], ack 128280, win 213, options [nop,nop,TS val 273790509 ecr 4187308610], length 0
21:09:36.343972 IP 10.0.0.1.41646 > 10.0.0.3.5001: Flags [P.], seq 128280:131072, ack 1, win 83, options [nop,nop,TS val 4187308610 ecr 273790509], length 2792
21:09:36.344034 IP 10.0.0.3.5001 > 10.0.0.1.41646: Flags [.], ack 131072, win 222, options [nop,nop,TS val 273790509 ecr 4187308610], length 0
21:09:36.345109 IP 10.0.0.1.41646 > 10.0.0.3.5001: Flags [.], ack 1, win 83, options [nop,nop,TS val 4187308612 ecr 273790509], length 0
21:09:37.339533 IP 10.0.0.1.41646 > 10.0.0.3.5001: Flags [P.], seq 131072:138312, ack 1, win 83, options [nop,nop,TS val 4187309606 ecr 273790509], length 7240
21:09:37.339613 IP 10.0.0.3.5001 > 10.0.0.1.41646: Flags [.], ack 138312, win 250, options [nop,nop,TS val 273791505 ecr 4187309606], length 0
21:09:37.339653 IP 10.0.0.1.41646 > 10.0.0.3.5001: Flags [P.], seq 138312:145552, ack 1, win 83, options [nop,nop,TS val 4187309606 ecr 273790509], length 7240
21:09:37.339697 IP 10.0.0.3.5001 > 10.0.0.1.41646: Flags [.], ack 145552, win 278, options [nop,nop,TS val 273791505 ecr 4187309606], length 0
21:09:37.339830 IP 10.0.0.1.41646 > 10.0.0.3.5001: Flags [P.], seq 145552:160032, ack 1, win 83, options [nop,nop,TS val 4187309606 ecr 273791505], length 14480
21:09:37.339889 IP 10.0.0.3.5001 > 10.0.0.1.41646: Flags [.], ack 160032, win 335, options [nop,nop,TS val 273791505 ecr 4187309606], length 0
21:09:37.339917 IP 10.0.0.1.41646 > 10.0.0.3.5001: Flags [P.], seq 160032:174512, ack 1, win 83, options [nop,nop,TS val 4187309606 ecr 273791505], length 14480
21:09:37.339962 IP 10.0.0.3.5001 > 10.0.0.1.41646: Flags [.], ack 174512, win 391, options [nop,nop,TS val 273791505 ecr 4187309606], length 0
21:09:37.340052 IP 10.0.0.1.41646 > 10.0.0.3.5001: Flags [P.], seq 174512:202024, ack 1, win 83, options [nop,nop,TS val 4187309606 ecr 273791505], length 27512
21:09:37.340113 IP 10.0.0.3.5001 > 10.0.0.1.41646: Flags [.], ack 202024, win 499, options [nop,nop,TS val 273791506 ecr 4187309606], length 0
21:09:37.340142 IP 10.0.0.1.41646 > 10.0.0.3.5001: Flags [P.], seq 202024:230984, ack 1, win 83, options [nop,nop,TS val 4187309606 ecr 273791505], length 28960
21:09:37.340190 IP 10.0.0.3.5001 > 10.0.0.1.41646: Flags [.], ack 230984, win 612, options [nop,nop,TS val 273791506 ecr 4187309606], length 0
21:09:37.340218 IP 10.0.0.1.41646 > 10.0.0.3.5001: Flags [.], seq 230984:232432, ack 1, win 83, options [nop,nop,TS val 4187309606 ecr 273791505], length 1448
21:09:37.340259 IP 10.0.0.3.5001 > 10.0.0.1.41646: Flags [.], ack 232432, win 618, options [nop,nop,TS val 273791506 ecr 4187309606], length 0
21:09:37.340356 IP 10.0.0.1.41646 > 10.0.0.3.5001: Flags [P.], seq 232432:258496, ack 1, win 83, options [nop,nop,TS val 4187309607 ecr 273791506], length 26064
21:09:37.340416 IP 10.0.0.3.5001 > 10.0.0.1.41646: Flags [.], ack 258496, win 719, options [nop,nop,TS val 273791506 ecr 4187309607], length 0
21:09:37.340444 IP 10.0.0.1.41646 > 10.0.0.3.5001: Flags [P.], seq 258496:262144, ack 1, win 83, options [nop,nop,TS val 4187309607 ecr 273791506], length 3648
21:09:37.340486 IP 10.0.0.3.5001 > 10.0.0.1.41646: Flags [.], ack 262144, win 734, options [nop,nop,TS val 273791506 ecr 4187309607], length 0
21:09:38.339541 IP 10.0.0.1.41646 > 10.0.0.3.5001: Flags [P.], seq 262144:269384, ack 1, win 83, options [nop,nop,TS val 4187310606 ecr 273791506], length 7240
21:09:38.339639 IP 10.0.0.3.5001 > 10.0.0.1.41646: Flags [.], ack 269384, win 762, options [nop,nop,TS val 273792505 ecr 4187310606], length 0
21:09:38.339738 IP 10.0.0.1.41646 > 10.0.0.3.5001: Flags [P.], seq 269384:276624, ack 1, win 83, options [nop,nop,TS val 4187310606 ecr 273791506], length 7240
21:09:38.339797 IP 10.0.0.3.5001 > 10.0.0.1.41646: Flags [.], ack 276624, win 790, options [nop,nop,TS val 273792505 ecr 4187310606], length 0
21:09:38.339907 IP 10.0.0.1.41646 > 10.0.0.3.5001: Flags [P.], seq 276624:291104, ack 1, win 83, options [nop,nop,TS val 4187310606 ecr 273792505], length 14480
21:09:38.339967 IP 10.0.0.3.5001 > 10.0.0.1.41646: Flags [.], ack 291104, win 847, options [nop,nop,TS val 273792505 ecr 4187310606], length 0
21:09:38.339996 IP 10.0.0.1.41646 > 10.0.0.3.5001: Flags [P.], seq 291104:305584, ack 1, win 83, options [nop,nop,TS val 4187310606 ecr 273792505], length 14480
21:09:38.340042 IP 10.0.0.3.5001 > 10.0.0.1.41646: Flags [.], ack 305584, win 903, options [nop,nop,TS val 273792505 ecr 4187310606], length 0
21:09:38.340135 IP 10.0.0.1.41646 > 10.0.0.3.5001: Flags [P.], seq 305584:334544, ack 1, win 83, options [nop,nop,TS val 4187310607 ecr 273792505], length 28960
21:09:38.340199 IP 10.0.0.3.5001 > 10.0.0.1.41646: Flags [.], ack 334544, win 1016, options [nop,nop,TS val 273792506 ecr 4187310607], length 0
21:09:38.340227 IP 10.0.0.1.41646 > 10.0.0.3.5001: Flags [P.], seq 334544:341784, ack 1, win 83, options [nop,nop,TS val 4187310607 ecr 273792505], length 7240
21:09:38.340270 IP 10.0.0.3.5001 > 10.0.0.1.41646: Flags [.], ack 341784, win 1045, options [nop,nop,TS val 273792506 ecr 4187310607], length 0
21:09:38.340299 IP 10.0.0.1.41646 > 10.0.0.3.5001: Flags [P.], seq 341784:363504, ack 1, win 83, options [nop,nop,TS val 4187310607 ecr 273792505], length 21720
21:09:38.340347 IP 10.0.0.3.5001 > 10.0.0.1.41646: Flags [.], ack 363504, win 1130, options [nop,nop,TS val 273792506 ecr 4187310607], length 0
21:09:38.340446 IP 10.0.0.1.41646 > 10.0.0.3.5001: Flags [P.], seq 363504:393216, ack 1, win 83, options [nop,nop,TS val 4187310607 ecr 273792506], length 29712
21:09:38.340510 IP 10.0.0.3.5001 > 10.0.0.1.41646: Flags [.], ack 393216, win 1246, options [nop,nop,TS val 273792506 ecr 4187310607], length 0
21:09:39.339542 IP 10.0.0.1.41646 > 10.0.0.3.5001: Flags [P.], seq 393216:400456, ack 1, win 83, options [nop,nop,TS val 4187311606 ecr 273792506], length 7240
21:09:39.339620 IP 10.0.0.3.5001 > 10.0.0.1.41646: Flags [.], ack 400456, win 1274, options [nop,nop,TS val 273793505 ecr 4187311606], length 0
21:09:39.339716 IP 10.0.0.1.41646 > 10.0.0.3.5001: Flags [P.], seq 400456:407696, ack 1, win 83, options [nop,nop,TS val 4187311606 ecr 273792506], length 7240
21:09:39.339773 IP 10.0.0.3.5001 > 10.0.0.1.41646: Flags [.], ack 407696, win 1302, options [nop,nop,TS val 273793505 ecr 4187311606], length 0
21:09:39.339879 IP 10.0.0.1.41646 > 10.0.0.3.5001: Flags [P.], seq 407696:422176, ack 1, win 83, options [nop,nop,TS val 4187311606 ecr 273793505], length 14480
21:09:39.339937 IP 10.0.0.3.5001 > 10.0.0.1.41646: Flags [.], ack 422176, win 1359, options [nop,nop,TS val 273793505 ecr 4187311606], length 0
21:09:39.339965 IP 10.0.0.1.41646 > 10.0.0.3.5001: Flags [P.], seq 422176:436656, ack 1, win 83, options [nop,nop,TS val 4187311606 ecr 273793505], length 14480
21:09:39.340011 IP 10.0.0.3.5001 > 10.0.0.1.41646: Flags [.], ack 436656, win 1415, options [nop,nop,TS val 273793505 ecr 4187311606], length 0
21:09:39.340101 IP 10.0.0.1.41646 > 10.0.0.3.5001: Flags [P.], seq 436656:465616, ack 1, win 83, options [nop,nop,TS val 4187311607 ecr 273793505], length 28960
21:09:39.340162 IP 10.0.0.3.5001 > 10.0.0.1.41646: Flags [.], ack 465616, win 1528, options [nop,nop,TS val 273793506 ecr 4187311607], length 0
21:09:39.340190 IP 10.0.0.1.41646 > 10.0.0.3.5001: Flags [P.], seq 465616:472856, ack 1, win 83, options [nop,nop,TS val 4187311607 ecr 273793505], length 7240
21:09:39.340232 IP 10.0.0.3.5001 > 10.0.0.1.41646: Flags [.], ack 472856, win 1557, options [nop,nop,TS val 273793506 ecr 4187311607], length 0
21:09:39.340260 IP 10.0.0.1.41646 > 10.0.0.3.5001: Flags [P.], seq 472856:494576, ack 1, win 83, options [nop,nop,TS val 4187311607 ecr 273793505], length 21720
21:09:39.340306 IP 10.0.0.3.5001 > 10.0.0.1.41646: Flags [.], ack 494576, win 1642, options [nop,nop,TS val 273793506 ecr 4187311607], length 0
21:09:39.340402 IP 10.0.0.1.41646 > 10.0.0.3.5001: Flags [P.], seq 494576:524288, ack 1, win 83, options [nop,nop,TS val 4187311607 ecr 273793506], length 29712
21:09:39.340464 IP 10.0.0.3.5001 > 10.0.0.1.41646: Flags [.], ack 524288, win 1758, options [nop,nop,TS val 273793506 ecr 4187311607], length 0
21:09:40.339545 IP 10.0.0.1.41646 > 10.0.0.3.5001: Flags [P.], seq 524288:531528, ack 1, win 83, options [nop,nop,TS val 4187312606 ecr 273793506], length 7240
21:09:40.339620 IP 10.0.0.3.5001 > 10.0.0.1.41646: Flags [.], ack 531528, win 1786, options [nop,nop,TS val 273794505 ecr 4187312606], length 0
21:09:40.339713 IP 10.0.0.1.41646 > 10.0.0.3.5001: Flags [P.], seq 531528:538768, ack 1, win 83, options [nop,nop,TS val 4187312606 ecr 273793506], length 7240
21:09:40.339769 IP 10.0.0.3.5001 > 10.0.0.1.41646: Flags [.], ack 538768, win 1814, options [nop,nop,TS val 273794505 ecr 4187312606], length 0
21:09:40.339876 IP 10.0.0.1.41646 > 10.0.0.3.5001: Flags [P.], seq 538768:553248, ack 1, win 83, options [nop,nop,TS val 4187312606 ecr 273794505], length 14480
21:09:40.339933 IP 10.0.0.3.5001 > 10.0.0.1.41646: Flags [.], ack 553248, win 1871, options [nop,nop,TS val 273794505 ecr 4187312606], length 0
21:09:40.339962 IP 10.0.0.1.41646 > 10.0.0.3.5001: Flags [P.], seq 553248:567728, ack 1, win 83, options [nop,nop,TS val 4187312606 ecr 273794505], length 14480
21:09:40.340005 IP 10.0.0.3.5001 > 10.0.0.1.41646: Flags [.], ack 567728, win 1927, options [nop,nop,TS val 273794505 ecr 4187312606], length 0
21:09:40.340095 IP 10.0.0.1.41646 > 10.0.0.3.5001: Flags [P.], seq 567728:596688, ack 1, win 83, options [nop,nop,TS val 4187312607 ecr 273794505], length 28960
21:09:40.340156 IP 10.0.0.3.5001 > 10.0.0.1.41646: Flags [.], ack 596688, win 2040, options [nop,nop,TS val 273794506 ecr 4187312607], length 0
21:09:40.340184 IP 10.0.0.1.41646 > 10.0.0.3.5001: Flags [P.], seq 596688:603928, ack 1, win 83, options [nop,nop,TS val 4187312607 ecr 273794505], length 7240
21:09:40.340225 IP 10.0.0.3.5001 > 10.0.0.1.41646: Flags [.], ack 603928, win 2069, options [nop,nop,TS val 273794506 ecr 4187312607], length 0
21:09:40.340253 IP 10.0.0.1.41646 > 10.0.0.3.5001: Flags [P.], seq 603928:625648, ack 1, win 83, options [nop,nop,TS val 4187312607 ecr 273794505], length 21720
21:09:40.340299 IP 10.0.0.3.5001 > 10.0.0.1.41646: Flags [.], ack 625648, win 2154, options [nop,nop,TS val 273794506 ecr 4187312607], length 0
21:09:40.340395 IP 10.0.0.1.41646 > 10.0.0.3.5001: Flags [P.], seq 625648:655360, ack 1, win 83, options [nop,nop,TS val 4187312607 ecr 273794506], length 29712
21:09:40.340456 IP 10.0.0.3.5001 > 10.0.0.1.41646: Flags [.], ack 655360, win 2270, options [nop,nop,TS val 273794506 ecr 4187312607], length 0
21:09:41.339540 IP 10.0.0.1.41646 > 10.0.0.3.5001: Flags [P.], seq 655360:662600, ack 1, win 83, options [nop,nop,TS val 4187313606 ecr 273794506], length 7240
21:09:41.339618 IP 10.0.0.3.5001 > 10.0.0.1.41646: Flags [.], ack 662600, win 2298, options [nop,nop,TS val 273795505 ecr 4187313606], length 0
21:09:41.339718 IP 10.0.0.1.41646 > 10.0.0.3.5001: Flags [P.], seq 662600:669840, ack 1, win 83, options [nop,nop,TS val 4187313606 ecr 273794506], length 7240
21:09:41.339778 IP 10.0.0.3.5001 > 10.0.0.1.41646: Flags [.], ack 669840, win 2326, options [nop,nop,TS val 273795505 ecr 4187313606], length 0
21:09:41.339886 IP 10.0.0.1.41646 > 10.0.0.3.5001: Flags [P.], seq 669840:684320, ack 1, win 83, options [nop,nop,TS val 4187313606 ecr 273795505], length 14480
21:09:41.339945 IP 10.0.0.3.5001 > 10.0.0.1.41646: Flags [.], ack 684320, win 2383, options [nop,nop,TS val 273795505 ecr 4187313606], length 0
21:09:41.339974 IP 10.0.0.1.41646 > 10.0.0.3.5001: Flags [P.], seq 684320:698800, ack 1, win 83, options [nop,nop,TS val 4187313606 ecr 273795505], length 14480
21:09:41.340019 IP 10.0.0.3.5001 > 10.0.0.1.41646: Flags [.], ack 698800, win 2439, options [nop,nop,TS val 273795505 ecr 4187313606], length 0
21:09:41.340111 IP 10.0.0.1.41646 > 10.0.0.3.5001: Flags [P.], seq 698800:727760, ack 1, win 83, options [nop,nop,TS val 4187313607 ecr 273795505], length 28960
21:09:41.340172 IP 10.0.0.3.5001 > 10.0.0.1.41646: Flags [.], ack 727760, win 2552, options [nop,nop,TS val 273795506 ecr 4187313607], length 0
21:09:41.340201 IP 10.0.0.1.41646 > 10.0.0.3.5001: Flags [P.], seq 727760:735000, ack 1, win 83, options [nop,nop,TS val 4187313607 ecr 273795505], length 7240
21:09:41.340244 IP 10.0.0.3.5001 > 10.0.0.1.41646: Flags [.], ack 735000, win 2581, options [nop,nop,TS val 273795506 ecr 4187313607], length 0
21:09:41.340273 IP 10.0.0.1.41646 > 10.0.0.3.5001: Flags [P.], seq 735000:756720, ack 1, win 83, options [nop,nop,TS val 4187313607 ecr 273795505], length 21720
21:09:41.340319 IP 10.0.0.3.5001 > 10.0.0.1.41646: Flags [.], ack 756720, win 2666, options [nop,nop,TS val 273795506 ecr 4187313607], length 0
21:09:41.340418 IP 10.0.0.1.41646 > 10.0.0.3.5001: Flags [P.], seq 756720:786432, ack 1, win 83, options [nop,nop,TS val 4187313607 ecr 273795506], length 29712
21:09:41.340480 IP 10.0.0.3.5001 > 10.0.0.1.41646: Flags [.], ack 786432, win 2782, options [nop,nop,TS val 273795506 ecr 4187313607], length 0
21:09:42.339536 IP 10.0.0.1.41646 > 10.0.0.3.5001: Flags [P.], seq 786432:793672, ack 1, win 83, options [nop,nop,TS val 4187314606 ecr 273795506], length 7240
21:09:42.339613 IP 10.0.0.3.5001 > 10.0.0.1.41646: Flags [.], ack 793672, win 2810, options [nop,nop,TS val 273796505 ecr 4187314606], length 0
21:09:42.339708 IP 10.0.0.1.41646 > 10.0.0.3.5001: Flags [P.], seq 793672:800912, ack 1, win 83, options [nop,nop,TS val 4187314606 ecr 273795506], length 7240
21:09:42.339766 IP 10.0.0.3.5001 > 10.0.0.1.41646: Flags [.], ack 800912, win 2838, options [nop,nop,TS val 273796505 ecr 4187314606], length 0
21:09:42.339875 IP 10.0.0.1.41646 > 10.0.0.3.5001: Flags [P.], seq 800912:815392, ack 1, win 83, options [nop,nop,TS val 4187314606 ecr 273796505], length 14480
21:09:42.339933 IP 10.0.0.3.5001 > 10.0.0.1.41646: Flags [.], ack 815392, win 2895, options [nop,nop,TS val 273796505 ecr 4187314606], length 0
21:09:42.339962 IP 10.0.0.1.41646 > 10.0.0.3.5001: Flags [P.], seq 815392:829872, ack 1, win 83, options [nop,nop,TS val 4187314606 ecr 273796505], length 14480
21:09:42.340007 IP 10.0.0.3.5001 > 10.0.0.1.41646: Flags [.], ack 829872, win 2951, options [nop,nop,TS val 273796505 ecr 4187314606], length 0
21:09:42.340099 IP 10.0.0.1.41646 > 10.0.0.3.5001: Flags [P.], seq 829872:858832, ack 1, win 83, options [nop,nop,TS val 4187314607 ecr 273796505], length 28960
21:09:42.340161 IP 10.0.0.3.5001 > 10.0.0.1.41646: Flags [.], ack 858832, win 3064, options [nop,nop,TS val 273796506 ecr 4187314607], length 0
21:09:42.340189 IP 10.0.0.1.41646 > 10.0.0.3.5001: Flags [P.], seq 858832:866072, ack 1, win 83, options [nop,nop,TS val 4187314607 ecr 273796505], length 7240
21:09:42.340232 IP 10.0.0.3.5001 > 10.0.0.1.41646: Flags [.], ack 866072, win 3093, options [nop,nop,TS val 273796506 ecr 4187314607], length 0
21:09:42.340261 IP 10.0.0.1.41646 > 10.0.0.3.5001: Flags [P.], seq 866072:887792, ack 1, win 83, options [nop,nop,TS val 4187314607 ecr 273796505], length 21720
21:09:42.340308 IP 10.0.0.3.5001 > 10.0.0.1.41646: Flags [.], ack 887792, win 3178, options [nop,nop,TS val 273796506 ecr 4187314607], length 0
21:09:42.340407 IP 10.0.0.1.41646 > 10.0.0.3.5001: Flags [P.], seq 887792:917504, ack 1, win 83, options [nop,nop,TS val 4187314607 ecr 273796506], length 29712
21:09:42.340470 IP 10.0.0.3.5001 > 10.0.0.1.41646: Flags [.], ack 917504, win 3294, options [nop,nop,TS val 273796506 ecr 4187314607], length 0
21:09:43.339541 IP 10.0.0.1.41646 > 10.0.0.3.5001: Flags [P.], seq 917504:924744, ack 1, win 83, options [nop,nop,TS val 4187315606 ecr 273796506], length 7240
21:09:43.339620 IP 10.0.0.3.5001 > 10.0.0.1.41646: Flags [.], ack 924744, win 3322, options [nop,nop,TS val 273797505 ecr 4187315606], length 0
21:09:43.339717 IP 10.0.0.1.41646 > 10.0.0.3.5001: Flags [P.], seq 924744:931984, ack 1, win 83, options [nop,nop,TS val 4187315606 ecr 273796506], length 7240
21:09:43.339776 IP 10.0.0.3.5001 > 10.0.0.1.41646: Flags [.], ack 931984, win 3350, options [nop,nop,TS val 273797505 ecr 4187315606], length 0
21:09:43.339909 IP 10.0.0.1.41646 > 10.0.0.3.5001: Flags [P.], seq 931984:946464, ack 1, win 83, options [nop,nop,TS val 4187315606 ecr 273797505], length 14480
21:09:43.339973 IP 10.0.0.3.5001 > 10.0.0.1.41646: Flags [.], ack 946464, win 3407, options [nop,nop,TS val 273797505 ecr 4187315606], length 0
21:09:43.340017 IP 10.0.0.1.41646 > 10.0.0.3.5001: Flags [P.], seq 946464:960944, ack 1, win 83, options [nop,nop,TS val 4187315606 ecr 273797505], length 14480
21:09:43.340063 IP 10.0.0.3.5001 > 10.0.0.1.41646: Flags [.], ack 960944, win 3463, options [nop,nop,TS val 273797505 ecr 4187315606], length 0
21:09:43.340156 IP 10.0.0.1.41646 > 10.0.0.3.5001: Flags [P.], seq 960944:989904, ack 1, win 83, options [nop,nop,TS val 4187315607 ecr 273797505], length 28960
21:09:43.340221 IP 10.0.0.3.5001 > 10.0.0.1.41646: Flags [.], ack 989904, win 3576, options [nop,nop,TS val 273797506 ecr 4187315607], length 0
21:09:43.340250 IP 10.0.0.1.41646 > 10.0.0.3.5001: Flags [P.], seq 989904:997144, ack 1, win 83, options [nop,nop,TS val 4187315607 ecr 273797505], length 7240
21:09:43.340294 IP 10.0.0.3.5001 > 10.0.0.1.41646: Flags [.], ack 997144, win 3605, options [nop,nop,TS val 273797506 ecr 4187315607], length 0
21:09:43.340323 IP 10.0.0.1.41646 > 10.0.0.3.5001: Flags [P.], seq 997144:1018864, ack 1, win 83, options [nop,nop,TS val 4187315607 ecr 273797505], length 21720
21:09:43.340372 IP 10.0.0.3.5001 > 10.0.0.1.41646: Flags [.], ack 1018864, win 3690, options [nop,nop,TS val 273797506 ecr 4187315607], length 0
21:09:43.340472 IP 10.0.0.1.41646 > 10.0.0.3.5001: Flags [P.], seq 1018864:1048576, ack 1, win 83, options [nop,nop,TS val 4187315607 ecr 273797506], length 29712
21:09:43.340537 IP 10.0.0.3.5001 > 10.0.0.1.41646: Flags [.], ack 1048576, win 3806, options [nop,nop,TS val 273797506 ecr 4187315607], length 0
21:09:44.339594 IP 10.0.0.1.41646 > 10.0.0.3.5001: Flags [P.], seq 1048576:1055816, ack 1, win 83, options [nop,nop,TS val 4187316606 ecr 273797506], length 7240
21:09:44.339678 IP 10.0.0.3.5001 > 10.0.0.1.41646: Flags [.], ack 1055816, win 3834, options [nop,nop,TS val 273798505 ecr 4187316606], length 0
21:09:44.339816 IP 10.0.0.1.41646 > 10.0.0.3.5001: Flags [P.], seq 1055816:1063056, ack 1, win 83, options [nop,nop,TS val 4187316606 ecr 273797506], length 7240
21:09:44.339873 IP 10.0.0.3.5001 > 10.0.0.1.41646: Flags [.], ack 1063056, win 3862, options [nop,nop,TS val 273798505 ecr 4187316606], length 0
21:09:44.339980 IP 10.0.0.1.41646 > 10.0.0.3.5001: Flags [P.], seq 1063056:1077536, ack 1, win 83, options [nop,nop,TS val 4187316606 ecr 273798505], length 14480
21:09:44.340037 IP 10.0.0.3.5001 > 10.0.0.1.41646: Flags [.], ack 1077536, win 3919, options [nop,nop,TS val 273798505 ecr 4187316606], length 0
21:09:44.340066 IP 10.0.0.1.41646 > 10.0.0.3.5001: Flags [P.], seq 1077536:1092016, ack 1, win 83, options [nop,nop,TS val 4187316606 ecr 273798505], length 14480
21:09:44.340111 IP 10.0.0.3.5001 > 10.0.0.1.41646: Flags [.], ack 1092016, win 3975, options [nop,nop,TS val 273798506 ecr 4187316606], length 0
21:09:44.340200 IP 10.0.0.1.41646 > 10.0.0.3.5001: Flags [P.], seq 1092016:1113736, ack 1, win 83, options [nop,nop,TS val 4187316607 ecr 273798505], length 21720
21:09:44.340260 IP 10.0.0.3.5001 > 10.0.0.1.41646: Flags [.], ack 1113736, win 4060, options [nop,nop,TS val 273798506 ecr 4187316607], length 0
21:09:44.340341 IP 10.0.0.1.41646 > 10.0.0.3.5001: Flags [P.], seq 1113736:1128216, ack 1, win 83, options [nop,nop,TS val 4187316607 ecr 273798506], length 14480
21:09:44.340398 IP 10.0.0.3.5001 > 10.0.0.1.41646: Flags [.], ack 1128216, win 4117, options [nop,nop,TS val 273798506 ecr 4187316607], length 0
21:09:44.340427 IP 10.0.0.1.41646 > 10.0.0.3.5001: Flags [P.], seq 1128216:1149936, ack 1, win 83, options [nop,nop,TS val 4187316607 ecr 273798506], length 21720
21:09:44.340473 IP 10.0.0.3.5001 > 10.0.0.1.41646: Flags [.], ack 1149936, win 4202, options [nop,nop,TS val 273798506 ecr 4187316607], length 0
21:09:44.340562 IP 10.0.0.1.41646 > 10.0.0.3.5001: Flags [P.], seq 1149936:1179648, ack 1, win 83, options [nop,nop,TS val 4187316607 ecr 273798506], length 29712
21:09:44.340643 IP 10.0.0.3.5001 > 10.0.0.1.41646: Flags [.], ack 1179648, win 4318, options [nop,nop,TS val 273798506 ecr 4187316607], length 0
21:09:45.339547 IP 10.0.0.1.41646 > 10.0.0.3.5001: Flags [P.], seq 1179648:1186888, ack 1, win 83, options [nop,nop,TS val 4187317606 ecr 273798506], length 7240
21:09:45.339625 IP 10.0.0.3.5001 > 10.0.0.1.41646: Flags [.], ack 1186888, win 4346, options [nop,nop,TS val 273799505 ecr 4187317606], length 0
21:09:45.339720 IP 10.0.0.1.41646 > 10.0.0.3.5001: Flags [P.], seq 1186888:1194128, ack 1, win 83, options [nop,nop,TS val 4187317606 ecr 273798506], length 7240
21:09:45.339777 IP 10.0.0.3.5001 > 10.0.0.1.41646: Flags [.], ack 1194128, win 4374, options [nop,nop,TS val 273799505 ecr 4187317606], length 0
21:09:45.339884 IP 10.0.0.1.41646 > 10.0.0.3.5001: Flags [P.], seq 1194128:1208608, ack 1, win 83, options [nop,nop,TS val 4187317606 ecr 273799505], length 14480
21:09:45.339941 IP 10.0.0.3.5001 > 10.0.0.1.41646: Flags [.], ack 1208608, win 4431, options [nop,nop,TS val 273799505 ecr 4187317606], length 0
21:09:45.339969 IP 10.0.0.1.41646 > 10.0.0.3.5001: Flags [P.], seq 1208608:1223088, ack 1, win 83, options [nop,nop,TS val 4187317606 ecr 273799505], length 14480
21:09:45.340013 IP 10.0.0.3.5001 > 10.0.0.1.41646: Flags [.], ack 1223088, win 4487, options [nop,nop,TS val 273799505 ecr 4187317606], length 0
21:09:45.340103 IP 10.0.0.1.41646 > 10.0.0.3.5001: Flags [P.], seq 1223088:1252048, ack 1, win 83, options [nop,nop,TS val 4187317607 ecr 273799505], length 28960
21:09:45.340163 IP 10.0.0.3.5001 > 10.0.0.1.41646: Flags [.], ack 1252048, win 4600, options [nop,nop,TS val 273799506 ecr 4187317607], length 0
21:09:45.340191 IP 10.0.0.1.41646 > 10.0.0.3.5001: Flags [P.], seq 1252048:1259288, ack 1, win 83, options [nop,nop,TS val 4187317607 ecr 273799505], length 7240
21:09:45.340233 IP 10.0.0.3.5001 > 10.0.0.1.41646: Flags [.], ack 1259288, win 4629, options [nop,nop,TS val 273799506 ecr 4187317607], length 0
21:09:45.340261 IP 10.0.0.1.41646 > 10.0.0.3.5001: Flags [P.], seq 1259288:1281008, ack 1, win 83, options [nop,nop,TS val 4187317607 ecr 273799505], length 21720
21:09:45.340306 IP 10.0.0.3.5001 > 10.0.0.1.41646: Flags [.], ack 1281008, win 4714, options [nop,nop,TS val 273799506 ecr 4187317607], length 0
21:09:45.340402 IP 10.0.0.1.41646 > 10.0.0.3.5001: Flags [P.], seq 1281008:1310720, ack 1, win 83, options [nop,nop,TS val 4187317607 ecr 273799506], length 29712
21:09:45.340463 IP 10.0.0.3.5001 > 10.0.0.1.41646: Flags [.], ack 1310720, win 4830, options [nop,nop,TS val 273799506 ecr 4187317607], length 0
21:09:46.339544 IP 10.0.0.1.41646 > 10.0.0.3.5001: Flags [P.], seq 1310720:1317960, ack 1, win 83, options [nop,nop,TS val 4187318606 ecr 273799506], length 7240
21:09:46.339621 IP 10.0.0.3.5001 > 10.0.0.1.41646: Flags [.], ack 1317960, win 4858, options [nop,nop,TS val 273800505 ecr 4187318606], length 0
21:09:46.339735 IP 10.0.0.1.41646 > 10.0.0.3.5001: Flags [P.], seq 1317960:1325200, ack 1, win 83, options [nop,nop,TS val 4187318606 ecr 273799506], length 7240
21:09:46.339827 IP 10.0.0.3.5001 > 10.0.0.1.41646: Flags [.], ack 1325200, win 4882, options [nop,nop,TS val 273800505 ecr 4187318606], length 0
21:09:46.339936 IP 10.0.0.1.41646 > 10.0.0.3.5001: Flags [P.], seq 1325200:1339680, ack 1, win 83, options [nop,nop,TS val 4187318606 ecr 273800505], length 14480
21:09:46.339995 IP 10.0.0.3.5001 > 10.0.0.1.41646: Flags [.], ack 1339680, win 4875, options [nop,nop,TS val 273800505 ecr 4187318606], length 0
21:09:46.340024 IP 10.0.0.1.41646 > 10.0.0.3.5001: Flags [P.], seq 1339680:1354160, ack 1, win 83, options [nop,nop,TS val 4187318606 ecr 273800505], length 14480
21:09:46.340085 IP 10.0.0.3.5001 > 10.0.0.1.41646: Flags [.], ack 1354160, win 4860, options [nop,nop,TS val 273800506 ecr 4187318606], length 0
21:09:46.340173 IP 10.0.0.1.41646 > 10.0.0.3.5001: Flags [P.], seq 1354160:1375880, ack 1, win 83, options [nop,nop,TS val 4187318607 ecr 273800505], length 21720
21:09:46.340232 IP 10.0.0.3.5001 > 10.0.0.1.41646: Flags [.], ack 1375880, win 4868, options [nop,nop,TS val 273800506 ecr 4187318607], length 0
21:09:46.340313 IP 10.0.0.1.41646 > 10.0.0.3.5001: Flags [P.], seq 1375880:1390360, ack 1, win 83, options [nop,nop,TS val 4187318607 ecr 273800506], length 14480
21:09:46.340370 IP 10.0.0.3.5001 > 10.0.0.1.41646: Flags [.], ack 1390360, win 4875, options [nop,nop,TS val 273800506 ecr 4187318607], length 0
21:09:46.340399 IP 10.0.0.1.41646 > 10.0.0.3.5001: Flags [P.], seq 1390360:1412080, ack 1, win 83, options [nop,nop,TS val 4187318607 ecr 273800506], length 21720
21:09:46.340444 IP 10.0.0.3.5001 > 10.0.0.1.41646: Flags [.], ack 1412080, win 4852, options [nop,nop,TS val 273800506 ecr 4187318607], length 0
21:09:46.340533 IP 10.0.0.1.41646 > 10.0.0.3.5001: Flags [P.], seq 1412080:1441792, ack 1, win 83, options [nop,nop,TS val 4187318607 ecr 273800506], length 29712
21:09:46.340593 IP 10.0.0.3.5001 > 10.0.0.1.41646: Flags [.], ack 1441792, win 4860, options [nop,nop,TS val 273800506 ecr 4187318607], length 0
21:09:47.339547 IP 10.0.0.1.41646 > 10.0.0.3.5001: Flags [P.], seq 1441792:1449032, ack 1, win 83, options [nop,nop,TS val 4187319606 ecr 273800506], length 7240
21:09:47.339625 IP 10.0.0.3.5001 > 10.0.0.1.41646: Flags [.], ack 1449032, win 4882, options [nop,nop,TS val 273801505 ecr 4187319606], length 0
21:09:47.339720 IP 10.0.0.1.41646 > 10.0.0.3.5001: Flags [P.], seq 1449032:1456272, ack 1, win 83, options [nop,nop,TS val 4187319606 ecr 273800506], length 7240
21:09:47.339777 IP 10.0.0.3.5001 > 10.0.0.1.41646: Flags [.], ack 1456272, win 4882, options [nop,nop,TS val 273801505 ecr 4187319606], length 0
21:09:47.339884 IP 10.0.0.1.41646 > 10.0.0.3.5001: Flags [P.], seq 1456272:1470752, ack 1, win 83, options [nop,nop,TS val 4187319606 ecr 273801505], length 14480
21:09:47.339942 IP 10.0.0.3.5001 > 10.0.0.1.41646: Flags [.], ack 1470752, win 4875, options [nop,nop,TS val 273801505 ecr 4187319606], length 0
21:09:47.339970 IP 10.0.0.1.41646 > 10.0.0.3.5001: Flags [P.], seq 1470752:1485232, ack 1, win 83, options [nop,nop,TS val 4187319606 ecr 273801505], length 14480
21:09:47.340015 IP 10.0.0.3.5001 > 10.0.0.1.41646: Flags [.], ack 1485232, win 4860, options [nop,nop,TS val 273801505 ecr 4187319606], length 0
21:09:47.340106 IP 10.0.0.1.41646 > 10.0.0.3.5001: Flags [P.], seq 1485232:1514192, ack 1, win 83, options [nop,nop,TS val 4187319607 ecr 273801505], length 28960
21:09:47.340167 IP 10.0.0.3.5001 > 10.0.0.1.41646: Flags [.], ack 1514192, win 4861, options [nop,nop,TS val 273801506 ecr 4187319607], length 0
21:09:47.340195 IP 10.0.0.1.41646 > 10.0.0.3.5001: Flags [P.], seq 1514192:1521432, ack 1, win 83, options [nop,nop,TS val 4187319607 ecr 273801505], length 7240
21:09:47.340237 IP 10.0.0.3.5001 > 10.0.0.1.41646: Flags [.], ack 1521432, win 4852, options [nop,nop,TS val 273801506 ecr 4187319607], length 0
21:09:47.340265 IP 10.0.0.1.41646 > 10.0.0.3.5001: Flags [P.], seq 1521432:1543152, ack 1, win 83, options [nop,nop,TS val 4187319607 ecr 273801505], length 21720
21:09:47.340311 IP 10.0.0.3.5001 > 10.0.0.1.41646: Flags [.], ack 1543152, win 4830, options [nop,nop,TS val 273801506 ecr 4187319607], length 0
21:09:47.340408 IP 10.0.0.1.41646 > 10.0.0.3.5001: Flags [P.], seq 1543152:1572864, ack 1, win 83, options [nop,nop,TS val 4187319607 ecr 273801506], length 29712
21:09:47.340469 IP 10.0.0.3.5001 > 10.0.0.1.41646: Flags [.], ack 1572864, win 4860, options [nop,nop,TS val 273801506 ecr 4187319607], length 0
21:09:48.339541 IP 10.0.0.1.41646 > 10.0.0.3.5001: Flags [P.], seq 1572864:1580104, ack 1, win 83, options [nop,nop,TS val 4187320606 ecr 273801506], length 7240
21:09:48.339623 IP 10.0.0.3.5001 > 10.0.0.1.41646: Flags [.], ack 1580104, win 4882, options [nop,nop,TS val 273802505 ecr 4187320606], length 0
21:09:48.339721 IP 10.0.0.1.41646 > 10.0.0.3.5001: Flags [P.], seq 1580104:1587344, ack 1, win 83, options [nop,nop,TS val 4187320606 ecr 273801506], length 7240
21:09:48.339779 IP 10.0.0.3.5001 > 10.0.0.1.41646: Flags [.], ack 1587344, win 4882, options [nop,nop,TS val 273802505 ecr 4187320606], length 0
21:09:48.339890 IP 10.0.0.1.41646 > 10.0.0.3.5001: Flags [P.], seq 1587344:1601824, ack 1, win 83, options [nop,nop,TS val 4187320606 ecr 273802505], length 14480
21:09:48.339950 IP 10.0.0.3.5001 > 10.0.0.1.41646: Flags [.], ack 1601824, win 4875, options [nop,nop,TS val 273802505 ecr 4187320606], length 0
21:09:48.339979 IP 10.0.0.1.41646 > 10.0.0.3.5001: Flags [P.], seq 1601824:1616304, ack 1, win 83, options [nop,nop,TS val 4187320606 ecr 273802505], length 14480
21:09:48.340024 IP 10.0.0.3.5001 > 10.0.0.1.41646: Flags [.], ack 1616304, win 4860, options [nop,nop,TS val 273802505 ecr 4187320606], length 0
21:09:48.340117 IP 10.0.0.1.41646 > 10.0.0.3.5001: Flags [P.], seq 1616304:1645264, ack 1, win 83, options [nop,nop,TS val 4187320607 ecr 273802505], length 28960
21:09:48.340180 IP 10.0.0.3.5001 > 10.0.0.1.41646: Flags [.], ack 1645264, win 4861, options [nop,nop,TS val 273802506 ecr 4187320607], length 0
21:09:48.340208 IP 10.0.0.1.41646 > 10.0.0.3.5001: Flags [P.], seq 1645264:1652504, ack 1, win 83, options [nop,nop,TS val 4187320607 ecr 273802505], length 7240
21:09:48.340252 IP 10.0.0.3.5001 > 10.0.0.1.41646: Flags [.], ack 1652504, win 4852, options [nop,nop,TS val 273802506 ecr 4187320607], length 0
21:09:48.340281 IP 10.0.0.1.41646 > 10.0.0.3.5001: Flags [P.], seq 1652504:1674224, ack 1, win 83, options [nop,nop,TS val 4187320607 ecr 273802505], length 21720
21:09:48.340328 IP 10.0.0.3.5001 > 10.0.0.1.41646: Flags [.], ack 1674224, win 4830, options [nop,nop,TS val 273802506 ecr 4187320607], length 0
21:09:48.340428 IP 10.0.0.1.41646 > 10.0.0.3.5001: Flags [P.], seq 1674224:1703936, ack 1, win 83, options [nop,nop,TS val 4187320607 ecr 273802506], length 29712
21:09:48.340491 IP 10.0.0.3.5001 > 10.0.0.1.41646: Flags [.], ack 1703936, win 4860, options [nop,nop,TS val 273802506 ecr 4187320607], length 0
21:09:49.339544 IP 10.0.0.1.41646 > 10.0.0.3.5001: Flags [P.], seq 1703936:1711176, ack 1, win 83, options [nop,nop,TS val 4187321606 ecr 273802506], length 7240
21:09:49.339641 IP 10.0.0.3.5001 > 10.0.0.1.41646: Flags [.], ack 1711176, win 4882, options [nop,nop,TS val 273803505 ecr 4187321606], length 0
21:09:49.339789 IP 10.0.0.1.41646 > 10.0.0.3.5001: Flags [P.], seq 1711176:1718416, ack 1, win 83, options [nop,nop,TS val 4187321606 ecr 273802506], length 7240
21:09:49.339846 IP 10.0.0.3.5001 > 10.0.0.1.41646: Flags [.], ack 1718416, win 4882, options [nop,nop,TS val 273803505 ecr 4187321606], length 0
21:09:49.339953 IP 10.0.0.1.41646 > 10.0.0.3.5001: Flags [P.], seq 1718416:1732896, ack 1, win 83, options [nop,nop,TS val 4187321606 ecr 273803505], length 14480
21:09:49.340010 IP 10.0.0.3.5001 > 10.0.0.1.41646: Flags [.], ack 1732896, win 4875, options [nop,nop,TS val 273803505 ecr 4187321606], length 0
21:09:49.340038 IP 10.0.0.1.41646 > 10.0.0.3.5001: Flags [P.], seq 1732896:1747376, ack 1, win 83, options [nop,nop,TS val 4187321606 ecr 273803505], length 14480
21:09:49.340083 IP 10.0.0.3.5001 > 10.0.0.1.41646: Flags [.], ack 1747376, win 4860, options [nop,nop,TS val 273803506 ecr 4187321606], length 0
21:09:49.340171 IP 10.0.0.1.41646 > 10.0.0.3.5001: Flags [P.], seq 1747376:1769096, ack 1, win 83, options [nop,nop,TS val 4187321607 ecr 273803505], length 21720
21:09:49.340230 IP 10.0.0.3.5001 > 10.0.0.1.41646: Flags [.], ack 1769096, win 4868, options [nop,nop,TS val 273803506 ecr 4187321607], length 0
21:09:49.340312 IP 10.0.0.1.41646 > 10.0.0.3.5001: Flags [P.], seq 1769096:1783576, ack 1, win 83, options [nop,nop,TS val 4187321607 ecr 273803506], length 14480
21:09:49.340368 IP 10.0.0.3.5001 > 10.0.0.1.41646: Flags [.], ack 1783576, win 4875, options [nop,nop,TS val 273803506 ecr 4187321607], length 0
21:09:49.340397 IP 10.0.0.1.41646 > 10.0.0.3.5001: Flags [P.], seq 1783576:1805296, ack 1, win 83, options [nop,nop,TS val 4187321607 ecr 273803506], length 21720
21:09:49.340442 IP 10.0.0.3.5001 > 10.0.0.1.41646: Flags [.], ack 1805296, win 4852, options [nop,nop,TS val 273803506 ecr 4187321607], length 0
21:09:49.340530 IP 10.0.0.1.41646 > 10.0.0.3.5001: Flags [P.], seq 1805296:1835008, ack 1, win 83, options [nop,nop,TS val 4187321607 ecr 273803506], length 29712
21:09:49.340591 IP 10.0.0.3.5001 > 10.0.0.1.41646: Flags [.], ack 1835008, win 4860, options [nop,nop,TS val 273803506 ecr 4187321607], length 0
21:09:50.339538 IP 10.0.0.1.41646 > 10.0.0.3.5001: Flags [P.], seq 1835008:1842248, ack 1, win 83, options [nop,nop,TS val 4187322606 ecr 273803506], length 7240
21:09:50.339615 IP 10.0.0.3.5001 > 10.0.0.1.41646: Flags [.], ack 1842248, win 4882, options [nop,nop,TS val 273804505 ecr 4187322606], length 0
21:09:50.339713 IP 10.0.0.1.41646 > 10.0.0.3.5001: Flags [P.], seq 1842248:1849488, ack 1, win 83, options [nop,nop,TS val 4187322606 ecr 273803506], length 7240
21:09:50.339770 IP 10.0.0.3.5001 > 10.0.0.1.41646: Flags [.], ack 1849488, win 4882, options [nop,nop,TS val 273804505 ecr 4187322606], length 0
21:09:50.339879 IP 10.0.0.1.41646 > 10.0.0.3.5001: Flags [P.], seq 1849488:1863968, ack 1, win 83, options [nop,nop,TS val 4187322606 ecr 273804505], length 14480
21:09:50.339940 IP 10.0.0.3.5001 > 10.0.0.1.41646: Flags [.], ack 1863968, win 4875, options [nop,nop,TS val 273804505 ecr 4187322606], length 0
21:09:50.339969 IP 10.0.0.1.41646 > 10.0.0.3.5001: Flags [P.], seq 1863968:1878448, ack 1, win 83, options [nop,nop,TS val 4187322606 ecr 273804505], length 14480
21:09:50.340014 IP 10.0.0.3.5001 > 10.0.0.1.41646: Flags [.], ack 1878448, win 4860, options [nop,nop,TS val 273804505 ecr 4187322606], length 0
21:09:50.340107 IP 10.0.0.1.41646 > 10.0.0.3.5001: Flags [P.], seq 1878448:1907408, ack 1, win 83, options [nop,nop,TS val 4187322607 ecr 273804505], length 28960
21:09:50.340169 IP 10.0.0.3.5001 > 10.0.0.1.41646: Flags [.], ack 1907408, win 4861, options [nop,nop,TS val 273804506 ecr 4187322607], length 0
21:09:50.340197 IP 10.0.0.1.41646 > 10.0.0.3.5001: Flags [P.], seq 1907408:1914648, ack 1, win 83, options [nop,nop,TS val 4187322607 ecr 273804505], length 7240
21:09:50.340240 IP 10.0.0.3.5001 > 10.0.0.1.41646: Flags [.], ack 1914648, win 4852, options [nop,nop,TS val 273804506 ecr 4187322607], length 0
21:09:50.340269 IP 10.0.0.1.41646 > 10.0.0.3.5001: Flags [P.], seq 1914648:1936368, ack 1, win 83, options [nop,nop,TS val 4187322607 ecr 273804505], length 21720
21:09:50.340316 IP 10.0.0.3.5001 > 10.0.0.1.41646: Flags [.], ack 1936368, win 4830, options [nop,nop,TS val 273804506 ecr 4187322607], length 0
21:09:50.340415 IP 10.0.0.1.41646 > 10.0.0.3.5001: Flags [P.], seq 1936368:1966080, ack 1, win 83, options [nop,nop,TS val 4187322607 ecr 273804506], length 29712
21:09:50.340478 IP 10.0.0.3.5001 > 10.0.0.1.41646: Flags [.], ack 1966080, win 4860, options [nop,nop,TS val 273804506 ecr 4187322607], length 0
21:09:51.339548 IP 10.0.0.1.41646 > 10.0.0.3.5001: Flags [P.], seq 1966080:1973320, ack 1, win 83, options [nop,nop,TS val 4187323606 ecr 273804506], length 7240
21:09:51.339626 IP 10.0.0.3.5001 > 10.0.0.1.41646: Flags [.], ack 1973320, win 4882, options [nop,nop,TS val 273805505 ecr 4187323606], length 0
21:09:51.339721 IP 10.0.0.1.41646 > 10.0.0.3.5001: Flags [P.], seq 1973320:1980560, ack 1, win 83, options [nop,nop,TS val 4187323606 ecr 273804506], length 7240
21:09:51.339778 IP 10.0.0.3.5001 > 10.0.0.1.41646: Flags [.], ack 1980560, win 4882, options [nop,nop,TS val 273805505 ecr 4187323606], length 0
21:09:51.339885 IP 10.0.0.1.41646 > 10.0.0.3.5001: Flags [P.], seq 1980560:1995040, ack 1, win 83, options [nop,nop,TS val 4187323606 ecr 273805505], length 14480
21:09:51.339943 IP 10.0.0.3.5001 > 10.0.0.1.41646: Flags [.], ack 1995040, win 4875, options [nop,nop,TS val 273805505 ecr 4187323606], length 0
21:09:51.339971 IP 10.0.0.1.41646 > 10.0.0.3.5001: Flags [P.], seq 1995040:2009520, ack 1, win 83, options [nop,nop,TS val 4187323606 ecr 273805505], length 14480
21:09:51.340015 IP 10.0.0.3.5001 > 10.0.0.1.41646: Flags [.], ack 2009520, win 4860, options [nop,nop,TS val 273805505 ecr 4187323606], length 0
21:09:51.340105 IP 10.0.0.1.41646 > 10.0.0.3.5001: Flags [P.], seq 2009520:2038480, ack 1, win 83, options [nop,nop,TS val 4187323607 ecr 273805505], length 28960
21:09:51.340166 IP 10.0.0.3.5001 > 10.0.0.1.41646: Flags [.], ack 2038480, win 4861, options [nop,nop,TS val 273805506 ecr 4187323607], length 0
21:09:51.340194 IP 10.0.0.1.41646 > 10.0.0.3.5001: Flags [P.], seq 2038480:2045720, ack 1, win 83, options [nop,nop,TS val 4187323607 ecr 273805505], length 7240
21:09:51.340236 IP 10.0.0.3.5001 > 10.0.0.1.41646: Flags [.], ack 2045720, win 4852, options [nop,nop,TS val 273805506 ecr 4187323607], length 0
21:09:51.340264 IP 10.0.0.1.41646 > 10.0.0.3.5001: Flags [P.], seq 2045720:2067440, ack 1, win 83, options [nop,nop,TS val 4187323607 ecr 273805505], length 21720
21:09:51.340309 IP 10.0.0.3.5001 > 10.0.0.1.41646: Flags [.], ack 2067440, win 4830, options [nop,nop,TS val 273805506 ecr 4187323607], length 0
21:09:51.340406 IP 10.0.0.1.41646 > 10.0.0.3.5001: Flags [P.], seq 2067440:2097152, ack 1, win 83, options [nop,nop,TS val 4187323607 ecr 273805506], length 29712
21:09:51.340467 IP 10.0.0.3.5001 > 10.0.0.1.41646: Flags [.], ack 2097152, win 4860, options [nop,nop,TS val 273805506 ecr 4187323607], length 0
21:09:52.339548 IP 10.0.0.1.41646 > 10.0.0.3.5001: Flags [P.], seq 2097152:2104392, ack 1, win 83, options [nop,nop,TS val 4187324606 ecr 273805506], length 7240
21:09:52.339625 IP 10.0.0.3.5001 > 10.0.0.1.41646: Flags [.], ack 2104392, win 4882, options [nop,nop,TS val 273806505 ecr 4187324606], length 0
21:09:52.339720 IP 10.0.0.1.41646 > 10.0.0.3.5001: Flags [P.], seq 2104392:2111632, ack 1, win 83, options [nop,nop,TS val 4187324606 ecr 273805506], length 7240
21:09:52.339776 IP 10.0.0.3.5001 > 10.0.0.1.41646: Flags [.], ack 2111632, win 4882, options [nop,nop,TS val 273806505 ecr 4187324606], length 0
21:09:52.339883 IP 10.0.0.1.41646 > 10.0.0.3.5001: Flags [P.], seq 2111632:2126112, ack 1, win 83, options [nop,nop,TS val 4187324606 ecr 273806505], length 14480
21:09:52.339940 IP 10.0.0.3.5001 > 10.0.0.1.41646: Flags [.], ack 2126112, win 4875, options [nop,nop,TS val 273806505 ecr 4187324606], length 0
21:09:52.339968 IP 10.0.0.1.41646 > 10.0.0.3.5001: Flags [P.], seq 2126112:2140592, ack 1, win 83, options [nop,nop,TS val 4187324606 ecr 273806505], length 14480
21:09:52.340013 IP 10.0.0.3.5001 > 10.0.0.1.41646: Flags [.], ack 2140592, win 4860, options [nop,nop,TS val 273806505 ecr 4187324606], length 0
21:09:52.340103 IP 10.0.0.1.41646 > 10.0.0.3.5001: Flags [P.], seq 2140592:2169552, ack 1, win 83, options [nop,nop,TS val 4187324607 ecr 273806505], length 28960
21:09:52.340163 IP 10.0.0.3.5001 > 10.0.0.1.41646: Flags [.], ack 2169552, win 4861, options [nop,nop,TS val 273806506 ecr 4187324607], length 0
21:09:52.340191 IP 10.0.0.1.41646 > 10.0.0.3.5001: Flags [P.], seq 2169552:2176792, ack 1, win 83, options [nop,nop,TS val 4187324607 ecr 273806505], length 7240
21:09:52.340233 IP 10.0.0.3.5001 > 10.0.0.1.41646: Flags [.], ack 2176792, win 4852, options [nop,nop,TS val 273806506 ecr 4187324607], length 0
21:09:52.340261 IP 10.0.0.1.41646 > 10.0.0.3.5001: Flags [P.], seq 2176792:2198512, ack 1, win 83, options [nop,nop,TS val 4187324607 ecr 273806505], length 21720
21:09:52.340307 IP 10.0.0.3.5001 > 10.0.0.1.41646: Flags [.], ack 2198512, win 4830, options [nop,nop,TS val 273806506 ecr 4187324607], length 0
21:09:52.340403 IP 10.0.0.1.41646 > 10.0.0.3.5001: Flags [P.], seq 2198512:2228224, ack 1, win 83, options [nop,nop,TS val 4187324607 ecr 273806506], length 29712
21:09:52.340465 IP 10.0.0.3.5001 > 10.0.0.1.41646: Flags [.], ack 2228224, win 4860, options [nop,nop,TS val 273806506 ecr 4187324607], length 0
21:09:53.339537 IP 10.0.0.1.41646 > 10.0.0.3.5001: Flags [P.], seq 2228224:2235464, ack 1, win 83, options [nop,nop,TS val 4187325606 ecr 273806506], length 7240
21:09:53.339615 IP 10.0.0.3.5001 > 10.0.0.1.41646: Flags [.], ack 2235464, win 4882, options [nop,nop,TS val 273807505 ecr 4187325606], length 0
21:09:53.339708 IP 10.0.0.1.41646 > 10.0.0.3.5001: Flags [P.], seq 2235464:2242704, ack 1, win 83, options [nop,nop,TS val 4187325606 ecr 273806506], length 7240
21:09:53.339765 IP 10.0.0.3.5001 > 10.0.0.1.41646: Flags [.], ack 2242704, win 4882, options [nop,nop,TS val 273807505 ecr 4187325606], length 0
21:09:53.339871 IP 10.0.0.1.41646 > 10.0.0.3.5001: Flags [P.], seq 2242704:2257184, ack 1, win 83, options [nop,nop,TS val 4187325606 ecr 273807505], length 14480
21:09:53.339929 IP 10.0.0.3.5001 > 10.0.0.1.41646: Flags [.], ack 2257184, win 4875, options [nop,nop,TS val 273807505 ecr 4187325606], length 0
21:09:53.339957 IP 10.0.0.1.41646 > 10.0.0.3.5001: Flags [P.], seq 2257184:2271664, ack 1, win 83, options [nop,nop,TS val 4187325606 ecr 273807505], length 14480
21:09:53.340002 IP 10.0.0.3.5001 > 10.0.0.1.41646: Flags [.], ack 2271664, win 4860, options [nop,nop,TS val 273807505 ecr 4187325606], length 0
21:09:53.340091 IP 10.0.0.1.41646 > 10.0.0.3.5001: Flags [P.], seq 2271664:2300624, ack 1, win 83, options [nop,nop,TS val 4187325607 ecr 273807505], length 28960
21:09:53.340152 IP 10.0.0.3.5001 > 10.0.0.1.41646: Flags [.], ack 2300624, win 4861, options [nop,nop,TS val 273807506 ecr 4187325607], length 0
21:09:53.340179 IP 10.0.0.1.41646 > 10.0.0.3.5001: Flags [P.], seq 2300624:2307864, ack 1, win 83, options [nop,nop,TS val 4187325607 ecr 273807505], length 7240
21:09:53.340221 IP 10.0.0.3.5001 > 10.0.0.1.41646: Flags [.], ack 2307864, win 4852, options [nop,nop,TS val 273807506 ecr 4187325607], length 0
21:09:53.340249 IP 10.0.0.1.41646 > 10.0.0.3.5001: Flags [P.], seq 2307864:2329584, ack 1, win 83, options [nop,nop,TS val 4187325607 ecr 273807505], length 21720
21:09:53.340295 IP 10.0.0.3.5001 > 10.0.0.1.41646: Flags [.], ack 2329584, win 4830, options [nop,nop,TS val 273807506 ecr 4187325607], length 0
21:09:53.340390 IP 10.0.0.1.41646 > 10.0.0.3.5001: Flags [P.], seq 2329584:2359296, ack 1, win 83, options [nop,nop,TS val 4187325607 ecr 273807506], length 29712
21:09:53.340451 IP 10.0.0.3.5001 > 10.0.0.1.41646: Flags [.], ack 2359296, win 4860, options [nop,nop,TS val 273807506 ecr 4187325607], length 0
21:09:54.339547 IP 10.0.0.1.41646 > 10.0.0.3.5001: Flags [P.], seq 2359296:2366536, ack 1, win 83, options [nop,nop,TS val 4187326606 ecr 273807506], length 7240
21:09:54.339627 IP 10.0.0.3.5001 > 10.0.0.1.41646: Flags [.], ack 2366536, win 4882, options [nop,nop,TS val 273808505 ecr 4187326606], length 0
21:09:54.339722 IP 10.0.0.1.41646 > 10.0.0.3.5001: Flags [P.], seq 2366536:2373776, ack 1, win 83, options [nop,nop,TS val 4187326606 ecr 273807506], length 7240
21:09:54.339780 IP 10.0.0.3.5001 > 10.0.0.1.41646: Flags [.], ack 2373776, win 4882, options [nop,nop,TS val 273808505 ecr 4187326606], length 0
21:09:54.339889 IP 10.0.0.1.41646 > 10.0.0.3.5001: Flags [P.], seq 2373776:2388256, ack 1, win 83, options [nop,nop,TS val 4187326606 ecr 273808505], length 14480
21:09:54.339948 IP 10.0.0.3.5001 > 10.0.0.1.41646: Flags [.], ack 2388256, win 4875, options [nop,nop,TS val 273808505 ecr 4187326606], length 0
21:09:54.339977 IP 10.0.0.1.41646 > 10.0.0.3.5001: Flags [P.], seq 2388256:2402736, ack 1, win 83, options [nop,nop,TS val 4187326606 ecr 273808505], length 14480
21:09:54.340023 IP 10.0.0.3.5001 > 10.0.0.1.41646: Flags [.], ack 2402736, win 4860, options [nop,nop,TS val 273808505 ecr 4187326606], length 0
21:09:54.340115 IP 10.0.0.1.41646 > 10.0.0.3.5001: Flags [P.], seq 2402736:2431696, ack 1, win 83, options [nop,nop,TS val 4187326607 ecr 273808505], length 28960
21:09:54.340177 IP 10.0.0.3.5001 > 10.0.0.1.41646: Flags [.], ack 2431696, win 4861, options [nop,nop,TS val 273808506 ecr 4187326607], length 0
21:09:54.340205 IP 10.0.0.1.41646 > 10.0.0.3.5001: Flags [P.], seq 2431696:2438936, ack 1, win 83, options [nop,nop,TS val 4187326607 ecr 273808505], length 7240
21:09:54.340249 IP 10.0.0.3.5001 > 10.0.0.1.41646: Flags [.], ack 2438936, win 4852, options [nop,nop,TS val 273808506 ecr 4187326607], length 0
21:09:54.340277 IP 10.0.0.1.41646 > 10.0.0.3.5001: Flags [P.], seq 2438936:2460656, ack 1, win 83, options [nop,nop,TS val 4187326607 ecr 273808505], length 21720
21:09:54.340324 IP 10.0.0.3.5001 > 10.0.0.1.41646: Flags [.], ack 2460656, win 4830, options [nop,nop,TS val 273808506 ecr 4187326607], length 0
21:09:54.340422 IP 10.0.0.1.41646 > 10.0.0.3.5001: Flags [P.], seq 2460656:2490368, ack 1, win 83, options [nop,nop,TS val 4187326607 ecr 273808506], length 29712
21:09:54.340485 IP 10.0.0.3.5001 > 10.0.0.1.41646: Flags [.], ack 2490368, win 4860, options [nop,nop,TS val 273808506 ecr 4187326607], length 0
21:09:55.339543 IP 10.0.0.1.41646 > 10.0.0.3.5001: Flags [P.], seq 2490368:2497608, ack 1, win 83, options [nop,nop,TS val 4187327606 ecr 273808506], length 7240
21:09:55.339622 IP 10.0.0.3.5001 > 10.0.0.1.41646: Flags [.], ack 2497608, win 4882, options [nop,nop,TS val 273809505 ecr 4187327606], length 0
21:09:55.339732 IP 10.0.0.1.41646 > 10.0.0.3.5001: Flags [P.], seq 2497608:2504848, ack 1, win 83, options [nop,nop,TS val 4187327606 ecr 273808506], length 7240
21:09:55.339790 IP 10.0.0.3.5001 > 10.0.0.1.41646: Flags [.], ack 2504848, win 4882, options [nop,nop,TS val 273809505 ecr 4187327606], length 0
21:09:55.339900 IP 10.0.0.1.41646 > 10.0.0.3.5001: Flags [P.], seq 2504848:2519328, ack 1, win 83, options [nop,nop,TS val 4187327606 ecr 273809505], length 14480
21:09:55.339959 IP 10.0.0.3.5001 > 10.0.0.1.41646: Flags [.], ack 2519328, win 4875, options [nop,nop,TS val 273809505 ecr 4187327606], length 0
21:09:55.339988 IP 10.0.0.1.41646 > 10.0.0.3.5001: Flags [P.], seq 2519328:2533808, ack 1, win 83, options [nop,nop,TS val 4187327606 ecr 273809505], length 14480
21:09:55.340034 IP 10.0.0.3.5001 > 10.0.0.1.41646: Flags [.], ack 2533808, win 4860, options [nop,nop,TS val 273809505 ecr 4187327606], length 0
21:09:55.340126 IP 10.0.0.1.41646 > 10.0.0.3.5001: Flags [P.], seq 2533808:2562768, ack 1, win 83, options [nop,nop,TS val 4187327607 ecr 273809505], length 28960
21:09:55.340189 IP 10.0.0.3.5001 > 10.0.0.1.41646: Flags [.], ack 2562768, win 4861, options [nop,nop,TS val 273809506 ecr 4187327607], length 0
21:09:55.340217 IP 10.0.0.1.41646 > 10.0.0.3.5001: Flags [P.], seq 2562768:2570008, ack 1, win 83, options [nop,nop,TS val 4187327607 ecr 273809505], length 7240
21:09:55.340260 IP 10.0.0.3.5001 > 10.0.0.1.41646: Flags [.], ack 2570008, win 4852, options [nop,nop,TS val 273809506 ecr 4187327607], length 0
21:09:55.340289 IP 10.0.0.1.41646 > 10.0.0.3.5001: Flags [P.], seq 2570008:2591728, ack 1, win 83, options [nop,nop,TS val 4187327607 ecr 273809505], length 21720
21:09:55.340336 IP 10.0.0.3.5001 > 10.0.0.1.41646: Flags [.], ack 2591728, win 4830, options [nop,nop,TS val 273809506 ecr 4187327607], length 0
21:09:55.340435 IP 10.0.0.1.41646 > 10.0.0.3.5001: Flags [P.], seq 2591728:2621440, ack 1, win 83, options [nop,nop,TS val 4187327607 ecr 273809506], length 29712
21:09:55.340497 IP 10.0.0.3.5001 > 10.0.0.1.41646: Flags [.], ack 2621440, win 4860, options [nop,nop,TS val 273809506 ecr 4187327607], length 0
21:09:56.340417 IP 10.0.0.3.5001 > 10.0.0.1.41646: Flags [.], ack 2622888, win 4888, options [nop,nop,TS val 273810506 ecr 4187328606], length 0
21:09:56.340476 IP 10.0.0.3.5001 > 10.0.0.1.41646: Flags [.], ack 2624336, win 4886, options [nop,nop,TS val 273810506 ecr 4187328606], length 0
21:09:56.340543 IP 10.0.0.3.5001 > 10.0.0.1.41646: Flags [.], ack 2625784, win 4884, options [nop,nop,TS val 273810506 ecr 4187328606], length 0
21:09:56.340595 IP 10.0.0.3.5001 > 10.0.0.1.41646: Flags [.], ack 2627232, win 4882, options [nop,nop,TS val 273810506 ecr 4187328606], length 0
21:09:56.340666 IP 10.0.0.3.5001 > 10.0.0.1.41646: Flags [.], ack 2628680, win 4880, options [nop,nop,TS val 273810506 ecr 4187328606], length 0
21:09:56.340959 IP 10.0.0.3.5001 > 10.0.0.1.41646: Flags [.], ack 2635920, win 4882, options [nop,nop,TS val 273810506 ecr 4187328606], length 0
21:09:56.341129 IP 10.0.0.3.5001 > 10.0.0.1.41646: Flags [.], ack 2650400, win 4875, options [nop,nop,TS val 273810507 ecr 4187328608], length 0
21:09:56.341291 IP 10.0.0.3.5001 > 10.0.0.1.41646: Flags [.], ack 2664880, win 4860, options [nop,nop,TS val 273810507 ecr 4187328608], length 0
21:09:56.341465 IP 10.0.0.3.5001 > 10.0.0.1.41646: Flags [.], ack 2693840, win 4861, options [nop,nop,TS val 273810507 ecr 4187328608], length 0
21:09:56.341537 IP 10.0.0.3.5001 > 10.0.0.1.41646: Flags [.], ack 2701080, win 4852, options [nop,nop,TS val 273810507 ecr 4187328608], length 0
21:09:56.341613 IP 10.0.0.3.5001 > 10.0.0.1.41646: Flags [.], ack 2722800, win 4830, options [nop,nop,TS val 273810507 ecr 4187328608], length 0
21:09:56.341779 IP 10.0.0.3.5001 > 10.0.0.1.41646: Flags [.], ack 2752512, win 4860, options [nop,nop,TS val 273810507 ecr 4187328608], length 0
