21:10:06.339537 IP 10.0.0.1.41646 > 10.0.0.3.5001: Flags [P.], seq 3932160:3939400, ack 1, win 83, options [nop,nop,TS val 4187338606 ecr 273819506], length 7240
21:10:06.340887 IP 10.0.0.1.41646 > 10.0.0.3.5001: Flags [P.], seq 3939400:3946640, ack 1, win 83, options [nop,nop,TS val 4187338606 ecr 273819506], length 7240
21:10:06.341183 IP 10.0.0.1.41646 > 10.0.0.3.5001: Flags [P.], seq 3946640:3961120, ack 1, win 83, options [nop,nop,TS val 4187338608 ecr 273820506], length 14480
21:10:06.341272 IP 10.0.0.1.41646 > 10.0.0.3.5001: Flags [P.], seq 3961120:3975600, ack 1, win 83, options [nop,nop,TS val 4187338608 ecr 273820506], length 14480
21:10:06.341411 IP 10.0.0.1.41646 > 10.0.0.3.5001: Flags [P.], seq 3975600:4004560, ack 1, win 83, options [nop,nop,TS val 4187338608 ecr 273820507], length 28960
21:10:06.341503 IP 10.0.0.1.41646 > 10.0.0.3.5001: Flags [P.], seq 4004560:4011800, ack 1, win 83, options [nop,nop,TS val 4187338608 ecr 273820507], length 7240
21:10:06.341574 IP 10.0.0.1.41646 > 10.0.0.3.5001: Flags [P.], seq 4011800:4033520, ack 1, win 83, options [nop,nop,TS val 4187338608 ecr 273820507], length 21720
21:10:06.341720 IP 10.0.0.1.41646 > 10.0.0.3.5001: Flags [P.], seq 4033520:4063232, ack 1, win 83, options [nop,nop,TS val 4187338608 ecr 273820507], length 29712
21:10:07.339540 IP 10.0.0.1.41646 > 10.0.0.3.5001: Flags [P.], seq 4063232:4070472, ack 1, win 83, options [nop,nop,TS val 4187339606 ecr 273820507], length 7240
21:10:07.339717 IP 10.0.0.1.41646 > 10.0.0.3.5001: Flags [P.], seq 4070472:4077712, ack 1, win 83, options [nop,nop,TS val 4187339606 ecr 273820507], length 7240
21:10:07.339883 IP 10.0.0.1.41646 > 10.0.0.3.5001: Flags [P.], seq 4077712:4092192, ack 1, win 83, options [nop,nop,TS val 4187339606 ecr 273821505], length 14480
21:10:07.339970 IP 10.0.0.1.41646 > 10.0.0.3.5001: Flags [P.], seq 4092192:4106672, ack 1, win 83, options [nop,nop,TS val 4187339606 ecr 273821505], length 14480
21:10:07.340105 IP 10.0.0.1.41646 > 10.0.0.3.5001: Flags [P.], seq 4106672:4135632, ack 1, win 83, options [nop,nop,TS val 4187339607 ecr 273821505], length 28960
21:10:07.340194 IP 10.0.0.1.41646 > 10.0.0.3.5001: Flags [P.], seq 4135632:4142872, ack 1, win 83, options [nop,nop,TS val 4187339607 ecr 273821505], length 7240
21:10:07.340264 IP 10.0.0.1.41646 > 10.0.0.3.5001: Flags [P.], seq 4142872:4164592, ack 1, win 83, options [nop,nop,TS val 4187339607 ecr 273821505], length 21720
21:10:07.340423 IP 10.0.0.1.41646 > 10.0.0.3.5001: Flags [P.], seq 4164592:4194304, ack 1, win 83, options [nop,nop,TS val 4187339607 ecr 273821506], length 29712
21:10:08.339536 IP 10.0.0.1.41646 > 10.0.0.3.5001: Flags [P.], seq 4194304:4201544, ack 1, win 83, options [nop,nop,TS val 4187340606 ecr 273821506], length 7240
21:10:08.339876 IP 10.0.0.3.5001 > 10.0.0.1.41646: Flags [.], ack 4201544, win 4882, options [nop,nop,TS val 273822505 ecr 4187340606], length 0
21:10:08.340204 IP 10.0.0.1.41646 > 10.0.0.3.5001: Flags [P.], seq 4201544:4208784, ack 1, win 83, options [nop,nop,TS val 4187340606 ecr 273821506], length 7240
21:10:08.340263 IP 10.0.0.3.5001 > 10.0.0.1.41646: Flags [.], ack 4208784, win 4882, options [nop,nop,TS val 273822506 ecr 4187340606], length 0
21:10:08.340371 IP 10.0.0.1.41646 > 10.0.0.3.5001: Flags [P.], seq 4208784:4218920, ack 1, win 83, options [nop,nop,TS val 4187340607 ecr 273822505], length 10136
21:10:08.340428 IP 10.0.0.3.5001 > 10.0.0.1.41646: Flags [.], ack 4218920, win 4879, options [nop,nop,TS val 273822506 ecr 4187340607], length 0
21:10:08.340508 IP 10.0.0.1.41646 > 10.0.0.3.5001: Flags [P.], seq 4218920:4233400, ack 1, win 83, options [nop,nop,TS val 4187340607 ecr 273822506], length 14480
21:10:08.340565 IP 10.0.0.3.5001 > 10.0.0.1.41646: Flags [.], ack 4233400, win 4875, options [nop,nop,TS val 273822506 ecr 4187340607], length 0
21:10:08.340594 IP 10.0.0.1.41646 > 10.0.0.3.5001: Flags [P.], seq 4233400:4237744, ack 1, win 83, options [nop,nop,TS val 4187340607 ecr 273822506], length 4344
21:10:08.340635 IP 10.0.0.3.5001 > 10.0.0.1.41646: Flags [.], ack 4237744, win 4869, options [nop,nop,TS val 273822506 ecr 4187340607], length 0
21:10:08.340723 IP 10.0.0.1.41646 > 10.0.0.3.5001: Flags [P.], seq 4237744:4266704, ack 1, win 83, options [nop,nop,TS val 4187340607 ecr 273822506], length 28960
21:10:08.340784 IP 10.0.0.3.5001 > 10.0.0.1.41646: Flags [.], ack 4266704, win 4861, options [nop,nop,TS val 273822506 ecr 4187340607], length 0
21:10:08.340812 IP 10.0.0.1.41646 > 10.0.0.3.5001: Flags [P.], seq 4266704:4273944, ack 1, win 83, options [nop,nop,TS val 4187340607 ecr 273822506], length 7240
21:10:08.340874 IP 10.0.0.3.5001 > 10.0.0.1.41646: Flags [.], ack 4273944, win 4852, options [nop,nop,TS val 273822506 ecr 4187340607], length 0
21:10:08.341028 IP 10.0.0.1.41646 > 10.0.0.3.5001: Flags [P.], seq 4273944:4295664, ack 1, win 83, options [nop,nop,TS val 4187340607 ecr 273822506], length 21720
21:10:08.341095 IP 10.0.0.3.5001 > 10.0.0.1.41646: Flags [.], ack 4295664, win 4830, options [nop,nop,TS val 273822507 ecr 4187340607], length 0
21:10:08.341209 IP 10.0.0.1.41646 > 10.0.0.3.5001: Flags [P.], seq 4295664:4325376, ack 1, win 83, options [nop,nop,TS val 4187340608 ecr 273822506], length 29712
21:10:08.341269 IP 10.0.0.3.5001 > 10.0.0.1.41646: Flags [.], ack 4325376, win 4860, options [nop,nop,TS val 273822507 ecr 4187340608], length 0
21:10:09.339543 IP 10.0.0.1.41646 > 10.0.0.3.5001: Flags [P.], seq 4325376:4332616, ack 1, win 83, options [nop,nop,TS val 4187341606 ecr 273822507], length 7240
21:10:09.339626 IP 10.0.0.3.5001 > 10.0.0.1.41646: Flags [.], ack 4332616, win 4882, options [nop,nop,TS val 273823505 ecr 4187341606], length 0
21:10:09.339725 IP 10.0.0.1.41646 > 10.0.0.3.5001: Flags [P.], seq 4332616:4339856, ack 1, win 83, options [nop,nop,TS val 4187341606 ecr 273822507], length 7240
21:10:09.339783 IP 10.0.0.3.5001 > 10.0.0.1.41646: Flags [.], ack 4339856, win 4882, options [nop,nop,TS val 273823505 ecr 4187341606], length 0
21:10:09.339893 IP 10.0.0.1.41646 > 10.0.0.3.5001: Flags [P.], seq 4339856:4354336, ack 1, win 83, options [nop,nop,TS val 4187341606 ecr 273823505], length 14480
21:10:09.339952 IP 10.0.0.3.5001 > 10.0.0.1.41646: Flags [.], ack 4354336, win 4875, options [nop,nop,TS val 273823505 ecr 4187341606], length 0
21:10:09.339982 IP 10.0.0.1.41646 > 10.0.0.3.5001: Flags [P.], seq 4354336:4368816, ack 1, win 83, options [nop,nop,TS val 4187341606 ecr 273823505], length 14480
21:10:09.340027 IP 10.0.0.3.5001 > 10.0.0.1.41646: Flags [.], ack 4368816, win 4860, options [nop,nop,TS val 273823505 ecr 4187341606], length 0
21:10:09.340120 IP 10.0.0.1.41646 > 10.0.0.3.5001: Flags [P.], seq 4368816:4397776, ack 1, win 83, options [nop,nop,TS val 4187341607 ecr 273823505], length 28960
21:10:09.340182 IP 10.0.0.3.5001 > 10.0.0.1.41646: Flags [.], ack 4397776, win 4861, options [nop,nop,TS val 273823506 ecr 4187341607], length 0
21:10:09.340210 IP 10.0.0.1.41646 > 10.0.0.3.5001: Flags [P.], seq 4397776:4405016, ack 1, win 83, options [nop,nop,TS val 4187341607 ecr 273823505], length 7240
21:10:09.340254 IP 10.0.0.3.5001 > 10.0.0.1.41646: Flags [.], ack 4405016, win 4852, options [nop,nop,TS val 273823506 ecr 4187341607], length 0
21:10:09.340283 IP 10.0.0.1.41646 > 10.0.0.3.5001: Flags [P.], seq 4405016:4426736, ack 1, win 83, options [nop,nop,TS val 4187341607 ecr 273823505], length 21720
21:10:09.340329 IP 10.0.0.3.5001 > 10.0.0.1.41646: Flags [.], ack 4426736, win 4830, options [nop,nop,TS val 273823506 ecr 4187341607], length 0
21:10:09.340429 IP 10.0.0.1.41646 > 10.0.0.3.5001: Flags [P.], seq 4426736:4456448, ack 1, win 83, options [nop,nop,TS val 4187341607 ecr 273823506], length 29712
21:10:09.340491 IP 10.0.0.3.5001 > 10.0.0.1.41646: Flags [.], ack 4456448, win 4860, options [nop,nop,TS val 273823506 ecr 4187341607], length 0
21:10:10.339541 IP 10.0.0.1.41646 > 10.0.0.3.5001: Flags [P.], seq 4456448:4463688, ack 1, win 83, options [nop,nop,TS val 4187342606 ecr 273823506], length 7240
21:10:10.339622 IP 10.0.0.3.5001 > 10.0.0.1.41646: Flags [.], ack 4463688, win 4882, options [nop,nop,TS val 273824505 ecr 4187342606], length 0
21:10:10.339719 IP 10.0.0.1.41646 > 10.0.0.3.5001: Flags [P.], seq 4463688:4470928, ack 1, win 83, options [nop,nop,TS val 4187342606 ecr 273823506], length 7240
21:10:10.339776 IP 10.0.0.3.5001 > 10.0.0.1.41646: Flags [.], ack 4470928, win 4882, options [nop,nop,TS val 273824505 ecr 4187342606], length 0
21:10:10.339885 IP 10.0.0.1.41646 > 10.0.0.3.5001: Flags [P.], seq 4470928:4485408, ack 1, win 83, options [nop,nop,TS val 4187342606 ecr 273824505], length 14480
21:10:10.339944 IP 10.0.0.3.5001 > 10.0.0.1.41646: Flags [.], ack 4485408, win 4875, options [nop,nop,TS val 273824505 ecr 4187342606], length 0
21:10:10.339972 IP 10.0.0.1.41646 > 10.0.0.3.5001: Flags [P.], seq 4485408:4499888, ack 1, win 83, options [nop,nop,TS val 4187342606 ecr 273824505], length 14480
21:10:10.340018 IP 10.0.0.3.5001 > 10.0.0.1.41646: Flags [.], ack 4499888, win 4860, options [nop,nop,TS val 273824505 ecr 4187342606], length 0
21:10:10.340110 IP 10.0.0.1.41646 > 10.0.0.3.5001: Flags [P.], seq 4499888:4528848, ack 1, win 83, options [nop,nop,TS val 4187342607 ecr 273824505], length 28960
21:10:10.340171 IP 10.0.0.3.5001 > 10.0.0.1.41646: Flags [.], ack 4528848, win 4861, options [nop,nop,TS val 273824506 ecr 4187342607], length 0
21:10:10.340199 IP 10.0.0.1.41646 > 10.0.0.3.5001: Flags [P.], seq 4528848:4536088, ack 1, win 83, options [nop,nop,TS val 4187342607 ecr 273824505], length 7240
21:10:10.340243 IP 10.0.0.3.5001 > 10.0.0.1.41646: Flags [.], ack 4536088, win 4852, options [nop,nop,TS val 273824506 ecr 4187342607], length 0
21:10:10.340274 IP 10.0.0.1.41646 > 10.0.0.3.5001: Flags [P.], seq 4536088:4557808, ack 1, win 83, options [nop,nop,TS val 4187342607 ecr 273824505], length 21720
21:10:10.340320 IP 10.0.0.3.5001 > 10.0.0.1.41646: Flags [.], ack 4557808, win 4830, options [nop,nop,TS val 273824506 ecr 4187342607], length 0
21:10:10.340419 IP 10.0.0.1.41646 > 10.0.0.3.5001: Flags [P.], seq 4557808:4587520, ack 1, win 83, options [nop,nop,TS val 4187342607 ecr 273824506], length 29712
21:10:10.340482 IP 10.0.0.3.5001 > 10.0.0.1.41646: Flags [.], ack 4587520, win 4860, options [nop,nop,TS val 273824506 ecr 4187342607], length 0
21:10:11.339547 IP 10.0.0.1.41646 > 10.0.0.3.5001: Flags [P.], seq 4587520:4594760, ack 1, win 83, options [nop,nop,TS val 4187343606 ecr 273824506], length 7240
21:10:11.339628 IP 10.0.0.3.5001 > 10.0.0.1.41646: Flags [.], ack 4594760, win 4882, options [nop,nop,TS val 273825505 ecr 4187343606], length 0
21:10:11.339727 IP 10.0.0.1.41646 > 10.0.0.3.5001: Flags [P.], seq 4594760:4602000, ack 1, win 83, options [nop,nop,TS val 4187343606 ecr 273824506], length 7240
21:10:11.339785 IP 10.0.0.3.5001 > 10.0.0.1.41646: Flags [.], ack 4602000, win 4882, options [nop,nop,TS val 273825505 ecr 4187343606], length 0
21:10:11.339895 IP 10.0.0.1.41646 > 10.0.0.3.5001: Flags [P.], seq 4602000:4616480, ack 1, win 83, options [nop,nop,TS val 4187343606 ecr 273825505], length 14480
21:10:11.339955 IP 10.0.0.3.5001 > 10.0.0.1.41646: Flags [.], ack 4616480, win 4875, options [nop,nop,TS val 273825505 ecr 4187343606], length 0
21:10:11.339984 IP 10.0.0.1.41646 > 10.0.0.3.5001: Flags [P.], seq 4616480:4630960, ack 1, win 83, options [nop,nop,TS val 4187343606 ecr 273825505], length 14480
21:10:11.340030 IP 10.0.0.3.5001 > 10.0.0.1.41646: Flags [.], ack 4630960, win 4860, options [nop,nop,TS val 273825505 ecr 4187343606], length 0
21:10:11.340123 IP 10.0.0.1.41646 > 10.0.0.3.5001: Flags [P.], seq 4630960:4659920, ack 1, win 83, options [nop,nop,TS val 4187343607 ecr 273825505], length 28960
21:10:11.340185 IP 10.0.0.3.5001 > 10.0.0.1.41646: Flags [.], ack 4659920, win 4861, options [nop,nop,TS val 273825506 ecr 4187343607], length 0
21:10:11.340214 IP 10.0.0.1.41646 > 10.0.0.3.5001: Flags [P.], seq 4659920:4667160, ack 1, win 83, options [nop,nop,TS val 4187343607 ecr 273825505], length 7240
21:10:11.340257 IP 10.0.0.3.5001 > 10.0.0.1.41646: Flags [.], ack 4667160, win 4852, options [nop,nop,TS val 273825506 ecr 4187343607], length 0
21:10:11.340286 IP 10.0.0.1.41646 > 10.0.0.3.5001: Flags [P.], seq 4667160:4688880, ack 1, win 83, options [nop,nop,TS val 4187343607 ecr 273825505], length 21720
21:10:11.340333 IP 10.0.0.3.5001 > 10.0.0.1.41646: Flags [.], ack 4688880, win 4830, options [nop,nop,TS val 273825506 ecr 4187343607], length 0
21:10:11.340432 IP 10.0.0.1.41646 > 10.0.0.3.5001: Flags [P.], seq 4688880:4718592, ack 1, win 83, options [nop,nop,TS val 4187343607 ecr 273825506], length 29712
21:10:11.340495 IP 10.0.0.3.5001 > 10.0.0.1.41646: Flags [.], ack 4718592, win 4860, options [nop,nop,TS val 273825506 ecr 4187343607], length 0
21:10:12.339535 IP 10.0.0.1.41646 > 10.0.0.3.5001: Flags [P.], seq 4718592:4725832, ack 1, win 83, options [nop,nop,TS val 4187344606 ecr 273825506], length 7240
21:10:12.339612 IP 10.0.0.3.5001 > 10.0.0.1.41646: Flags [.], ack 4725832, win 4882, options [nop,nop,TS val 273826505 ecr 4187344606], length 0
21:10:12.339706 IP 10.0.0.1.41646 > 10.0.0.3.5001: Flags [P.], seq 4725832:4733072, ack 1, win 83, options [nop,nop,TS val 4187344606 ecr 273825506], length 7240
21:10:12.339763 IP 10.0.0.3.5001 > 10.0.0.1.41646: Flags [.], ack 4733072, win 4882, options [nop,nop,TS val 273826505 ecr 4187344606], length 0
21:10:12.339871 IP 10.0.0.1.41646 > 10.0.0.3.5001: Flags [P.], seq 4733072:4747552, ack 1, win 83, options [nop,nop,TS val 4187344606 ecr 273826505], length 14480
21:10:12.339929 IP 10.0.0.3.5001 > 10.0.0.1.41646: Flags [.], ack 4747552, win 4875, options [nop,nop,TS val 273826505 ecr 4187344606], length 0
21:10:12.339958 IP 10.0.0.1.41646 > 10.0.0.3.5001: Flags [P.], seq 4747552:4762032, ack 1, win 83, options [nop,nop,TS val 4187344606 ecr 273826505], length 14480
21:10:12.340002 IP 10.0.0.3.5001 > 10.0.0.1.41646: Flags [.], ack 4762032, win 4860, options [nop,nop,TS val 273826505 ecr 4187344606], length 0
21:10:12.340094 IP 10.0.0.1.41646 > 10.0.0.3.5001: Flags [P.], seq 4762032:4790992, ack 1, win 83, options [nop,nop,TS val 4187344607 ecr 273826505], length 28960
21:10:12.340156 IP 10.0.0.3.5001 > 10.0.0.1.41646: Flags [.], ack 4790992, win 4861, options [nop,nop,TS val 273826506 ecr 4187344607], length 0
21:10:12.340184 IP 10.0.0.1.41646 > 10.0.0.3.5001: Flags [P.], seq 4790992:4798232, ack 1, win 83, options [nop,nop,TS val 4187344607 ecr 273826505], length 7240
21:10:12.340227 IP 10.0.0.3.5001 > 10.0.0.1.41646: Flags [.], ack 4798232, win 4852, options [nop,nop,TS val 273826506 ecr 4187344607], length 0
21:10:12.340256 IP 10.0.0.1.41646 > 10.0.0.3.5001: Flags [P.], seq 4798232:4819952, ack 1, win 83, options [nop,nop,TS val 4187344607 ecr 273826505], length 21720
21:10:12.340302 IP 10.0.0.3.5001 > 10.0.0.1.41646: Flags [.], ack 4819952, win 4830, options [nop,nop,TS val 273826506 ecr 4187344607], length 0
21:10:12.340401 IP 10.0.0.1.41646 > 10.0.0.3.5001: Flags [P.], seq 4819952:4849664, ack 1, win 83, options [nop,nop,TS val 4187344607 ecr 273826506], length 29712
21:10:12.340463 IP 10.0.0.3.5001 > 10.0.0.1.41646: Flags [.], ack 4849664, win 4860, options [nop,nop,TS val 273826506 ecr 4187344607], length 0
21:10:13.339541 IP 10.0.0.1.41646 > 10.0.0.3.5001: Flags [P.], seq 4849664:4856904, ack 1, win 83, options [nop,nop,TS val 4187345606 ecr 273826506], length 7240
21:10:13.339656 IP 10.0.0.3.5001 > 10.0.0.1.41646: Flags [.], ack 4856904, win 4882, options [nop,nop,TS val 273827505 ecr 4187345606], length 0
21:10:13.339755 IP 10.0.0.1.41646 > 10.0.0.3.5001: Flags [P.], seq 4856904:4864144, ack 1, win 83, options [nop,nop,TS val 4187345606 ecr 273826506], length 7240
21:10:13.339814 IP 10.0.0.3.5001 > 10.0.0.1.41646: Flags [.], ack 4864144, win 4882, options [nop,nop,TS val 273827505 ecr 4187345606], length 0
21:10:13.339924 IP 10.0.0.1.41646 > 10.0.0.3.5001: Flags [P.], seq 4864144:4878624, ack 1, win 83, options [nop,nop,TS val 4187345606 ecr 273827505], length 14480
21:10:13.339984 IP 10.0.0.3.5001 > 10.0.0.1.41646: Flags [.], ack 4878624, win 4875, options [nop,nop,TS val 273827505 ecr 4187345606], length 0
21:10:13.340012 IP 10.0.0.1.41646 > 10.0.0.3.5001: Flags [P.], seq 4878624:4893104, ack 1, win 83, options [nop,nop,TS val 4187345606 ecr 273827505], length 14480
21:10:13.340058 IP 10.0.0.3.5001 > 10.0.0.1.41646: Flags [.], ack 4893104, win 4860, options [nop,nop,TS val 273827505 ecr 4187345606], length 0
21:10:13.340151 IP 10.0.0.1.41646 > 10.0.0.3.5001: Flags [P.], seq 4893104:4922064, ack 1, win 83, options [nop,nop,TS val 4187345607 ecr 273827505], length 28960
21:10:13.340213 IP 10.0.0.3.5001 > 10.0.0.1.41646: Flags [.], ack 4922064, win 4861, options [nop,nop,TS val 273827506 ecr 4187345607], length 0
21:10:13.340242 IP 10.0.0.1.41646 > 10.0.0.3.5001: Flags [P.], seq 4922064:4929304, ack 1, win 83, options [nop,nop,TS val 4187345607 ecr 273827505], length 7240
21:10:13.340285 IP 10.0.0.3.5001 > 10.0.0.1.41646: Flags [.], ack 4929304, win 4852, options [nop,nop,TS val 273827506 ecr 4187345607], length 0
21:10:13.340314 IP 10.0.0.1.41646 > 10.0.0.3.5001: Flags [P.], seq 4929304:4951024, ack 1, win 83, options [nop,nop,TS val 4187345607 ecr 273827505], length 21720
21:10:13.340361 IP 10.0.0.3.5001 > 10.0.0.1.41646: Flags [.], ack 4951024, win 4830, options [nop,nop,TS val 273827506 ecr 4187345607], length 0
21:10:13.340459 IP 10.0.0.1.41646 > 10.0.0.3.5001: Flags [P.], seq 4951024:4980736, ack 1, win 83, options [nop,nop,TS val 4187345607 ecr 273827506], length 29712
21:10:13.340523 IP 10.0.0.3.5001 > 10.0.0.1.41646: Flags [.], ack 4980736, win 4860, options [nop,nop,TS val 273827506 ecr 4187345607], length 0
21:10:14.339540 IP 10.0.0.1.41646 > 10.0.0.3.5001: Flags [P.], seq 4980736:4987976, ack 1, win 83, options [nop,nop,TS val 4187346606 ecr 273827506], length 7240
21:10:14.339620 IP 10.0.0.3.5001 > 10.0.0.1.41646: Flags [.], ack 4987976, win 4882, options [nop,nop,TS val 273828505 ecr 4187346606], length 0
21:10:14.339715 IP 10.0.0.1.41646 > 10.0.0.3.5001: Flags [P.], seq 4987976:4995216, ack 1, win 83, options [nop,nop,TS val 4187346606 ecr 273827506], length 7240
21:10:14.339773 IP 10.0.0.3.5001 > 10.0.0.1.41646: Flags [.], ack 4995216, win 4882, options [nop,nop,TS val 273828505 ecr 4187346606], length 0
21:10:14.339882 IP 10.0.0.1.41646 > 10.0.0.3.5001: Flags [P.], seq 4995216:5009696, ack 1, win 83, options [nop,nop,TS val 4187346606 ecr 273828505], length 14480
21:10:14.339941 IP 10.0.0.3.5001 > 10.0.0.1.41646: Flags [.], ack 5009696, win 4875, options [nop,nop,TS val 273828505 ecr 4187346606], length 0
21:10:14.339970 IP 10.0.0.1.41646 > 10.0.0.3.5001: Flags [P.], seq 5009696:5024176, ack 1, win 83, options [nop,nop,TS val 4187346606 ecr 273828505], length 14480
21:10:14.340015 IP 10.0.0.3.5001 > 10.0.0.1.41646: Flags [.], ack 5024176, win 4860, options [nop,nop,TS val 273828505 ecr 4187346606], length 0
21:10:14.340107 IP 10.0.0.1.41646 > 10.0.0.3.5001: Flags [P.], seq 5024176:5053136, ack 1, win 83, options [nop,nop,TS val 4187346607 ecr 273828505], length 28960
21:10:14.340169 IP 10.0.0.3.5001 > 10.0.0.1.41646: Flags [.], ack 5053136, win 4861, options [nop,nop,TS val 273828506 ecr 4187346607], length 0
21:10:14.340197 IP 10.0.0.1.41646 > 10.0.0.3.5001: Flags [P.], seq 5053136:5060376, ack 1, win 83, options [nop,nop,TS val 4187346607 ecr 273828505], length 7240
21:10:14.340240 IP 10.0.0.3.5001 > 10.0.0.1.41646: Flags [.], ack 5060376, win 4852, options [nop,nop,TS val 273828506 ecr 4187346607], length 0
21:10:14.340269 IP 10.0.0.1.41646 > 10.0.0.3.5001: Flags [P.], seq 5060376:5082096, ack 1, win 83, options [nop,nop,TS val 4187346607 ecr 273828505], length 21720
21:10:14.340316 IP 10.0.0.3.5001 > 10.0.0.1.41646: Flags [.], ack 5082096, win 4830, options [nop,nop,TS val 273828506 ecr 4187346607], length 0
21:10:14.340414 IP 10.0.0.1.41646 > 10.0.0.3.5001: Flags [P.], seq 5082096:5111808, ack 1, win 83, options [nop,nop,TS val 4187346607 ecr 273828506], length 29712
21:10:14.340477 IP 10.0.0.3.5001 > 10.0.0.1.41646: Flags [.], ack 5111808, win 4860, options [nop,nop,TS val 273828506 ecr 4187346607], length 0
21:10:15.339545 IP 10.0.0.1.41646 > 10.0.0.3.5001: Flags [P.], seq 5111808:5119048, ack 1, win 83, options [nop,nop,TS val 4187347606 ecr 273828506], length 7240
21:10:15.339626 IP 10.0.0.3.5001 > 10.0.0.1.41646: Flags [.], ack 5119048, win 4882, options [nop,nop,TS val 273829505 ecr 4187347606], length 0
21:10:15.339724 IP 10.0.0.1.41646 > 10.0.0.3.5001: Flags [P.], seq 5119048:5126288, ack 1, win 83, options [nop,nop,TS val 4187347606 ecr 273828506], length 7240
21:10:15.339782 IP 10.0.0.3.5001 > 10.0.0.1.41646: Flags [.], ack 5126288, win 4882, options [nop,nop,TS val 273829505 ecr 4187347606], length 0
21:10:15.339892 IP 10.0.0.1.41646 > 10.0.0.3.5001: Flags [P.], seq 5126288:5140768, ack 1, win 83, options [nop,nop,TS val 4187347606 ecr 273829505], length 14480
21:10:15.339952 IP 10.0.0.3.5001 > 10.0.0.1.41646: Flags [.], ack 5140768, win 4875, options [nop,nop,TS val 273829505 ecr 4187347606], length 0
21:10:15.339981 IP 10.0.0.1.41646 > 10.0.0.3.5001: Flags [P.], seq 5140768:5155248, ack 1, win 83, options [nop,nop,TS val 4187347606 ecr 273829505], length 14480
21:10:15.340027 IP 10.0.0.3.5001 > 10.0.0.1.41646: Flags [.], ack 5155248, win 4860, options [nop,nop,TS val 273829505 ecr 4187347606], length 0
21:10:15.340119 IP 10.0.0.1.41646 > 10.0.0.3.5001: Flags [P.], seq 5155248:5184208, ack 1, win 83, options [nop,nop,TS val 4187347607 ecr 273829505], length 28960
21:10:15.340183 IP 10.0.0.3.5001 > 10.0.0.1.41646: Flags [.], ack 5184208, win 4861, options [nop,nop,TS val 273829506 ecr 4187347607], length 0
21:10:15.340231 IP 10.0.0.1.41646 > 10.0.0.3.5001: Flags [P.], seq 5184208:5191448, ack 1, win 83, options [nop,nop,TS val 4187347607 ecr 273829505], length 7240
21:10:15.340310 IP 10.0.0.3.5001 > 10.0.0.1.41646: Flags [.], ack 5191448, win 4852, options [nop,nop,TS val 273829506 ecr 4187347607], length 0
21:10:15.340353 IP 10.0.0.1.41646 > 10.0.0.3.5001: Flags [P.], seq 5191448:5213168, ack 1, win 83, options [nop,nop,TS val 4187347607 ecr 273829505], length 21720
21:10:15.340437 IP 10.0.0.3.5001 > 10.0.0.1.41646: Flags [.], ack 5213168, win 4830, options [nop,nop,TS val 273829506 ecr 4187347607], length 0
21:10:15.340574 IP 10.0.0.1.41646 > 10.0.0.3.5001: Flags [P.], seq 5213168:5242880, ack 1, win 83, options [nop,nop,TS val 4187347607 ecr 273829506], length 29712
21:10:15.340640 IP 10.0.0.3.5001 > 10.0.0.1.41646: Flags [.], ack 5242880, win 4860, options [nop,nop,TS val 273829506 ecr 4187347607], length 0
21:10:16.339531 IP 10.0.0.1.41646 > 10.0.0.3.5001: Flags [P.], seq 5242880:5250120, ack 1, win 83, options [nop,nop,TS val 4187348606 ecr 273829506], length 7240
21:10:16.339609 IP 10.0.0.3.5001 > 10.0.0.1.41646: Flags [.], ack 5250120, win 4882, options [nop,nop,TS val 273830505 ecr 4187348606], length 0
21:10:16.339722 IP 10.0.0.1.41646 > 10.0.0.3.5001: Flags [P.], seq 5250120:5257360, ack 1, win 83, options [nop,nop,TS val 4187348606 ecr 273829506], length 7240
21:10:16.339894 IP 10.0.0.3.5001 > 10.0.0.1.41646: Flags [.], ack 5257360, win 4882, options [nop,nop,TS val 273830505 ecr 4187348606], length 0
21:10:16.340026 IP 10.0.0.1.41646 > 10.0.0.3.5001: Flags [P.], seq 5257360:5271840, ack 1, win 83, options [nop,nop,TS val 4187348606 ecr 273830505], length 14480
21:10:16.340100 IP 10.0.0.3.5001 > 10.0.0.1.41646: Flags [.], ack 5271840, win 4875, options [nop,nop,TS val 273830506 ecr 4187348606], length 0
21:10:16.340128 IP 10.0.0.1.41646 > 10.0.0.3.5001: Flags [P.], seq 5271840:5286320, ack 1, win 83, options [nop,nop,TS val 4187348606 ecr 273830505], length 14480
21:10:16.340173 IP 10.0.0.3.5001 > 10.0.0.1.41646: Flags [.], ack 5286320, win 4860, options [nop,nop,TS val 273830506 ecr 4187348606], length 0
21:10:16.340263 IP 10.0.0.1.41646 > 10.0.0.3.5001: Flags [P.], seq 5286320:5315280, ack 1, win 83, options [nop,nop,TS val 4187348607 ecr 273830506], length 28960
21:10:16.340324 IP 10.0.0.3.5001 > 10.0.0.1.41646: Flags [.], ack 5315280, win 4861, options [nop,nop,TS val 273830506 ecr 4187348607], length 0
21:10:16.340352 IP 10.0.0.1.41646 > 10.0.0.3.5001: Flags [P.], seq 5315280:5322520, ack 1, win 83, options [nop,nop,TS val 4187348607 ecr 273830506], length 7240
21:10:16.340394 IP 10.0.0.3.5001 > 10.0.0.1.41646: Flags [.], ack 5322520, win 4852, options [nop,nop,TS val 273830506 ecr 4187348607], length 0
21:10:16.340422 IP 10.0.0.1.41646 > 10.0.0.3.5001: Flags [P.], seq 5322520:5344240, ack 1, win 83, options [nop,nop,TS val 4187348607 ecr 273830506], length 21720
21:10:16.340468 IP 10.0.0.3.5001 > 10.0.0.1.41646: Flags [.], ack 5344240, win 4830, options [nop,nop,TS val 273830506 ecr 4187348607], length 0
21:10:16.340565 IP 10.0.0.1.41646 > 10.0.0.3.5001: Flags [P.], seq 5344240:5373952, ack 1, win 83, options [nop,nop,TS val 4187348607 ecr 273830506], length 29712
21:10:16.340625 IP 10.0.0.3.5001 > 10.0.0.1.41646: Flags [.], ack 5373952, win 4860, options [nop,nop,TS val 273830506 ecr 4187348607], length 0
21:10:16.361215 IP 10.0.0.1.41646 > 10.0.0.3.5001: Flags [F.], seq 5373952, ack 1, win 83, options [nop,nop,TS val 4187348628 ecr 273830506], length 0
21:10:16.370865 IP 10.0.0.3.5001 > 10.0.0.1.41646: Flags [F.], seq 1, ack 5373953, win 4888, options [nop,nop,TS val 273830536 ecr 4187348628], length 0
21:10:16.371235 IP 10.0.0.1.41646 > 10.0.0.3.5001: Flags [.], ack 2, win 83, options [nop,nop,TS val 4187348638 ecr 273830536], length 0

