01:16:46.866633 IP 10.0.1.10.45735 > 10.0.2.20.5002: UDP, length 1470
01:16:46.885448 IP 10.0.1.10.45735 > 10.0.2.20.5002: UDP, length 1470
01:16:46.906080 IP 10.0.1.10.45735 > 10.0.2.20.5002: UDP, length 1470
01:16:46.929016 IP 10.0.1.10.45735 > 10.0.2.20.5002: UDP, length 1470
01:16:46.951798 IP 10.0.1.10.45735 > 10.0.2.20.5002: UDP, length 1470
01:16:46.975220 IP 10.0.1.10.45735 > 10.0.2.20.5002: UDP, length 1470
01:16:46.997417 IP 10.0.1.10.45735 > 10.0.2.20.5002: UDP, length 1470
01:16:47.020697 IP 10.0.1.10.45735 > 10.0.2.20.5002: UDP, length 1470
01:16:47.043424 IP 10.0.1.10.45735 > 10.0.2.20.5002: UDP, length 1470
01:16:47.066720 IP 10.0.1.10.45735 > 10.0.2.20.5002: UDP, length 1470
01:16:47.090461 IP 10.0.1.10.45735 > 10.0.2.20.5002: UDP, length 1470
01:16:47.112444 IP 10.0.1.10.45735 > 10.0.2.20.5002: UDP, length 1470
01:16:47.136045 IP 10.0.1.10.45735 > 10.0.2.20.5002: UDP, length 1470
01:16:47.158138 IP 10.0.1.10.45735 > 10.0.2.20.5002: UDP, length 1470
01:16:47.181234 IP 10.0.1.10.45735 > 10.0.2.20.5002: UDP, length 1470
01:16:47.204547 IP 10.0.1.10.45735 > 10.0.2.20.5002: UDP, length 1470
01:16:47.227749 IP 10.0.1.10.45735 > 10.0.2.20.5002: UDP, length 1470
01:16:47.250316 IP 10.0.1.10.45735 > 10.0.2.20.5002: UDP, length 1470
01:16:47.274072 IP 10.0.1.10.45735 > 10.0.2.20.5002: UDP, length 1470
01:16:47.296943 IP 10.0.1.10.45735 > 10.0.2.20.5002: UDP, length 1470
01:16:47.318855 IP 10.0.1.10.45735 > 10.0.2.20.5002: UDP, length 1470
01:16:47.342048 IP 10.0.1.10.45735 > 10.0.2.20.5002: UDP, length 1470
01:16:47.365211 IP 10.0.1.10.45735 > 10.0.2.20.5002: UDP, length 1470
01:16:47.388090 IP 10.0.1.10.45735 > 10.0.2.20.5002: UDP, length 1470
01:16:47.410905 IP 10.0.1.10.45735 > 10.0.2.20.5002: UDP, length 1470
01:16:47.434380 IP 10.0.1.10.45735 > 10.0.2.20.5002: UDP, length 1470
01:16:47.457181 IP 10.0.1.10.45735 > 10.0.2.20.5002: UDP, length 1470
01:16:47.480075 IP 10.0.1.10.45735 > 10.0.2.20.5002: UDP, length 1470
01:16:47.502877 IP 10.0.1.10.45735 > 10.0.2.20.5002: UDP, length 1470
01:16:47.526129 IP 10.0.1.10.45735 > 10.0.2.20.5002: UDP, length 1470
01:16:47.548750 IP 10.0.1.10.45735 > 10.0.2.20.5002: UDP, length 1470
01:16:47.571618 IP 10.0.1.10.45735 > 10.0.2.20.5002: UDP, length 1470
01:16:47.594781 IP 10.0.1.10.45735 > 10.0.2.20.5002: UDP, length 1470
01:16:47.618119 IP 10.0.1.10.45735 > 10.0.2.20.5002: UDP, length 1470
01:16:47.641015 IP 10.0.1.10.45735 > 10.0.2.20.5002: UDP, length 1470
01:16:47.664324 IP 10.0.1.10.45735 > 10.0.2.20.5002: UDP, length 1470
01:16:47.687091 IP 10.0.1.10.45735 > 10.0.2.20.5002: UDP, length 1470
01:16:47.709650 IP 10.0.1.10.45735 > 10.0.2.20.5002: UDP, length 1470
01:16:47.733545 IP 10.0.1.10.45735 > 10.0.2.20.5002: UDP, length 1470
01:16:47.756280 IP 10.0.1.10.45735 > 10.0.2.20.5002: UDP, length 1470
01:16:47.779357 IP 10.0.1.10.45735 > 10.0.2.20.5002: UDP, length 1470
01:16:47.801448 IP 10.0.1.10.45735 > 10.0.2.20.5002: UDP, length 1470
01:16:47.824314 IP 10.0.1.10.45735 > 10.0.2.20.5002: UDP, length 1470
01:16:47.847264 IP 10.0.1.10.45735 > 10.0.2.20.5002: UDP, length 1470
01:16:47.870282 IP 10.0.1.10.45735 > 10.0.2.20.5002: UDP, length 1470
01:16:47.893646 IP 10.0.1.10.45735 > 10.0.2.20.5002: UDP, length 1470
01:16:47.917085 IP 10.0.1.10.45735 > 10.0.2.20.5002: UDP, length 1470
01:16:47.940268 IP 10.0.1.10.45735 > 10.0.2.20.5002: UDP, length 1470
01:16:47.962115 IP 10.0.1.10.45735 > 10.0.2.20.5002: UDP, length 1470
01:16:47.985291 IP 10.0.1.10.45735 > 10.0.2.20.5002: UDP, length 1470
01:16:48.008245 IP 10.0.1.10.45735 > 10.0.2.20.5002: UDP, length 1470
01:16:48.031185 IP 10.0.1.10.45735 > 10.0.2.20.5002: UDP, length 1470
01:16:48.054442 IP 10.0.1.10.45735 > 10.0.2.20.5002: UDP, length 1470
01:16:48.077379 IP 10.0.1.10.45735 > 10.0.2.20.5002: UDP, length 1470
01:16:48.100176 IP 10.0.1.10.45735 > 10.0.2.20.5002: UDP, length 1470
01:16:48.123015 IP 10.0.1.10.45735 > 10.0.2.20.5002: UDP, length 1470
01:16:48.146349 IP 10.0.1.10.45735 > 10.0.2.20.5002: UDP, length 1470
01:16:48.169718 IP 10.0.1.10.45735 > 10.0.2.20.5002: UDP, length 1470
01:16:48.191905 IP 10.0.1.10.45735 > 10.0.2.20.5002: UDP, length 1470
01:16:48.214671 IP 10.0.1.10.45735 > 10.0.2.20.5002: UDP, length 1470
01:16:48.238090 IP 10.0.1.10.45735 > 10.0.2.20.5002: UDP, length 1470
01:16:48.260968 IP 10.0.1.10.45735 > 10.0.2.20.5002: UDP, length 1470
01:16:48.283803 IP 10.0.1.10.45735 > 10.0.2.20.5002: UDP, length 1470
01:16:48.307641 IP 10.0.1.10.45735 > 10.0.2.20.5002: UDP, length 1470
01:16:48.329618 IP 10.0.1.10.45735 > 10.0.2.20.5002: UDP, length 1470
01:16:48.352819 IP 10.0.1.10.45735 > 10.0.2.20.5002: UDP, length 1470
01:16:48.376267 IP 10.0.1.10.45735 > 10.0.2.20.5002: UDP, length 1470
01:16:48.398813 IP 10.0.1.10.45735 > 10.0.2.20.5002: UDP, length 1470
01:16:48.421883 IP 10.0.1.10.45735 > 10.0.2.20.5002: UDP, length 1470
01:16:48.444630 IP 10.0.1.10.45735 > 10.0.2.20.5002: UDP, length 1470
01:16:48.467706 IP 10.0.1.10.45735 > 10.0.2.20.5002: UDP, length 1470
01:16:48.490283 IP 10.0.1.10.45735 > 10.0.2.20.5002: UDP, length 1470
01:16:48.513575 IP 10.0.1.10.45735 > 10.0.2.20.5002: UDP, length 1470
01:16:48.536581 IP 10.0.1.10.45735 > 10.0.2.20.5002: UDP, length 1470
01:16:48.560359 IP 10.0.1.10.45735 > 10.0.2.20.5002: UDP, length 1470
01:16:48.582672 IP 10.0.1.10.45735 > 10.0.2.20.5002: UDP, length 1470
01:16:48.606390 IP 10.0.1.10.45735 > 10.0.2.20.5002: UDP, length 1470
01:16:48.628442 IP 10.0.1.10.45735 > 10.0.2.20.5002: UDP, length 1470
01:16:48.651179 IP 10.0.1.10.45735 > 10.0.2.20.5002: UDP, length 1470
01:16:48.674048 IP 10.0.1.10.45735 > 10.0.2.20.5002: UDP, length 1470
01:16:48.697298 IP 10.0.1.10.45735 > 10.0.2.20.5002: UDP, length 1470
01:16:48.720285 IP 10.0.1.10.45735 > 10.0.2.20.5002: UDP, length 1470
01:16:48.743004 IP 10.0.1.10.45735 > 10.0.2.20.5002: UDP, length 1470
01:16:48.766769 IP 10.0.1.10.45735 > 10.0.2.20.5002: UDP, length 1470
01:16:48.789875 IP 10.0.1.10.45735 > 10.0.2.20.5002: UDP, length 1470
01:16:48.813120 IP 10.0.1.10.45735 > 10.0.2.20.5002: UDP, length 1470
01:16:48.835027 IP 10.0.1.10.45735 > 10.0.2.20.5002: UDP, length 1470
01:16:48.858034 IP 10.0.1.10.45735 > 10.0.2.20.5002: UDP, length 1470
01:16:48.881160 IP 10.0.1.10.45735 > 10.0.2.20.5002: UDP, length 1470
01:16:48.904716 IP 10.0.1.10.45735 > 10.0.2.20.5002: UDP, length 1470
01:16:48.926739 IP 10.0.1.10.45735 > 10.0.2.20.5002: UDP, length 1470
01:16:48.950471 IP 10.0.1.10.45735 > 10.0.2.20.5002: UDP, length 1470
01:16:48.973632 IP 10.0.1.10.45735 > 10.0.2.20.5002: UDP, length 1470
01:16:48.996784 IP 10.0.1.10.45735 > 10.0.2.20.5002: UDP, length 1470
01:16:49.018729 IP 10.0.1.10.45735 > 10.0.2.20.5002: UDP, length 1470
01:16:49.041684 IP 10.0.1.10.45735 > 10.0.2.20.5002: UDP, length 1470
01:16:49.064718 IP 10.0.1.10.45735 > 10.0.2.20.5002: UDP, length 1470
01:16:49.087715 IP 10.0.1.10.45735 > 10.0.2.20.5002: UDP, length 1470
01:16:49.110653 IP 10.0.1.10.45735 > 10.0.2.20.5002: UDP, length 1470
01:16:49.133863 IP 10.0.1.10.45735 > 10.0.2.20.5002: UDP, length 1470
01:16:49.156918 IP 10.0.1.10.45735 > 10.0.2.20.5002: UDP, length 1470
01:16:49.180538 IP 10.0.1.10.45735 > 10.0.2.20.5002: UDP, length 1470
01:16:49.202221 IP 10.0.1.10.45735 > 10.0.2.20.5002: UDP, length 1470
01:16:49.225385 IP 10.0.1.10.45735 > 10.0.2.20.5002: UDP, length 1470
01:16:49.248696 IP 10.0.1.10.45735 > 10.0.2.20.5002: UDP, length 1470
01:16:49.271433 IP 10.0.1.10.45735 > 10.0.2.20.5002: UDP, length 1470
01:16:49.295326 IP 10.0.1.10.45735 > 10.0.2.20.5002: UDP, length 1470
01:16:49.317613 IP 10.0.1.10.45735 > 10.0.2.20.5002: UDP, length 1470
01:16:49.340330 IP 10.0.1.10.45735 > 10.0.2.20.5002: UDP, length 1470
01:16:49.363225 IP 10.0.1.10.45735 > 10.0.2.20.5002: UDP, length 1470
01:16:49.386495 IP 10.0.1.10.45735 > 10.0.2.20.5002: UDP, length 1470
01:16:49.409496 IP 10.0.1.10.45735 > 10.0.2.20.5002: UDP, length 1470
01:16:49.432344 IP 10.0.1.10.45735 > 10.0.2.20.5002: UDP, length 1470
01:16:49.455894 IP 10.0.1.10.45735 > 10.0.2.20.5002: UDP, length 1470
01:16:49.479025 IP 10.0.1.10.45735 > 10.0.2.20.5002: UDP, length 1470
01:16:49.501875 IP 10.0.1.10.45735 > 10.0.2.20.5002: UDP, length 1470
01:16:49.524061 IP 10.0.1.10.45735 > 10.0.2.20.5002: UDP, length 1470
01:16:49.546949 IP 10.0.1.10.45735 > 10.0.2.20.5002: UDP, length 1470
01:16:49.570347 IP 10.0.1.10.45735 > 10.0.2.20.5002: UDP, length 1470
01:16:49.593220 IP 10.0.1.10.45735 > 10.0.2.20.5002: UDP, length 1470
01:16:49.616543 IP 10.0.1.10.45735 > 10.0.2.20.5002: UDP, length 1470
01:16:49.638677 IP 10.0.1.10.45735 > 10.0.2.20.5002: UDP, length 1470
01:16:49.662860 IP 10.0.1.10.45735 > 10.0.2.20.5002: UDP, length 1470
01:16:49.685842 IP 10.0.1.10.45735 > 10.0.2.20.5002: UDP, length 1470
01:16:49.708591 IP 10.0.1.10.45735 > 10.0.2.20.5002: UDP, length 1470
01:16:49.730747 IP 10.0.1.10.45735 > 10.0.2.20.5002: UDP, length 1470
01:16:49.753828 IP 10.0.1.10.45735 > 10.0.2.20.5002: UDP, length 1470
01:16:49.776932 IP 10.0.1.10.45735 > 10.0.2.20.5002: UDP, length 1470
01:16:49.799756 IP 10.0.1.10.45735 > 10.0.2.20.5002: UDP, length 1470
01:16:49.822617 IP 10.0.1.10.45735 > 10.0.2.20.5002: UDP, length 1470
01:16:49.846033 IP 10.0.1.10.45735 > 10.0.2.20.5002: UDP, length 1470
01:16:49.869881 IP 10.0.1.10.45735 > 10.0.2.20.5002: UDP, length 1470
01:16:49.891564 IP 10.0.1.10.45735 > 10.0.2.20.5002: UDP, length 1470
01:16:49.916171 IP 10.0.1.10.45735 > 10.0.2.20.5002: UDP, length 1470
01:16:49.938340 IP 10.0.1.10.45735 > 10.0.2.20.5002: UDP, length 1470
01:16:49.960481 IP 10.0.1.10.45735 > 10.0.2.20.5002: UDP, length 1470
01:16:49.983462 IP 10.0.1.10.45735 > 10.0.2.20.5002: UDP, length 1470
01:16:50.006508 IP 10.0.1.10.45735 > 10.0.2.20.5002: UDP, length 1470
01:16:50.029514 IP 10.0.1.10.45735 > 10.0.2.20.5002: UDP, length 1470
01:16:50.052487 IP 10.0.1.10.45735 > 10.0.2.20.5002: UDP, length 1470
01:16:50.076166 IP 10.0.1.10.45735 > 10.0.2.20.5002: UDP, length 1470
01:16:50.099052 IP 10.0.1.10.45735 > 10.0.2.20.5002: UDP, length 1470
01:16:50.122041 IP 10.0.1.10.45735 > 10.0.2.20.5002: UDP, length 1470
01:16:50.144981 IP 10.0.1.10.45735 > 10.0.2.20.5002: UDP, length 1470
01:16:50.167006 IP 10.0.1.10.45735 > 10.0.2.20.5002: UDP, length 1470
01:16:50.190363 IP 10.0.1.10.45735 > 10.0.2.20.5002: UDP, length 1470
01:16:50.213441 IP 10.0.1.10.45735 > 10.0.2.20.5002: UDP, length 1470
01:16:50.236203 IP 10.0.1.10.45735 > 10.0.2.20.5002: UDP, length 1470
01:16:50.259637 IP 10.0.1.10.45735 > 10.0.2.20.5002: UDP, length 1470
01:16:50.282425 IP 10.0.1.10.45735 > 10.0.2.20.5002: UDP, length 1470
01:16:50.305838 IP 10.0.1.10.45735 > 10.0.2.20.5002: UDP, length 1470
01:16:50.328515 IP 10.0.1.10.45735 > 10.0.2.20.5002: UDP, length 1470
01:16:50.351850 IP 10.0.1.10.45735 > 10.0.2.20.5002: UDP, length 1470
01:16:50.374649 IP 10.0.1.10.45735 > 10.0.2.20.5002: UDP, length 1470
01:16:50.396997 IP 10.0.1.10.45735 > 10.0.2.20.5002: UDP, length 1470
01:16:50.419974 IP 10.0.1.10.45735 > 10.0.2.20.5002: UDP, length 1470
01:16:50.442746 IP 10.0.1.10.45735 > 10.0.2.20.5002: UDP, length 1470
01:16:50.466133 IP 10.0.1.10.45735 > 10.0.2.20.5002: UDP, length 1470
01:16:50.489535 IP 10.0.1.10.45735 > 10.0.2.20.5002: UDP, length 1470
01:16:50.512318 IP 10.0.1.10.45735 > 10.0.2.20.5002: UDP, length 1470
01:16:50.535544 IP 10.0.1.10.45735 > 10.0.2.20.5002: UDP, length 1470
01:16:50.558761 IP 10.0.1.10.45735 > 10.0.2.20.5002: UDP, length 1470
01:16:50.580814 IP 10.0.1.10.45735 > 10.0.2.20.5002: UDP, length 1470
01:16:50.603729 IP 10.0.1.10.45735 > 10.0.2.20.5002: UDP, length 1470
01:16:50.626586 IP 10.0.1.10.45735 > 10.0.2.20.5002: UDP, length 1470
01:16:50.649890 IP 10.0.1.10.45735 > 10.0.2.20.5002: UDP, length 1470
01:16:50.672840 IP 10.0.1.10.45735 > 10.0.2.20.5002: UDP, length 1470
01:16:50.696072 IP 10.0.1.10.45735 > 10.0.2.20.5002: UDP, length 1470
01:16:50.718850 IP 10.0.1.10.45735 > 10.0.2.20.5002: UDP, length 1470
01:16:50.741645 IP 10.0.1.10.45735 > 10.0.2.20.5002: UDP, length 1470
01:16:50.765152 IP 10.0.1.10.45735 > 10.0.2.20.5002: UDP, length 1470
01:16:50.787647 IP 10.0.1.10.45735 > 10.0.2.20.5002: UDP, length 1470
01:16:50.810338 IP 10.0.1.10.45735 > 10.0.2.20.5002: UDP, length 1470
01:16:50.833434 IP 10.0.1.10.45735 > 10.0.2.20.5002: UDP, length 1470
01:16:50.856453 IP 10.0.1.10.45735 > 10.0.2.20.5002: UDP, length 1470
01:16:50.879020 IP 10.0.1.10.45735 > 10.0.2.20.5002: UDP, length 1470
01:16:50.902296 IP 10.0.1.10.45735 > 10.0.2.20.5002: UDP, length 1470
01:16:50.926045 IP 10.0.1.10.45735 > 10.0.2.20.5002: UDP, length 1470
01:16:50.948898 IP 10.0.1.10.45735 > 10.0.2.20.5002: UDP, length 1470
01:16:50.970807 IP 10.0.1.10.45735 > 10.0.2.20.5002: UDP, length 1470
01:16:50.994076 IP 10.0.1.10.45735 > 10.0.2.20.5002: UDP, length 1470
01:16:51.017092 IP 10.0.1.10.45735 > 10.0.2.20.5002: UDP, length 1470
01:16:51.039879 IP 10.0.1.10.45735 > 10.0.2.20.5002: UDP, length 1470
01:16:51.062912 IP 10.0.1.10.45735 > 10.0.2.20.5002: UDP, length 1470
01:16:51.086257 IP 10.0.1.10.45735 > 10.0.2.20.5002: UDP, length 1470
01:16:51.109429 IP 10.0.1.10.45735 > 10.0.2.20.5002: UDP, length 1470
01:16:51.132503 IP 10.0.1.10.45735 > 10.0.2.20.5002: UDP, length 1470
01:16:51.154789 IP 10.0.1.10.45735 > 10.0.2.20.5002: UDP, length 1470
01:16:51.178792 IP 10.0.1.10.45735 > 10.0.2.20.5002: UDP, length 1470
01:16:51.200786 IP 10.0.1.10.45735 > 10.0.2.20.5002: UDP, length 1470
01:16:51.223796 IP 10.0.1.10.45735 > 10.0.2.20.5002: UDP, length 1470
01:16:51.247250 IP 10.0.1.10.45735 > 10.0.2.20.5002: UDP, length 1470
01:16:51.270371 IP 10.0.1.10.45735 > 10.0.2.20.5002: UDP, length 1470
01:16:51.293608 IP 10.0.1.10.45735 > 10.0.2.20.5002: UDP, length 1470
01:16:51.315680 IP 10.0.1.10.45735 > 10.0.2.20.5002: UDP, length 1470
01:16:51.338667 IP 10.0.1.10.45735 > 10.0.2.20.5002: UDP, length 1470
01:16:51.361561 IP 10.0.1.10.45735 > 10.0.2.20.5002: UDP, length 1470
01:16:51.384545 IP 10.0.1.10.45735 > 10.0.2.20.5002: UDP, length 1470
01:16:51.407514 IP 10.0.1.10.45735 > 10.0.2.20.5002: UDP, length 1470
01:16:51.430590 IP 10.0.1.10.45735 > 10.0.2.20.5002: UDP, length 1470
01:16:51.454085 IP 10.0.1.10.45735 > 10.0.2.20.5002: UDP, length 1470
01:16:51.476585 IP 10.0.1.10.45735 > 10.0.2.20.5002: UDP, length 1470
01:16:51.500413 IP 10.0.1.10.45735 > 10.0.2.20.5002: UDP, length 1470
01:16:51.523373 IP 10.0.1.10.45735 > 10.0.2.20.5002: UDP, length 1470
01:16:51.545058 IP 10.0.1.10.45735 > 10.0.2.20.5002: UDP, length 1470
01:16:51.568232 IP 10.0.1.10.45735 > 10.0.2.20.5002: UDP, length 1470
01:16:51.591235 IP 10.0.1.10.45735 > 10.0.2.20.5002: UDP, length 1470
01:16:51.614560 IP 10.0.1.10.45735 > 10.0.2.20.5002: UDP, length 1470
01:16:51.637417 IP 10.0.1.10.45735 > 10.0.2.20.5002: UDP, length 1470
01:16:51.660779 IP 10.0.1.10.45735 > 10.0.2.20.5002: UDP, length 1470
01:16:51.683601 IP 10.0.1.10.45735 > 10.0.2.20.5002: UDP, length 1470
01:16:51.706981 IP 10.0.1.10.45735 > 10.0.2.20.5002: UDP, length 1470
01:16:51.730301 IP 10.0.1.10.45735 > 10.0.2.20.5002: UDP, length 1470
01:16:51.752726 IP 10.0.1.10.45735 > 10.0.2.20.5002: UDP, length 1470
01:16:51.775007 IP 10.0.1.10.45735 > 10.0.2.20.5002: UDP, length 1470
01:16:51.798069 IP 10.0.1.10.45735 > 10.0.2.20.5002: UDP, length 1470
01:16:51.821189 IP 10.0.1.10.45735 > 10.0.2.20.5002: UDP, length 1470
01:16:51.843953 IP 10.0.1.10.45735 > 10.0.2.20.5002: UDP, length 1470
01:16:51.866832 IP 10.0.1.10.45735 > 10.0.2.20.5002: UDP, length 1470
01:16:51.890112 IP 10.0.1.10.45735 > 10.0.2.20.5002: UDP, length 1470
01:16:51.913033 IP 10.0.1.10.45735 > 10.0.2.20.5002: UDP, length 1470
01:16:51.935895 IP 10.0.1.10.45735 > 10.0.2.20.5002: UDP, length 1470
01:16:51.958559 IP 10.0.1.10.45735 > 10.0.2.20.5002: UDP, length 1470
01:16:51.981894 IP 10.0.1.10.45735 > 10.0.2.20.5002: UDP, length 1470
01:16:52.005012 IP 10.0.1.10.45735 > 10.0.2.20.5002: UDP, length 1470
01:16:52.028287 IP 10.0.1.10.45735 > 10.0.2.20.5002: UDP, length 1470
01:16:52.050432 IP 10.0.1.10.45735 > 10.0.2.20.5002: UDP, length 1470
01:16:52.074571 IP 10.0.1.10.45735 > 10.0.2.20.5002: UDP, length 1470
01:16:52.096525 IP 10.0.1.10.45735 > 10.0.2.20.5002: UDP, length 1470
01:16:52.119552 IP 10.0.1.10.45735 > 10.0.2.20.5002: UDP, length 1470
01:16:52.142543 IP 10.0.1.10.45735 > 10.0.2.20.5002: UDP, length 1470
01:16:52.165752 IP 10.0.1.10.45735 > 10.0.2.20.5002: UDP, length 1470
01:16:52.188416 IP 10.0.1.10.45735 > 10.0.2.20.5002: UDP, length 1470
01:16:52.211366 IP 10.0.1.10.45735 > 10.0.2.20.5002: UDP, length 1470
01:16:52.235132 IP 10.0.1.10.45735 > 10.0.2.20.5002: UDP, length 1470
01:16:52.258215 IP 10.0.1.10.45735 > 10.0.2.20.5002: UDP, length 1470
01:16:52.280101 IP 10.0.1.10.45735 > 10.0.2.20.5002: UDP, length 1470
01:16:52.303111 IP 10.0.1.10.45735 > 10.0.2.20.5002: UDP, length 1470
01:16:52.326477 IP 10.0.1.10.45735 > 10.0.2.20.5002: UDP, length 1470
01:16:52.349103 IP 10.0.1.10.45735 > 10.0.2.20.5002: UDP, length 1470
01:16:52.372307 IP 10.0.1.10.45735 > 10.0.2.20.5002: UDP, length 1470
01:16:52.395277 IP 10.0.1.10.45735 > 10.0.2.20.5002: UDP, length 1470
01:16:52.418301 IP 10.0.1.10.45735 > 10.0.2.20.5002: UDP, length 1470
01:16:52.442046 IP 10.0.1.10.45735 > 10.0.2.20.5002: UDP, length 1470
01:16:52.465066 IP 10.0.1.10.45735 > 10.0.2.20.5002: UDP, length 1470
01:16:52.487005 IP 10.0.1.10.45735 > 10.0.2.20.5002: UDP, length 1470
01:16:52.510053 IP 10.0.1.10.45735 > 10.0.2.20.5002: UDP, length 1470
01:16:52.533119 IP 10.0.1.10.45735 > 10.0.2.20.5002: UDP, length 1470
01:16:52.556059 IP 10.0.1.10.45735 > 10.0.2.20.5002: UDP, length 1470
01:16:52.579510 IP 10.0.1.10.45735 > 10.0.2.20.5002: UDP, length 1470
01:16:52.602590 IP 10.0.1.10.45735 > 10.0.2.20.5002: UDP, length 1470
01:16:52.625544 IP 10.0.1.10.45735 > 10.0.2.20.5002: UDP, length 1470
01:16:52.648802 IP 10.0.1.10.45735 > 10.0.2.20.5002: UDP, length 1470
01:16:52.671131 IP 10.0.1.10.45735 > 10.0.2.20.5002: UDP, length 1470
01:16:52.693938 IP 10.0.1.10.45735 > 10.0.2.20.5002: UDP, length 1470
01:16:52.716997 IP 10.0.1.10.45735 > 10.0.2.20.5002: UDP, length 1470
01:16:52.739874 IP 10.0.1.10.45735 > 10.0.2.20.5002: UDP, length 1470
01:16:52.762561 IP 10.0.1.10.45735 > 10.0.2.20.5002: UDP, length 1470
01:16:52.786053 IP 10.0.1.10.45735 > 10.0.2.20.5002: UDP, length 1470
01:16:52.808882 IP 10.0.1.10.45735 > 10.0.2.20.5002: UDP, length 1470
01:16:52.832153 IP 10.0.1.10.45735 > 10.0.2.20.5002: UDP, length 1470
01:16:52.854394 IP 10.0.1.10.45735 > 10.0.2.20.5002: UDP, length 1470
01:16:52.877809 IP 10.0.1.10.45735 > 10.0.2.20.5002: UDP, length 1470
01:16:52.900958 IP 10.0.1.10.45735 > 10.0.2.20.5002: UDP, length 1470
01:16:52.923490 IP 10.0.1.10.45735 > 10.0.2.20.5002: UDP, length 1470
01:16:52.946259 IP 10.0.1.10.45735 > 10.0.2.20.5002: UDP, length 1470
01:16:52.969665 IP 10.0.1.10.45735 > 10.0.2.20.5002: UDP, length 1470
01:16:52.992475 IP 10.0.1.10.45735 > 10.0.2.20.5002: UDP, length 1470
01:16:53.015861 IP 10.0.1.10.45735 > 10.0.2.20.5002: UDP, length 1470
01:16:53.039126 IP 10.0.1.10.45735 > 10.0.2.20.5002: UDP, length 1470
01:16:53.061482 IP 10.0.1.10.45735 > 10.0.2.20.5002: UDP, length 1470
01:16:53.084890 IP 10.0.1.10.45735 > 10.0.2.20.5002: UDP, length 1470
01:16:53.107320 IP 10.0.1.10.45735 > 10.0.2.20.5002: UDP, length 1470
01:16:53.130071 IP 10.0.1.10.45735 > 10.0.2.20.5002: UDP, length 1470
01:16:53.153366 IP 10.0.1.10.45735 > 10.0.2.20.5002: UDP, length 1470
01:16:53.176186 IP 10.0.1.10.45735 > 10.0.2.20.5002: UDP, length 1470
01:16:53.199031 IP 10.0.1.10.45735 > 10.0.2.20.5002: UDP, length 1470
01:16:53.222793 IP 10.0.1.10.45735 > 10.0.2.20.5002: UDP, length 1470
01:16:53.245737 IP 10.0.1.10.45735 > 10.0.2.20.5002: UDP, length 1470
01:16:53.268187 IP 10.0.1.10.45735 > 10.0.2.20.5002: UDP, length 1470
01:16:53.290890 IP 10.0.1.10.45735 > 10.0.2.20.5002: UDP, length 1470
01:16:53.314191 IP 10.0.1.10.45735 > 10.0.2.20.5002: UDP, length 1470
01:16:53.337091 IP 10.0.1.10.45735 > 10.0.2.20.5002: UDP, length 1470
01:16:53.359936 IP 10.0.1.10.45735 > 10.0.2.20.5002: UDP, length 1470
01:16:53.383536 IP 10.0.1.10.45735 > 10.0.2.20.5002: UDP, length 1470
01:16:53.406113 IP 10.0.1.10.45735 > 10.0.2.20.5002: UDP, length 1470
01:16:53.429214 IP 10.0.1.10.45735 > 10.0.2.20.5002: UDP, length 1470
01:16:53.451867 IP 10.0.1.10.45735 > 10.0.2.20.5002: UDP, length 1470
01:16:53.474683 IP 10.0.1.10.45735 > 10.0.2.20.5002: UDP, length 1470
01:16:53.497792 IP 10.0.1.10.45735 > 10.0.2.20.5002: UDP, length 1470
01:16:53.520781 IP 10.0.1.10.45735 > 10.0.2.20.5002: UDP, length 1470
01:16:53.543646 IP 10.0.1.10.45735 > 10.0.2.20.5002: UDP, length 1470
01:16:53.566323 IP 10.0.1.10.45735 > 10.0.2.20.5002: UDP, length 1470
01:16:53.589797 IP 10.0.1.10.45735 > 10.0.2.20.5002: UDP, length 1470
01:16:53.613230 IP 10.0.1.10.45735 > 10.0.2.20.5002: UDP, length 1470
01:16:53.636429 IP 10.0.1.10.45735 > 10.0.2.20.5002: UDP, length 1470
01:16:53.658551 IP 10.0.1.10.45735 > 10.0.2.20.5002: UDP, length 1470
01:16:53.681635 IP 10.0.1.10.45735 > 10.0.2.20.5002: UDP, length 1470
01:16:53.704430 IP 10.0.1.10.45735 > 10.0.2.20.5002: UDP, length 1470
01:16:53.727201 IP 10.0.1.10.45735 > 10.0.2.20.5002: UDP, length 1470
01:16:53.750284 IP 10.0.1.10.45735 > 10.0.2.20.5002: UDP, length 1470
01:16:53.773554 IP 10.0.1.10.45735 > 10.0.2.20.5002: UDP, length 1470
01:16:53.796413 IP 10.0.1.10.45735 > 10.0.2.20.5002: UDP, length 1470
01:16:53.819211 IP 10.0.1.10.45735 > 10.0.2.20.5002: UDP, length 1470
01:16:53.842785 IP 10.0.1.10.45735 > 10.0.2.20.5002: UDP, length 1470
01:16:53.866077 IP 10.0.1.10.45735 > 10.0.2.20.5002: UDP, length 1470
01:16:53.888289 IP 10.0.1.10.45735 > 10.0.2.20.5002: UDP, length 1470
01:16:53.911181 IP 10.0.1.10.45735 > 10.0.2.20.5002: UDP, length 1470
01:16:53.934198 IP 10.0.1.10.45735 > 10.0.2.20.5002: UDP, length 1470
01:16:53.957231 IP 10.0.1.10.45735 > 10.0.2.20.5002: UDP, length 1470
01:16:53.980125 IP 10.0.1.10.45735 > 10.0.2.20.5002: UDP, length 1470
01:16:54.003664 IP 10.0.1.10.45735 > 10.0.2.20.5002: UDP, length 1470
01:16:54.026064 IP 10.0.1.10.45735 > 10.0.2.20.5002: UDP, length 1470
01:16:54.050035 IP 10.0.1.10.45735 > 10.0.2.20.5002: UDP, length 1470
01:16:54.072092 IP 10.0.1.10.45735 > 10.0.2.20.5002: UDP, length 1470
01:16:54.095312 IP 10.0.1.10.45735 > 10.0.2.20.5002: UDP, length 1470
01:16:54.118043 IP 10.0.1.10.45735 > 10.0.2.20.5002: UDP, length 1470
01:16:54.141188 IP 10.0.1.10.45735 > 10.0.2.20.5002: UDP, length 1470
01:16:54.163916 IP 10.0.1.10.45735 > 10.0.2.20.5002: UDP, length 1470
01:16:54.186676 IP 10.0.1.10.45735 > 10.0.2.20.5002: UDP, length 1470
01:16:54.210090 IP 10.0.1.10.45735 > 10.0.2.20.5002: UDP, length 1470
01:16:54.233412 IP 10.0.1.10.45735 > 10.0.2.20.5002: UDP, length 1470
01:16:54.256267 IP 10.0.1.10.45735 > 10.0.2.20.5002: UDP, length 1470
01:16:54.279576 IP 10.0.1.10.45735 > 10.0.2.20.5002: UDP, length 1470
01:16:54.302217 IP 10.0.1.10.45735 > 10.0.2.20.5002: UDP, length 1470
01:16:54.324625 IP 10.0.1.10.45735 > 10.0.2.20.5002: UDP, length 1470
01:16:54.347646 IP 10.0.1.10.45735 > 10.0.2.20.5002: UDP, length 1470
01:16:54.370554 IP 10.0.1.10.45735 > 10.0.2.20.5002: UDP, length 1470
01:16:54.393465 IP 10.0.1.10.45735 > 10.0.2.20.5002: UDP, length 1470
01:16:54.416650 IP 10.0.1.10.45735 > 10.0.2.20.5002: UDP, length 1470
01:16:54.439968 IP 10.0.1.10.45735 > 10.0.2.20.5002: UDP, length 1470
01:16:54.463319 IP 10.0.1.10.45735 > 10.0.2.20.5002: UDP, length 1470
01:16:54.485365 IP 10.0.1.10.45735 > 10.0.2.20.5002: UDP, length 1470
01:16:54.508363 IP 10.0.1.10.45735 > 10.0.2.20.5002: UDP, length 1470
01:16:54.531260 IP 10.0.1.10.45735 > 10.0.2.20.5002: UDP, length 1470
01:16:54.554682 IP 10.0.1.10.45735 > 10.0.2.20.5002: UDP, length 1470
01:16:54.577330 IP 10.0.1.10.45735 > 10.0.2.20.5002: UDP, length 1470
01:16:54.600276 IP 10.0.1.10.45735 > 10.0.2.20.5002: UDP, length 1470
01:16:54.623686 IP 10.0.1.10.45735 > 10.0.2.20.5002: UDP, length 1470
01:16:54.646439 IP 10.0.1.10.45735 > 10.0.2.20.5002: UDP, length 1470
01:16:54.668957 IP 10.0.1.10.45735 > 10.0.2.20.5002: UDP, length 1470
01:16:54.691969 IP 10.0.1.10.45735 > 10.0.2.20.5002: UDP, length 1470
01:16:54.715095 IP 10.0.1.10.45735 > 10.0.2.20.5002: UDP, length 1470
01:16:54.738118 IP 10.0.1.10.45735 > 10.0.2.20.5002: UDP, length 1470
01:16:54.761237 IP 10.0.1.10.45735 > 10.0.2.20.5002: UDP, length 1470
01:16:54.784617 IP 10.0.1.10.45735 > 10.0.2.20.5002: UDP, length 1470
01:16:54.807130 IP 10.0.1.10.45735 > 10.0.2.20.5002: UDP, length 1470
01:16:54.830741 IP 10.0.1.10.45735 > 10.0.2.20.5002: UDP, length 1470
01:16:54.853495 IP 10.0.1.10.45735 > 10.0.2.20.5002: UDP, length 1470
01:16:54.875836 IP 10.0.1.10.45735 > 10.0.2.20.5002: UDP, length 1470
01:16:54.898674 IP 10.0.1.10.45735 > 10.0.2.20.5002: UDP, length 1470
01:16:54.922072 IP 10.0.1.10.45735 > 10.0.2.20.5002: UDP, length 1470
01:16:54.944977 IP 10.0.1.10.45735 > 10.0.2.20.5002: UDP, length 1470
01:16:54.968360 IP 10.0.1.10.45735 > 10.0.2.20.5002: UDP, length 1470
01:16:54.991127 IP 10.0.1.10.45735 > 10.0.2.20.5002: UDP, length 1470
01:16:55.014479 IP 10.0.1.10.45735 > 10.0.2.20.5002: UDP, length 1470
01:16:55.036520 IP 10.0.1.10.45735 > 10.0.2.20.5002: UDP, length 1470
01:16:55.059434 IP 10.0.1.10.45735 > 10.0.2.20.5002: UDP, length 1470
01:16:55.082224 IP 10.0.1.10.45735 > 10.0.2.20.5002: UDP, length 1470
01:16:55.105834 IP 10.0.1.10.45735 > 10.0.2.20.5002: UDP, length 1470
01:16:55.128582 IP 10.0.1.10.45735 > 10.0.2.20.5002: UDP, length 1470
01:16:55.151619 IP 10.0.1.10.45735 > 10.0.2.20.5002: UDP, length 1470
01:16:55.175327 IP 10.0.1.10.45735 > 10.0.2.20.5002: UDP, length 1470
01:16:55.197732 IP 10.0.1.10.45735 > 10.0.2.20.5002: UDP, length 1470
01:16:55.220359 IP 10.0.1.10.45735 > 10.0.2.20.5002: UDP, length 1470
01:16:55.243276 IP 10.0.1.10.45735 > 10.0.2.20.5002: UDP, length 1470
01:16:55.266693 IP 10.0.1.10.45735 > 10.0.2.20.5002: UDP, length 1470
01:16:55.289726 IP 10.0.1.10.45735 > 10.0.2.20.5002: UDP, length 1470
01:16:55.313074 IP 10.0.1.10.45735 > 10.0.2.20.5002: UDP, length 1470
01:16:55.336216 IP 10.0.1.10.45735 > 10.0.2.20.5002: UDP, length 1470
01:16:55.358067 IP 10.0.1.10.45735 > 10.0.2.20.5002: UDP, length 1470
01:16:55.381177 IP 10.0.1.10.45735 > 10.0.2.20.5002: UDP, length 1470
01:16:55.404144 IP 10.0.1.10.45735 > 10.0.2.20.5002: UDP, length 1470
01:16:55.426990 IP 10.0.1.10.45735 > 10.0.2.20.5002: UDP, length 1470
01:16:55.450359 IP 10.0.1.10.45735 > 10.0.2.20.5002: UDP, length 1470
01:16:55.473174 IP 10.0.1.10.45735 > 10.0.2.20.5002: UDP, length 1470
01:16:55.496831 IP 10.0.1.10.45735 > 10.0.2.20.5002: UDP, length 1470
01:16:55.519756 IP 10.0.1.10.45735 > 10.0.2.20.5002: UDP, length 1470
01:16:55.542336 IP 10.0.1.10.45735 > 10.0.2.20.5002: UDP, length 1470
01:16:55.564875 IP 10.0.1.10.45735 > 10.0.2.20.5002: UDP, length 1470
01:16:55.587700 IP 10.0.1.10.45735 > 10.0.2.20.5002: UDP, length 1470
01:16:55.610577 IP 10.0.1.10.45735 > 10.0.2.20.5002: UDP, length 1470
01:16:55.634359 IP 10.0.1.10.45735 > 10.0.2.20.5002: UDP, length 1470
01:16:55.657496 IP 10.0.1.10.45735 > 10.0.2.20.5002: UDP, length 1470
01:16:55.680655 IP 10.0.1.10.45735 > 10.0.2.20.5002: UDP, length 1470
01:16:55.703665 IP 10.0.1.10.45735 > 10.0.2.20.5002: UDP, length 1470
01:16:55.725515 IP 10.0.1.10.45735 > 10.0.2.20.5002: UDP, length 1470
01:16:55.748732 IP 10.0.1.10.45735 > 10.0.2.20.5002: UDP, length 1470
01:16:55.771592 IP 10.0.1.10.45735 > 10.0.2.20.5002: UDP, length 1470
01:16:55.794514 IP 10.0.1.10.45735 > 10.0.2.20.5002: UDP, length 1470
01:16:55.817832 IP 10.0.1.10.45735 > 10.0.2.20.5002: UDP, length 1470
01:16:55.840407 IP 10.0.1.10.45735 > 10.0.2.20.5002: UDP, length 1470
01:16:55.863372 IP 10.0.1.10.45735 > 10.0.2.20.5002: UDP, length 1470
01:16:55.886689 IP 10.0.1.10.45735 > 10.0.2.20.5002: UDP, length 1470
01:16:55.910068 IP 10.0.1.10.45735 > 10.0.2.20.5002: UDP, length 1470
01:16:55.932494 IP 10.0.1.10.45735 > 10.0.2.20.5002: UDP, length 1470
01:16:55.955313 IP 10.0.1.10.45735 > 10.0.2.20.5002: UDP, length 1470
01:16:55.978699 IP 10.0.1.10.45735 > 10.0.2.20.5002: UDP, length 1470
01:16:56.001739 IP 10.0.1.10.45735 > 10.0.2.20.5002: UDP, length 1470
01:16:56.024870 IP 10.0.1.10.45735 > 10.0.2.20.5002: UDP, length 1470
01:16:56.047061 IP 10.0.1.10.45735 > 10.0.2.20.5002: UDP, length 1470
01:16:56.071039 IP 10.0.1.10.45735 > 10.0.2.20.5002: UDP, length 1470
01:16:56.093111 IP 10.0.1.10.45735 > 10.0.2.20.5002: UDP, length 1470
01:16:56.115942 IP 10.0.1.10.45735 > 10.0.2.20.5002: UDP, length 1470
01:16:56.139065 IP 10.0.1.10.45735 > 10.0.2.20.5002: UDP, length 1470
01:16:56.162159 IP 10.0.1.10.45735 > 10.0.2.20.5002: UDP, length 1470
01:16:56.185204 IP 10.0.1.10.45735 > 10.0.2.20.5002: UDP, length 1470
01:16:56.207978 IP 10.0.1.10.45735 > 10.0.2.20.5002: UDP, length 1470
01:16:56.230899 IP 10.0.1.10.45735 > 10.0.2.20.5002: UDP, length 1470
01:16:56.254583 IP 10.0.1.10.45735 > 10.0.2.20.5002: UDP, length 1470
01:16:56.276862 IP 10.0.1.10.45735 > 10.0.2.20.5002: UDP, length 1470
01:16:56.300791 IP 10.0.1.10.45735 > 10.0.2.20.5002: UDP, length 1470
01:16:56.322897 IP 10.0.1.10.45735 > 10.0.2.20.5002: UDP, length 1470
01:16:56.345789 IP 10.0.1.10.45735 > 10.0.2.20.5002: UDP, length 1470
01:16:56.368843 IP 10.0.1.10.45735 > 10.0.2.20.5002: UDP, length 1470
01:16:56.391822 IP 10.0.1.10.45735 > 10.0.2.20.5002: UDP, length 1470
01:16:56.414646 IP 10.0.1.10.45735 > 10.0.2.20.5002: UDP, length 1470
01:16:56.438101 IP 10.0.1.10.45735 > 10.0.2.20.5002: UDP, length 1470
01:16:56.461414 IP 10.0.1.10.45735 > 10.0.2.20.5002: UDP, length 1470
01:16:56.484253 IP 10.0.1.10.45735 > 10.0.2.20.5002: UDP, length 1470
01:16:56.507426 IP 10.0.1.10.45735 > 10.0.2.20.5002: UDP, length 1470
01:16:56.530509 IP 10.0.1.10.45735 > 10.0.2.20.5002: UDP, length 1470
01:16:56.552921 IP 10.0.1.10.45735 > 10.0.2.20.5002: UDP, length 1470
01:16:56.575451 IP 10.0.1.10.45735 > 10.0.2.20.5002: UDP, length 1470
01:16:56.598457 IP 10.0.1.10.45735 > 10.0.2.20.5002: UDP, length 1470
01:16:56.621687 IP 10.0.1.10.45735 > 10.0.2.20.5002: UDP, length 1470
01:16:56.644918 IP 10.0.1.10.45735 > 10.0.2.20.5002: UDP, length 1470
01:16:56.668027 IP 10.0.1.10.45735 > 10.0.2.20.5002: UDP, length 1470
01:16:56.690726 IP 10.0.1.10.45735 > 10.0.2.20.5002: UDP, length 1470
01:16:56.713829 IP 10.0.1.10.45735 > 10.0.2.20.5002: UDP, length 1470
01:16:56.737240 IP 10.0.1.10.45735 > 10.0.2.20.5002: UDP, length 1470
01:16:56.759205 IP 10.0.1.10.45735 > 10.0.2.20.5002: UDP, length 1470
01:16:56.782241 IP 10.0.1.10.45735 > 10.0.2.20.5002: UDP, length 1470
01:16:56.805231 IP 10.0.1.10.45735 > 10.0.2.20.5002: UDP, length 1470
01:16:56.828163 IP 10.0.1.10.45735 > 10.0.2.20.5002: UDP, length 1470
01:16:56.851103 IP 10.0.1.10.45735 > 10.0.2.20.5002: UDP, length 1470
01:16:56.874356 IP 10.0.1.10.45735 > 10.0.2.20.5002: UDP, length 1470
01:16:56.898336 IP 10.0.1.10.45735 > 10.0.2.20.5002: UDP, length 1470
01:16:56.920173 IP 10.0.1.10.45735 > 10.0.2.20.5002: UDP, length 1470
01:16:56.943522 IP 10.0.1.10.45735 > 10.0.2.20.5002: UDP, length 1470
01:16:56.966533 IP 10.0.1.10.45735 > 10.0.2.20.5002: UDP, length 1470
01:16:56.989740 IP 10.0.1.10.45735 > 10.0.2.20.5002: UDP, length 1470
01:16:57.011751 IP 10.0.1.10.45735 > 10.0.2.20.5002: UDP, length 1470
01:16:57.034809 IP 10.0.1.10.45735 > 10.0.2.20.5002: UDP, length 1470
01:16:57.058046 IP 10.0.1.10.45735 > 10.0.2.20.5002: UDP, length 1470
01:16:57.081267 IP 10.0.1.10.45735 > 10.0.2.20.5002: UDP, length 1470
01:16:57.103939 IP 10.0.1.10.45735 > 10.0.2.20.5002: UDP, length 1470
01:16:57.127462 IP 10.0.1.10.45735 > 10.0.2.20.5002: UDP, length 1470
01:16:57.150797 IP 10.0.1.10.45735 > 10.0.2.20.5002: UDP, length 1470
01:16:57.172699 IP 10.0.1.10.45735 > 10.0.2.20.5002: UDP, length 1470
01:16:57.196033 IP 10.0.1.10.45735 > 10.0.2.20.5002: UDP, length 1470
01:16:57.218543 IP 10.0.1.10.45735 > 10.0.2.20.5002: UDP, length 1470
01:16:57.241896 IP 10.0.1.10.45735 > 10.0.2.20.5002: UDP, length 1470
01:16:57.264953 IP 10.0.1.10.45735 > 10.0.2.20.5002: UDP, length 1470
01:16:57.288161 IP 10.0.1.10.45735 > 10.0.2.20.5002: UDP, length 1470
01:16:57.310906 IP 10.0.1.10.45735 > 10.0.2.20.5002: UDP, length 1470
01:16:57.333647 IP 10.0.1.10.45735 > 10.0.2.20.5002: UDP, length 1470
01:16:57.356503 IP 10.0.1.10.45735 > 10.0.2.20.5002: UDP, length 1470
01:16:57.379515 IP 10.0.1.10.45735 > 10.0.2.20.5002: UDP, length 1470
01:16:57.402305 IP 10.0.1.10.45735 > 10.0.2.20.5002: UDP, length 1470
01:16:57.425584 IP 10.0.1.10.45735 > 10.0.2.20.5002: UDP, length 1470
01:16:57.448506 IP 10.0.1.10.45735 > 10.0.2.20.5002: UDP, length 1470
01:16:57.471301 IP 10.0.1.10.45735 > 10.0.2.20.5002: UDP, length 1470
01:16:57.494688 IP 10.0.1.10.45735 > 10.0.2.20.5002: UDP, length 1470
01:16:57.517201 IP 10.0.1.10.45735 > 10.0.2.20.5002: UDP, length 1470
01:16:57.541088 IP 10.0.1.10.45735 > 10.0.2.20.5002: UDP, length 1470
01:16:57.564270 IP 10.0.1.10.45735 > 10.0.2.20.5002: UDP, length 1470
01:16:57.586255 IP 10.0.1.10.45735 > 10.0.2.20.5002: UDP, length 1470
01:16:57.608987 IP 10.0.1.10.45735 > 10.0.2.20.5002: UDP, length 1470
01:16:57.632178 IP 10.0.1.10.45735 > 10.0.2.20.5002: UDP, length 1470
01:16:57.655047 IP 10.0.1.10.45735 > 10.0.2.20.5002: UDP, length 1470
01:16:57.678226 IP 10.0.1.10.45735 > 10.0.2.20.5002: UDP, length 1470
01:16:57.701160 IP 10.0.1.10.45735 > 10.0.2.20.5002: UDP, length 1470
01:16:57.724452 IP 10.0.1.10.45735 > 10.0.2.20.5002: UDP, length 1470
01:16:57.747057 IP 10.0.1.10.45735 > 10.0.2.20.5002: UDP, length 1470
01:16:57.769874 IP 10.0.1.10.45735 > 10.0.2.20.5002: UDP, length 1470
01:16:57.794032 IP 10.0.1.10.45735 > 10.0.2.20.5002: UDP, length 1470
01:16:57.815625 IP 10.0.1.10.45735 > 10.0.2.20.5002: UDP, length 1470
01:16:57.838766 IP 10.0.1.10.45735 > 10.0.2.20.5002: UDP, length 1470
01:16:57.862153 IP 10.0.1.10.45735 > 10.0.2.20.5002: UDP, length 1470
01:16:57.884909 IP 10.0.1.10.45735 > 10.0.2.20.5002: UDP, length 1470
01:16:57.907760 IP 10.0.1.10.45735 > 10.0.2.20.5002: UDP, length 1470
01:16:57.931663 IP 10.0.1.10.45735 > 10.0.2.20.5002: UDP, length 1470
01:16:57.953897 IP 10.0.1.10.45735 > 10.0.2.20.5002: UDP, length 1470
01:16:57.976868 IP 10.0.1.10.45735 > 10.0.2.20.5002: UDP, length 1470
01:16:57.999705 IP 10.0.1.10.45735 > 10.0.2.20.5002: UDP, length 1470
01:16:58.022547 IP 10.0.1.10.45735 > 10.0.2.20.5002: UDP, length 1470
01:16:58.046019 IP 10.0.1.10.45735 > 10.0.2.20.5002: UDP, length 1470
01:16:58.068810 IP 10.0.1.10.45735 > 10.0.2.20.5002: UDP, length 1470
01:16:58.091478 IP 10.0.1.10.45735 > 10.0.2.20.5002: UDP, length 1470
01:16:58.114447 IP 10.0.1.10.45735 > 10.0.2.20.5002: UDP, length 1470
01:16:58.138226 IP 10.0.1.10.45735 > 10.0.2.20.5002: UDP, length 1470
01:16:58.160403 IP 10.0.1.10.45735 > 10.0.2.20.5002: UDP, length 1470
01:16:58.183689 IP 10.0.1.10.45735 > 10.0.2.20.5002: UDP, length 1470
01:16:58.206329 IP 10.0.1.10.45735 > 10.0.2.20.5002: UDP, length 1470
01:16:58.229450 IP 10.0.1.10.45735 > 10.0.2.20.5002: UDP, length 1470
01:16:58.252318 IP 10.0.1.10.45735 > 10.0.2.20.5002: UDP, length 1470
01:16:58.275126 IP 10.0.1.10.45735 > 10.0.2.20.5002: UDP, length 1470
01:16:58.298538 IP 10.0.1.10.45735 > 10.0.2.20.5002: UDP, length 1470
01:16:58.321293 IP 10.0.1.10.45735 > 10.0.2.20.5002: UDP, length 1470
01:16:58.344193 IP 10.0.1.10.45735 > 10.0.2.20.5002: UDP, length 1470
01:16:58.367763 IP 10.0.1.10.45735 > 10.0.2.20.5002: UDP, length 1470
01:16:58.390596 IP 10.0.1.10.45735 > 10.0.2.20.5002: UDP, length 1470
01:16:58.412971 IP 10.0.1.10.45735 > 10.0.2.20.5002: UDP, length 1470
01:16:58.436144 IP 10.0.1.10.45735 > 10.0.2.20.5002: UDP, length 1470
01:16:58.458867 IP 10.0.1.10.45735 > 10.0.2.20.5002: UDP, length 1470
01:16:58.482298 IP 10.0.1.10.45735 > 10.0.2.20.5002: UDP, length 1470
01:16:58.505690 IP 10.0.1.10.45735 > 10.0.2.20.5002: UDP, length 1470
01:16:58.528470 IP 10.0.1.10.45735 > 10.0.2.20.5002: UDP, length 1470
01:16:58.550616 IP 10.0.1.10.45735 > 10.0.2.20.5002: UDP, length 1470
01:16:58.574011 IP 10.0.1.10.45735 > 10.0.2.20.5002: UDP, length 1470
01:16:58.596915 IP 10.0.1.10.45735 > 10.0.2.20.5002: UDP, length 1470
01:16:58.619734 IP 10.0.1.10.45735 > 10.0.2.20.5002: UDP, length 1470
01:16:58.642901 IP 10.0.1.10.45735 > 10.0.2.20.5002: UDP, length 1470
01:16:58.665715 IP 10.0.1.10.45735 > 10.0.2.20.5002: UDP, length 1470
01:16:58.688862 IP 10.0.1.10.45735 > 10.0.2.20.5002: UDP, length 1470
01:16:58.712242 IP 10.0.1.10.45735 > 10.0.2.20.5002: UDP, length 1470
01:16:58.735008 IP 10.0.1.10.45735 > 10.0.2.20.5002: UDP, length 1470
01:16:58.758468 IP 10.0.1.10.45735 > 10.0.2.20.5002: UDP, length 1470
01:16:58.781216 IP 10.0.1.10.45735 > 10.0.2.20.5002: UDP, length 1470
01:16:58.803985 IP 10.0.1.10.45735 > 10.0.2.20.5002: UDP, length 1470
01:16:58.826659 IP 10.0.1.10.45735 > 10.0.2.20.5002: UDP, length 1470
01:16:58.849325 IP 10.0.1.10.45735 > 10.0.2.20.5002: UDP, length 1470
01:16:58.872478 IP 10.0.1.10.45735 > 10.0.2.20.5002: UDP, length 1470
01:16:58.895394 IP 10.0.1.10.45735 > 10.0.2.20.5002: UDP, length 1470
01:16:58.918678 IP 10.0.1.10.45735 > 10.0.2.20.5002: UDP, length 1470
01:16:58.941374 IP 10.0.1.10.45735 > 10.0.2.20.5002: UDP, length 1470
01:16:58.964543 IP 10.0.1.10.45735 > 10.0.2.20.5002: UDP, length 1470
01:16:58.988140 IP 10.0.1.10.45735 > 10.0.2.20.5002: UDP, length 1470
01:16:59.010318 IP 10.0.1.10.45735 > 10.0.2.20.5002: UDP, length 1470
01:16:59.033712 IP 10.0.1.10.45735 > 10.0.2.20.5002: UDP, length 1470
01:16:59.056170 IP 10.0.1.10.45735 > 10.0.2.20.5002: UDP, length 1470
01:16:59.079155 IP 10.0.1.10.45735 > 10.0.2.20.5002: UDP, length 1470
01:16:59.102457 IP 10.0.1.10.45735 > 10.0.2.20.5002: UDP, length 1470
01:16:59.125108 IP 10.0.1.10.45735 > 10.0.2.20.5002: UDP, length 1470
01:16:59.148115 IP 10.0.1.10.45735 > 10.0.2.20.5002: UDP, length 1470
01:16:59.171484 IP 10.0.1.10.45735 > 10.0.2.20.5002: UDP, length 1470
01:16:59.194140 IP 10.0.1.10.45735 > 10.0.2.20.5002: UDP, length 1470
01:16:59.216796 IP 10.0.1.10.45735 > 10.0.2.20.5002: UDP, length 1470
01:16:59.239885 IP 10.0.1.10.45735 > 10.0.2.20.5002: UDP, length 1470
01:16:59.262879 IP 10.0.1.10.45735 > 10.0.2.20.5002: UDP, length 1470
01:16:59.286079 IP 10.0.1.10.45735 > 10.0.2.20.5002: UDP, length 1470
01:16:59.309058 IP 10.0.1.10.45735 > 10.0.2.20.5002: UDP, length 1470
01:16:59.331908 IP 10.0.1.10.45735 > 10.0.2.20.5002: UDP, length 1470
01:16:59.354797 IP 10.0.1.10.45735 > 10.0.2.20.5002: UDP, length 1470
01:16:59.378123 IP 10.0.1.10.45735 > 10.0.2.20.5002: UDP, length 1470
01:16:59.401424 IP 10.0.1.10.45735 > 10.0.2.20.5002: UDP, length 1470
01:16:59.423722 IP 10.0.1.10.45735 > 10.0.2.20.5002: UDP, length 1470
01:16:59.446476 IP 10.0.1.10.45735 > 10.0.2.20.5002: UDP, length 1470
01:16:59.469513 IP 10.0.1.10.45735 > 10.0.2.20.5002: UDP, length 1470
01:16:59.492743 IP 10.0.1.10.45735 > 10.0.2.20.5002: UDP, length 1470
01:16:59.515621 IP 10.0.1.10.45735 > 10.0.2.20.5002: UDP, length 1470
01:16:59.538672 IP 10.0.1.10.45735 > 10.0.2.20.5002: UDP, length 1470
01:16:59.561780 IP 10.0.1.10.45735 > 10.0.2.20.5002: UDP, length 1470
01:16:59.584685 IP 10.0.1.10.45735 > 10.0.2.20.5002: UDP, length 1470
01:16:59.607458 IP 10.0.1.10.45735 > 10.0.2.20.5002: UDP, length 1470
01:16:59.630641 IP 10.0.1.10.45735 > 10.0.2.20.5002: UDP, length 1470
01:16:59.653248 IP 10.0.1.10.45735 > 10.0.2.20.5002: UDP, length 1470
01:16:59.676407 IP 10.0.1.10.45735 > 10.0.2.20.5002: UDP, length 1470
01:16:59.699370 IP 10.0.1.10.45735 > 10.0.2.20.5002: UDP, length 1470
01:16:59.722504 IP 10.0.1.10.45735 > 10.0.2.20.5002: UDP, length 1470
01:16:59.745466 IP 10.0.1.10.45735 > 10.0.2.20.5002: UDP, length 1470
01:16:59.768762 IP 10.0.1.10.45735 > 10.0.2.20.5002: UDP, length 1470
01:16:59.791714 IP 10.0.1.10.45735 > 10.0.2.20.5002: UDP, length 1470
01:16:59.814532 IP 10.0.1.10.45735 > 10.0.2.20.5002: UDP, length 1470
01:16:59.837877 IP 10.0.1.10.45735 > 10.0.2.20.5002: UDP, length 1470
01:16:59.860127 IP 10.0.1.10.45735 > 10.0.2.20.5002: UDP, length 1470
01:16:59.882801 IP 10.0.1.10.45735 > 10.0.2.20.5002: UDP, length 1470
01:16:59.906362 IP 10.0.1.10.45735 > 10.0.2.20.5002: UDP, length 1470
01:16:59.929209 IP 10.0.1.10.45735 > 10.0.2.20.5002: UDP, length 1470
01:16:59.952057 IP 10.0.1.10.45735 > 10.0.2.20.5002: UDP, length 1470
