23:03:10.248737 IP 10.0.1.10.52969 > 10.0.2.10.5001: UDP, length 1470
23:03:10.261782 IP 10.0.1.10.52969 > 10.0.2.10.5001: UDP, length 1470
23:03:10.271695 IP 10.0.1.10.52969 > 10.0.2.10.5001: UDP, length 1470
23:03:10.283054 IP 10.0.1.10.52969 > 10.0.2.10.5001: UDP, length 1470
23:03:10.294435 IP 10.0.1.10.52969 > 10.0.2.10.5001: UDP, length 1470
23:03:10.305696 IP 10.0.1.10.52969 > 10.0.2.10.5001: UDP, length 1470
23:03:10.316257 IP 10.0.1.10.52969 > 10.0.2.10.5001: UDP, length 1470
23:03:10.327555 IP 10.0.1.10.52969 > 10.0.2.10.5001: UDP, length 1470
23:03:10.338430 IP 10.0.1.10.52969 > 10.0.2.10.5001: UDP, length 1470
23:03:10.349726 IP 10.0.1.10.52969 > 10.0.2.10.5001: UDP, length 1470
23:03:10.361288 IP 10.0.1.10.52969 > 10.0.2.10.5001: UDP, length 1470
23:03:10.372359 IP 10.0.1.10.52969 > 10.0.2.10.5001: UDP, length 1470
23:03:10.383607 IP 10.0.1.10.52969 > 10.0.2.10.5001: UDP, length 1470
23:03:10.395381 IP 10.0.1.10.52969 > 10.0.2.10.5001: UDP, length 1470
23:03:10.405663 IP 10.0.1.10.52969 > 10.0.2.10.5001: UDP, length 1470
23:03:10.417048 IP 10.0.1.10.52969 > 10.0.2.10.5001: UDP, length 1470
23:03:10.427990 IP 10.0.1.10.52969 > 10.0.2.10.5001: UDP, length 1470
23:03:10.439210 IP 10.0.1.10.52969 > 10.0.2.10.5001: UDP, length 1470
23:03:10.450543 IP 10.0.1.10.52969 > 10.0.2.10.5001: UDP, length 1470
23:03:10.461954 IP 10.0.1.10.52969 > 10.0.2.10.5001: UDP, length 1470
23:03:10.472960 IP 10.0.1.10.52969 > 10.0.2.10.5001: UDP, length 1470
23:03:10.484160 IP 10.0.1.10.52969 > 10.0.2.10.5001: UDP, length 1470
23:03:10.495323 IP 10.0.1.10.52969 > 10.0.2.10.5001: UDP, length 1470
23:03:10.506721 IP 10.0.1.10.52969 > 10.0.2.10.5001: UDP, length 1470
23:03:10.517936 IP 10.0.1.10.52969 > 10.0.2.10.5001: UDP, length 1470
23:03:10.529264 IP 10.0.1.10.52969 > 10.0.2.10.5001: UDP, length 1470
23:03:10.540299 IP 10.0.1.10.52969 > 10.0.2.10.5001: UDP, length 1470
23:03:10.551459 IP 10.0.1.10.52969 > 10.0.2.10.5001: UDP, length 1470
23:03:10.562811 IP 10.0.1.10.52969 > 10.0.2.10.5001: UDP, length 1470
23:03:10.573717 IP 10.0.1.10.52969 > 10.0.2.10.5001: UDP, length 1470
23:03:10.585180 IP 10.0.1.10.52969 > 10.0.2.10.5001: UDP, length 1470
23:03:10.596296 IP 10.0.1.10.52969 > 10.0.2.10.5001: UDP, length 1470
23:03:10.607407 IP 10.0.1.10.52969 > 10.0.2.10.5001: UDP, length 1470
23:03:10.618591 IP 10.0.1.10.52969 > 10.0.2.10.5001: UDP, length 1470
23:03:10.629980 IP 10.0.1.10.52969 > 10.0.2.10.5001: UDP, length 1470
23:03:10.641217 IP 10.0.1.10.52969 > 10.0.2.10.5001: UDP, length 1470
23:03:10.652252 IP 10.0.1.10.52969 > 10.0.2.10.5001: UDP, length 1470
23:03:10.663495 IP 10.0.1.10.52969 > 10.0.2.10.5001: UDP, length 1470
23:03:10.675068 IP 10.0.1.10.52969 > 10.0.2.10.5001: UDP, length 1470
23:03:10.685990 IP 10.0.1.10.52969 > 10.0.2.10.5001: UDP, length 1470
23:03:10.697471 IP 10.0.1.10.52969 > 10.0.2.10.5001: UDP, length 1470
23:03:10.708610 IP 10.0.1.10.52969 > 10.0.2.10.5001: UDP, length 1470
23:03:10.719784 IP 10.0.1.10.52969 > 10.0.2.10.5001: UDP, length 1470
23:03:10.731012 IP 10.0.1.10.52969 > 10.0.2.10.5001: UDP, length 1470
23:03:10.742337 IP 10.0.1.10.52969 > 10.0.2.10.5001: UDP, length 1470
23:03:10.753291 IP 10.0.1.10.52969 > 10.0.2.10.5001: UDP, length 1470
23:03:10.764448 IP 10.0.1.10.52969 > 10.0.2.10.5001: UDP, length 1470
23:03:10.775749 IP 10.0.1.10.52969 > 10.0.2.10.5001: UDP, length 1470
23:03:10.787321 IP 10.0.1.10.52969 > 10.0.2.10.5001: UDP, length 1470
23:03:10.798251 IP 10.0.1.10.52969 > 10.0.2.10.5001: UDP, length 1470
23:03:10.809427 IP 10.0.1.10.52969 > 10.0.2.10.5001: UDP, length 1470
23:03:10.820819 IP 10.0.1.10.52969 > 10.0.2.10.5001: UDP, length 1470
23:03:10.831858 IP 10.0.1.10.52969 > 10.0.2.10.5001: UDP, length 1470
23:03:10.843934 IP 10.0.1.10.52969 > 10.0.2.10.5001: UDP, length 1470
23:03:10.854567 IP 10.0.1.10.52969 > 10.0.2.10.5001: UDP, length 1470
23:03:10.865646 IP 10.0.1.10.52969 > 10.0.2.10.5001: UDP, length 1470
23:03:10.876803 IP 10.0.1.10.52969 > 10.0.2.10.5001: UDP, length 1470
23:03:10.888014 IP 10.0.1.10.52969 > 10.0.2.10.5001: UDP, length 1470
23:03:10.899053 IP 10.0.1.10.52969 > 10.0.2.10.5001: UDP, length 1470
23:03:10.910749 IP 10.0.1.10.52969 > 10.0.2.10.5001: UDP, length 1470
23:03:10.921782 IP 10.0.1.10.52969 > 10.0.2.10.5001: UDP, length 1470
23:03:10.932994 IP 10.0.1.10.52969 > 10.0.2.10.5001: UDP, length 1470
23:03:10.944186 IP 10.0.1.10.52969 > 10.0.2.10.5001: UDP, length 1470
23:03:10.955455 IP 10.0.1.10.52969 > 10.0.2.10.5001: UDP, length 1470
23:03:10.967028 IP 10.0.1.10.52969 > 10.0.2.10.5001: UDP, length 1470
23:03:10.978019 IP 10.0.1.10.52969 > 10.0.2.10.5001: UDP, length 1470
23:03:10.989151 IP 10.0.1.10.52969 > 10.0.2.10.5001: UDP, length 1470
23:03:11.000192 IP 10.0.1.10.52969 > 10.0.2.10.5001: UDP, length 1470
23:03:11.011203 IP 10.0.1.10.52969 > 10.0.2.10.5001: UDP, length 1470
23:03:11.022808 IP 10.0.1.10.52969 > 10.0.2.10.5001: UDP, length 1470
23:03:11.033924 IP 10.0.1.10.52969 > 10.0.2.10.5001: UDP, length 1470
23:03:11.044944 IP 10.0.1.10.52969 > 10.0.2.10.5001: UDP, length 1470
23:03:11.056320 IP 10.0.1.10.52969 > 10.0.2.10.5001: UDP, length 1470
23:03:11.070795 IP 10.0.1.10.52969 > 10.0.2.10.5001: UDP, length 1470
23:03:11.078837 IP 10.0.1.10.52969 > 10.0.2.10.5001: UDP, length 1470
23:03:11.090061 IP 10.0.1.10.52969 > 10.0.2.10.5001: UDP, length 1470
23:03:11.101346 IP 10.0.1.10.52969 > 10.0.2.10.5001: UDP, length 1470
23:03:11.112363 IP 10.0.1.10.52969 > 10.0.2.10.5001: UDP, length 1470
23:03:11.123315 IP 10.0.1.10.52969 > 10.0.2.10.5001: UDP, length 1470
23:03:11.134519 IP 10.0.1.10.52969 > 10.0.2.10.5001: UDP, length 1470
23:03:11.146060 IP 10.0.1.10.52969 > 10.0.2.10.5001: UDP, length 1470
23:03:11.157142 IP 10.0.1.10.52969 > 10.0.2.10.5001: UDP, length 1470
23:03:11.168281 IP 10.0.1.10.52969 > 10.0.2.10.5001: UDP, length 1470
23:03:11.179434 IP 10.0.1.10.52969 > 10.0.2.10.5001: UDP, length 1470
23:03:11.190726 IP 10.0.1.10.52969 > 10.0.2.10.5001: UDP, length 1470
23:03:11.202100 IP 10.0.1.10.52969 > 10.0.2.10.5001: UDP, length 1470
23:03:11.213491 IP 10.0.1.10.52969 > 10.0.2.10.5001: UDP, length 1470
23:03:11.224396 IP 10.0.1.10.52969 > 10.0.2.10.5001: UDP, length 1470
23:03:11.235492 IP 10.0.1.10.52969 > 10.0.2.10.5001: UDP, length 1470
23:03:11.247381 IP 10.0.1.10.52969 > 10.0.2.10.5001: UDP, length 1470
23:03:11.258361 IP 10.0.1.10.52969 > 10.0.2.10.5001: UDP, length 1470
23:03:11.269342 IP 10.0.1.10.52969 > 10.0.2.10.5001: UDP, length 1470
23:03:11.280620 IP 10.0.1.10.52969 > 10.0.2.10.5001: UDP, length 1470
23:03:11.291533 IP 10.0.1.10.52969 > 10.0.2.10.5001: UDP, length 1470
23:03:11.302935 IP 10.0.1.10.52969 > 10.0.2.10.5001: UDP, length 1470
23:03:11.314567 IP 10.0.1.10.52969 > 10.0.2.10.5001: UDP, length 1470
23:03:11.325484 IP 10.0.1.10.52969 > 10.0.2.10.5001: UDP, length 1470
23:03:11.336471 IP 10.0.1.10.52969 > 10.0.2.10.5001: UDP, length 1470
23:03:11.347718 IP 10.0.1.10.52969 > 10.0.2.10.5001: UDP, length 1470
23:03:11.358929 IP 10.0.1.10.52969 > 10.0.2.10.5001: UDP, length 1470
23:03:11.370293 IP 10.0.1.10.52969 > 10.0.2.10.5001: UDP, length 1470
23:03:11.381417 IP 10.0.1.10.52969 > 10.0.2.10.5001: UDP, length 1470
23:03:11.392601 IP 10.0.1.10.52969 > 10.0.2.10.5001: UDP, length 1470
23:03:11.403782 IP 10.0.1.10.52969 > 10.0.2.10.5001: UDP, length 1470
23:03:11.415300 IP 10.0.1.10.52969 > 10.0.2.10.5001: UDP, length 1470
23:03:11.426488 IP 10.0.1.10.52969 > 10.0.2.10.5001: UDP, length 1470
23:03:11.437426 IP 10.0.1.10.52969 > 10.0.2.10.5001: UDP, length 1470
23:03:11.448916 IP 10.0.1.10.52969 > 10.0.2.10.5001: UDP, length 1470
23:03:11.459754 IP 10.0.1.10.52969 > 10.0.2.10.5001: UDP, length 1470
23:03:11.470895 IP 10.0.1.10.52969 > 10.0.2.10.5001: UDP, length 1470
23:03:11.482549 IP 10.0.1.10.52969 > 10.0.2.10.5001: UDP, length 1470
23:03:11.494245 IP 10.0.1.10.52969 > 10.0.2.10.5001: UDP, length 1470
23:03:11.504840 IP 10.0.1.10.52969 > 10.0.2.10.5001: UDP, length 1470
23:03:11.516129 IP 10.0.1.10.52969 > 10.0.2.10.5001: UDP, length 1470
23:03:11.527279 IP 10.0.1.10.52969 > 10.0.2.10.5001: UDP, length 1470
23:03:11.538465 IP 10.0.1.10.52969 > 10.0.2.10.5001: UDP, length 1470
23:03:11.550083 IP 10.0.1.10.52969 > 10.0.2.10.5001: UDP, length 1470
23:03:11.560939 IP 10.0.1.10.52969 > 10.0.2.10.5001: UDP, length 1470
23:03:11.572035 IP 10.0.1.10.52969 > 10.0.2.10.5001: UDP, length 1470
23:03:11.583913 IP 10.0.1.10.52969 > 10.0.2.10.5001: UDP, length 1470
23:03:11.594579 IP 10.0.1.10.52969 > 10.0.2.10.5001: UDP, length 1470
23:03:11.606081 IP 10.0.1.10.52969 > 10.0.2.10.5001: UDP, length 1470
23:03:11.617195 IP 10.0.1.10.52969 > 10.0.2.10.5001: UDP, length 1470
23:03:11.628362 IP 10.0.1.10.52969 > 10.0.2.10.5001: UDP, length 1470
23:03:11.639149 IP 10.0.1.10.52969 > 10.0.2.10.5001: UDP, length 1470
23:03:11.651015 IP 10.0.1.10.52969 > 10.0.2.10.5001: UDP, length 1470
23:03:11.662407 IP 10.0.1.10.52969 > 10.0.2.10.5001: UDP, length 1470
23:03:11.673004 IP 10.0.1.10.52969 > 10.0.2.10.5001: UDP, length 1470
23:03:11.684334 IP 10.0.1.10.52969 > 10.0.2.10.5001: UDP, length 1470
23:03:11.695315 IP 10.0.1.10.52969 > 10.0.2.10.5001: UDP, length 1470
23:03:11.706793 IP 10.0.1.10.52969 > 10.0.2.10.5001: UDP, length 1470
23:03:11.717987 IP 10.0.1.10.52969 > 10.0.2.10.5001: UDP, length 1470
23:03:11.729133 IP 10.0.1.10.52969 > 10.0.2.10.5001: UDP, length 1470
23:03:11.740326 IP 10.0.1.10.52969 > 10.0.2.10.5001: UDP, length 1470
23:03:11.751546 IP 10.0.1.10.52969 > 10.0.2.10.5001: UDP, length 1470
23:03:11.763093 IP 10.0.1.10.52969 > 10.0.2.10.5001: UDP, length 1470
23:03:11.774187 IP 10.0.1.10.52969 > 10.0.2.10.5001: UDP, length 1470
23:03:11.785656 IP 10.0.1.10.52969 > 10.0.2.10.5001: UDP, length 1470
23:03:11.796453 IP 10.0.1.10.52969 > 10.0.2.10.5001: UDP, length 1470
23:03:11.807530 IP 10.0.1.10.52969 > 10.0.2.10.5001: UDP, length 1470
23:03:11.818964 IP 10.0.1.10.52969 > 10.0.2.10.5001: UDP, length 1470
23:03:11.830376 IP 10.0.1.10.52969 > 10.0.2.10.5001: UDP, length 1470
23:03:11.841238 IP 10.0.1.10.52969 > 10.0.2.10.5001: UDP, length 1470
23:03:11.852636 IP 10.0.1.10.52969 > 10.0.2.10.5001: UDP, length 1470
23:03:11.863650 IP 10.0.1.10.52969 > 10.0.2.10.5001: UDP, length 1470
23:03:11.874930 IP 10.0.1.10.52969 > 10.0.2.10.5001: UDP, length 1470
23:03:11.886190 IP 10.0.1.10.52969 > 10.0.2.10.5001: UDP, length 1470
23:03:11.897603 IP 10.0.1.10.52969 > 10.0.2.10.5001: UDP, length 1470
23:03:11.908616 IP 10.0.1.10.52969 > 10.0.2.10.5001: UDP, length 1470
23:03:11.919793 IP 10.0.1.10.52969 > 10.0.2.10.5001: UDP, length 1470
23:03:11.931169 IP 10.0.1.10.52969 > 10.0.2.10.5001: UDP, length 1470
23:03:11.942478 IP 10.0.1.10.52969 > 10.0.2.10.5001: UDP, length 1470
23:03:11.953703 IP 10.0.1.10.52969 > 10.0.2.10.5001: UDP, length 1470
23:03:11.964790 IP 10.0.1.10.52969 > 10.0.2.10.5001: UDP, length 1470
23:03:11.975786 IP 10.0.1.10.52969 > 10.0.2.10.5001: UDP, length 1470
23:03:11.987016 IP 10.0.1.10.52969 > 10.0.2.10.5001: UDP, length 1470
23:03:11.998772 IP 10.0.1.10.52969 > 10.0.2.10.5001: UDP, length 1470
23:03:12.009473 IP 10.0.1.10.52969 > 10.0.2.10.5001: UDP, length 1470
23:03:12.020623 IP 10.0.1.10.52969 > 10.0.2.10.5001: UDP, length 1470
23:03:12.032118 IP 10.0.1.10.52969 > 10.0.2.10.5001: UDP, length 1470
23:03:12.043371 IP 10.0.1.10.52969 > 10.0.2.10.5001: UDP, length 1470
23:03:12.054771 IP 10.0.1.10.52969 > 10.0.2.10.5001: UDP, length 1470
23:03:12.065941 IP 10.0.1.10.52969 > 10.0.2.10.5001: UDP, length 1470
23:03:12.077152 IP 10.0.1.10.52969 > 10.0.2.10.5001: UDP, length 1470
23:03:12.088061 IP 10.0.1.10.52969 > 10.0.2.10.5001: UDP, length 1470
23:03:12.099489 IP 10.0.1.10.52969 > 10.0.2.10.5001: UDP, length 1470
23:03:12.110923 IP 10.0.1.10.52969 > 10.0.2.10.5001: UDP, length 1470
23:03:12.121730 IP 10.0.1.10.52969 > 10.0.2.10.5001: UDP, length 1470
23:03:12.133225 IP 10.0.1.10.52969 > 10.0.2.10.5001: UDP, length 1470
23:03:12.144120 IP 10.0.1.10.52969 > 10.0.2.10.5001: UDP, length 1470
23:03:12.155087 IP 10.0.1.10.52969 > 10.0.2.10.5001: UDP, length 1470
23:03:12.166399 IP 10.0.1.10.52969 > 10.0.2.10.5001: UDP, length 1470
23:03:12.177878 IP 10.0.1.10.52969 > 10.0.2.10.5001: UDP, length 1470
23:03:12.188964 IP 10.0.1.10.52969 > 10.0.2.10.5001: UDP, length 1470
23:03:12.200119 IP 10.0.1.10.52969 > 10.0.2.10.5001: UDP, length 1470
23:03:12.211434 IP 10.0.1.10.52969 > 10.0.2.10.5001: UDP, length 1470
23:03:12.222800 IP 10.0.1.10.52969 > 10.0.2.10.5001: UDP, length 1470
23:03:12.233932 IP 10.0.1.10.52969 > 10.0.2.10.5001: UDP, length 1470
23:03:12.245151 IP 10.0.1.10.52969 > 10.0.2.10.5001: UDP, length 1470
23:03:12.256296 IP 10.0.1.10.52969 > 10.0.2.10.5001: UDP, length 1470
23:03:12.267632 IP 10.0.1.10.52969 > 10.0.2.10.5001: UDP, length 1470
23:03:12.279285 IP 10.0.1.10.52969 > 10.0.2.10.5001: UDP, length 1470
23:03:12.289746 IP 10.0.1.10.52969 > 10.0.2.10.5001: UDP, length 1470
23:03:12.300962 IP 10.0.1.10.52969 > 10.0.2.10.5001: UDP, length 1470
23:03:12.312310 IP 10.0.1.10.52969 > 10.0.2.10.5001: UDP, length 1470
23:03:12.323400 IP 10.0.1.10.52969 > 10.0.2.10.5001: UDP, length 1470
23:03:12.334833 IP 10.0.1.10.52969 > 10.0.2.10.5001: UDP, length 1470
23:03:12.346327 IP 10.0.1.10.52969 > 10.0.2.10.5001: UDP, length 1470
23:03:12.357148 IP 10.0.1.10.52969 > 10.0.2.10.5001: UDP, length 1470
23:03:12.368569 IP 10.0.1.10.52969 > 10.0.2.10.5001: UDP, length 1470
23:03:12.379646 IP 10.0.1.10.52969 > 10.0.2.10.5001: UDP, length 1470
23:03:12.390727 IP 10.0.1.10.52969 > 10.0.2.10.5001: UDP, length 1470
23:03:12.402163 IP 10.0.1.10.52969 > 10.0.2.10.5001: UDP, length 1470
23:03:12.413069 IP 10.0.1.10.52969 > 10.0.2.10.5001: UDP, length 1470
23:03:12.424349 IP 10.0.1.10.52969 > 10.0.2.10.5001: UDP, length 1470
23:03:12.435576 IP 10.0.1.10.52969 > 10.0.2.10.5001: UDP, length 1470
23:03:12.446842 IP 10.0.1.10.52969 > 10.0.2.10.5001: UDP, length 1470
23:03:12.458299 IP 10.0.1.10.52969 > 10.0.2.10.5001: UDP, length 1470
23:03:12.469668 IP 10.0.1.10.52969 > 10.0.2.10.5001: UDP, length 1470
23:03:12.480599 IP 10.0.1.10.52969 > 10.0.2.10.5001: UDP, length 1470
23:03:12.491822 IP 10.0.1.10.52969 > 10.0.2.10.5001: UDP, length 1470
23:03:12.503174 IP 10.0.1.10.52969 > 10.0.2.10.5001: UDP, length 1470
23:03:12.514095 IP 10.0.1.10.52969 > 10.0.2.10.5001: UDP, length 1470
23:03:12.525733 IP 10.0.1.10.52969 > 10.0.2.10.5001: UDP, length 1470
23:03:12.536830 IP 10.0.1.10.52969 > 10.0.2.10.5001: UDP, length 1470
23:03:12.547875 IP 10.0.1.10.52969 > 10.0.2.10.5001: UDP, length 1470
23:03:12.559197 IP 10.0.1.10.52969 > 10.0.2.10.5001: UDP, length 1470
23:03:12.570211 IP 10.0.1.10.52969 > 10.0.2.10.5001: UDP, length 1470
23:03:12.581692 IP 10.0.1.10.52969 > 10.0.2.10.5001: UDP, length 1470
23:03:12.592920 IP 10.0.1.10.52969 > 10.0.2.10.5001: UDP, length 1470
23:03:12.603741 IP 10.0.1.10.52969 > 10.0.2.10.5001: UDP, length 1470
23:03:12.615578 IP 10.0.1.10.52969 > 10.0.2.10.5001: UDP, length 1470
23:03:12.626612 IP 10.0.1.10.52969 > 10.0.2.10.5001: UDP, length 1470
23:03:12.637490 IP 10.0.1.10.52969 > 10.0.2.10.5001: UDP, length 1470
23:03:12.648716 IP 10.0.1.10.52969 > 10.0.2.10.5001: UDP, length 1470
23:03:12.659859 IP 10.0.1.10.52969 > 10.0.2.10.5001: UDP, length 1470
23:03:12.671236 IP 10.0.1.10.52969 > 10.0.2.10.5001: UDP, length 1470
23:03:12.682565 IP 10.0.1.10.52969 > 10.0.2.10.5001: UDP, length 1470
23:03:12.694204 IP 10.0.1.10.52969 > 10.0.2.10.5001: UDP, length 1470
23:03:12.704632 IP 10.0.1.10.52969 > 10.0.2.10.5001: UDP, length 1470
23:03:12.716121 IP 10.0.1.10.52969 > 10.0.2.10.5001: UDP, length 1470
23:03:12.727182 IP 10.0.1.10.52969 > 10.0.2.10.5001: UDP, length 1470
23:03:12.738500 IP 10.0.1.10.52969 > 10.0.2.10.5001: UDP, length 1470
23:03:12.750007 IP 10.0.1.10.52969 > 10.0.2.10.5001: UDP, length 1470
23:03:12.761454 IP 10.0.1.10.52969 > 10.0.2.10.5001: UDP, length 1470
23:03:12.772490 IP 10.0.1.10.52969 > 10.0.2.10.5001: UDP, length 1470
23:03:12.783414 IP 10.0.1.10.52969 > 10.0.2.10.5001: UDP, length 1470
23:03:12.794808 IP 10.0.1.10.52969 > 10.0.2.10.5001: UDP, length 1470
23:03:12.806013 IP 10.0.1.10.52969 > 10.0.2.10.5001: UDP, length 1470
23:03:12.817056 IP 10.0.1.10.52969 > 10.0.2.10.5001: UDP, length 1470
23:03:12.828255 IP 10.0.1.10.52969 > 10.0.2.10.5001: UDP, length 1470
23:03:12.839441 IP 10.0.1.10.52969 > 10.0.2.10.5001: UDP, length 1470
23:03:12.850888 IP 10.0.1.10.52969 > 10.0.2.10.5001: UDP, length 1470
23:03:12.862013 IP 10.0.1.10.52969 > 10.0.2.10.5001: UDP, length 1470
23:03:12.873188 IP 10.0.1.10.52969 > 10.0.2.10.5001: UDP, length 1470
23:03:12.884443 IP 10.0.1.10.52969 > 10.0.2.10.5001: UDP, length 1470
23:03:12.895410 IP 10.0.1.10.52969 > 10.0.2.10.5001: UDP, length 1470
23:03:12.906748 IP 10.0.1.10.52969 > 10.0.2.10.5001: UDP, length 1470
23:03:12.918272 IP 10.0.1.10.52969 > 10.0.2.10.5001: UDP, length 1470
23:03:12.929912 IP 10.0.1.10.52969 > 10.0.2.10.5001: UDP, length 1470
23:03:12.940409 IP 10.0.1.10.52969 > 10.0.2.10.5001: UDP, length 1470
23:03:12.951533 IP 10.0.1.10.52969 > 10.0.2.10.5001: UDP, length 1470
23:03:12.963127 IP 10.0.1.10.52969 > 10.0.2.10.5001: UDP, length 1470
23:03:12.974120 IP 10.0.1.10.52969 > 10.0.2.10.5001: UDP, length 1470
23:03:12.985037 IP 10.0.1.10.52969 > 10.0.2.10.5001: UDP, length 1470
23:03:12.996547 IP 10.0.1.10.52969 > 10.0.2.10.5001: UDP, length 1470
23:03:13.007626 IP 10.0.1.10.52969 > 10.0.2.10.5001: UDP, length 1470
23:03:13.018969 IP 10.0.1.10.52969 > 10.0.2.10.5001: UDP, length 1470
23:03:13.030942 IP 10.0.1.10.52969 > 10.0.2.10.5001: UDP, length 1470
23:03:13.041300 IP 10.0.1.10.52969 > 10.0.2.10.5001: UDP, length 1470
23:03:13.052525 IP 10.0.1.10.52969 > 10.0.2.10.5001: UDP, length 1470
23:03:13.063586 IP 10.0.1.10.52969 > 10.0.2.10.5001: UDP, length 1470
23:03:13.075008 IP 10.0.1.10.52969 > 10.0.2.10.5001: UDP, length 1470
23:03:13.086445 IP 10.0.1.10.52969 > 10.0.2.10.5001: UDP, length 1470
23:03:13.097552 IP 10.0.1.10.52969 > 10.0.2.10.5001: UDP, length 1470
23:03:13.108635 IP 10.0.1.10.52969 > 10.0.2.10.5001: UDP, length 1470
23:03:13.119683 IP 10.0.1.10.52969 > 10.0.2.10.5001: UDP, length 1470
23:03:13.131054 IP 10.0.1.10.52969 > 10.0.2.10.5001: UDP, length 1470
23:03:13.142416 IP 10.0.1.10.52969 > 10.0.2.10.5001: UDP, length 1470
23:03:13.153396 IP 10.0.1.10.52969 > 10.0.2.10.5001: UDP, length 1470
23:03:13.164736 IP 10.0.1.10.52969 > 10.0.2.10.5001: UDP, length 1470
23:03:13.175773 IP 10.0.1.10.52969 > 10.0.2.10.5001: UDP, length 1470
23:03:13.186977 IP 10.0.1.10.52969 > 10.0.2.10.5001: UDP, length 1470
23:03:13.198310 IP 10.0.1.10.52969 > 10.0.2.10.5001: UDP, length 1470
23:03:13.209852 IP 10.0.1.10.52969 > 10.0.2.10.5001: UDP, length 1470
23:03:13.220707 IP 10.0.1.10.52969 > 10.0.2.10.5001: UDP, length 1470
23:03:13.231989 IP 10.0.1.10.52969 > 10.0.2.10.5001: UDP, length 1470
23:03:13.243078 IP 10.0.1.10.52969 > 10.0.2.10.5001: UDP, length 1470
23:03:13.254268 IP 10.0.1.10.52969 > 10.0.2.10.5001: UDP, length 1470
23:03:13.265622 IP 10.0.1.10.52969 > 10.0.2.10.5001: UDP, length 1470
23:03:13.276837 IP 10.0.1.10.52969 > 10.0.2.10.5001: UDP, length 1470
23:03:13.287877 IP 10.0.1.10.52969 > 10.0.2.10.5001: UDP, length 1470
23:03:13.299273 IP 10.0.1.10.52969 > 10.0.2.10.5001: UDP, length 1470
23:03:13.310877 IP 10.0.1.10.52969 > 10.0.2.10.5001: UDP, length 1470
23:03:13.321707 IP 10.0.1.10.52969 > 10.0.2.10.5001: UDP, length 1470
23:03:13.333134 IP 10.0.1.10.52969 > 10.0.2.10.5001: UDP, length 1470
23:03:13.344062 IP 10.0.1.10.52969 > 10.0.2.10.5001: UDP, length 1470
23:03:13.355323 IP 10.0.1.10.52969 > 10.0.2.10.5001: UDP, length 1470
23:03:13.367110 IP 10.0.1.10.52969 > 10.0.2.10.5001: UDP, length 1470
23:03:13.378149 IP 10.0.1.10.52969 > 10.0.2.10.5001: UDP, length 1470
23:03:13.389330 IP 10.0.1.10.52969 > 10.0.2.10.5001: UDP, length 1470
23:03:13.400102 IP 10.0.1.10.52969 > 10.0.2.10.5001: UDP, length 1470
23:03:13.411212 IP 10.0.1.10.52969 > 10.0.2.10.5001: UDP, length 1470
23:03:13.422911 IP 10.0.1.10.52969 > 10.0.2.10.5001: UDP, length 1470
23:03:13.434087 IP 10.0.1.10.52969 > 10.0.2.10.5001: UDP, length 1470
23:03:13.445115 IP 10.0.1.10.52969 > 10.0.2.10.5001: UDP, length 1470
23:03:13.456187 IP 10.0.1.10.52969 > 10.0.2.10.5001: UDP, length 1470
23:03:13.467389 IP 10.0.1.10.52969 > 10.0.2.10.5001: UDP, length 1470
23:03:13.479169 IP 10.0.1.10.52969 > 10.0.2.10.5001: UDP, length 1470
23:03:13.490019 IP 10.0.1.10.52969 > 10.0.2.10.5001: UDP, length 1470
23:03:13.501445 IP 10.0.1.10.52969 > 10.0.2.10.5001: UDP, length 1470
23:03:13.512543 IP 10.0.1.10.52969 > 10.0.2.10.5001: UDP, length 1470
23:03:13.523547 IP 10.0.1.10.52969 > 10.0.2.10.5001: UDP, length 1470
23:03:13.535259 IP 10.0.1.10.52969 > 10.0.2.10.5001: UDP, length 1470
23:03:13.546020 IP 10.0.1.10.52969 > 10.0.2.10.5001: UDP, length 1470
23:03:13.557444 IP 10.0.1.10.52969 > 10.0.2.10.5001: UDP, length 1470
23:03:13.568865 IP 10.0.1.10.52969 > 10.0.2.10.5001: UDP, length 1470
23:03:13.579757 IP 10.0.1.10.52969 > 10.0.2.10.5001: UDP, length 1470
23:03:13.591082 IP 10.0.1.10.52969 > 10.0.2.10.5001: UDP, length 1470
23:03:13.602417 IP 10.0.1.10.52969 > 10.0.2.10.5001: UDP, length 1470
23:03:13.613299 IP 10.0.1.10.52969 > 10.0.2.10.5001: UDP, length 1470
23:03:13.624633 IP 10.0.1.10.52969 > 10.0.2.10.5001: UDP, length 1470
23:03:13.635752 IP 10.0.1.10.52969 > 10.0.2.10.5001: UDP, length 1470
23:03:13.646956 IP 10.0.1.10.52969 > 10.0.2.10.5001: UDP, length 1470
23:03:13.658210 IP 10.0.1.10.52969 > 10.0.2.10.5001: UDP, length 1470
23:03:13.669368 IP 10.0.1.10.52969 > 10.0.2.10.5001: UDP, length 1470
23:03:13.680812 IP 10.0.1.10.52969 > 10.0.2.10.5001: UDP, length 1470
23:03:13.691708 IP 10.0.1.10.52969 > 10.0.2.10.5001: UDP, length 1470
23:03:13.703278 IP 10.0.1.10.52969 > 10.0.2.10.5001: UDP, length 1470
23:03:13.714120 IP 10.0.1.10.52969 > 10.0.2.10.5001: UDP, length 1470
23:03:13.725428 IP 10.0.1.10.52969 > 10.0.2.10.5001: UDP, length 1470
23:03:13.736603 IP 10.0.1.10.52969 > 10.0.2.10.5001: UDP, length 1470
23:03:13.747894 IP 10.0.1.10.52969 > 10.0.2.10.5001: UDP, length 1470
23:03:13.759017 IP 10.0.1.10.52969 > 10.0.2.10.5001: UDP, length 1470
23:03:13.770417 IP 10.0.1.10.52969 > 10.0.2.10.5001: UDP, length 1470
23:03:13.781777 IP 10.0.1.10.52969 > 10.0.2.10.5001: UDP, length 1470
23:03:13.792844 IP 10.0.1.10.52969 > 10.0.2.10.5001: UDP, length 1470
23:03:13.803957 IP 10.0.1.10.52969 > 10.0.2.10.5001: UDP, length 1470
23:03:13.815362 IP 10.0.1.10.52969 > 10.0.2.10.5001: UDP, length 1470
23:03:13.826557 IP 10.0.1.10.52969 > 10.0.2.10.5001: UDP, length 1470
23:03:13.838263 IP 10.0.1.10.52969 > 10.0.2.10.5001: UDP, length 1470
23:03:13.848959 IP 10.0.1.10.52969 > 10.0.2.10.5001: UDP, length 1470
23:03:13.860043 IP 10.0.1.10.52969 > 10.0.2.10.5001: UDP, length 1470
23:03:13.871262 IP 10.0.1.10.52969 > 10.0.2.10.5001: UDP, length 1470
23:03:13.882549 IP 10.0.1.10.52969 > 10.0.2.10.5001: UDP, length 1470
23:03:13.893868 IP 10.0.1.10.52969 > 10.0.2.10.5001: UDP, length 1470
23:03:13.905051 IP 10.0.1.10.52969 > 10.0.2.10.5001: UDP, length 1470
23:03:13.916219 IP 10.0.1.10.52969 > 10.0.2.10.5001: UDP, length 1470
23:03:13.927202 IP 10.0.1.10.52969 > 10.0.2.10.5001: UDP, length 1470
23:03:13.938966 IP 10.0.1.10.52969 > 10.0.2.10.5001: UDP, length 1470
23:03:13.949904 IP 10.0.1.10.52969 > 10.0.2.10.5001: UDP, length 1470
23:03:13.961141 IP 10.0.1.10.52969 > 10.0.2.10.5001: UDP, length 1470
23:03:13.972125 IP 10.0.1.10.52969 > 10.0.2.10.5001: UDP, length 1470
23:03:13.983434 IP 10.0.1.10.52969 > 10.0.2.10.5001: UDP, length 1470
23:03:13.994986 IP 10.0.1.10.52969 > 10.0.2.10.5001: UDP, length 1470
23:03:14.006094 IP 10.0.1.10.52969 > 10.0.2.10.5001: UDP, length 1470
23:03:14.017202 IP 10.0.1.10.52969 > 10.0.2.10.5001: UDP, length 1470
23:03:14.028348 IP 10.0.1.10.52969 > 10.0.2.10.5001: UDP, length 1470
23:03:14.039388 IP 10.0.1.10.52969 > 10.0.2.10.5001: UDP, length 1470
23:03:14.050970 IP 10.0.1.10.52969 > 10.0.2.10.5001: UDP, length 1470
23:03:14.062264 IP 10.0.1.10.52969 > 10.0.2.10.5001: UDP, length 1470
23:03:14.073448 IP 10.0.1.10.52969 > 10.0.2.10.5001: UDP, length 1470
23:03:14.084540 IP 10.0.1.10.52969 > 10.0.2.10.5001: UDP, length 1470
23:03:14.095592 IP 10.0.1.10.52969 > 10.0.2.10.5001: UDP, length 1470
23:03:14.107314 IP 10.0.1.10.52969 > 10.0.2.10.5001: UDP, length 1470
23:03:14.118247 IP 10.0.1.10.52969 > 10.0.2.10.5001: UDP, length 1470
23:03:14.129397 IP 10.0.1.10.52969 > 10.0.2.10.5001: UDP, length 1470
23:03:14.140351 IP 10.0.1.10.52969 > 10.0.2.10.5001: UDP, length 1470
23:03:14.151616 IP 10.0.1.10.52969 > 10.0.2.10.5001: UDP, length 1470
23:03:14.163006 IP 10.0.1.10.52969 > 10.0.2.10.5001: UDP, length 1470
23:03:14.174020 IP 10.0.1.10.52969 > 10.0.2.10.5001: UDP, length 1470
23:03:14.185171 IP 10.0.1.10.52969 > 10.0.2.10.5001: UDP, length 1470
23:03:14.196517 IP 10.0.1.10.52969 > 10.0.2.10.5001: UDP, length 1470
23:03:14.207642 IP 10.0.1.10.52969 > 10.0.2.10.5001: UDP, length 1470
23:03:14.219190 IP 10.0.1.10.52969 > 10.0.2.10.5001: UDP, length 1470
23:03:14.230239 IP 10.0.1.10.52969 > 10.0.2.10.5001: UDP, length 1470
23:03:14.241395 IP 10.0.1.10.52969 > 10.0.2.10.5001: UDP, length 1470
23:03:14.252526 IP 10.0.1.10.52969 > 10.0.2.10.5001: UDP, length 1470
23:03:14.263675 IP 10.0.1.10.52969 > 10.0.2.10.5001: UDP, length 1470
23:03:14.274800 IP 10.0.1.10.52969 > 10.0.2.10.5001: UDP, length 1470
23:03:14.286341 IP 10.0.1.10.52969 > 10.0.2.10.5001: UDP, length 1470
23:03:14.297363 IP 10.0.1.10.52969 > 10.0.2.10.5001: UDP, length 1470
23:03:14.308628 IP 10.0.1.10.52969 > 10.0.2.10.5001: UDP, length 1470
23:03:14.319761 IP 10.0.1.10.52969 > 10.0.2.10.5001: UDP, length 1470
23:03:14.330936 IP 10.0.1.10.52969 > 10.0.2.10.5001: UDP, length 1470
23:03:14.342363 IP 10.0.1.10.52969 > 10.0.2.10.5001: UDP, length 1470
23:03:14.353604 IP 10.0.1.10.52969 > 10.0.2.10.5001: UDP, length 1470
23:03:14.365074 IP 10.0.1.10.52969 > 10.0.2.10.5001: UDP, length 1470
23:03:14.376203 IP 10.0.1.10.52969 > 10.0.2.10.5001: UDP, length 1470
23:03:14.387181 IP 10.0.1.10.52969 > 10.0.2.10.5001: UDP, length 1470
23:03:14.399005 IP 10.0.1.10.52969 > 10.0.2.10.5001: UDP, length 1470
23:03:14.409687 IP 10.0.1.10.52969 > 10.0.2.10.5001: UDP, length 1470
23:03:14.420879 IP 10.0.1.10.52969 > 10.0.2.10.5001: UDP, length 1470
23:03:14.431926 IP 10.0.1.10.52969 > 10.0.2.10.5001: UDP, length 1470
23:03:14.443092 IP 10.0.1.10.52969 > 10.0.2.10.5001: UDP, length 1470
23:03:14.454247 IP 10.0.1.10.52969 > 10.0.2.10.5001: UDP, length 1470
23:03:14.465508 IP 10.0.1.10.52969 > 10.0.2.10.5001: UDP, length 1470
23:03:14.476824 IP 10.0.1.10.52969 > 10.0.2.10.5001: UDP, length 1470
23:03:14.488220 IP 10.0.1.10.52969 > 10.0.2.10.5001: UDP, length 1470
23:03:14.499678 IP 10.0.1.10.52969 > 10.0.2.10.5001: UDP, length 1470
23:03:14.511235 IP 10.0.1.10.52969 > 10.0.2.10.5001: UDP, length 1470
23:03:14.521749 IP 10.0.1.10.52969 > 10.0.2.10.5001: UDP, length 1470
23:03:14.532994 IP 10.0.1.10.52969 > 10.0.2.10.5001: UDP, length 1470
23:03:14.544180 IP 10.0.1.10.52969 > 10.0.2.10.5001: UDP, length 1470
23:03:14.555246 IP 10.0.1.10.52969 > 10.0.2.10.5001: UDP, length 1470
23:03:14.566804 IP 10.0.1.10.52969 > 10.0.2.10.5001: UDP, length 1470
23:03:14.578317 IP 10.0.1.10.52969 > 10.0.2.10.5001: UDP, length 1470
23:03:14.588989 IP 10.0.1.10.52969 > 10.0.2.10.5001: UDP, length 1470
23:03:14.600302 IP 10.0.1.10.52969 > 10.0.2.10.5001: UDP, length 1470
23:03:14.611523 IP 10.0.1.10.52969 > 10.0.2.10.5001: UDP, length 1470
23:03:14.622573 IP 10.0.1.10.52969 > 10.0.2.10.5001: UDP, length 1470
23:03:14.634375 IP 10.0.1.10.52969 > 10.0.2.10.5001: UDP, length 1470
23:03:14.645247 IP 10.0.1.10.52969 > 10.0.2.10.5001: UDP, length 1470
23:03:14.656194 IP 10.0.1.10.52969 > 10.0.2.10.5001: UDP, length 1470
23:03:14.667367 IP 10.0.1.10.52969 > 10.0.2.10.5001: UDP, length 1470
23:03:14.678940 IP 10.0.1.10.52969 > 10.0.2.10.5001: UDP, length 1470
23:03:14.690086 IP 10.0.1.10.52969 > 10.0.2.10.5001: UDP, length 1470
23:03:14.701471 IP 10.0.1.10.52969 > 10.0.2.10.5001: UDP, length 1470
23:03:14.712612 IP 10.0.1.10.52969 > 10.0.2.10.5001: UDP, length 1470
23:03:14.723465 IP 10.0.1.10.52969 > 10.0.2.10.5001: UDP, length 1470
23:03:14.735041 IP 10.0.1.10.52969 > 10.0.2.10.5001: UDP, length 1470
23:03:14.745864 IP 10.0.1.10.52969 > 10.0.2.10.5001: UDP, length 1470
23:03:14.757118 IP 10.0.1.10.52969 > 10.0.2.10.5001: UDP, length 1470
23:03:14.768399 IP 10.0.1.10.52969 > 10.0.2.10.5001: UDP, length 1470
23:03:14.779546 IP 10.0.1.10.52969 > 10.0.2.10.5001: UDP, length 1470
23:03:14.791230 IP 10.0.1.10.52969 > 10.0.2.10.5001: UDP, length 1470
23:03:14.802379 IP 10.0.1.10.52969 > 10.0.2.10.5001: UDP, length 1470
23:03:14.813331 IP 10.0.1.10.52969 > 10.0.2.10.5001: UDP, length 1470
23:03:14.824414 IP 10.0.1.10.52969 > 10.0.2.10.5001: UDP, length 1470
23:03:14.835670 IP 10.0.1.10.52969 > 10.0.2.10.5001: UDP, length 1470
23:03:14.846993 IP 10.0.1.10.52969 > 10.0.2.10.5001: UDP, length 1470
23:03:14.858280 IP 10.0.1.10.52969 > 10.0.2.10.5001: UDP, length 1470
23:03:14.869524 IP 10.0.1.10.52969 > 10.0.2.10.5001: UDP, length 1470
23:03:14.880742 IP 10.0.1.10.52969 > 10.0.2.10.5001: UDP, length 1470
23:03:14.891835 IP 10.0.1.10.52969 > 10.0.2.10.5001: UDP, length 1470
23:03:14.902934 IP 10.0.1.10.52969 > 10.0.2.10.5001: UDP, length 1470
23:03:14.914578 IP 10.0.1.10.52969 > 10.0.2.10.5001: UDP, length 1470
23:03:14.925868 IP 10.0.1.10.52969 > 10.0.2.10.5001: UDP, length 1470
23:03:14.936722 IP 10.0.1.10.52969 > 10.0.2.10.5001: UDP, length 1470
23:03:14.947857 IP 10.0.1.10.52969 > 10.0.2.10.5001: UDP, length 1470
23:03:14.959310 IP 10.0.1.10.52969 > 10.0.2.10.5001: UDP, length 1470
23:03:14.970281 IP 10.0.1.10.52969 > 10.0.2.10.5001: UDP, length 1470
23:03:14.981637 IP 10.0.1.10.52969 > 10.0.2.10.5001: UDP, length 1470
23:03:14.992795 IP 10.0.1.10.52969 > 10.0.2.10.5001: UDP, length 1470
23:03:15.003997 IP 10.0.1.10.52969 > 10.0.2.10.5001: UDP, length 1470
23:03:15.015215 IP 10.0.1.10.52969 > 10.0.2.10.5001: UDP, length 1470
23:03:15.026551 IP 10.0.1.10.52969 > 10.0.2.10.5001: UDP, length 1470
23:03:15.037794 IP 10.0.1.10.52969 > 10.0.2.10.5001: UDP, length 1470
23:03:15.049147 IP 10.0.1.10.52969 > 10.0.2.10.5001: UDP, length 1470
23:03:15.060190 IP 10.0.1.10.52969 > 10.0.2.10.5001: UDP, length 1470
23:03:15.071359 IP 10.0.1.10.52969 > 10.0.2.10.5001: UDP, length 1470
23:03:15.083284 IP 10.0.1.10.52969 > 10.0.2.10.5001: UDP, length 1470
23:03:15.094404 IP 10.0.1.10.52969 > 10.0.2.10.5001: UDP, length 1470
23:03:15.104896 IP 10.0.1.10.52969 > 10.0.2.10.5001: UDP, length 1470
23:03:15.116441 IP 10.0.1.10.52969 > 10.0.2.10.5001: UDP, length 1470
23:03:15.127303 IP 10.0.1.10.52969 > 10.0.2.10.5001: UDP, length 1470
23:03:15.138561 IP 10.0.1.10.52969 > 10.0.2.10.5001: UDP, length 1470
23:03:15.150240 IP 10.0.1.10.52969 > 10.0.2.10.5001: UDP, length 1470
23:03:15.161143 IP 10.0.1.10.52969 > 10.0.2.10.5001: UDP, length 1470
23:03:15.172085 IP 10.0.1.10.52969 > 10.0.2.10.5001: UDP, length 1470
23:03:15.183296 IP 10.0.1.10.52969 > 10.0.2.10.5001: UDP, length 1470
23:03:15.194800 IP 10.0.1.10.52969 > 10.0.2.10.5001: UDP, length 1470
23:03:15.206096 IP 10.0.1.10.52969 > 10.0.2.10.5001: UDP, length 1470
23:03:15.217041 IP 10.0.1.10.52969 > 10.0.2.10.5001: UDP, length 1470
23:03:15.228549 IP 10.0.1.10.52969 > 10.0.2.10.5001: UDP, length 1470
23:03:15.239404 IP 10.0.1.10.52969 > 10.0.2.10.5001: UDP, length 1470
23:03:15.250771 IP 10.0.1.10.52969 > 10.0.2.10.5001: UDP, length 1470
23:03:15.262129 IP 10.0.1.10.52969 > 10.0.2.10.5001: UDP, length 1470
23:03:15.273077 IP 10.0.1.10.52969 > 10.0.2.10.5001: UDP, length 1470
23:03:15.284138 IP 10.0.1.10.52969 > 10.0.2.10.5001: UDP, length 1470
23:03:15.295351 IP 10.0.1.10.52969 > 10.0.2.10.5001: UDP, length 1470
23:03:15.306835 IP 10.0.1.10.52969 > 10.0.2.10.5001: UDP, length 1470
23:03:15.318082 IP 10.0.1.10.52969 > 10.0.2.10.5001: UDP, length 1470
23:03:15.329103 IP 10.0.1.10.52969 > 10.0.2.10.5001: UDP, length 1470
23:03:15.340290 IP 10.0.1.10.52969 > 10.0.2.10.5001: UDP, length 1470
23:03:15.351730 IP 10.0.1.10.52969 > 10.0.2.10.5001: UDP, length 1470
23:03:15.362932 IP 10.0.1.10.52969 > 10.0.2.10.5001: UDP, length 1470
23:03:15.374000 IP 10.0.1.10.52969 > 10.0.2.10.5001: UDP, length 1470
23:03:15.385276 IP 10.0.1.10.52969 > 10.0.2.10.5001: UDP, length 1470
23:03:15.396623 IP 10.0.1.10.52969 > 10.0.2.10.5001: UDP, length 1470
23:03:15.407751 IP 10.0.1.10.52969 > 10.0.2.10.5001: UDP, length 1470
23:03:15.419199 IP 10.0.1.10.52969 > 10.0.2.10.5001: UDP, length 1470
23:03:15.430211 IP 10.0.1.10.52969 > 10.0.2.10.5001: UDP, length 1470
23:03:15.441339 IP 10.0.1.10.52969 > 10.0.2.10.5001: UDP, length 1470
23:03:15.452656 IP 10.0.1.10.52969 > 10.0.2.10.5001: UDP, length 1470
23:03:15.463811 IP 10.0.1.10.52969 > 10.0.2.10.5001: UDP, length 1470
23:03:15.475276 IP 10.0.1.10.52969 > 10.0.2.10.5001: UDP, length 1470
23:03:15.486244 IP 10.0.1.10.52969 > 10.0.2.10.5001: UDP, length 1470
23:03:15.497483 IP 10.0.1.10.52969 > 10.0.2.10.5001: UDP, length 1470
23:03:15.508623 IP 10.0.1.10.52969 > 10.0.2.10.5001: UDP, length 1470
23:03:15.519679 IP 10.0.1.10.52969 > 10.0.2.10.5001: UDP, length 1470
23:03:15.531364 IP 10.0.1.10.52969 > 10.0.2.10.5001: UDP, length 1470
23:03:15.542497 IP 10.0.1.10.52969 > 10.0.2.10.5001: UDP, length 1470
23:03:15.553743 IP 10.0.1.10.52969 > 10.0.2.10.5001: UDP, length 1470
23:03:15.564737 IP 10.0.1.10.52969 > 10.0.2.10.5001: UDP, length 1470
23:03:15.575996 IP 10.0.1.10.52969 > 10.0.2.10.5001: UDP, length 1470
23:03:15.587031 IP 10.0.1.10.52969 > 10.0.2.10.5001: UDP, length 1470
23:03:15.598868 IP 10.0.1.10.52969 > 10.0.2.10.5001: UDP, length 1470
23:03:15.609940 IP 10.0.1.10.52969 > 10.0.2.10.5001: UDP, length 1470
23:03:15.621012 IP 10.0.1.10.52969 > 10.0.2.10.5001: UDP, length 1470
23:03:15.631984 IP 10.0.1.10.52969 > 10.0.2.10.5001: UDP, length 1470
23:03:15.643335 IP 10.0.1.10.52969 > 10.0.2.10.5001: UDP, length 1470
23:03:15.654484 IP 10.0.1.10.52969 > 10.0.2.10.5001: UDP, length 1470
23:03:15.665636 IP 10.0.1.10.52969 > 10.0.2.10.5001: UDP, length 1470
23:03:15.676887 IP 10.0.1.10.52969 > 10.0.2.10.5001: UDP, length 1470
23:03:15.688009 IP 10.0.1.10.52969 > 10.0.2.10.5001: UDP, length 1470
23:03:15.699583 IP 10.0.1.10.52969 > 10.0.2.10.5001: UDP, length 1470
23:03:15.710775 IP 10.0.1.10.52969 > 10.0.2.10.5001: UDP, length 1470
23:03:15.721734 IP 10.0.1.10.52969 > 10.0.2.10.5001: UDP, length 1470
23:03:15.733015 IP 10.0.1.10.52969 > 10.0.2.10.5001: UDP, length 1470
23:03:15.744098 IP 10.0.1.10.52969 > 10.0.2.10.5001: UDP, length 1470
23:03:15.755105 IP 10.0.1.10.52969 > 10.0.2.10.5001: UDP, length 1470
23:03:15.767387 IP 10.0.1.10.52969 > 10.0.2.10.5001: UDP, length 1470
23:03:15.777832 IP 10.0.1.10.52969 > 10.0.2.10.5001: UDP, length 1470
23:03:15.789114 IP 10.0.1.10.52969 > 10.0.2.10.5001: UDP, length 1470
23:03:15.800317 IP 10.0.1.10.52969 > 10.0.2.10.5001: UDP, length 1470
23:03:15.811356 IP 10.0.1.10.52969 > 10.0.2.10.5001: UDP, length 1470
23:03:15.823024 IP 10.0.1.10.52969 > 10.0.2.10.5001: UDP, length 1470
23:03:15.833818 IP 10.0.1.10.52969 > 10.0.2.10.5001: UDP, length 1470
23:03:15.845262 IP 10.0.1.10.52969 > 10.0.2.10.5001: UDP, length 1470
23:03:15.856220 IP 10.0.1.10.52969 > 10.0.2.10.5001: UDP, length 1470
23:03:15.867383 IP 10.0.1.10.52969 > 10.0.2.10.5001: UDP, length 1470
23:03:15.878928 IP 10.0.1.10.52969 > 10.0.2.10.5001: UDP, length 1470
23:03:15.890182 IP 10.0.1.10.52969 > 10.0.2.10.5001: UDP, length 1470
23:03:15.901205 IP 10.0.1.10.52969 > 10.0.2.10.5001: UDP, length 1470
23:03:15.912333 IP 10.0.1.10.52969 > 10.0.2.10.5001: UDP, length 1470
23:03:15.923447 IP 10.0.1.10.52969 > 10.0.2.10.5001: UDP, length 1470
23:03:15.934827 IP 10.0.1.10.52969 > 10.0.2.10.5001: UDP, length 1470
23:03:15.946112 IP 10.0.1.10.52969 > 10.0.2.10.5001: UDP, length 1470
23:03:15.957500 IP 10.0.1.10.52969 > 10.0.2.10.5001: UDP, length 1470
23:03:15.968526 IP 10.0.1.10.52969 > 10.0.2.10.5001: UDP, length 1470
23:03:15.979602 IP 10.0.1.10.52969 > 10.0.2.10.5001: UDP, length 1470
23:03:15.991201 IP 10.0.1.10.52969 > 10.0.2.10.5001: UDP, length 1470
23:03:16.002244 IP 10.0.1.10.52969 > 10.0.2.10.5001: UDP, length 1470
23:03:16.013720 IP 10.0.1.10.52969 > 10.0.2.10.5001: UDP, length 1470
23:03:16.024725 IP 10.0.1.10.52969 > 10.0.2.10.5001: UDP, length 1470
23:03:16.035745 IP 10.0.1.10.52969 > 10.0.2.10.5001: UDP, length 1470
23:03:16.047368 IP 10.0.1.10.52969 > 10.0.2.10.5001: UDP, length 1470
23:03:16.058481 IP 10.0.1.10.52969 > 10.0.2.10.5001: UDP, length 1470
23:03:16.069478 IP 10.0.1.10.52969 > 10.0.2.10.5001: UDP, length 1470
23:03:16.080655 IP 10.0.1.10.52969 > 10.0.2.10.5001: UDP, length 1470
23:03:16.091704 IP 10.0.1.10.52969 > 10.0.2.10.5001: UDP, length 1470
23:03:16.103298 IP 10.0.1.10.52969 > 10.0.2.10.5001: UDP, length 1470
23:03:16.114694 IP 10.0.1.10.52969 > 10.0.2.10.5001: UDP, length 1470
23:03:16.125434 IP 10.0.1.10.52969 > 10.0.2.10.5001: UDP, length 1470
23:03:16.136738 IP 10.0.1.10.52969 > 10.0.2.10.5001: UDP, length 1470
23:03:16.148179 IP 10.0.1.10.52969 > 10.0.2.10.5001: UDP, length 1470
23:03:16.159121 IP 10.0.1.10.52969 > 10.0.2.10.5001: UDP, length 1470
23:03:16.170362 IP 10.0.1.10.52969 > 10.0.2.10.5001: UDP, length 1470
23:03:16.181779 IP 10.0.1.10.52969 > 10.0.2.10.5001: UDP, length 1470
23:03:16.192789 IP 10.0.1.10.52969 > 10.0.2.10.5001: UDP, length 1470
23:03:16.203926 IP 10.0.1.10.52969 > 10.0.2.10.5001: UDP, length 1470
23:03:16.215215 IP 10.0.1.10.52969 > 10.0.2.10.5001: UDP, length 1470
23:03:16.226838 IP 10.0.1.10.52969 > 10.0.2.10.5001: UDP, length 1470
23:03:16.237867 IP 10.0.1.10.52969 > 10.0.2.10.5001: UDP, length 1470
23:03:16.248910 IP 10.0.1.10.52969 > 10.0.2.10.5001: UDP, length 1470
23:03:16.259992 IP 10.0.1.10.52969 > 10.0.2.10.5001: UDP, length 1470
23:03:16.271163 IP 10.0.1.10.52969 > 10.0.2.10.5001: UDP, length 1470
23:03:16.282462 IP 10.0.1.10.52969 > 10.0.2.10.5001: UDP, length 1470
23:03:16.293526 IP 10.0.1.10.52969 > 10.0.2.10.5001: UDP, length 1470
23:03:16.304697 IP 10.0.1.10.52969 > 10.0.2.10.5001: UDP, length 1470
23:03:16.316065 IP 10.0.1.10.52969 > 10.0.2.10.5001: UDP, length 1470
23:03:16.327472 IP 10.0.1.10.52969 > 10.0.2.10.5001: UDP, length 1470
23:03:16.338538 IP 10.0.1.10.52969 > 10.0.2.10.5001: UDP, length 1470
23:03:16.350052 IP 10.0.1.10.52969 > 10.0.2.10.5001: UDP, length 1470
23:03:16.361344 IP 10.0.1.10.52969 > 10.0.2.10.5001: UDP, length 1470
23:03:16.372255 IP 10.0.1.10.52969 > 10.0.2.10.5001: UDP, length 1470
23:03:16.383411 IP 10.0.1.10.52969 > 10.0.2.10.5001: UDP, length 1470
23:03:16.394770 IP 10.0.1.10.52969 > 10.0.2.10.5001: UDP, length 1470
23:03:16.406231 IP 10.0.1.10.52969 > 10.0.2.10.5001: UDP, length 1470
23:03:16.417517 IP 10.0.1.10.52969 > 10.0.2.10.5001: UDP, length 1470
23:03:16.428177 IP 10.0.1.10.52969 > 10.0.2.10.5001: UDP, length 1470
23:03:16.439607 IP 10.0.1.10.52969 > 10.0.2.10.5001: UDP, length 1470
23:03:16.451020 IP 10.0.1.10.52969 > 10.0.2.10.5001: UDP, length 1470
23:03:16.462207 IP 10.0.1.10.52969 > 10.0.2.10.5001: UDP, length 1470
23:03:16.473407 IP 10.0.1.10.52969 > 10.0.2.10.5001: UDP, length 1470
23:03:16.484414 IP 10.0.1.10.52969 > 10.0.2.10.5001: UDP, length 1470
23:03:16.495500 IP 10.0.1.10.52969 > 10.0.2.10.5001: UDP, length 1470
23:03:16.507402 IP 10.0.1.10.52969 > 10.0.2.10.5001: UDP, length 1470
23:03:16.518321 IP 10.0.1.10.52969 > 10.0.2.10.5001: UDP, length 1470
23:03:16.529453 IP 10.0.1.10.52969 > 10.0.2.10.5001: UDP, length 1470
23:03:16.540598 IP 10.0.1.10.52969 > 10.0.2.10.5001: UDP, length 1470
23:03:16.551568 IP 10.0.1.10.52969 > 10.0.2.10.5001: UDP, length 1470
23:03:16.563111 IP 10.0.1.10.52969 > 10.0.2.10.5001: UDP, length 1470
23:03:16.574408 IP 10.0.1.10.52969 > 10.0.2.10.5001: UDP, length 1470
23:03:16.585552 IP 10.0.1.10.52969 > 10.0.2.10.5001: UDP, length 1470
23:03:16.596464 IP 10.0.1.10.52969 > 10.0.2.10.5001: UDP, length 1470
23:03:16.607814 IP 10.0.1.10.52969 > 10.0.2.10.5001: UDP, length 1470
23:03:16.619266 IP 10.0.1.10.52969 > 10.0.2.10.5001: UDP, length 1470
23:03:16.630468 IP 10.0.1.10.52969 > 10.0.2.10.5001: UDP, length 1470
23:03:16.641723 IP 10.0.1.10.52969 > 10.0.2.10.5001: UDP, length 1470
23:03:16.652789 IP 10.0.1.10.52969 > 10.0.2.10.5001: UDP, length 1470
23:03:16.663841 IP 10.0.1.10.52969 > 10.0.2.10.5001: UDP, length 1470
23:03:16.674818 IP 10.0.1.10.52969 > 10.0.2.10.5001: UDP, length 1470
23:03:16.686707 IP 10.0.1.10.52969 > 10.0.2.10.5001: UDP, length 1470
23:03:16.697827 IP 10.0.1.10.52969 > 10.0.2.10.5001: UDP, length 1470
23:03:16.708805 IP 10.0.1.10.52969 > 10.0.2.10.5001: UDP, length 1470
23:03:16.719706 IP 10.0.1.10.52969 > 10.0.2.10.5001: UDP, length 1470
23:03:16.731587 IP 10.0.1.10.52969 > 10.0.2.10.5001: UDP, length 1470
23:03:16.742784 IP 10.0.1.10.52969 > 10.0.2.10.5001: UDP, length 1470
23:03:16.753752 IP 10.0.1.10.52969 > 10.0.2.10.5001: UDP, length 1470
23:03:16.764878 IP 10.0.1.10.52969 > 10.0.2.10.5001: UDP, length 1470
23:03:16.776049 IP 10.0.1.10.52969 > 10.0.2.10.5001: UDP, length 1470
23:03:16.787202 IP 10.0.1.10.52969 > 10.0.2.10.5001: UDP, length 1470
23:03:16.798840 IP 10.0.1.10.52969 > 10.0.2.10.5001: UDP, length 1470
23:03:16.809717 IP 10.0.1.10.52969 > 10.0.2.10.5001: UDP, length 1470
23:03:16.820792 IP 10.0.1.10.52969 > 10.0.2.10.5001: UDP, length 1470
23:03:16.832044 IP 10.0.1.10.52969 > 10.0.2.10.5001: UDP, length 1470
23:03:16.843155 IP 10.0.1.10.52969 > 10.0.2.10.5001: UDP, length 1470
23:03:16.854775 IP 10.0.1.10.52969 > 10.0.2.10.5001: UDP, length 1470
23:03:16.865892 IP 10.0.1.10.52969 > 10.0.2.10.5001: UDP, length 1470
23:03:16.877127 IP 10.0.1.10.52969 > 10.0.2.10.5001: UDP, length 1470
23:03:16.888071 IP 10.0.1.10.52969 > 10.0.2.10.5001: UDP, length 1470
23:03:16.899250 IP 10.0.1.10.52969 > 10.0.2.10.5001: UDP, length 1470
23:03:16.910764 IP 10.0.1.10.52969 > 10.0.2.10.5001: UDP, length 1470
23:03:16.921901 IP 10.0.1.10.52969 > 10.0.2.10.5001: UDP, length 1470
23:03:16.933242 IP 10.0.1.10.52969 > 10.0.2.10.5001: UDP, length 1470
23:03:16.944351 IP 10.0.1.10.52969 > 10.0.2.10.5001: UDP, length 1470
23:03:16.955350 IP 10.0.1.10.52969 > 10.0.2.10.5001: UDP, length 1470
23:03:16.967249 IP 10.0.1.10.52969 > 10.0.2.10.5001: UDP, length 1470
23:03:16.978269 IP 10.0.1.10.52969 > 10.0.2.10.5001: UDP, length 1470
23:03:16.989307 IP 10.0.1.10.52969 > 10.0.2.10.5001: UDP, length 1470
23:03:17.000455 IP 10.0.1.10.52969 > 10.0.2.10.5001: UDP, length 1470
23:03:17.011478 IP 10.0.1.10.52969 > 10.0.2.10.5001: UDP, length 1470
23:03:17.023363 IP 10.0.1.10.52969 > 10.0.2.10.5001: UDP, length 1470
23:03:17.034202 IP 10.0.1.10.52969 > 10.0.2.10.5001: UDP, length 1470
23:03:17.045285 IP 10.0.1.10.52969 > 10.0.2.10.5001: UDP, length 1470
23:03:17.056375 IP 10.0.1.10.52969 > 10.0.2.10.5001: UDP, length 1470
23:03:17.067389 IP 10.0.1.10.52969 > 10.0.2.10.5001: UDP, length 1470
23:03:17.078897 IP 10.0.1.10.52969 > 10.0.2.10.5001: UDP, length 1470
23:03:17.090176 IP 10.0.1.10.52969 > 10.0.2.10.5001: UDP, length 1470
23:03:17.101461 IP 10.0.1.10.52969 > 10.0.2.10.5001: UDP, length 1470
23:03:17.112396 IP 10.0.1.10.52969 > 10.0.2.10.5001: UDP, length 1470
23:03:17.123531 IP 10.0.1.10.52969 > 10.0.2.10.5001: UDP, length 1470
23:03:17.135339 IP 10.0.1.10.52969 > 10.0.2.10.5001: UDP, length 1470
23:03:17.146369 IP 10.0.1.10.52969 > 10.0.2.10.5001: UDP, length 1470
23:03:17.157398 IP 10.0.1.10.52969 > 10.0.2.10.5001: UDP, length 1470
23:03:17.168511 IP 10.0.1.10.52969 > 10.0.2.10.5001: UDP, length 1470
23:03:17.179653 IP 10.0.1.10.52969 > 10.0.2.10.5001: UDP, length 1470
23:03:17.191330 IP 10.0.1.10.52969 > 10.0.2.10.5001: UDP, length 1470
23:03:17.202476 IP 10.0.1.10.52969 > 10.0.2.10.5001: UDP, length 1470
23:03:17.213521 IP 10.0.1.10.52969 > 10.0.2.10.5001: UDP, length 1470
23:03:17.224603 IP 10.0.1.10.52969 > 10.0.2.10.5001: UDP, length 1470
23:03:17.235854 IP 10.0.1.10.52969 > 10.0.2.10.5001: UDP, length 1470
23:03:17.247058 IP 10.0.1.10.52969 > 10.0.2.10.5001: UDP, length 1470
23:03:17.258544 IP 10.0.1.10.52969 > 10.0.2.10.5001: UDP, length 1470
23:03:17.269877 IP 10.0.1.10.52969 > 10.0.2.10.5001: UDP, length 1470
23:03:17.280895 IP 10.0.1.10.52969 > 10.0.2.10.5001: UDP, length 1470
23:03:17.291884 IP 10.0.1.10.52969 > 10.0.2.10.5001: UDP, length 1470
23:03:17.303409 IP 10.0.1.10.52969 > 10.0.2.10.5001: UDP, length 1470
23:03:17.314437 IP 10.0.1.10.52969 > 10.0.2.10.5001: UDP, length 1470
23:03:17.325266 IP 10.0.1.10.52969 > 10.0.2.10.5001: UDP, length 1470
23:03:17.336698 IP 10.0.1.10.52969 > 10.0.2.10.5001: UDP, length 1470
23:03:17.347904 IP 10.0.1.10.52969 > 10.0.2.10.5001: UDP, length 1470
23:03:17.359855 IP 10.0.1.10.52969 > 10.0.2.10.5001: UDP, length 1470
23:03:17.370374 IP 10.0.1.10.52969 > 10.0.2.10.5001: UDP, length 1470
23:03:17.381724 IP 10.0.1.10.52969 > 10.0.2.10.5001: UDP, length 1470
23:03:17.392926 IP 10.0.1.10.52969 > 10.0.2.10.5001: UDP, length 1470
23:03:17.403960 IP 10.0.1.10.52969 > 10.0.2.10.5001: UDP, length 1470
23:03:17.415189 IP 10.0.1.10.52969 > 10.0.2.10.5001: UDP, length 1470
23:03:17.426760 IP 10.0.1.10.52969 > 10.0.2.10.5001: UDP, length 1470
23:03:17.437816 IP 10.0.1.10.52969 > 10.0.2.10.5001: UDP, length 1470
23:03:17.449145 IP 10.0.1.10.52969 > 10.0.2.10.5001: UDP, length 1470
23:03:17.460345 IP 10.0.1.10.52969 > 10.0.2.10.5001: UDP, length 1470
23:03:17.471412 IP 10.0.1.10.52969 > 10.0.2.10.5001: UDP, length 1470
23:03:17.483317 IP 10.0.1.10.52969 > 10.0.2.10.5001: UDP, length 1470
23:03:17.493954 IP 10.0.1.10.52969 > 10.0.2.10.5001: UDP, length 1470
23:03:17.504876 IP 10.0.1.10.52969 > 10.0.2.10.5001: UDP, length 1470
23:03:17.516154 IP 10.0.1.10.52969 > 10.0.2.10.5001: UDP, length 1470
23:03:17.527306 IP 10.0.1.10.52969 > 10.0.2.10.5001: UDP, length 1470
23:03:17.538883 IP 10.0.1.10.52969 > 10.0.2.10.5001: UDP, length 1470
23:03:17.550562 IP 10.0.1.10.52969 > 10.0.2.10.5001: UDP, length 1470
23:03:17.561885 IP 10.0.1.10.52969 > 10.0.2.10.5001: UDP, length 1470
23:03:17.572141 IP 10.0.1.10.52969 > 10.0.2.10.5001: UDP, length 1470
23:03:17.583431 IP 10.0.1.10.52969 > 10.0.2.10.5001: UDP, length 1470
23:03:17.595256 IP 10.0.1.10.52969 > 10.0.2.10.5001: UDP, length 1470
23:03:17.605866 IP 10.0.1.10.52969 > 10.0.2.10.5001: UDP, length 1470
23:03:17.617331 IP 10.0.1.10.52969 > 10.0.2.10.5001: UDP, length 1470
23:03:17.628405 IP 10.0.1.10.52969 > 10.0.2.10.5001: UDP, length 1470
23:03:17.639469 IP 10.0.1.10.52969 > 10.0.2.10.5001: UDP, length 1470
23:03:17.650784 IP 10.0.1.10.52969 > 10.0.2.10.5001: UDP, length 1470
23:03:17.662065 IP 10.0.1.10.52969 > 10.0.2.10.5001: UDP, length 1470
23:03:17.673309 IP 10.0.1.10.52969 > 10.0.2.10.5001: UDP, length 1470
23:03:17.684315 IP 10.0.1.10.52969 > 10.0.2.10.5001: UDP, length 1470
23:03:17.695399 IP 10.0.1.10.52969 > 10.0.2.10.5001: UDP, length 1470
23:03:17.707140 IP 10.0.1.10.52969 > 10.0.2.10.5001: UDP, length 1470
23:03:17.718592 IP 10.0.1.10.52969 > 10.0.2.10.5001: UDP, length 1470
23:03:17.729865 IP 10.0.1.10.52969 > 10.0.2.10.5001: UDP, length 1470
23:03:17.740554 IP 10.0.1.10.52969 > 10.0.2.10.5001: UDP, length 1470
23:03:17.751766 IP 10.0.1.10.52969 > 10.0.2.10.5001: UDP, length 1470
23:03:17.762841 IP 10.0.1.10.52969 > 10.0.2.10.5001: UDP, length 1470
23:03:17.774031 IP 10.0.1.10.52969 > 10.0.2.10.5001: UDP, length 1470
23:03:17.785476 IP 10.0.1.10.52969 > 10.0.2.10.5001: UDP, length 1470
23:03:17.796611 IP 10.0.1.10.52969 > 10.0.2.10.5001: UDP, length 1470
23:03:17.807739 IP 10.0.1.10.52969 > 10.0.2.10.5001: UDP, length 1470
23:03:17.819551 IP 10.0.1.10.52969 > 10.0.2.10.5001: UDP, length 1470
23:03:17.830550 IP 10.0.1.10.52969 > 10.0.2.10.5001: UDP, length 1470
23:03:17.841759 IP 10.0.1.10.52969 > 10.0.2.10.5001: UDP, length 1470
23:03:17.855196 IP 10.0.1.10.52969 > 10.0.2.10.5001: UDP, length 1470
23:03:17.863697 IP 10.0.1.10.52969 > 10.0.2.10.5001: UDP, length 1470
23:03:17.875056 IP 10.0.1.10.52969 > 10.0.2.10.5001: UDP, length 1470
23:03:17.886507 IP 10.0.1.10.52969 > 10.0.2.10.5001: UDP, length 1470
23:03:17.897614 IP 10.0.1.10.52969 > 10.0.2.10.5001: UDP, length 1470
23:03:17.908770 IP 10.0.1.10.52969 > 10.0.2.10.5001: UDP, length 1470
23:03:17.919740 IP 10.0.1.10.52969 > 10.0.2.10.5001: UDP, length 1470
23:03:17.930989 IP 10.0.1.10.52969 > 10.0.2.10.5001: UDP, length 1470
23:03:17.942495 IP 10.0.1.10.52969 > 10.0.2.10.5001: UDP, length 1470
23:03:17.953831 IP 10.0.1.10.52969 > 10.0.2.10.5001: UDP, length 1470
23:03:17.964826 IP 10.0.1.10.52969 > 10.0.2.10.5001: UDP, length 1470
23:03:17.976044 IP 10.0.1.10.52969 > 10.0.2.10.5001: UDP, length 1470
23:03:17.987103 IP 10.0.1.10.52969 > 10.0.2.10.5001: UDP, length 1470
23:03:17.998805 IP 10.0.1.10.52969 > 10.0.2.10.5001: UDP, length 1470
23:03:18.009865 IP 10.0.1.10.52969 > 10.0.2.10.5001: UDP, length 1470
23:03:18.020873 IP 10.0.1.10.52969 > 10.0.2.10.5001: UDP, length 1470
23:03:18.032123 IP 10.0.1.10.52969 > 10.0.2.10.5001: UDP, length 1470
23:03:18.043463 IP 10.0.1.10.52969 > 10.0.2.10.5001: UDP, length 1470
23:03:18.054553 IP 10.0.1.10.52969 > 10.0.2.10.5001: UDP, length 1470
23:03:18.065978 IP 10.0.1.10.52969 > 10.0.2.10.5001: UDP, length 1470
23:03:18.077093 IP 10.0.1.10.52969 > 10.0.2.10.5001: UDP, length 1470
23:03:18.088232 IP 10.0.1.10.52969 > 10.0.2.10.5001: UDP, length 1470
23:03:18.099219 IP 10.0.1.10.52969 > 10.0.2.10.5001: UDP, length 1470
23:03:18.110737 IP 10.0.1.10.52969 > 10.0.2.10.5001: UDP, length 1470
23:03:18.122267 IP 10.0.1.10.52969 > 10.0.2.10.5001: UDP, length 1470
23:03:18.133227 IP 10.0.1.10.52969 > 10.0.2.10.5001: UDP, length 1470
23:03:18.144270 IP 10.0.1.10.52969 > 10.0.2.10.5001: UDP, length 1470
23:03:18.155409 IP 10.0.1.10.52969 > 10.0.2.10.5001: UDP, length 1470
23:03:18.166944 IP 10.0.1.10.52969 > 10.0.2.10.5001: UDP, length 1470
23:03:18.178161 IP 10.0.1.10.52969 > 10.0.2.10.5001: UDP, length 1470
23:03:18.189240 IP 10.0.1.10.52969 > 10.0.2.10.5001: UDP, length 1470
23:03:18.200366 IP 10.0.1.10.52969 > 10.0.2.10.5001: UDP, length 1470
23:03:18.211365 IP 10.0.1.10.52969 > 10.0.2.10.5001: UDP, length 1470
23:03:18.222878 IP 10.0.1.10.52969 > 10.0.2.10.5001: UDP, length 1470
23:03:18.234102 IP 10.0.1.10.52969 > 10.0.2.10.5001: UDP, length 1470
23:03:18.245112 IP 10.0.1.10.52969 > 10.0.2.10.5001: UDP, length 1470
23:03:18.256816 IP 10.0.1.10.52969 > 10.0.2.10.5001: UDP, length 1470
23:03:18.267499 IP 10.0.1.10.52969 > 10.0.2.10.5001: UDP, length 1470
23:03:18.279074 IP 10.0.1.10.52969 > 10.0.2.10.5001: UDP, length 1470
23:03:18.290246 IP 10.0.1.10.52969 > 10.0.2.10.5001: UDP, length 1470
23:03:18.301405 IP 10.0.1.10.52969 > 10.0.2.10.5001: UDP, length 1470
23:03:18.312514 IP 10.0.1.10.52969 > 10.0.2.10.5001: UDP, length 1470
23:03:18.323567 IP 10.0.1.10.52969 > 10.0.2.10.5001: UDP, length 1470
23:03:18.335254 IP 10.0.1.10.52969 > 10.0.2.10.5001: UDP, length 1470
23:03:18.346122 IP 10.0.1.10.52969 > 10.0.2.10.5001: UDP, length 1470
23:03:18.357559 IP 10.0.1.10.52969 > 10.0.2.10.5001: UDP, length 1470
23:03:18.368499 IP 10.0.1.10.52969 > 10.0.2.10.5001: UDP, length 1470
23:03:18.379798 IP 10.0.1.10.52969 > 10.0.2.10.5001: UDP, length 1470
23:03:18.391140 IP 10.0.1.10.52969 > 10.0.2.10.5001: UDP, length 1470
23:03:18.402304 IP 10.0.1.10.52969 > 10.0.2.10.5001: UDP, length 1470
23:03:18.413199 IP 10.0.1.10.52969 > 10.0.2.10.5001: UDP, length 1470
23:03:18.424861 IP 10.0.1.10.52969 > 10.0.2.10.5001: UDP, length 1470
23:03:18.435734 IP 10.0.1.10.52969 > 10.0.2.10.5001: UDP, length 1470
23:03:18.447045 IP 10.0.1.10.52969 > 10.0.2.10.5001: UDP, length 1470
23:03:18.459121 IP 10.0.1.10.52969 > 10.0.2.10.5001: UDP, length 1470
23:03:18.469721 IP 10.0.1.10.52969 > 10.0.2.10.5001: UDP, length 1470
23:03:18.480870 IP 10.0.1.10.52969 > 10.0.2.10.5001: UDP, length 1470
23:03:18.491933 IP 10.0.1.10.52969 > 10.0.2.10.5001: UDP, length 1470
23:03:18.503115 IP 10.0.1.10.52969 > 10.0.2.10.5001: UDP, length 1470
23:03:18.514785 IP 10.0.1.10.52969 > 10.0.2.10.5001: UDP, length 1470
23:03:18.525433 IP 10.0.1.10.52969 > 10.0.2.10.5001: UDP, length 1470
23:03:18.536940 IP 10.0.1.10.52969 > 10.0.2.10.5001: UDP, length 1470
23:03:18.548184 IP 10.0.1.10.52969 > 10.0.2.10.5001: UDP, length 1470
23:03:18.560003 IP 10.0.1.10.52969 > 10.0.2.10.5001: UDP, length 1470
23:03:18.571100 IP 10.0.1.10.52969 > 10.0.2.10.5001: UDP, length 1470
23:03:18.582041 IP 10.0.1.10.52969 > 10.0.2.10.5001: UDP, length 1470
23:03:18.593118 IP 10.0.1.10.52969 > 10.0.2.10.5001: UDP, length 1470
23:03:18.604286 IP 10.0.1.10.52969 > 10.0.2.10.5001: UDP, length 1470
23:03:18.615388 IP 10.0.1.10.52969 > 10.0.2.10.5001: UDP, length 1470
23:03:18.626942 IP 10.0.1.10.52969 > 10.0.2.10.5001: UDP, length 1470
23:03:18.638068 IP 10.0.1.10.52969 > 10.0.2.10.5001: UDP, length 1470
23:03:18.649168 IP 10.0.1.10.52969 > 10.0.2.10.5001: UDP, length 1470
23:03:18.660141 IP 10.0.1.10.52969 > 10.0.2.10.5001: UDP, length 1470
23:03:18.671398 IP 10.0.1.10.52969 > 10.0.2.10.5001: UDP, length 1470
23:03:18.682908 IP 10.0.1.10.52969 > 10.0.2.10.5001: UDP, length 1470
23:03:18.694244 IP 10.0.1.10.52969 > 10.0.2.10.5001: UDP, length 1470
23:03:18.705245 IP 10.0.1.10.52969 > 10.0.2.10.5001: UDP, length 1470
23:03:18.716418 IP 10.0.1.10.52969 > 10.0.2.10.5001: UDP, length 1470
23:03:18.727440 IP 10.0.1.10.52969 > 10.0.2.10.5001: UDP, length 1470
23:03:18.739331 IP 10.0.1.10.52969 > 10.0.2.10.5001: UDP, length 1470
23:03:18.750257 IP 10.0.1.10.52969 > 10.0.2.10.5001: UDP, length 1470
23:03:18.761206 IP 10.0.1.10.52969 > 10.0.2.10.5001: UDP, length 1470
23:03:18.772418 IP 10.0.1.10.52969 > 10.0.2.10.5001: UDP, length 1470
23:03:18.783413 IP 10.0.1.10.52969 > 10.0.2.10.5001: UDP, length 1470
23:03:18.795018 IP 10.0.1.10.52969 > 10.0.2.10.5001: UDP, length 1470
23:03:18.806161 IP 10.0.1.10.52969 > 10.0.2.10.5001: UDP, length 1470
23:03:18.817452 IP 10.0.1.10.52969 > 10.0.2.10.5001: UDP, length 1470
23:03:18.828431 IP 10.0.1.10.52969 > 10.0.2.10.5001: UDP, length 1470
23:03:18.839647 IP 10.0.1.10.52969 > 10.0.2.10.5001: UDP, length 1470
23:03:18.851122 IP 10.0.1.10.52969 > 10.0.2.10.5001: UDP, length 1470
23:03:18.862305 IP 10.0.1.10.52969 > 10.0.2.10.5001: UDP, length 1470
23:03:18.873479 IP 10.0.1.10.52969 > 10.0.2.10.5001: UDP, length 1470
23:03:18.884542 IP 10.0.1.10.52969 > 10.0.2.10.5001: UDP, length 1470
23:03:18.895556 IP 10.0.1.10.52969 > 10.0.2.10.5001: UDP, length 1470
23:03:18.907059 IP 10.0.1.10.52969 > 10.0.2.10.5001: UDP, length 1470
23:03:18.918186 IP 10.0.1.10.52969 > 10.0.2.10.5001: UDP, length 1470
23:03:18.929264 IP 10.0.1.10.52969 > 10.0.2.10.5001: UDP, length 1470
23:03:18.940538 IP 10.0.1.10.52969 > 10.0.2.10.5001: UDP, length 1470
23:03:18.951578 IP 10.0.1.10.52969 > 10.0.2.10.5001: UDP, length 1470
23:03:18.962968 IP 10.0.1.10.52969 > 10.0.2.10.5001: UDP, length 1470
23:03:18.974003 IP 10.0.1.10.52969 > 10.0.2.10.5001: UDP, length 1470
23:03:18.985291 IP 10.0.1.10.52969 > 10.0.2.10.5001: UDP, length 1470
23:03:18.996557 IP 10.0.1.10.52969 > 10.0.2.10.5001: UDP, length 1470
23:03:19.007728 IP 10.0.1.10.52969 > 10.0.2.10.5001: UDP, length 1470
23:03:19.019392 IP 10.0.1.10.52969 > 10.0.2.10.5001: UDP, length 1470
23:03:19.030551 IP 10.0.1.10.52969 > 10.0.2.10.5001: UDP, length 1470
23:03:19.041674 IP 10.0.1.10.52969 > 10.0.2.10.5001: UDP, length 1470
23:03:19.052640 IP 10.0.1.10.52969 > 10.0.2.10.5001: UDP, length 1470
23:03:19.063823 IP 10.0.1.10.52969 > 10.0.2.10.5001: UDP, length 1470
23:03:19.075149 IP 10.0.1.10.52969 > 10.0.2.10.5001: UDP, length 1470
23:03:19.086877 IP 10.0.1.10.52969 > 10.0.2.10.5001: UDP, length 1470
23:03:19.098149 IP 10.0.1.10.52969 > 10.0.2.10.5001: UDP, length 1470
23:03:19.108754 IP 10.0.1.10.52969 > 10.0.2.10.5001: UDP, length 1470
23:03:19.119842 IP 10.0.1.10.52969 > 10.0.2.10.5001: UDP, length 1470
23:03:19.131432 IP 10.0.1.10.52969 > 10.0.2.10.5001: UDP, length 1470
23:03:19.142408 IP 10.0.1.10.52969 > 10.0.2.10.5001: UDP, length 1470
23:03:19.153766 IP 10.0.1.10.52969 > 10.0.2.10.5001: UDP, length 1470
23:03:19.165000 IP 10.0.1.10.52969 > 10.0.2.10.5001: UDP, length 1470
23:03:19.175929 IP 10.0.1.10.52969 > 10.0.2.10.5001: UDP, length 1470
23:03:19.187326 IP 10.0.1.10.52969 > 10.0.2.10.5001: UDP, length 1470
23:03:19.198758 IP 10.0.1.10.52969 > 10.0.2.10.5001: UDP, length 1470
23:03:19.209933 IP 10.0.1.10.52969 > 10.0.2.10.5001: UDP, length 1470
23:03:19.220918 IP 10.0.1.10.52969 > 10.0.2.10.5001: UDP, length 1470
23:03:19.232266 IP 10.0.1.10.52969 > 10.0.2.10.5001: UDP, length 1470
23:03:19.243114 IP 10.0.1.10.52969 > 10.0.2.10.5001: UDP, length 1470
23:03:19.254603 IP 10.0.1.10.52969 > 10.0.2.10.5001: UDP, length 1470
23:03:19.265754 IP 10.0.1.10.52969 > 10.0.2.10.5001: UDP, length 1470
23:03:19.276901 IP 10.0.1.10.52969 > 10.0.2.10.5001: UDP, length 1470
23:03:19.288171 IP 10.0.1.10.52969 > 10.0.2.10.5001: UDP, length 1470
23:03:19.299416 IP 10.0.1.10.52969 > 10.0.2.10.5001: UDP, length 1470
23:03:19.310786 IP 10.0.1.10.52969 > 10.0.2.10.5001: UDP, length 1470
23:03:19.321944 IP 10.0.1.10.52969 > 10.0.2.10.5001: UDP, length 1470
23:03:19.333288 IP 10.0.1.10.52969 > 10.0.2.10.5001: UDP, length 1470
23:03:19.344245 IP 10.0.1.10.52969 > 10.0.2.10.5001: UDP, length 1470
23:03:19.355481 IP 10.0.1.10.52969 > 10.0.2.10.5001: UDP, length 1470
23:03:19.366733 IP 10.0.1.10.52969 > 10.0.2.10.5001: UDP, length 1470
23:03:19.377945 IP 10.0.1.10.52969 > 10.0.2.10.5001: UDP, length 1470
23:03:19.389141 IP 10.0.1.10.52969 > 10.0.2.10.5001: UDP, length 1470
23:03:19.400524 IP 10.0.1.10.52969 > 10.0.2.10.5001: UDP, length 1470
23:03:19.411474 IP 10.0.1.10.52969 > 10.0.2.10.5001: UDP, length 1470
23:03:19.424953 IP 10.0.1.10.52969 > 10.0.2.10.5001: UDP, length 1470
23:03:19.433953 IP 10.0.1.10.52969 > 10.0.2.10.5001: UDP, length 1470
23:03:19.445133 IP 10.0.1.10.52969 > 10.0.2.10.5001: UDP, length 1470
23:03:19.456350 IP 10.0.1.10.52969 > 10.0.2.10.5001: UDP, length 1470
23:03:19.467409 IP 10.0.1.10.52969 > 10.0.2.10.5001: UDP, length 1470
23:03:19.479142 IP 10.0.1.10.52969 > 10.0.2.10.5001: UDP, length 1470
23:03:19.490025 IP 10.0.1.10.52969 > 10.0.2.10.5001: UDP, length 1470
23:03:19.501433 IP 10.0.1.10.52969 > 10.0.2.10.5001: UDP, length 1470
23:03:19.512439 IP 10.0.1.10.52969 > 10.0.2.10.5001: UDP, length 1470
23:03:19.523691 IP 10.0.1.10.52969 > 10.0.2.10.5001: UDP, length 1470
23:03:19.534832 IP 10.0.1.10.52969 > 10.0.2.10.5001: UDP, length 1470
23:03:19.546285 IP 10.0.1.10.52969 > 10.0.2.10.5001: UDP, length 1470
23:03:19.557229 IP 10.0.1.10.52969 > 10.0.2.10.5001: UDP, length 1470
23:03:19.568614 IP 10.0.1.10.52969 > 10.0.2.10.5001: UDP, length 1470
23:03:19.579621 IP 10.0.1.10.52969 > 10.0.2.10.5001: UDP, length 1470
23:03:19.591129 IP 10.0.1.10.52969 > 10.0.2.10.5001: UDP, length 1470
23:03:19.602398 IP 10.0.1.10.52969 > 10.0.2.10.5001: UDP, length 1470
23:03:19.613961 IP 10.0.1.10.52969 > 10.0.2.10.5001: UDP, length 1470
23:03:19.625101 IP 10.0.1.10.52969 > 10.0.2.10.5001: UDP, length 1470
23:03:19.635858 IP 10.0.1.10.52969 > 10.0.2.10.5001: UDP, length 1470
23:03:19.647843 IP 10.0.1.10.52969 > 10.0.2.10.5001: UDP, length 1470
23:03:19.658924 IP 10.0.1.10.52969 > 10.0.2.10.5001: UDP, length 1470
23:03:19.669710 IP 10.0.1.10.52969 > 10.0.2.10.5001: UDP, length 1470
23:03:19.680660 IP 10.0.1.10.52969 > 10.0.2.10.5001: UDP, length 1470
23:03:19.691891 IP 10.0.1.10.52969 > 10.0.2.10.5001: UDP, length 1470
23:03:19.702890 IP 10.0.1.10.52969 > 10.0.2.10.5001: UDP, length 1470
23:03:19.714381 IP 10.0.1.10.52969 > 10.0.2.10.5001: UDP, length 1470
23:03:19.725577 IP 10.0.1.10.52969 > 10.0.2.10.5001: UDP, length 1470
23:03:19.736721 IP 10.0.1.10.52969 > 10.0.2.10.5001: UDP, length 1470
23:03:19.747868 IP 10.0.1.10.52969 > 10.0.2.10.5001: UDP, length 1470
23:03:19.759111 IP 10.0.1.10.52969 > 10.0.2.10.5001: UDP, length 1470
23:03:19.770539 IP 10.0.1.10.52969 > 10.0.2.10.5001: UDP, length 1470
23:03:19.782073 IP 10.0.1.10.52969 > 10.0.2.10.5001: UDP, length 1470
23:03:19.792823 IP 10.0.1.10.52969 > 10.0.2.10.5001: UDP, length 1470
23:03:19.804701 IP 10.0.1.10.52969 > 10.0.2.10.5001: UDP, length 1470
23:03:19.815191 IP 10.0.1.10.52969 > 10.0.2.10.5001: UDP, length 1470
23:03:19.826923 IP 10.0.1.10.52969 > 10.0.2.10.5001: UDP, length 1470
23:03:19.837710 IP 10.0.1.10.52969 > 10.0.2.10.5001: UDP, length 1470
23:03:19.848882 IP 10.0.1.10.52969 > 10.0.2.10.5001: UDP, length 1470
23:03:19.860043 IP 10.0.1.10.52969 > 10.0.2.10.5001: UDP, length 1470
23:03:19.871330 IP 10.0.1.10.52969 > 10.0.2.10.5001: UDP, length 1470
23:03:19.883058 IP 10.0.1.10.52969 > 10.0.2.10.5001: UDP, length 1470
23:03:19.894000 IP 10.0.1.10.52969 > 10.0.2.10.5001: UDP, length 1470
23:03:19.905112 IP 10.0.1.10.52969 > 10.0.2.10.5001: UDP, length 1470
23:03:19.916451 IP 10.0.1.10.52969 > 10.0.2.10.5001: UDP, length 1470
23:03:19.927507 IP 10.0.1.10.52969 > 10.0.2.10.5001: UDP, length 1470
23:03:19.938835 IP 10.0.1.10.52969 > 10.0.2.10.5001: UDP, length 1470
23:03:19.950514 IP 10.0.1.10.52969 > 10.0.2.10.5001: UDP, length 1470
23:03:19.961954 IP 10.0.1.10.52969 > 10.0.2.10.5001: UDP, length 1470
23:03:19.972224 IP 10.0.1.10.52969 > 10.0.2.10.5001: UDP, length 1470
23:03:19.983499 IP 10.0.1.10.52969 > 10.0.2.10.5001: UDP, length 1470
23:03:19.995029 IP 10.0.1.10.52969 > 10.0.2.10.5001: UDP, length 1470
23:03:20.005828 IP 10.0.1.10.52969 > 10.0.2.10.5001: UDP, length 1470
23:03:20.017121 IP 10.0.1.10.52969 > 10.0.2.10.5001: UDP, length 1470
23:03:20.028200 IP 10.0.1.10.52969 > 10.0.2.10.5001: UDP, length 1470
23:03:20.039373 IP 10.0.1.10.52969 > 10.0.2.10.5001: UDP, length 1470
23:03:20.051293 IP 10.0.1.10.52969 > 10.0.2.10.5001: UDP, length 1470
23:03:20.062695 IP 10.0.1.10.52969 > 10.0.2.10.5001: UDP, length 1470
23:03:20.073818 IP 10.0.1.10.52969 > 10.0.2.10.5001: UDP, length 1470
23:03:20.084559 IP 10.0.1.10.52969 > 10.0.2.10.5001: UDP, length 1470
23:03:20.095947 IP 10.0.1.10.52969 > 10.0.2.10.5001: UDP, length 1470
23:03:20.107769 IP 10.0.1.10.52969 > 10.0.2.10.5001: UDP, length 1470
23:03:20.119117 IP 10.0.1.10.52969 > 10.0.2.10.5001: UDP, length 1470
23:03:20.129315 IP 10.0.1.10.52969 > 10.0.2.10.5001: UDP, length 1470
23:03:20.140946 IP 10.0.1.10.52969 > 10.0.2.10.5001: UDP, length 1470
23:03:20.152325 IP 10.0.1.10.52969 > 10.0.2.10.5001: UDP, length 1470
23:03:20.163047 IP 10.0.1.10.52969 > 10.0.2.10.5001: UDP, length 1470
23:03:20.173954 IP 10.0.1.10.52969 > 10.0.2.10.5001: UDP, length 1470
23:03:20.185434 IP 10.0.1.10.52969 > 10.0.2.10.5001: UDP, length 1470
23:03:20.196551 IP 10.0.1.10.52969 > 10.0.2.10.5001: UDP, length 1470
23:03:20.207683 IP 10.0.1.10.52969 > 10.0.2.10.5001: UDP, length 1470
23:03:20.219061 IP 10.0.1.10.52969 > 10.0.2.10.5001: UDP, length 1470
23:03:20.231051 IP 10.0.1.10.52969 > 10.0.2.10.5001: UDP, length 1470
23:03:20.241763 IP 10.0.1.10.52969 > 10.0.2.10.5001: UDP, length 1470
23:03:20.252583 IP 10.0.1.10.52969 > 10.0.2.10.5001: UDP, length 1470

