23:02:37.685043 IP 10.0.1.10.44692 > 10.0.2.10.5001: UDP, length 1470
23:02:37.696074 IP 10.0.1.10.44692 > 10.0.2.10.5001: UDP, length 1470
23:02:37.707267 IP 10.0.1.10.44692 > 10.0.2.10.5001: UDP, length 1470
23:02:37.718655 IP 10.0.1.10.44692 > 10.0.2.10.5001: UDP, length 1470
23:02:37.730041 IP 10.0.1.10.44692 > 10.0.2.10.5001: UDP, length 1470
23:02:37.740894 IP 10.0.1.10.44692 > 10.0.2.10.5001: UDP, length 1470
23:02:37.752156 IP 10.0.1.10.44692 > 10.0.2.10.5001: UDP, length 1470
23:02:37.763378 IP 10.0.1.10.44692 > 10.0.2.10.5001: UDP, length 1470
23:02:37.774551 IP 10.0.1.10.44692 > 10.0.2.10.5001: UDP, length 1470
23:02:37.786096 IP 10.0.1.10.44692 > 10.0.2.10.5001: UDP, length 1470
23:02:37.797075 IP 10.0.1.10.44692 > 10.0.2.10.5001: UDP, length 1470
23:02:37.809174 IP 10.0.1.10.44692 > 10.0.2.10.5001: UDP, length 1470
23:02:37.819747 IP 10.0.1.10.44692 > 10.0.2.10.5001: UDP, length 1470
23:02:37.830676 IP 10.0.1.10.44692 > 10.0.2.10.5001: UDP, length 1470
23:02:37.841892 IP 10.0.1.10.44692 > 10.0.2.10.5001: UDP, length 1470
23:02:37.853149 IP 10.0.1.10.44692 > 10.0.2.10.5001: UDP, length 1470
23:02:37.864317 IP 10.0.1.10.44692 > 10.0.2.10.5001: UDP, length 1470
23:02:37.875488 IP 10.0.1.10.44692 > 10.0.2.10.5001: UDP, length 1470
23:02:37.886730 IP 10.0.1.10.44692 > 10.0.2.10.5001: UDP, length 1470
23:02:37.897983 IP 10.0.1.10.44692 > 10.0.2.10.5001: UDP, length 1470
23:02:37.909353 IP 10.0.1.10.44692 > 10.0.2.10.5001: UDP, length 1470
23:02:37.920441 IP 10.0.1.10.44692 > 10.0.2.10.5001: UDP, length 1470
23:02:37.931633 IP 10.0.1.10.44692 > 10.0.2.10.5001: UDP, length 1470
23:02:37.943572 IP 10.0.1.10.44692 > 10.0.2.10.5001: UDP, length 1470
23:02:37.954226 IP 10.0.1.10.44692 > 10.0.2.10.5001: UDP, length 1470
23:02:37.965235 IP 10.0.1.10.44692 > 10.0.2.10.5001: UDP, length 1470
23:02:37.976543 IP 10.0.1.10.44692 > 10.0.2.10.5001: UDP, length 1470
23:02:37.987678 IP 10.0.1.10.44692 > 10.0.2.10.5001: UDP, length 1470
23:02:37.998821 IP 10.0.1.10.44692 > 10.0.2.10.5001: UDP, length 1470
23:02:38.010249 IP 10.0.1.10.44692 > 10.0.2.10.5001: UDP, length 1470
23:02:38.021398 IP 10.0.1.10.44692 > 10.0.2.10.5001: UDP, length 1470
23:02:38.032684 IP 10.0.1.10.44692 > 10.0.2.10.5001: UDP, length 1470
23:02:38.043688 IP 10.0.1.10.44692 > 10.0.2.10.5001: UDP, length 1470
23:02:38.054883 IP 10.0.1.10.44692 > 10.0.2.10.5001: UDP, length 1470
23:02:38.066322 IP 10.0.1.10.44692 > 10.0.2.10.5001: UDP, length 1470
23:02:38.077379 IP 10.0.1.10.44692 > 10.0.2.10.5001: UDP, length 1470
23:02:38.088769 IP 10.0.1.10.44692 > 10.0.2.10.5001: UDP, length 1470
23:02:38.099891 IP 10.0.1.10.44692 > 10.0.2.10.5001: UDP, length 1470
23:02:38.111032 IP 10.0.1.10.44692 > 10.0.2.10.5001: UDP, length 1470
23:02:38.122658 IP 10.0.1.10.44692 > 10.0.2.10.5001: UDP, length 1470
23:02:38.133878 IP 10.0.1.10.44692 > 10.0.2.10.5001: UDP, length 1470
23:02:38.144667 IP 10.0.1.10.44692 > 10.0.2.10.5001: UDP, length 1470
23:02:38.156308 IP 10.0.1.10.44692 > 10.0.2.10.5001: UDP, length 1470
23:02:38.167150 IP 10.0.1.10.44692 > 10.0.2.10.5001: UDP, length 1470
23:02:38.178304 IP 10.0.1.10.44692 > 10.0.2.10.5001: UDP, length 1470
23:02:38.189779 IP 10.0.1.10.44692 > 10.0.2.10.5001: UDP, length 1470
23:02:38.200912 IP 10.0.1.10.44692 > 10.0.2.10.5001: UDP, length 1470
23:02:38.212080 IP 10.0.1.10.44692 > 10.0.2.10.5001: UDP, length 1470
23:02:38.223420 IP 10.0.1.10.44692 > 10.0.2.10.5001: UDP, length 1470
23:02:38.234674 IP 10.0.1.10.44692 > 10.0.2.10.5001: UDP, length 1470
23:02:38.245723 IP 10.0.1.10.44692 > 10.0.2.10.5001: UDP, length 1470
23:02:38.256911 IP 10.0.1.10.44692 > 10.0.2.10.5001: UDP, length 1470
23:02:38.268072 IP 10.0.1.10.44692 > 10.0.2.10.5001: UDP, length 1470
23:02:38.279360 IP 10.0.1.10.44692 > 10.0.2.10.5001: UDP, length 1470
23:02:38.291044 IP 10.0.1.10.44692 > 10.0.2.10.5001: UDP, length 1470
23:02:38.301883 IP 10.0.1.10.44692 > 10.0.2.10.5001: UDP, length 1470
23:02:38.312964 IP 10.0.1.10.44692 > 10.0.2.10.5001: UDP, length 1470
23:02:38.324398 IP 10.0.1.10.44692 > 10.0.2.10.5001: UDP, length 1470
23:02:38.335609 IP 10.0.1.10.44692 > 10.0.2.10.5001: UDP, length 1470
23:02:38.346557 IP 10.0.1.10.44692 > 10.0.2.10.5001: UDP, length 1470
23:02:38.359705 IP 10.0.1.10.44692 > 10.0.2.10.5001: UDP, length 1470
23:02:38.369334 IP 10.0.1.10.44692 > 10.0.2.10.5001: UDP, length 1470
23:02:38.380314 IP 10.0.1.10.44692 > 10.0.2.10.5001: UDP, length 1470
23:02:38.391678 IP 10.0.1.10.44692 > 10.0.2.10.5001: UDP, length 1470
23:02:38.402864 IP 10.0.1.10.44692 > 10.0.2.10.5001: UDP, length 1470
23:02:38.413941 IP 10.0.1.10.44692 > 10.0.2.10.5001: UDP, length 1470
23:02:38.425481 IP 10.0.1.10.44692 > 10.0.2.10.5001: UDP, length 1470
23:02:38.436584 IP 10.0.1.10.44692 > 10.0.2.10.5001: UDP, length 1470
23:02:38.447470 IP 10.0.1.10.44692 > 10.0.2.10.5001: UDP, length 1470
23:02:38.458792 IP 10.0.1.10.44692 > 10.0.2.10.5001: UDP, length 1470
23:02:38.469814 IP 10.0.1.10.44692 > 10.0.2.10.5001: UDP, length 1470
23:02:38.481451 IP 10.0.1.10.44692 > 10.0.2.10.5001: UDP, length 1470
23:02:38.492504 IP 10.0.1.10.44692 > 10.0.2.10.5001: UDP, length 1470
23:02:38.503638 IP 10.0.1.10.44692 > 10.0.2.10.5001: UDP, length 1470
23:02:38.514912 IP 10.0.1.10.44692 > 10.0.2.10.5001: UDP, length 1470
23:02:38.526010 IP 10.0.1.10.44692 > 10.0.2.10.5001: UDP, length 1470
23:02:38.537343 IP 10.0.1.10.44692 > 10.0.2.10.5001: UDP, length 1470
23:02:38.548552 IP 10.0.1.10.44692 > 10.0.2.10.5001: UDP, length 1470
23:02:38.559637 IP 10.0.1.10.44692 > 10.0.2.10.5001: UDP, length 1470
23:02:38.570848 IP 10.0.1.10.44692 > 10.0.2.10.5001: UDP, length 1470
23:02:38.582338 IP 10.0.1.10.44692 > 10.0.2.10.5001: UDP, length 1470
23:02:38.593617 IP 10.0.1.10.44692 > 10.0.2.10.5001: UDP, length 1470
23:02:38.604820 IP 10.0.1.10.44692 > 10.0.2.10.5001: UDP, length 1470
23:02:38.616133 IP 10.0.1.10.44692 > 10.0.2.10.5001: UDP, length 1470
23:02:38.627165 IP 10.0.1.10.44692 > 10.0.2.10.5001: UDP, length 1470
23:02:38.638222 IP 10.0.1.10.44692 > 10.0.2.10.5001: UDP, length 1470
23:02:38.649601 IP 10.0.1.10.44692 > 10.0.2.10.5001: UDP, length 1470
23:02:38.660939 IP 10.0.1.10.44692 > 10.0.2.10.5001: UDP, length 1470
23:02:38.671876 IP 10.0.1.10.44692 > 10.0.2.10.5001: UDP, length 1470
23:02:38.683072 IP 10.0.1.10.44692 > 10.0.2.10.5001: UDP, length 1470
23:02:38.694582 IP 10.0.1.10.44692 > 10.0.2.10.5001: UDP, length 1470
23:02:38.705729 IP 10.0.1.10.44692 > 10.0.2.10.5001: UDP, length 1470
23:02:38.716903 IP 10.0.1.10.44692 > 10.0.2.10.5001: UDP, length 1470
23:02:38.728195 IP 10.0.1.10.44692 > 10.0.2.10.5001: UDP, length 1470
23:02:38.739501 IP 10.0.1.10.44692 > 10.0.2.10.5001: UDP, length 1470
23:02:38.750934 IP 10.0.1.10.44692 > 10.0.2.10.5001: UDP, length 1470
23:02:38.761979 IP 10.0.1.10.44692 > 10.0.2.10.5001: UDP, length 1470
23:02:38.773185 IP 10.0.1.10.44692 > 10.0.2.10.5001: UDP, length 1470
23:02:38.784242 IP 10.0.1.10.44692 > 10.0.2.10.5001: UDP, length 1470
23:02:38.795972 IP 10.0.1.10.44692 > 10.0.2.10.5001: UDP, length 1470
23:02:38.806780 IP 10.0.1.10.44692 > 10.0.2.10.5001: UDP, length 1470
23:02:38.817616 IP 10.0.1.10.44692 > 10.0.2.10.5001: UDP, length 1470
23:02:38.828913 IP 10.0.1.10.44692 > 10.0.2.10.5001: UDP, length 1470
23:02:38.840172 IP 10.0.1.10.44692 > 10.0.2.10.5001: UDP, length 1470
23:02:38.851282 IP 10.0.1.10.44692 > 10.0.2.10.5001: UDP, length 1470
23:02:38.862994 IP 10.0.1.10.44692 > 10.0.2.10.5001: UDP, length 1470
23:02:38.874026 IP 10.0.1.10.44692 > 10.0.2.10.5001: UDP, length 1470
23:02:38.885057 IP 10.0.1.10.44692 > 10.0.2.10.5001: UDP, length 1470
23:02:38.896266 IP 10.0.1.10.44692 > 10.0.2.10.5001: UDP, length 1470
23:02:38.907355 IP 10.0.1.10.44692 > 10.0.2.10.5001: UDP, length 1470
23:02:38.919041 IP 10.0.1.10.44692 > 10.0.2.10.5001: UDP, length 1470
23:02:38.930128 IP 10.0.1.10.44692 > 10.0.2.10.5001: UDP, length 1470
23:02:38.941824 IP 10.0.1.10.44692 > 10.0.2.10.5001: UDP, length 1470
23:02:38.952182 IP 10.0.1.10.44692 > 10.0.2.10.5001: UDP, length 1470
23:02:38.963397 IP 10.0.1.10.44692 > 10.0.2.10.5001: UDP, length 1470
23:02:38.974720 IP 10.0.1.10.44692 > 10.0.2.10.5001: UDP, length 1470
23:02:38.986019 IP 10.0.1.10.44692 > 10.0.2.10.5001: UDP, length 1470
23:02:38.997259 IP 10.0.1.10.44692 > 10.0.2.10.5001: UDP, length 1470
23:02:39.008351 IP 10.0.1.10.44692 > 10.0.2.10.5001: UDP, length 1470
23:02:39.019419 IP 10.0.1.10.44692 > 10.0.2.10.5001: UDP, length 1470
23:02:39.031173 IP 10.0.1.10.44692 > 10.0.2.10.5001: UDP, length 1470
23:02:39.042219 IP 10.0.1.10.44692 > 10.0.2.10.5001: UDP, length 1470
23:02:39.053342 IP 10.0.1.10.44692 > 10.0.2.10.5001: UDP, length 1470
23:02:39.064636 IP 10.0.1.10.44692 > 10.0.2.10.5001: UDP, length 1470
23:02:39.075552 IP 10.0.1.10.44692 > 10.0.2.10.5001: UDP, length 1470
23:02:39.086770 IP 10.0.1.10.44692 > 10.0.2.10.5001: UDP, length 1470
23:02:39.098052 IP 10.0.1.10.44692 > 10.0.2.10.5001: UDP, length 1470
23:02:39.109289 IP 10.0.1.10.44692 > 10.0.2.10.5001: UDP, length 1470
23:02:39.120411 IP 10.0.1.10.44692 > 10.0.2.10.5001: UDP, length 1470
23:02:39.132153 IP 10.0.1.10.44692 > 10.0.2.10.5001: UDP, length 1470
23:02:39.143115 IP 10.0.1.10.44692 > 10.0.2.10.5001: UDP, length 1470
23:02:39.154516 IP 10.0.1.10.44692 > 10.0.2.10.5001: UDP, length 1470
23:02:39.165721 IP 10.0.1.10.44692 > 10.0.2.10.5001: UDP, length 1470
23:02:39.176578 IP 10.0.1.10.44692 > 10.0.2.10.5001: UDP, length 1470
23:02:39.187856 IP 10.0.1.10.44692 > 10.0.2.10.5001: UDP, length 1470
23:02:39.199259 IP 10.0.1.10.44692 > 10.0.2.10.5001: UDP, length 1470
23:02:39.211055 IP 10.0.1.10.44692 > 10.0.2.10.5001: UDP, length 1470
23:02:39.221504 IP 10.0.1.10.44692 > 10.0.2.10.5001: UDP, length 1470
23:02:39.233083 IP 10.0.1.10.44692 > 10.0.2.10.5001: UDP, length 1470
23:02:39.245263 IP 10.0.1.10.44692 > 10.0.2.10.5001: UDP, length 1470
23:02:39.255260 IP 10.0.1.10.44692 > 10.0.2.10.5001: UDP, length 1470
23:02:39.266570 IP 10.0.1.10.44692 > 10.0.2.10.5001: UDP, length 1470
23:02:39.277570 IP 10.0.1.10.44692 > 10.0.2.10.5001: UDP, length 1470
23:02:39.288958 IP 10.0.1.10.44692 > 10.0.2.10.5001: UDP, length 1470
23:02:39.300365 IP 10.0.1.10.44692 > 10.0.2.10.5001: UDP, length 1470
23:02:39.311185 IP 10.0.1.10.44692 > 10.0.2.10.5001: UDP, length 1470
23:02:39.322342 IP 10.0.1.10.44692 > 10.0.2.10.5001: UDP, length 1470
23:02:39.334022 IP 10.0.1.10.44692 > 10.0.2.10.5001: UDP, length 1470
23:02:39.345017 IP 10.0.1.10.44692 > 10.0.2.10.5001: UDP, length 1470
23:02:39.356689 IP 10.0.1.10.44692 > 10.0.2.10.5001: UDP, length 1470
23:02:39.367356 IP 10.0.1.10.44692 > 10.0.2.10.5001: UDP, length 1470
23:02:39.378444 IP 10.0.1.10.44692 > 10.0.2.10.5001: UDP, length 1470
23:02:39.389872 IP 10.0.1.10.44692 > 10.0.2.10.5001: UDP, length 1470
23:02:39.401104 IP 10.0.1.10.44692 > 10.0.2.10.5001: UDP, length 1470
23:02:39.413154 IP 10.0.1.10.44692 > 10.0.2.10.5001: UDP, length 1470
23:02:39.423159 IP 10.0.1.10.44692 > 10.0.2.10.5001: UDP, length 1470
23:02:39.434735 IP 10.0.1.10.44692 > 10.0.2.10.5001: UDP, length 1470
23:02:39.445944 IP 10.0.1.10.44692 > 10.0.2.10.5001: UDP, length 1470
23:02:39.457234 IP 10.0.1.10.44692 > 10.0.2.10.5001: UDP, length 1470
23:02:39.468534 IP 10.0.1.10.44692 > 10.0.2.10.5001: UDP, length 1470
23:02:39.479469 IP 10.0.1.10.44692 > 10.0.2.10.5001: UDP, length 1470
23:02:39.490845 IP 10.0.1.10.44692 > 10.0.2.10.5001: UDP, length 1470
23:02:39.502580 IP 10.0.1.10.44692 > 10.0.2.10.5001: UDP, length 1470
23:02:39.513492 IP 10.0.1.10.44692 > 10.0.2.10.5001: UDP, length 1470
23:02:39.524260 IP 10.0.1.10.44692 > 10.0.2.10.5001: UDP, length 1470
23:02:39.535853 IP 10.0.1.10.44692 > 10.0.2.10.5001: UDP, length 1470
23:02:39.546879 IP 10.0.1.10.44692 > 10.0.2.10.5001: UDP, length 1470
23:02:39.558210 IP 10.0.1.10.44692 > 10.0.2.10.5001: UDP, length 1470
23:02:39.569354 IP 10.0.1.10.44692 > 10.0.2.10.5001: UDP, length 1470
23:02:39.581484 IP 10.0.1.10.44692 > 10.0.2.10.5001: UDP, length 1470
23:02:39.591465 IP 10.0.1.10.44692 > 10.0.2.10.5001: UDP, length 1470
23:02:39.602741 IP 10.0.1.10.44692 > 10.0.2.10.5001: UDP, length 1470
23:02:39.613950 IP 10.0.1.10.44692 > 10.0.2.10.5001: UDP, length 1470
23:02:39.625173 IP 10.0.1.10.44692 > 10.0.2.10.5001: UDP, length 1470
23:02:39.636291 IP 10.0.1.10.44692 > 10.0.2.10.5001: UDP, length 1470
23:02:39.647596 IP 10.0.1.10.44692 > 10.0.2.10.5001: UDP, length 1470
23:02:39.659908 IP 10.0.1.10.44692 > 10.0.2.10.5001: UDP, length 1470
23:02:39.670556 IP 10.0.1.10.44692 > 10.0.2.10.5001: UDP, length 1470
23:02:39.681497 IP 10.0.1.10.44692 > 10.0.2.10.5001: UDP, length 1470
23:02:39.692882 IP 10.0.1.10.44692 > 10.0.2.10.5001: UDP, length 1470
23:02:39.703680 IP 10.0.1.10.44692 > 10.0.2.10.5001: UDP, length 1470
23:02:39.715345 IP 10.0.1.10.44692 > 10.0.2.10.5001: UDP, length 1470
23:02:39.726521 IP 10.0.1.10.44692 > 10.0.2.10.5001: UDP, length 1470
23:02:39.738253 IP 10.0.1.10.44692 > 10.0.2.10.5001: UDP, length 1470
23:02:39.748771 IP 10.0.1.10.44692 > 10.0.2.10.5001: UDP, length 1470
23:02:39.760148 IP 10.0.1.10.44692 > 10.0.2.10.5001: UDP, length 1470
23:02:39.771521 IP 10.0.1.10.44692 > 10.0.2.10.5001: UDP, length 1470
23:02:39.782237 IP 10.0.1.10.44692 > 10.0.2.10.5001: UDP, length 1470
23:02:39.793656 IP 10.0.1.10.44692 > 10.0.2.10.5001: UDP, length 1470
23:02:39.804705 IP 10.0.1.10.44692 > 10.0.2.10.5001: UDP, length 1470
23:02:39.815939 IP 10.0.1.10.44692 > 10.0.2.10.5001: UDP, length 1470
23:02:39.827087 IP 10.0.1.10.44692 > 10.0.2.10.5001: UDP, length 1470
23:02:39.838458 IP 10.0.1.10.44692 > 10.0.2.10.5001: UDP, length 1470
23:02:39.849493 IP 10.0.1.10.44692 > 10.0.2.10.5001: UDP, length 1470
23:02:39.860722 IP 10.0.1.10.44692 > 10.0.2.10.5001: UDP, length 1470
23:02:39.871965 IP 10.0.1.10.44692 > 10.0.2.10.5001: UDP, length 1470
23:02:39.883268 IP 10.0.1.10.44692 > 10.0.2.10.5001: UDP, length 1470
23:02:39.894944 IP 10.0.1.10.44692 > 10.0.2.10.5001: UDP, length 1470
23:02:39.905776 IP 10.0.1.10.44692 > 10.0.2.10.5001: UDP, length 1470
23:02:39.916873 IP 10.0.1.10.44692 > 10.0.2.10.5001: UDP, length 1470
23:02:39.928039 IP 10.0.1.10.44692 > 10.0.2.10.5001: UDP, length 1470
23:02:39.939304 IP 10.0.1.10.44692 > 10.0.2.10.5001: UDP, length 1470
23:02:39.950941 IP 10.0.1.10.44692 > 10.0.2.10.5001: UDP, length 1470
23:02:39.961981 IP 10.0.1.10.44692 > 10.0.2.10.5001: UDP, length 1470
23:02:39.973109 IP 10.0.1.10.44692 > 10.0.2.10.5001: UDP, length 1470
23:02:39.984471 IP 10.0.1.10.44692 > 10.0.2.10.5001: UDP, length 1470
23:02:39.996451 IP 10.0.1.10.44692 > 10.0.2.10.5001: UDP, length 1470
23:02:40.006593 IP 10.0.1.10.44692 > 10.0.2.10.5001: UDP, length 1470
23:02:40.017812 IP 10.0.1.10.44692 > 10.0.2.10.5001: UDP, length 1470
23:02:40.029023 IP 10.0.1.10.44692 > 10.0.2.10.5001: UDP, length 1470
23:02:40.040205 IP 10.0.1.10.44692 > 10.0.2.10.5001: UDP, length 1470
23:02:40.051315 IP 10.0.1.10.44692 > 10.0.2.10.5001: UDP, length 1470
23:02:40.062834 IP 10.0.1.10.44692 > 10.0.2.10.5001: UDP, length 1470
23:02:40.073813 IP 10.0.1.10.44692 > 10.0.2.10.5001: UDP, length 1470
23:02:40.085376 IP 10.0.1.10.44692 > 10.0.2.10.5001: UDP, length 1470
23:02:40.096144 IP 10.0.1.10.44692 > 10.0.2.10.5001: UDP, length 1470
23:02:40.107368 IP 10.0.1.10.44692 > 10.0.2.10.5001: UDP, length 1470
23:02:40.118528 IP 10.0.1.10.44692 > 10.0.2.10.5001: UDP, length 1470
23:02:40.129890 IP 10.0.1.10.44692 > 10.0.2.10.5001: UDP, length 1470
23:02:40.140872 IP 10.0.1.10.44692 > 10.0.2.10.5001: UDP, length 1470
23:02:40.152611 IP 10.0.1.10.44692 > 10.0.2.10.5001: UDP, length 1470
23:02:40.163443 IP 10.0.1.10.44692 > 10.0.2.10.5001: UDP, length 1470
23:02:40.175234 IP 10.0.1.10.44692 > 10.0.2.10.5001: UDP, length 1470
23:02:40.186301 IP 10.0.1.10.44692 > 10.0.2.10.5001: UDP, length 1470
23:02:40.196989 IP 10.0.1.10.44692 > 10.0.2.10.5001: UDP, length 1470
23:02:40.208399 IP 10.0.1.10.44692 > 10.0.2.10.5001: UDP, length 1470
23:02:40.219723 IP 10.0.1.10.44692 > 10.0.2.10.5001: UDP, length 1470
23:02:40.231115 IP 10.0.1.10.44692 > 10.0.2.10.5001: UDP, length 1470
23:02:40.242332 IP 10.0.1.10.44692 > 10.0.2.10.5001: UDP, length 1470
23:02:40.253440 IP 10.0.1.10.44692 > 10.0.2.10.5001: UDP, length 1470
23:02:40.264731 IP 10.0.1.10.44692 > 10.0.2.10.5001: UDP, length 1470
23:02:40.275606 IP 10.0.1.10.44692 > 10.0.2.10.5001: UDP, length 1470
23:02:40.287447 IP 10.0.1.10.44692 > 10.0.2.10.5001: UDP, length 1470
23:02:40.298760 IP 10.0.1.10.44692 > 10.0.2.10.5001: UDP, length 1470
23:02:40.309922 IP 10.0.1.10.44692 > 10.0.2.10.5001: UDP, length 1470
23:02:40.320593 IP 10.0.1.10.44692 > 10.0.2.10.5001: UDP, length 1470
23:02:40.331883 IP 10.0.1.10.44692 > 10.0.2.10.5001: UDP, length 1470
23:02:40.343463 IP 10.0.1.10.44692 > 10.0.2.10.5001: UDP, length 1470
23:02:40.354488 IP 10.0.1.10.44692 > 10.0.2.10.5001: UDP, length 1470
23:02:40.366371 IP 10.0.1.10.44692 > 10.0.2.10.5001: UDP, length 1470
23:02:40.376715 IP 10.0.1.10.44692 > 10.0.2.10.5001: UDP, length 1470
23:02:40.387714 IP 10.0.1.10.44692 > 10.0.2.10.5001: UDP, length 1470
23:02:40.398904 IP 10.0.1.10.44692 > 10.0.2.10.5001: UDP, length 1470
23:02:40.410273 IP 10.0.1.10.44692 > 10.0.2.10.5001: UDP, length 1470
23:02:40.421736 IP 10.0.1.10.44692 > 10.0.2.10.5001: UDP, length 1470
23:02:40.432533 IP 10.0.1.10.44692 > 10.0.2.10.5001: UDP, length 1470
23:02:40.443818 IP 10.0.1.10.44692 > 10.0.2.10.5001: UDP, length 1470
23:02:40.455412 IP 10.0.1.10.44692 > 10.0.2.10.5001: UDP, length 1470
23:02:40.466769 IP 10.0.1.10.44692 > 10.0.2.10.5001: UDP, length 1470
23:02:40.478161 IP 10.0.1.10.44692 > 10.0.2.10.5001: UDP, length 1470
23:02:40.489011 IP 10.0.1.10.44692 > 10.0.2.10.5001: UDP, length 1470
23:02:40.500406 IP 10.0.1.10.44692 > 10.0.2.10.5001: UDP, length 1470
23:02:40.511762 IP 10.0.1.10.44692 > 10.0.2.10.5001: UDP, length 1470
23:02:40.522872 IP 10.0.1.10.44692 > 10.0.2.10.5001: UDP, length 1470
23:02:40.534956 IP 10.0.1.10.44692 > 10.0.2.10.5001: UDP, length 1470
23:02:40.545101 IP 10.0.1.10.44692 > 10.0.2.10.5001: UDP, length 1470
23:02:40.557069 IP 10.0.1.10.44692 > 10.0.2.10.5001: UDP, length 1470
23:02:40.568425 IP 10.0.1.10.44692 > 10.0.2.10.5001: UDP, length 1470
23:02:40.579562 IP 10.0.1.10.44692 > 10.0.2.10.5001: UDP, length 1470
23:02:40.590110 IP 10.0.1.10.44692 > 10.0.2.10.5001: UDP, length 1470
23:02:40.600760 IP 10.0.1.10.44692 > 10.0.2.10.5001: UDP, length 1470
23:02:40.611972 IP 10.0.1.10.44692 > 10.0.2.10.5001: UDP, length 1470
23:02:40.623121 IP 10.0.1.10.44692 > 10.0.2.10.5001: UDP, length 1470
23:02:40.634479 IP 10.0.1.10.44692 > 10.0.2.10.5001: UDP, length 1470
23:02:40.645951 IP 10.0.1.10.44692 > 10.0.2.10.5001: UDP, length 1470
23:02:40.656777 IP 10.0.1.10.44692 > 10.0.2.10.5001: UDP, length 1470
23:02:40.668224 IP 10.0.1.10.44692 > 10.0.2.10.5001: UDP, length 1470
23:02:40.679353 IP 10.0.1.10.44692 > 10.0.2.10.5001: UDP, length 1470
23:02:40.690672 IP 10.0.1.10.44692 > 10.0.2.10.5001: UDP, length 1470
23:02:40.701812 IP 10.0.1.10.44692 > 10.0.2.10.5001: UDP, length 1470
23:02:40.714179 IP 10.0.1.10.44692 > 10.0.2.10.5001: UDP, length 1470
23:02:40.724123 IP 10.0.1.10.44692 > 10.0.2.10.5001: UDP, length 1470
23:02:40.735365 IP 10.0.1.10.44692 > 10.0.2.10.5001: UDP, length 1470
23:02:40.746558 IP 10.0.1.10.44692 > 10.0.2.10.5001: UDP, length 1470
23:02:40.758036 IP 10.0.1.10.44692 > 10.0.2.10.5001: UDP, length 1470
23:02:40.769058 IP 10.0.1.10.44692 > 10.0.2.10.5001: UDP, length 1470
23:02:40.780458 IP 10.0.1.10.44692 > 10.0.2.10.5001: UDP, length 1470
23:02:40.791410 IP 10.0.1.10.44692 > 10.0.2.10.5001: UDP, length 1470
23:02:40.802717 IP 10.0.1.10.44692 > 10.0.2.10.5001: UDP, length 1470
23:02:40.813934 IP 10.0.1.10.44692 > 10.0.2.10.5001: UDP, length 1470
23:02:40.825253 IP 10.0.1.10.44692 > 10.0.2.10.5001: UDP, length 1470
23:02:40.836613 IP 10.0.1.10.44692 > 10.0.2.10.5001: UDP, length 1470
23:02:40.848355 IP 10.0.1.10.44692 > 10.0.2.10.5001: UDP, length 1470
23:02:40.858802 IP 10.0.1.10.44692 > 10.0.2.10.5001: UDP, length 1470
23:02:40.869792 IP 10.0.1.10.44692 > 10.0.2.10.5001: UDP, length 1470
23:02:40.881361 IP 10.0.1.10.44692 > 10.0.2.10.5001: UDP, length 1470
23:02:40.893703 IP 10.0.1.10.44692 > 10.0.2.10.5001: UDP, length 1470
23:02:40.903486 IP 10.0.1.10.44692 > 10.0.2.10.5001: UDP, length 1470
23:02:40.914969 IP 10.0.1.10.44692 > 10.0.2.10.5001: UDP, length 1470
23:02:40.926030 IP 10.0.1.10.44692 > 10.0.2.10.5001: UDP, length 1470
23:02:40.937147 IP 10.0.1.10.44692 > 10.0.2.10.5001: UDP, length 1470
23:02:40.948358 IP 10.0.1.10.44692 > 10.0.2.10.5001: UDP, length 1470
23:02:40.959576 IP 10.0.1.10.44692 > 10.0.2.10.5001: UDP, length 1470
23:02:40.971000 IP 10.0.1.10.44692 > 10.0.2.10.5001: UDP, length 1470
23:02:40.982280 IP 10.0.1.10.44692 > 10.0.2.10.5001: UDP, length 1470
23:02:40.993341 IP 10.0.1.10.44692 > 10.0.2.10.5001: UDP, length 1470
23:02:41.004479 IP 10.0.1.10.44692 > 10.0.2.10.5001: UDP, length 1470
23:02:41.015845 IP 10.0.1.10.44692 > 10.0.2.10.5001: UDP, length 1470
23:02:41.026862 IP 10.0.1.10.44692 > 10.0.2.10.5001: UDP, length 1470
23:02:41.038187 IP 10.0.1.10.44692 > 10.0.2.10.5001: UDP, length 1470
23:02:41.049656 IP 10.0.1.10.44692 > 10.0.2.10.5001: UDP, length 1470
23:02:41.060505 IP 10.0.1.10.44692 > 10.0.2.10.5001: UDP, length 1470
23:02:41.071938 IP 10.0.1.10.44692 > 10.0.2.10.5001: UDP, length 1470
23:02:41.083044 IP 10.0.1.10.44692 > 10.0.2.10.5001: UDP, length 1470
23:02:41.094264 IP 10.0.1.10.44692 > 10.0.2.10.5001: UDP, length 1470
23:02:41.105419 IP 10.0.1.10.44692 > 10.0.2.10.5001: UDP, length 1470
23:02:41.116707 IP 10.0.1.10.44692 > 10.0.2.10.5001: UDP, length 1470
23:02:41.127811 IP 10.0.1.10.44692 > 10.0.2.10.5001: UDP, length 1470
23:02:41.139254 IP 10.0.1.10.44692 > 10.0.2.10.5001: UDP, length 1470
23:02:41.150814 IP 10.0.1.10.44692 > 10.0.2.10.5001: UDP, length 1470
23:02:41.161912 IP 10.0.1.10.44692 > 10.0.2.10.5001: UDP, length 1470
23:02:41.172802 IP 10.0.1.10.44692 > 10.0.2.10.5001: UDP, length 1470
23:02:41.183998 IP 10.0.1.10.44692 > 10.0.2.10.5001: UDP, length 1470
23:02:41.195118 IP 10.0.1.10.44692 > 10.0.2.10.5001: UDP, length 1470
23:02:41.207755 IP 10.0.1.10.44692 > 10.0.2.10.5001: UDP, length 1470
23:02:41.217962 IP 10.0.1.10.44692 > 10.0.2.10.5001: UDP, length 1470
23:02:41.228818 IP 10.0.1.10.44692 > 10.0.2.10.5001: UDP, length 1470
23:02:41.241126 IP 10.0.1.10.44692 > 10.0.2.10.5001: UDP, length 1470
23:02:41.251728 IP 10.0.1.10.44692 > 10.0.2.10.5001: UDP, length 1470
23:02:41.262547 IP 10.0.1.10.44692 > 10.0.2.10.5001: UDP, length 1470
23:02:41.274085 IP 10.0.1.10.44692 > 10.0.2.10.5001: UDP, length 1470
23:02:41.285169 IP 10.0.1.10.44692 > 10.0.2.10.5001: UDP, length 1470
23:02:41.296172 IP 10.0.1.10.44692 > 10.0.2.10.5001: UDP, length 1470
23:02:41.307723 IP 10.0.1.10.44692 > 10.0.2.10.5001: UDP, length 1470
23:02:41.318876 IP 10.0.1.10.44692 > 10.0.2.10.5001: UDP, length 1470
23:02:41.330010 IP 10.0.1.10.44692 > 10.0.2.10.5001: UDP, length 1470
23:02:41.341916 IP 10.0.1.10.44692 > 10.0.2.10.5001: UDP, length 1470
23:02:41.352692 IP 10.0.1.10.44692 > 10.0.2.10.5001: UDP, length 1470
23:02:41.363380 IP 10.0.1.10.44692 > 10.0.2.10.5001: UDP, length 1470
23:02:41.374839 IP 10.0.1.10.44692 > 10.0.2.10.5001: UDP, length 1470
23:02:41.385863 IP 10.0.1.10.44692 > 10.0.2.10.5001: UDP, length 1470
23:02:41.397085 IP 10.0.1.10.44692 > 10.0.2.10.5001: UDP, length 1470
23:02:41.408359 IP 10.0.1.10.44692 > 10.0.2.10.5001: UDP, length 1470
23:02:41.419400 IP 10.0.1.10.44692 > 10.0.2.10.5001: UDP, length 1470
23:02:41.430821 IP 10.0.1.10.44692 > 10.0.2.10.5001: UDP, length 1470
23:02:41.441958 IP 10.0.1.10.44692 > 10.0.2.10.5001: UDP, length 1470
23:02:41.453230 IP 10.0.1.10.44692 > 10.0.2.10.5001: UDP, length 1470
23:02:41.464458 IP 10.0.1.10.44692 > 10.0.2.10.5001: UDP, length 1470
23:02:41.475545 IP 10.0.1.10.44692 > 10.0.2.10.5001: UDP, length 1470
23:02:41.486795 IP 10.0.1.10.44692 > 10.0.2.10.5001: UDP, length 1470
23:02:41.498203 IP 10.0.1.10.44692 > 10.0.2.10.5001: UDP, length 1470
23:02:41.509335 IP 10.0.1.10.44692 > 10.0.2.10.5001: UDP, length 1470
23:02:41.520641 IP 10.0.1.10.44692 > 10.0.2.10.5001: UDP, length 1470
23:02:41.531751 IP 10.0.1.10.44692 > 10.0.2.10.5001: UDP, length 1470
23:02:41.543120 IP 10.0.1.10.44692 > 10.0.2.10.5001: UDP, length 1470
23:02:41.554124 IP 10.0.1.10.44692 > 10.0.2.10.5001: UDP, length 1470
23:02:41.565684 IP 10.0.1.10.44692 > 10.0.2.10.5001: UDP, length 1470
23:02:41.577256 IP 10.0.1.10.44692 > 10.0.2.10.5001: UDP, length 1470
23:02:41.588020 IP 10.0.1.10.44692 > 10.0.2.10.5001: UDP, length 1470
23:02:41.599352 IP 10.0.1.10.44692 > 10.0.2.10.5001: UDP, length 1470
23:02:41.611199 IP 10.0.1.10.44692 > 10.0.2.10.5001: UDP, length 1470
23:02:41.621428 IP 10.0.1.10.44692 > 10.0.2.10.5001: UDP, length 1470
23:02:41.633086 IP 10.0.1.10.44692 > 10.0.2.10.5001: UDP, length 1470
23:02:41.643963 IP 10.0.1.10.44692 > 10.0.2.10.5001: UDP, length 1470
23:02:41.654948 IP 10.0.1.10.44692 > 10.0.2.10.5001: UDP, length 1470
23:02:41.666323 IP 10.0.1.10.44692 > 10.0.2.10.5001: UDP, length 1470
23:02:41.677615 IP 10.0.1.10.44692 > 10.0.2.10.5001: UDP, length 1470
23:02:41.688753 IP 10.0.1.10.44692 > 10.0.2.10.5001: UDP, length 1470
23:02:41.700036 IP 10.0.1.10.44692 > 10.0.2.10.5001: UDP, length 1470
23:02:41.711206 IP 10.0.1.10.44692 > 10.0.2.10.5001: UDP, length 1470
23:02:41.722286 IP 10.0.1.10.44692 > 10.0.2.10.5001: UDP, length 1470
23:02:41.733569 IP 10.0.1.10.44692 > 10.0.2.10.5001: UDP, length 1470
23:02:41.744814 IP 10.0.1.10.44692 > 10.0.2.10.5001: UDP, length 1470
23:02:41.756173 IP 10.0.1.10.44692 > 10.0.2.10.5001: UDP, length 1470
23:02:41.767322 IP 10.0.1.10.44692 > 10.0.2.10.5001: UDP, length 1470
23:02:41.778914 IP 10.0.1.10.44692 > 10.0.2.10.5001: UDP, length 1470
23:02:41.790114 IP 10.0.1.10.44692 > 10.0.2.10.5001: UDP, length 1470
23:02:41.800856 IP 10.0.1.10.44692 > 10.0.2.10.5001: UDP, length 1470
23:02:41.812182 IP 10.0.1.10.44692 > 10.0.2.10.5001: UDP, length 1470
23:02:41.823309 IP 10.0.1.10.44692 > 10.0.2.10.5001: UDP, length 1470
23:02:41.835045 IP 10.0.1.10.44692 > 10.0.2.10.5001: UDP, length 1470
23:02:41.845821 IP 10.0.1.10.44692 > 10.0.2.10.5001: UDP, length 1470
23:02:41.856969 IP 10.0.1.10.44692 > 10.0.2.10.5001: UDP, length 1470
23:02:41.868393 IP 10.0.1.10.44692 > 10.0.2.10.5001: UDP, length 1470
23:02:41.879308 IP 10.0.1.10.44692 > 10.0.2.10.5001: UDP, length 1470
23:02:41.890548 IP 10.0.1.10.44692 > 10.0.2.10.5001: UDP, length 1470
23:02:41.901867 IP 10.0.1.10.44692 > 10.0.2.10.5001: UDP, length 1470
23:02:41.913171 IP 10.0.1.10.44692 > 10.0.2.10.5001: UDP, length 1470
23:02:41.924240 IP 10.0.1.10.44692 > 10.0.2.10.5001: UDP, length 1470
23:02:41.936396 IP 10.0.1.10.44692 > 10.0.2.10.5001: UDP, length 1470
23:02:41.947230 IP 10.0.1.10.44692 > 10.0.2.10.5001: UDP, length 1470
23:02:41.957932 IP 10.0.1.10.44692 > 10.0.2.10.5001: UDP, length 1470
23:02:41.969183 IP 10.0.1.10.44692 > 10.0.2.10.5001: UDP, length 1470
23:02:41.980459 IP 10.0.1.10.44692 > 10.0.2.10.5001: UDP, length 1470
23:02:41.991484 IP 10.0.1.10.44692 > 10.0.2.10.5001: UDP, length 1470
23:02:42.002872 IP 10.0.1.10.44692 > 10.0.2.10.5001: UDP, length 1470
23:02:42.014334 IP 10.0.1.10.44692 > 10.0.2.10.5001: UDP, length 1470
23:02:42.025416 IP 10.0.1.10.44692 > 10.0.2.10.5001: UDP, length 1470
23:02:42.036536 IP 10.0.1.10.44692 > 10.0.2.10.5001: UDP, length 1470
23:02:42.047572 IP 10.0.1.10.44692 > 10.0.2.10.5001: UDP, length 1470
23:02:42.058800 IP 10.0.1.10.44692 > 10.0.2.10.5001: UDP, length 1470
23:02:42.070088 IP 10.0.1.10.44692 > 10.0.2.10.5001: UDP, length 1470
23:02:42.081635 IP 10.0.1.10.44692 > 10.0.2.10.5001: UDP, length 1470
23:02:42.092527 IP 10.0.1.10.44692 > 10.0.2.10.5001: UDP, length 1470
23:02:42.103780 IP 10.0.1.10.44692 > 10.0.2.10.5001: UDP, length 1470
23:02:42.114892 IP 10.0.1.10.44692 > 10.0.2.10.5001: UDP, length 1470
23:02:42.126324 IP 10.0.1.10.44692 > 10.0.2.10.5001: UDP, length 1470
23:02:42.137444 IP 10.0.1.10.44692 > 10.0.2.10.5001: UDP, length 1470
23:02:42.148888 IP 10.0.1.10.44692 > 10.0.2.10.5001: UDP, length 1470
23:02:42.159992 IP 10.0.1.10.44692 > 10.0.2.10.5001: UDP, length 1470
23:02:42.170916 IP 10.0.1.10.44692 > 10.0.2.10.5001: UDP, length 1470
23:02:42.182306 IP 10.0.1.10.44692 > 10.0.2.10.5001: UDP, length 1470
23:02:42.193564 IP 10.0.1.10.44692 > 10.0.2.10.5001: UDP, length 1470
23:02:42.204804 IP 10.0.1.10.44692 > 10.0.2.10.5001: UDP, length 1470
23:02:42.215819 IP 10.0.1.10.44692 > 10.0.2.10.5001: UDP, length 1470
23:02:42.226888 IP 10.0.1.10.44692 > 10.0.2.10.5001: UDP, length 1470
23:02:42.238252 IP 10.0.1.10.44692 > 10.0.2.10.5001: UDP, length 1470
23:02:42.249369 IP 10.0.1.10.44692 > 10.0.2.10.5001: UDP, length 1470
23:02:42.260798 IP 10.0.1.10.44692 > 10.0.2.10.5001: UDP, length 1470
23:02:42.272937 IP 10.0.1.10.44692 > 10.0.2.10.5001: UDP, length 1470
23:02:42.283082 IP 10.0.1.10.44692 > 10.0.2.10.5001: UDP, length 1470
23:02:42.294501 IP 10.0.1.10.44692 > 10.0.2.10.5001: UDP, length 1470
23:02:42.305715 IP 10.0.1.10.44692 > 10.0.2.10.5001: UDP, length 1470
23:02:42.317008 IP 10.0.1.10.44692 > 10.0.2.10.5001: UDP, length 1470
23:02:42.327998 IP 10.0.1.10.44692 > 10.0.2.10.5001: UDP, length 1470
23:02:42.339126 IP 10.0.1.10.44692 > 10.0.2.10.5001: UDP, length 1470
23:02:42.350502 IP 10.0.1.10.44692 > 10.0.2.10.5001: UDP, length 1470
23:02:42.361898 IP 10.0.1.10.44692 > 10.0.2.10.5001: UDP, length 1470
23:02:42.372946 IP 10.0.1.10.44692 > 10.0.2.10.5001: UDP, length 1470
23:02:42.384075 IP 10.0.1.10.44692 > 10.0.2.10.5001: UDP, length 1470
23:02:42.395226 IP 10.0.1.10.44692 > 10.0.2.10.5001: UDP, length 1470
23:02:42.406687 IP 10.0.1.10.44692 > 10.0.2.10.5001: UDP, length 1470
23:02:42.417815 IP 10.0.1.10.44692 > 10.0.2.10.5001: UDP, length 1470
23:02:42.429116 IP 10.0.1.10.44692 > 10.0.2.10.5001: UDP, length 1470
23:02:42.440415 IP 10.0.1.10.44692 > 10.0.2.10.5001: UDP, length 1470
23:02:42.451281 IP 10.0.1.10.44692 > 10.0.2.10.5001: UDP, length 1470
23:02:42.462572 IP 10.0.1.10.44692 > 10.0.2.10.5001: UDP, length 1470
23:02:42.473884 IP 10.0.1.10.44692 > 10.0.2.10.5001: UDP, length 1470
23:02:42.486066 IP 10.0.1.10.44692 > 10.0.2.10.5001: UDP, length 1470
23:02:42.496606 IP 10.0.1.10.44692 > 10.0.2.10.5001: UDP, length 1470
23:02:42.507415 IP 10.0.1.10.44692 > 10.0.2.10.5001: UDP, length 1470
23:02:42.518764 IP 10.0.1.10.44692 > 10.0.2.10.5001: UDP, length 1470
23:02:42.530093 IP 10.0.1.10.44692 > 10.0.2.10.5001: UDP, length 1470
23:02:42.541262 IP 10.0.1.10.44692 > 10.0.2.10.5001: UDP, length 1470
23:02:42.552459 IP 10.0.1.10.44692 > 10.0.2.10.5001: UDP, length 1470
23:02:42.563522 IP 10.0.1.10.44692 > 10.0.2.10.5001: UDP, length 1470
23:02:42.574815 IP 10.0.1.10.44692 > 10.0.2.10.5001: UDP, length 1470
23:02:42.586215 IP 10.0.1.10.44692 > 10.0.2.10.5001: UDP, length 1470
23:02:42.597583 IP 10.0.1.10.44692 > 10.0.2.10.5001: UDP, length 1470
23:02:42.608939 IP 10.0.1.10.44692 > 10.0.2.10.5001: UDP, length 1470
23:02:42.619635 IP 10.0.1.10.44692 > 10.0.2.10.5001: UDP, length 1470
23:02:42.631078 IP 10.0.1.10.44692 > 10.0.2.10.5001: UDP, length 1470
23:02:42.642826 IP 10.0.1.10.44692 > 10.0.2.10.5001: UDP, length 1470
23:02:42.653209 IP 10.0.1.10.44692 > 10.0.2.10.5001: UDP, length 1470
23:02:42.664660 IP 10.0.1.10.44692 > 10.0.2.10.5001: UDP, length 1470
23:02:42.675726 IP 10.0.1.10.44692 > 10.0.2.10.5001: UDP, length 1470
23:02:42.926312 IP 10.0.1.10.44692 > 10.0.2.10.5001: UDP, length 1470
23:02:43.177052 IP 10.0.1.10.44692 > 10.0.2.10.5001: UDP, length 1470
23:02:43.427205 IP 10.0.1.10.44692 > 10.0.2.10.5001: UDP, length 1470
23:02:43.677683 IP 10.0.1.10.44692 > 10.0.2.10.5001: UDP, length 1470
23:02:43.928265 IP 10.0.1.10.44692 > 10.0.2.10.5001: UDP, length 1470
23:02:44.179087 IP 10.0.1.10.44692 > 10.0.2.10.5001: UDP, length 1470
23:02:44.429976 IP 10.0.1.10.44692 > 10.0.2.10.5001: UDP, length 1470
23:02:44.680797 IP 10.0.1.10.44692 > 10.0.2.10.5001: UDP, length 1470
23:02:44.931560 IP 10.0.1.10.44692 > 10.0.2.10.5001: UDP, length 1470
