23:02:50.242005 IP 10.0.1.10.52969 > 10.0.2.10.5001: UDP, length 1470
23:02:50.252415 IP 10.0.1.10.52969 > 10.0.2.10.5001: UDP, length 1470
23:02:50.262582 IP 10.0.1.10.52969 > 10.0.2.10.5001: UDP, length 1470
23:02:50.274307 IP 10.0.1.10.52969 > 10.0.2.10.5001: UDP, length 1470
23:02:50.285585 IP 10.0.1.10.52969 > 10.0.2.10.5001: UDP, length 1470
23:02:50.296739 IP 10.0.1.10.52969 > 10.0.2.10.5001: UDP, length 1470
23:02:50.308563 IP 10.0.1.10.52969 > 10.0.2.10.5001: UDP, length 1470
23:02:50.319112 IP 10.0.1.10.52969 > 10.0.2.10.5001: UDP, length 1470
23:02:50.330697 IP 10.0.1.10.52969 > 10.0.2.10.5001: UDP, length 1470
23:02:50.342264 IP 10.0.1.10.52969 > 10.0.2.10.5001: UDP, length 1470
23:02:50.352628 IP 10.0.1.10.52969 > 10.0.2.10.5001: UDP, length 1470
23:02:50.364168 IP 10.0.1.10.52969 > 10.0.2.10.5001: UDP, length 1470
23:02:50.375301 IP 10.0.1.10.52969 > 10.0.2.10.5001: UDP, length 1470
23:02:50.386548 IP 10.0.1.10.52969 > 10.0.2.10.5001: UDP, length 1470
23:02:50.397639 IP 10.0.1.10.52969 > 10.0.2.10.5001: UDP, length 1470
23:02:50.408841 IP 10.0.1.10.52969 > 10.0.2.10.5001: UDP, length 1470
23:02:50.420043 IP 10.0.1.10.52969 > 10.0.2.10.5001: UDP, length 1470
23:02:50.431589 IP 10.0.1.10.52969 > 10.0.2.10.5001: UDP, length 1470
23:02:50.443229 IP 10.0.1.10.52969 > 10.0.2.10.5001: UDP, length 1470
23:02:50.453638 IP 10.0.1.10.52969 > 10.0.2.10.5001: UDP, length 1470
23:02:50.465155 IP 10.0.1.10.52969 > 10.0.2.10.5001: UDP, length 1470
23:02:50.476367 IP 10.0.1.10.52969 > 10.0.2.10.5001: UDP, length 1470
23:02:50.487309 IP 10.0.1.10.52969 > 10.0.2.10.5001: UDP, length 1470
23:02:50.498602 IP 10.0.1.10.52969 > 10.0.2.10.5001: UDP, length 1470
23:02:50.509812 IP 10.0.1.10.52969 > 10.0.2.10.5001: UDP, length 1470
23:02:50.521043 IP 10.0.1.10.52969 > 10.0.2.10.5001: UDP, length 1470
23:02:50.532506 IP 10.0.1.10.52969 > 10.0.2.10.5001: UDP, length 1470
23:02:50.543957 IP 10.0.1.10.52969 > 10.0.2.10.5001: UDP, length 1470
23:02:50.554877 IP 10.0.1.10.52969 > 10.0.2.10.5001: UDP, length 1470
23:02:50.565801 IP 10.0.1.10.52969 > 10.0.2.10.5001: UDP, length 1470
23:02:50.577332 IP 10.0.1.10.52969 > 10.0.2.10.5001: UDP, length 1470
23:02:50.588482 IP 10.0.1.10.52969 > 10.0.2.10.5001: UDP, length 1470
23:02:50.599671 IP 10.0.1.10.52969 > 10.0.2.10.5001: UDP, length 1470
23:02:50.610721 IP 10.0.1.10.52969 > 10.0.2.10.5001: UDP, length 1470
23:02:50.622057 IP 10.0.1.10.52969 > 10.0.2.10.5001: UDP, length 1470
23:02:50.633303 IP 10.0.1.10.52969 > 10.0.2.10.5001: UDP, length 1470
23:02:50.644458 IP 10.0.1.10.52969 > 10.0.2.10.5001: UDP, length 1470
23:02:50.655627 IP 10.0.1.10.52969 > 10.0.2.10.5001: UDP, length 1470
23:02:50.666879 IP 10.0.1.10.52969 > 10.0.2.10.5001: UDP, length 1470
23:02:50.678402 IP 10.0.1.10.52969 > 10.0.2.10.5001: UDP, length 1470
23:02:50.689244 IP 10.0.1.10.52969 > 10.0.2.10.5001: UDP, length 1470
23:02:50.700870 IP 10.0.1.10.52969 > 10.0.2.10.5001: UDP, length 1470
23:02:50.711774 IP 10.0.1.10.52969 > 10.0.2.10.5001: UDP, length 1470
23:02:50.722847 IP 10.0.1.10.52969 > 10.0.2.10.5001: UDP, length 1470
23:02:50.734158 IP 10.0.1.10.52969 > 10.0.2.10.5001: UDP, length 1470
23:02:50.745240 IP 10.0.1.10.52969 > 10.0.2.10.5001: UDP, length 1470
23:02:50.756935 IP 10.0.1.10.52969 > 10.0.2.10.5001: UDP, length 1470
23:02:50.767965 IP 10.0.1.10.52969 > 10.0.2.10.5001: UDP, length 1470
23:02:50.778940 IP 10.0.1.10.52969 > 10.0.2.10.5001: UDP, length 1470
23:02:50.790725 IP 10.0.1.10.52969 > 10.0.2.10.5001: UDP, length 1470
23:02:50.802910 IP 10.0.1.10.52969 > 10.0.2.10.5001: UDP, length 1470
23:02:50.812557 IP 10.0.1.10.52969 > 10.0.2.10.5001: UDP, length 1470
23:02:50.824910 IP 10.0.1.10.52969 > 10.0.2.10.5001: UDP, length 1470
23:02:50.834898 IP 10.0.1.10.52969 > 10.0.2.10.5001: UDP, length 1470
23:02:50.846185 IP 10.0.1.10.52969 > 10.0.2.10.5001: UDP, length 1470
23:02:50.857662 IP 10.0.1.10.52969 > 10.0.2.10.5001: UDP, length 1470
23:02:50.868922 IP 10.0.1.10.52969 > 10.0.2.10.5001: UDP, length 1470
23:02:50.879888 IP 10.0.1.10.52969 > 10.0.2.10.5001: UDP, length 1470
23:02:50.891053 IP 10.0.1.10.52969 > 10.0.2.10.5001: UDP, length 1470
23:02:50.902532 IP 10.0.1.10.52969 > 10.0.2.10.5001: UDP, length 1470
23:02:50.914022 IP 10.0.1.10.52969 > 10.0.2.10.5001: UDP, length 1470
23:02:50.924847 IP 10.0.1.10.52969 > 10.0.2.10.5001: UDP, length 1470
23:02:50.935881 IP 10.0.1.10.52969 > 10.0.2.10.5001: UDP, length 1470
23:02:50.947157 IP 10.0.1.10.52969 > 10.0.2.10.5001: UDP, length 1470
23:02:50.959006 IP 10.0.1.10.52969 > 10.0.2.10.5001: UDP, length 1470
23:02:50.969769 IP 10.0.1.10.52969 > 10.0.2.10.5001: UDP, length 1470
23:02:50.981062 IP 10.0.1.10.52969 > 10.0.2.10.5001: UDP, length 1470
23:02:50.992138 IP 10.0.1.10.52969 > 10.0.2.10.5001: UDP, length 1470
23:02:51.003346 IP 10.0.1.10.52969 > 10.0.2.10.5001: UDP, length 1470
23:02:51.015001 IP 10.0.1.10.52969 > 10.0.2.10.5001: UDP, length 1470
23:02:51.025810 IP 10.0.1.10.52969 > 10.0.2.10.5001: UDP, length 1470
23:02:51.037334 IP 10.0.1.10.52969 > 10.0.2.10.5001: UDP, length 1470
23:02:51.048511 IP 10.0.1.10.52969 > 10.0.2.10.5001: UDP, length 1470
23:02:51.060438 IP 10.0.1.10.52969 > 10.0.2.10.5001: UDP, length 1470
23:02:51.070758 IP 10.0.1.10.52969 > 10.0.2.10.5001: UDP, length 1470
23:02:51.081878 IP 10.0.1.10.52969 > 10.0.2.10.5001: UDP, length 1470
23:02:51.093130 IP 10.0.1.10.52969 > 10.0.2.10.5001: UDP, length 1470
23:02:51.104228 IP 10.0.1.10.52969 > 10.0.2.10.5001: UDP, length 1470
23:02:51.115565 IP 10.0.1.10.52969 > 10.0.2.10.5001: UDP, length 1470
23:02:51.126977 IP 10.0.1.10.52969 > 10.0.2.10.5001: UDP, length 1470
23:02:51.137995 IP 10.0.1.10.52969 > 10.0.2.10.5001: UDP, length 1470
23:02:51.149390 IP 10.0.1.10.52969 > 10.0.2.10.5001: UDP, length 1470
23:02:51.160401 IP 10.0.1.10.52969 > 10.0.2.10.5001: UDP, length 1470
23:02:51.171465 IP 10.0.1.10.52969 > 10.0.2.10.5001: UDP, length 1470
23:02:51.182994 IP 10.0.1.10.52969 > 10.0.2.10.5001: UDP, length 1470
23:02:51.194380 IP 10.0.1.10.52969 > 10.0.2.10.5001: UDP, length 1470
23:02:51.205374 IP 10.0.1.10.52969 > 10.0.2.10.5001: UDP, length 1470
23:02:51.216414 IP 10.0.1.10.52969 > 10.0.2.10.5001: UDP, length 1470
23:02:51.230818 IP 10.0.1.10.52969 > 10.0.2.10.5001: UDP, length 1470
23:02:51.238723 IP 10.0.1.10.52969 > 10.0.2.10.5001: UDP, length 1470
23:02:51.250118 IP 10.0.1.10.52969 > 10.0.2.10.5001: UDP, length 1470
23:02:51.261528 IP 10.0.1.10.52969 > 10.0.2.10.5001: UDP, length 1470
23:02:51.272573 IP 10.0.1.10.52969 > 10.0.2.10.5001: UDP, length 1470
23:02:51.283612 IP 10.0.1.10.52969 > 10.0.2.10.5001: UDP, length 1470
23:02:51.294752 IP 10.0.1.10.52969 > 10.0.2.10.5001: UDP, length 1470
23:02:51.306064 IP 10.0.1.10.52969 > 10.0.2.10.5001: UDP, length 1470
23:02:51.317221 IP 10.0.1.10.52969 > 10.0.2.10.5001: UDP, length 1470
23:02:51.328550 IP 10.0.1.10.52969 > 10.0.2.10.5001: UDP, length 1470
23:02:51.339992 IP 10.0.1.10.52969 > 10.0.2.10.5001: UDP, length 1470
23:02:51.351272 IP 10.0.1.10.52969 > 10.0.2.10.5001: UDP, length 1470
23:02:51.363112 IP 10.0.1.10.52969 > 10.0.2.10.5001: UDP, length 1470
23:02:51.373691 IP 10.0.1.10.52969 > 10.0.2.10.5001: UDP, length 1470
23:02:51.385257 IP 10.0.1.10.52969 > 10.0.2.10.5001: UDP, length 1470
23:02:51.395844 IP 10.0.1.10.52969 > 10.0.2.10.5001: UDP, length 1470
23:02:51.407335 IP 10.0.1.10.52969 > 10.0.2.10.5001: UDP, length 1470
23:02:51.419190 IP 10.0.1.10.52969 > 10.0.2.10.5001: UDP, length 1470
23:02:51.429749 IP 10.0.1.10.52969 > 10.0.2.10.5001: UDP, length 1470
23:02:51.441756 IP 10.0.1.10.52969 > 10.0.2.10.5001: UDP, length 1470
23:02:51.451985 IP 10.0.1.10.52969 > 10.0.2.10.5001: UDP, length 1470
23:02:51.463242 IP 10.0.1.10.52969 > 10.0.2.10.5001: UDP, length 1470
23:02:51.474249 IP 10.0.1.10.52969 > 10.0.2.10.5001: UDP, length 1470
23:02:51.485449 IP 10.0.1.10.52969 > 10.0.2.10.5001: UDP, length 1470
23:02:51.496978 IP 10.0.1.10.52969 > 10.0.2.10.5001: UDP, length 1470
23:02:51.508056 IP 10.0.1.10.52969 > 10.0.2.10.5001: UDP, length 1470
23:02:51.519249 IP 10.0.1.10.52969 > 10.0.2.10.5001: UDP, length 1470
23:02:51.530576 IP 10.0.1.10.52969 > 10.0.2.10.5001: UDP, length 1470
23:02:51.542124 IP 10.0.1.10.52969 > 10.0.2.10.5001: UDP, length 1470
23:02:51.552903 IP 10.0.1.10.52969 > 10.0.2.10.5001: UDP, length 1470
23:02:51.564081 IP 10.0.1.10.52969 > 10.0.2.10.5001: UDP, length 1470
23:02:51.575091 IP 10.0.1.10.52969 > 10.0.2.10.5001: UDP, length 1470
23:02:51.586739 IP 10.0.1.10.52969 > 10.0.2.10.5001: UDP, length 1470
23:02:51.598022 IP 10.0.1.10.52969 > 10.0.2.10.5001: UDP, length 1470
23:02:51.609110 IP 10.0.1.10.52969 > 10.0.2.10.5001: UDP, length 1470
23:02:51.620129 IP 10.0.1.10.52969 > 10.0.2.10.5001: UDP, length 1470
23:02:51.631244 IP 10.0.1.10.52969 > 10.0.2.10.5001: UDP, length 1470
23:02:51.643286 IP 10.0.1.10.52969 > 10.0.2.10.5001: UDP, length 1470
23:02:51.654272 IP 10.0.1.10.52969 > 10.0.2.10.5001: UDP, length 1470
23:02:51.665563 IP 10.0.1.10.52969 > 10.0.2.10.5001: UDP, length 1470
23:02:51.676310 IP 10.0.1.10.52969 > 10.0.2.10.5001: UDP, length 1470
23:02:51.687416 IP 10.0.1.10.52969 > 10.0.2.10.5001: UDP, length 1470
23:02:51.698919 IP 10.0.1.10.52969 > 10.0.2.10.5001: UDP, length 1470
23:02:51.709992 IP 10.0.1.10.52969 > 10.0.2.10.5001: UDP, length 1470
23:02:51.721135 IP 10.0.1.10.52969 > 10.0.2.10.5001: UDP, length 1470
23:02:51.732387 IP 10.0.1.10.52969 > 10.0.2.10.5001: UDP, length 1470
23:02:51.743442 IP 10.0.1.10.52969 > 10.0.2.10.5001: UDP, length 1470
23:02:51.754792 IP 10.0.1.10.52969 > 10.0.2.10.5001: UDP, length 1470
23:02:51.766254 IP 10.0.1.10.52969 > 10.0.2.10.5001: UDP, length 1470
23:02:51.777251 IP 10.0.1.10.52969 > 10.0.2.10.5001: UDP, length 1470
23:02:51.788340 IP 10.0.1.10.52969 > 10.0.2.10.5001: UDP, length 1470
23:02:51.799565 IP 10.0.1.10.52969 > 10.0.2.10.5001: UDP, length 1470
23:02:51.810670 IP 10.0.1.10.52969 > 10.0.2.10.5001: UDP, length 1470
23:02:51.821981 IP 10.0.1.10.52969 > 10.0.2.10.5001: UDP, length 1470
23:02:51.833197 IP 10.0.1.10.52969 > 10.0.2.10.5001: UDP, length 1470
23:02:51.844516 IP 10.0.1.10.52969 > 10.0.2.10.5001: UDP, length 1470
23:02:51.856114 IP 10.0.1.10.52969 > 10.0.2.10.5001: UDP, length 1470
23:02:51.867348 IP 10.0.1.10.52969 > 10.0.2.10.5001: UDP, length 1470
23:02:51.878692 IP 10.0.1.10.52969 > 10.0.2.10.5001: UDP, length 1470
23:02:51.889580 IP 10.0.1.10.52969 > 10.0.2.10.5001: UDP, length 1470
23:02:51.901359 IP 10.0.1.10.52969 > 10.0.2.10.5001: UDP, length 1470
23:02:51.912637 IP 10.0.1.10.52969 > 10.0.2.10.5001: UDP, length 1470
23:02:51.923375 IP 10.0.1.10.52969 > 10.0.2.10.5001: UDP, length 1470
23:02:51.934895 IP 10.0.1.10.52969 > 10.0.2.10.5001: UDP, length 1470
23:02:51.945923 IP 10.0.1.10.52969 > 10.0.2.10.5001: UDP, length 1470
23:02:51.956767 IP 10.0.1.10.52969 > 10.0.2.10.5001: UDP, length 1470
23:02:51.967907 IP 10.0.1.10.52969 > 10.0.2.10.5001: UDP, length 1470
23:02:51.979012 IP 10.0.1.10.52969 > 10.0.2.10.5001: UDP, length 1470
23:02:51.990492 IP 10.0.1.10.52969 > 10.0.2.10.5001: UDP, length 1470
23:02:52.001790 IP 10.0.1.10.52969 > 10.0.2.10.5001: UDP, length 1470
23:02:52.012910 IP 10.0.1.10.52969 > 10.0.2.10.5001: UDP, length 1470
23:02:52.023888 IP 10.0.1.10.52969 > 10.0.2.10.5001: UDP, length 1470
23:02:52.035190 IP 10.0.1.10.52969 > 10.0.2.10.5001: UDP, length 1470
23:02:52.046866 IP 10.0.1.10.52969 > 10.0.2.10.5001: UDP, length 1470
23:02:52.057984 IP 10.0.1.10.52969 > 10.0.2.10.5001: UDP, length 1470
23:02:52.069068 IP 10.0.1.10.52969 > 10.0.2.10.5001: UDP, length 1470
23:02:52.080182 IP 10.0.1.10.52969 > 10.0.2.10.5001: UDP, length 1470
23:02:52.091831 IP 10.0.1.10.52969 > 10.0.2.10.5001: UDP, length 1470
23:02:52.103241 IP 10.0.1.10.52969 > 10.0.2.10.5001: UDP, length 1470
23:02:52.114556 IP 10.0.1.10.52969 > 10.0.2.10.5001: UDP, length 1470
23:02:52.125509 IP 10.0.1.10.52969 > 10.0.2.10.5001: UDP, length 1470
23:02:52.136231 IP 10.0.1.10.52969 > 10.0.2.10.5001: UDP, length 1470
23:02:52.147823 IP 10.0.1.10.52969 > 10.0.2.10.5001: UDP, length 1470
23:02:52.158821 IP 10.0.1.10.52969 > 10.0.2.10.5001: UDP, length 1470
23:02:52.169699 IP 10.0.1.10.52969 > 10.0.2.10.5001: UDP, length 1470
23:02:52.181107 IP 10.0.1.10.52969 > 10.0.2.10.5001: UDP, length 1470
23:02:52.192318 IP 10.0.1.10.52969 > 10.0.2.10.5001: UDP, length 1470
23:02:52.203309 IP 10.0.1.10.52969 > 10.0.2.10.5001: UDP, length 1470
23:02:52.214877 IP 10.0.1.10.52969 > 10.0.2.10.5001: UDP, length 1470
23:02:52.226044 IP 10.0.1.10.52969 > 10.0.2.10.5001: UDP, length 1470
23:02:52.237346 IP 10.0.1.10.52969 > 10.0.2.10.5001: UDP, length 1470
23:02:52.248467 IP 10.0.1.10.52969 > 10.0.2.10.5001: UDP, length 1470
23:02:52.259413 IP 10.0.1.10.52969 > 10.0.2.10.5001: UDP, length 1470
23:02:52.270942 IP 10.0.1.10.52969 > 10.0.2.10.5001: UDP, length 1470
23:02:52.282172 IP 10.0.1.10.52969 > 10.0.2.10.5001: UDP, length 1470
23:02:52.292998 IP 10.0.1.10.52969 > 10.0.2.10.5001: UDP, length 1470
23:02:52.304148 IP 10.0.1.10.52969 > 10.0.2.10.5001: UDP, length 1470
23:02:52.315348 IP 10.0.1.10.52969 > 10.0.2.10.5001: UDP, length 1470
23:02:52.327431 IP 10.0.1.10.52969 > 10.0.2.10.5001: UDP, length 1470
23:02:52.338213 IP 10.0.1.10.52969 > 10.0.2.10.5001: UDP, length 1470
23:02:52.349137 IP 10.0.1.10.52969 > 10.0.2.10.5001: UDP, length 1470
23:02:52.360444 IP 10.0.1.10.52969 > 10.0.2.10.5001: UDP, length 1470
23:02:52.371426 IP 10.0.1.10.52969 > 10.0.2.10.5001: UDP, length 1470
23:02:52.382845 IP 10.0.1.10.52969 > 10.0.2.10.5001: UDP, length 1470
23:02:52.394199 IP 10.0.1.10.52969 > 10.0.2.10.5001: UDP, length 1470
23:02:52.405443 IP 10.0.1.10.52969 > 10.0.2.10.5001: UDP, length 1470
23:02:52.416517 IP 10.0.1.10.52969 > 10.0.2.10.5001: UDP, length 1470
23:02:52.427615 IP 10.0.1.10.52969 > 10.0.2.10.5001: UDP, length 1470
23:02:52.439020 IP 10.0.1.10.52969 > 10.0.2.10.5001: UDP, length 1470
23:02:52.450248 IP 10.0.1.10.52969 > 10.0.2.10.5001: UDP, length 1470
23:02:52.461543 IP 10.0.1.10.52969 > 10.0.2.10.5001: UDP, length 1470
23:02:52.472506 IP 10.0.1.10.52969 > 10.0.2.10.5001: UDP, length 1470
23:02:52.483631 IP 10.0.1.10.52969 > 10.0.2.10.5001: UDP, length 1470
23:02:52.495892 IP 10.0.1.10.52969 > 10.0.2.10.5001: UDP, length 1470
23:02:52.506590 IP 10.0.1.10.52969 > 10.0.2.10.5001: UDP, length 1470
23:02:52.517480 IP 10.0.1.10.52969 > 10.0.2.10.5001: UDP, length 1470
23:02:52.528578 IP 10.0.1.10.52969 > 10.0.2.10.5001: UDP, length 1470
23:02:52.539712 IP 10.0.1.10.52969 > 10.0.2.10.5001: UDP, length 1470
23:02:52.550969 IP 10.0.1.10.52969 > 10.0.2.10.5001: UDP, length 1470
23:02:52.562432 IP 10.0.1.10.52969 > 10.0.2.10.5001: UDP, length 1470
23:02:52.573517 IP 10.0.1.10.52969 > 10.0.2.10.5001: UDP, length 1470
23:02:52.584850 IP 10.0.1.10.52969 > 10.0.2.10.5001: UDP, length 1470
23:02:52.595860 IP 10.0.1.10.52969 > 10.0.2.10.5001: UDP, length 1470
23:02:52.606897 IP 10.0.1.10.52969 > 10.0.2.10.5001: UDP, length 1470
23:02:52.618478 IP 10.0.1.10.52969 > 10.0.2.10.5001: UDP, length 1470
23:02:52.630197 IP 10.0.1.10.52969 > 10.0.2.10.5001: UDP, length 1470
23:02:52.641403 IP 10.0.1.10.52969 > 10.0.2.10.5001: UDP, length 1470
23:02:52.652685 IP 10.0.1.10.52969 > 10.0.2.10.5001: UDP, length 1470
23:02:52.664072 IP 10.0.1.10.52969 > 10.0.2.10.5001: UDP, length 1470
23:02:52.674808 IP 10.0.1.10.52969 > 10.0.2.10.5001: UDP, length 1470
23:02:52.686585 IP 10.0.1.10.52969 > 10.0.2.10.5001: UDP, length 1470
23:02:52.697065 IP 10.0.1.10.52969 > 10.0.2.10.5001: UDP, length 1470
23:02:52.707928 IP 10.0.1.10.52969 > 10.0.2.10.5001: UDP, length 1470
23:02:52.719149 IP 10.0.1.10.52969 > 10.0.2.10.5001: UDP, length 1470
23:02:52.730842 IP 10.0.1.10.52969 > 10.0.2.10.5001: UDP, length 1470
23:02:52.741915 IP 10.0.1.10.52969 > 10.0.2.10.5001: UDP, length 1470
23:02:52.752988 IP 10.0.1.10.52969 > 10.0.2.10.5001: UDP, length 1470
23:02:52.764214 IP 10.0.1.10.52969 > 10.0.2.10.5001: UDP, length 1470
23:02:52.775873 IP 10.0.1.10.52969 > 10.0.2.10.5001: UDP, length 1470
23:02:52.786923 IP 10.0.1.10.52969 > 10.0.2.10.5001: UDP, length 1470
23:02:52.797975 IP 10.0.1.10.52969 > 10.0.2.10.5001: UDP, length 1470
23:02:52.809147 IP 10.0.1.10.52969 > 10.0.2.10.5001: UDP, length 1470
23:02:52.820227 IP 10.0.1.10.52969 > 10.0.2.10.5001: UDP, length 1470
23:02:52.831339 IP 10.0.1.10.52969 > 10.0.2.10.5001: UDP, length 1470
23:02:52.842673 IP 10.0.1.10.52969 > 10.0.2.10.5001: UDP, length 1470
23:02:52.853808 IP 10.0.1.10.52969 > 10.0.2.10.5001: UDP, length 1470
23:02:52.865487 IP 10.0.1.10.52969 > 10.0.2.10.5001: UDP, length 1470
23:02:52.876536 IP 10.0.1.10.52969 > 10.0.2.10.5001: UDP, length 1470
23:02:52.887333 IP 10.0.1.10.52969 > 10.0.2.10.5001: UDP, length 1470
23:02:52.899041 IP 10.0.1.10.52969 > 10.0.2.10.5001: UDP, length 1470
23:02:52.910274 IP 10.0.1.10.52969 > 10.0.2.10.5001: UDP, length 1470
23:02:52.921152 IP 10.0.1.10.52969 > 10.0.2.10.5001: UDP, length 1470
23:02:52.933158 IP 10.0.1.10.52969 > 10.0.2.10.5001: UDP, length 1470
23:02:52.943788 IP 10.0.1.10.52969 > 10.0.2.10.5001: UDP, length 1470
23:02:52.954917 IP 10.0.1.10.52969 > 10.0.2.10.5001: UDP, length 1470
23:02:52.966149 IP 10.0.1.10.52969 > 10.0.2.10.5001: UDP, length 1470
23:02:52.977998 IP 10.0.1.10.52969 > 10.0.2.10.5001: UDP, length 1470
23:02:52.988681 IP 10.0.1.10.52969 > 10.0.2.10.5001: UDP, length 1470
23:02:52.999688 IP 10.0.1.10.52969 > 10.0.2.10.5001: UDP, length 1470
23:02:53.010876 IP 10.0.1.10.52969 > 10.0.2.10.5001: UDP, length 1470
23:02:53.022188 IP 10.0.1.10.52969 > 10.0.2.10.5001: UDP, length 1470
23:02:53.033604 IP 10.0.1.10.52969 > 10.0.2.10.5001: UDP, length 1470
23:02:53.044618 IP 10.0.1.10.52969 > 10.0.2.10.5001: UDP, length 1470
23:02:53.055855 IP 10.0.1.10.52969 > 10.0.2.10.5001: UDP, length 1470
23:02:53.067096 IP 10.0.1.10.52969 > 10.0.2.10.5001: UDP, length 1470
23:02:53.078147 IP 10.0.1.10.52969 > 10.0.2.10.5001: UDP, length 1470
23:02:53.089271 IP 10.0.1.10.52969 > 10.0.2.10.5001: UDP, length 1470
23:02:53.101153 IP 10.0.1.10.52969 > 10.0.2.10.5001: UDP, length 1470
23:02:53.111697 IP 10.0.1.10.52969 > 10.0.2.10.5001: UDP, length 1470
23:02:53.123074 IP 10.0.1.10.52969 > 10.0.2.10.5001: UDP, length 1470
23:02:53.135064 IP 10.0.1.10.52969 > 10.0.2.10.5001: UDP, length 1470
23:02:53.146013 IP 10.0.1.10.52969 > 10.0.2.10.5001: UDP, length 1470
23:02:53.156601 IP 10.0.1.10.52969 > 10.0.2.10.5001: UDP, length 1470
23:02:53.167853 IP 10.0.1.10.52969 > 10.0.2.10.5001: UDP, length 1470
23:02:53.178964 IP 10.0.1.10.52969 > 10.0.2.10.5001: UDP, length 1470
23:02:53.190368 IP 10.0.1.10.52969 > 10.0.2.10.5001: UDP, length 1470
23:02:53.201703 IP 10.0.1.10.52969 > 10.0.2.10.5001: UDP, length 1470
23:02:53.212759 IP 10.0.1.10.52969 > 10.0.2.10.5001: UDP, length 1470
23:02:53.223880 IP 10.0.1.10.52969 > 10.0.2.10.5001: UDP, length 1470
23:02:53.235491 IP 10.0.1.10.52969 > 10.0.2.10.5001: UDP, length 1470
23:02:53.246601 IP 10.0.1.10.52969 > 10.0.2.10.5001: UDP, length 1470
23:02:53.257854 IP 10.0.1.10.52969 > 10.0.2.10.5001: UDP, length 1470
23:02:53.269133 IP 10.0.1.10.52969 > 10.0.2.10.5001: UDP, length 1470
23:02:53.279866 IP 10.0.1.10.52969 > 10.0.2.10.5001: UDP, length 1470
23:02:53.291254 IP 10.0.1.10.52969 > 10.0.2.10.5001: UDP, length 1470
23:02:53.302777 IP 10.0.1.10.52969 > 10.0.2.10.5001: UDP, length 1470
23:02:53.313836 IP 10.0.1.10.52969 > 10.0.2.10.5001: UDP, length 1470
23:02:53.325273 IP 10.0.1.10.52969 > 10.0.2.10.5001: UDP, length 1470
23:02:53.336114 IP 10.0.1.10.52969 > 10.0.2.10.5001: UDP, length 1470
23:02:53.347136 IP 10.0.1.10.52969 > 10.0.2.10.5001: UDP, length 1470
23:02:53.358337 IP 10.0.1.10.52969 > 10.0.2.10.5001: UDP, length 1470
23:02:53.369720 IP 10.0.1.10.52969 > 10.0.2.10.5001: UDP, length 1470
23:02:53.381004 IP 10.0.1.10.52969 > 10.0.2.10.5001: UDP, length 1470
23:02:53.391954 IP 10.0.1.10.52969 > 10.0.2.10.5001: UDP, length 1470
23:02:53.403307 IP 10.0.1.10.52969 > 10.0.2.10.5001: UDP, length 1470
23:02:53.415033 IP 10.0.1.10.52969 > 10.0.2.10.5001: UDP, length 1470
23:02:53.425790 IP 10.0.1.10.52969 > 10.0.2.10.5001: UDP, length 1470
23:02:53.436963 IP 10.0.1.10.52969 > 10.0.2.10.5001: UDP, length 1470
23:02:53.448595 IP 10.0.1.10.52969 > 10.0.2.10.5001: UDP, length 1470
23:02:53.459664 IP 10.0.1.10.52969 > 10.0.2.10.5001: UDP, length 1470
23:02:53.470858 IP 10.0.1.10.52969 > 10.0.2.10.5001: UDP, length 1470
23:02:53.482119 IP 10.0.1.10.52969 > 10.0.2.10.5001: UDP, length 1470
23:02:53.493277 IP 10.0.1.10.52969 > 10.0.2.10.5001: UDP, length 1470
23:02:53.504465 IP 10.0.1.10.52969 > 10.0.2.10.5001: UDP, length 1470
23:02:53.515478 IP 10.0.1.10.52969 > 10.0.2.10.5001: UDP, length 1470
23:02:53.527257 IP 10.0.1.10.52969 > 10.0.2.10.5001: UDP, length 1470
23:02:53.538078 IP 10.0.1.10.52969 > 10.0.2.10.5001: UDP, length 1470
23:02:53.549496 IP 10.0.1.10.52969 > 10.0.2.10.5001: UDP, length 1470
23:02:53.562382 IP 10.0.1.10.52969 > 10.0.2.10.5001: UDP, length 1470
23:02:53.571592 IP 10.0.1.10.52969 > 10.0.2.10.5001: UDP, length 1470
23:02:53.583723 IP 10.0.1.10.52969 > 10.0.2.10.5001: UDP, length 1470
23:02:53.595079 IP 10.0.1.10.52969 > 10.0.2.10.5001: UDP, length 1470
23:02:53.605171 IP 10.0.1.10.52969 > 10.0.2.10.5001: UDP, length 1470
23:02:53.617055 IP 10.0.1.10.52969 > 10.0.2.10.5001: UDP, length 1470
23:02:53.628010 IP 10.0.1.10.52969 > 10.0.2.10.5001: UDP, length 1470
23:02:53.639126 IP 10.0.1.10.52969 > 10.0.2.10.5001: UDP, length 1470
23:02:53.650014 IP 10.0.1.10.52969 > 10.0.2.10.5001: UDP, length 1470
23:02:53.661241 IP 10.0.1.10.52969 > 10.0.2.10.5001: UDP, length 1470
23:02:53.672599 IP 10.0.1.10.52969 > 10.0.2.10.5001: UDP, length 1470
23:02:53.683703 IP 10.0.1.10.52969 > 10.0.2.10.5001: UDP, length 1470
23:02:53.695000 IP 10.0.1.10.52969 > 10.0.2.10.5001: UDP, length 1470
23:02:53.706371 IP 10.0.1.10.52969 > 10.0.2.10.5001: UDP, length 1470
23:02:53.717521 IP 10.0.1.10.52969 > 10.0.2.10.5001: UDP, length 1470
23:02:53.728748 IP 10.0.1.10.52969 > 10.0.2.10.5001: UDP, length 1470
23:02:53.739952 IP 10.0.1.10.52969 > 10.0.2.10.5001: UDP, length 1470
23:02:53.751186 IP 10.0.1.10.52969 > 10.0.2.10.5001: UDP, length 1470
23:02:53.762736 IP 10.0.1.10.52969 > 10.0.2.10.5001: UDP, length 1470
23:02:53.773919 IP 10.0.1.10.52969 > 10.0.2.10.5001: UDP, length 1470
23:02:53.784910 IP 10.0.1.10.52969 > 10.0.2.10.5001: UDP, length 1470
23:02:53.795973 IP 10.0.1.10.52969 > 10.0.2.10.5001: UDP, length 1470
23:02:53.807352 IP 10.0.1.10.52969 > 10.0.2.10.5001: UDP, length 1470
23:02:53.818773 IP 10.0.1.10.52969 > 10.0.2.10.5001: UDP, length 1470
23:02:53.829824 IP 10.0.1.10.52969 > 10.0.2.10.5001: UDP, length 1470
23:02:53.841481 IP 10.0.1.10.52969 > 10.0.2.10.5001: UDP, length 1470
23:02:53.852617 IP 10.0.1.10.52969 > 10.0.2.10.5001: UDP, length 1470
23:02:53.863890 IP 10.0.1.10.52969 > 10.0.2.10.5001: UDP, length 1470
23:02:53.874593 IP 10.0.1.10.52969 > 10.0.2.10.5001: UDP, length 1470
23:02:53.886452 IP 10.0.1.10.52969 > 10.0.2.10.5001: UDP, length 1470
23:02:53.896706 IP 10.0.1.10.52969 > 10.0.2.10.5001: UDP, length 1470
23:02:53.908025 IP 10.0.1.10.52969 > 10.0.2.10.5001: UDP, length 1470
23:02:53.920957 IP 10.0.1.10.52969 > 10.0.2.10.5001: UDP, length 1470
23:02:53.930487 IP 10.0.1.10.52969 > 10.0.2.10.5001: UDP, length 1470
23:02:53.941810 IP 10.0.1.10.52969 > 10.0.2.10.5001: UDP, length 1470
23:02:53.952911 IP 10.0.1.10.52969 > 10.0.2.10.5001: UDP, length 1470
23:02:53.964100 IP 10.0.1.10.52969 > 10.0.2.10.5001: UDP, length 1470
23:02:53.975444 IP 10.0.1.10.52969 > 10.0.2.10.5001: UDP, length 1470
23:02:53.986694 IP 10.0.1.10.52969 > 10.0.2.10.5001: UDP, length 1470
23:02:53.998005 IP 10.0.1.10.52969 > 10.0.2.10.5001: UDP, length 1470
23:02:54.009024 IP 10.0.1.10.52969 > 10.0.2.10.5001: UDP, length 1470
23:02:54.020372 IP 10.0.1.10.52969 > 10.0.2.10.5001: UDP, length 1470
23:02:54.031393 IP 10.0.1.10.52969 > 10.0.2.10.5001: UDP, length 1470
23:02:54.043033 IP 10.0.1.10.52969 > 10.0.2.10.5001: UDP, length 1470
23:02:54.054501 IP 10.0.1.10.52969 > 10.0.2.10.5001: UDP, length 1470
23:02:54.065439 IP 10.0.1.10.52969 > 10.0.2.10.5001: UDP, length 1470
23:02:54.076557 IP 10.0.1.10.52969 > 10.0.2.10.5001: UDP, length 1470
23:02:54.087492 IP 10.0.1.10.52969 > 10.0.2.10.5001: UDP, length 1470
23:02:54.099310 IP 10.0.1.10.52969 > 10.0.2.10.5001: UDP, length 1470
23:02:54.110366 IP 10.0.1.10.52969 > 10.0.2.10.5001: UDP, length 1470
23:02:54.121441 IP 10.0.1.10.52969 > 10.0.2.10.5001: UDP, length 1470
23:02:54.132557 IP 10.0.1.10.52969 > 10.0.2.10.5001: UDP, length 1470
23:02:54.143621 IP 10.0.1.10.52969 > 10.0.2.10.5001: UDP, length 1470
23:02:54.155554 IP 10.0.1.10.52969 > 10.0.2.10.5001: UDP, length 1470
23:02:54.166056 IP 10.0.1.10.52969 > 10.0.2.10.5001: UDP, length 1470
23:02:54.177476 IP 10.0.1.10.52969 > 10.0.2.10.5001: UDP, length 1470
23:02:54.188358 IP 10.0.1.10.52969 > 10.0.2.10.5001: UDP, length 1470
23:02:54.199795 IP 10.0.1.10.52969 > 10.0.2.10.5001: UDP, length 1470
23:02:54.210969 IP 10.0.1.10.52969 > 10.0.2.10.5001: UDP, length 1470
23:02:54.222298 IP 10.0.1.10.52969 > 10.0.2.10.5001: UDP, length 1470
23:02:54.233585 IP 10.0.1.10.52969 > 10.0.2.10.5001: UDP, length 1470
23:02:54.244947 IP 10.0.1.10.52969 > 10.0.2.10.5001: UDP, length 1470
23:02:54.255896 IP 10.0.1.10.52969 > 10.0.2.10.5001: UDP, length 1470
23:02:54.267373 IP 10.0.1.10.52969 > 10.0.2.10.5001: UDP, length 1470
23:02:54.278509 IP 10.0.1.10.52969 > 10.0.2.10.5001: UDP, length 1470
23:02:54.289298 IP 10.0.1.10.52969 > 10.0.2.10.5001: UDP, length 1470
23:02:54.300878 IP 10.0.1.10.52969 > 10.0.2.10.5001: UDP, length 1470
23:02:54.312548 IP 10.0.1.10.52969 > 10.0.2.10.5001: UDP, length 1470
23:02:54.323409 IP 10.0.1.10.52969 > 10.0.2.10.5001: UDP, length 1470
23:02:54.334390 IP 10.0.1.10.52969 > 10.0.2.10.5001: UDP, length 1470
23:02:54.345643 IP 10.0.1.10.52969 > 10.0.2.10.5001: UDP, length 1470
23:02:54.356858 IP 10.0.1.10.52969 > 10.0.2.10.5001: UDP, length 1470
23:02:54.367935 IP 10.0.1.10.52969 > 10.0.2.10.5001: UDP, length 1470
23:02:54.379197 IP 10.0.1.10.52969 > 10.0.2.10.5001: UDP, length 1470
23:02:54.390385 IP 10.0.1.10.52969 > 10.0.2.10.5001: UDP, length 1470
23:02:54.401604 IP 10.0.1.10.52969 > 10.0.2.10.5001: UDP, length 1470
23:02:54.412920 IP 10.0.1.10.52969 > 10.0.2.10.5001: UDP, length 1470
23:02:54.425105 IP 10.0.1.10.52969 > 10.0.2.10.5001: UDP, length 1470
23:02:54.435166 IP 10.0.1.10.52969 > 10.0.2.10.5001: UDP, length 1470
23:02:54.446989 IP 10.0.1.10.52969 > 10.0.2.10.5001: UDP, length 1470
23:02:54.457990 IP 10.0.1.10.52969 > 10.0.2.10.5001: UDP, length 1470
23:02:54.468720 IP 10.0.1.10.52969 > 10.0.2.10.5001: UDP, length 1470
23:02:54.480055 IP 10.0.1.10.52969 > 10.0.2.10.5001: UDP, length 1470
23:02:54.491211 IP 10.0.1.10.52969 > 10.0.2.10.5001: UDP, length 1470
23:02:54.502563 IP 10.0.1.10.52969 > 10.0.2.10.5001: UDP, length 1470
23:02:54.514693 IP 10.0.1.10.52969 > 10.0.2.10.5001: UDP, length 1470
23:02:54.525053 IP 10.0.1.10.52969 > 10.0.2.10.5001: UDP, length 1470
23:02:54.536125 IP 10.0.1.10.52969 > 10.0.2.10.5001: UDP, length 1470
23:02:54.547378 IP 10.0.1.10.52969 > 10.0.2.10.5001: UDP, length 1470
23:02:54.558537 IP 10.0.1.10.52969 > 10.0.2.10.5001: UDP, length 1470
23:02:54.569750 IP 10.0.1.10.52969 > 10.0.2.10.5001: UDP, length 1470
23:02:54.581022 IP 10.0.1.10.52969 > 10.0.2.10.5001: UDP, length 1470
23:02:54.592064 IP 10.0.1.10.52969 > 10.0.2.10.5001: UDP, length 1470
23:02:54.603506 IP 10.0.1.10.52969 > 10.0.2.10.5001: UDP, length 1470
23:02:54.615065 IP 10.0.1.10.52969 > 10.0.2.10.5001: UDP, length 1470
23:02:54.626195 IP 10.0.1.10.52969 > 10.0.2.10.5001: UDP, length 1470
23:02:54.637010 IP 10.0.1.10.52969 > 10.0.2.10.5001: UDP, length 1470
23:02:54.648309 IP 10.0.1.10.52969 > 10.0.2.10.5001: UDP, length 1470
23:02:54.659359 IP 10.0.1.10.52969 > 10.0.2.10.5001: UDP, length 1470
23:02:54.670802 IP 10.0.1.10.52969 > 10.0.2.10.5001: UDP, length 1470
23:02:54.681932 IP 10.0.1.10.52969 > 10.0.2.10.5001: UDP, length 1470
23:02:54.693250 IP 10.0.1.10.52969 > 10.0.2.10.5001: UDP, length 1470
23:02:54.704385 IP 10.0.1.10.52969 > 10.0.2.10.5001: UDP, length 1470
23:02:54.716722 IP 10.0.1.10.52969 > 10.0.2.10.5001: UDP, length 1470
23:02:54.726962 IP 10.0.1.10.52969 > 10.0.2.10.5001: UDP, length 1470
23:02:54.738270 IP 10.0.1.10.52969 > 10.0.2.10.5001: UDP, length 1470
23:02:54.749176 IP 10.0.1.10.52969 > 10.0.2.10.5001: UDP, length 1470
23:02:54.760505 IP 10.0.1.10.52969 > 10.0.2.10.5001: UDP, length 1470
23:02:54.771931 IP 10.0.1.10.52969 > 10.0.2.10.5001: UDP, length 1470
23:02:54.783301 IP 10.0.1.10.52969 > 10.0.2.10.5001: UDP, length 1470
23:02:54.794358 IP 10.0.1.10.52969 > 10.0.2.10.5001: UDP, length 1470
23:02:54.805559 IP 10.0.1.10.52969 > 10.0.2.10.5001: UDP, length 1470
23:02:54.816686 IP 10.0.1.10.52969 > 10.0.2.10.5001: UDP, length 1470
23:02:54.827756 IP 10.0.1.10.52969 > 10.0.2.10.5001: UDP, length 1470
23:02:54.839268 IP 10.0.1.10.52969 > 10.0.2.10.5001: UDP, length 1470
23:02:54.850558 IP 10.0.1.10.52969 > 10.0.2.10.5001: UDP, length 1470
23:02:54.861340 IP 10.0.1.10.52969 > 10.0.2.10.5001: UDP, length 1470
23:02:54.872680 IP 10.0.1.10.52969 > 10.0.2.10.5001: UDP, length 1470
23:02:54.883573 IP 10.0.1.10.52969 > 10.0.2.10.5001: UDP, length 1470
23:02:54.895091 IP 10.0.1.10.52969 > 10.0.2.10.5001: UDP, length 1470
23:02:54.906185 IP 10.0.1.10.52969 > 10.0.2.10.5001: UDP, length 1470
23:02:54.917337 IP 10.0.1.10.52969 > 10.0.2.10.5001: UDP, length 1470
23:02:54.928465 IP 10.0.1.10.52969 > 10.0.2.10.5001: UDP, length 1470
23:02:54.939667 IP 10.0.1.10.52969 > 10.0.2.10.5001: UDP, length 1470
23:02:54.950822 IP 10.0.1.10.52969 > 10.0.2.10.5001: UDP, length 1470
23:02:54.962216 IP 10.0.1.10.52969 > 10.0.2.10.5001: UDP, length 1470
23:02:54.973419 IP 10.0.1.10.52969 > 10.0.2.10.5001: UDP, length 1470
23:02:54.984646 IP 10.0.1.10.52969 > 10.0.2.10.5001: UDP, length 1470
23:02:54.995953 IP 10.0.1.10.52969 > 10.0.2.10.5001: UDP, length 1470
23:02:55.006941 IP 10.0.1.10.52969 > 10.0.2.10.5001: UDP, length 1470
23:02:55.018270 IP 10.0.1.10.52969 > 10.0.2.10.5001: UDP, length 1470
23:02:55.029697 IP 10.0.1.10.52969 > 10.0.2.10.5001: UDP, length 1470
23:02:55.040812 IP 10.0.1.10.52969 > 10.0.2.10.5001: UDP, length 1470
23:02:55.052018 IP 10.0.1.10.52969 > 10.0.2.10.5001: UDP, length 1470
23:02:55.064431 IP 10.0.1.10.52969 > 10.0.2.10.5001: UDP, length 1470
23:02:55.074770 IP 10.0.1.10.52969 > 10.0.2.10.5001: UDP, length 1470
23:02:55.085947 IP 10.0.1.10.52969 > 10.0.2.10.5001: UDP, length 1470
23:02:55.097120 IP 10.0.1.10.52969 > 10.0.2.10.5001: UDP, length 1470
23:02:55.108297 IP 10.0.1.10.52969 > 10.0.2.10.5001: UDP, length 1470
23:02:55.119455 IP 10.0.1.10.52969 > 10.0.2.10.5001: UDP, length 1470
23:02:55.130922 IP 10.0.1.10.52969 > 10.0.2.10.5001: UDP, length 1470
23:02:55.141835 IP 10.0.1.10.52969 > 10.0.2.10.5001: UDP, length 1470
23:02:55.153151 IP 10.0.1.10.52969 > 10.0.2.10.5001: UDP, length 1470
23:02:55.164200 IP 10.0.1.10.52969 > 10.0.2.10.5001: UDP, length 1470
23:02:55.175990 IP 10.0.1.10.52969 > 10.0.2.10.5001: UDP, length 1470
23:02:55.186939 IP 10.0.1.10.52969 > 10.0.2.10.5001: UDP, length 1470
23:02:55.198145 IP 10.0.1.10.52969 > 10.0.2.10.5001: UDP, length 1470
23:02:55.208966 IP 10.0.1.10.52969 > 10.0.2.10.5001: UDP, length 1470
23:02:55.220165 IP 10.0.1.10.52969 > 10.0.2.10.5001: UDP, length 1470
23:02:55.231419 IP 10.0.1.10.52969 > 10.0.2.10.5001: UDP, length 1470
23:02:55.242734 IP 10.0.1.10.52969 > 10.0.2.10.5001: UDP, length 1470
23:02:55.254010 IP 10.0.1.10.52969 > 10.0.2.10.5001: UDP, length 1470
23:02:55.265272 IP 10.0.1.10.52969 > 10.0.2.10.5001: UDP, length 1470
23:02:55.276498 IP 10.0.1.10.52969 > 10.0.2.10.5001: UDP, length 1470
23:02:55.287523 IP 10.0.1.10.52969 > 10.0.2.10.5001: UDP, length 1470
23:02:55.299138 IP 10.0.1.10.52969 > 10.0.2.10.5001: UDP, length 1470
23:02:55.310339 IP 10.0.1.10.52969 > 10.0.2.10.5001: UDP, length 1470
23:02:55.321125 IP 10.0.1.10.52969 > 10.0.2.10.5001: UDP, length 1470
23:02:55.332538 IP 10.0.1.10.52969 > 10.0.2.10.5001: UDP, length 1470
23:02:55.344176 IP 10.0.1.10.52969 > 10.0.2.10.5001: UDP, length 1470
23:02:55.354942 IP 10.0.1.10.52969 > 10.0.2.10.5001: UDP, length 1470
23:02:55.366394 IP 10.0.1.10.52969 > 10.0.2.10.5001: UDP, length 1470
23:02:55.377207 IP 10.0.1.10.52969 > 10.0.2.10.5001: UDP, length 1470
23:02:55.388904 IP 10.0.1.10.52969 > 10.0.2.10.5001: UDP, length 1470
23:02:55.399612 IP 10.0.1.10.52969 > 10.0.2.10.5001: UDP, length 1470
23:02:55.411121 IP 10.0.1.10.52969 > 10.0.2.10.5001: UDP, length 1470
23:02:55.423423 IP 10.0.1.10.52969 > 10.0.2.10.5001: UDP, length 1470
23:02:55.433176 IP 10.0.1.10.52969 > 10.0.2.10.5001: UDP, length 1470
23:02:55.445031 IP 10.0.1.10.52969 > 10.0.2.10.5001: UDP, length 1470
23:02:55.455777 IP 10.0.1.10.52969 > 10.0.2.10.5001: UDP, length 1470
23:02:55.466887 IP 10.0.1.10.52969 > 10.0.2.10.5001: UDP, length 1470
23:02:55.478440 IP 10.0.1.10.52969 > 10.0.2.10.5001: UDP, length 1470
23:02:55.489440 IP 10.0.1.10.52969 > 10.0.2.10.5001: UDP, length 1470
23:02:55.500734 IP 10.0.1.10.52969 > 10.0.2.10.5001: UDP, length 1470
23:02:55.512274 IP 10.0.1.10.52969 > 10.0.2.10.5001: UDP, length 1470
23:02:55.522986 IP 10.0.1.10.52969 > 10.0.2.10.5001: UDP, length 1470
23:02:55.534183 IP 10.0.1.10.52969 > 10.0.2.10.5001: UDP, length 1470
23:02:55.545614 IP 10.0.1.10.52969 > 10.0.2.10.5001: UDP, length 1470
23:02:55.556756 IP 10.0.1.10.52969 > 10.0.2.10.5001: UDP, length 1470
23:02:55.567825 IP 10.0.1.10.52969 > 10.0.2.10.5001: UDP, length 1470
23:02:55.578978 IP 10.0.1.10.52969 > 10.0.2.10.5001: UDP, length 1470
23:02:55.590566 IP 10.0.1.10.52969 > 10.0.2.10.5001: UDP, length 1470
23:02:55.601753 IP 10.0.1.10.52969 > 10.0.2.10.5001: UDP, length 1470
23:02:55.612911 IP 10.0.1.10.52969 > 10.0.2.10.5001: UDP, length 1470
23:02:55.624055 IP 10.0.1.10.52969 > 10.0.2.10.5001: UDP, length 1470
23:02:55.635278 IP 10.0.1.10.52969 > 10.0.2.10.5001: UDP, length 1470
23:02:55.646978 IP 10.0.1.10.52969 > 10.0.2.10.5001: UDP, length 1470
23:02:55.657977 IP 10.0.1.10.52969 > 10.0.2.10.5001: UDP, length 1470
23:02:55.669076 IP 10.0.1.10.52969 > 10.0.2.10.5001: UDP, length 1470
23:02:55.680247 IP 10.0.1.10.52969 > 10.0.2.10.5001: UDP, length 1470
23:02:55.691212 IP 10.0.1.10.52969 > 10.0.2.10.5001: UDP, length 1470
23:02:55.703347 IP 10.0.1.10.52969 > 10.0.2.10.5001: UDP, length 1470
23:02:55.713980 IP 10.0.1.10.52969 > 10.0.2.10.5001: UDP, length 1470
23:02:55.725161 IP 10.0.1.10.52969 > 10.0.2.10.5001: UDP, length 1470
23:02:55.736242 IP 10.0.1.10.52969 > 10.0.2.10.5001: UDP, length 1470
23:02:55.747412 IP 10.0.1.10.52969 > 10.0.2.10.5001: UDP, length 1470
23:02:55.759088 IP 10.0.1.10.52969 > 10.0.2.10.5001: UDP, length 1470
23:02:55.769662 IP 10.0.1.10.52969 > 10.0.2.10.5001: UDP, length 1470
23:02:55.781013 IP 10.0.1.10.52969 > 10.0.2.10.5001: UDP, length 1470
23:02:55.792350 IP 10.0.1.10.52969 > 10.0.2.10.5001: UDP, length 1470
23:02:55.803496 IP 10.0.1.10.52969 > 10.0.2.10.5001: UDP, length 1470
23:02:55.814913 IP 10.0.1.10.52969 > 10.0.2.10.5001: UDP, length 1470
23:02:55.826247 IP 10.0.1.10.52969 > 10.0.2.10.5001: UDP, length 1470
23:02:55.837263 IP 10.0.1.10.52969 > 10.0.2.10.5001: UDP, length 1470
23:02:55.848599 IP 10.0.1.10.52969 > 10.0.2.10.5001: UDP, length 1470
23:02:55.860119 IP 10.0.1.10.52969 > 10.0.2.10.5001: UDP, length 1470
23:02:55.870888 IP 10.0.1.10.52969 > 10.0.2.10.5001: UDP, length 1470
23:02:55.881849 IP 10.0.1.10.52969 > 10.0.2.10.5001: UDP, length 1470
23:02:55.893249 IP 10.0.1.10.52969 > 10.0.2.10.5001: UDP, length 1470
23:02:55.904250 IP 10.0.1.10.52969 > 10.0.2.10.5001: UDP, length 1470
23:02:55.915619 IP 10.0.1.10.52969 > 10.0.2.10.5001: UDP, length 1470
23:02:55.926735 IP 10.0.1.10.52969 > 10.0.2.10.5001: UDP, length 1470
23:02:55.937976 IP 10.0.1.10.52969 > 10.0.2.10.5001: UDP, length 1470
23:02:55.949468 IP 10.0.1.10.52969 > 10.0.2.10.5001: UDP, length 1470
23:02:55.960612 IP 10.0.1.10.52969 > 10.0.2.10.5001: UDP, length 1470
23:02:55.971447 IP 10.0.1.10.52969 > 10.0.2.10.5001: UDP, length 1470
23:02:55.983047 IP 10.0.1.10.52969 > 10.0.2.10.5001: UDP, length 1470
23:02:55.994298 IP 10.0.1.10.52969 > 10.0.2.10.5001: UDP, length 1470
23:02:56.005481 IP 10.0.1.10.52969 > 10.0.2.10.5001: UDP, length 1470
23:02:56.016892 IP 10.0.1.10.52969 > 10.0.2.10.5001: UDP, length 1470
23:02:56.027688 IP 10.0.1.10.52969 > 10.0.2.10.5001: UDP, length 1470
23:02:56.038886 IP 10.0.1.10.52969 > 10.0.2.10.5001: UDP, length 1470
23:02:56.050358 IP 10.0.1.10.52969 > 10.0.2.10.5001: UDP, length 1470
23:02:56.061727 IP 10.0.1.10.52969 > 10.0.2.10.5001: UDP, length 1470
23:02:56.072802 IP 10.0.1.10.52969 > 10.0.2.10.5001: UDP, length 1470
23:02:56.084082 IP 10.0.1.10.52969 > 10.0.2.10.5001: UDP, length 1470
23:02:56.095260 IP 10.0.1.10.52969 > 10.0.2.10.5001: UDP, length 1470
23:02:56.106250 IP 10.0.1.10.52969 > 10.0.2.10.5001: UDP, length 1470
23:02:56.117535 IP 10.0.1.10.52969 > 10.0.2.10.5001: UDP, length 1470
23:02:56.128673 IP 10.0.1.10.52969 > 10.0.2.10.5001: UDP, length 1470
23:02:56.139834 IP 10.0.1.10.52969 > 10.0.2.10.5001: UDP, length 1470
23:02:56.151235 IP 10.0.1.10.52969 > 10.0.2.10.5001: UDP, length 1470
23:02:56.162682 IP 10.0.1.10.52969 > 10.0.2.10.5001: UDP, length 1470
23:02:56.173618 IP 10.0.1.10.52969 > 10.0.2.10.5001: UDP, length 1470
23:02:56.184860 IP 10.0.1.10.52969 > 10.0.2.10.5001: UDP, length 1470
23:02:56.195914 IP 10.0.1.10.52969 > 10.0.2.10.5001: UDP, length 1470
23:02:56.207371 IP 10.0.1.10.52969 > 10.0.2.10.5001: UDP, length 1470
23:02:56.218578 IP 10.0.1.10.52969 > 10.0.2.10.5001: UDP, length 1470
23:02:56.230501 IP 10.0.1.10.52969 > 10.0.2.10.5001: UDP, length 1470
23:02:56.240932 IP 10.0.1.10.52969 > 10.0.2.10.5001: UDP, length 1470
23:02:56.252715 IP 10.0.1.10.52969 > 10.0.2.10.5001: UDP, length 1470
23:02:56.263290 IP 10.0.1.10.52969 > 10.0.2.10.5001: UDP, length 1470
23:02:56.274461 IP 10.0.1.10.52969 > 10.0.2.10.5001: UDP, length 1470
23:02:56.285742 IP 10.0.1.10.52969 > 10.0.2.10.5001: UDP, length 1470
23:02:56.296848 IP 10.0.1.10.52969 > 10.0.2.10.5001: UDP, length 1470
23:02:56.308113 IP 10.0.1.10.52969 > 10.0.2.10.5001: UDP, length 1470
23:02:56.319468 IP 10.0.1.10.52969 > 10.0.2.10.5001: UDP, length 1470
23:02:56.330591 IP 10.0.1.10.52969 > 10.0.2.10.5001: UDP, length 1470
23:02:56.341876 IP 10.0.1.10.52969 > 10.0.2.10.5001: UDP, length 1470
23:02:56.352890 IP 10.0.1.10.52969 > 10.0.2.10.5001: UDP, length 1470
23:02:56.364393 IP 10.0.1.10.52969 > 10.0.2.10.5001: UDP, length 1470
23:02:56.375536 IP 10.0.1.10.52969 > 10.0.2.10.5001: UDP, length 1470
23:02:56.387088 IP 10.0.1.10.52969 > 10.0.2.10.5001: UDP, length 1470
23:02:56.398859 IP 10.0.1.10.52969 > 10.0.2.10.5001: UDP, length 1470
23:02:56.408921 IP 10.0.1.10.52969 > 10.0.2.10.5001: UDP, length 1470
23:02:56.420600 IP 10.0.1.10.52969 > 10.0.2.10.5001: UDP, length 1470
23:02:56.431391 IP 10.0.1.10.52969 > 10.0.2.10.5001: UDP, length 1470
23:02:56.442972 IP 10.0.1.10.52969 > 10.0.2.10.5001: UDP, length 1470
23:02:56.453965 IP 10.0.1.10.52969 > 10.0.2.10.5001: UDP, length 1470
23:02:56.465093 IP 10.0.1.10.52969 > 10.0.2.10.5001: UDP, length 1470
23:02:56.476405 IP 10.0.1.10.52969 > 10.0.2.10.5001: UDP, length 1470
23:02:56.487497 IP 10.0.1.10.52969 > 10.0.2.10.5001: UDP, length 1470
23:02:56.499005 IP 10.0.1.10.52969 > 10.0.2.10.5001: UDP, length 1470
23:02:56.510501 IP 10.0.1.10.52969 > 10.0.2.10.5001: UDP, length 1470
23:02:56.521086 IP 10.0.1.10.52969 > 10.0.2.10.5001: UDP, length 1470
23:02:56.532585 IP 10.0.1.10.52969 > 10.0.2.10.5001: UDP, length 1470
23:02:56.543676 IP 10.0.1.10.52969 > 10.0.2.10.5001: UDP, length 1470
23:02:56.554776 IP 10.0.1.10.52969 > 10.0.2.10.5001: UDP, length 1470
23:02:56.566563 IP 10.0.1.10.52969 > 10.0.2.10.5001: UDP, length 1470
23:02:56.577982 IP 10.0.1.10.52969 > 10.0.2.10.5001: UDP, length 1470
23:02:56.588669 IP 10.0.1.10.52969 > 10.0.2.10.5001: UDP, length 1470
23:02:56.599720 IP 10.0.1.10.52969 > 10.0.2.10.5001: UDP, length 1470
23:02:56.611391 IP 10.0.1.10.52969 > 10.0.2.10.5001: UDP, length 1470
23:02:56.622790 IP 10.0.1.10.52969 > 10.0.2.10.5001: UDP, length 1470
23:02:56.634126 IP 10.0.1.10.52969 > 10.0.2.10.5001: UDP, length 1470
