23:02:17.674534 IP 10.0.1.10.44692 > 10.0.2.10.5001: UDP, length 1470
23:02:17.677467 IP 10.0.1.10.44692 > 10.0.2.10.5001: UDP, length 1470
23:02:17.688036 IP 10.0.1.10.44692 > 10.0.2.10.5001: UDP, length 1470
23:02:17.699608 IP 10.0.1.10.44692 > 10.0.2.10.5001: UDP, length 1470
23:02:17.711523 IP 10.0.1.10.44692 > 10.0.2.10.5001: UDP, length 1470
23:02:17.721877 IP 10.0.1.10.44692 > 10.0.2.10.5001: UDP, length 1470
23:02:17.733253 IP 10.0.1.10.44692 > 10.0.2.10.5001: UDP, length 1470
23:02:17.744276 IP 10.0.1.10.44692 > 10.0.2.10.5001: UDP, length 1470
23:02:17.755414 IP 10.0.1.10.44692 > 10.0.2.10.5001: UDP, length 1470
23:02:17.767647 IP 10.0.1.10.44692 > 10.0.2.10.5001: UDP, length 1470
23:02:17.778316 IP 10.0.1.10.44692 > 10.0.2.10.5001: UDP, length 1470
23:02:17.789707 IP 10.0.1.10.44692 > 10.0.2.10.5001: UDP, length 1470
23:02:17.800603 IP 10.0.1.10.44692 > 10.0.2.10.5001: UDP, length 1470
23:02:17.811735 IP 10.0.1.10.44692 > 10.0.2.10.5001: UDP, length 1470
23:02:17.823321 IP 10.0.1.10.44692 > 10.0.2.10.5001: UDP, length 1470
23:02:17.834755 IP 10.0.1.10.44692 > 10.0.2.10.5001: UDP, length 1470
23:02:17.845277 IP 10.0.1.10.44692 > 10.0.2.10.5001: UDP, length 1470
23:02:17.856330 IP 10.0.1.10.44692 > 10.0.2.10.5001: UDP, length 1470
23:02:17.867807 IP 10.0.1.10.44692 > 10.0.2.10.5001: UDP, length 1470
23:02:17.879245 IP 10.0.1.10.44692 > 10.0.2.10.5001: UDP, length 1470
23:02:17.890510 IP 10.0.1.10.44692 > 10.0.2.10.5001: UDP, length 1470
23:02:17.901542 IP 10.0.1.10.44692 > 10.0.2.10.5001: UDP, length 1470
23:02:17.912806 IP 10.0.1.10.44692 > 10.0.2.10.5001: UDP, length 1470
23:02:17.923932 IP 10.0.1.10.44692 > 10.0.2.10.5001: UDP, length 1470
23:02:17.935535 IP 10.0.1.10.44692 > 10.0.2.10.5001: UDP, length 1470
23:02:17.946734 IP 10.0.1.10.44692 > 10.0.2.10.5001: UDP, length 1470
23:02:17.957564 IP 10.0.1.10.44692 > 10.0.2.10.5001: UDP, length 1470
23:02:17.968749 IP 10.0.1.10.44692 > 10.0.2.10.5001: UDP, length 1470
23:02:17.979826 IP 10.0.1.10.44692 > 10.0.2.10.5001: UDP, length 1470
23:02:17.991546 IP 10.0.1.10.44692 > 10.0.2.10.5001: UDP, length 1470
23:02:18.002349 IP 10.0.1.10.44692 > 10.0.2.10.5001: UDP, length 1470
23:02:18.013697 IP 10.0.1.10.44692 > 10.0.2.10.5001: UDP, length 1470
23:02:18.024614 IP 10.0.1.10.44692 > 10.0.2.10.5001: UDP, length 1470
23:02:18.035607 IP 10.0.1.10.44692 > 10.0.2.10.5001: UDP, length 1470
23:02:18.047054 IP 10.0.1.10.44692 > 10.0.2.10.5001: UDP, length 1470
23:02:18.058494 IP 10.0.1.10.44692 > 10.0.2.10.5001: UDP, length 1470
23:02:18.069698 IP 10.0.1.10.44692 > 10.0.2.10.5001: UDP, length 1470
23:02:18.080857 IP 10.0.1.10.44692 > 10.0.2.10.5001: UDP, length 1470
23:02:18.092041 IP 10.0.1.10.44692 > 10.0.2.10.5001: UDP, length 1470
23:02:18.103090 IP 10.0.1.10.44692 > 10.0.2.10.5001: UDP, length 1470
23:02:18.114485 IP 10.0.1.10.44692 > 10.0.2.10.5001: UDP, length 1470
23:02:18.126022 IP 10.0.1.10.44692 > 10.0.2.10.5001: UDP, length 1470
23:02:18.137023 IP 10.0.1.10.44692 > 10.0.2.10.5001: UDP, length 1470
23:02:18.148162 IP 10.0.1.10.44692 > 10.0.2.10.5001: UDP, length 1470
23:02:18.159097 IP 10.0.1.10.44692 > 10.0.2.10.5001: UDP, length 1470
23:02:18.171162 IP 10.0.1.10.44692 > 10.0.2.10.5001: UDP, length 1470
23:02:18.182017 IP 10.0.1.10.44692 > 10.0.2.10.5001: UDP, length 1470
23:02:18.193169 IP 10.0.1.10.44692 > 10.0.2.10.5001: UDP, length 1470
23:02:18.204207 IP 10.0.1.10.44692 > 10.0.2.10.5001: UDP, length 1470
23:02:18.215476 IP 10.0.1.10.44692 > 10.0.2.10.5001: UDP, length 1470
23:02:18.227055 IP 10.0.1.10.44692 > 10.0.2.10.5001: UDP, length 1470
23:02:18.238691 IP 10.0.1.10.44692 > 10.0.2.10.5001: UDP, length 1470
23:02:18.249243 IP 10.0.1.10.44692 > 10.0.2.10.5001: UDP, length 1470
23:02:18.260248 IP 10.0.1.10.44692 > 10.0.2.10.5001: UDP, length 1470
23:02:18.271508 IP 10.0.1.10.44692 > 10.0.2.10.5001: UDP, length 1470
23:02:18.282943 IP 10.0.1.10.44692 > 10.0.2.10.5001: UDP, length 1470
23:02:18.294080 IP 10.0.1.10.44692 > 10.0.2.10.5001: UDP, length 1470
23:02:18.305290 IP 10.0.1.10.44692 > 10.0.2.10.5001: UDP, length 1470
23:02:18.316517 IP 10.0.1.10.44692 > 10.0.2.10.5001: UDP, length 1470
23:02:18.327602 IP 10.0.1.10.44692 > 10.0.2.10.5001: UDP, length 1470
23:02:18.339237 IP 10.0.1.10.44692 > 10.0.2.10.5001: UDP, length 1470
23:02:18.350200 IP 10.0.1.10.44692 > 10.0.2.10.5001: UDP, length 1470
23:02:18.361282 IP 10.0.1.10.44692 > 10.0.2.10.5001: UDP, length 1470
23:02:18.372573 IP 10.0.1.10.44692 > 10.0.2.10.5001: UDP, length 1470
23:02:18.384167 IP 10.0.1.10.44692 > 10.0.2.10.5001: UDP, length 1470
23:02:18.394961 IP 10.0.1.10.44692 > 10.0.2.10.5001: UDP, length 1470
23:02:18.406046 IP 10.0.1.10.44692 > 10.0.2.10.5001: UDP, length 1470
23:02:18.417457 IP 10.0.1.10.44692 > 10.0.2.10.5001: UDP, length 1470
23:02:18.428747 IP 10.0.1.10.44692 > 10.0.2.10.5001: UDP, length 1470
23:02:18.439691 IP 10.0.1.10.44692 > 10.0.2.10.5001: UDP, length 1470
23:02:18.450894 IP 10.0.1.10.44692 > 10.0.2.10.5001: UDP, length 1470
23:02:18.462289 IP 10.0.1.10.44692 > 10.0.2.10.5001: UDP, length 1470
23:02:18.473533 IP 10.0.1.10.44692 > 10.0.2.10.5001: UDP, length 1470
23:02:18.484685 IP 10.0.1.10.44692 > 10.0.2.10.5001: UDP, length 1470
23:02:18.495869 IP 10.0.1.10.44692 > 10.0.2.10.5001: UDP, length 1470
23:02:18.507234 IP 10.0.1.10.44692 > 10.0.2.10.5001: UDP, length 1470
23:02:18.518507 IP 10.0.1.10.44692 > 10.0.2.10.5001: UDP, length 1470
23:02:18.529520 IP 10.0.1.10.44692 > 10.0.2.10.5001: UDP, length 1470
23:02:18.540626 IP 10.0.1.10.44692 > 10.0.2.10.5001: UDP, length 1470
23:02:18.552923 IP 10.0.1.10.44692 > 10.0.2.10.5001: UDP, length 1470
23:02:18.562855 IP 10.0.1.10.44692 > 10.0.2.10.5001: UDP, length 1470
23:02:18.574407 IP 10.0.1.10.44692 > 10.0.2.10.5001: UDP, length 1470
23:02:18.585401 IP 10.0.1.10.44692 > 10.0.2.10.5001: UDP, length 1470
23:02:18.597044 IP 10.0.1.10.44692 > 10.0.2.10.5001: UDP, length 1470
23:02:18.608203 IP 10.0.1.10.44692 > 10.0.2.10.5001: UDP, length 1470
23:02:18.618884 IP 10.0.1.10.44692 > 10.0.2.10.5001: UDP, length 1470
23:02:18.630092 IP 10.0.1.10.44692 > 10.0.2.10.5001: UDP, length 1470
23:02:18.641394 IP 10.0.1.10.44692 > 10.0.2.10.5001: UDP, length 1470
23:02:18.652790 IP 10.0.1.10.44692 > 10.0.2.10.5001: UDP, length 1470
23:02:18.663829 IP 10.0.1.10.44692 > 10.0.2.10.5001: UDP, length 1470
23:02:18.675050 IP 10.0.1.10.44692 > 10.0.2.10.5001: UDP, length 1470
23:02:18.686274 IP 10.0.1.10.44692 > 10.0.2.10.5001: UDP, length 1470
23:02:18.697818 IP 10.0.1.10.44692 > 10.0.2.10.5001: UDP, length 1470
23:02:18.709423 IP 10.0.1.10.44692 > 10.0.2.10.5001: UDP, length 1470
23:02:18.719967 IP 10.0.1.10.44692 > 10.0.2.10.5001: UDP, length 1470
23:02:18.731082 IP 10.0.1.10.44692 > 10.0.2.10.5001: UDP, length 1470
23:02:18.742738 IP 10.0.1.10.44692 > 10.0.2.10.5001: UDP, length 1470
23:02:18.754309 IP 10.0.1.10.44692 > 10.0.2.10.5001: UDP, length 1470
23:02:18.765191 IP 10.0.1.10.44692 > 10.0.2.10.5001: UDP, length 1470
23:02:18.776038 IP 10.0.1.10.44692 > 10.0.2.10.5001: UDP, length 1470
23:02:18.787270 IP 10.0.1.10.44692 > 10.0.2.10.5001: UDP, length 1470
23:02:18.798442 IP 10.0.1.10.44692 > 10.0.2.10.5001: UDP, length 1470
23:02:18.810135 IP 10.0.1.10.44692 > 10.0.2.10.5001: UDP, length 1470
23:02:18.820795 IP 10.0.1.10.44692 > 10.0.2.10.5001: UDP, length 1470
23:02:18.832110 IP 10.0.1.10.44692 > 10.0.2.10.5001: UDP, length 1470
23:02:18.843237 IP 10.0.1.10.44692 > 10.0.2.10.5001: UDP, length 1470
23:02:18.854973 IP 10.0.1.10.44692 > 10.0.2.10.5001: UDP, length 1470
23:02:18.865874 IP 10.0.1.10.44692 > 10.0.2.10.5001: UDP, length 1470
23:02:18.877041 IP 10.0.1.10.44692 > 10.0.2.10.5001: UDP, length 1470
23:02:18.888158 IP 10.0.1.10.44692 > 10.0.2.10.5001: UDP, length 1470
23:02:18.899395 IP 10.0.1.10.44692 > 10.0.2.10.5001: UDP, length 1470
23:02:18.910525 IP 10.0.1.10.44692 > 10.0.2.10.5001: UDP, length 1470
23:02:18.921601 IP 10.0.1.10.44692 > 10.0.2.10.5001: UDP, length 1470
23:02:18.933191 IP 10.0.1.10.44692 > 10.0.2.10.5001: UDP, length 1470
23:02:18.944264 IP 10.0.1.10.44692 > 10.0.2.10.5001: UDP, length 1470
23:02:18.955391 IP 10.0.1.10.44692 > 10.0.2.10.5001: UDP, length 1470
23:02:18.967058 IP 10.0.1.10.44692 > 10.0.2.10.5001: UDP, length 1470
23:02:18.978465 IP 10.0.1.10.44692 > 10.0.2.10.5001: UDP, length 1470
23:02:18.989097 IP 10.0.1.10.44692 > 10.0.2.10.5001: UDP, length 1470
23:02:19.000588 IP 10.0.1.10.44692 > 10.0.2.10.5001: UDP, length 1470
23:02:19.011672 IP 10.0.1.10.44692 > 10.0.2.10.5001: UDP, length 1470
23:02:19.022871 IP 10.0.1.10.44692 > 10.0.2.10.5001: UDP, length 1470
23:02:19.034769 IP 10.0.1.10.44692 > 10.0.2.10.5001: UDP, length 1470
23:02:19.045623 IP 10.0.1.10.44692 > 10.0.2.10.5001: UDP, length 1470
23:02:19.056659 IP 10.0.1.10.44692 > 10.0.2.10.5001: UDP, length 1470
23:02:19.068118 IP 10.0.1.10.44692 > 10.0.2.10.5001: UDP, length 1470
23:02:19.079267 IP 10.0.1.10.44692 > 10.0.2.10.5001: UDP, length 1470
23:02:19.089992 IP 10.0.1.10.44692 > 10.0.2.10.5001: UDP, length 1470
23:02:19.101347 IP 10.0.1.10.44692 > 10.0.2.10.5001: UDP, length 1470
23:02:19.112650 IP 10.0.1.10.44692 > 10.0.2.10.5001: UDP, length 1470
23:02:19.123650 IP 10.0.1.10.44692 > 10.0.2.10.5001: UDP, length 1470
23:02:19.134865 IP 10.0.1.10.44692 > 10.0.2.10.5001: UDP, length 1470
23:02:19.146810 IP 10.0.1.10.44692 > 10.0.2.10.5001: UDP, length 1470
23:02:19.157543 IP 10.0.1.10.44692 > 10.0.2.10.5001: UDP, length 1470
23:02:19.168916 IP 10.0.1.10.44692 > 10.0.2.10.5001: UDP, length 1470
23:02:19.179849 IP 10.0.1.10.44692 > 10.0.2.10.5001: UDP, length 1470
23:02:19.190952 IP 10.0.1.10.44692 > 10.0.2.10.5001: UDP, length 1470
23:02:19.202441 IP 10.0.1.10.44692 > 10.0.2.10.5001: UDP, length 1470
23:02:19.213759 IP 10.0.1.10.44692 > 10.0.2.10.5001: UDP, length 1470
23:02:19.224774 IP 10.0.1.10.44692 > 10.0.2.10.5001: UDP, length 1470
23:02:19.236214 IP 10.0.1.10.44692 > 10.0.2.10.5001: UDP, length 1470
23:02:19.247692 IP 10.0.1.10.44692 > 10.0.2.10.5001: UDP, length 1470
23:02:19.258801 IP 10.0.1.10.44692 > 10.0.2.10.5001: UDP, length 1470
23:02:19.270208 IP 10.0.1.10.44692 > 10.0.2.10.5001: UDP, length 1470
23:02:19.281945 IP 10.0.1.10.44692 > 10.0.2.10.5001: UDP, length 1470
23:02:19.292088 IP 10.0.1.10.44692 > 10.0.2.10.5001: UDP, length 1470
23:02:19.303312 IP 10.0.1.10.44692 > 10.0.2.10.5001: UDP, length 1470
23:02:19.314375 IP 10.0.1.10.44692 > 10.0.2.10.5001: UDP, length 1470
23:02:19.325564 IP 10.0.1.10.44692 > 10.0.2.10.5001: UDP, length 1470
23:02:19.336991 IP 10.0.1.10.44692 > 10.0.2.10.5001: UDP, length 1470
23:02:19.348079 IP 10.0.1.10.44692 > 10.0.2.10.5001: UDP, length 1470
23:02:19.359133 IP 10.0.1.10.44692 > 10.0.2.10.5001: UDP, length 1470
23:02:19.370859 IP 10.0.1.10.44692 > 10.0.2.10.5001: UDP, length 1470
23:02:19.382040 IP 10.0.1.10.44692 > 10.0.2.10.5001: UDP, length 1470
23:02:19.392892 IP 10.0.1.10.44692 > 10.0.2.10.5001: UDP, length 1470
23:02:19.404855 IP 10.0.1.10.44692 > 10.0.2.10.5001: UDP, length 1470
23:02:19.415325 IP 10.0.1.10.44692 > 10.0.2.10.5001: UDP, length 1470
23:02:19.426813 IP 10.0.1.10.44692 > 10.0.2.10.5001: UDP, length 1470
23:02:19.438056 IP 10.0.1.10.44692 > 10.0.2.10.5001: UDP, length 1470
23:02:19.449438 IP 10.0.1.10.44692 > 10.0.2.10.5001: UDP, length 1470
23:02:19.460226 IP 10.0.1.10.44692 > 10.0.2.10.5001: UDP, length 1470
23:02:19.471655 IP 10.0.1.10.44692 > 10.0.2.10.5001: UDP, length 1470
23:02:19.482859 IP 10.0.1.10.44692 > 10.0.2.10.5001: UDP, length 1470
23:02:19.493934 IP 10.0.1.10.44692 > 10.0.2.10.5001: UDP, length 1470
23:02:19.505468 IP 10.0.1.10.44692 > 10.0.2.10.5001: UDP, length 1470
23:02:19.516249 IP 10.0.1.10.44692 > 10.0.2.10.5001: UDP, length 1470
23:02:19.527520 IP 10.0.1.10.44692 > 10.0.2.10.5001: UDP, length 1470
23:02:19.538675 IP 10.0.1.10.44692 > 10.0.2.10.5001: UDP, length 1470
23:02:19.550198 IP 10.0.1.10.44692 > 10.0.2.10.5001: UDP, length 1470
23:02:19.561082 IP 10.0.1.10.44692 > 10.0.2.10.5001: UDP, length 1470
23:02:19.572371 IP 10.0.1.10.44692 > 10.0.2.10.5001: UDP, length 1470
23:02:19.583675 IP 10.0.1.10.44692 > 10.0.2.10.5001: UDP, length 1470
23:02:19.594669 IP 10.0.1.10.44692 > 10.0.2.10.5001: UDP, length 1470
23:02:19.605810 IP 10.0.1.10.44692 > 10.0.2.10.5001: UDP, length 1470
23:02:19.617122 IP 10.0.1.10.44692 > 10.0.2.10.5001: UDP, length 1470
23:02:19.628346 IP 10.0.1.10.44692 > 10.0.2.10.5001: UDP, length 1470
23:02:19.639543 IP 10.0.1.10.44692 > 10.0.2.10.5001: UDP, length 1470
23:02:19.650935 IP 10.0.1.10.44692 > 10.0.2.10.5001: UDP, length 1470
23:02:19.662318 IP 10.0.1.10.44692 > 10.0.2.10.5001: UDP, length 1470
23:02:19.673287 IP 10.0.1.10.44692 > 10.0.2.10.5001: UDP, length 1470
23:02:19.684624 IP 10.0.1.10.44692 > 10.0.2.10.5001: UDP, length 1470
23:02:19.695649 IP 10.0.1.10.44692 > 10.0.2.10.5001: UDP, length 1470
23:02:19.706864 IP 10.0.1.10.44692 > 10.0.2.10.5001: UDP, length 1470
23:02:19.718096 IP 10.0.1.10.44692 > 10.0.2.10.5001: UDP, length 1470
23:02:19.729294 IP 10.0.1.10.44692 > 10.0.2.10.5001: UDP, length 1470
23:02:19.740404 IP 10.0.1.10.44692 > 10.0.2.10.5001: UDP, length 1470
23:02:19.751701 IP 10.0.1.10.44692 > 10.0.2.10.5001: UDP, length 1470
23:02:19.763169 IP 10.0.1.10.44692 > 10.0.2.10.5001: UDP, length 1470
23:02:19.774092 IP 10.0.1.10.44692 > 10.0.2.10.5001: UDP, length 1470
23:02:19.785347 IP 10.0.1.10.44692 > 10.0.2.10.5001: UDP, length 1470
23:02:19.796773 IP 10.0.1.10.44692 > 10.0.2.10.5001: UDP, length 1470
23:02:19.807803 IP 10.0.1.10.44692 > 10.0.2.10.5001: UDP, length 1470
23:02:19.819206 IP 10.0.1.10.44692 > 10.0.2.10.5001: UDP, length 1470
23:02:19.830861 IP 10.0.1.10.44692 > 10.0.2.10.5001: UDP, length 1470
23:02:19.841970 IP 10.0.1.10.44692 > 10.0.2.10.5001: UDP, length 1470
23:02:19.852804 IP 10.0.1.10.44692 > 10.0.2.10.5001: UDP, length 1470
23:02:19.863965 IP 10.0.1.10.44692 > 10.0.2.10.5001: UDP, length 1470
23:02:19.875320 IP 10.0.1.10.44692 > 10.0.2.10.5001: UDP, length 1470
23:02:19.886301 IP 10.0.1.10.44692 > 10.0.2.10.5001: UDP, length 1470
23:02:19.897914 IP 10.0.1.10.44692 > 10.0.2.10.5001: UDP, length 1470
23:02:19.908927 IP 10.0.1.10.44692 > 10.0.2.10.5001: UDP, length 1470
23:02:19.919960 IP 10.0.1.10.44692 > 10.0.2.10.5001: UDP, length 1470
23:02:19.931103 IP 10.0.1.10.44692 > 10.0.2.10.5001: UDP, length 1470
23:02:19.942827 IP 10.0.1.10.44692 > 10.0.2.10.5001: UDP, length 1470
23:02:19.953606 IP 10.0.1.10.44692 > 10.0.2.10.5001: UDP, length 1470
23:02:19.964974 IP 10.0.1.10.44692 > 10.0.2.10.5001: UDP, length 1470
23:02:19.975977 IP 10.0.1.10.44692 > 10.0.2.10.5001: UDP, length 1470
23:02:19.987185 IP 10.0.1.10.44692 > 10.0.2.10.5001: UDP, length 1470
23:02:19.998527 IP 10.0.1.10.44692 > 10.0.2.10.5001: UDP, length 1470
23:02:20.009944 IP 10.0.1.10.44692 > 10.0.2.10.5001: UDP, length 1470
23:02:20.021293 IP 10.0.1.10.44692 > 10.0.2.10.5001: UDP, length 1470
23:02:20.032203 IP 10.0.1.10.44692 > 10.0.2.10.5001: UDP, length 1470
23:02:20.043301 IP 10.0.1.10.44692 > 10.0.2.10.5001: UDP, length 1470
23:02:20.054540 IP 10.0.1.10.44692 > 10.0.2.10.5001: UDP, length 1470
23:02:20.065927 IP 10.0.1.10.44692 > 10.0.2.10.5001: UDP, length 1470
23:02:20.076978 IP 10.0.1.10.44692 > 10.0.2.10.5001: UDP, length 1470
23:02:20.088256 IP 10.0.1.10.44692 > 10.0.2.10.5001: UDP, length 1470
23:02:20.099326 IP 10.0.1.10.44692 > 10.0.2.10.5001: UDP, length 1470
23:02:20.111158 IP 10.0.1.10.44692 > 10.0.2.10.5001: UDP, length 1470
23:02:20.122016 IP 10.0.1.10.44692 > 10.0.2.10.5001: UDP, length 1470
23:02:20.133125 IP 10.0.1.10.44692 > 10.0.2.10.5001: UDP, length 1470
23:02:20.144357 IP 10.0.1.10.44692 > 10.0.2.10.5001: UDP, length 1470
23:02:20.155439 IP 10.0.1.10.44692 > 10.0.2.10.5001: UDP, length 1470
23:02:20.167221 IP 10.0.1.10.44692 > 10.0.2.10.5001: UDP, length 1470
23:02:20.178261 IP 10.0.1.10.44692 > 10.0.2.10.5001: UDP, length 1470
23:02:20.189155 IP 10.0.1.10.44692 > 10.0.2.10.5001: UDP, length 1470
23:02:20.200385 IP 10.0.1.10.44692 > 10.0.2.10.5001: UDP, length 1470
23:02:20.212054 IP 10.0.1.10.44692 > 10.0.2.10.5001: UDP, length 1470
23:02:20.222926 IP 10.0.1.10.44692 > 10.0.2.10.5001: UDP, length 1470
23:02:20.234691 IP 10.0.1.10.44692 > 10.0.2.10.5001: UDP, length 1470
23:02:20.245372 IP 10.0.1.10.44692 > 10.0.2.10.5001: UDP, length 1470
23:02:20.256331 IP 10.0.1.10.44692 > 10.0.2.10.5001: UDP, length 1470
23:02:20.268145 IP 10.0.1.10.44692 > 10.0.2.10.5001: UDP, length 1470
23:02:20.278759 IP 10.0.1.10.44692 > 10.0.2.10.5001: UDP, length 1470
23:02:20.290667 IP 10.0.1.10.44692 > 10.0.2.10.5001: UDP, length 1470
23:02:20.301601 IP 10.0.1.10.44692 > 10.0.2.10.5001: UDP, length 1470
23:02:20.312575 IP 10.0.1.10.44692 > 10.0.2.10.5001: UDP, length 1470
23:02:20.324013 IP 10.0.1.10.44692 > 10.0.2.10.5001: UDP, length 1470
23:02:20.335003 IP 10.0.1.10.44692 > 10.0.2.10.5001: UDP, length 1470
23:02:20.346963 IP 10.0.1.10.44692 > 10.0.2.10.5001: UDP, length 1470
23:02:20.357674 IP 10.0.1.10.44692 > 10.0.2.10.5001: UDP, length 1470
23:02:20.368892 IP 10.0.1.10.44692 > 10.0.2.10.5001: UDP, length 1470
23:02:20.379947 IP 10.0.1.10.44692 > 10.0.2.10.5001: UDP, length 1470
23:02:20.391095 IP 10.0.1.10.44692 > 10.0.2.10.5001: UDP, length 1470
23:02:20.402874 IP 10.0.1.10.44692 > 10.0.2.10.5001: UDP, length 1470
23:02:20.414043 IP 10.0.1.10.44692 > 10.0.2.10.5001: UDP, length 1470
23:02:20.425166 IP 10.0.1.10.44692 > 10.0.2.10.5001: UDP, length 1470
23:02:20.436246 IP 10.0.1.10.44692 > 10.0.2.10.5001: UDP, length 1470
23:02:20.447669 IP 10.0.1.10.44692 > 10.0.2.10.5001: UDP, length 1470
23:02:20.459090 IP 10.0.1.10.44692 > 10.0.2.10.5001: UDP, length 1470
23:02:20.469640 IP 10.0.1.10.44692 > 10.0.2.10.5001: UDP, length 1470
23:02:20.480749 IP 10.0.1.10.44692 > 10.0.2.10.5001: UDP, length 1470
23:02:20.491869 IP 10.0.1.10.44692 > 10.0.2.10.5001: UDP, length 1470
23:02:20.503284 IP 10.0.1.10.44692 > 10.0.2.10.5001: UDP, length 1470
23:02:20.515767 IP 10.0.1.10.44692 > 10.0.2.10.5001: UDP, length 1470
23:02:20.526402 IP 10.0.1.10.44692 > 10.0.2.10.5001: UDP, length 1470
23:02:20.537002 IP 10.0.1.10.44692 > 10.0.2.10.5001: UDP, length 1470
23:02:20.548012 IP 10.0.1.10.44692 > 10.0.2.10.5001: UDP, length 1470
23:02:20.559343 IP 10.0.1.10.44692 > 10.0.2.10.5001: UDP, length 1470
23:02:20.570812 IP 10.0.1.10.44692 > 10.0.2.10.5001: UDP, length 1470
23:02:20.582018 IP 10.0.1.10.44692 > 10.0.2.10.5001: UDP, length 1470
23:02:20.593295 IP 10.0.1.10.44692 > 10.0.2.10.5001: UDP, length 1470
23:02:20.604399 IP 10.0.1.10.44692 > 10.0.2.10.5001: UDP, length 1470
23:02:20.615358 IP 10.0.1.10.44692 > 10.0.2.10.5001: UDP, length 1470
23:02:20.627080 IP 10.0.1.10.44692 > 10.0.2.10.5001: UDP, length 1470
23:02:20.637949 IP 10.0.1.10.44692 > 10.0.2.10.5001: UDP, length 1470
23:02:20.648938 IP 10.0.1.10.44692 > 10.0.2.10.5001: UDP, length 1470
23:02:20.660307 IP 10.0.1.10.44692 > 10.0.2.10.5001: UDP, length 1470
23:02:20.671409 IP 10.0.1.10.44692 > 10.0.2.10.5001: UDP, length 1470
23:02:20.682784 IP 10.0.1.10.44692 > 10.0.2.10.5001: UDP, length 1470
23:02:20.693785 IP 10.0.1.10.44692 > 10.0.2.10.5001: UDP, length 1470
23:02:20.705029 IP 10.0.1.10.44692 > 10.0.2.10.5001: UDP, length 1470
23:02:20.716243 IP 10.0.1.10.44692 > 10.0.2.10.5001: UDP, length 1470
23:02:20.727379 IP 10.0.1.10.44692 > 10.0.2.10.5001: UDP, length 1470
23:02:20.738932 IP 10.0.1.10.44692 > 10.0.2.10.5001: UDP, length 1470
23:02:20.750197 IP 10.0.1.10.44692 > 10.0.2.10.5001: UDP, length 1470
23:02:20.761302 IP 10.0.1.10.44692 > 10.0.2.10.5001: UDP, length 1470
23:02:20.772337 IP 10.0.1.10.44692 > 10.0.2.10.5001: UDP, length 1470
23:02:20.783554 IP 10.0.1.10.44692 > 10.0.2.10.5001: UDP, length 1470
23:02:20.794882 IP 10.0.1.10.44692 > 10.0.2.10.5001: UDP, length 1470
23:02:20.806496 IP 10.0.1.10.44692 > 10.0.2.10.5001: UDP, length 1470
23:02:20.817442 IP 10.0.1.10.44692 > 10.0.2.10.5001: UDP, length 1470
23:02:20.828446 IP 10.0.1.10.44692 > 10.0.2.10.5001: UDP, length 1470
23:02:20.839615 IP 10.0.1.10.44692 > 10.0.2.10.5001: UDP, length 1470
23:02:20.852059 IP 10.0.1.10.44692 > 10.0.2.10.5001: UDP, length 1470
23:02:20.862939 IP 10.0.1.10.44692 > 10.0.2.10.5001: UDP, length 1470
23:02:20.873249 IP 10.0.1.10.44692 > 10.0.2.10.5001: UDP, length 1470
23:02:20.884825 IP 10.0.1.10.44692 > 10.0.2.10.5001: UDP, length 1470
23:02:20.895783 IP 10.0.1.10.44692 > 10.0.2.10.5001: UDP, length 1470
23:02:20.907050 IP 10.0.1.10.44692 > 10.0.2.10.5001: UDP, length 1470
23:02:20.918297 IP 10.0.1.10.44692 > 10.0.2.10.5001: UDP, length 1470
23:02:20.929334 IP 10.0.1.10.44692 > 10.0.2.10.5001: UDP, length 1470
23:02:20.940664 IP 10.0.1.10.44692 > 10.0.2.10.5001: UDP, length 1470
23:02:20.951660 IP 10.0.1.10.44692 > 10.0.2.10.5001: UDP, length 1470
23:02:20.962876 IP 10.0.1.10.44692 > 10.0.2.10.5001: UDP, length 1470
23:02:20.974378 IP 10.0.1.10.44692 > 10.0.2.10.5001: UDP, length 1470
23:02:20.985451 IP 10.0.1.10.44692 > 10.0.2.10.5001: UDP, length 1470
23:02:20.996867 IP 10.0.1.10.44692 > 10.0.2.10.5001: UDP, length 1470
23:02:21.007944 IP 10.0.1.10.44692 > 10.0.2.10.5001: UDP, length 1470
23:02:21.019626 IP 10.0.1.10.44692 > 10.0.2.10.5001: UDP, length 1470
23:02:21.030459 IP 10.0.1.10.44692 > 10.0.2.10.5001: UDP, length 1470
23:02:21.041399 IP 10.0.1.10.44692 > 10.0.2.10.5001: UDP, length 1470
23:02:21.052638 IP 10.0.1.10.44692 > 10.0.2.10.5001: UDP, length 1470
23:02:21.063941 IP 10.0.1.10.44692 > 10.0.2.10.5001: UDP, length 1470
23:02:21.075094 IP 10.0.1.10.44692 > 10.0.2.10.5001: UDP, length 1470
23:02:21.086503 IP 10.0.1.10.44692 > 10.0.2.10.5001: UDP, length 1470
23:02:21.097868 IP 10.0.1.10.44692 > 10.0.2.10.5001: UDP, length 1470
23:02:21.109024 IP 10.0.1.10.44692 > 10.0.2.10.5001: UDP, length 1470
23:02:21.120115 IP 10.0.1.10.44692 > 10.0.2.10.5001: UDP, length 1470
23:02:21.131193 IP 10.0.1.10.44692 > 10.0.2.10.5001: UDP, length 1470
23:02:21.142686 IP 10.0.1.10.44692 > 10.0.2.10.5001: UDP, length 1470
23:02:21.153967 IP 10.0.1.10.44692 > 10.0.2.10.5001: UDP, length 1470
23:02:21.165000 IP 10.0.1.10.44692 > 10.0.2.10.5001: UDP, length 1470
23:02:21.176162 IP 10.0.1.10.44692 > 10.0.2.10.5001: UDP, length 1470
23:02:21.187266 IP 10.0.1.10.44692 > 10.0.2.10.5001: UDP, length 1470
23:02:21.198967 IP 10.0.1.10.44692 > 10.0.2.10.5001: UDP, length 1470
23:02:21.210056 IP 10.0.1.10.44692 > 10.0.2.10.5001: UDP, length 1470
23:02:21.220988 IP 10.0.1.10.44692 > 10.0.2.10.5001: UDP, length 1470
23:02:21.232298 IP 10.0.1.10.44692 > 10.0.2.10.5001: UDP, length 1470
23:02:21.243323 IP 10.0.1.10.44692 > 10.0.2.10.5001: UDP, length 1470
23:02:21.255016 IP 10.0.1.10.44692 > 10.0.2.10.5001: UDP, length 1470
23:02:21.265826 IP 10.0.1.10.44692 > 10.0.2.10.5001: UDP, length 1470
23:02:21.277133 IP 10.0.1.10.44692 > 10.0.2.10.5001: UDP, length 1470
23:02:21.288305 IP 10.0.1.10.44692 > 10.0.2.10.5001: UDP, length 1470
23:02:21.299918 IP 10.0.1.10.44692 > 10.0.2.10.5001: UDP, length 1470
23:02:21.310846 IP 10.0.1.10.44692 > 10.0.2.10.5001: UDP, length 1470
23:02:21.322037 IP 10.0.1.10.44692 > 10.0.2.10.5001: UDP, length 1470
23:02:21.333350 IP 10.0.1.10.44692 > 10.0.2.10.5001: UDP, length 1470
23:02:21.344560 IP 10.0.1.10.44692 > 10.0.2.10.5001: UDP, length 1470
23:02:21.355426 IP 10.0.1.10.44692 > 10.0.2.10.5001: UDP, length 1470
23:02:21.366966 IP 10.0.1.10.44692 > 10.0.2.10.5001: UDP, length 1470
23:02:21.377950 IP 10.0.1.10.44692 > 10.0.2.10.5001: UDP, length 1470
23:02:21.389302 IP 10.0.1.10.44692 > 10.0.2.10.5001: UDP, length 1470
23:02:21.400563 IP 10.0.1.10.44692 > 10.0.2.10.5001: UDP, length 1470
23:02:21.411683 IP 10.0.1.10.44692 > 10.0.2.10.5001: UDP, length 1470
23:02:21.422753 IP 10.0.1.10.44692 > 10.0.2.10.5001: UDP, length 1470
23:02:21.434337 IP 10.0.1.10.44692 > 10.0.2.10.5001: UDP, length 1470
23:02:21.445368 IP 10.0.1.10.44692 > 10.0.2.10.5001: UDP, length 1470
23:02:21.456474 IP 10.0.1.10.44692 > 10.0.2.10.5001: UDP, length 1470
23:02:21.467979 IP 10.0.1.10.44692 > 10.0.2.10.5001: UDP, length 1470
23:02:21.478993 IP 10.0.1.10.44692 > 10.0.2.10.5001: UDP, length 1470
23:02:21.490396 IP 10.0.1.10.44692 > 10.0.2.10.5001: UDP, length 1470
23:02:21.501823 IP 10.0.1.10.44692 > 10.0.2.10.5001: UDP, length 1470
23:02:21.512770 IP 10.0.1.10.44692 > 10.0.2.10.5001: UDP, length 1470
23:02:21.523925 IP 10.0.1.10.44692 > 10.0.2.10.5001: UDP, length 1470
23:02:21.535357 IP 10.0.1.10.44692 > 10.0.2.10.5001: UDP, length 1470
23:02:21.546219 IP 10.0.1.10.44692 > 10.0.2.10.5001: UDP, length 1470
23:02:21.557703 IP 10.0.1.10.44692 > 10.0.2.10.5001: UDP, length 1470
23:02:21.568852 IP 10.0.1.10.44692 > 10.0.2.10.5001: UDP, length 1470
23:02:21.579920 IP 10.0.1.10.44692 > 10.0.2.10.5001: UDP, length 1470
23:02:21.591185 IP 10.0.1.10.44692 > 10.0.2.10.5001: UDP, length 1470
23:02:21.602561 IP 10.0.1.10.44692 > 10.0.2.10.5001: UDP, length 1470
23:02:21.613864 IP 10.0.1.10.44692 > 10.0.2.10.5001: UDP, length 1470
23:02:21.624851 IP 10.0.1.10.44692 > 10.0.2.10.5001: UDP, length 1470
23:02:21.636202 IP 10.0.1.10.44692 > 10.0.2.10.5001: UDP, length 1470
23:02:21.647215 IP 10.0.1.10.44692 > 10.0.2.10.5001: UDP, length 1470
23:02:21.658587 IP 10.0.1.10.44692 > 10.0.2.10.5001: UDP, length 1470
23:02:21.670061 IP 10.0.1.10.44692 > 10.0.2.10.5001: UDP, length 1470
23:02:21.680741 IP 10.0.1.10.44692 > 10.0.2.10.5001: UDP, length 1470
23:02:21.691903 IP 10.0.1.10.44692 > 10.0.2.10.5001: UDP, length 1470
23:02:21.703203 IP 10.0.1.10.44692 > 10.0.2.10.5001: UDP, length 1470
23:02:21.714995 IP 10.0.1.10.44692 > 10.0.2.10.5001: UDP, length 1470
23:02:21.725613 IP 10.0.1.10.44692 > 10.0.2.10.5001: UDP, length 1470
23:02:21.736772 IP 10.0.1.10.44692 > 10.0.2.10.5001: UDP, length 1470
23:02:21.748021 IP 10.0.1.10.44692 > 10.0.2.10.5001: UDP, length 1470
23:02:21.759207 IP 10.0.1.10.44692 > 10.0.2.10.5001: UDP, length 1470
23:02:21.770556 IP 10.0.1.10.44692 > 10.0.2.10.5001: UDP, length 1470
23:02:21.781756 IP 10.0.1.10.44692 > 10.0.2.10.5001: UDP, length 1470
23:02:21.792839 IP 10.0.1.10.44692 > 10.0.2.10.5001: UDP, length 1470
23:02:21.804088 IP 10.0.1.10.44692 > 10.0.2.10.5001: UDP, length 1470
23:02:21.815693 IP 10.0.1.10.44692 > 10.0.2.10.5001: UDP, length 1470
23:02:21.826670 IP 10.0.1.10.44692 > 10.0.2.10.5001: UDP, length 1470
23:02:21.837838 IP 10.0.1.10.44692 > 10.0.2.10.5001: UDP, length 1470
23:02:21.849341 IP 10.0.1.10.44692 > 10.0.2.10.5001: UDP, length 1470
23:02:21.860839 IP 10.0.1.10.44692 > 10.0.2.10.5001: UDP, length 1470
23:02:21.871379 IP 10.0.1.10.44692 > 10.0.2.10.5001: UDP, length 1470
23:02:21.882719 IP 10.0.1.10.44692 > 10.0.2.10.5001: UDP, length 1470
23:02:21.893804 IP 10.0.1.10.44692 > 10.0.2.10.5001: UDP, length 1470
23:02:21.905128 IP 10.0.1.10.44692 > 10.0.2.10.5001: UDP, length 1470
23:02:21.916340 IP 10.0.1.10.44692 > 10.0.2.10.5001: UDP, length 1470
23:02:21.927605 IP 10.0.1.10.44692 > 10.0.2.10.5001: UDP, length 1470
23:02:21.938757 IP 10.0.1.10.44692 > 10.0.2.10.5001: UDP, length 1470
23:02:21.949923 IP 10.0.1.10.44692 > 10.0.2.10.5001: UDP, length 1470
23:02:21.961378 IP 10.0.1.10.44692 > 10.0.2.10.5001: UDP, length 1470
23:02:21.972477 IP 10.0.1.10.44692 > 10.0.2.10.5001: UDP, length 1470
23:02:21.983547 IP 10.0.1.10.44692 > 10.0.2.10.5001: UDP, length 1470
23:02:21.995197 IP 10.0.1.10.44692 > 10.0.2.10.5001: UDP, length 1470
23:02:22.006041 IP 10.0.1.10.44692 > 10.0.2.10.5001: UDP, length 1470
23:02:22.017657 IP 10.0.1.10.44692 > 10.0.2.10.5001: UDP, length 1470
23:02:22.028557 IP 10.0.1.10.44692 > 10.0.2.10.5001: UDP, length 1470
23:02:22.039613 IP 10.0.1.10.44692 > 10.0.2.10.5001: UDP, length 1470
23:02:22.051168 IP 10.0.1.10.44692 > 10.0.2.10.5001: UDP, length 1470
23:02:22.062305 IP 10.0.1.10.44692 > 10.0.2.10.5001: UDP, length 1470
23:02:22.073280 IP 10.0.1.10.44692 > 10.0.2.10.5001: UDP, length 1470
23:02:22.084590 IP 10.0.1.10.44692 > 10.0.2.10.5001: UDP, length 1470
23:02:22.095989 IP 10.0.1.10.44692 > 10.0.2.10.5001: UDP, length 1470
23:02:22.107177 IP 10.0.1.10.44692 > 10.0.2.10.5001: UDP, length 1470
23:02:22.118426 IP 10.0.1.10.44692 > 10.0.2.10.5001: UDP, length 1470
23:02:22.129553 IP 10.0.1.10.44692 > 10.0.2.10.5001: UDP, length 1470
23:02:22.141337 IP 10.0.1.10.44692 > 10.0.2.10.5001: UDP, length 1470
23:02:22.152351 IP 10.0.1.10.44692 > 10.0.2.10.5001: UDP, length 1470
23:02:22.162940 IP 10.0.1.10.44692 > 10.0.2.10.5001: UDP, length 1470
23:02:22.174267 IP 10.0.1.10.44692 > 10.0.2.10.5001: UDP, length 1470
23:02:22.185383 IP 10.0.1.10.44692 > 10.0.2.10.5001: UDP, length 1470
23:02:22.196685 IP 10.0.1.10.44692 > 10.0.2.10.5001: UDP, length 1470
23:02:22.207934 IP 10.0.1.10.44692 > 10.0.2.10.5001: UDP, length 1470
23:02:22.219235 IP 10.0.1.10.44692 > 10.0.2.10.5001: UDP, length 1470
23:02:22.230781 IP 10.0.1.10.44692 > 10.0.2.10.5001: UDP, length 1470
23:02:22.241556 IP 10.0.1.10.44692 > 10.0.2.10.5001: UDP, length 1470
23:02:22.252889 IP 10.0.1.10.44692 > 10.0.2.10.5001: UDP, length 1470
23:02:22.264055 IP 10.0.1.10.44692 > 10.0.2.10.5001: UDP, length 1470
23:02:22.275468 IP 10.0.1.10.44692 > 10.0.2.10.5001: UDP, length 1470
23:02:22.286798 IP 10.0.1.10.44692 > 10.0.2.10.5001: UDP, length 1470
23:02:22.297936 IP 10.0.1.10.44692 > 10.0.2.10.5001: UDP, length 1470
23:02:22.308803 IP 10.0.1.10.44692 > 10.0.2.10.5001: UDP, length 1470
23:02:22.319978 IP 10.0.1.10.44692 > 10.0.2.10.5001: UDP, length 1470
23:02:22.331155 IP 10.0.1.10.44692 > 10.0.2.10.5001: UDP, length 1470
23:02:22.342415 IP 10.0.1.10.44692 > 10.0.2.10.5001: UDP, length 1470
23:02:22.353741 IP 10.0.1.10.44692 > 10.0.2.10.5001: UDP, length 1470
23:02:22.364887 IP 10.0.1.10.44692 > 10.0.2.10.5001: UDP, length 1470
23:02:22.376105 IP 10.0.1.10.44692 > 10.0.2.10.5001: UDP, length 1470
23:02:22.387333 IP 10.0.1.10.44692 > 10.0.2.10.5001: UDP, length 1470
23:02:22.398788 IP 10.0.1.10.44692 > 10.0.2.10.5001: UDP, length 1470
23:02:22.409784 IP 10.0.1.10.44692 > 10.0.2.10.5001: UDP, length 1470
23:02:22.421155 IP 10.0.1.10.44692 > 10.0.2.10.5001: UDP, length 1470
23:02:22.432293 IP 10.0.1.10.44692 > 10.0.2.10.5001: UDP, length 1470
23:02:22.443409 IP 10.0.1.10.44692 > 10.0.2.10.5001: UDP, length 1470
23:02:22.455115 IP 10.0.1.10.44692 > 10.0.2.10.5001: UDP, length 1470
23:02:22.467046 IP 10.0.1.10.44692 > 10.0.2.10.5001: UDP, length 1470
23:02:22.477203 IP 10.0.1.10.44692 > 10.0.2.10.5001: UDP, length 1470
23:02:22.488512 IP 10.0.1.10.44692 > 10.0.2.10.5001: UDP, length 1470
23:02:22.499878 IP 10.0.1.10.44692 > 10.0.2.10.5001: UDP, length 1470
23:02:22.510815 IP 10.0.1.10.44692 > 10.0.2.10.5001: UDP, length 1470
23:02:22.521928 IP 10.0.1.10.44692 > 10.0.2.10.5001: UDP, length 1470
23:02:22.533121 IP 10.0.1.10.44692 > 10.0.2.10.5001: UDP, length 1470
23:02:22.544432 IP 10.0.1.10.44692 > 10.0.2.10.5001: UDP, length 1470
23:02:22.555558 IP 10.0.1.10.44692 > 10.0.2.10.5001: UDP, length 1470
23:02:22.567286 IP 10.0.1.10.44692 > 10.0.2.10.5001: UDP, length 1470
23:02:22.578352 IP 10.0.1.10.44692 > 10.0.2.10.5001: UDP, length 1470
23:02:22.589315 IP 10.0.1.10.44692 > 10.0.2.10.5001: UDP, length 1470
23:02:22.601319 IP 10.0.1.10.44692 > 10.0.2.10.5001: UDP, length 1470
23:02:22.611650 IP 10.0.1.10.44692 > 10.0.2.10.5001: UDP, length 1470
23:02:22.622832 IP 10.0.1.10.44692 > 10.0.2.10.5001: UDP, length 1470
23:02:22.634298 IP 10.0.1.10.44692 > 10.0.2.10.5001: UDP, length 1470
23:02:22.645394 IP 10.0.1.10.44692 > 10.0.2.10.5001: UDP, length 1470
23:02:22.656737 IP 10.0.1.10.44692 > 10.0.2.10.5001: UDP, length 1470
23:02:22.667845 IP 10.0.1.10.44692 > 10.0.2.10.5001: UDP, length 1470
23:02:22.679135 IP 10.0.1.10.44692 > 10.0.2.10.5001: UDP, length 1470
23:02:22.690263 IP 10.0.1.10.44692 > 10.0.2.10.5001: UDP, length 1470
23:02:22.701256 IP 10.0.1.10.44692 > 10.0.2.10.5001: UDP, length 1470
23:02:22.712618 IP 10.0.1.10.44692 > 10.0.2.10.5001: UDP, length 1470
23:02:22.723780 IP 10.0.1.10.44692 > 10.0.2.10.5001: UDP, length 1470
23:02:22.735024 IP 10.0.1.10.44692 > 10.0.2.10.5001: UDP, length 1470
23:02:22.746139 IP 10.0.1.10.44692 > 10.0.2.10.5001: UDP, length 1470
23:02:22.757462 IP 10.0.1.10.44692 > 10.0.2.10.5001: UDP, length 1470
23:02:22.770086 IP 10.0.1.10.44692 > 10.0.2.10.5001: UDP, length 1470
23:02:22.779841 IP 10.0.1.10.44692 > 10.0.2.10.5001: UDP, length 1470
23:02:22.790879 IP 10.0.1.10.44692 > 10.0.2.10.5001: UDP, length 1470
23:02:22.802255 IP 10.0.1.10.44692 > 10.0.2.10.5001: UDP, length 1470
23:02:22.813769 IP 10.0.1.10.44692 > 10.0.2.10.5001: UDP, length 1470
23:02:22.824917 IP 10.0.1.10.44692 > 10.0.2.10.5001: UDP, length 1470
23:02:22.836044 IP 10.0.1.10.44692 > 10.0.2.10.5001: UDP, length 1470
23:02:22.847330 IP 10.0.1.10.44692 > 10.0.2.10.5001: UDP, length 1470
23:02:22.858958 IP 10.0.1.10.44692 > 10.0.2.10.5001: UDP, length 1470
23:02:22.869847 IP 10.0.1.10.44692 > 10.0.2.10.5001: UDP, length 1470
23:02:22.881384 IP 10.0.1.10.44692 > 10.0.2.10.5001: UDP, length 1470
23:02:22.892274 IP 10.0.1.10.44692 > 10.0.2.10.5001: UDP, length 1470
23:02:22.903296 IP 10.0.1.10.44692 > 10.0.2.10.5001: UDP, length 1470
23:02:22.914866 IP 10.0.1.10.44692 > 10.0.2.10.5001: UDP, length 1470
23:02:22.926177 IP 10.0.1.10.44692 > 10.0.2.10.5001: UDP, length 1470
23:02:22.937382 IP 10.0.1.10.44692 > 10.0.2.10.5001: UDP, length 1470
23:02:22.948412 IP 10.0.1.10.44692 > 10.0.2.10.5001: UDP, length 1470
23:02:22.960048 IP 10.0.1.10.44692 > 10.0.2.10.5001: UDP, length 1470
23:02:22.971079 IP 10.0.1.10.44692 > 10.0.2.10.5001: UDP, length 1470
23:02:22.982467 IP 10.0.1.10.44692 > 10.0.2.10.5001: UDP, length 1470
23:02:22.993137 IP 10.0.1.10.44692 > 10.0.2.10.5001: UDP, length 1470
23:02:23.004160 IP 10.0.1.10.44692 > 10.0.2.10.5001: UDP, length 1470
23:02:23.015331 IP 10.0.1.10.44692 > 10.0.2.10.5001: UDP, length 1470
23:02:23.027287 IP 10.0.1.10.44692 > 10.0.2.10.5001: UDP, length 1470
23:02:23.037819 IP 10.0.1.10.44692 > 10.0.2.10.5001: UDP, length 1470
23:02:23.049006 IP 10.0.1.10.44692 > 10.0.2.10.5001: UDP, length 1470
23:02:23.060171 IP 10.0.1.10.44692 > 10.0.2.10.5001: UDP, length 1470
23:02:23.071720 IP 10.0.1.10.44692 > 10.0.2.10.5001: UDP, length 1470
23:02:23.082800 IP 10.0.1.10.44692 > 10.0.2.10.5001: UDP, length 1470
23:02:23.094305 IP 10.0.1.10.44692 > 10.0.2.10.5001: UDP, length 1470
23:02:23.105243 IP 10.0.1.10.44692 > 10.0.2.10.5001: UDP, length 1470
23:02:23.116358 IP 10.0.1.10.44692 > 10.0.2.10.5001: UDP, length 1470
23:02:23.128188 IP 10.0.1.10.44692 > 10.0.2.10.5001: UDP, length 1470
23:02:23.139204 IP 10.0.1.10.44692 > 10.0.2.10.5001: UDP, length 1470
23:02:23.150038 IP 10.0.1.10.44692 > 10.0.2.10.5001: UDP, length 1470
23:02:23.161493 IP 10.0.1.10.44692 > 10.0.2.10.5001: UDP, length 1470
23:02:23.172702 IP 10.0.1.10.44692 > 10.0.2.10.5001: UDP, length 1470
23:02:23.184673 IP 10.0.1.10.44692 > 10.0.2.10.5001: UDP, length 1470
23:02:23.195015 IP 10.0.1.10.44692 > 10.0.2.10.5001: UDP, length 1470
23:02:23.206037 IP 10.0.1.10.44692 > 10.0.2.10.5001: UDP, length 1470
23:02:23.217269 IP 10.0.1.10.44692 > 10.0.2.10.5001: UDP, length 1470
23:02:23.228508 IP 10.0.1.10.44692 > 10.0.2.10.5001: UDP, length 1470
23:02:23.239762 IP 10.0.1.10.44692 > 10.0.2.10.5001: UDP, length 1470
23:02:23.250849 IP 10.0.1.10.44692 > 10.0.2.10.5001: UDP, length 1470
23:02:23.262058 IP 10.0.1.10.44692 > 10.0.2.10.5001: UDP, length 1470
23:02:23.273593 IP 10.0.1.10.44692 > 10.0.2.10.5001: UDP, length 1470
23:02:23.284661 IP 10.0.1.10.44692 > 10.0.2.10.5001: UDP, length 1470
23:02:23.296381 IP 10.0.1.10.44692 > 10.0.2.10.5001: UDP, length 1470
23:02:23.307021 IP 10.0.1.10.44692 > 10.0.2.10.5001: UDP, length 1470
23:02:23.318553 IP 10.0.1.10.44692 > 10.0.2.10.5001: UDP, length 1470
23:02:23.329668 IP 10.0.1.10.44692 > 10.0.2.10.5001: UDP, length 1470
23:02:23.340644 IP 10.0.1.10.44692 > 10.0.2.10.5001: UDP, length 1470
23:02:23.351947 IP 10.0.1.10.44692 > 10.0.2.10.5001: UDP, length 1470
23:02:23.363106 IP 10.0.1.10.44692 > 10.0.2.10.5001: UDP, length 1470
23:02:23.374252 IP 10.0.1.10.44692 > 10.0.2.10.5001: UDP, length 1470
23:02:23.385431 IP 10.0.1.10.44692 > 10.0.2.10.5001: UDP, length 1470
23:02:23.396915 IP 10.0.1.10.44692 > 10.0.2.10.5001: UDP, length 1470
23:02:23.408028 IP 10.0.1.10.44692 > 10.0.2.10.5001: UDP, length 1470
23:02:23.419091 IP 10.0.1.10.44692 > 10.0.2.10.5001: UDP, length 1470
23:02:23.430477 IP 10.0.1.10.44692 > 10.0.2.10.5001: UDP, length 1470
23:02:23.441583 IP 10.0.1.10.44692 > 10.0.2.10.5001: UDP, length 1470
23:02:23.453012 IP 10.0.1.10.44692 > 10.0.2.10.5001: UDP, length 1470
23:02:23.464259 IP 10.0.1.10.44692 > 10.0.2.10.5001: UDP, length 1470
23:02:23.475343 IP 10.0.1.10.44692 > 10.0.2.10.5001: UDP, length 1470
23:02:23.486380 IP 10.0.1.10.44692 > 10.0.2.10.5001: UDP, length 1470
23:02:23.497847 IP 10.0.1.10.44692 > 10.0.2.10.5001: UDP, length 1470
23:02:23.508979 IP 10.0.1.10.44692 > 10.0.2.10.5001: UDP, length 1470
23:02:23.520039 IP 10.0.1.10.44692 > 10.0.2.10.5001: UDP, length 1470
23:02:23.531281 IP 10.0.1.10.44692 > 10.0.2.10.5001: UDP, length 1470
23:02:23.542711 IP 10.0.1.10.44692 > 10.0.2.10.5001: UDP, length 1470
23:02:23.553674 IP 10.0.1.10.44692 > 10.0.2.10.5001: UDP, length 1470
23:02:23.565127 IP 10.0.1.10.44692 > 10.0.2.10.5001: UDP, length 1470
23:02:23.576363 IP 10.0.1.10.44692 > 10.0.2.10.5001: UDP, length 1470
23:02:23.587439 IP 10.0.1.10.44692 > 10.0.2.10.5001: UDP, length 1470
23:02:23.598979 IP 10.0.1.10.44692 > 10.0.2.10.5001: UDP, length 1470
23:02:23.609759 IP 10.0.1.10.44692 > 10.0.2.10.5001: UDP, length 1470
23:02:23.621035 IP 10.0.1.10.44692 > 10.0.2.10.5001: UDP, length 1470
23:02:23.632260 IP 10.0.1.10.44692 > 10.0.2.10.5001: UDP, length 1470
23:02:23.643444 IP 10.0.1.10.44692 > 10.0.2.10.5001: UDP, length 1470
23:02:23.655132 IP 10.0.1.10.44692 > 10.0.2.10.5001: UDP, length 1470
23:02:23.666081 IP 10.0.1.10.44692 > 10.0.2.10.5001: UDP, length 1470
23:02:23.677069 IP 10.0.1.10.44692 > 10.0.2.10.5001: UDP, length 1470
23:02:23.688466 IP 10.0.1.10.44692 > 10.0.2.10.5001: UDP, length 1470
23:02:23.699650 IP 10.0.1.10.44692 > 10.0.2.10.5001: UDP, length 1470
23:02:23.710767 IP 10.0.1.10.44692 > 10.0.2.10.5001: UDP, length 1470
23:02:23.722263 IP 10.0.1.10.44692 > 10.0.2.10.5001: UDP, length 1470
23:02:23.733162 IP 10.0.1.10.44692 > 10.0.2.10.5001: UDP, length 1470
23:02:23.744430 IP 10.0.1.10.44692 > 10.0.2.10.5001: UDP, length 1470
23:02:23.756528 IP 10.0.1.10.44692 > 10.0.2.10.5001: UDP, length 1470
23:02:23.766729 IP 10.0.1.10.44692 > 10.0.2.10.5001: UDP, length 1470
23:02:23.778940 IP 10.0.1.10.44692 > 10.0.2.10.5001: UDP, length 1470
23:02:23.790051 IP 10.0.1.10.44692 > 10.0.2.10.5001: UDP, length 1470
23:02:23.800430 IP 10.0.1.10.44692 > 10.0.2.10.5001: UDP, length 1470
23:02:23.811799 IP 10.0.1.10.44692 > 10.0.2.10.5001: UDP, length 1470
23:02:23.823897 IP 10.0.1.10.44692 > 10.0.2.10.5001: UDP, length 1470
23:02:23.834141 IP 10.0.1.10.44692 > 10.0.2.10.5001: UDP, length 1470
23:02:23.846297 IP 10.0.1.10.44692 > 10.0.2.10.5001: UDP, length 1470
23:02:23.856914 IP 10.0.1.10.44692 > 10.0.2.10.5001: UDP, length 1470
23:02:23.867846 IP 10.0.1.10.44692 > 10.0.2.10.5001: UDP, length 1470
23:02:23.878906 IP 10.0.1.10.44692 > 10.0.2.10.5001: UDP, length 1470
23:02:23.890202 IP 10.0.1.10.44692 > 10.0.2.10.5001: UDP, length 1470
23:02:23.901398 IP 10.0.1.10.44692 > 10.0.2.10.5001: UDP, length 1470
23:02:23.912489 IP 10.0.1.10.44692 > 10.0.2.10.5001: UDP, length 1470
23:02:23.924037 IP 10.0.1.10.44692 > 10.0.2.10.5001: UDP, length 1470
23:02:23.935370 IP 10.0.1.10.44692 > 10.0.2.10.5001: UDP, length 1470
23:02:23.946239 IP 10.0.1.10.44692 > 10.0.2.10.5001: UDP, length 1470
23:02:23.957820 IP 10.0.1.10.44692 > 10.0.2.10.5001: UDP, length 1470
23:02:23.968764 IP 10.0.1.10.44692 > 10.0.2.10.5001: UDP, length 1470
23:02:23.979888 IP 10.0.1.10.44692 > 10.0.2.10.5001: UDP, length 1470
23:02:23.991965 IP 10.0.1.10.44692 > 10.0.2.10.5001: UDP, length 1470
23:02:24.002926 IP 10.0.1.10.44692 > 10.0.2.10.5001: UDP, length 1470
23:02:24.013646 IP 10.0.1.10.44692 > 10.0.2.10.5001: UDP, length 1470
23:02:24.024990 IP 10.0.1.10.44692 > 10.0.2.10.5001: UDP, length 1470
23:02:24.036255 IP 10.0.1.10.44692 > 10.0.2.10.5001: UDP, length 1470
23:02:24.047614 IP 10.0.1.10.44692 > 10.0.2.10.5001: UDP, length 1470
23:02:24.058541 IP 10.0.1.10.44692 > 10.0.2.10.5001: UDP, length 1470
