23:03:20.328896 IP 10.0.1.10.52969 > 10.0.2.10.5001: UDP, length 1470
23:03:20.342821 IP 10.0.1.10.52969 > 10.0.2.10.5001: UDP, length 1470
23:03:20.353718 IP 10.0.1.10.52969 > 10.0.2.10.5001: UDP, length 1470
23:03:20.364826 IP 10.0.1.10.52969 > 10.0.2.10.5001: UDP, length 1470
23:03:20.376106 IP 10.0.1.10.52969 > 10.0.2.10.5001: UDP, length 1470
23:03:20.387019 IP 10.0.1.10.52969 > 10.0.2.10.5001: UDP, length 1470
23:03:20.398581 IP 10.0.1.10.52969 > 10.0.2.10.5001: UDP, length 1470
23:03:20.409913 IP 10.0.1.10.52969 > 10.0.2.10.5001: UDP, length 1470
23:03:20.421077 IP 10.0.1.10.52969 > 10.0.2.10.5001: UDP, length 1470
23:03:20.432066 IP 10.0.1.10.52969 > 10.0.2.10.5001: UDP, length 1470
23:03:20.443313 IP 10.0.1.10.52969 > 10.0.2.10.5001: UDP, length 1470
23:03:20.454961 IP 10.0.1.10.52969 > 10.0.2.10.5001: UDP, length 1470
23:03:20.466103 IP 10.0.1.10.52969 > 10.0.2.10.5001: UDP, length 1470
23:03:20.477733 IP 10.0.1.10.52969 > 10.0.2.10.5001: UDP, length 1470
23:03:20.487982 IP 10.0.1.10.52969 > 10.0.2.10.5001: UDP, length 1470
23:03:20.499445 IP 10.0.1.10.52969 > 10.0.2.10.5001: UDP, length 1470
23:03:20.510901 IP 10.0.1.10.52969 > 10.0.2.10.5001: UDP, length 1470
23:03:20.521992 IP 10.0.1.10.52969 > 10.0.2.10.5001: UDP, length 1470
23:03:20.533067 IP 10.0.1.10.52969 > 10.0.2.10.5001: UDP, length 1470
23:03:20.544211 IP 10.0.1.10.52969 > 10.0.2.10.5001: UDP, length 1470
23:03:20.555337 IP 10.0.1.10.52969 > 10.0.2.10.5001: UDP, length 1470
23:03:20.566776 IP 10.0.1.10.52969 > 10.0.2.10.5001: UDP, length 1470
23:03:20.578062 IP 10.0.1.10.52969 > 10.0.2.10.5001: UDP, length 1470
23:03:20.589314 IP 10.0.1.10.52969 > 10.0.2.10.5001: UDP, length 1470
23:03:20.600492 IP 10.0.1.10.52969 > 10.0.2.10.5001: UDP, length 1470
23:03:20.611430 IP 10.0.1.10.52969 > 10.0.2.10.5001: UDP, length 1470
23:03:20.623133 IP 10.0.1.10.52969 > 10.0.2.10.5001: UDP, length 1470
23:03:20.634172 IP 10.0.1.10.52969 > 10.0.2.10.5001: UDP, length 1470
23:03:20.645497 IP 10.0.1.10.52969 > 10.0.2.10.5001: UDP, length 1470
23:03:20.657078 IP 10.0.1.10.52969 > 10.0.2.10.5001: UDP, length 1470
23:03:20.668189 IP 10.0.1.10.52969 > 10.0.2.10.5001: UDP, length 1470
23:03:20.679264 IP 10.0.1.10.52969 > 10.0.2.10.5001: UDP, length 1470
23:03:20.690918 IP 10.0.1.10.52969 > 10.0.2.10.5001: UDP, length 1470
23:03:20.702021 IP 10.0.1.10.52969 > 10.0.2.10.5001: UDP, length 1470
23:03:20.713084 IP 10.0.1.10.52969 > 10.0.2.10.5001: UDP, length 1470
23:03:20.723580 IP 10.0.1.10.52969 > 10.0.2.10.5001: UDP, length 1470
23:03:20.734991 IP 10.0.1.10.52969 > 10.0.2.10.5001: UDP, length 1470
23:03:20.746257 IP 10.0.1.10.52969 > 10.0.2.10.5001: UDP, length 1470
23:03:20.757241 IP 10.0.1.10.52969 > 10.0.2.10.5001: UDP, length 1470
23:03:20.768778 IP 10.0.1.10.52969 > 10.0.2.10.5001: UDP, length 1470
23:03:20.779656 IP 10.0.1.10.52969 > 10.0.2.10.5001: UDP, length 1470
23:03:20.791169 IP 10.0.1.10.52969 > 10.0.2.10.5001: UDP, length 1470
23:03:20.802436 IP 10.0.1.10.52969 > 10.0.2.10.5001: UDP, length 1470
23:03:20.813633 IP 10.0.1.10.52969 > 10.0.2.10.5001: UDP, length 1470
23:03:20.824755 IP 10.0.1.10.52969 > 10.0.2.10.5001: UDP, length 1470
23:03:20.835837 IP 10.0.1.10.52969 > 10.0.2.10.5001: UDP, length 1470
23:03:20.847415 IP 10.0.1.10.52969 > 10.0.2.10.5001: UDP, length 1470
23:03:20.858709 IP 10.0.1.10.52969 > 10.0.2.10.5001: UDP, length 1470
23:03:20.870458 IP 10.0.1.10.52969 > 10.0.2.10.5001: UDP, length 1470
23:03:20.880702 IP 10.0.1.10.52969 > 10.0.2.10.5001: UDP, length 1470
23:03:20.892602 IP 10.0.1.10.52969 > 10.0.2.10.5001: UDP, length 1470
23:03:20.903351 IP 10.0.1.10.52969 > 10.0.2.10.5001: UDP, length 1470
23:03:20.915144 IP 10.0.1.10.52969 > 10.0.2.10.5001: UDP, length 1470
23:03:20.926181 IP 10.0.1.10.52969 > 10.0.2.10.5001: UDP, length 1470
23:03:20.936970 IP 10.0.1.10.52969 > 10.0.2.10.5001: UDP, length 1470
23:03:20.949024 IP 10.0.1.10.52969 > 10.0.2.10.5001: UDP, length 1470
23:03:20.959384 IP 10.0.1.10.52969 > 10.0.2.10.5001: UDP, length 1470
23:03:20.970961 IP 10.0.1.10.52969 > 10.0.2.10.5001: UDP, length 1470
23:03:20.981491 IP 10.0.1.10.52969 > 10.0.2.10.5001: UDP, length 1470
23:03:20.992636 IP 10.0.1.10.52969 > 10.0.2.10.5001: UDP, length 1470
23:03:21.003745 IP 10.0.1.10.52969 > 10.0.2.10.5001: UDP, length 1470
23:03:21.015077 IP 10.0.1.10.52969 > 10.0.2.10.5001: UDP, length 1470
23:03:21.027028 IP 10.0.1.10.52969 > 10.0.2.10.5001: UDP, length 1470
23:03:21.037487 IP 10.0.1.10.52969 > 10.0.2.10.5001: UDP, length 1470
23:03:21.048888 IP 10.0.1.10.52969 > 10.0.2.10.5001: UDP, length 1470
23:03:21.060121 IP 10.0.1.10.52969 > 10.0.2.10.5001: UDP, length 1470
23:03:21.071174 IP 10.0.1.10.52969 > 10.0.2.10.5001: UDP, length 1470
23:03:21.083111 IP 10.0.1.10.52969 > 10.0.2.10.5001: UDP, length 1470
23:03:21.094722 IP 10.0.1.10.52969 > 10.0.2.10.5001: UDP, length 1470
23:03:21.105224 IP 10.0.1.10.52969 > 10.0.2.10.5001: UDP, length 1470
23:03:21.117462 IP 10.0.1.10.52969 > 10.0.2.10.5001: UDP, length 1470
23:03:21.127703 IP 10.0.1.10.52969 > 10.0.2.10.5001: UDP, length 1470
23:03:21.138932 IP 10.0.1.10.52969 > 10.0.2.10.5001: UDP, length 1470
23:03:21.150380 IP 10.0.1.10.52969 > 10.0.2.10.5001: UDP, length 1470
23:03:21.161131 IP 10.0.1.10.52969 > 10.0.2.10.5001: UDP, length 1470
23:03:21.172217 IP 10.0.1.10.52969 > 10.0.2.10.5001: UDP, length 1470
23:03:21.183315 IP 10.0.1.10.52969 > 10.0.2.10.5001: UDP, length 1470
23:03:21.195046 IP 10.0.1.10.52969 > 10.0.2.10.5001: UDP, length 1470
23:03:21.205993 IP 10.0.1.10.52969 > 10.0.2.10.5001: UDP, length 1470
23:03:21.217171 IP 10.0.1.10.52969 > 10.0.2.10.5001: UDP, length 1470
23:03:21.228944 IP 10.0.1.10.52969 > 10.0.2.10.5001: UDP, length 1470
23:03:21.239422 IP 10.0.1.10.52969 > 10.0.2.10.5001: UDP, length 1470
23:03:21.251408 IP 10.0.1.10.52969 > 10.0.2.10.5001: UDP, length 1470
23:03:21.262581 IP 10.0.1.10.52969 > 10.0.2.10.5001: UDP, length 1470
23:03:21.273302 IP 10.0.1.10.52969 > 10.0.2.10.5001: UDP, length 1470
23:03:21.284726 IP 10.0.1.10.52969 > 10.0.2.10.5001: UDP, length 1470
23:03:21.295580 IP 10.0.1.10.52969 > 10.0.2.10.5001: UDP, length 1470
23:03:21.306849 IP 10.0.1.10.52969 > 10.0.2.10.5001: UDP, length 1470
23:03:21.318385 IP 10.0.1.10.52969 > 10.0.2.10.5001: UDP, length 1470
23:03:21.329596 IP 10.0.1.10.52969 > 10.0.2.10.5001: UDP, length 1470
23:03:21.340360 IP 10.0.1.10.52969 > 10.0.2.10.5001: UDP, length 1470
23:03:21.351789 IP 10.0.1.10.52969 > 10.0.2.10.5001: UDP, length 1470
23:03:21.363024 IP 10.0.1.10.52969 > 10.0.2.10.5001: UDP, length 1470
23:03:21.374704 IP 10.0.1.10.52969 > 10.0.2.10.5001: UDP, length 1470
23:03:21.385648 IP 10.0.1.10.52969 > 10.0.2.10.5001: UDP, length 1470
23:03:21.396819 IP 10.0.1.10.52969 > 10.0.2.10.5001: UDP, length 1470
23:03:21.408068 IP 10.0.1.10.52969 > 10.0.2.10.5001: UDP, length 1470
23:03:21.419772 IP 10.0.1.10.52969 > 10.0.2.10.5001: UDP, length 1470
23:03:21.430810 IP 10.0.1.10.52969 > 10.0.2.10.5001: UDP, length 1470
23:03:21.441786 IP 10.0.1.10.52969 > 10.0.2.10.5001: UDP, length 1470
23:03:21.452767 IP 10.0.1.10.52969 > 10.0.2.10.5001: UDP, length 1470
23:03:21.463919 IP 10.0.1.10.52969 > 10.0.2.10.5001: UDP, length 1470
23:03:21.475055 IP 10.0.1.10.52969 > 10.0.2.10.5001: UDP, length 1470
23:03:21.486353 IP 10.0.1.10.52969 > 10.0.2.10.5001: UDP, length 1470
23:03:21.497622 IP 10.0.1.10.52969 > 10.0.2.10.5001: UDP, length 1470
23:03:21.508699 IP 10.0.1.10.52969 > 10.0.2.10.5001: UDP, length 1470
23:03:21.519950 IP 10.0.1.10.52969 > 10.0.2.10.5001: UDP, length 1470
23:03:21.531106 IP 10.0.1.10.52969 > 10.0.2.10.5001: UDP, length 1470
23:03:21.542628 IP 10.0.1.10.52969 > 10.0.2.10.5001: UDP, length 1470
23:03:21.553633 IP 10.0.1.10.52969 > 10.0.2.10.5001: UDP, length 1470
23:03:21.564806 IP 10.0.1.10.52969 > 10.0.2.10.5001: UDP, length 1470
23:03:21.575990 IP 10.0.1.10.52969 > 10.0.2.10.5001: UDP, length 1470
23:03:21.587081 IP 10.0.1.10.52969 > 10.0.2.10.5001: UDP, length 1470
23:03:21.598415 IP 10.0.1.10.52969 > 10.0.2.10.5001: UDP, length 1470
23:03:21.610320 IP 10.0.1.10.52969 > 10.0.2.10.5001: UDP, length 1470
23:03:21.620839 IP 10.0.1.10.52969 > 10.0.2.10.5001: UDP, length 1470
23:03:21.632321 IP 10.0.1.10.52969 > 10.0.2.10.5001: UDP, length 1470
23:03:21.643348 IP 10.0.1.10.52969 > 10.0.2.10.5001: UDP, length 1470
23:03:21.654543 IP 10.0.1.10.52969 > 10.0.2.10.5001: UDP, length 1470
23:03:21.665577 IP 10.0.1.10.52969 > 10.0.2.10.5001: UDP, length 1470
23:03:21.676875 IP 10.0.1.10.52969 > 10.0.2.10.5001: UDP, length 1470
23:03:21.688176 IP 10.0.1.10.52969 > 10.0.2.10.5001: UDP, length 1470
23:03:21.699287 IP 10.0.1.10.52969 > 10.0.2.10.5001: UDP, length 1470
23:03:21.711019 IP 10.0.1.10.52969 > 10.0.2.10.5001: UDP, length 1470
23:03:21.721646 IP 10.0.1.10.52969 > 10.0.2.10.5001: UDP, length 1470
23:03:21.733504 IP 10.0.1.10.52969 > 10.0.2.10.5001: UDP, length 1470
23:03:21.744327 IP 10.0.1.10.52969 > 10.0.2.10.5001: UDP, length 1470
23:03:21.755606 IP 10.0.1.10.52969 > 10.0.2.10.5001: UDP, length 1470
23:03:21.766730 IP 10.0.1.10.52969 > 10.0.2.10.5001: UDP, length 1470
23:03:21.777965 IP 10.0.1.10.52969 > 10.0.2.10.5001: UDP, length 1470
23:03:21.789185 IP 10.0.1.10.52969 > 10.0.2.10.5001: UDP, length 1470
23:03:21.800367 IP 10.0.1.10.52969 > 10.0.2.10.5001: UDP, length 1470
23:03:21.811806 IP 10.0.1.10.52969 > 10.0.2.10.5001: UDP, length 1470
23:03:21.822821 IP 10.0.1.10.52969 > 10.0.2.10.5001: UDP, length 1470
23:03:21.834058 IP 10.0.1.10.52969 > 10.0.2.10.5001: UDP, length 1470
23:03:21.845350 IP 10.0.1.10.52969 > 10.0.2.10.5001: UDP, length 1470
23:03:21.856645 IP 10.0.1.10.52969 > 10.0.2.10.5001: UDP, length 1470
23:03:21.867584 IP 10.0.1.10.52969 > 10.0.2.10.5001: UDP, length 1470
23:03:21.879255 IP 10.0.1.10.52969 > 10.0.2.10.5001: UDP, length 1470
23:03:21.890156 IP 10.0.1.10.52969 > 10.0.2.10.5001: UDP, length 1470
23:03:21.901271 IP 10.0.1.10.52969 > 10.0.2.10.5001: UDP, length 1470
23:03:21.913188 IP 10.0.1.10.52969 > 10.0.2.10.5001: UDP, length 1470
23:03:21.923626 IP 10.0.1.10.52969 > 10.0.2.10.5001: UDP, length 1470
23:03:21.935130 IP 10.0.1.10.52969 > 10.0.2.10.5001: UDP, length 1470
23:03:21.946199 IP 10.0.1.10.52969 > 10.0.2.10.5001: UDP, length 1470
23:03:21.957350 IP 10.0.1.10.52969 > 10.0.2.10.5001: UDP, length 1470
23:03:21.969088 IP 10.0.1.10.52969 > 10.0.2.10.5001: UDP, length 1470
23:03:21.979787 IP 10.0.1.10.52969 > 10.0.2.10.5001: UDP, length 1470
23:03:21.991169 IP 10.0.1.10.52969 > 10.0.2.10.5001: UDP, length 1470
23:03:22.002390 IP 10.0.1.10.52969 > 10.0.2.10.5001: UDP, length 1470
23:03:22.013453 IP 10.0.1.10.52969 > 10.0.2.10.5001: UDP, length 1470
23:03:22.024818 IP 10.0.1.10.52969 > 10.0.2.10.5001: UDP, length 1470
23:03:22.036254 IP 10.0.1.10.52969 > 10.0.2.10.5001: UDP, length 1470
23:03:22.046908 IP 10.0.1.10.52969 > 10.0.2.10.5001: UDP, length 1470
23:03:22.057988 IP 10.0.1.10.52969 > 10.0.2.10.5001: UDP, length 1470
23:03:22.069577 IP 10.0.1.10.52969 > 10.0.2.10.5001: UDP, length 1470
23:03:22.080770 IP 10.0.1.10.52969 > 10.0.2.10.5001: UDP, length 1470
23:03:22.091800 IP 10.0.1.10.52969 > 10.0.2.10.5001: UDP, length 1470
23:03:22.103010 IP 10.0.1.10.52969 > 10.0.2.10.5001: UDP, length 1470
23:03:22.114748 IP 10.0.1.10.52969 > 10.0.2.10.5001: UDP, length 1470
23:03:22.125860 IP 10.0.1.10.52969 > 10.0.2.10.5001: UDP, length 1470
23:03:22.138007 IP 10.0.1.10.52969 > 10.0.2.10.5001: UDP, length 1470
23:03:22.148031 IP 10.0.1.10.52969 > 10.0.2.10.5001: UDP, length 1470
23:03:22.159136 IP 10.0.1.10.52969 > 10.0.2.10.5001: UDP, length 1470
23:03:22.170846 IP 10.0.1.10.52969 > 10.0.2.10.5001: UDP, length 1470
23:03:22.181712 IP 10.0.1.10.52969 > 10.0.2.10.5001: UDP, length 1470
23:03:22.193283 IP 10.0.1.10.52969 > 10.0.2.10.5001: UDP, length 1470
23:03:22.204142 IP 10.0.1.10.52969 > 10.0.2.10.5001: UDP, length 1470
23:03:22.215197 IP 10.0.1.10.52969 > 10.0.2.10.5001: UDP, length 1470
23:03:22.226879 IP 10.0.1.10.52969 > 10.0.2.10.5001: UDP, length 1470
23:03:22.237854 IP 10.0.1.10.52969 > 10.0.2.10.5001: UDP, length 1470
23:03:22.249020 IP 10.0.1.10.52969 > 10.0.2.10.5001: UDP, length 1470
23:03:22.260889 IP 10.0.1.10.52969 > 10.0.2.10.5001: UDP, length 1470
23:03:22.273308 IP 10.0.1.10.52969 > 10.0.2.10.5001: UDP, length 1470
23:03:22.282784 IP 10.0.1.10.52969 > 10.0.2.10.5001: UDP, length 1470
23:03:22.294274 IP 10.0.1.10.52969 > 10.0.2.10.5001: UDP, length 1470
23:03:22.305178 IP 10.0.1.10.52969 > 10.0.2.10.5001: UDP, length 1470
23:03:22.316489 IP 10.0.1.10.52969 > 10.0.2.10.5001: UDP, length 1470
23:03:22.327473 IP 10.0.1.10.52969 > 10.0.2.10.5001: UDP, length 1470
23:03:22.338905 IP 10.0.1.10.52969 > 10.0.2.10.5001: UDP, length 1470
23:03:22.350105 IP 10.0.1.10.52969 > 10.0.2.10.5001: UDP, length 1470
23:03:22.361270 IP 10.0.1.10.52969 > 10.0.2.10.5001: UDP, length 1470
23:03:22.372412 IP 10.0.1.10.52969 > 10.0.2.10.5001: UDP, length 1470
23:03:22.383419 IP 10.0.1.10.52969 > 10.0.2.10.5001: UDP, length 1470
23:03:22.395603 IP 10.0.1.10.52969 > 10.0.2.10.5001: UDP, length 1470
23:03:22.406164 IP 10.0.1.10.52969 > 10.0.2.10.5001: UDP, length 1470
23:03:22.418220 IP 10.0.1.10.52969 > 10.0.2.10.5001: UDP, length 1470
23:03:22.428619 IP 10.0.1.10.52969 > 10.0.2.10.5001: UDP, length 1470
23:03:22.439508 IP 10.0.1.10.52969 > 10.0.2.10.5001: UDP, length 1470
23:03:22.450860 IP 10.0.1.10.52969 > 10.0.2.10.5001: UDP, length 1470
23:03:22.462041 IP 10.0.1.10.52969 > 10.0.2.10.5001: UDP, length 1470
23:03:22.473340 IP 10.0.1.10.52969 > 10.0.2.10.5001: UDP, length 1470
23:03:22.484526 IP 10.0.1.10.52969 > 10.0.2.10.5001: UDP, length 1470
23:03:22.495708 IP 10.0.1.10.52969 > 10.0.2.10.5001: UDP, length 1470
23:03:22.507192 IP 10.0.1.10.52969 > 10.0.2.10.5001: UDP, length 1470
23:03:22.518460 IP 10.0.1.10.52969 > 10.0.2.10.5001: UDP, length 1470
23:03:22.529555 IP 10.0.1.10.52969 > 10.0.2.10.5001: UDP, length 1470
23:03:22.540785 IP 10.0.1.10.52969 > 10.0.2.10.5001: UDP, length 1470
23:03:22.551795 IP 10.0.1.10.52969 > 10.0.2.10.5001: UDP, length 1470
23:03:22.563199 IP 10.0.1.10.52969 > 10.0.2.10.5001: UDP, length 1470
23:03:22.574024 IP 10.0.1.10.52969 > 10.0.2.10.5001: UDP, length 1470
23:03:22.585668 IP 10.0.1.10.52969 > 10.0.2.10.5001: UDP, length 1470
23:03:22.597225 IP 10.0.1.10.52969 > 10.0.2.10.5001: UDP, length 1470
23:03:22.608121 IP 10.0.1.10.52969 > 10.0.2.10.5001: UDP, length 1470
23:03:22.619625 IP 10.0.1.10.52969 > 10.0.2.10.5001: UDP, length 1470
23:03:22.630244 IP 10.0.1.10.52969 > 10.0.2.10.5001: UDP, length 1470
23:03:22.641469 IP 10.0.1.10.52969 > 10.0.2.10.5001: UDP, length 1470
23:03:22.652775 IP 10.0.1.10.52969 > 10.0.2.10.5001: UDP, length 1470
23:03:22.663846 IP 10.0.1.10.52969 > 10.0.2.10.5001: UDP, length 1470
23:03:22.674967 IP 10.0.1.10.52969 > 10.0.2.10.5001: UDP, length 1470
23:03:22.686217 IP 10.0.1.10.52969 > 10.0.2.10.5001: UDP, length 1470
23:03:22.697804 IP 10.0.1.10.52969 > 10.0.2.10.5001: UDP, length 1470
23:03:22.708840 IP 10.0.1.10.52969 > 10.0.2.10.5001: UDP, length 1470
23:03:22.719872 IP 10.0.1.10.52969 > 10.0.2.10.5001: UDP, length 1470
23:03:22.731301 IP 10.0.1.10.52969 > 10.0.2.10.5001: UDP, length 1470
23:03:22.742467 IP 10.0.1.10.52969 > 10.0.2.10.5001: UDP, length 1470
23:03:22.754349 IP 10.0.1.10.52969 > 10.0.2.10.5001: UDP, length 1470
23:03:22.765724 IP 10.0.1.10.52969 > 10.0.2.10.5001: UDP, length 1470
23:03:22.776065 IP 10.0.1.10.52969 > 10.0.2.10.5001: UDP, length 1470
23:03:22.787253 IP 10.0.1.10.52969 > 10.0.2.10.5001: UDP, length 1470
23:03:22.799053 IP 10.0.1.10.52969 > 10.0.2.10.5001: UDP, length 1470
23:03:22.809466 IP 10.0.1.10.52969 > 10.0.2.10.5001: UDP, length 1470
23:03:22.820859 IP 10.0.1.10.52969 > 10.0.2.10.5001: UDP, length 1470
23:03:22.832145 IP 10.0.1.10.52969 > 10.0.2.10.5001: UDP, length 1470
23:03:22.843044 IP 10.0.1.10.52969 > 10.0.2.10.5001: UDP, length 1470
23:03:22.854866 IP 10.0.1.10.52969 > 10.0.2.10.5001: UDP, length 1470
23:03:22.865703 IP 10.0.1.10.52969 > 10.0.2.10.5001: UDP, length 1470
23:03:22.877047 IP 10.0.1.10.52969 > 10.0.2.10.5001: UDP, length 1470
23:03:22.888808 IP 10.0.1.10.52969 > 10.0.2.10.5001: UDP, length 1470
23:03:22.900022 IP 10.0.1.10.52969 > 10.0.2.10.5001: UDP, length 1470
23:03:22.911146 IP 10.0.1.10.52969 > 10.0.2.10.5001: UDP, length 1470
23:03:22.921794 IP 10.0.1.10.52969 > 10.0.2.10.5001: UDP, length 1470
23:03:22.933623 IP 10.0.1.10.52969 > 10.0.2.10.5001: UDP, length 1470
23:03:22.944325 IP 10.0.1.10.52969 > 10.0.2.10.5001: UDP, length 1470
23:03:22.955290 IP 10.0.1.10.52969 > 10.0.2.10.5001: UDP, length 1470
23:03:22.966782 IP 10.0.1.10.52969 > 10.0.2.10.5001: UDP, length 1470
23:03:22.977965 IP 10.0.1.10.52969 > 10.0.2.10.5001: UDP, length 1470
23:03:22.989150 IP 10.0.1.10.52969 > 10.0.2.10.5001: UDP, length 1470
23:03:23.000795 IP 10.0.1.10.52969 > 10.0.2.10.5001: UDP, length 1470
23:03:23.011582 IP 10.0.1.10.52969 > 10.0.2.10.5001: UDP, length 1470
23:03:23.022883 IP 10.0.1.10.52969 > 10.0.2.10.5001: UDP, length 1470
23:03:23.034190 IP 10.0.1.10.52969 > 10.0.2.10.5001: UDP, length 1470
23:03:23.045613 IP 10.0.1.10.52969 > 10.0.2.10.5001: UDP, length 1470
23:03:23.056641 IP 10.0.1.10.52969 > 10.0.2.10.5001: UDP, length 1470
23:03:23.072344 IP 10.0.1.10.52969 > 10.0.2.10.5001: UDP, length 1470
23:03:23.079038 IP 10.0.1.10.52969 > 10.0.2.10.5001: UDP, length 1470
23:03:23.089927 IP 10.0.1.10.52969 > 10.0.2.10.5001: UDP, length 1470
23:03:23.101249 IP 10.0.1.10.52969 > 10.0.2.10.5001: UDP, length 1470
23:03:23.112591 IP 10.0.1.10.52969 > 10.0.2.10.5001: UDP, length 1470
23:03:23.123661 IP 10.0.1.10.52969 > 10.0.2.10.5001: UDP, length 1470
23:03:23.134782 IP 10.0.1.10.52969 > 10.0.2.10.5001: UDP, length 1470
23:03:23.146162 IP 10.0.1.10.52969 > 10.0.2.10.5001: UDP, length 1470
23:03:23.157385 IP 10.0.1.10.52969 > 10.0.2.10.5001: UDP, length 1470
23:03:23.168761 IP 10.0.1.10.52969 > 10.0.2.10.5001: UDP, length 1470
23:03:23.179696 IP 10.0.1.10.52969 > 10.0.2.10.5001: UDP, length 1470
23:03:23.191304 IP 10.0.1.10.52969 > 10.0.2.10.5001: UDP, length 1470
23:03:23.202190 IP 10.0.1.10.52969 > 10.0.2.10.5001: UDP, length 1470
23:03:23.213543 IP 10.0.1.10.52969 > 10.0.2.10.5001: UDP, length 1470
23:03:23.224634 IP 10.0.1.10.52969 > 10.0.2.10.5001: UDP, length 1470
23:03:23.235964 IP 10.0.1.10.52969 > 10.0.2.10.5001: UDP, length 1470
23:03:23.248010 IP 10.0.1.10.52969 > 10.0.2.10.5001: UDP, length 1470
23:03:23.258382 IP 10.0.1.10.52969 > 10.0.2.10.5001: UDP, length 1470
23:03:23.269391 IP 10.0.1.10.52969 > 10.0.2.10.5001: UDP, length 1470
23:03:23.280810 IP 10.0.1.10.52969 > 10.0.2.10.5001: UDP, length 1470
23:03:23.292021 IP 10.0.1.10.52969 > 10.0.2.10.5001: UDP, length 1470
23:03:23.303165 IP 10.0.1.10.52969 > 10.0.2.10.5001: UDP, length 1470
23:03:23.314739 IP 10.0.1.10.52969 > 10.0.2.10.5001: UDP, length 1470
23:03:23.325515 IP 10.0.1.10.52969 > 10.0.2.10.5001: UDP, length 1470
23:03:23.336810 IP 10.0.1.10.52969 > 10.0.2.10.5001: UDP, length 1470
23:03:23.347994 IP 10.0.1.10.52969 > 10.0.2.10.5001: UDP, length 1470
23:03:23.359595 IP 10.0.1.10.52969 > 10.0.2.10.5001: UDP, length 1470
23:03:23.370809 IP 10.0.1.10.52969 > 10.0.2.10.5001: UDP, length 1470
23:03:23.382103 IP 10.0.1.10.52969 > 10.0.2.10.5001: UDP, length 1470
23:03:23.392878 IP 10.0.1.10.52969 > 10.0.2.10.5001: UDP, length 1470
23:03:23.404026 IP 10.0.1.10.52969 > 10.0.2.10.5001: UDP, length 1470
23:03:23.415362 IP 10.0.1.10.52969 > 10.0.2.10.5001: UDP, length 1470
23:03:23.426489 IP 10.0.1.10.52969 > 10.0.2.10.5001: UDP, length 1470
23:03:23.437659 IP 10.0.1.10.52969 > 10.0.2.10.5001: UDP, length 1470
23:03:23.449264 IP 10.0.1.10.52969 > 10.0.2.10.5001: UDP, length 1470
23:03:23.460428 IP 10.0.1.10.52969 > 10.0.2.10.5001: UDP, length 1470
23:03:23.471404 IP 10.0.1.10.52969 > 10.0.2.10.5001: UDP, length 1470
23:03:23.483361 IP 10.0.1.10.52969 > 10.0.2.10.5001: UDP, length 1470
23:03:23.494093 IP 10.0.1.10.52969 > 10.0.2.10.5001: UDP, length 1470
23:03:23.505087 IP 10.0.1.10.52969 > 10.0.2.10.5001: UDP, length 1470
23:03:23.516385 IP 10.0.1.10.52969 > 10.0.2.10.5001: UDP, length 1470
23:03:23.527758 IP 10.0.1.10.52969 > 10.0.2.10.5001: UDP, length 1470
23:03:23.538830 IP 10.0.1.10.52969 > 10.0.2.10.5001: UDP, length 1470
23:03:23.550082 IP 10.0.1.10.52969 > 10.0.2.10.5001: UDP, length 1470
23:03:23.561362 IP 10.0.1.10.52969 > 10.0.2.10.5001: UDP, length 1470
23:03:23.572629 IP 10.0.1.10.52969 > 10.0.2.10.5001: UDP, length 1470
23:03:23.583639 IP 10.0.1.10.52969 > 10.0.2.10.5001: UDP, length 1470
23:03:23.594557 IP 10.0.1.10.52969 > 10.0.2.10.5001: UDP, length 1470
23:03:23.606487 IP 10.0.1.10.52969 > 10.0.2.10.5001: UDP, length 1470
23:03:23.617340 IP 10.0.1.10.52969 > 10.0.2.10.5001: UDP, length 1470
23:03:23.628528 IP 10.0.1.10.52969 > 10.0.2.10.5001: UDP, length 1470
23:03:23.639599 IP 10.0.1.10.52969 > 10.0.2.10.5001: UDP, length 1470
23:03:23.650697 IP 10.0.1.10.52969 > 10.0.2.10.5001: UDP, length 1470
23:03:23.662169 IP 10.0.1.10.52969 > 10.0.2.10.5001: UDP, length 1470
23:03:23.673313 IP 10.0.1.10.52969 > 10.0.2.10.5001: UDP, length 1470
23:03:23.684299 IP 10.0.1.10.52969 > 10.0.2.10.5001: UDP, length 1470
23:03:23.695685 IP 10.0.1.10.52969 > 10.0.2.10.5001: UDP, length 1470
23:03:23.706896 IP 10.0.1.10.52969 > 10.0.2.10.5001: UDP, length 1470
23:03:23.718106 IP 10.0.1.10.52969 > 10.0.2.10.5001: UDP, length 1470
23:03:23.729195 IP 10.0.1.10.52969 > 10.0.2.10.5001: UDP, length 1470
23:03:23.740565 IP 10.0.1.10.52969 > 10.0.2.10.5001: UDP, length 1470
23:03:23.751703 IP 10.0.1.10.52969 > 10.0.2.10.5001: UDP, length 1470
23:03:23.762949 IP 10.0.1.10.52969 > 10.0.2.10.5001: UDP, length 1470
23:03:23.774602 IP 10.0.1.10.52969 > 10.0.2.10.5001: UDP, length 1470
23:03:23.785754 IP 10.0.1.10.52969 > 10.0.2.10.5001: UDP, length 1470
23:03:23.797358 IP 10.0.1.10.52969 > 10.0.2.10.5001: UDP, length 1470
23:03:23.808405 IP 10.0.1.10.52969 > 10.0.2.10.5001: UDP, length 1470
23:03:23.819457 IP 10.0.1.10.52969 > 10.0.2.10.5001: UDP, length 1470
23:03:23.830386 IP 10.0.1.10.52969 > 10.0.2.10.5001: UDP, length 1470
23:03:23.841728 IP 10.0.1.10.52969 > 10.0.2.10.5001: UDP, length 1470
23:03:23.852624 IP 10.0.1.10.52969 > 10.0.2.10.5001: UDP, length 1470
23:03:23.864040 IP 10.0.1.10.52969 > 10.0.2.10.5001: UDP, length 1470
23:03:23.875042 IP 10.0.1.10.52969 > 10.0.2.10.5001: UDP, length 1470
23:03:23.886373 IP 10.0.1.10.52969 > 10.0.2.10.5001: UDP, length 1470
23:03:23.897615 IP 10.0.1.10.52969 > 10.0.2.10.5001: UDP, length 1470
23:03:23.908876 IP 10.0.1.10.52969 > 10.0.2.10.5001: UDP, length 1470
23:03:23.920019 IP 10.0.1.10.52969 > 10.0.2.10.5001: UDP, length 1470
23:03:23.931228 IP 10.0.1.10.52969 > 10.0.2.10.5001: UDP, length 1470
23:03:23.942473 IP 10.0.1.10.52969 > 10.0.2.10.5001: UDP, length 1470
23:03:23.953692 IP 10.0.1.10.52969 > 10.0.2.10.5001: UDP, length 1470
23:03:23.965021 IP 10.0.1.10.52969 > 10.0.2.10.5001: UDP, length 1470
23:03:23.976517 IP 10.0.1.10.52969 > 10.0.2.10.5001: UDP, length 1470
23:03:23.987460 IP 10.0.1.10.52969 > 10.0.2.10.5001: UDP, length 1470
23:03:23.998554 IP 10.0.1.10.52969 > 10.0.2.10.5001: UDP, length 1470
23:03:24.009917 IP 10.0.1.10.52969 > 10.0.2.10.5001: UDP, length 1470
23:03:24.021061 IP 10.0.1.10.52969 > 10.0.2.10.5001: UDP, length 1470
23:03:24.032068 IP 10.0.1.10.52969 > 10.0.2.10.5001: UDP, length 1470
23:03:24.043336 IP 10.0.1.10.52969 > 10.0.2.10.5001: UDP, length 1470
23:03:24.054653 IP 10.0.1.10.52969 > 10.0.2.10.5001: UDP, length 1470
23:03:24.066329 IP 10.0.1.10.52969 > 10.0.2.10.5001: UDP, length 1470
23:03:24.077124 IP 10.0.1.10.52969 > 10.0.2.10.5001: UDP, length 1470
23:03:24.088213 IP 10.0.1.10.52969 > 10.0.2.10.5001: UDP, length 1470
23:03:24.099398 IP 10.0.1.10.52969 > 10.0.2.10.5001: UDP, length 1470
23:03:24.110414 IP 10.0.1.10.52969 > 10.0.2.10.5001: UDP, length 1470
23:03:24.121821 IP 10.0.1.10.52969 > 10.0.2.10.5001: UDP, length 1470
23:03:24.133205 IP 10.0.1.10.52969 > 10.0.2.10.5001: UDP, length 1470
23:03:24.144291 IP 10.0.1.10.52969 > 10.0.2.10.5001: UDP, length 1470
23:03:24.155601 IP 10.0.1.10.52969 > 10.0.2.10.5001: UDP, length 1470
23:03:24.167107 IP 10.0.1.10.52969 > 10.0.2.10.5001: UDP, length 1470
23:03:24.177918 IP 10.0.1.10.52969 > 10.0.2.10.5001: UDP, length 1470
23:03:24.189149 IP 10.0.1.10.52969 > 10.0.2.10.5001: UDP, length 1470
23:03:24.200950 IP 10.0.1.10.52969 > 10.0.2.10.5001: UDP, length 1470
23:03:24.211757 IP 10.0.1.10.52969 > 10.0.2.10.5001: UDP, length 1470
23:03:24.223071 IP 10.0.1.10.52969 > 10.0.2.10.5001: UDP, length 1470
23:03:24.234179 IP 10.0.1.10.52969 > 10.0.2.10.5001: UDP, length 1470
23:03:24.245572 IP 10.0.1.10.52969 > 10.0.2.10.5001: UDP, length 1470
23:03:24.256620 IP 10.0.1.10.52969 > 10.0.2.10.5001: UDP, length 1470
23:03:24.267613 IP 10.0.1.10.52969 > 10.0.2.10.5001: UDP, length 1470
23:03:24.279782 IP 10.0.1.10.52969 > 10.0.2.10.5001: UDP, length 1470
23:03:24.290259 IP 10.0.1.10.52969 > 10.0.2.10.5001: UDP, length 1470
23:03:24.301357 IP 10.0.1.10.52969 > 10.0.2.10.5001: UDP, length 1470
23:03:24.313388 IP 10.0.1.10.52969 > 10.0.2.10.5001: UDP, length 1470
23:03:24.323688 IP 10.0.1.10.52969 > 10.0.2.10.5001: UDP, length 1470
23:03:24.335201 IP 10.0.1.10.52969 > 10.0.2.10.5001: UDP, length 1470
23:03:24.346172 IP 10.0.1.10.52969 > 10.0.2.10.5001: UDP, length 1470
23:03:24.357321 IP 10.0.1.10.52969 > 10.0.2.10.5001: UDP, length 1470
23:03:24.368976 IP 10.0.1.10.52969 > 10.0.2.10.5001: UDP, length 1470
23:03:24.379918 IP 10.0.1.10.52969 > 10.0.2.10.5001: UDP, length 1470
23:03:24.391020 IP 10.0.1.10.52969 > 10.0.2.10.5001: UDP, length 1470
23:03:24.402858 IP 10.0.1.10.52969 > 10.0.2.10.5001: UDP, length 1470
23:03:24.414012 IP 10.0.1.10.52969 > 10.0.2.10.5001: UDP, length 1470
23:03:24.424801 IP 10.0.1.10.52969 > 10.0.2.10.5001: UDP, length 1470
23:03:24.436047 IP 10.0.1.10.52969 > 10.0.2.10.5001: UDP, length 1470
23:03:24.447114 IP 10.0.1.10.52969 > 10.0.2.10.5001: UDP, length 1470
23:03:24.458581 IP 10.0.1.10.52969 > 10.0.2.10.5001: UDP, length 1470
23:03:24.469867 IP 10.0.1.10.52969 > 10.0.2.10.5001: UDP, length 1470
23:03:24.481443 IP 10.0.1.10.52969 > 10.0.2.10.5001: UDP, length 1470
23:03:24.492496 IP 10.0.1.10.52969 > 10.0.2.10.5001: UDP, length 1470
23:03:24.503633 IP 10.0.1.10.52969 > 10.0.2.10.5001: UDP, length 1470
23:03:24.515127 IP 10.0.1.10.52969 > 10.0.2.10.5001: UDP, length 1470
23:03:24.525888 IP 10.0.1.10.52969 > 10.0.2.10.5001: UDP, length 1470
23:03:24.537164 IP 10.0.1.10.52969 > 10.0.2.10.5001: UDP, length 1470
23:03:24.548450 IP 10.0.1.10.52969 > 10.0.2.10.5001: UDP, length 1470
23:03:24.559246 IP 10.0.1.10.52969 > 10.0.2.10.5001: UDP, length 1470
23:03:24.570619 IP 10.0.1.10.52969 > 10.0.2.10.5001: UDP, length 1470
23:03:24.581952 IP 10.0.1.10.52969 > 10.0.2.10.5001: UDP, length 1470
23:03:24.592846 IP 10.0.1.10.52969 > 10.0.2.10.5001: UDP, length 1470
23:03:24.604146 IP 10.0.1.10.52969 > 10.0.2.10.5001: UDP, length 1470
23:03:24.615615 IP 10.0.1.10.52969 > 10.0.2.10.5001: UDP, length 1470
23:03:24.626695 IP 10.0.1.10.52969 > 10.0.2.10.5001: UDP, length 1470
23:03:24.637632 IP 10.0.1.10.52969 > 10.0.2.10.5001: UDP, length 1470
23:03:24.649030 IP 10.0.1.10.52969 > 10.0.2.10.5001: UDP, length 1470
23:03:24.660174 IP 10.0.1.10.52969 > 10.0.2.10.5001: UDP, length 1470
23:03:24.671341 IP 10.0.1.10.52969 > 10.0.2.10.5001: UDP, length 1470
23:03:24.682529 IP 10.0.1.10.52969 > 10.0.2.10.5001: UDP, length 1470
23:03:24.693973 IP 10.0.1.10.52969 > 10.0.2.10.5001: UDP, length 1470
23:03:24.705103 IP 10.0.1.10.52969 > 10.0.2.10.5001: UDP, length 1470
23:03:24.716599 IP 10.0.1.10.52969 > 10.0.2.10.5001: UDP, length 1470
23:03:24.727643 IP 10.0.1.10.52969 > 10.0.2.10.5001: UDP, length 1470
23:03:24.738757 IP 10.0.1.10.52969 > 10.0.2.10.5001: UDP, length 1470
23:03:24.750086 IP 10.0.1.10.52969 > 10.0.2.10.5001: UDP, length 1470
23:03:24.761277 IP 10.0.1.10.52969 > 10.0.2.10.5001: UDP, length 1470
23:03:24.772258 IP 10.0.1.10.52969 > 10.0.2.10.5001: UDP, length 1470
23:03:24.783541 IP 10.0.1.10.52969 > 10.0.2.10.5001: UDP, length 1470
23:03:24.794995 IP 10.0.1.10.52969 > 10.0.2.10.5001: UDP, length 1470
23:03:24.806435 IP 10.0.1.10.52969 > 10.0.2.10.5001: UDP, length 1470
23:03:24.817276 IP 10.0.1.10.52969 > 10.0.2.10.5001: UDP, length 1470
23:03:24.828987 IP 10.0.1.10.52969 > 10.0.2.10.5001: UDP, length 1470
23:03:24.840371 IP 10.0.1.10.52969 > 10.0.2.10.5001: UDP, length 1470
23:03:24.851650 IP 10.0.1.10.52969 > 10.0.2.10.5001: UDP, length 1470
23:03:24.862419 IP 10.0.1.10.52969 > 10.0.2.10.5001: UDP, length 1470
23:03:24.873135 IP 10.0.1.10.52969 > 10.0.2.10.5001: UDP, length 1470
23:03:24.884931 IP 10.0.1.10.52969 > 10.0.2.10.5001: UDP, length 1470
23:03:24.895856 IP 10.0.1.10.52969 > 10.0.2.10.5001: UDP, length 1470
23:03:24.907081 IP 10.0.1.10.52969 > 10.0.2.10.5001: UDP, length 1470
23:03:24.918550 IP 10.0.1.10.52969 > 10.0.2.10.5001: UDP, length 1470
23:03:24.929782 IP 10.0.1.10.52969 > 10.0.2.10.5001: UDP, length 1470
23:03:24.940711 IP 10.0.1.10.52969 > 10.0.2.10.5001: UDP, length 1470
23:03:24.952316 IP 10.0.1.10.52969 > 10.0.2.10.5001: UDP, length 1470
23:03:24.963404 IP 10.0.1.10.52969 > 10.0.2.10.5001: UDP, length 1470
23:03:24.974349 IP 10.0.1.10.52969 > 10.0.2.10.5001: UDP, length 1470
23:03:24.986123 IP 10.0.1.10.52969 > 10.0.2.10.5001: UDP, length 1470
23:03:24.997457 IP 10.0.1.10.52969 > 10.0.2.10.5001: UDP, length 1470
23:03:25.008517 IP 10.0.1.10.52969 > 10.0.2.10.5001: UDP, length 1470
23:03:25.019591 IP 10.0.1.10.52969 > 10.0.2.10.5001: UDP, length 1470
23:03:25.030436 IP 10.0.1.10.52969 > 10.0.2.10.5001: UDP, length 1470
23:03:25.041873 IP 10.0.1.10.52969 > 10.0.2.10.5001: UDP, length 1470
23:03:25.053140 IP 10.0.1.10.52969 > 10.0.2.10.5001: UDP, length 1470
23:03:25.064235 IP 10.0.1.10.52969 > 10.0.2.10.5001: UDP, length 1470
23:03:25.075197 IP 10.0.1.10.52969 > 10.0.2.10.5001: UDP, length 1470
23:03:25.086871 IP 10.0.1.10.52969 > 10.0.2.10.5001: UDP, length 1470
23:03:25.098172 IP 10.0.1.10.52969 > 10.0.2.10.5001: UDP, length 1470
23:03:25.108961 IP 10.0.1.10.52969 > 10.0.2.10.5001: UDP, length 1470
23:03:25.119974 IP 10.0.1.10.52969 > 10.0.2.10.5001: UDP, length 1470
23:03:25.131111 IP 10.0.1.10.52969 > 10.0.2.10.5001: UDP, length 1470
23:03:25.142316 IP 10.0.1.10.52969 > 10.0.2.10.5001: UDP, length 1470
23:03:25.154598 IP 10.0.1.10.52969 > 10.0.2.10.5001: UDP, length 1470
23:03:25.164662 IP 10.0.1.10.52969 > 10.0.2.10.5001: UDP, length 1470
23:03:25.175923 IP 10.0.1.10.52969 > 10.0.2.10.5001: UDP, length 1470
23:03:25.187106 IP 10.0.1.10.52969 > 10.0.2.10.5001: UDP, length 1470
23:03:25.198822 IP 10.0.1.10.52969 > 10.0.2.10.5001: UDP, length 1470
23:03:25.209862 IP 10.0.1.10.52969 > 10.0.2.10.5001: UDP, length 1470
23:03:25.220996 IP 10.0.1.10.52969 > 10.0.2.10.5001: UDP, length 1470
23:03:25.232486 IP 10.0.1.10.52969 > 10.0.2.10.5001: UDP, length 1470
23:03:25.243316 IP 10.0.1.10.52969 > 10.0.2.10.5001: UDP, length 1470
23:03:25.254469 IP 10.0.1.10.52969 > 10.0.2.10.5001: UDP, length 1470
23:03:25.266256 IP 10.0.1.10.52969 > 10.0.2.10.5001: UDP, length 1470
23:03:25.277284 IP 10.0.1.10.52969 > 10.0.2.10.5001: UDP, length 1470
23:03:25.288335 IP 10.0.1.10.52969 > 10.0.2.10.5001: UDP, length 1470
23:03:25.300708 IP 10.0.1.10.52969 > 10.0.2.10.5001: UDP, length 1470
23:03:25.311064 IP 10.0.1.10.52969 > 10.0.2.10.5001: UDP, length 1470
23:03:25.322031 IP 10.0.1.10.52969 > 10.0.2.10.5001: UDP, length 1470
23:03:25.333231 IP 10.0.1.10.52969 > 10.0.2.10.5001: UDP, length 1470
23:03:25.344324 IP 10.0.1.10.52969 > 10.0.2.10.5001: UDP, length 1470
23:03:25.355402 IP 10.0.1.10.52969 > 10.0.2.10.5001: UDP, length 1470
23:03:25.367226 IP 10.0.1.10.52969 > 10.0.2.10.5001: UDP, length 1470
23:03:25.378107 IP 10.0.1.10.52969 > 10.0.2.10.5001: UDP, length 1470
23:03:25.389092 IP 10.0.1.10.52969 > 10.0.2.10.5001: UDP, length 1470
23:03:25.400469 IP 10.0.1.10.52969 > 10.0.2.10.5001: UDP, length 1470
23:03:25.411665 IP 10.0.1.10.52969 > 10.0.2.10.5001: UDP, length 1470
23:03:25.422981 IP 10.0.1.10.52969 > 10.0.2.10.5001: UDP, length 1470
23:03:25.435217 IP 10.0.1.10.52969 > 10.0.2.10.5001: UDP, length 1470
23:03:25.445413 IP 10.0.1.10.52969 > 10.0.2.10.5001: UDP, length 1470
23:03:25.456603 IP 10.0.1.10.52969 > 10.0.2.10.5001: UDP, length 1470
23:03:25.467570 IP 10.0.1.10.52969 > 10.0.2.10.5001: UDP, length 1470
23:03:25.479079 IP 10.0.1.10.52969 > 10.0.2.10.5001: UDP, length 1470
23:03:25.490337 IP 10.0.1.10.52969 > 10.0.2.10.5001: UDP, length 1470
23:03:25.501434 IP 10.0.1.10.52969 > 10.0.2.10.5001: UDP, length 1470
23:03:25.513125 IP 10.0.1.10.52969 > 10.0.2.10.5001: UDP, length 1470
23:03:25.523734 IP 10.0.1.10.52969 > 10.0.2.10.5001: UDP, length 1470
23:03:25.535053 IP 10.0.1.10.52969 > 10.0.2.10.5001: UDP, length 1470
23:03:25.546548 IP 10.0.1.10.52969 > 10.0.2.10.5001: UDP, length 1470
23:03:25.558001 IP 10.0.1.10.52969 > 10.0.2.10.5001: UDP, length 1470
23:03:25.568748 IP 10.0.1.10.52969 > 10.0.2.10.5001: UDP, length 1470
23:03:25.580044 IP 10.0.1.10.52969 > 10.0.2.10.5001: UDP, length 1470
23:03:25.590925 IP 10.0.1.10.52969 > 10.0.2.10.5001: UDP, length 1470
23:03:25.602275 IP 10.0.1.10.52969 > 10.0.2.10.5001: UDP, length 1470
23:03:25.613656 IP 10.0.1.10.52969 > 10.0.2.10.5001: UDP, length 1470
23:03:25.624629 IP 10.0.1.10.52969 > 10.0.2.10.5001: UDP, length 1470
23:03:25.635775 IP 10.0.1.10.52969 > 10.0.2.10.5001: UDP, length 1470
23:03:25.647230 IP 10.0.1.10.52969 > 10.0.2.10.5001: UDP, length 1470
23:03:25.658484 IP 10.0.1.10.52969 > 10.0.2.10.5001: UDP, length 1470
23:03:25.669562 IP 10.0.1.10.52969 > 10.0.2.10.5001: UDP, length 1470
23:03:25.680903 IP 10.0.1.10.52969 > 10.0.2.10.5001: UDP, length 1470
23:03:25.692024 IP 10.0.1.10.52969 > 10.0.2.10.5001: UDP, length 1470
23:03:25.703254 IP 10.0.1.10.52969 > 10.0.2.10.5001: UDP, length 1470
23:03:25.714716 IP 10.0.1.10.52969 > 10.0.2.10.5001: UDP, length 1470
23:03:25.725517 IP 10.0.1.10.52969 > 10.0.2.10.5001: UDP, length 1470
