21:09:56.339533 IP 10.0.0.1.41646 > 10.0.0.3.5001: Flags [P.], seq 2621441:2628681, ack 1, win 83, options [nop,nop,TS val 4187328606 ecr 273809506], length 7240
21:09:56.340901 IP 10.0.0.1.41646 > 10.0.0.3.5001: Flags [P.], seq 2628681:2635921, ack 1, win 83, options [nop,nop,TS val 4187328606 ecr 273809506], length 7240
21:09:56.341069 IP 10.0.0.1.41646 > 10.0.0.3.5001: Flags [P.], seq 2635921:2650401, ack 1, win 83, options [nop,nop,TS val 4187328608 ecr 273810506], length 14480
21:09:56.341159 IP 10.0.0.1.41646 > 10.0.0.3.5001: Flags [P.], seq 2650401:2664881, ack 1, win 83, options [nop,nop,TS val 4187328608 ecr 273810506], length 14480
21:09:56.341403 IP 10.0.0.1.41646 > 10.0.0.3.5001: Flags [P.], seq 2664881:2693841, ack 1, win 83, options [nop,nop,TS val 4187328608 ecr 273810507], length 28960
21:09:56.341494 IP 10.0.0.1.41646 > 10.0.0.3.5001: Flags [P.], seq 2693841:2701081, ack 1, win 83, options [nop,nop,TS val 4187328608 ecr 273810507], length 7240
21:09:56.341566 IP 10.0.0.1.41646 > 10.0.0.3.5001: Flags [P.], seq 2701081:2722801, ack 1, win 83, options [nop,nop,TS val 4187328608 ecr 273810507], length 21720
21:09:56.341712 IP 10.0.0.1.41646 > 10.0.0.3.5001: Flags [P.], seq 2722801:2752513, ack 1, win 83, options [nop,nop,TS val 4187328608 ecr 273810507], length 29712
21:09:57.339534 IP 10.0.0.1.41646 > 10.0.0.3.5001: Flags [P.], seq 2752513:2759753, ack 1, win 83, options [nop,nop,TS val 4187329606 ecr 273810507], length 7240
21:09:57.340306 IP 10.0.0.1.41646 > 10.0.0.3.5001: Flags [P.], seq 2759753:2766993, ack 1, win 83, options [nop,nop,TS val 4187329606 ecr 273810507], length 7240
21:09:57.340473 IP 10.0.0.1.41646 > 10.0.0.3.5001: Flags [P.], seq 2766993:2777129, ack 1, win 83, options [nop,nop,TS val 4187329607 ecr 273811505], length 10136
21:09:57.340611 IP 10.0.0.1.41646 > 10.0.0.3.5001: Flags [P.], seq 2777129:2791609, ack 1, win 83, options [nop,nop,TS val 4187329607 ecr 273811506], length 14480
21:09:57.340697 IP 10.0.0.1.41646 > 10.0.0.3.5001: Flags [P.], seq 2791609:2795953, ack 1, win 83, options [nop,nop,TS val 4187329607 ecr 273811506], length 4344
21:09:57.340993 IP 10.0.0.1.41646 > 10.0.0.3.5001: Flags [P.], seq 2795953:2824913, ack 1, win 83, options [nop,nop,TS val 4187329607 ecr 273811506], length 28960
21:09:57.341100 IP 10.0.0.1.41646 > 10.0.0.3.5001: Flags [P.], seq 2824913:2832153, ack 1, win 83, options [nop,nop,TS val 4187329607 ecr 273811506], length 7240
21:09:57.341170 IP 10.0.0.1.41646 > 10.0.0.3.5001: Flags [P.], seq 2832153:2853873, ack 1, win 83, options [nop,nop,TS val 4187329607 ecr 273811506], length 21720
21:09:57.341312 IP 10.0.0.1.41646 > 10.0.0.3.5001: Flags [P.], seq 2853873:2883585, ack 1, win 83, options [nop,nop,TS val 4187329608 ecr 273811506], length 29712
21:09:58.339547 IP 10.0.0.1.41646 > 10.0.0.3.5001: Flags [P.], seq 2883585:2890825, ack 1, win 83, options [nop,nop,TS val 4187330606 ecr 273811507], length 7240
21:09:58.339723 IP 10.0.0.1.41646 > 10.0.0.3.5001: Flags [P.], seq 2890825:2898065, ack 1, win 83, options [nop,nop,TS val 4187330606 ecr 273811507], length 7240
21:09:58.339891 IP 10.0.0.1.41646 > 10.0.0.3.5001: Flags [P.], seq 2898065:2912545, ack 1, win 83, options [nop,nop,TS val 4187330606 ecr 273812505], length 14480
21:09:58.339979 IP 10.0.0.1.41646 > 10.0.0.3.5001: Flags [P.], seq 2912545:2927025, ack 1, win 83, options [nop,nop,TS val 4187330606 ecr 273812505], length 14480
21:09:58.340117 IP 10.0.0.1.41646 > 10.0.0.3.5001: Flags [P.], seq 2927025:2955985, ack 1, win 83, options [nop,nop,TS val 4187330607 ecr 273812505], length 28960
21:09:58.340208 IP 10.0.0.1.41646 > 10.0.0.3.5001: Flags [P.], seq 2955985:2963225, ack 1, win 83, options [nop,nop,TS val 4187330607 ecr 273812505], length 7240
21:09:58.340301 IP 10.0.0.1.41646 > 10.0.0.3.5001: Flags [P.], seq 2963225:2984945, ack 1, win 83, options [nop,nop,TS val 4187330607 ecr 273812505], length 21720
21:09:58.340465 IP 10.0.0.1.41646 > 10.0.0.3.5001: Flags [P.], seq 2984945:3014657, ack 1, win 83, options [nop,nop,TS val 4187330607 ecr 273812506], length 29712
21:09:59.339531 IP 10.0.0.1.41646 > 10.0.0.3.5001: Flags [P.], seq 3014657:3021897, ack 1, win 83, options [nop,nop,TS val 4187331606 ecr 273812506], length 7240
21:09:59.339703 IP 10.0.0.1.41646 > 10.0.0.3.5001: Flags [P.], seq 3021897:3029137, ack 1, win 83, options [nop,nop,TS val 4187331606 ecr 273812506], length 7240
21:09:59.339871 IP 10.0.0.1.41646 > 10.0.0.3.5001: Flags [P.], seq 3029137:3043617, ack 1, win 83, options [nop,nop,TS val 4187331606 ecr 273813505], length 14480
21:09:59.339959 IP 10.0.0.1.41646 > 10.0.0.3.5001: Flags [P.], seq 3043617:3058097, ack 1, win 83, options [nop,nop,TS val 4187331606 ecr 273813505], length 14480
21:09:59.340096 IP 10.0.0.1.41646 > 10.0.0.3.5001: Flags [P.], seq 3058097:3087057, ack 1, win 83, options [nop,nop,TS val 4187331607 ecr 273813505], length 28960
21:09:59.340187 IP 10.0.0.1.41646 > 10.0.0.3.5001: Flags [P.], seq 3087057:3094297, ack 1, win 83, options [nop,nop,TS val 4187331607 ecr 273813505], length 7240
21:09:59.340259 IP 10.0.0.1.41646 > 10.0.0.3.5001: Flags [P.], seq 3094297:3116017, ack 1, win 83, options [nop,nop,TS val 4187331607 ecr 273813505], length 21720
21:09:59.340404 IP 10.0.0.1.41646 > 10.0.0.3.5001: Flags [P.], seq 3116017:3145729, ack 1, win 83, options [nop,nop,TS val 4187331607 ecr 273813506], length 29712
21:10:00.339537 IP 10.0.0.1.41646 > 10.0.0.3.5001: Flags [P.], seq 3145729:3152969, ack 1, win 83, options [nop,nop,TS val 4187332606 ecr 273813506], length 7240
21:10:00.339711 IP 10.0.0.1.41646 > 10.0.0.3.5001: Flags [P.], seq 3152969:3160209, ack 1, win 83, options [nop,nop,TS val 4187332606 ecr 273813506], length 7240
21:10:00.339879 IP 10.0.0.1.41646 > 10.0.0.3.5001: Flags [P.], seq 3160209:3174689, ack 1, win 83, options [nop,nop,TS val 4187332606 ecr 273814505], length 14480
21:10:00.339967 IP 10.0.0.1.41646 > 10.0.0.3.5001: Flags [P.], seq 3174689:3189169, ack 1, win 83, options [nop,nop,TS val 4187332606 ecr 273814505], length 14480
21:10:00.340105 IP 10.0.0.1.41646 > 10.0.0.3.5001: Flags [P.], seq 3189169:3218129, ack 1, win 83, options [nop,nop,TS val 4187332607 ecr 273814505], length 28960
21:10:00.340196 IP 10.0.0.1.41646 > 10.0.0.3.5001: Flags [P.], seq 3218129:3225369, ack 1, win 83, options [nop,nop,TS val 4187332607 ecr 273814505], length 7240
21:10:00.340268 IP 10.0.0.1.41646 > 10.0.0.3.5001: Flags [P.], seq 3225369:3247089, ack 1, win 83, options [nop,nop,TS val 4187332607 ecr 273814505], length 21720
21:10:00.340413 IP 10.0.0.1.41646 > 10.0.0.3.5001: Flags [P.], seq 3247089:3276801, ack 1, win 83, options [nop,nop,TS val 4187332607 ecr 273814506], length 29712
21:10:01.339535 IP 10.0.0.1.41646 > 10.0.0.3.5001: Flags [P.], seq 3276801:3284041, ack 1, win 83, options [nop,nop,TS val 4187333606 ecr 273814506], length 7240
21:10:01.339710 IP 10.0.0.1.41646 > 10.0.0.3.5001: Flags [P.], seq 3284041:3291281, ack 1, win 83, options [nop,nop,TS val 4187333606 ecr 273814506], length 7240
21:10:01.339892 IP 10.0.0.1.41646 > 10.0.0.3.5001: Flags [P.], seq 3291281:3305761, ack 1, win 83, options [nop,nop,TS val 4187333606 ecr 273815505], length 14480
21:10:01.339980 IP 10.0.0.1.41646 > 10.0.0.3.5001: Flags [P.], seq 3305761:3320241, ack 1, win 83, options [nop,nop,TS val 4187333606 ecr 273815505], length 14480
21:10:01.340120 IP 10.0.0.1.41646 > 10.0.0.3.5001: Flags [P.], seq 3320241:3349201, ack 1, win 83, options [nop,nop,TS val 4187333607 ecr 273815505], length 28960
21:10:01.340210 IP 10.0.0.1.41646 > 10.0.0.3.5001: Flags [P.], seq 3349201:3356441, ack 1, win 83, options [nop,nop,TS val 4187333607 ecr 273815505], length 7240
21:10:01.340283 IP 10.0.0.1.41646 > 10.0.0.3.5001: Flags [P.], seq 3356441:3378161, ack 1, win 83, options [nop,nop,TS val 4187333607 ecr 273815505], length 21720
21:10:01.340428 IP 10.0.0.1.41646 > 10.0.0.3.5001: Flags [P.], seq 3378161:3407873, ack 1, win 83, options [nop,nop,TS val 4187333607 ecr 273815506], length 29712
21:10:02.339535 IP 10.0.0.1.41646 > 10.0.0.3.5001: Flags [P.], seq 3407873:3415113, ack 1, win 83, options [nop,nop,TS val 4187334606 ecr 273815506], length 7240
21:10:02.339706 IP 10.0.0.1.41646 > 10.0.0.3.5001: Flags [P.], seq 3415113:3422353, ack 1, win 83, options [nop,nop,TS val 4187334606 ecr 273815506], length 7240
21:10:02.339870 IP 10.0.0.1.41646 > 10.0.0.3.5001: Flags [P.], seq 3422353:3436833, ack 1, win 83, options [nop,nop,TS val 4187334606 ecr 273816505], length 14480
21:10:02.339956 IP 10.0.0.1.41646 > 10.0.0.3.5001: Flags [P.], seq 3436833:3451313, ack 1, win 83, options [nop,nop,TS val 4187334606 ecr 273816505], length 14480
21:10:02.340091 IP 10.0.0.1.41646 > 10.0.0.3.5001: Flags [P.], seq 3451313:3480273, ack 1, win 83, options [nop,nop,TS val 4187334607 ecr 273816505], length 28960
21:10:02.340180 IP 10.0.0.1.41646 > 10.0.0.3.5001: Flags [P.], seq 3480273:3487513, ack 1, win 83, options [nop,nop,TS val 4187334607 ecr 273816505], length 7240
21:10:02.340250 IP 10.0.0.1.41646 > 10.0.0.3.5001: Flags [P.], seq 3487513:3509233, ack 1, win 83, options [nop,nop,TS val 4187334607 ecr 273816505], length 21720
21:10:02.340393 IP 10.0.0.1.41646 > 10.0.0.3.5001: Flags [P.], seq 3509233:3538945, ack 1, win 83, options [nop,nop,TS val 4187334607 ecr 273816506], length 29712
21:10:03.339541 IP 10.0.0.1.41646 > 10.0.0.3.5001: Flags [P.], seq 3538945:3546185, ack 1, win 83, options [nop,nop,TS val 4187335606 ecr 273816506], length 7240
21:10:03.339708 IP 10.0.0.1.41646 > 10.0.0.3.5001: Flags [P.], seq 3546185:3553425, ack 1, win 83, options [nop,nop,TS val 4187335606 ecr 273816506], length 7240
21:10:03.339871 IP 10.0.0.1.41646 > 10.0.0.3.5001: Flags [P.], seq 3553425:3567905, ack 1, win 83, options [nop,nop,TS val 4187335606 ecr 273817505], length 14480
21:10:03.339958 IP 10.0.0.1.41646 > 10.0.0.3.5001: Flags [P.], seq 3567905:3582385, ack 1, win 83, options [nop,nop,TS val 4187335606 ecr 273817505], length 14480
21:10:03.340093 IP 10.0.0.1.41646 > 10.0.0.3.5001: Flags [P.], seq 3582385:3611345, ack 1, win 83, options [nop,nop,TS val 4187335607 ecr 273817505], length 28960
21:10:03.340182 IP 10.0.0.1.41646 > 10.0.0.3.5001: Flags [P.], seq 3611345:3618585, ack 1, win 83, options [nop,nop,TS val 4187335607 ecr 273817505], length 7240
21:10:03.340253 IP 10.0.0.1.41646 > 10.0.0.3.5001: Flags [P.], seq 3618585:3640305, ack 1, win 83, options [nop,nop,TS val 4187335607 ecr 273817505], length 21720
21:10:03.340395 IP 10.0.0.1.41646 > 10.0.0.3.5001: Flags [P.], seq 3640305:3670017, ack 1, win 83, options [nop,nop,TS val 4187335607 ecr 273817506], length 29712
21:10:04.339537 IP 10.0.0.1.41646 > 10.0.0.3.5001: Flags [P.], seq 3670017:3677257, ack 1, win 83, options [nop,nop,TS val 4187336606 ecr 273817506], length 7240
21:10:04.339707 IP 10.0.0.1.41646 > 10.0.0.3.5001: Flags [P.], seq 3677257:3684497, ack 1, win 83, options [nop,nop,TS val 4187336606 ecr 273817506], length 7240
21:10:04.339871 IP 10.0.0.1.41646 > 10.0.0.3.5001: Flags [P.], seq 3684497:3698977, ack 1, win 83, options [nop,nop,TS val 4187336606 ecr 273818505], length 14480
21:10:04.339957 IP 10.0.0.1.41646 > 10.0.0.3.5001: Flags [P.], seq 3698977:3713457, ack 1, win 83, options [nop,nop,TS val 4187336606 ecr 273818505], length 14480
21:10:04.340092 IP 10.0.0.1.41646 > 10.0.0.3.5001: Flags [P.], seq 3713457:3742417, ack 1, win 83, options [nop,nop,TS val 4187336607 ecr 273818505], length 28960
21:10:04.340180 IP 10.0.0.1.41646 > 10.0.0.3.5001: Flags [P.], seq 3742417:3749657, ack 1, win 83, options [nop,nop,TS val 4187336607 ecr 273818505], length 7240
21:10:04.340250 IP 10.0.0.1.41646 > 10.0.0.3.5001: Flags [P.], seq 3749657:3771377, ack 1, win 83, options [nop,nop,TS val 4187336607 ecr 273818505], length 21720
21:10:04.340392 IP 10.0.0.1.41646 > 10.0.0.3.5001: Flags [P.], seq 3771377:3801089, ack 1, win 83, options [nop,nop,TS val 4187336607 ecr 273818506], length 29712
21:10:05.339537 IP 10.0.0.1.41646 > 10.0.0.3.5001: Flags [P.], seq 3801089:3808329, ack 1, win 83, options [nop,nop,TS val 4187337606 ecr 273818506], length 7240
21:10:05.339712 IP 10.0.0.1.41646 > 10.0.0.3.5001: Flags [P.], seq 3808329:3815569, ack 1, win 83, options [nop,nop,TS val 4187337606 ecr 273818506], length 7240
21:10:05.339881 IP 10.0.0.1.41646 > 10.0.0.3.5001: Flags [P.], seq 3815569:3830049, ack 1, win 83, options [nop,nop,TS val 4187337606 ecr 273819505], length 14480
21:10:05.339969 IP 10.0.0.1.41646 > 10.0.0.3.5001: Flags [P.], seq 3830049:3844529, ack 1, win 83, options [nop,nop,TS val 4187337606 ecr 273819505], length 14480
21:10:05.340107 IP 10.0.0.1.41646 > 10.0.0.3.5001: Flags [P.], seq 3844529:3873489, ack 1, win 83, options [nop,nop,TS val 4187337607 ecr 273819505], length 28960
21:10:05.340197 IP 10.0.0.1.41646 > 10.0.0.3.5001: Flags [P.], seq 3873489:3880729, ack 1, win 83, options [nop,nop,TS val 4187337607 ecr 273819505], length 7240
21:10:05.340270 IP 10.0.0.1.41646 > 10.0.0.3.5001: Flags [P.], seq 3880729:3902449, ack 1, win 83, options [nop,nop,TS val 4187337607 ecr 273819505], length 21720
21:10:05.340416 IP 10.0.0.1.41646 > 10.0.0.3.5001: Flags [P.], seq 3902449:3932161, ack 1, win 83, options [nop,nop,TS val 4187337607 ecr 273819506], length 29712
