21:09:06.261779 IP 10.0.0.1.41644 > 10.0.0.3.5001: Flags [S], seq 2412291814, win 42340, options [mss 1460,sackOK,TS val 4187278506 ecr 0,nop,wscale 9], length 0
21:09:06.265707 IP 10.0.0.1.41644 > 10.0.0.3.5001: Flags [.], ack 1, win 83, options [nop,nop,TS val 4187278532 ecr 273760428], length 0
21:09:06.265946 IP 10.0.0.1.41644 > 10.0.0.3.5001: Flags [P.], seq 1:2897, ack 1, win 83, options [nop,nop,TS val 4187278532 ecr 273760428], length 2896
21:09:06.266068 IP 10.0.0.1.41644 > 10.0.0.3.5001: Flags [P.], seq 2897:5793, ack 1, win 83, options [nop,nop,TS val 4187278533 ecr 273760428], length 2896
21:09:06.266155 IP 10.0.0.1.41644 > 10.0.0.3.5001: Flags [P.], seq 5793:8689, ack 1, win 83, options [nop,nop,TS val 4187278533 ecr 273760428], length 2896
21:09:06.266240 IP 10.0.0.1.41644 > 10.0.0.3.5001: Flags [P.], seq 8689:11585, ack 1, win 83, options [nop,nop,TS val 4187278533 ecr 273760428], length 2896
21:09:06.266328 IP 10.0.0.1.41644 > 10.0.0.3.5001: Flags [P.], seq 11585:14481, ack 1, win 83, options [nop,nop,TS val 4187278533 ecr 273760428], length 2896
21:09:06.270887 IP 10.0.0.1.41644 > 10.0.0.3.5001: Flags [P.], seq 14481:17377, ack 1, win 83, options [nop,nop,TS val 4187278537 ecr 273760431], length 2896
21:09:06.270895 IP 10.0.0.1.41644 > 10.0.0.3.5001: Flags [P.], seq 17377:20273, ack 1, win 83, options [nop,nop,TS val 4187278537 ecr 273760431], length 2896
21:09:06.272760 IP 10.0.0.1.41644 > 10.0.0.3.5001: Flags [P.], seq 20273:23169, ack 1, win 83, options [nop,nop,TS val 4187278539 ecr 273760436], length 2896
21:09:06.272844 IP 10.0.0.1.41644 > 10.0.0.3.5001: Flags [P.], seq 23169:26065, ack 1, win 83, options [nop,nop,TS val 4187278539 ecr 273760436], length 2896
21:09:06.273591 IP 10.0.0.1.41644 > 10.0.0.3.5001: Flags [.], ack 1, win 83, options [nop,nop,TS val 4187278540 ecr 273760438], length 0
21:09:06.275873 IP 10.0.0.1.41644 > 10.0.0.3.5001: Flags [P.], seq 26065:28961, ack 1, win 83, options [nop,nop,TS val 4187278539 ecr 273760436], length 2896
21:09:06.275880 IP 10.0.0.1.41644 > 10.0.0.3.5001: Flags [P.], seq 28961:31857, ack 1, win 83, options [nop,nop,TS val 4187278539 ecr 273760436], length 2896
21:09:06.276104 IP 10.0.0.1.41644 > 10.0.0.3.5001: Flags [P.], seq 31857:34753, ack 1, win 83, options [nop,nop,TS val 4187278543 ecr 273760441], length 2896
21:09:06.276112 IP 10.0.0.1.41644 > 10.0.0.3.5001: Flags [P.], seq 34753:36201, ack 1, win 83, options [nop,nop,TS val 4187278543 ecr 273760441], length 1448
21:09:06.276120 IP 10.0.0.1.41644 > 10.0.0.3.5001: Flags [P.], seq 36201:40545, ack 1, win 83, options [nop,nop,TS val 4187278543 ecr 273760441], length 4344
21:09:06.276415 IP 10.0.0.1.41644 > 10.0.0.3.5001: Flags [P.], seq 40545:44889, ack 1, win 83, options [nop,nop,TS val 4187278543 ecr 273760442], length 4344
21:09:06.276423 IP 10.0.0.1.41644 > 10.0.0.3.5001: Flags [P.], seq 44889:50681, ack 1, win 83, options [nop,nop,TS val 4187278543 ecr 273760442], length 5792
21:09:06.276430 IP 10.0.0.1.41644 > 10.0.0.3.5001: Flags [P.], seq 50681:56473, ack 1, win 83, options [nop,nop,TS val 4187278543 ecr 273760442], length 5792
21:09:06.276744 IP 10.0.0.1.41644 > 10.0.0.3.5001: Flags [P.], seq 56473:57921, ack 1, win 83, options [nop,nop,TS val 4187278543 ecr 273760442], length 1448
21:09:06.276752 IP 10.0.0.1.41644 > 10.0.0.3.5001: Flags [P.], seq 57921:68057, ack 1, win 83, options [nop,nop,TS val 4187278543 ecr 273760442], length 10136
21:09:06.276759 IP 10.0.0.1.41644 > 10.0.0.3.5001: Flags [P.], seq 68057:78193, ack 1, win 83, options [nop,nop,TS val 4187278543 ecr 273760442], length 10136
21:09:06.277190 IP 10.0.0.1.41644 > 10.0.0.3.5001: Flags [P.], seq 78193:79641, ack 1, win 83, options [nop,nop,TS val 4187278544 ecr 273760442], length 1448
21:09:06.277198 IP 10.0.0.1.41644 > 10.0.0.3.5001: Flags [P.], seq 79641:91225, ack 1, win 83, options [nop,nop,TS val 4187278544 ecr 273760442], length 11584
21:09:06.277205 IP 10.0.0.1.41644 > 10.0.0.3.5001: Flags [P.], seq 91225:101361, ack 1, win 83, options [nop,nop,TS val 4187278544 ecr 273760442], length 10136
21:09:06.277490 IP 10.0.0.1.41644 > 10.0.0.3.5001: Flags [P.], seq 101361:112945, ack 1, win 83, options [nop,nop,TS val 4187278544 ecr 273760443], length 11584
21:09:06.277497 IP 10.0.0.1.41644 > 10.0.0.3.5001: Flags [P.], seq 112945:123081, ack 1, win 83, options [nop,nop,TS val 4187278544 ecr 273760443], length 10136
21:09:06.277643 IP 10.0.0.1.41644 > 10.0.0.3.5001: Flags [P.], seq 123081:131073, ack 1, win 83, options [nop,nop,TS val 4187278544 ecr 273760443], length 7992
21:09:07.265990 IP 10.0.0.1.41644 > 10.0.0.3.5001: Flags [P.], seq 131073:138313, ack 1, win 83, options [nop,nop,TS val 4187279532 ecr 273760445], length 7240
21:09:07.266202 IP 10.0.0.1.41644 > 10.0.0.3.5001: Flags [P.], seq 138313:145553, ack 1, win 83, options [nop,nop,TS val 4187279533 ecr 273760445], length 7240
21:09:07.266391 IP 10.0.0.1.41644 > 10.0.0.3.5001: Flags [P.], seq 145553:155689, ack 1, win 83, options [nop,nop,TS val 4187279533 ecr 273761431], length 10136
21:09:07.266483 IP 10.0.0.1.41644 > 10.0.0.3.5001: Flags [P.], seq 155689:160033, ack 1, win 83, options [nop,nop,TS val 4187279533 ecr 273761431], length 4344
21:09:07.266623 IP 10.0.0.1.41644 > 10.0.0.3.5001: Flags [P.], seq 160033:174513, ack 1, win 83, options [nop,nop,TS val 4187279533 ecr 273761432], length 14480
21:09:07.266772 IP 10.0.0.1.41644 > 10.0.0.3.5001: Flags [P.], seq 174513:184649, ack 1, win 83, options [nop,nop,TS val 4187279533 ecr 273761432], length 10136
21:09:07.266863 IP 10.0.0.1.41644 > 10.0.0.3.5001: Flags [P.], seq 184649:212161, ack 1, win 83, options [nop,nop,TS val 4187279533 ecr 273761432], length 27512
21:09:07.266943 IP 10.0.0.1.41644 > 10.0.0.3.5001: Flags [P.], seq 212161:223745, ack 1, win 83, options [nop,nop,TS val 4187279533 ecr 273761432], length 11584
21:09:07.267019 IP 10.0.0.1.41644 > 10.0.0.3.5001: Flags [P.], seq 223745:229537, ack 1, win 83, options [nop,nop,TS val 4187279533 ecr 273761432], length 5792
21:09:07.267190 IP 10.0.0.1.41644 > 10.0.0.3.5001: Flags [P.], seq 229537:258497, ack 1, win 83, options [nop,nop,TS val 4187279534 ecr 273761432], length 28960
21:09:07.267289 IP 10.0.0.1.41644 > 10.0.0.3.5001: Flags [P.], seq 258497:262145, ack 1, win 83, options [nop,nop,TS val 4187279534 ecr 273761432], length 3648
21:09:08.265971 IP 10.0.0.1.41644 > 10.0.0.3.5001: Flags [P.], seq 262145:269385, ack 1, win 83, options [nop,nop,TS val 4187280532 ecr 273761433], length 7240
21:09:08.266155 IP 10.0.0.1.41644 > 10.0.0.3.5001: Flags [P.], seq 269385:276625, ack 1, win 83, options [nop,nop,TS val 4187280533 ecr 273761433], length 7240
21:09:08.266331 IP 10.0.0.1.41644 > 10.0.0.3.5001: Flags [P.], seq 276625:286761, ack 1, win 83, options [nop,nop,TS val 4187280533 ecr 273762431], length 10136
21:09:08.266421 IP 10.0.0.1.41644 > 10.0.0.3.5001: Flags [P.], seq 286761:291105, ack 1, win 83, options [nop,nop,TS val 4187280533 ecr 273762431], length 4344
21:09:08.266558 IP 10.0.0.1.41644 > 10.0.0.3.5001: Flags [P.], seq 291105:305585, ack 1, win 83, options [nop,nop,TS val 4187280533 ecr 273762432], length 14480
21:09:08.266705 IP 10.0.0.1.41644 > 10.0.0.3.5001: Flags [P.], seq 305585:333097, ack 1, win 83, options [nop,nop,TS val 4187280533 ecr 273762432], length 27512
21:09:08.266799 IP 10.0.0.1.41644 > 10.0.0.3.5001: Flags [P.], seq 333097:341785, ack 1, win 83, options [nop,nop,TS val 4187280533 ecr 273762432], length 8688
21:09:08.266873 IP 10.0.0.1.41644 > 10.0.0.3.5001: Flags [P.], seq 341785:360609, ack 1, win 83, options [nop,nop,TS val 4187280533 ecr 273762432], length 18824
21:09:08.267022 IP 10.0.0.1.41644 > 10.0.0.3.5001: Flags [P.], seq 360609:389569, ack 1, win 83, options [nop,nop,TS val 4187280533 ecr 273762432], length 28960
21:09:08.267114 IP 10.0.0.1.41644 > 10.0.0.3.5001: Flags [P.], seq 389569:393217, ack 1, win 83, options [nop,nop,TS val 4187280533 ecr 273762432], length 3648
21:09:09.265980 IP 10.0.0.1.41644 > 10.0.0.3.5001: Flags [P.], seq 393217:400457, ack 1, win 83, options [nop,nop,TS val 4187281532 ecr 273762433], length 7240
21:09:09.266188 IP 10.0.0.1.41644 > 10.0.0.3.5001: Flags [P.], seq 400457:407697, ack 1, win 83, options [nop,nop,TS val 4187281533 ecr 273762433], length 7240
21:09:09.266362 IP 10.0.0.1.41644 > 10.0.0.3.5001: Flags [P.], seq 407697:417833, ack 1, win 83, options [nop,nop,TS val 4187281533 ecr 273763431], length 10136
21:09:09.266451 IP 10.0.0.1.41644 > 10.0.0.3.5001: Flags [P.], seq 417833:422177, ack 1, win 83, options [nop,nop,TS val 4187281533 ecr 273763431], length 4344
21:09:09.266587 IP 10.0.0.1.41644 > 10.0.0.3.5001: Flags [P.], seq 422177:436657, ack 1, win 83, options [nop,nop,TS val 4187281533 ecr 273763432], length 14480
21:09:09.266736 IP 10.0.0.1.41644 > 10.0.0.3.5001: Flags [P.], seq 436657:464169, ack 1, win 83, options [nop,nop,TS val 4187281533 ecr 273763432], length 27512
21:09:09.266829 IP 10.0.0.1.41644 > 10.0.0.3.5001: Flags [P.], seq 464169:472857, ack 1, win 83, options [nop,nop,TS val 4187281533 ecr 273763432], length 8688
21:09:09.266903 IP 10.0.0.1.41644 > 10.0.0.3.5001: Flags [P.], seq 472857:491681, ack 1, win 83, options [nop,nop,TS val 4187281533 ecr 273763432], length 18824
21:09:09.267055 IP 10.0.0.1.41644 > 10.0.0.3.5001: Flags [P.], seq 491681:520641, ack 1, win 83, options [nop,nop,TS val 4187281533 ecr 273763432], length 28960
21:09:09.267148 IP 10.0.0.1.41644 > 10.0.0.3.5001: Flags [P.], seq 520641:524289, ack 1, win 83, options [nop,nop,TS val 4187281533 ecr 273763432], length 3648
21:09:10.265978 IP 10.0.0.1.41644 > 10.0.0.3.5001: Flags [P.], seq 524289:531529, ack 1, win 83, options [nop,nop,TS val 4187282532 ecr 273763433], length 7240
21:09:10.266179 IP 10.0.0.1.41644 > 10.0.0.3.5001: Flags [P.], seq 531529:538769, ack 1, win 83, options [nop,nop,TS val 4187282533 ecr 273763433], length 7240
21:09:10.266355 IP 10.0.0.1.41644 > 10.0.0.3.5001: Flags [P.], seq 538769:548905, ack 1, win 83, options [nop,nop,TS val 4187282533 ecr 273764431], length 10136
21:09:10.266446 IP 10.0.0.1.41644 > 10.0.0.3.5001: Flags [P.], seq 548905:553249, ack 1, win 83, options [nop,nop,TS val 4187282533 ecr 273764431], length 4344
21:09:10.266845 IP 10.0.0.1.41644 > 10.0.0.3.5001: Flags [P.], seq 553249:567729, ack 1, win 83, options [nop,nop,TS val 4187282533 ecr 273764432], length 14480
21:09:10.267089 IP 10.0.0.1.41644 > 10.0.0.3.5001: Flags [P.], seq 567729:595241, ack 1, win 83, options [nop,nop,TS val 4187282534 ecr 273764432], length 27512
21:09:10.267224 IP 10.0.0.1.41644 > 10.0.0.3.5001: Flags [P.], seq 595241:603929, ack 1, win 83, options [nop,nop,TS val 4187282534 ecr 273764432], length 8688
21:09:10.267306 IP 10.0.0.1.41644 > 10.0.0.3.5001: Flags [P.], seq 603929:622753, ack 1, win 83, options [nop,nop,TS val 4187282534 ecr 273764432], length 18824
21:09:10.267503 IP 10.0.0.1.41644 > 10.0.0.3.5001: Flags [P.], seq 622753:651713, ack 1, win 83, options [nop,nop,TS val 4187282534 ecr 273764433], length 28960
21:09:10.267632 IP 10.0.0.1.41644 > 10.0.0.3.5001: Flags [P.], seq 651713:655361, ack 1, win 83, options [nop,nop,TS val 4187282534 ecr 273764433], length 3648
21:09:11.265978 IP 10.0.0.1.41644 > 10.0.0.3.5001: Flags [P.], seq 655361:662601, ack 1, win 83, options [nop,nop,TS val 4187283532 ecr 273764433], length 7240
21:09:11.266159 IP 10.0.0.1.41644 > 10.0.0.3.5001: Flags [P.], seq 662601:669841, ack 1, win 83, options [nop,nop,TS val 4187283533 ecr 273764433], length 7240
21:09:11.266331 IP 10.0.0.1.41644 > 10.0.0.3.5001: Flags [P.], seq 669841:679977, ack 1, win 83, options [nop,nop,TS val 4187283533 ecr 273765431], length 10136
21:09:11.266420 IP 10.0.0.1.41644 > 10.0.0.3.5001: Flags [P.], seq 679977:684321, ack 1, win 83, options [nop,nop,TS val 4187283533 ecr 273765431], length 4344
21:09:11.266556 IP 10.0.0.1.41644 > 10.0.0.3.5001: Flags [P.], seq 684321:698801, ack 1, win 83, options [nop,nop,TS val 4187283533 ecr 273765432], length 14480
21:09:11.266705 IP 10.0.0.1.41644 > 10.0.0.3.5001: Flags [P.], seq 698801:726313, ack 1, win 83, options [nop,nop,TS val 4187283533 ecr 273765432], length 27512
21:09:11.266802 IP 10.0.0.1.41644 > 10.0.0.3.5001: Flags [P.], seq 726313:735001, ack 1, win 83, options [nop,nop,TS val 4187283533 ecr 273765432], length 8688
21:09:11.266877 IP 10.0.0.1.41644 > 10.0.0.3.5001: Flags [P.], seq 735001:753825, ack 1, win 83, options [nop,nop,TS val 4187283533 ecr 273765432], length 18824
21:09:11.267028 IP 10.0.0.1.41644 > 10.0.0.3.5001: Flags [P.], seq 753825:782785, ack 1, win 83, options [nop,nop,TS val 4187283533 ecr 273765432], length 28960
21:09:11.267124 IP 10.0.0.1.41644 > 10.0.0.3.5001: Flags [P.], seq 782785:786433, ack 1, win 83, options [nop,nop,TS val 4187283533 ecr 273765432], length 3648
21:09:12.265969 IP 10.0.0.1.41644 > 10.0.0.3.5001: Flags [P.], seq 786433:793673, ack 1, win 83, options [nop,nop,TS val 4187284532 ecr 273765433], length 7240
21:09:12.266148 IP 10.0.0.1.41644 > 10.0.0.3.5001: Flags [P.], seq 793673:800913, ack 1, win 83, options [nop,nop,TS val 4187284533 ecr 273765433], length 7240
21:09:12.266320 IP 10.0.0.1.41644 > 10.0.0.3.5001: Flags [P.], seq 800913:811049, ack 1, win 83, options [nop,nop,TS val 4187284533 ecr 273766431], length 10136
21:09:12.266465 IP 10.0.0.1.41644 > 10.0.0.3.5001: Flags [P.], seq 811049:825529, ack 1, win 83, options [nop,nop,TS val 4187284533 ecr 273766432], length 14480
21:09:12.266556 IP 10.0.0.1.41644 > 10.0.0.3.5001: Flags [P.], seq 825529:829873, ack 1, win 83, options [nop,nop,TS val 4187284533 ecr 273766432], length 4344
21:09:12.266698 IP 10.0.0.1.41644 > 10.0.0.3.5001: Flags [P.], seq 829873:857385, ack 1, win 83, options [nop,nop,TS val 4187284533 ecr 273766432], length 27512
21:09:12.266793 IP 10.0.0.1.41644 > 10.0.0.3.5001: Flags [P.], seq 857385:866073, ack 1, win 83, options [nop,nop,TS val 4187284533 ecr 273766432], length 8688
21:09:12.266868 IP 10.0.0.1.41644 > 10.0.0.3.5001: Flags [P.], seq 866073:884897, ack 1, win 83, options [nop,nop,TS val 4187284533 ecr 273766432], length 18824
21:09:12.267016 IP 10.0.0.1.41644 > 10.0.0.3.5001: Flags [P.], seq 884897:913857, ack 1, win 83, options [nop,nop,TS val 4187284533 ecr 273766432], length 28960
21:09:12.267111 IP 10.0.0.1.41644 > 10.0.0.3.5001: Flags [P.], seq 913857:917505, ack 1, win 83, options [nop,nop,TS val 4187284533 ecr 273766432], length 3648
21:09:13.265977 IP 10.0.0.1.41644 > 10.0.0.3.5001: Flags [P.], seq 917505:924745, ack 1, win 83, options [nop,nop,TS val 4187285532 ecr 273766433], length 7240
21:09:13.266166 IP 10.0.0.1.41644 > 10.0.0.3.5001: Flags [P.], seq 924745:931985, ack 1, win 83, options [nop,nop,TS val 4187285533 ecr 273766433], length 7240
21:09:13.266339 IP 10.0.0.1.41644 > 10.0.0.3.5001: Flags [P.], seq 931985:942121, ack 1, win 83, options [nop,nop,TS val 4187285533 ecr 273767431], length 10136
21:09:13.266484 IP 10.0.0.1.41644 > 10.0.0.3.5001: Flags [P.], seq 942121:956601, ack 1, win 83, options [nop,nop,TS val 4187285533 ecr 273767432], length 14480
21:09:13.266575 IP 10.0.0.1.41644 > 10.0.0.3.5001: Flags [P.], seq 956601:960945, ack 1, win 83, options [nop,nop,TS val 4187285533 ecr 273767432], length 4344
21:09:13.266713 IP 10.0.0.1.41644 > 10.0.0.3.5001: Flags [P.], seq 960945:988457, ack 1, win 83, options [nop,nop,TS val 4187285533 ecr 273767432], length 27512
21:09:13.266807 IP 10.0.0.1.41644 > 10.0.0.3.5001: Flags [P.], seq 988457:997145, ack 1, win 83, options [nop,nop,TS val 4187285533 ecr 273767432], length 8688
21:09:13.266881 IP 10.0.0.1.41644 > 10.0.0.3.5001: Flags [P.], seq 997145:1015969, ack 1, win 83, options [nop,nop,TS val 4187285533 ecr 273767432], length 18824
21:09:13.267030 IP 10.0.0.1.41644 > 10.0.0.3.5001: Flags [P.], seq 1015969:1044929, ack 1, win 83, options [nop,nop,TS val 4187285533 ecr 273767432], length 28960
21:09:13.267180 IP 10.0.0.1.41644 > 10.0.0.3.5001: Flags [P.], seq 1044929:1048577, ack 1, win 83, options [nop,nop,TS val 4187285533 ecr 273767432], length 3648
21:09:14.265965 IP 10.0.0.1.41644 > 10.0.0.3.5001: Flags [P.], seq 1048577:1055817, ack 1, win 83, options [nop,nop,TS val 4187286532 ecr 273767433], length 7240
21:09:14.266151 IP 10.0.0.1.41644 > 10.0.0.3.5001: Flags [P.], seq 1055817:1063057, ack 1, win 83, options [nop,nop,TS val 4187286533 ecr 273767433], length 7240
21:09:14.266321 IP 10.0.0.1.41644 > 10.0.0.3.5001: Flags [P.], seq 1063057:1073193, ack 1, win 83, options [nop,nop,TS val 4187286533 ecr 273768431], length 10136
21:09:14.266481 IP 10.0.0.1.41644 > 10.0.0.3.5001: Flags [P.], seq 1073193:1087673, ack 1, win 83, options [nop,nop,TS val 4187286533 ecr 273768432], length 14480
21:09:14.266571 IP 10.0.0.1.41644 > 10.0.0.3.5001: Flags [P.], seq 1087673:1092017, ack 1, win 83, options [nop,nop,TS val 4187286533 ecr 273768432], length 4344
21:09:14.266711 IP 10.0.0.1.41644 > 10.0.0.3.5001: Flags [P.], seq 1092017:1119529, ack 1, win 83, options [nop,nop,TS val 4187286533 ecr 273768432], length 27512
21:09:14.266803 IP 10.0.0.1.41644 > 10.0.0.3.5001: Flags [P.], seq 1119529:1128217, ack 1, win 83, options [nop,nop,TS val 4187286533 ecr 273768432], length 8688
21:09:14.266877 IP 10.0.0.1.41644 > 10.0.0.3.5001: Flags [P.], seq 1128217:1147041, ack 1, win 83, options [nop,nop,TS val 4187286533 ecr 273768432], length 18824
21:09:14.267025 IP 10.0.0.1.41644 > 10.0.0.3.5001: Flags [P.], seq 1147041:1177449, ack 1, win 83, options [nop,nop,TS val 4187286533 ecr 273768432], length 30408
21:09:14.267117 IP 10.0.0.1.41644 > 10.0.0.3.5001: Flags [P.], seq 1177449:1179649, ack 1, win 83, options [nop,nop,TS val 4187286533 ecr 273768432], length 2200
21:09:15.265974 IP 10.0.0.1.41644 > 10.0.0.3.5001: Flags [P.], seq 1179649:1186889, ack 1, win 83, options [nop,nop,TS val 4187287532 ecr 273768433], length 7240
21:09:15.266146 IP 10.0.0.1.41644 > 10.0.0.3.5001: Flags [P.], seq 1186889:1194129, ack 1, win 83, options [nop,nop,TS val 4187287533 ecr 273768433], length 7240
21:09:15.266309 IP 10.0.0.1.41644 > 10.0.0.3.5001: Flags [P.], seq 1194129:1204265, ack 1, win 83, options [nop,nop,TS val 4187287533 ecr 273769431], length 10136
21:09:15.266444 IP 10.0.0.1.41644 > 10.0.0.3.5001: Flags [P.], seq 1204265:1218745, ack 1, win 83, options [nop,nop,TS val 4187287533 ecr 273769432], length 14480
21:09:15.266530 IP 10.0.0.1.41644 > 10.0.0.3.5001: Flags [P.], seq 1218745:1223089, ack 1, win 83, options [nop,nop,TS val 4187287533 ecr 273769432], length 4344
21:09:15.266660 IP 10.0.0.1.41644 > 10.0.0.3.5001: Flags [P.], seq 1223089:1250601, ack 1, win 83, options [nop,nop,TS val 4187287533 ecr 273769432], length 27512
21:09:15.266747 IP 10.0.0.1.41644 > 10.0.0.3.5001: Flags [P.], seq 1250601:1259289, ack 1, win 83, options [nop,nop,TS val 4187287533 ecr 273769432], length 8688
21:09:15.266817 IP 10.0.0.1.41644 > 10.0.0.3.5001: Flags [P.], seq 1259289:1278113, ack 1, win 83, options [nop,nop,TS val 4187287533 ecr 273769432], length 18824
21:09:15.266957 IP 10.0.0.1.41644 > 10.0.0.3.5001: Flags [P.], seq 1278113:1308521, ack 1, win 83, options [nop,nop,TS val 4187287533 ecr 273769432], length 30408
21:09:15.267045 IP 10.0.0.1.41644 > 10.0.0.3.5001: Flags [P.], seq 1308521:1310721, ack 1, win 83, options [nop,nop,TS val 4187287533 ecr 273769432], length 2200
21:09:16.266664 IP 10.0.0.1.41644 > 10.0.0.3.5001: Flags [P.], seq 1310721:1317961, ack 1, win 83, options [nop,nop,TS val 4187288533 ecr 273769433], length 7240
21:09:16.268255 IP 10.0.0.1.41644 > 10.0.0.3.5001: Flags [P.], seq 1317961:1325201, ack 1, win 83, options [nop,nop,TS val 4187288534 ecr 273769433], length 7240
21:09:16.268763 IP 10.0.0.1.41644 > 10.0.0.3.5001: Flags [P.], seq 1325201:1335337, ack 1, win 83, options [nop,nop,TS val 4187288535 ecr 273770433], length 10136
21:09:16.268924 IP 10.0.0.1.41644 > 10.0.0.3.5001: Flags [P.], seq 1335337:1349817, ack 1, win 83, options [nop,nop,TS val 4187288535 ecr 273770434], length 14480
21:09:16.269158 IP 10.0.0.1.41644 > 10.0.0.3.5001: Flags [P.], seq 1349817:1354161, ack 1, win 83, options [nop,nop,TS val 4187288535 ecr 273770434], length 4344
21:09:16.269313 IP 10.0.0.1.41644 > 10.0.0.3.5001: Flags [P.], seq 1354161:1380225, ack 1, win 83, options [nop,nop,TS val 4187288536 ecr 273770434], length 26064
21:09:16.269449 IP 10.0.0.1.41644 > 10.0.0.3.5001: Flags [P.], seq 1380225:1390361, ack 1, win 83, options [nop,nop,TS val 4187288536 ecr 273770434], length 10136
21:09:16.269610 IP 10.0.0.1.41644 > 10.0.0.3.5001: Flags [P.], seq 1390361:1409185, ack 1, win 83, options [nop,nop,TS val 4187288536 ecr 273770435], length 18824
21:09:16.269788 IP 10.0.0.1.41644 > 10.0.0.3.5001: Flags [P.], seq 1409185:1441041, ack 1, win 83, options [nop,nop,TS val 4187288536 ecr 273770435], length 31856
21:09:16.269911 IP 10.0.0.1.41644 > 10.0.0.3.5001: Flags [P.], seq 1441041:1441793, ack 1, win 83, options [nop,nop,TS val 4187288536 ecr 273770435], length 752
21:09:17.265965 IP 10.0.0.1.41644 > 10.0.0.3.5001: Flags [P.], seq 1441793:1449033, ack 1, win 83, options [nop,nop,TS val 4187289532 ecr 273770435], length 7240
21:09:17.266136 IP 10.0.0.1.41644 > 10.0.0.3.5001: Flags [P.], seq 1449033:1456273, ack 1, win 83, options [nop,nop,TS val 4187289533 ecr 273770435], length 7240
21:09:17.266305 IP 10.0.0.1.41644 > 10.0.0.3.5001: Flags [P.], seq 1456273:1466409, ack 1, win 83, options [nop,nop,TS val 4187289533 ecr 273771431], length 10136
21:09:17.266394 IP 10.0.0.1.41644 > 10.0.0.3.5001: Flags [P.], seq 1466409:1470753, ack 1, win 83, options [nop,nop,TS val 4187289533 ecr 273771431], length 4344
21:09:17.266530 IP 10.0.0.1.41644 > 10.0.0.3.5001: Flags [P.], seq 1470753:1485233, ack 1, win 83, options [nop,nop,TS val 4187289533 ecr 273771432], length 14480
21:09:17.266676 IP 10.0.0.1.41644 > 10.0.0.3.5001: Flags [P.], seq 1485233:1512745, ack 1, win 83, options [nop,nop,TS val 4187289533 ecr 273771432], length 27512
21:09:17.266769 IP 10.0.0.1.41644 > 10.0.0.3.5001: Flags [P.], seq 1512745:1521433, ack 1, win 83, options [nop,nop,TS val 4187289533 ecr 273771432], length 8688
21:09:17.266843 IP 10.0.0.1.41644 > 10.0.0.3.5001: Flags [P.], seq 1521433:1540257, ack 1, win 83, options [nop,nop,TS val 4187289533 ecr 273771432], length 18824
21:09:17.266990 IP 10.0.0.1.41644 > 10.0.0.3.5001: Flags [P.], seq 1540257:1572113, ack 1, win 83, options [nop,nop,TS val 4187289533 ecr 273771432], length 31856
21:09:17.267082 IP 10.0.0.1.41644 > 10.0.0.3.5001: Flags [P.], seq 1572113:1572865, ack 1, win 83, options [nop,nop,TS val 4187289533 ecr 273771432], length 752
21:09:18.265993 IP 10.0.0.1.41644 > 10.0.0.3.5001: Flags [P.], seq 1572865:1580105, ack 1, win 83, options [nop,nop,TS val 4187290532 ecr 273771433], length 7240
21:09:18.266188 IP 10.0.0.1.41644 > 10.0.0.3.5001: Flags [P.], seq 1580105:1587345, ack 1, win 83, options [nop,nop,TS val 4187290533 ecr 273771433], length 7240
21:09:18.266361 IP 10.0.0.1.41644 > 10.0.0.3.5001: Flags [P.], seq 1587345:1597481, ack 1, win 83, options [nop,nop,TS val 4187290533 ecr 273772431], length 10136
21:09:18.266505 IP 10.0.0.1.41644 > 10.0.0.3.5001: Flags [P.], seq 1597481:1611961, ack 1, win 83, options [nop,nop,TS val 4187290533 ecr 273772432], length 14480
21:09:18.266596 IP 10.0.0.1.41644 > 10.0.0.3.5001: Flags [P.], seq 1611961:1616305, ack 1, win 83, options [nop,nop,TS val 4187290533 ecr 273772432], length 4344
21:09:18.266743 IP 10.0.0.1.41644 > 10.0.0.3.5001: Flags [P.], seq 1616305:1643817, ack 1, win 83, options [nop,nop,TS val 4187290533 ecr 273772432], length 27512
21:09:18.266885 IP 10.0.0.1.41644 > 10.0.0.3.5001: Flags [P.], seq 1643817:1652505, ack 1, win 83, options [nop,nop,TS val 4187290533 ecr 273772432], length 8688
21:09:18.266983 IP 10.0.0.1.41644 > 10.0.0.3.5001: Flags [P.], seq 1652505:1671329, ack 1, win 83, options [nop,nop,TS val 4187290533 ecr 273772432], length 18824
21:09:18.267340 IP 10.0.0.1.41644 > 10.0.0.3.5001: Flags [P.], seq 1671329:1703185, ack 1, win 83, options [nop,nop,TS val 4187290534 ecr 273772432], length 31856
21:09:18.267481 IP 10.0.0.1.41644 > 10.0.0.3.5001: Flags [P.], seq 1703185:1703937, ack 1, win 83, options [nop,nop,TS val 4187290534 ecr 273772432], length 752
21:09:19.265967 IP 10.0.0.1.41644 > 10.0.0.3.5001: Flags [P.], seq 1703937:1711177, ack 1, win 83, options [nop,nop,TS val 4187291532 ecr 273772433], length 7240
21:09:19.266153 IP 10.0.0.1.41644 > 10.0.0.3.5001: Flags [P.], seq 1711177:1718417, ack 1, win 83, options [nop,nop,TS val 4187291533 ecr 273772433], length 7240
21:09:19.266324 IP 10.0.0.1.41644 > 10.0.0.3.5001: Flags [P.], seq 1718417:1728553, ack 1, win 83, options [nop,nop,TS val 4187291533 ecr 273773431], length 10136
21:09:19.266483 IP 10.0.0.1.41644 > 10.0.0.3.5001: Flags [P.], seq 1728553:1743033, ack 1, win 83, options [nop,nop,TS val 4187291533 ecr 273773432], length 14480
21:09:19.266573 IP 10.0.0.1.41644 > 10.0.0.3.5001: Flags [P.], seq 1743033:1747377, ack 1, win 83, options [nop,nop,TS val 4187291533 ecr 273773432], length 4344
21:09:19.266711 IP 10.0.0.1.41644 > 10.0.0.3.5001: Flags [P.], seq 1747377:1774889, ack 1, win 83, options [nop,nop,TS val 4187291533 ecr 273773432], length 27512
21:09:19.266804 IP 10.0.0.1.41644 > 10.0.0.3.5001: Flags [P.], seq 1774889:1783577, ack 1, win 83, options [nop,nop,TS val 4187291533 ecr 273773432], length 8688
21:09:19.266878 IP 10.0.0.1.41644 > 10.0.0.3.5001: Flags [P.], seq 1783577:1803849, ack 1, win 83, options [nop,nop,TS val 4187291533 ecr 273773432], length 20272
21:09:19.267026 IP 10.0.0.1.41644 > 10.0.0.3.5001: Flags [P.], seq 1803849:1835009, ack 1, win 83, options [nop,nop,TS val 4187291533 ecr 273773432], length 31160
21:09:20.265965 IP 10.0.0.1.41644 > 10.0.0.3.5001: Flags [P.], seq 1835009:1842249, ack 1, win 83, options [nop,nop,TS val 4187292532 ecr 273773433], length 7240
21:09:20.266133 IP 10.0.0.1.41644 > 10.0.0.3.5001: Flags [P.], seq 1842249:1849489, ack 1, win 83, options [nop,nop,TS val 4187292533 ecr 273773433], length 7240
21:09:20.266298 IP 10.0.0.1.41644 > 10.0.0.3.5001: Flags [P.], seq 1849489:1859625, ack 1, win 83, options [nop,nop,TS val 4187292533 ecr 273774431], length 10136
21:09:20.266438 IP 10.0.0.1.41644 > 10.0.0.3.5001: Flags [P.], seq 1859625:1874105, ack 1, win 83, options [nop,nop,TS val 4187292533 ecr 273774432], length 14480
21:09:20.266526 IP 10.0.0.1.41644 > 10.0.0.3.5001: Flags [P.], seq 1874105:1878449, ack 1, win 83, options [nop,nop,TS val 4187292533 ecr 273774432], length 4344
21:09:20.266659 IP 10.0.0.1.41644 > 10.0.0.3.5001: Flags [P.], seq 1878449:1905961, ack 1, win 83, options [nop,nop,TS val 4187292533 ecr 273774432], length 27512
21:09:20.266749 IP 10.0.0.1.41644 > 10.0.0.3.5001: Flags [P.], seq 1905961:1914649, ack 1, win 83, options [nop,nop,TS val 4187292533 ecr 273774432], length 8688
21:09:20.266821 IP 10.0.0.1.41644 > 10.0.0.3.5001: Flags [P.], seq 1914649:1934921, ack 1, win 83, options [nop,nop,TS val 4187292533 ecr 273774432], length 20272
21:09:20.266964 IP 10.0.0.1.41644 > 10.0.0.3.5001: Flags [P.], seq 1934921:1966081, ack 1, win 83, options [nop,nop,TS val 4187292533 ecr 273774432], length 31160
21:09:21.265959 IP 10.0.0.1.41644 > 10.0.0.3.5001: Flags [P.], seq 1966081:1973321, ack 1, win 83, options [nop,nop,TS val 4187293532 ecr 273774432], length 7240
21:09:21.266128 IP 10.0.0.1.41644 > 10.0.0.3.5001: Flags [P.], seq 1973321:1980561, ack 1, win 83, options [nop,nop,TS val 4187293533 ecr 273774432], length 7240
21:09:21.266294 IP 10.0.0.1.41644 > 10.0.0.3.5001: Flags [P.], seq 1980561:1990697, ack 1, win 83, options [nop,nop,TS val 4187293533 ecr 273775431], length 10136
21:09:21.266435 IP 10.0.0.1.41644 > 10.0.0.3.5001: Flags [P.], seq 1990697:2005177, ack 1, win 83, options [nop,nop,TS val 4187293533 ecr 273775432], length 14480
21:09:21.266523 IP 10.0.0.1.41644 > 10.0.0.3.5001: Flags [P.], seq 2005177:2009521, ack 1, win 83, options [nop,nop,TS val 4187293533 ecr 273775432], length 4344
21:09:21.266657 IP 10.0.0.1.41644 > 10.0.0.3.5001: Flags [P.], seq 2009521:2037033, ack 1, win 83, options [nop,nop,TS val 4187293533 ecr 273775432], length 27512
21:09:21.266747 IP 10.0.0.1.41644 > 10.0.0.3.5001: Flags [P.], seq 2037033:2045721, ack 1, win 83, options [nop,nop,TS val 4187293533 ecr 273775432], length 8688
21:09:21.266819 IP 10.0.0.1.41644 > 10.0.0.3.5001: Flags [P.], seq 2045721:2065993, ack 1, win 83, options [nop,nop,TS val 4187293533 ecr 273775432], length 20272
21:09:21.266963 IP 10.0.0.1.41644 > 10.0.0.3.5001: Flags [P.], seq 2065993:2097153, ack 1, win 83, options [nop,nop,TS val 4187293533 ecr 273775432], length 31160
21:09:22.265955 IP 10.0.0.1.41644 > 10.0.0.3.5001: Flags [P.], seq 2097153:2104393, ack 1, win 83, options [nop,nop,TS val 4187294532 ecr 273775432], length 7240
21:09:22.266161 IP 10.0.0.1.41644 > 10.0.0.3.5001: Flags [P.], seq 2104393:2111633, ack 1, win 83, options [nop,nop,TS val 4187294533 ecr 273775432], length 7240
21:09:22.266329 IP 10.0.0.1.41644 > 10.0.0.3.5001: Flags [P.], seq 2111633:2121769, ack 1, win 83, options [nop,nop,TS val 4187294533 ecr 273776431], length 10136
21:09:22.266469 IP 10.0.0.1.41644 > 10.0.0.3.5001: Flags [P.], seq 2121769:2136249, ack 1, win 83, options [nop,nop,TS val 4187294533 ecr 273776432], length 14480
21:09:22.266556 IP 10.0.0.1.41644 > 10.0.0.3.5001: Flags [P.], seq 2136249:2140593, ack 1, win 83, options [nop,nop,TS val 4187294533 ecr 273776432], length 4344
21:09:22.266688 IP 10.0.0.1.41644 > 10.0.0.3.5001: Flags [P.], seq 2140593:2168105, ack 1, win 83, options [nop,nop,TS val 4187294533 ecr 273776432], length 27512
21:09:22.266779 IP 10.0.0.1.41644 > 10.0.0.3.5001: Flags [P.], seq 2168105:2176793, ack 1, win 83, options [nop,nop,TS val 4187294533 ecr 273776432], length 8688
21:09:22.266850 IP 10.0.0.1.41644 > 10.0.0.3.5001: Flags [P.], seq 2176793:2195617, ack 1, win 83, options [nop,nop,TS val 4187294533 ecr 273776432], length 18824
21:09:22.266994 IP 10.0.0.1.41644 > 10.0.0.3.5001: Flags [P.], seq 2195617:2228225, ack 1, win 83, options [nop,nop,TS val 4187294533 ecr 273776432], length 32608
21:09:23.265965 IP 10.0.0.1.41644 > 10.0.0.3.5001: Flags [P.], seq 2228225:2235465, ack 1, win 83, options [nop,nop,TS val 4187295532 ecr 273776432], length 7240
21:09:23.266138 IP 10.0.0.1.41644 > 10.0.0.3.5001: Flags [P.], seq 2235465:2242705, ack 1, win 83, options [nop,nop,TS val 4187295533 ecr 273776432], length 7240
21:09:23.266305 IP 10.0.0.1.41644 > 10.0.0.3.5001: Flags [P.], seq 2242705:2252841, ack 1, win 83, options [nop,nop,TS val 4187295533 ecr 273777431], length 10136
21:09:23.266445 IP 10.0.0.1.41644 > 10.0.0.3.5001: Flags [P.], seq 2252841:2267321, ack 1, win 83, options [nop,nop,TS val 4187295533 ecr 273777432], length 14480
21:09:23.266533 IP 10.0.0.1.41644 > 10.0.0.3.5001: Flags [P.], seq 2267321:2271665, ack 1, win 83, options [nop,nop,TS val 4187295533 ecr 273777432], length 4344
21:09:23.266666 IP 10.0.0.1.41644 > 10.0.0.3.5001: Flags [P.], seq 2271665:2299177, ack 1, win 83, options [nop,nop,TS val 4187295533 ecr 273777432], length 27512
21:09:23.266756 IP 10.0.0.1.41644 > 10.0.0.3.5001: Flags [P.], seq 2299177:2307865, ack 1, win 83, options [nop,nop,TS val 4187295533 ecr 273777432], length 8688
21:09:23.266828 IP 10.0.0.1.41644 > 10.0.0.3.5001: Flags [P.], seq 2307865:2326689, ack 1, win 83, options [nop,nop,TS val 4187295533 ecr 273777432], length 18824
21:09:23.266972 IP 10.0.0.1.41644 > 10.0.0.3.5001: Flags [P.], seq 2326689:2359297, ack 1, win 83, options [nop,nop,TS val 4187295533 ecr 273777432], length 32608
21:09:24.265975 IP 10.0.0.1.41644 > 10.0.0.3.5001: Flags [P.], seq 2359297:2366537, ack 1, win 83, options [nop,nop,TS val 4187296532 ecr 273777432], length 7240
21:09:24.266147 IP 10.0.0.1.41644 > 10.0.0.3.5001: Flags [P.], seq 2366537:2373777, ack 1, win 83, options [nop,nop,TS val 4187296533 ecr 273777432], length 7240
21:09:24.266311 IP 10.0.0.1.41644 > 10.0.0.3.5001: Flags [P.], seq 2373777:2383913, ack 1, win 83, options [nop,nop,TS val 4187296533 ecr 273778431], length 10136
21:09:24.266447 IP 10.0.0.1.41644 > 10.0.0.3.5001: Flags [P.], seq 2383913:2398393, ack 1, win 83, options [nop,nop,TS val 4187296533 ecr 273778432], length 14480
21:09:24.266533 IP 10.0.0.1.41644 > 10.0.0.3.5001: Flags [P.], seq 2398393:2402737, ack 1, win 83, options [nop,nop,TS val 4187296533 ecr 273778432], length 4344
21:09:24.266663 IP 10.0.0.1.41644 > 10.0.0.3.5001: Flags [P.], seq 2402737:2430249, ack 1, win 83, options [nop,nop,TS val 4187296533 ecr 273778432], length 27512
21:09:24.266751 IP 10.0.0.1.41644 > 10.0.0.3.5001: Flags [P.], seq 2430249:2438937, ack 1, win 83, options [nop,nop,TS val 4187296533 ecr 273778432], length 8688
21:09:24.266821 IP 10.0.0.1.41644 > 10.0.0.3.5001: Flags [P.], seq 2438937:2457761, ack 1, win 83, options [nop,nop,TS val 4187296533 ecr 273778432], length 18824
21:09:24.266976 IP 10.0.0.1.41644 > 10.0.0.3.5001: Flags [P.], seq 2457761:2490369, ack 1, win 83, options [nop,nop,TS val 4187296533 ecr 273778432], length 32608
21:09:25.265968 IP 10.0.0.1.41644 > 10.0.0.3.5001: Flags [P.], seq 2490369:2497609, ack 1, win 83, options [nop,nop,TS val 4187297532 ecr 273778432], length 7240
21:09:25.266144 IP 10.0.0.1.41644 > 10.0.0.3.5001: Flags [P.], seq 2497609:2504849, ack 1, win 83, options [nop,nop,TS val 4187297533 ecr 273778432], length 7240
21:09:25.266312 IP 10.0.0.1.41644 > 10.0.0.3.5001: Flags [P.], seq 2504849:2514985, ack 1, win 83, options [nop,nop,TS val 4187297533 ecr 273779431], length 10136
21:09:25.266452 IP 10.0.0.1.41644 > 10.0.0.3.5001: Flags [P.], seq 2514985:2529465, ack 1, win 83, options [nop,nop,TS val 4187297533 ecr 273779432], length 14480
21:09:25.266540 IP 10.0.0.1.41644 > 10.0.0.3.5001: Flags [P.], seq 2529465:2533809, ack 1, win 83, options [nop,nop,TS val 4187297533 ecr 273779432], length 4344
21:09:25.266674 IP 10.0.0.1.41644 > 10.0.0.3.5001: Flags [P.], seq 2533809:2561321, ack 1, win 83, options [nop,nop,TS val 4187297533 ecr 273779432], length 27512
21:09:25.266765 IP 10.0.0.1.41644 > 10.0.0.3.5001: Flags [P.], seq 2561321:2570009, ack 1, win 83, options [nop,nop,TS val 4187297533 ecr 273779432], length 8688
21:09:25.266837 IP 10.0.0.1.41644 > 10.0.0.3.5001: Flags [P.], seq 2570009:2588833, ack 1, win 83, options [nop,nop,TS val 4187297533 ecr 273779432], length 18824
21:09:25.266981 IP 10.0.0.1.41644 > 10.0.0.3.5001: Flags [P.], seq 2588833:2621441, ack 1, win 83, options [nop,nop,TS val 4187297533 ecr 273779432], length 32608
