19:05:42.562948 IP 10.0.0.1.34711 > 10.0.0.3.5001: UDP, length 1470
19:05:42.574112 IP 10.0.0.1.34711 > 10.0.0.3.5001: UDP, length 1470
19:05:42.585343 IP 10.0.0.1.34711 > 10.0.0.3.5001: UDP, length 1470
19:05:42.596549 IP 10.0.0.1.34711 > 10.0.0.3.5001: UDP, length 1470
19:05:42.607675 IP 10.0.0.1.34711 > 10.0.0.3.5001: UDP, length 1470
19:05:42.619291 IP 10.0.0.1.34711 > 10.0.0.3.5001: UDP, length 1470
19:05:42.630065 IP 10.0.0.1.34711 > 10.0.0.3.5001: UDP, length 1470
19:05:42.641470 IP 10.0.0.1.34711 > 10.0.0.3.5001: UDP, length 1470
19:05:42.652710 IP 10.0.0.1.34711 > 10.0.0.3.5001: UDP, length 1470
19:05:42.663607 IP 10.0.0.1.34711 > 10.0.0.3.5001: UDP, length 1470
19:05:42.675328 IP 10.0.0.1.34711 > 10.0.0.3.5001: UDP, length 1470
19:05:42.686780 IP 10.0.0.1.34711 > 10.0.0.3.5001: UDP, length 1470
19:05:42.697300 IP 10.0.0.1.34711 > 10.0.0.3.5001: UDP, length 1470
19:05:42.708502 IP 10.0.0.1.34711 > 10.0.0.3.5001: UDP, length 1470
19:05:42.719614 IP 10.0.0.1.34711 > 10.0.0.3.5001: UDP, length 1470
19:05:42.730930 IP 10.0.0.1.34711 > 10.0.0.3.5001: UDP, length 1470
19:05:42.742330 IP 10.0.0.1.34711 > 10.0.0.3.5001: UDP, length 1470
19:05:42.753479 IP 10.0.0.1.34711 > 10.0.0.3.5001: UDP, length 1470
19:05:42.764605 IP 10.0.0.1.34711 > 10.0.0.3.5001: UDP, length 1470
19:05:42.775796 IP 10.0.0.1.34711 > 10.0.0.3.5001: UDP, length 1470
19:05:42.787112 IP 10.0.0.1.34711 > 10.0.0.3.5001: UDP, length 1470
19:05:42.798048 IP 10.0.0.1.34711 > 10.0.0.3.5001: UDP, length 1470
19:05:42.809672 IP 10.0.0.1.34711 > 10.0.0.3.5001: UDP, length 1470
19:05:42.820810 IP 10.0.0.1.34711 > 10.0.0.3.5001: UDP, length 1470
19:05:42.831892 IP 10.0.0.1.34711 > 10.0.0.3.5001: UDP, length 1470
19:05:42.842906 IP 10.0.0.1.34711 > 10.0.0.3.5001: UDP, length 1470
19:05:42.854489 IP 10.0.0.1.34711 > 10.0.0.3.5001: UDP, length 1470
19:05:42.865427 IP 10.0.0.1.34711 > 10.0.0.3.5001: UDP, length 1470
19:05:42.877082 IP 10.0.0.1.34711 > 10.0.0.3.5001: UDP, length 1470
19:05:42.888159 IP 10.0.0.1.34711 > 10.0.0.3.5001: UDP, length 1470
19:05:42.899345 IP 10.0.0.1.34711 > 10.0.0.3.5001: UDP, length 1470
19:05:42.910351 IP 10.0.0.1.34711 > 10.0.0.3.5001: UDP, length 1470
19:05:42.921717 IP 10.0.0.1.34711 > 10.0.0.3.5001: UDP, length 1470
19:05:42.932945 IP 10.0.0.1.34711 > 10.0.0.3.5001: UDP, length 1470
19:05:42.943929 IP 10.0.0.1.34711 > 10.0.0.3.5001: UDP, length 1470
19:05:42.955145 IP 10.0.0.1.34711 > 10.0.0.3.5001: UDP, length 1470
19:05:42.966311 IP 10.0.0.1.34711 > 10.0.0.3.5001: UDP, length 1470
19:05:42.977942 IP 10.0.0.1.34711 > 10.0.0.3.5001: UDP, length 1470
19:05:42.989146 IP 10.0.0.1.34711 > 10.0.0.3.5001: UDP, length 1470
19:05:43.000172 IP 10.0.0.1.34711 > 10.0.0.3.5001: UDP, length 1470
19:05:43.011306 IP 10.0.0.1.34711 > 10.0.0.3.5001: UDP, length 1470
19:05:43.022989 IP 10.0.0.1.34711 > 10.0.0.3.5001: UDP, length 1470
19:05:43.034034 IP 10.0.0.1.34711 > 10.0.0.3.5001: UDP, length 1470
19:05:43.045212 IP 10.0.0.1.34711 > 10.0.0.3.5001: UDP, length 1470
19:05:43.056120 IP 10.0.0.1.34711 > 10.0.0.3.5001: UDP, length 1470
19:05:43.067340 IP 10.0.0.1.34711 > 10.0.0.3.5001: UDP, length 1470
19:05:43.079023 IP 10.0.0.1.34711 > 10.0.0.3.5001: UDP, length 1470
19:05:43.090168 IP 10.0.0.1.34711 > 10.0.0.3.5001: UDP, length 1470
19:05:43.101279 IP 10.0.0.1.34711 > 10.0.0.3.5001: UDP, length 1470
19:05:43.112377 IP 10.0.0.1.34711 > 10.0.0.3.5001: UDP, length 1470
19:05:43.123364 IP 10.0.0.1.34711 > 10.0.0.3.5001: UDP, length 1470
19:05:43.135127 IP 10.0.0.1.34711 > 10.0.0.3.5001: UDP, length 1470
19:05:43.146226 IP 10.0.0.1.34711 > 10.0.0.3.5001: UDP, length 1470
19:05:43.157300 IP 10.0.0.1.34711 > 10.0.0.3.5001: UDP, length 1470
19:05:43.168484 IP 10.0.0.1.34711 > 10.0.0.3.5001: UDP, length 1470
19:05:43.179445 IP 10.0.0.1.34711 > 10.0.0.3.5001: UDP, length 1470
19:05:43.191156 IP 10.0.0.1.34711 > 10.0.0.3.5001: UDP, length 1470
19:05:43.202318 IP 10.0.0.1.34711 > 10.0.0.3.5001: UDP, length 1470
19:05:43.213121 IP 10.0.0.1.34711 > 10.0.0.3.5001: UDP, length 1470
19:05:43.224370 IP 10.0.0.1.34711 > 10.0.0.3.5001: UDP, length 1470
19:05:43.235639 IP 10.0.0.1.34711 > 10.0.0.3.5001: UDP, length 1470
19:05:43.247196 IP 10.0.0.1.34711 > 10.0.0.3.5001: UDP, length 1470
19:05:43.258385 IP 10.0.0.1.34711 > 10.0.0.3.5001: UDP, length 1470
19:05:43.269135 IP 10.0.0.1.34711 > 10.0.0.3.5001: UDP, length 1470
19:05:43.280705 IP 10.0.0.1.34711 > 10.0.0.3.5001: UDP, length 1470
19:05:43.292422 IP 10.0.0.1.34711 > 10.0.0.3.5001: UDP, length 1470
19:05:43.303495 IP 10.0.0.1.34711 > 10.0.0.3.5001: UDP, length 1470
19:05:43.314686 IP 10.0.0.1.34711 > 10.0.0.3.5001: UDP, length 1470
19:05:43.325964 IP 10.0.0.1.34711 > 10.0.0.3.5001: UDP, length 1470
19:05:43.336648 IP 10.0.0.1.34711 > 10.0.0.3.5001: UDP, length 1470
19:05:43.347959 IP 10.0.0.1.34711 > 10.0.0.3.5001: UDP, length 1470
19:05:43.359378 IP 10.0.0.1.34711 > 10.0.0.3.5001: UDP, length 1470
19:05:43.370278 IP 10.0.0.1.34711 > 10.0.0.3.5001: UDP, length 1470
19:05:43.381604 IP 10.0.0.1.34711 > 10.0.0.3.5001: UDP, length 1470
19:05:43.392859 IP 10.0.0.1.34711 > 10.0.0.3.5001: UDP, length 1470
19:05:43.403963 IP 10.0.0.1.34711 > 10.0.0.3.5001: UDP, length 1470
19:05:43.415254 IP 10.0.0.1.34711 > 10.0.0.3.5001: UDP, length 1470
19:05:43.426764 IP 10.0.0.1.34711 > 10.0.0.3.5001: UDP, length 1470
19:05:43.437807 IP 10.0.0.1.34711 > 10.0.0.3.5001: UDP, length 1470
19:05:43.448807 IP 10.0.0.1.34711 > 10.0.0.3.5001: UDP, length 1470
19:05:43.459854 IP 10.0.0.1.34711 > 10.0.0.3.5001: UDP, length 1470
19:05:43.471067 IP 10.0.0.1.34711 > 10.0.0.3.5001: UDP, length 1470
19:05:43.482893 IP 10.0.0.1.34711 > 10.0.0.3.5001: UDP, length 1470
19:05:43.493941 IP 10.0.0.1.34711 > 10.0.0.3.5001: UDP, length 1470
19:05:43.504991 IP 10.0.0.1.34711 > 10.0.0.3.5001: UDP, length 1470
19:05:43.516032 IP 10.0.0.1.34711 > 10.0.0.3.5001: UDP, length 1470
19:05:43.527259 IP 10.0.0.1.34711 > 10.0.0.3.5001: UDP, length 1470
19:05:43.538690 IP 10.0.0.1.34711 > 10.0.0.3.5001: UDP, length 1470
19:05:43.550078 IP 10.0.0.1.34711 > 10.0.0.3.5001: UDP, length 1470
19:05:43.561088 IP 10.0.0.1.34711 > 10.0.0.3.5001: UDP, length 1470
19:05:43.572196 IP 10.0.0.1.34711 > 10.0.0.3.5001: UDP, length 1470
19:05:43.583209 IP 10.0.0.1.34711 > 10.0.0.3.5001: UDP, length 1470
19:05:43.594985 IP 10.0.0.1.34711 > 10.0.0.3.5001: UDP, length 1470
19:05:43.606067 IP 10.0.0.1.34711 > 10.0.0.3.5001: UDP, length 1470
19:05:43.616969 IP 10.0.0.1.34711 > 10.0.0.3.5001: UDP, length 1470
19:05:43.628266 IP 10.0.0.1.34711 > 10.0.0.3.5001: UDP, length 1470
19:05:43.639285 IP 10.0.0.1.34711 > 10.0.0.3.5001: UDP, length 1470
19:05:43.651010 IP 10.0.0.1.34711 > 10.0.0.3.5001: UDP, length 1470
19:05:43.662066 IP 10.0.0.1.34711 > 10.0.0.3.5001: UDP, length 1470
19:05:43.673285 IP 10.0.0.1.34711 > 10.0.0.3.5001: UDP, length 1470
19:05:43.684381 IP 10.0.0.1.34711 > 10.0.0.3.5001: UDP, length 1470
19:05:43.695366 IP 10.0.0.1.34711 > 10.0.0.3.5001: UDP, length 1470
19:05:43.706780 IP 10.0.0.1.34711 > 10.0.0.3.5001: UDP, length 1470
19:05:43.717968 IP 10.0.0.1.34711 > 10.0.0.3.5001: UDP, length 1470
19:05:43.729306 IP 10.0.0.1.34711 > 10.0.0.3.5001: UDP, length 1470
19:05:43.740275 IP 10.0.0.1.34711 > 10.0.0.3.5001: UDP, length 1470
19:05:43.751322 IP 10.0.0.1.34711 > 10.0.0.3.5001: UDP, length 1470
19:05:43.763308 IP 10.0.0.1.34711 > 10.0.0.3.5001: UDP, length 1470
19:05:43.774320 IP 10.0.0.1.34711 > 10.0.0.3.5001: UDP, length 1470
19:05:43.785501 IP 10.0.0.1.34711 > 10.0.0.3.5001: UDP, length 1470
19:05:43.796576 IP 10.0.0.1.34711 > 10.0.0.3.5001: UDP, length 1470
19:05:43.807639 IP 10.0.0.1.34711 > 10.0.0.3.5001: UDP, length 1470
19:05:43.818984 IP 10.0.0.1.34711 > 10.0.0.3.5001: UDP, length 1470
19:05:43.830412 IP 10.0.0.1.34711 > 10.0.0.3.5001: UDP, length 1470
19:05:43.841302 IP 10.0.0.1.34711 > 10.0.0.3.5001: UDP, length 1470
19:05:43.852564 IP 10.0.0.1.34711 > 10.0.0.3.5001: UDP, length 1470
19:05:43.863782 IP 10.0.0.1.34711 > 10.0.0.3.5001: UDP, length 1470
19:05:43.875126 IP 10.0.0.1.34711 > 10.0.0.3.5001: UDP, length 1470
19:05:43.886541 IP 10.0.0.1.34711 > 10.0.0.3.5001: UDP, length 1470
19:05:43.897737 IP 10.0.0.1.34711 > 10.0.0.3.5001: UDP, length 1470
19:05:43.908715 IP 10.0.0.1.34711 > 10.0.0.3.5001: UDP, length 1470
19:05:43.919765 IP 10.0.0.1.34711 > 10.0.0.3.5001: UDP, length 1470
19:05:43.931317 IP 10.0.0.1.34711 > 10.0.0.3.5001: UDP, length 1470
19:05:43.942258 IP 10.0.0.1.34711 > 10.0.0.3.5001: UDP, length 1470
19:05:43.953547 IP 10.0.0.1.34711 > 10.0.0.3.5001: UDP, length 1470
19:05:43.964644 IP 10.0.0.1.34711 > 10.0.0.3.5001: UDP, length 1470
19:05:43.975752 IP 10.0.0.1.34711 > 10.0.0.3.5001: UDP, length 1470
19:05:43.987306 IP 10.0.0.1.34711 > 10.0.0.3.5001: UDP, length 1470
19:05:43.998787 IP 10.0.0.1.34711 > 10.0.0.3.5001: UDP, length 1470
19:05:44.009587 IP 10.0.0.1.34711 > 10.0.0.3.5001: UDP, length 1470
19:05:44.020805 IP 10.0.0.1.34711 > 10.0.0.3.5001: UDP, length 1470
19:05:44.032014 IP 10.0.0.1.34711 > 10.0.0.3.5001: UDP, length 1470
19:05:44.043056 IP 10.0.0.1.34711 > 10.0.0.3.5001: UDP, length 1470
19:05:44.054717 IP 10.0.0.1.34711 > 10.0.0.3.5001: UDP, length 1470
19:05:44.065834 IP 10.0.0.1.34711 > 10.0.0.3.5001: UDP, length 1470
19:05:44.076973 IP 10.0.0.1.34711 > 10.0.0.3.5001: UDP, length 1470
19:05:44.087887 IP 10.0.0.1.34711 > 10.0.0.3.5001: UDP, length 1470
19:05:44.099343 IP 10.0.0.1.34711 > 10.0.0.3.5001: UDP, length 1470
19:05:44.110817 IP 10.0.0.1.34711 > 10.0.0.3.5001: UDP, length 1470
19:05:44.121748 IP 10.0.0.1.34711 > 10.0.0.3.5001: UDP, length 1470
19:05:44.132990 IP 10.0.0.1.34711 > 10.0.0.3.5001: UDP, length 1470
19:05:44.144224 IP 10.0.0.1.34711 > 10.0.0.3.5001: UDP, length 1470
19:05:44.155384 IP 10.0.0.1.34711 > 10.0.0.3.5001: UDP, length 1470
19:05:44.166835 IP 10.0.0.1.34711 > 10.0.0.3.5001: UDP, length 1470
19:05:44.177569 IP 10.0.0.1.34711 > 10.0.0.3.5001: UDP, length 1470
19:05:44.189035 IP 10.0.0.1.34711 > 10.0.0.3.5001: UDP, length 1470
19:05:44.200258 IP 10.0.0.1.34711 > 10.0.0.3.5001: UDP, length 1470
19:05:44.211548 IP 10.0.0.1.34711 > 10.0.0.3.5001: UDP, length 1470
19:05:44.222953 IP 10.0.0.1.34711 > 10.0.0.3.5001: UDP, length 1470
19:05:44.234089 IP 10.0.0.1.34711 > 10.0.0.3.5001: UDP, length 1470
19:05:44.244939 IP 10.0.0.1.34711 > 10.0.0.3.5001: UDP, length 1470
19:05:44.256295 IP 10.0.0.1.34711 > 10.0.0.3.5001: UDP, length 1470
19:05:44.267355 IP 10.0.0.1.34711 > 10.0.0.3.5001: UDP, length 1470
19:05:44.278931 IP 10.0.0.1.34711 > 10.0.0.3.5001: UDP, length 1470
19:05:44.290097 IP 10.0.0.1.34711 > 10.0.0.3.5001: UDP, length 1470
19:05:44.301251 IP 10.0.0.1.34711 > 10.0.0.3.5001: UDP, length 1470
19:05:44.312346 IP 10.0.0.1.34711 > 10.0.0.3.5001: UDP, length 1470
19:05:44.323391 IP 10.0.0.1.34711 > 10.0.0.3.5001: UDP, length 1470
19:05:44.334903 IP 10.0.0.1.34711 > 10.0.0.3.5001: UDP, length 1470
19:05:44.345926 IP 10.0.0.1.34711 > 10.0.0.3.5001: UDP, length 1470
19:05:44.357358 IP 10.0.0.1.34711 > 10.0.0.3.5001: UDP, length 1470
19:05:44.368466 IP 10.0.0.1.34711 > 10.0.0.3.5001: UDP, length 1470
19:05:44.379493 IP 10.0.0.1.34711 > 10.0.0.3.5001: UDP, length 1470
19:05:44.391273 IP 10.0.0.1.34711 > 10.0.0.3.5001: UDP, length 1470
19:05:44.402330 IP 10.0.0.1.34711 > 10.0.0.3.5001: UDP, length 1470
19:05:44.413437 IP 10.0.0.1.34711 > 10.0.0.3.5001: UDP, length 1470
19:05:44.424539 IP 10.0.0.1.34711 > 10.0.0.3.5001: UDP, length 1470
19:05:44.435563 IP 10.0.0.1.34711 > 10.0.0.3.5001: UDP, length 1470
19:05:44.447319 IP 10.0.0.1.34711 > 10.0.0.3.5001: UDP, length 1470
19:05:44.458428 IP 10.0.0.1.34711 > 10.0.0.3.5001: UDP, length 1470
19:05:44.469189 IP 10.0.0.1.34711 > 10.0.0.3.5001: UDP, length 1470
19:05:44.480657 IP 10.0.0.1.34711 > 10.0.0.3.5001: UDP, length 1470
19:05:44.491787 IP 10.0.0.1.34711 > 10.0.0.3.5001: UDP, length 1470
19:05:44.503296 IP 10.0.0.1.34711 > 10.0.0.3.5001: UDP, length 1470
19:05:44.514507 IP 10.0.0.1.34711 > 10.0.0.3.5001: UDP, length 1470
19:05:44.525785 IP 10.0.0.1.34711 > 10.0.0.3.5001: UDP, length 1470
19:05:44.536790 IP 10.0.0.1.34711 > 10.0.0.3.5001: UDP, length 1470
19:05:44.547779 IP 10.0.0.1.34711 > 10.0.0.3.5001: UDP, length 1470
19:05:44.559112 IP 10.0.0.1.34711 > 10.0.0.3.5001: UDP, length 1470
19:05:44.570698 IP 10.0.0.1.34711 > 10.0.0.3.5001: UDP, length 1470
19:05:44.581806 IP 10.0.0.1.34711 > 10.0.0.3.5001: UDP, length 1470
19:05:44.592675 IP 10.0.0.1.34711 > 10.0.0.3.5001: UDP, length 1470
19:05:44.603835 IP 10.0.0.1.34711 > 10.0.0.3.5001: UDP, length 1470
19:05:44.615304 IP 10.0.0.1.34711 > 10.0.0.3.5001: UDP, length 1470
19:05:44.626504 IP 10.0.0.1.34711 > 10.0.0.3.5001: UDP, length 1470
19:05:44.637725 IP 10.0.0.1.34711 > 10.0.0.3.5001: UDP, length 1470
19:05:44.648865 IP 10.0.0.1.34711 > 10.0.0.3.5001: UDP, length 1470
19:05:44.660048 IP 10.0.0.1.34711 > 10.0.0.3.5001: UDP, length 1470
19:05:44.671176 IP 10.0.0.1.34711 > 10.0.0.3.5001: UDP, length 1470
19:05:44.682882 IP 10.0.0.1.34711 > 10.0.0.3.5001: UDP, length 1470
19:05:44.693903 IP 10.0.0.1.34711 > 10.0.0.3.5001: UDP, length 1470
19:05:44.705028 IP 10.0.0.1.34711 > 10.0.0.3.5001: UDP, length 1470
19:05:44.716120 IP 10.0.0.1.34711 > 10.0.0.3.5001: UDP, length 1470
19:05:44.727352 IP 10.0.0.1.34711 > 10.0.0.3.5001: UDP, length 1470
19:05:44.738791 IP 10.0.0.1.34711 > 10.0.0.3.5001: UDP, length 1470
19:05:44.750024 IP 10.0.0.1.34711 > 10.0.0.3.5001: UDP, length 1470
19:05:44.761078 IP 10.0.0.1.34711 > 10.0.0.3.5001: UDP, length 1470
19:05:44.772884 IP 10.0.0.1.34711 > 10.0.0.3.5001: UDP, length 1470
19:05:44.783948 IP 10.0.0.1.34711 > 10.0.0.3.5001: UDP, length 1470
19:05:44.794530 IP 10.0.0.1.34711 > 10.0.0.3.5001: UDP, length 1470
19:05:44.805684 IP 10.0.0.1.34711 > 10.0.0.3.5001: UDP, length 1470
19:05:44.817822 IP 10.0.0.1.34711 > 10.0.0.3.5001: UDP, length 1470
19:05:44.828637 IP 10.0.0.1.34711 > 10.0.0.3.5001: UDP, length 1470
19:05:44.839225 IP 10.0.0.1.34711 > 10.0.0.3.5001: UDP, length 1470
19:05:44.850939 IP 10.0.0.1.34711 > 10.0.0.3.5001: UDP, length 1470
19:05:44.861925 IP 10.0.0.1.34711 > 10.0.0.3.5001: UDP, length 1470
19:05:44.873274 IP 10.0.0.1.34711 > 10.0.0.3.5001: UDP, length 1470
19:05:44.884641 IP 10.0.0.1.34711 > 10.0.0.3.5001: UDP, length 1470
19:05:44.896141 IP 10.0.0.1.34711 > 10.0.0.3.5001: UDP, length 1470
19:05:44.906842 IP 10.0.0.1.34711 > 10.0.0.3.5001: UDP, length 1470
19:05:44.918359 IP 10.0.0.1.34711 > 10.0.0.3.5001: UDP, length 1470
19:05:44.929419 IP 10.0.0.1.34711 > 10.0.0.3.5001: UDP, length 1470
19:05:44.940633 IP 10.0.0.1.34711 > 10.0.0.3.5001: UDP, length 1470
19:05:44.951460 IP 10.0.0.1.34711 > 10.0.0.3.5001: UDP, length 1470
19:05:44.962759 IP 10.0.0.1.34711 > 10.0.0.3.5001: UDP, length 1470
19:05:44.974170 IP 10.0.0.1.34711 > 10.0.0.3.5001: UDP, length 1470
19:05:44.985490 IP 10.0.0.1.34711 > 10.0.0.3.5001: UDP, length 1470
19:05:44.996608 IP 10.0.0.1.34711 > 10.0.0.3.5001: UDP, length 1470
19:05:45.007634 IP 10.0.0.1.34711 > 10.0.0.3.5001: UDP, length 1470
19:05:45.019319 IP 10.0.0.1.34711 > 10.0.0.3.5001: UDP, length 1470
19:05:45.030575 IP 10.0.0.1.34711 > 10.0.0.3.5001: UDP, length 1470
19:05:45.041401 IP 10.0.0.1.34711 > 10.0.0.3.5001: UDP, length 1470
19:05:45.052630 IP 10.0.0.1.34711 > 10.0.0.3.5001: UDP, length 1470
19:05:45.063808 IP 10.0.0.1.34711 > 10.0.0.3.5001: UDP, length 1470
19:05:45.075114 IP 10.0.0.1.34711 > 10.0.0.3.5001: UDP, length 1470
19:05:45.086543 IP 10.0.0.1.34711 > 10.0.0.3.5001: UDP, length 1470
19:05:45.097664 IP 10.0.0.1.34711 > 10.0.0.3.5001: UDP, length 1470
19:05:45.108663 IP 10.0.0.1.34711 > 10.0.0.3.5001: UDP, length 1470
19:05:45.119769 IP 10.0.0.1.34711 > 10.0.0.3.5001: UDP, length 1470
19:05:45.130967 IP 10.0.0.1.34711 > 10.0.0.3.5001: UDP, length 1470
19:05:45.142350 IP 10.0.0.1.34711 > 10.0.0.3.5001: UDP, length 1470
19:05:45.153665 IP 10.0.0.1.34711 > 10.0.0.3.5001: UDP, length 1470
19:05:45.164810 IP 10.0.0.1.34711 > 10.0.0.3.5001: UDP, length 1470
19:05:45.175886 IP 10.0.0.1.34711 > 10.0.0.3.5001: UDP, length 1470
19:05:45.187300 IP 10.0.0.1.34711 > 10.0.0.3.5001: UDP, length 1470
19:05:45.198766 IP 10.0.0.1.34711 > 10.0.0.3.5001: UDP, length 1470
19:05:45.209816 IP 10.0.0.1.34711 > 10.0.0.3.5001: UDP, length 1470
19:05:45.220972 IP 10.0.0.1.34711 > 10.0.0.3.5001: UDP, length 1470
19:05:45.232288 IP 10.0.0.1.34711 > 10.0.0.3.5001: UDP, length 1470
19:05:45.245088 IP 10.0.0.1.34711 > 10.0.0.3.5001: UDP, length 1470
19:05:45.254771 IP 10.0.0.1.34711 > 10.0.0.3.5001: UDP, length 1470
19:05:45.265790 IP 10.0.0.1.34711 > 10.0.0.3.5001: UDP, length 1470
19:05:45.276891 IP 10.0.0.1.34711 > 10.0.0.3.5001: UDP, length 1470
19:05:45.287989 IP 10.0.0.1.34711 > 10.0.0.3.5001: UDP, length 1470
19:05:45.299393 IP 10.0.0.1.34711 > 10.0.0.3.5001: UDP, length 1470
19:05:45.310390 IP 10.0.0.1.34711 > 10.0.0.3.5001: UDP, length 1470
19:05:45.322486 IP 10.0.0.1.34711 > 10.0.0.3.5001: UDP, length 1470
19:05:45.333878 IP 10.0.0.1.34711 > 10.0.0.3.5001: UDP, length 1470
19:05:45.344457 IP 10.0.0.1.34711 > 10.0.0.3.5001: UDP, length 1470
19:05:45.356385 IP 10.0.0.1.34711 > 10.0.0.3.5001: UDP, length 1470
19:05:45.367134 IP 10.0.0.1.34711 > 10.0.0.3.5001: UDP, length 1470
19:05:45.377948 IP 10.0.0.1.34711 > 10.0.0.3.5001: UDP, length 1470
19:05:45.389025 IP 10.0.0.1.34711 > 10.0.0.3.5001: UDP, length 1470
19:05:45.400205 IP 10.0.0.1.34711 > 10.0.0.3.5001: UDP, length 1470
19:05:45.411218 IP 10.0.0.1.34711 > 10.0.0.3.5001: UDP, length 1470
19:05:45.423060 IP 10.0.0.1.34711 > 10.0.0.3.5001: UDP, length 1470
19:05:45.434090 IP 10.0.0.1.34711 > 10.0.0.3.5001: UDP, length 1470
19:05:45.445254 IP 10.0.0.1.34711 > 10.0.0.3.5001: UDP, length 1470
19:05:45.456347 IP 10.0.0.1.34711 > 10.0.0.3.5001: UDP, length 1470
19:05:45.467416 IP 10.0.0.1.34711 > 10.0.0.3.5001: UDP, length 1470
19:05:45.478963 IP 10.0.0.1.34711 > 10.0.0.3.5001: UDP, length 1470
19:05:45.490123 IP 10.0.0.1.34711 > 10.0.0.3.5001: UDP, length 1470
19:05:45.501299 IP 10.0.0.1.34711 > 10.0.0.3.5001: UDP, length 1470
19:05:45.512442 IP 10.0.0.1.34711 > 10.0.0.3.5001: UDP, length 1470
19:05:45.523336 IP 10.0.0.1.34711 > 10.0.0.3.5001: UDP, length 1470
19:05:45.535209 IP 10.0.0.1.34711 > 10.0.0.3.5001: UDP, length 1470
19:05:45.546268 IP 10.0.0.1.34711 > 10.0.0.3.5001: UDP, length 1470
19:05:45.557602 IP 10.0.0.1.34711 > 10.0.0.3.5001: UDP, length 1470
19:05:45.568475 IP 10.0.0.1.34711 > 10.0.0.3.5001: UDP, length 1470
19:05:45.579505 IP 10.0.0.1.34711 > 10.0.0.3.5001: UDP, length 1470
19:05:45.591262 IP 10.0.0.1.34711 > 10.0.0.3.5001: UDP, length 1470
19:05:45.602135 IP 10.0.0.1.34711 > 10.0.0.3.5001: UDP, length 1470
19:05:45.613415 IP 10.0.0.1.34711 > 10.0.0.3.5001: UDP, length 1470
19:05:45.624573 IP 10.0.0.1.34711 > 10.0.0.3.5001: UDP, length 1470
19:05:45.635768 IP 10.0.0.1.34711 > 10.0.0.3.5001: UDP, length 1470
19:05:45.647160 IP 10.0.0.1.34711 > 10.0.0.3.5001: UDP, length 1470
19:05:45.658404 IP 10.0.0.1.34711 > 10.0.0.3.5001: UDP, length 1470
19:05:45.669630 IP 10.0.0.1.34711 > 10.0.0.3.5001: UDP, length 1470
19:05:45.680677 IP 10.0.0.1.34711 > 10.0.0.3.5001: UDP, length 1470
19:05:45.691739 IP 10.0.0.1.34711 > 10.0.0.3.5001: UDP, length 1470
19:05:45.703423 IP 10.0.0.1.34711 > 10.0.0.3.5001: UDP, length 1470
19:05:45.714218 IP 10.0.0.1.34711 > 10.0.0.3.5001: UDP, length 1470
19:05:45.725622 IP 10.0.0.1.34711 > 10.0.0.3.5001: UDP, length 1470
19:05:45.736749 IP 10.0.0.1.34711 > 10.0.0.3.5001: UDP, length 1470
19:05:45.747804 IP 10.0.0.1.34711 > 10.0.0.3.5001: UDP, length 1470
19:05:45.759318 IP 10.0.0.1.34711 > 10.0.0.3.5001: UDP, length 1470
19:05:45.770300 IP 10.0.0.1.34711 > 10.0.0.3.5001: UDP, length 1470
19:05:45.781664 IP 10.0.0.1.34711 > 10.0.0.3.5001: UDP, length 1470
19:05:45.792850 IP 10.0.0.1.34711 > 10.0.0.3.5001: UDP, length 1470
19:05:45.803984 IP 10.0.0.1.34711 > 10.0.0.3.5001: UDP, length 1470
19:05:45.815057 IP 10.0.0.1.34711 > 10.0.0.3.5001: UDP, length 1470
19:05:45.826278 IP 10.0.0.1.34711 > 10.0.0.3.5001: UDP, length 1470
19:05:45.837610 IP 10.0.0.1.34711 > 10.0.0.3.5001: UDP, length 1470
19:05:45.848694 IP 10.0.0.1.34711 > 10.0.0.3.5001: UDP, length 1470
19:05:45.859870 IP 10.0.0.1.34711 > 10.0.0.3.5001: UDP, length 1470
19:05:45.871316 IP 10.0.0.1.34711 > 10.0.0.3.5001: UDP, length 1470
19:05:45.882819 IP 10.0.0.1.34711 > 10.0.0.3.5001: UDP, length 1470
19:05:45.894053 IP 10.0.0.1.34711 > 10.0.0.3.5001: UDP, length 1470
19:05:45.905015 IP 10.0.0.1.34711 > 10.0.0.3.5001: UDP, length 1470
19:05:45.916124 IP 10.0.0.1.34711 > 10.0.0.3.5001: UDP, length 1470
19:05:45.927397 IP 10.0.0.1.34711 > 10.0.0.3.5001: UDP, length 1470
19:05:45.938386 IP 10.0.0.1.34711 > 10.0.0.3.5001: UDP, length 1470
19:05:45.949942 IP 10.0.0.1.34711 > 10.0.0.3.5001: UDP, length 1470
19:05:45.961128 IP 10.0.0.1.34711 > 10.0.0.3.5001: UDP, length 1470
19:05:45.972160 IP 10.0.0.1.34711 > 10.0.0.3.5001: UDP, length 1470
19:05:45.983257 IP 10.0.0.1.34711 > 10.0.0.3.5001: UDP, length 1470
19:05:45.995053 IP 10.0.0.1.34711 > 10.0.0.3.5001: UDP, length 1470
19:05:46.006070 IP 10.0.0.1.34711 > 10.0.0.3.5001: UDP, length 1470
19:05:46.017182 IP 10.0.0.1.34711 > 10.0.0.3.5001: UDP, length 1470
19:05:46.028265 IP 10.0.0.1.34711 > 10.0.0.3.5001: UDP, length 1470
19:05:46.039327 IP 10.0.0.1.34711 > 10.0.0.3.5001: UDP, length 1470
19:05:46.051071 IP 10.0.0.1.34711 > 10.0.0.3.5001: UDP, length 1470
19:05:46.061671 IP 10.0.0.1.34711 > 10.0.0.3.5001: UDP, length 1470
19:05:46.073261 IP 10.0.0.1.34711 > 10.0.0.3.5001: UDP, length 1470
19:05:46.084354 IP 10.0.0.1.34711 > 10.0.0.3.5001: UDP, length 1470
19:05:46.095614 IP 10.0.0.1.34711 > 10.0.0.3.5001: UDP, length 1470
19:05:46.106850 IP 10.0.0.1.34711 > 10.0.0.3.5001: UDP, length 1470
19:05:46.118250 IP 10.0.0.1.34711 > 10.0.0.3.5001: UDP, length 1470
19:05:46.129377 IP 10.0.0.1.34711 > 10.0.0.3.5001: UDP, length 1470
19:05:46.140485 IP 10.0.0.1.34711 > 10.0.0.3.5001: UDP, length 1470
19:05:46.151539 IP 10.0.0.1.34711 > 10.0.0.3.5001: UDP, length 1470
19:05:46.162824 IP 10.0.0.1.34711 > 10.0.0.3.5001: UDP, length 1470
19:05:46.174286 IP 10.0.0.1.34711 > 10.0.0.3.5001: UDP, length 1470
19:05:46.185387 IP 10.0.0.1.34711 > 10.0.0.3.5001: UDP, length 1470
19:05:46.196531 IP 10.0.0.1.34711 > 10.0.0.3.5001: UDP, length 1470
19:05:46.207559 IP 10.0.0.1.34711 > 10.0.0.3.5001: UDP, length 1470
19:05:46.219299 IP 10.0.0.1.34711 > 10.0.0.3.5001: UDP, length 1470
19:05:46.230347 IP 10.0.0.1.34711 > 10.0.0.3.5001: UDP, length 1470
19:05:46.241964 IP 10.0.0.1.34711 > 10.0.0.3.5001: UDP, length 1470
19:05:46.252607 IP 10.0.0.1.34711 > 10.0.0.3.5001: UDP, length 1470
19:05:46.263798 IP 10.0.0.1.34711 > 10.0.0.3.5001: UDP, length 1470
19:05:46.275088 IP 10.0.0.1.34711 > 10.0.0.3.5001: UDP, length 1470
19:05:46.286327 IP 10.0.0.1.34711 > 10.0.0.3.5001: UDP, length 1470
19:05:46.297646 IP 10.0.0.1.34711 > 10.0.0.3.5001: UDP, length 1470
19:05:46.308719 IP 10.0.0.1.34711 > 10.0.0.3.5001: UDP, length 1470
19:05:46.322278 IP 10.0.0.1.34711 > 10.0.0.3.5001: UDP, length 1470
19:05:46.331166 IP 10.0.0.1.34711 > 10.0.0.3.5001: UDP, length 1470
19:05:46.342232 IP 10.0.0.1.34711 > 10.0.0.3.5001: UDP, length 1470
19:05:46.353535 IP 10.0.0.1.34711 > 10.0.0.3.5001: UDP, length 1470
19:05:46.364622 IP 10.0.0.1.34711 > 10.0.0.3.5001: UDP, length 1470
19:05:46.375898 IP 10.0.0.1.34711 > 10.0.0.3.5001: UDP, length 1470
19:05:46.387341 IP 10.0.0.1.34711 > 10.0.0.3.5001: UDP, length 1470
19:05:46.398639 IP 10.0.0.1.34711 > 10.0.0.3.5001: UDP, length 1470
19:05:46.409688 IP 10.0.0.1.34711 > 10.0.0.3.5001: UDP, length 1470
19:05:46.420849 IP 10.0.0.1.34711 > 10.0.0.3.5001: UDP, length 1470
19:05:46.432019 IP 10.0.0.1.34711 > 10.0.0.3.5001: UDP, length 1470
19:05:46.443070 IP 10.0.0.1.34711 > 10.0.0.3.5001: UDP, length 1470
19:05:46.454988 IP 10.0.0.1.34711 > 10.0.0.3.5001: UDP, length 1470
19:05:46.465740 IP 10.0.0.1.34711 > 10.0.0.3.5001: UDP, length 1470
19:05:46.477147 IP 10.0.0.1.34711 > 10.0.0.3.5001: UDP, length 1470
19:05:46.488087 IP 10.0.0.1.34711 > 10.0.0.3.5001: UDP, length 1470
19:05:46.499329 IP 10.0.0.1.34711 > 10.0.0.3.5001: UDP, length 1470
19:05:46.510667 IP 10.0.0.1.34711 > 10.0.0.3.5001: UDP, length 1470
19:05:46.521899 IP 10.0.0.1.34711 > 10.0.0.3.5001: UDP, length 1470
19:05:46.533033 IP 10.0.0.1.34711 > 10.0.0.3.5001: UDP, length 1470
19:05:46.544185 IP 10.0.0.1.34711 > 10.0.0.3.5001: UDP, length 1470
19:05:46.555270 IP 10.0.0.1.34711 > 10.0.0.3.5001: UDP, length 1470
19:05:46.566501 IP 10.0.0.1.34711 > 10.0.0.3.5001: UDP, length 1470
19:05:46.577785 IP 10.0.0.1.34711 > 10.0.0.3.5001: UDP, length 1470
19:05:46.588987 IP 10.0.0.1.34711 > 10.0.0.3.5001: UDP, length 1470
19:05:46.600252 IP 10.0.0.1.34711 > 10.0.0.3.5001: UDP, length 1470
19:05:46.611277 IP 10.0.0.1.34711 > 10.0.0.3.5001: UDP, length 1470
19:05:46.623089 IP 10.0.0.1.34711 > 10.0.0.3.5001: UDP, length 1470
19:05:46.634129 IP 10.0.0.1.34711 > 10.0.0.3.5001: UDP, length 1470
19:05:46.645222 IP 10.0.0.1.34711 > 10.0.0.3.5001: UDP, length 1470
19:05:46.656240 IP 10.0.0.1.34711 > 10.0.0.3.5001: UDP, length 1470
19:05:46.667381 IP 10.0.0.1.34711 > 10.0.0.3.5001: UDP, length 1470
19:05:46.679111 IP 10.0.0.1.34711 > 10.0.0.3.5001: UDP, length 1470
19:05:46.690234 IP 10.0.0.1.34711 > 10.0.0.3.5001: UDP, length 1470
19:05:46.701315 IP 10.0.0.1.34711 > 10.0.0.3.5001: UDP, length 1470
19:05:46.712483 IP 10.0.0.1.34711 > 10.0.0.3.5001: UDP, length 1470
19:05:46.723441 IP 10.0.0.1.34711 > 10.0.0.3.5001: UDP, length 1470
19:05:46.734994 IP 10.0.0.1.34711 > 10.0.0.3.5001: UDP, length 1470
19:05:46.746184 IP 10.0.0.1.34711 > 10.0.0.3.5001: UDP, length 1470
19:05:46.757392 IP 10.0.0.1.34711 > 10.0.0.3.5001: UDP, length 1470
19:05:46.768385 IP 10.0.0.1.34711 > 10.0.0.3.5001: UDP, length 1470
19:05:46.779569 IP 10.0.0.1.34711 > 10.0.0.3.5001: UDP, length 1470
19:05:46.791393 IP 10.0.0.1.34711 > 10.0.0.3.5001: UDP, length 1470
19:05:46.802117 IP 10.0.0.1.34711 > 10.0.0.3.5001: UDP, length 1470
19:05:46.813489 IP 10.0.0.1.34711 > 10.0.0.3.5001: UDP, length 1470
19:05:46.824606 IP 10.0.0.1.34711 > 10.0.0.3.5001: UDP, length 1470
19:05:46.835564 IP 10.0.0.1.34711 > 10.0.0.3.5001: UDP, length 1470
19:05:46.846810 IP 10.0.0.1.34711 > 10.0.0.3.5001: UDP, length 1470
19:05:46.858038 IP 10.0.0.1.34711 > 10.0.0.3.5001: UDP, length 1470
19:05:46.869456 IP 10.0.0.1.34711 > 10.0.0.3.5001: UDP, length 1470
19:05:46.881310 IP 10.0.0.1.34711 > 10.0.0.3.5001: UDP, length 1470
19:05:46.892283 IP 10.0.0.1.34711 > 10.0.0.3.5001: UDP, length 1470
19:05:46.903190 IP 10.0.0.1.34711 > 10.0.0.3.5001: UDP, length 1470
19:05:46.914700 IP 10.0.0.1.34711 > 10.0.0.3.5001: UDP, length 1470
19:05:46.925849 IP 10.0.0.1.34711 > 10.0.0.3.5001: UDP, length 1470
19:05:46.936811 IP 10.0.0.1.34711 > 10.0.0.3.5001: UDP, length 1470
19:05:46.947976 IP 10.0.0.1.34711 > 10.0.0.3.5001: UDP, length 1470
19:05:46.959125 IP 10.0.0.1.34711 > 10.0.0.3.5001: UDP, length 1470
19:05:46.970396 IP 10.0.0.1.34711 > 10.0.0.3.5001: UDP, length 1470
19:05:46.981750 IP 10.0.0.1.34711 > 10.0.0.3.5001: UDP, length 1470
19:05:46.992713 IP 10.0.0.1.34711 > 10.0.0.3.5001: UDP, length 1470
19:05:47.003965 IP 10.0.0.1.34711 > 10.0.0.3.5001: UDP, length 1470
19:05:47.015128 IP 10.0.0.1.34711 > 10.0.0.3.5001: UDP, length 1470
19:05:47.026453 IP 10.0.0.1.34711 > 10.0.0.3.5001: UDP, length 1470
19:05:47.037535 IP 10.0.0.1.34711 > 10.0.0.3.5001: UDP, length 1470
19:05:47.048971 IP 10.0.0.1.34711 > 10.0.0.3.5001: UDP, length 1470
19:05:47.060092 IP 10.0.0.1.34711 > 10.0.0.3.5001: UDP, length 1470
19:05:47.071254 IP 10.0.0.1.34711 > 10.0.0.3.5001: UDP, length 1470
19:05:47.082901 IP 10.0.0.1.34711 > 10.0.0.3.5001: UDP, length 1470
19:05:47.093840 IP 10.0.0.1.34711 > 10.0.0.3.5001: UDP, length 1470
19:05:47.105098 IP 10.0.0.1.34711 > 10.0.0.3.5001: UDP, length 1470
19:05:47.116202 IP 10.0.0.1.34711 > 10.0.0.3.5001: UDP, length 1470
19:05:47.127286 IP 10.0.0.1.34711 > 10.0.0.3.5001: UDP, length 1470
19:05:47.138948 IP 10.0.0.1.34711 > 10.0.0.3.5001: UDP, length 1470
19:05:47.149971 IP 10.0.0.1.34711 > 10.0.0.3.5001: UDP, length 1470
19:05:47.161094 IP 10.0.0.1.34711 > 10.0.0.3.5001: UDP, length 1470
19:05:47.172244 IP 10.0.0.1.34711 > 10.0.0.3.5001: UDP, length 1470
19:05:47.183283 IP 10.0.0.1.34711 > 10.0.0.3.5001: UDP, length 1470
19:05:47.194764 IP 10.0.0.1.34711 > 10.0.0.3.5001: UDP, length 1470
19:05:47.206061 IP 10.0.0.1.34711 > 10.0.0.3.5001: UDP, length 1470
19:05:47.217238 IP 10.0.0.1.34711 > 10.0.0.3.5001: UDP, length 1470
19:05:47.228360 IP 10.0.0.1.34711 > 10.0.0.3.5001: UDP, length 1470
19:05:47.239401 IP 10.0.0.1.34711 > 10.0.0.3.5001: UDP, length 1470
19:05:47.250866 IP 10.0.0.1.34711 > 10.0.0.3.5001: UDP, length 1470
19:05:47.262248 IP 10.0.0.1.34711 > 10.0.0.3.5001: UDP, length 1470
19:05:47.273806 IP 10.0.0.1.34711 > 10.0.0.3.5001: UDP, length 1470
19:05:47.284447 IP 10.0.0.1.34711 > 10.0.0.3.5001: UDP, length 1470
19:05:47.295459 IP 10.0.0.1.34711 > 10.0.0.3.5001: UDP, length 1470
19:05:47.307202 IP 10.0.0.1.34711 > 10.0.0.3.5001: UDP, length 1470
19:05:47.318274 IP 10.0.0.1.34711 > 10.0.0.3.5001: UDP, length 1470
19:05:47.329379 IP 10.0.0.1.34711 > 10.0.0.3.5001: UDP, length 1470
19:05:47.340550 IP 10.0.0.1.34711 > 10.0.0.3.5001: UDP, length 1470
19:05:47.351568 IP 10.0.0.1.34711 > 10.0.0.3.5001: UDP, length 1470
19:05:47.362831 IP 10.0.0.1.34711 > 10.0.0.3.5001: UDP, length 1470
19:05:47.374324 IP 10.0.0.1.34711 > 10.0.0.3.5001: UDP, length 1470
19:05:47.385534 IP 10.0.0.1.34711 > 10.0.0.3.5001: UDP, length 1470
19:05:47.396630 IP 10.0.0.1.34711 > 10.0.0.3.5001: UDP, length 1470
19:05:47.407632 IP 10.0.0.1.34711 > 10.0.0.3.5001: UDP, length 1470
19:05:47.419193 IP 10.0.0.1.34711 > 10.0.0.3.5001: UDP, length 1470
19:05:47.430504 IP 10.0.0.1.34711 > 10.0.0.3.5001: UDP, length 1470
19:05:47.441444 IP 10.0.0.1.34711 > 10.0.0.3.5001: UDP, length 1470
19:05:47.452604 IP 10.0.0.1.34711 > 10.0.0.3.5001: UDP, length 1470
19:05:47.463613 IP 10.0.0.1.34711 > 10.0.0.3.5001: UDP, length 1470
19:05:47.474967 IP 10.0.0.1.34711 > 10.0.0.3.5001: UDP, length 1470
19:05:47.486811 IP 10.0.0.1.34711 > 10.0.0.3.5001: UDP, length 1470
19:05:47.497368 IP 10.0.0.1.34711 > 10.0.0.3.5001: UDP, length 1470
19:05:47.508735 IP 10.0.0.1.34711 > 10.0.0.3.5001: UDP, length 1470
19:05:47.519954 IP 10.0.0.1.34711 > 10.0.0.3.5001: UDP, length 1470
19:05:47.531153 IP 10.0.0.1.34711 > 10.0.0.3.5001: UDP, length 1470
19:05:47.542488 IP 10.0.0.1.34711 > 10.0.0.3.5001: UDP, length 1470
19:05:47.553963 IP 10.0.0.1.34711 > 10.0.0.3.5001: UDP, length 1470
19:05:47.805424 IP 10.0.0.1.34711 > 10.0.0.3.5001: UDP, length 1470
19:05:48.056287 IP 10.0.0.1.34711 > 10.0.0.3.5001: UDP, length 1470
19:05:48.307632 IP 10.0.0.1.34711 > 10.0.0.3.5001: UDP, length 1470
19:05:48.558749 IP 10.0.0.1.34711 > 10.0.0.3.5001: UDP, length 1470
19:05:48.809558 IP 10.0.0.1.34711 > 10.0.0.3.5001: UDP, length 1470
19:05:49.060819 IP 10.0.0.1.34711 > 10.0.0.3.5001: UDP, length 1470
19:05:49.312486 IP 10.0.0.1.34711 > 10.0.0.3.5001: UDP, length 1470
19:05:49.563175 IP 10.0.0.1.34711 > 10.0.0.3.5001: UDP, length 1470
19:05:49.814356 IP 10.0.0.1.34711 > 10.0.0.3.5001: UDP, length 1470
hoge
19:06:15.141451 IP 10.0.0.1.54965 > 10.0.0.4.5001: UDP, length 1470
19:06:15.153164 IP 10.0.0.1.54965 > 10.0.0.4.5001: UDP, length 1470
19:06:15.164517 IP 10.0.0.1.54965 > 10.0.0.4.5001: UDP, length 1470
19:06:15.175091 IP 10.0.0.1.54965 > 10.0.0.4.5001: UDP, length 1470
19:06:15.186367 IP 10.0.0.1.54965 > 10.0.0.4.5001: UDP, length 1470
19:06:15.197813 IP 10.0.0.1.54965 > 10.0.0.4.5001: UDP, length 1470
19:06:15.208823 IP 10.0.0.1.54965 > 10.0.0.4.5001: UDP, length 1470
19:06:15.220093 IP 10.0.0.1.54965 > 10.0.0.4.5001: UDP, length 1470
19:06:15.231014 IP 10.0.0.1.54965 > 10.0.0.4.5001: UDP, length 1470
19:06:15.242513 IP 10.0.0.1.54965 > 10.0.0.4.5001: UDP, length 1470
19:06:15.253940 IP 10.0.0.1.54965 > 10.0.0.4.5001: UDP, length 1470
19:06:15.264999 IP 10.0.0.1.54965 > 10.0.0.4.5001: UDP, length 1470
19:06:15.276108 IP 10.0.0.1.54965 > 10.0.0.4.5001: UDP, length 1470
19:06:15.287400 IP 10.0.0.1.54965 > 10.0.0.4.5001: UDP, length 1470
19:06:15.298928 IP 10.0.0.1.54965 > 10.0.0.4.5001: UDP, length 1470
19:06:15.309996 IP 10.0.0.1.54965 > 10.0.0.4.5001: UDP, length 1470
19:06:15.321176 IP 10.0.0.1.54965 > 10.0.0.4.5001: UDP, length 1470
19:06:15.332192 IP 10.0.0.1.54965 > 10.0.0.4.5001: UDP, length 1470
19:06:15.343283 IP 10.0.0.1.54965 > 10.0.0.4.5001: UDP, length 1470
19:06:15.354889 IP 10.0.0.1.54965 > 10.0.0.4.5001: UDP, length 1470
19:06:15.366122 IP 10.0.0.1.54965 > 10.0.0.4.5001: UDP, length 1470
19:06:15.377255 IP 10.0.0.1.54965 > 10.0.0.4.5001: UDP, length 1470
19:06:15.388138 IP 10.0.0.1.54965 > 10.0.0.4.5001: UDP, length 1470
19:06:15.399358 IP 10.0.0.1.54965 > 10.0.0.4.5001: UDP, length 1470
19:06:15.411169 IP 10.0.0.1.54965 > 10.0.0.4.5001: UDP, length 1470
19:06:15.422262 IP 10.0.0.1.54965 > 10.0.0.4.5001: UDP, length 1470
19:06:15.433514 IP 10.0.0.1.54965 > 10.0.0.4.5001: UDP, length 1470
19:06:15.444553 IP 10.0.0.1.54965 > 10.0.0.4.5001: UDP, length 1470
19:06:15.455533 IP 10.0.0.1.54965 > 10.0.0.4.5001: UDP, length 1470
19:06:15.467248 IP 10.0.0.1.54965 > 10.0.0.4.5001: UDP, length 1470
19:06:15.477925 IP 10.0.0.1.54965 > 10.0.0.4.5001: UDP, length 1470
19:06:15.489329 IP 10.0.0.1.54965 > 10.0.0.4.5001: UDP, length 1470
19:06:15.500533 IP 10.0.0.1.54965 > 10.0.0.4.5001: UDP, length 1470
19:06:15.511687 IP 10.0.0.1.54965 > 10.0.0.4.5001: UDP, length 1470
19:06:15.523051 IP 10.0.0.1.54965 > 10.0.0.4.5001: UDP, length 1470
19:06:15.534179 IP 10.0.0.1.54965 > 10.0.0.4.5001: UDP, length 1470
19:06:15.545544 IP 10.0.0.1.54965 > 10.0.0.4.5001: UDP, length 1470
19:06:15.556594 IP 10.0.0.1.54965 > 10.0.0.4.5001: UDP, length 1470
19:06:15.567783 IP 10.0.0.1.54965 > 10.0.0.4.5001: UDP, length 1470
19:06:15.579314 IP 10.0.0.1.54965 > 10.0.0.4.5001: UDP, length 1470
19:06:15.590432 IP 10.0.0.1.54965 > 10.0.0.4.5001: UDP, length 1470
19:06:15.601533 IP 10.0.0.1.54965 > 10.0.0.4.5001: UDP, length 1470
19:06:15.612327 IP 10.0.0.1.54965 > 10.0.0.4.5001: UDP, length 1470
19:06:15.623663 IP 10.0.0.1.54965 > 10.0.0.4.5001: UDP, length 1470
19:06:15.636171 IP 10.0.0.1.54965 > 10.0.0.4.5001: UDP, length 1470
19:06:15.646115 IP 10.0.0.1.54965 > 10.0.0.4.5001: UDP, length 1470
19:06:15.657369 IP 10.0.0.1.54965 > 10.0.0.4.5001: UDP, length 1470
19:06:15.668535 IP 10.0.0.1.54965 > 10.0.0.4.5001: UDP, length 1470
19:06:15.679607 IP 10.0.0.1.54965 > 10.0.0.4.5001: UDP, length 1470
19:06:15.691200 IP 10.0.0.1.54965 > 10.0.0.4.5001: UDP, length 1470
19:06:15.702706 IP 10.0.0.1.54965 > 10.0.0.4.5001: UDP, length 1470
19:06:15.713823 IP 10.0.0.1.54965 > 10.0.0.4.5001: UDP, length 1470
19:06:15.724695 IP 10.0.0.1.54965 > 10.0.0.4.5001: UDP, length 1470
19:06:15.735725 IP 10.0.0.1.54965 > 10.0.0.4.5001: UDP, length 1470
19:06:15.746907 IP 10.0.0.1.54965 > 10.0.0.4.5001: UDP, length 1470
19:06:15.758997 IP 10.0.0.1.54965 > 10.0.0.4.5001: UDP, length 1470
19:06:15.769846 IP 10.0.0.1.54965 > 10.0.0.4.5001: UDP, length 1470
19:06:15.780861 IP 10.0.0.1.54965 > 10.0.0.4.5001: UDP, length 1470
19:06:15.792043 IP 10.0.0.1.54965 > 10.0.0.4.5001: UDP, length 1470
19:06:15.803059 IP 10.0.0.1.54965 > 10.0.0.4.5001: UDP, length 1470
19:06:15.814839 IP 10.0.0.1.54965 > 10.0.0.4.5001: UDP, length 1470
19:06:15.826139 IP 10.0.0.1.54965 > 10.0.0.4.5001: UDP, length 1470
19:06:15.837056 IP 10.0.0.1.54965 > 10.0.0.4.5001: UDP, length 1470
19:06:15.848160 IP 10.0.0.1.54965 > 10.0.0.4.5001: UDP, length 1470
19:06:15.859227 IP 10.0.0.1.54965 > 10.0.0.4.5001: UDP, length 1470
19:06:15.870982 IP 10.0.0.1.54965 > 10.0.0.4.5001: UDP, length 1470
19:06:15.881924 IP 10.0.0.1.54965 > 10.0.0.4.5001: UDP, length 1470
19:06:15.893053 IP 10.0.0.1.54965 > 10.0.0.4.5001: UDP, length 1470
19:06:15.904164 IP 10.0.0.1.54965 > 10.0.0.4.5001: UDP, length 1470
19:06:15.915405 IP 10.0.0.1.54965 > 10.0.0.4.5001: UDP, length 1470
19:06:15.926863 IP 10.0.0.1.54965 > 10.0.0.4.5001: UDP, length 1470
19:06:15.938070 IP 10.0.0.1.54965 > 10.0.0.4.5001: UDP, length 1470
19:06:15.948990 IP 10.0.0.1.54965 > 10.0.0.4.5001: UDP, length 1470
19:06:15.960273 IP 10.0.0.1.54965 > 10.0.0.4.5001: UDP, length 1470
19:06:15.971329 IP 10.0.0.1.54965 > 10.0.0.4.5001: UDP, length 1470
19:06:15.982884 IP 10.0.0.1.54965 > 10.0.0.4.5001: UDP, length 1470
19:06:15.994156 IP 10.0.0.1.54965 > 10.0.0.4.5001: UDP, length 1470
19:06:16.005275 IP 10.0.0.1.54965 > 10.0.0.4.5001: UDP, length 1470
19:06:16.016367 IP 10.0.0.1.54965 > 10.0.0.4.5001: UDP, length 1470
19:06:16.027389 IP 10.0.0.1.54965 > 10.0.0.4.5001: UDP, length 1470
19:06:16.039163 IP 10.0.0.1.54965 > 10.0.0.4.5001: UDP, length 1470
19:06:16.050178 IP 10.0.0.1.54965 > 10.0.0.4.5001: UDP, length 1470
19:06:16.061299 IP 10.0.0.1.54965 > 10.0.0.4.5001: UDP, length 1470
19:06:16.072450 IP 10.0.0.1.54965 > 10.0.0.4.5001: UDP, length 1470
19:06:16.083455 IP 10.0.0.1.54965 > 10.0.0.4.5001: UDP, length 1470
19:06:16.095258 IP 10.0.0.1.54965 > 10.0.0.4.5001: UDP, length 1470
19:06:16.106197 IP 10.0.0.1.54965 > 10.0.0.4.5001: UDP, length 1470
19:06:16.117219 IP 10.0.0.1.54965 > 10.0.0.4.5001: UDP, length 1470
19:06:16.128496 IP 10.0.0.1.54965 > 10.0.0.4.5001: UDP, length 1470
19:06:16.139670 IP 10.0.0.1.54965 > 10.0.0.4.5001: UDP, length 1470
19:06:16.151183 IP 10.0.0.1.54965 > 10.0.0.4.5001: UDP, length 1470
19:06:16.162398 IP 10.0.0.1.54965 > 10.0.0.4.5001: UDP, length 1470
19:06:16.173513 IP 10.0.0.1.54965 > 10.0.0.4.5001: UDP, length 1470
19:06:16.184438 IP 10.0.0.1.54965 > 10.0.0.4.5001: UDP, length 1470
19:06:16.195675 IP 10.0.0.1.54965 > 10.0.0.4.5001: UDP, length 1470
19:06:16.208001 IP 10.0.0.1.54965 > 10.0.0.4.5001: UDP, length 1470
19:06:16.218776 IP 10.0.0.1.54965 > 10.0.0.4.5001: UDP, length 1470
19:06:16.229615 IP 10.0.0.1.54965 > 10.0.0.4.5001: UDP, length 1470
19:06:16.240465 IP 10.0.0.1.54965 > 10.0.0.4.5001: UDP, length 1470
19:06:16.251854 IP 10.0.0.1.54965 > 10.0.0.4.5001: UDP, length 1470
19:06:16.262825 IP 10.0.0.1.54965 > 10.0.0.4.5001: UDP, length 1470
19:06:16.274410 IP 10.0.0.1.54965 > 10.0.0.4.5001: UDP, length 1470
19:06:16.285964 IP 10.0.0.1.54965 > 10.0.0.4.5001: UDP, length 1470
19:06:16.297109 IP 10.0.0.1.54965 > 10.0.0.4.5001: UDP, length 1470
19:06:16.307910 IP 10.0.0.1.54965 > 10.0.0.4.5001: UDP, length 1470
19:06:16.319259 IP 10.0.0.1.54965 > 10.0.0.4.5001: UDP, length 1470
19:06:16.330416 IP 10.0.0.1.54965 > 10.0.0.4.5001: UDP, length 1470
19:06:16.341454 IP 10.0.0.1.54965 > 10.0.0.4.5001: UDP, length 1470
19:06:16.352875 IP 10.0.0.1.54965 > 10.0.0.4.5001: UDP, length 1470
19:06:16.363855 IP 10.0.0.1.54965 > 10.0.0.4.5001: UDP, length 1470
19:06:16.375108 IP 10.0.0.1.54965 > 10.0.0.4.5001: UDP, length 1470
19:06:16.386490 IP 10.0.0.1.54965 > 10.0.0.4.5001: UDP, length 1470
19:06:16.397495 IP 10.0.0.1.54965 > 10.0.0.4.5001: UDP, length 1470
19:06:16.408867 IP 10.0.0.1.54965 > 10.0.0.4.5001: UDP, length 1470
19:06:16.420094 IP 10.0.0.1.54965 > 10.0.0.4.5001: UDP, length 1470
19:06:16.431178 IP 10.0.0.1.54965 > 10.0.0.4.5001: UDP, length 1470
19:06:16.442655 IP 10.0.0.1.54965 > 10.0.0.4.5001: UDP, length 1470
19:06:16.454185 IP 10.0.0.1.54965 > 10.0.0.4.5001: UDP, length 1470
19:06:16.465224 IP 10.0.0.1.54965 > 10.0.0.4.5001: UDP, length 1470
19:06:16.476273 IP 10.0.0.1.54965 > 10.0.0.4.5001: UDP, length 1470
19:06:16.487355 IP 10.0.0.1.54965 > 10.0.0.4.5001: UDP, length 1470
19:06:16.498992 IP 10.0.0.1.54965 > 10.0.0.4.5001: UDP, length 1470
19:06:16.509986 IP 10.0.0.1.54965 > 10.0.0.4.5001: UDP, length 1470
19:06:16.521157 IP 10.0.0.1.54965 > 10.0.0.4.5001: UDP, length 1470
19:06:16.532251 IP 10.0.0.1.54965 > 10.0.0.4.5001: UDP, length 1470
19:06:16.543279 IP 10.0.0.1.54965 > 10.0.0.4.5001: UDP, length 1470
19:06:16.555017 IP 10.0.0.1.54965 > 10.0.0.4.5001: UDP, length 1470
19:06:16.566068 IP 10.0.0.1.54965 > 10.0.0.4.5001: UDP, length 1470
19:06:16.577051 IP 10.0.0.1.54965 > 10.0.0.4.5001: UDP, length 1470
19:06:16.588480 IP 10.0.0.1.54965 > 10.0.0.4.5001: UDP, length 1470
19:06:16.599478 IP 10.0.0.1.54965 > 10.0.0.4.5001: UDP, length 1470
19:06:16.610978 IP 10.0.0.1.54965 > 10.0.0.4.5001: UDP, length 1470
19:06:16.622206 IP 10.0.0.1.54965 > 10.0.0.4.5001: UDP, length 1470
19:06:16.633343 IP 10.0.0.1.54965 > 10.0.0.4.5001: UDP, length 1470
19:06:16.644379 IP 10.0.0.1.54965 > 10.0.0.4.5001: UDP, length 1470
19:06:16.655448 IP 10.0.0.1.54965 > 10.0.0.4.5001: UDP, length 1470
19:06:16.666796 IP 10.0.0.1.54965 > 10.0.0.4.5001: UDP, length 1470
19:06:16.678253 IP 10.0.0.1.54965 > 10.0.0.4.5001: UDP, length 1470
19:06:16.689893 IP 10.0.0.1.54965 > 10.0.0.4.5001: UDP, length 1470
19:06:16.700324 IP 10.0.0.1.54965 > 10.0.0.4.5001: UDP, length 1470
19:06:16.711471 IP 10.0.0.1.54965 > 10.0.0.4.5001: UDP, length 1470
19:06:16.722842 IP 10.0.0.1.54965 > 10.0.0.4.5001: UDP, length 1470
19:06:16.734088 IP 10.0.0.1.54965 > 10.0.0.4.5001: UDP, length 1470
19:06:16.745039 IP 10.0.0.1.54965 > 10.0.0.4.5001: UDP, length 1470
19:06:16.756511 IP 10.0.0.1.54965 > 10.0.0.4.5001: UDP, length 1470
19:06:16.767758 IP 10.0.0.1.54965 > 10.0.0.4.5001: UDP, length 1470
19:06:16.779173 IP 10.0.0.1.54965 > 10.0.0.4.5001: UDP, length 1470
19:06:16.790344 IP 10.0.0.1.54965 > 10.0.0.4.5001: UDP, length 1470
19:06:16.801618 IP 10.0.0.1.54965 > 10.0.0.4.5001: UDP, length 1470
19:06:16.812743 IP 10.0.0.1.54965 > 10.0.0.4.5001: UDP, length 1470
19:06:16.823803 IP 10.0.0.1.54965 > 10.0.0.4.5001: UDP, length 1470
19:06:16.834972 IP 10.0.0.1.54965 > 10.0.0.4.5001: UDP, length 1470
19:06:16.847077 IP 10.0.0.1.54965 > 10.0.0.4.5001: UDP, length 1470
19:06:16.857561 IP 10.0.0.1.54965 > 10.0.0.4.5001: UDP, length 1470
19:06:16.868801 IP 10.0.0.1.54965 > 10.0.0.4.5001: UDP, length 1470
19:06:16.879955 IP 10.0.0.1.54965 > 10.0.0.4.5001: UDP, length 1470
19:06:16.891334 IP 10.0.0.1.54965 > 10.0.0.4.5001: UDP, length 1470
19:06:16.902705 IP 10.0.0.1.54965 > 10.0.0.4.5001: UDP, length 1470
19:06:16.913705 IP 10.0.0.1.54965 > 10.0.0.4.5001: UDP, length 1470
19:06:16.924885 IP 10.0.0.1.54965 > 10.0.0.4.5001: UDP, length 1470
19:06:16.936051 IP 10.0.0.1.54965 > 10.0.0.4.5001: UDP, length 1470
19:06:16.947197 IP 10.0.0.1.54965 > 10.0.0.4.5001: UDP, length 1470
19:06:16.958349 IP 10.0.0.1.54965 > 10.0.0.4.5001: UDP, length 1470
19:06:16.969883 IP 10.0.0.1.54965 > 10.0.0.4.5001: UDP, length 1470
19:06:16.980977 IP 10.0.0.1.54965 > 10.0.0.4.5001: UDP, length 1470
19:06:16.992078 IP 10.0.0.1.54965 > 10.0.0.4.5001: UDP, length 1470
19:06:17.003342 IP 10.0.0.1.54965 > 10.0.0.4.5001: UDP, length 1470
19:06:17.014852 IP 10.0.0.1.54965 > 10.0.0.4.5001: UDP, length 1470
19:06:17.025940 IP 10.0.0.1.54965 > 10.0.0.4.5001: UDP, length 1470
19:06:17.037075 IP 10.0.0.1.54965 > 10.0.0.4.5001: UDP, length 1470
19:06:17.048035 IP 10.0.0.1.54965 > 10.0.0.4.5001: UDP, length 1470
19:06:17.059288 IP 10.0.0.1.54965 > 10.0.0.4.5001: UDP, length 1470
19:06:17.070829 IP 10.0.0.1.54965 > 10.0.0.4.5001: UDP, length 1470
19:06:17.081891 IP 10.0.0.1.54965 > 10.0.0.4.5001: UDP, length 1470
19:06:17.093158 IP 10.0.0.1.54965 > 10.0.0.4.5001: UDP, length 1470
19:06:17.104326 IP 10.0.0.1.54965 > 10.0.0.4.5001: UDP, length 1470
19:06:17.115242 IP 10.0.0.1.54965 > 10.0.0.4.5001: UDP, length 1470
19:06:17.127020 IP 10.0.0.1.54965 > 10.0.0.4.5001: UDP, length 1470
19:06:17.138153 IP 10.0.0.1.54965 > 10.0.0.4.5001: UDP, length 1470
19:06:17.149011 IP 10.0.0.1.54965 > 10.0.0.4.5001: UDP, length 1470
19:06:17.160363 IP 10.0.0.1.54965 > 10.0.0.4.5001: UDP, length 1470
19:06:17.171633 IP 10.0.0.1.54965 > 10.0.0.4.5001: UDP, length 1470
19:06:17.183166 IP 10.0.0.1.54965 > 10.0.0.4.5001: UDP, length 1470
19:06:17.194261 IP 10.0.0.1.54965 > 10.0.0.4.5001: UDP, length 1470
19:06:17.205718 IP 10.0.0.1.54965 > 10.0.0.4.5001: UDP, length 1470
19:06:17.216226 IP 10.0.0.1.54965 > 10.0.0.4.5001: UDP, length 1470
19:06:17.227639 IP 10.0.0.1.54965 > 10.0.0.4.5001: UDP, length 1470
19:06:17.238962 IP 10.0.0.1.54965 > 10.0.0.4.5001: UDP, length 1470
19:06:17.250172 IP 10.0.0.1.54965 > 10.0.0.4.5001: UDP, length 1470
19:06:17.261135 IP 10.0.0.1.54965 > 10.0.0.4.5001: UDP, length 1470
19:06:17.272555 IP 10.0.0.1.54965 > 10.0.0.4.5001: UDP, length 1470
19:06:17.284180 IP 10.0.0.1.54965 > 10.0.0.4.5001: UDP, length 1470
19:06:17.295335 IP 10.0.0.1.54965 > 10.0.0.4.5001: UDP, length 1470
19:06:17.306362 IP 10.0.0.1.54965 > 10.0.0.4.5001: UDP, length 1470
19:06:17.317473 IP 10.0.0.1.54965 > 10.0.0.4.5001: UDP, length 1470
19:06:17.328564 IP 10.0.0.1.54965 > 10.0.0.4.5001: UDP, length 1470
19:06:17.339615 IP 10.0.0.1.54965 > 10.0.0.4.5001: UDP, length 1470
19:06:17.351025 IP 10.0.0.1.54965 > 10.0.0.4.5001: UDP, length 1470
19:06:17.362404 IP 10.0.0.1.54965 > 10.0.0.4.5001: UDP, length 1470
19:06:17.373332 IP 10.0.0.1.54965 > 10.0.0.4.5001: UDP, length 1470
19:06:17.384643 IP 10.0.0.1.54965 > 10.0.0.4.5001: UDP, length 1470
19:06:17.395691 IP 10.0.0.1.54965 > 10.0.0.4.5001: UDP, length 1470
19:06:17.406957 IP 10.0.0.1.54965 > 10.0.0.4.5001: UDP, length 1470
19:06:17.418448 IP 10.0.0.1.54965 > 10.0.0.4.5001: UDP, length 1470
19:06:17.429661 IP 10.0.0.1.54965 > 10.0.0.4.5001: UDP, length 1470
19:06:17.440850 IP 10.0.0.1.54965 > 10.0.0.4.5001: UDP, length 1470
19:06:17.451970 IP 10.0.0.1.54965 > 10.0.0.4.5001: UDP, length 1470
19:06:17.463348 IP 10.0.0.1.54965 > 10.0.0.4.5001: UDP, length 1470
19:06:17.474237 IP 10.0.0.1.54965 > 10.0.0.4.5001: UDP, length 1470
19:06:17.485775 IP 10.0.0.1.54965 > 10.0.0.4.5001: UDP, length 1470
19:06:17.496828 IP 10.0.0.1.54965 > 10.0.0.4.5001: UDP, length 1470
19:06:17.507862 IP 10.0.0.1.54965 > 10.0.0.4.5001: UDP, length 1470
19:06:17.519280 IP 10.0.0.1.54965 > 10.0.0.4.5001: UDP, length 1470
19:06:17.530697 IP 10.0.0.1.54965 > 10.0.0.4.5001: UDP, length 1470
19:06:17.541432 IP 10.0.0.1.54965 > 10.0.0.4.5001: UDP, length 1470
19:06:17.552826 IP 10.0.0.1.54965 > 10.0.0.4.5001: UDP, length 1470
19:06:17.564079 IP 10.0.0.1.54965 > 10.0.0.4.5001: UDP, length 1470
19:06:17.575085 IP 10.0.0.1.54965 > 10.0.0.4.5001: UDP, length 1470
19:06:17.586770 IP 10.0.0.1.54965 > 10.0.0.4.5001: UDP, length 1470
19:06:17.597749 IP 10.0.0.1.54965 > 10.0.0.4.5001: UDP, length 1470
19:06:17.609028 IP 10.0.0.1.54965 > 10.0.0.4.5001: UDP, length 1470
19:06:17.620159 IP 10.0.0.1.54965 > 10.0.0.4.5001: UDP, length 1470
19:06:17.631389 IP 10.0.0.1.54965 > 10.0.0.4.5001: UDP, length 1470
19:06:17.642741 IP 10.0.0.1.54965 > 10.0.0.4.5001: UDP, length 1470
19:06:17.654016 IP 10.0.0.1.54965 > 10.0.0.4.5001: UDP, length 1470
19:06:17.665066 IP 10.0.0.1.54965 > 10.0.0.4.5001: UDP, length 1470
19:06:17.676189 IP 10.0.0.1.54965 > 10.0.0.4.5001: UDP, length 1470
19:06:17.687280 IP 10.0.0.1.54965 > 10.0.0.4.5001: UDP, length 1470
19:06:17.698964 IP 10.0.0.1.54965 > 10.0.0.4.5001: UDP, length 1470
19:06:17.710026 IP 10.0.0.1.54965 > 10.0.0.4.5001: UDP, length 1470
19:06:17.720953 IP 10.0.0.1.54965 > 10.0.0.4.5001: UDP, length 1470
19:06:17.732094 IP 10.0.0.1.54965 > 10.0.0.4.5001: UDP, length 1470
19:06:17.743354 IP 10.0.0.1.54965 > 10.0.0.4.5001: UDP, length 1470
19:06:17.754637 IP 10.0.0.1.54965 > 10.0.0.4.5001: UDP, length 1470
19:06:17.765862 IP 10.0.0.1.54965 > 10.0.0.4.5001: UDP, length 1470
19:06:17.777350 IP 10.0.0.1.54965 > 10.0.0.4.5001: UDP, length 1470
19:06:17.788384 IP 10.0.0.1.54965 > 10.0.0.4.5001: UDP, length 1470
19:06:17.799519 IP 10.0.0.1.54965 > 10.0.0.4.5001: UDP, length 1470
19:06:17.810825 IP 10.0.0.1.54965 > 10.0.0.4.5001: UDP, length 1470
19:06:17.822223 IP 10.0.0.1.54965 > 10.0.0.4.5001: UDP, length 1470
19:06:17.833335 IP 10.0.0.1.54965 > 10.0.0.4.5001: UDP, length 1470
19:06:17.844293 IP 10.0.0.1.54965 > 10.0.0.4.5001: UDP, length 1470
19:06:17.855510 IP 10.0.0.1.54965 > 10.0.0.4.5001: UDP, length 1470
19:06:17.867383 IP 10.0.0.1.54965 > 10.0.0.4.5001: UDP, length 1470
19:06:17.878130 IP 10.0.0.1.54965 > 10.0.0.4.5001: UDP, length 1470
19:06:17.889264 IP 10.0.0.1.54965 > 10.0.0.4.5001: UDP, length 1470
19:06:17.900586 IP 10.0.0.1.54965 > 10.0.0.4.5001: UDP, length 1470
19:06:17.911663 IP 10.0.0.1.54965 > 10.0.0.4.5001: UDP, length 1470
19:06:17.923243 IP 10.0.0.1.54965 > 10.0.0.4.5001: UDP, length 1470
19:06:17.934394 IP 10.0.0.1.54965 > 10.0.0.4.5001: UDP, length 1470
19:06:17.945222 IP 10.0.0.1.54965 > 10.0.0.4.5001: UDP, length 1470
19:06:17.956632 IP 10.0.0.1.54965 > 10.0.0.4.5001: UDP, length 1470
19:06:17.967618 IP 10.0.0.1.54965 > 10.0.0.4.5001: UDP, length 1470
19:06:17.979329 IP 10.0.0.1.54965 > 10.0.0.4.5001: UDP, length 1470
19:06:17.990500 IP 10.0.0.1.54965 > 10.0.0.4.5001: UDP, length 1470
19:06:18.001794 IP 10.0.0.1.54965 > 10.0.0.4.5001: UDP, length 1470
19:06:18.012742 IP 10.0.0.1.54965 > 10.0.0.4.5001: UDP, length 1470
19:06:18.023879 IP 10.0.0.1.54965 > 10.0.0.4.5001: UDP, length 1470
19:06:18.034929 IP 10.0.0.1.54965 > 10.0.0.4.5001: UDP, length 1470
19:06:18.046113 IP 10.0.0.1.54965 > 10.0.0.4.5001: UDP, length 1470
19:06:18.057693 IP 10.0.0.1.54965 > 10.0.0.4.5001: UDP, length 1470
19:06:18.068878 IP 10.0.0.1.54965 > 10.0.0.4.5001: UDP, length 1470
19:06:18.079955 IP 10.0.0.1.54965 > 10.0.0.4.5001: UDP, length 1470
19:06:18.091306 IP 10.0.0.1.54965 > 10.0.0.4.5001: UDP, length 1470
19:06:18.102763 IP 10.0.0.1.54965 > 10.0.0.4.5001: UDP, length 1470
19:06:18.113814 IP 10.0.0.1.54965 > 10.0.0.4.5001: UDP, length 1470
19:06:18.124939 IP 10.0.0.1.54965 > 10.0.0.4.5001: UDP, length 1470
19:06:18.136033 IP 10.0.0.1.54965 > 10.0.0.4.5001: UDP, length 1470
19:06:18.147088 IP 10.0.0.1.54965 > 10.0.0.4.5001: UDP, length 1470
19:06:18.158911 IP 10.0.0.1.54965 > 10.0.0.4.5001: UDP, length 1470
19:06:18.169875 IP 10.0.0.1.54965 > 10.0.0.4.5001: UDP, length 1470
19:06:18.181029 IP 10.0.0.1.54965 > 10.0.0.4.5001: UDP, length 1470
19:06:18.192116 IP 10.0.0.1.54965 > 10.0.0.4.5001: UDP, length 1470
19:06:18.203179 IP 10.0.0.1.54965 > 10.0.0.4.5001: UDP, length 1470
19:06:18.214756 IP 10.0.0.1.54965 > 10.0.0.4.5001: UDP, length 1470
19:06:18.225993 IP 10.0.0.1.54965 > 10.0.0.4.5001: UDP, length 1470
19:06:18.237125 IP 10.0.0.1.54965 > 10.0.0.4.5001: UDP, length 1470
19:06:18.248130 IP 10.0.0.1.54965 > 10.0.0.4.5001: UDP, length 1470
19:06:18.259334 IP 10.0.0.1.54965 > 10.0.0.4.5001: UDP, length 1470
19:06:18.270574 IP 10.0.0.1.54965 > 10.0.0.4.5001: UDP, length 1470
19:06:18.282076 IP 10.0.0.1.54965 > 10.0.0.4.5001: UDP, length 1470
19:06:18.293849 IP 10.0.0.1.54965 > 10.0.0.4.5001: UDP, length 1470
19:06:18.304218 IP 10.0.0.1.54965 > 10.0.0.4.5001: UDP, length 1470
19:06:18.315244 IP 10.0.0.1.54965 > 10.0.0.4.5001: UDP, length 1470
19:06:18.327876 IP 10.0.0.1.54965 > 10.0.0.4.5001: UDP, length 1470
19:06:18.338710 IP 10.0.0.1.54965 > 10.0.0.4.5001: UDP, length 1470
19:06:18.349273 IP 10.0.0.1.54965 > 10.0.0.4.5001: UDP, length 1470
19:06:18.360201 IP 10.0.0.1.54965 > 10.0.0.4.5001: UDP, length 1470
19:06:18.371589 IP 10.0.0.1.54965 > 10.0.0.4.5001: UDP, length 1470
19:06:18.382829 IP 10.0.0.1.54965 > 10.0.0.4.5001: UDP, length 1470
19:06:18.394041 IP 10.0.0.1.54965 > 10.0.0.4.5001: UDP, length 1470
19:06:18.405121 IP 10.0.0.1.54965 > 10.0.0.4.5001: UDP, length 1470
19:06:18.416378 IP 10.0.0.1.54965 > 10.0.0.4.5001: UDP, length 1470
19:06:18.427665 IP 10.0.0.1.54965 > 10.0.0.4.5001: UDP, length 1470
19:06:18.439300 IP 10.0.0.1.54965 > 10.0.0.4.5001: UDP, length 1470
19:06:18.450333 IP 10.0.0.1.54965 > 10.0.0.4.5001: UDP, length 1470
19:06:18.461530 IP 10.0.0.1.54965 > 10.0.0.4.5001: UDP, length 1470
19:06:18.472612 IP 10.0.0.1.54965 > 10.0.0.4.5001: UDP, length 1470
19:06:18.484524 IP 10.0.0.1.54965 > 10.0.0.4.5001: UDP, length 1470
19:06:18.495250 IP 10.0.0.1.54965 > 10.0.0.4.5001: UDP, length 1470
19:06:18.506368 IP 10.0.0.1.54965 > 10.0.0.4.5001: UDP, length 1470
19:06:18.517551 IP 10.0.0.1.54965 > 10.0.0.4.5001: UDP, length 1470
19:06:18.528466 IP 10.0.0.1.54965 > 10.0.0.4.5001: UDP, length 1470
19:06:18.539805 IP 10.0.0.1.54965 > 10.0.0.4.5001: UDP, length 1470
19:06:18.551067 IP 10.0.0.1.54965 > 10.0.0.4.5001: UDP, length 1470
19:06:18.562505 IP 10.0.0.1.54965 > 10.0.0.4.5001: UDP, length 1470
19:06:18.573883 IP 10.0.0.1.54965 > 10.0.0.4.5001: UDP, length 1470
19:06:18.584730 IP 10.0.0.1.54965 > 10.0.0.4.5001: UDP, length 1470
19:06:18.595894 IP 10.0.0.1.54965 > 10.0.0.4.5001: UDP, length 1470
19:06:18.606992 IP 10.0.0.1.54965 > 10.0.0.4.5001: UDP, length 1470
19:06:18.618646 IP 10.0.0.1.54965 > 10.0.0.4.5001: UDP, length 1470
19:06:18.629722 IP 10.0.0.1.54965 > 10.0.0.4.5001: UDP, length 1470
19:06:18.640945 IP 10.0.0.1.54965 > 10.0.0.4.5001: UDP, length 1470
19:06:18.651925 IP 10.0.0.1.54965 > 10.0.0.4.5001: UDP, length 1470
19:06:18.663336 IP 10.0.0.1.54965 > 10.0.0.4.5001: UDP, length 1470
19:06:18.674742 IP 10.0.0.1.54965 > 10.0.0.4.5001: UDP, length 1470
19:06:18.685531 IP 10.0.0.1.54965 > 10.0.0.4.5001: UDP, length 1470
19:06:18.696772 IP 10.0.0.1.54965 > 10.0.0.4.5001: UDP, length 1470
19:06:18.707979 IP 10.0.0.1.54965 > 10.0.0.4.5001: UDP, length 1470
19:06:18.719152 IP 10.0.0.1.54965 > 10.0.0.4.5001: UDP, length 1470
19:06:18.730743 IP 10.0.0.1.54965 > 10.0.0.4.5001: UDP, length 1470
19:06:18.742027 IP 10.0.0.1.54965 > 10.0.0.4.5001: UDP, length 1470
19:06:18.752715 IP 10.0.0.1.54965 > 10.0.0.4.5001: UDP, length 1470
19:06:18.763957 IP 10.0.0.1.54965 > 10.0.0.4.5001: UDP, length 1470
19:06:18.775333 IP 10.0.0.1.54965 > 10.0.0.4.5001: UDP, length 1470
19:06:18.786360 IP 10.0.0.1.54965 > 10.0.0.4.5001: UDP, length 1470
19:06:18.797845 IP 10.0.0.1.54965 > 10.0.0.4.5001: UDP, length 1470
19:06:18.808717 IP 10.0.0.1.54965 > 10.0.0.4.5001: UDP, length 1470
19:06:18.819984 IP 10.0.0.1.54965 > 10.0.0.4.5001: UDP, length 1470
19:06:18.831429 IP 10.0.0.1.54965 > 10.0.0.4.5001: UDP, length 1470
19:06:18.842830 IP 10.0.0.1.54965 > 10.0.0.4.5001: UDP, length 1470
19:06:18.853486 IP 10.0.0.1.54965 > 10.0.0.4.5001: UDP, length 1470
19:06:18.865029 IP 10.0.0.1.54965 > 10.0.0.4.5001: UDP, length 1470
19:06:18.876272 IP 10.0.0.1.54965 > 10.0.0.4.5001: UDP, length 1470
19:06:18.887376 IP 10.0.0.1.54965 > 10.0.0.4.5001: UDP, length 1470
19:06:18.898882 IP 10.0.0.1.54965 > 10.0.0.4.5001: UDP, length 1470
19:06:18.910113 IP 10.0.0.1.54965 > 10.0.0.4.5001: UDP, length 1470
19:06:18.921212 IP 10.0.0.1.54965 > 10.0.0.4.5001: UDP, length 1470
19:06:18.932318 IP 10.0.0.1.54965 > 10.0.0.4.5001: UDP, length 1470
19:06:18.943380 IP 10.0.0.1.54965 > 10.0.0.4.5001: UDP, length 1470
19:06:18.955267 IP 10.0.0.1.54965 > 10.0.0.4.5001: UDP, length 1470
19:06:18.966108 IP 10.0.0.1.54965 > 10.0.0.4.5001: UDP, length 1470
19:06:18.977304 IP 10.0.0.1.54965 > 10.0.0.4.5001: UDP, length 1470
19:06:18.988464 IP 10.0.0.1.54965 > 10.0.0.4.5001: UDP, length 1470
19:06:18.999486 IP 10.0.0.1.54965 > 10.0.0.4.5001: UDP, length 1470
19:06:19.011296 IP 10.0.0.1.54965 > 10.0.0.4.5001: UDP, length 1470
19:06:19.021922 IP 10.0.0.1.54965 > 10.0.0.4.5001: UDP, length 1470
19:06:19.033292 IP 10.0.0.1.54965 > 10.0.0.4.5001: UDP, length 1470
19:06:19.044517 IP 10.0.0.1.54965 > 10.0.0.4.5001: UDP, length 1470
19:06:19.055632 IP 10.0.0.1.54965 > 10.0.0.4.5001: UDP, length 1470
19:06:19.067242 IP 10.0.0.1.54965 > 10.0.0.4.5001: UDP, length 1470
19:06:19.078451 IP 10.0.0.1.54965 > 10.0.0.4.5001: UDP, length 1470
19:06:19.089537 IP 10.0.0.1.54965 > 10.0.0.4.5001: UDP, length 1470
19:06:19.100641 IP 10.0.0.1.54965 > 10.0.0.4.5001: UDP, length 1470
19:06:19.111673 IP 10.0.0.1.54965 > 10.0.0.4.5001: UDP, length 1470
19:06:19.123297 IP 10.0.0.1.54965 > 10.0.0.4.5001: UDP, length 1470
19:06:19.134460 IP 10.0.0.1.54965 > 10.0.0.4.5001: UDP, length 1470
19:06:19.145567 IP 10.0.0.1.54965 > 10.0.0.4.5001: UDP, length 1470
19:06:19.156648 IP 10.0.0.1.54965 > 10.0.0.4.5001: UDP, length 1470
19:06:19.168104 IP 10.0.0.1.54965 > 10.0.0.4.5001: UDP, length 1470
19:06:19.179210 IP 10.0.0.1.54965 > 10.0.0.4.5001: UDP, length 1470
19:06:19.190176 IP 10.0.0.1.54965 > 10.0.0.4.5001: UDP, length 1470
19:06:19.201540 IP 10.0.0.1.54965 > 10.0.0.4.5001: UDP, length 1470
19:06:19.212797 IP 10.0.0.1.54965 > 10.0.0.4.5001: UDP, length 1470
19:06:19.223875 IP 10.0.0.1.54965 > 10.0.0.4.5001: UDP, length 1470
19:06:19.235283 IP 10.0.0.1.54965 > 10.0.0.4.5001: UDP, length 1470
19:06:19.246211 IP 10.0.0.1.54965 > 10.0.0.4.5001: UDP, length 1470
19:06:19.257686 IP 10.0.0.1.54965 > 10.0.0.4.5001: UDP, length 1470
19:06:19.268807 IP 10.0.0.1.54965 > 10.0.0.4.5001: UDP, length 1470
19:06:19.279876 IP 10.0.0.1.54965 > 10.0.0.4.5001: UDP, length 1470
19:06:19.291311 IP 10.0.0.1.54965 > 10.0.0.4.5001: UDP, length 1470
19:06:19.302701 IP 10.0.0.1.54965 > 10.0.0.4.5001: UDP, length 1470
19:06:19.314329 IP 10.0.0.1.54965 > 10.0.0.4.5001: UDP, length 1470
19:06:19.324619 IP 10.0.0.1.54965 > 10.0.0.4.5001: UDP, length 1470
19:06:19.336011 IP 10.0.0.1.54965 > 10.0.0.4.5001: UDP, length 1470
19:06:19.347520 IP 10.0.0.1.54965 > 10.0.0.4.5001: UDP, length 1470
19:06:19.358245 IP 10.0.0.1.54965 > 10.0.0.4.5001: UDP, length 1470
19:06:19.369571 IP 10.0.0.1.54965 > 10.0.0.4.5001: UDP, length 1470
19:06:19.380762 IP 10.0.0.1.54965 > 10.0.0.4.5001: UDP, length 1470
19:06:19.392385 IP 10.0.0.1.54965 > 10.0.0.4.5001: UDP, length 1470
19:06:19.403660 IP 10.0.0.1.54965 > 10.0.0.4.5001: UDP, length 1470
19:06:19.414738 IP 10.0.0.1.54965 > 10.0.0.4.5001: UDP, length 1470
19:06:19.425957 IP 10.0.0.1.54965 > 10.0.0.4.5001: UDP, length 1470
19:06:19.437095 IP 10.0.0.1.54965 > 10.0.0.4.5001: UDP, length 1470
19:06:19.448202 IP 10.0.0.1.54965 > 10.0.0.4.5001: UDP, length 1470
19:06:19.459325 IP 10.0.0.1.54965 > 10.0.0.4.5001: UDP, length 1470
19:06:19.471059 IP 10.0.0.1.54965 > 10.0.0.4.5001: UDP, length 1470
19:06:19.482079 IP 10.0.0.1.54965 > 10.0.0.4.5001: UDP, length 1470
19:06:19.493170 IP 10.0.0.1.54965 > 10.0.0.4.5001: UDP, length 1470
19:06:19.504100 IP 10.0.0.1.54965 > 10.0.0.4.5001: UDP, length 1470
19:06:19.515456 IP 10.0.0.1.54965 > 10.0.0.4.5001: UDP, length 1470
19:06:19.526835 IP 10.0.0.1.54965 > 10.0.0.4.5001: UDP, length 1470
19:06:19.538154 IP 10.0.0.1.54965 > 10.0.0.4.5001: UDP, length 1470
19:06:19.549314 IP 10.0.0.1.54965 > 10.0.0.4.5001: UDP, length 1470
19:06:19.560424 IP 10.0.0.1.54965 > 10.0.0.4.5001: UDP, length 1470
19:06:19.571363 IP 10.0.0.1.54965 > 10.0.0.4.5001: UDP, length 1470
19:06:19.583158 IP 10.0.0.1.54965 > 10.0.0.4.5001: UDP, length 1470
19:06:19.594256 IP 10.0.0.1.54965 > 10.0.0.4.5001: UDP, length 1470
19:06:19.605366 IP 10.0.0.1.54965 > 10.0.0.4.5001: UDP, length 1470
19:06:19.616502 IP 10.0.0.1.54965 > 10.0.0.4.5001: UDP, length 1470
19:06:19.627500 IP 10.0.0.1.54965 > 10.0.0.4.5001: UDP, length 1470
19:06:19.639234 IP 10.0.0.1.54965 > 10.0.0.4.5001: UDP, length 1470
19:06:19.650430 IP 10.0.0.1.54965 > 10.0.0.4.5001: UDP, length 1470
19:06:19.661245 IP 10.0.0.1.54965 > 10.0.0.4.5001: UDP, length 1470
19:06:19.672561 IP 10.0.0.1.54965 > 10.0.0.4.5001: UDP, length 1470
19:06:19.683765 IP 10.0.0.1.54965 > 10.0.0.4.5001: UDP, length 1470
19:06:19.695327 IP 10.0.0.1.54965 > 10.0.0.4.5001: UDP, length 1470
19:06:19.706424 IP 10.0.0.1.54965 > 10.0.0.4.5001: UDP, length 1470
19:06:19.717666 IP 10.0.0.1.54965 > 10.0.0.4.5001: UDP, length 1470
19:06:19.728572 IP 10.0.0.1.54965 > 10.0.0.4.5001: UDP, length 1470
19:06:19.739650 IP 10.0.0.1.54965 > 10.0.0.4.5001: UDP, length 1470
19:06:19.751360 IP 10.0.0.1.54965 > 10.0.0.4.5001: UDP, length 1470
19:06:19.762617 IP 10.0.0.1.54965 > 10.0.0.4.5001: UDP, length 1470
19:06:19.773639 IP 10.0.0.1.54965 > 10.0.0.4.5001: UDP, length 1470
19:06:19.784734 IP 10.0.0.1.54965 > 10.0.0.4.5001: UDP, length 1470
19:06:19.795960 IP 10.0.0.1.54965 > 10.0.0.4.5001: UDP, length 1470
19:06:19.807008 IP 10.0.0.1.54965 > 10.0.0.4.5001: UDP, length 1470
19:06:19.818302 IP 10.0.0.1.54965 > 10.0.0.4.5001: UDP, length 1470
19:06:19.829400 IP 10.0.0.1.54965 > 10.0.0.4.5001: UDP, length 1470
19:06:19.840489 IP 10.0.0.1.54965 > 10.0.0.4.5001: UDP, length 1470
19:06:19.852141 IP 10.0.0.1.54965 > 10.0.0.4.5001: UDP, length 1470
19:06:19.863358 IP 10.0.0.1.54965 > 10.0.0.4.5001: UDP, length 1470
19:06:19.874852 IP 10.0.0.1.54965 > 10.0.0.4.5001: UDP, length 1470
19:06:19.885790 IP 10.0.0.1.54965 > 10.0.0.4.5001: UDP, length 1470
19:06:19.896972 IP 10.0.0.1.54965 > 10.0.0.4.5001: UDP, length 1470
19:06:19.908011 IP 10.0.0.1.54965 > 10.0.0.4.5001: UDP, length 1470
19:06:19.919286 IP 10.0.0.1.54965 > 10.0.0.4.5001: UDP, length 1470
19:06:19.930795 IP 10.0.0.1.54965 > 10.0.0.4.5001: UDP, length 1470
19:06:19.941779 IP 10.0.0.1.54965 > 10.0.0.4.5001: UDP, length 1470
19:06:19.953150 IP 10.0.0.1.54965 > 10.0.0.4.5001: UDP, length 1470
19:06:19.964261 IP 10.0.0.1.54965 > 10.0.0.4.5001: UDP, length 1470
19:06:19.975441 IP 10.0.0.1.54965 > 10.0.0.4.5001: UDP, length 1470
19:06:19.986744 IP 10.0.0.1.54965 > 10.0.0.4.5001: UDP, length 1470
19:06:19.997960 IP 10.0.0.1.54965 > 10.0.0.4.5001: UDP, length 1470
19:06:20.009163 IP 10.0.0.1.54965 > 10.0.0.4.5001: UDP, length 1470
19:06:20.020211 IP 10.0.0.1.54965 > 10.0.0.4.5001: UDP, length 1470
19:06:20.031285 IP 10.0.0.1.54965 > 10.0.0.4.5001: UDP, length 1470
19:06:20.042825 IP 10.0.0.1.54965 > 10.0.0.4.5001: UDP, length 1470
19:06:20.054144 IP 10.0.0.1.54965 > 10.0.0.4.5001: UDP, length 1470
19:06:20.065014 IP 10.0.0.1.54965 > 10.0.0.4.5001: UDP, length 1470
19:06:20.076357 IP 10.0.0.1.54965 > 10.0.0.4.5001: UDP, length 1470
19:06:20.087381 IP 10.0.0.1.54965 > 10.0.0.4.5001: UDP, length 1470
19:06:20.099122 IP 10.0.0.1.54965 > 10.0.0.4.5001: UDP, length 1470
19:06:20.109846 IP 10.0.0.1.54965 > 10.0.0.4.5001: UDP, length 1470
19:06:20.121340 IP 10.0.0.1.54965 > 10.0.0.4.5001: UDP, length 1470
19:06:20.132179 IP 10.0.0.1.54965 > 10.0.0.4.5001: UDP, length 1470
19:06:20.143614 IP 10.0.0.1.54965 > 10.0.0.4.5001: UDP, length 1470
19:06:20.154804 IP 10.0.0.1.54965 > 10.0.0.4.5001: UDP, length 1470
19:06:20.165997 IP 10.0.0.1.54965 > 10.0.0.4.5001: UDP, length 1470
19:06:20.177379 IP 10.0.0.1.54965 > 10.0.0.4.5001: UDP, length 1470
19:06:20.188471 IP 10.0.0.1.54965 > 10.0.0.4.5001: UDP, length 1470
19:06:20.199481 IP 10.0.0.1.54965 > 10.0.0.4.5001: UDP, length 1470
19:06:20.211398 IP 10.0.0.1.54965 > 10.0.0.4.5001: UDP, length 1470
19:06:20.222398 IP 10.0.0.1.54965 > 10.0.0.4.5001: UDP, length 1470
19:06:20.233487 IP 10.0.0.1.54965 > 10.0.0.4.5001: UDP, length 1470
19:06:20.245364 IP 10.0.0.1.54965 > 10.0.0.4.5001: UDP, length 1470
19:06:20.255536 IP 10.0.0.1.54965 > 10.0.0.4.5001: UDP, length 1470
19:06:20.266867 IP 10.0.0.1.54965 > 10.0.0.4.5001: UDP, length 1470
19:06:20.278395 IP 10.0.0.1.54965 > 10.0.0.4.5001: UDP, length 1470
19:06:20.289216 IP 10.0.0.1.54965 > 10.0.0.4.5001: UDP, length 1470
19:06:20.300528 IP 10.0.0.1.54965 > 10.0.0.4.5001: UDP, length 1470
19:06:20.312097 IP 10.0.0.1.54965 > 10.0.0.4.5001: UDP, length 1470
19:06:20.323100 IP 10.0.0.1.54965 > 10.0.0.4.5001: UDP, length 1470
19:06:20.334490 IP 10.0.0.1.54965 > 10.0.0.4.5001: UDP, length 1470
19:06:20.345623 IP 10.0.0.1.54965 > 10.0.0.4.5001: UDP, length 1470
19:06:20.356747 IP 10.0.0.1.54965 > 10.0.0.4.5001: UDP, length 1470
19:06:20.367782 IP 10.0.0.1.54965 > 10.0.0.4.5001: UDP, length 1470
19:06:20.378834 IP 10.0.0.1.54965 > 10.0.0.4.5001: UDP, length 1470
19:06:20.390514 IP 10.0.0.1.54965 > 10.0.0.4.5001: UDP, length 1470
19:06:20.402467 IP 10.0.0.1.54965 > 10.0.0.4.5001: UDP, length 1470
19:06:20.414293 IP 10.0.0.1.54965 > 10.0.0.4.5001: UDP, length 1470
19:06:20.424205 IP 10.0.0.1.54965 > 10.0.0.4.5001: UDP, length 1470
19:06:20.434941 IP 10.0.0.1.54965 > 10.0.0.4.5001: UDP, length 1470
19:06:20.446164 IP 10.0.0.1.54965 > 10.0.0.4.5001: UDP, length 1470
19:06:20.457466 IP 10.0.0.1.54965 > 10.0.0.4.5001: UDP, length 1470
19:06:20.468934 IP 10.0.0.1.54965 > 10.0.0.4.5001: UDP, length 1470
19:06:20.481865 IP 10.0.0.1.54965 > 10.0.0.4.5001: UDP, length 1470
19:06:20.491262 IP 10.0.0.1.54965 > 10.0.0.4.5001: UDP, length 1470
19:06:20.502428 IP 10.0.0.1.54965 > 10.0.0.4.5001: UDP, length 1470
19:06:20.514137 IP 10.0.0.1.54965 > 10.0.0.4.5001: UDP, length 1470
19:06:20.524982 IP 10.0.0.1.54965 > 10.0.0.4.5001: UDP, length 1470
19:06:20.536400 IP 10.0.0.1.54965 > 10.0.0.4.5001: UDP, length 1470
19:06:20.547264 IP 10.0.0.1.54965 > 10.0.0.4.5001: UDP, length 1470
19:06:20.558917 IP 10.0.0.1.54965 > 10.0.0.4.5001: UDP, length 1470
19:06:20.569846 IP 10.0.0.1.54965 > 10.0.0.4.5001: UDP, length 1470
19:06:20.581179 IP 10.0.0.1.54965 > 10.0.0.4.5001: UDP, length 1470
19:06:20.592098 IP 10.0.0.1.54965 > 10.0.0.4.5001: UDP, length 1470
19:06:20.603177 IP 10.0.0.1.54965 > 10.0.0.4.5001: UDP, length 1470
19:06:20.614777 IP 10.0.0.1.54965 > 10.0.0.4.5001: UDP, length 1470
19:06:20.626075 IP 10.0.0.1.54965 > 10.0.0.4.5001: UDP, length 1470
19:06:20.637133 IP 10.0.0.1.54965 > 10.0.0.4.5001: UDP, length 1470
19:06:20.648318 IP 10.0.0.1.54965 > 10.0.0.4.5001: UDP, length 1470
19:06:20.659386 IP 10.0.0.1.54965 > 10.0.0.4.5001: UDP, length 1470
19:06:20.671006 IP 10.0.0.1.54965 > 10.0.0.4.5001: UDP, length 1470
19:06:20.682147 IP 10.0.0.1.54965 > 10.0.0.4.5001: UDP, length 1470
19:06:20.693167 IP 10.0.0.1.54965 > 10.0.0.4.5001: UDP, length 1470
19:06:20.704354 IP 10.0.0.1.54965 > 10.0.0.4.5001: UDP, length 1470
19:06:20.715387 IP 10.0.0.1.54965 > 10.0.0.4.5001: UDP, length 1470
19:06:20.727109 IP 10.0.0.1.54965 > 10.0.0.4.5001: UDP, length 1470
19:06:20.738117 IP 10.0.0.1.54965 > 10.0.0.4.5001: UDP, length 1470
19:06:20.749109 IP 10.0.0.1.54965 > 10.0.0.4.5001: UDP, length 1470
19:06:20.760930 IP 10.0.0.1.54965 > 10.0.0.4.5001: UDP, length 1470
19:06:20.771924 IP 10.0.0.1.54965 > 10.0.0.4.5001: UDP, length 1470
19:06:20.782975 IP 10.0.0.1.54965 > 10.0.0.4.5001: UDP, length 1470
19:06:20.794286 IP 10.0.0.1.54965 > 10.0.0.4.5001: UDP, length 1470
19:06:20.805379 IP 10.0.0.1.54965 > 10.0.0.4.5001: UDP, length 1470
19:06:20.816512 IP 10.0.0.1.54965 > 10.0.0.4.5001: UDP, length 1470
19:06:20.827599 IP 10.0.0.1.54965 > 10.0.0.4.5001: UDP, length 1470
19:06:20.839010 IP 10.0.0.1.54965 > 10.0.0.4.5001: UDP, length 1470
19:06:20.850441 IP 10.0.0.1.54965 > 10.0.0.4.5001: UDP, length 1470
19:06:20.861707 IP 10.0.0.1.54965 > 10.0.0.4.5001: UDP, length 1470
19:06:20.872657 IP 10.0.0.1.54965 > 10.0.0.4.5001: UDP, length 1470
19:06:20.883754 IP 10.0.0.1.54965 > 10.0.0.4.5001: UDP, length 1470
19:06:20.894748 IP 10.0.0.1.54965 > 10.0.0.4.5001: UDP, length 1470
19:06:20.907051 IP 10.0.0.1.54965 > 10.0.0.4.5001: UDP, length 1470
19:06:20.919384 IP 10.0.0.1.54965 > 10.0.0.4.5001: UDP, length 1470
19:06:20.930227 IP 10.0.0.1.54965 > 10.0.0.4.5001: UDP, length 1470
19:06:20.939736 IP 10.0.0.1.54965 > 10.0.0.4.5001: UDP, length 1470
19:06:20.951287 IP 10.0.0.1.54965 > 10.0.0.4.5001: UDP, length 1470
19:06:20.962243 IP 10.0.0.1.54965 > 10.0.0.4.5001: UDP, length 1470
19:06:20.973688 IP 10.0.0.1.54965 > 10.0.0.4.5001: UDP, length 1470
19:06:20.985210 IP 10.0.0.1.54965 > 10.0.0.4.5001: UDP, length 1470
19:06:20.996563 IP 10.0.0.1.54965 > 10.0.0.4.5001: UDP, length 1470
19:06:21.007270 IP 10.0.0.1.54965 > 10.0.0.4.5001: UDP, length 1470
19:06:21.018727 IP 10.0.0.1.54965 > 10.0.0.4.5001: UDP, length 1470
19:06:21.029830 IP 10.0.0.1.54965 > 10.0.0.4.5001: UDP, length 1470
19:06:21.040740 IP 10.0.0.1.54965 > 10.0.0.4.5001: UDP, length 1470
19:06:21.052027 IP 10.0.0.1.54965 > 10.0.0.4.5001: UDP, length 1470
19:06:21.063334 IP 10.0.0.1.54965 > 10.0.0.4.5001: UDP, length 1470
19:06:21.074441 IP 10.0.0.1.54965 > 10.0.0.4.5001: UDP, length 1470
19:06:21.085762 IP 10.0.0.1.54965 > 10.0.0.4.5001: UDP, length 1470
19:06:21.096975 IP 10.0.0.1.54965 > 10.0.0.4.5001: UDP, length 1470
19:06:21.108035 IP 10.0.0.1.54965 > 10.0.0.4.5001: UDP, length 1470
19:06:21.119242 IP 10.0.0.1.54965 > 10.0.0.4.5001: UDP, length 1470
19:06:21.130938 IP 10.0.0.1.54965 > 10.0.0.4.5001: UDP, length 1470
19:06:21.141767 IP 10.0.0.1.54965 > 10.0.0.4.5001: UDP, length 1470
19:06:21.153066 IP 10.0.0.1.54965 > 10.0.0.4.5001: UDP, length 1470
19:06:21.164059 IP 10.0.0.1.54965 > 10.0.0.4.5001: UDP, length 1470
19:06:21.175209 IP 10.0.0.1.54965 > 10.0.0.4.5001: UDP, length 1470
19:06:21.187740 IP 10.0.0.1.54965 > 10.0.0.4.5001: UDP, length 1470
19:06:21.198693 IP 10.0.0.1.54965 > 10.0.0.4.5001: UDP, length 1470
19:06:21.209057 IP 10.0.0.1.54965 > 10.0.0.4.5001: UDP, length 1470
19:06:21.220434 IP 10.0.0.1.54965 > 10.0.0.4.5001: UDP, length 1470
19:06:21.231429 IP 10.0.0.1.54965 > 10.0.0.4.5001: UDP, length 1470
19:06:21.242499 IP 10.0.0.1.54965 > 10.0.0.4.5001: UDP, length 1470
19:06:21.254042 IP 10.0.0.1.54965 > 10.0.0.4.5001: UDP, length 1470
19:06:21.265280 IP 10.0.0.1.54965 > 10.0.0.4.5001: UDP, length 1470
19:06:21.276537 IP 10.0.0.1.54965 > 10.0.0.4.5001: UDP, length 1470
19:06:21.287239 IP 10.0.0.1.54965 > 10.0.0.4.5001: UDP, length 1470
19:06:21.299148 IP 10.0.0.1.54965 > 10.0.0.4.5001: UDP, length 1470
19:06:21.310263 IP 10.0.0.1.54965 > 10.0.0.4.5001: UDP, length 1470
19:06:21.321406 IP 10.0.0.1.54965 > 10.0.0.4.5001: UDP, length 1470
19:06:21.332492 IP 10.0.0.1.54965 > 10.0.0.4.5001: UDP, length 1470
19:06:21.343621 IP 10.0.0.1.54965 > 10.0.0.4.5001: UDP, length 1470
19:06:21.355227 IP 10.0.0.1.54965 > 10.0.0.4.5001: UDP, length 1470
19:06:21.366288 IP 10.0.0.1.54965 > 10.0.0.4.5001: UDP, length 1470
19:06:21.377390 IP 10.0.0.1.54965 > 10.0.0.4.5001: UDP, length 1470
19:06:21.388592 IP 10.0.0.1.54965 > 10.0.0.4.5001: UDP, length 1470
19:06:21.399454 IP 10.0.0.1.54965 > 10.0.0.4.5001: UDP, length 1470
19:06:21.411099 IP 10.0.0.1.54965 > 10.0.0.4.5001: UDP, length 1470
19:06:21.422466 IP 10.0.0.1.54965 > 10.0.0.4.5001: UDP, length 1470
19:06:21.433626 IP 10.0.0.1.54965 > 10.0.0.4.5001: UDP, length 1470
19:06:21.444312 IP 10.0.0.1.54965 > 10.0.0.4.5001: UDP, length 1470
19:06:21.455478 IP 10.0.0.1.54965 > 10.0.0.4.5001: UDP, length 1470
19:06:21.467205 IP 10.0.0.1.54965 > 10.0.0.4.5001: UDP, length 1470
19:06:21.478384 IP 10.0.0.1.54965 > 10.0.0.4.5001: UDP, length 1470
19:06:21.489507 IP 10.0.0.1.54965 > 10.0.0.4.5001: UDP, length 1470
19:06:21.500609 IP 10.0.0.1.54965 > 10.0.0.4.5001: UDP, length 1470
19:06:21.511607 IP 10.0.0.1.54965 > 10.0.0.4.5001: UDP, length 1470
19:06:21.523213 IP 10.0.0.1.54965 > 10.0.0.4.5001: UDP, length 1470
19:06:21.534451 IP 10.0.0.1.54965 > 10.0.0.4.5001: UDP, length 1470
19:06:21.545408 IP 10.0.0.1.54965 > 10.0.0.4.5001: UDP, length 1470
19:06:21.556582 IP 10.0.0.1.54965 > 10.0.0.4.5001: UDP, length 1470
19:06:21.567774 IP 10.0.0.1.54965 > 10.0.0.4.5001: UDP, length 1470
19:06:21.578967 IP 10.0.0.1.54965 > 10.0.0.4.5001: UDP, length 1470
19:06:21.590412 IP 10.0.0.1.54965 > 10.0.0.4.5001: UDP, length 1470
19:06:21.601725 IP 10.0.0.1.54965 > 10.0.0.4.5001: UDP, length 1470
19:06:21.612859 IP 10.0.0.1.54965 > 10.0.0.4.5001: UDP, length 1470
19:06:21.623950 IP 10.0.0.1.54965 > 10.0.0.4.5001: UDP, length 1470
19:06:21.634979 IP 10.0.0.1.54965 > 10.0.0.4.5001: UDP, length 1470
19:06:21.646834 IP 10.0.0.1.54965 > 10.0.0.4.5001: UDP, length 1470
19:06:21.657804 IP 10.0.0.1.54965 > 10.0.0.4.5001: UDP, length 1470
19:06:21.668734 IP 10.0.0.1.54965 > 10.0.0.4.5001: UDP, length 1470
19:06:21.680087 IP 10.0.0.1.54965 > 10.0.0.4.5001: UDP, length 1470
19:06:21.691296 IP 10.0.0.1.54965 > 10.0.0.4.5001: UDP, length 1470
19:06:21.702991 IP 10.0.0.1.54965 > 10.0.0.4.5001: UDP, length 1470
19:06:21.713932 IP 10.0.0.1.54965 > 10.0.0.4.5001: UDP, length 1470
19:06:21.724795 IP 10.0.0.1.54965 > 10.0.0.4.5001: UDP, length 1470
19:06:21.736023 IP 10.0.0.1.54965 > 10.0.0.4.5001: UDP, length 1470
19:06:21.747006 IP 10.0.0.1.54965 > 10.0.0.4.5001: UDP, length 1470
19:06:21.758861 IP 10.0.0.1.54965 > 10.0.0.4.5001: UDP, length 1470
19:06:21.769867 IP 10.0.0.1.54965 > 10.0.0.4.5001: UDP, length 1470
19:06:21.781020 IP 10.0.0.1.54965 > 10.0.0.4.5001: UDP, length 1470
19:06:21.791982 IP 10.0.0.1.54965 > 10.0.0.4.5001: UDP, length 1470
19:06:21.803298 IP 10.0.0.1.54965 > 10.0.0.4.5001: UDP, length 1470
19:06:21.814793 IP 10.0.0.1.54965 > 10.0.0.4.5001: UDP, length 1470
19:06:21.826087 IP 10.0.0.1.54965 > 10.0.0.4.5001: UDP, length 1470
19:06:21.837214 IP 10.0.0.1.54965 > 10.0.0.4.5001: UDP, length 1470
19:06:21.848341 IP 10.0.0.1.54965 > 10.0.0.4.5001: UDP, length 1470
19:06:21.859341 IP 10.0.0.1.54965 > 10.0.0.4.5001: UDP, length 1470
19:06:21.870762 IP 10.0.0.1.54965 > 10.0.0.4.5001: UDP, length 1470
19:06:21.881986 IP 10.0.0.1.54965 > 10.0.0.4.5001: UDP, length 1470
19:06:21.893287 IP 10.0.0.1.54965 > 10.0.0.4.5001: UDP, length 1470
19:06:21.904410 IP 10.0.0.1.54965 > 10.0.0.4.5001: UDP, length 1470
19:06:21.915454 IP 10.0.0.1.54965 > 10.0.0.4.5001: UDP, length 1470
19:06:21.927211 IP 10.0.0.1.54965 > 10.0.0.4.5001: UDP, length 1470
19:06:21.938242 IP 10.0.0.1.54965 > 10.0.0.4.5001: UDP, length 1470
19:06:21.949255 IP 10.0.0.1.54965 > 10.0.0.4.5001: UDP, length 1470
19:06:21.960472 IP 10.0.0.1.54965 > 10.0.0.4.5001: UDP, length 1470
19:06:21.973600 IP 10.0.0.1.54965 > 10.0.0.4.5001: UDP, length 1470
19:06:21.982869 IP 10.0.0.1.54965 > 10.0.0.4.5001: UDP, length 1470
19:06:21.993916 IP 10.0.0.1.54965 > 10.0.0.4.5001: UDP, length 1470
19:06:22.006116 IP 10.0.0.1.54965 > 10.0.0.4.5001: UDP, length 1470
19:06:22.016910 IP 10.0.0.1.54965 > 10.0.0.4.5001: UDP, length 1470
19:06:22.027519 IP 10.0.0.1.54965 > 10.0.0.4.5001: UDP, length 1470
19:06:22.039105 IP 10.0.0.1.54965 > 10.0.0.4.5001: UDP, length 1470
19:06:22.050104 IP 10.0.0.1.54965 > 10.0.0.4.5001: UDP, length 1470
19:06:22.061195 IP 10.0.0.1.54965 > 10.0.0.4.5001: UDP, length 1470
19:06:22.072618 IP 10.0.0.1.54965 > 10.0.0.4.5001: UDP, length 1470
19:06:22.083843 IP 10.0.0.1.54965 > 10.0.0.4.5001: UDP, length 1470
19:06:22.095364 IP 10.0.0.1.54965 > 10.0.0.4.5001: UDP, length 1470
19:06:22.106571 IP 10.0.0.1.54965 > 10.0.0.4.5001: UDP, length 1470
19:06:22.117821 IP 10.0.0.1.54965 > 10.0.0.4.5001: UDP, length 1470
19:06:22.128802 IP 10.0.0.1.54965 > 10.0.0.4.5001: UDP, length 1470
19:06:22.139867 IP 10.0.0.1.54965 > 10.0.0.4.5001: UDP, length 1470
19:06:22.151118 IP 10.0.0.1.54965 > 10.0.0.4.5001: UDP, length 1470
19:06:22.162401 IP 10.0.0.1.54965 > 10.0.0.4.5001: UDP, length 1470
19:06:22.173662 IP 10.0.0.1.54965 > 10.0.0.4.5001: UDP, length 1470
19:06:22.184651 IP 10.0.0.1.54965 > 10.0.0.4.5001: UDP, length 1470
19:06:22.195945 IP 10.0.0.1.54965 > 10.0.0.4.5001: UDP, length 1470
19:06:22.207027 IP 10.0.0.1.54965 > 10.0.0.4.5001: UDP, length 1470
19:06:22.218559 IP 10.0.0.1.54965 > 10.0.0.4.5001: UDP, length 1470
19:06:22.229970 IP 10.0.0.1.54965 > 10.0.0.4.5001: UDP, length 1470
19:06:22.240947 IP 10.0.0.1.54965 > 10.0.0.4.5001: UDP, length 1470
19:06:22.252238 IP 10.0.0.1.54965 > 10.0.0.4.5001: UDP, length 1470
19:06:22.263251 IP 10.0.0.1.54965 > 10.0.0.4.5001: UDP, length 1470
19:06:22.274703 IP 10.0.0.1.54965 > 10.0.0.4.5001: UDP, length 1470
19:06:22.285532 IP 10.0.0.1.54965 > 10.0.0.4.5001: UDP, length 1470
19:06:22.297112 IP 10.0.0.1.54965 > 10.0.0.4.5001: UDP, length 1470
19:06:22.308308 IP 10.0.0.1.54965 > 10.0.0.4.5001: UDP, length 1470
19:06:22.319307 IP 10.0.0.1.54965 > 10.0.0.4.5001: UDP, length 1470
19:06:22.330934 IP 10.0.0.1.54965 > 10.0.0.4.5001: UDP, length 1470
19:06:22.341930 IP 10.0.0.1.54965 > 10.0.0.4.5001: UDP, length 1470
19:06:22.352999 IP 10.0.0.1.54965 > 10.0.0.4.5001: UDP, length 1470
19:06:22.364369 IP 10.0.0.1.54965 > 10.0.0.4.5001: UDP, length 1470
19:06:22.375420 IP 10.0.0.1.54965 > 10.0.0.4.5001: UDP, length 1470
19:06:22.387210 IP 10.0.0.1.54965 > 10.0.0.4.5001: UDP, length 1470
19:06:22.398231 IP 10.0.0.1.54965 > 10.0.0.4.5001: UDP, length 1470
19:06:22.409415 IP 10.0.0.1.54965 > 10.0.0.4.5001: UDP, length 1470
19:06:22.420406 IP 10.0.0.1.54965 > 10.0.0.4.5001: UDP, length 1470
19:06:22.431499 IP 10.0.0.1.54965 > 10.0.0.4.5001: UDP, length 1470
19:06:22.442997 IP 10.0.0.1.54965 > 10.0.0.4.5001: UDP, length 1470
19:06:22.454375 IP 10.0.0.1.54965 > 10.0.0.4.5001: UDP, length 1470
19:06:22.465645 IP 10.0.0.1.54965 > 10.0.0.4.5001: UDP, length 1470
19:06:22.476898 IP 10.0.0.1.54965 > 10.0.0.4.5001: UDP, length 1470
19:06:22.488573 IP 10.0.0.1.54965 > 10.0.0.4.5001: UDP, length 1470
19:06:22.499008 IP 10.0.0.1.54965 > 10.0.0.4.5001: UDP, length 1470
19:06:22.510971 IP 10.0.0.1.54965 > 10.0.0.4.5001: UDP, length 1470
19:06:22.521134 IP 10.0.0.1.54965 > 10.0.0.4.5001: UDP, length 1470
19:06:22.532169 IP 10.0.0.1.54965 > 10.0.0.4.5001: UDP, length 1470
19:06:22.543413 IP 10.0.0.1.54965 > 10.0.0.4.5001: UDP, length 1470
19:06:22.555069 IP 10.0.0.1.54965 > 10.0.0.4.5001: UDP, length 1470
19:06:22.566424 IP 10.0.0.1.54965 > 10.0.0.4.5001: UDP, length 1470
19:06:22.577358 IP 10.0.0.1.54965 > 10.0.0.4.5001: UDP, length 1470
19:06:22.588632 IP 10.0.0.1.54965 > 10.0.0.4.5001: UDP, length 1470
19:06:22.599642 IP 10.0.0.1.54965 > 10.0.0.4.5001: UDP, length 1470
19:06:22.611277 IP 10.0.0.1.54965 > 10.0.0.4.5001: UDP, length 1470
19:06:22.622341 IP 10.0.0.1.54965 > 10.0.0.4.5001: UDP, length 1470
19:06:22.633603 IP 10.0.0.1.54965 > 10.0.0.4.5001: UDP, length 1470
19:06:22.644494 IP 10.0.0.1.54965 > 10.0.0.4.5001: UDP, length 1470
19:06:22.655617 IP 10.0.0.1.54965 > 10.0.0.4.5001: UDP, length 1470
19:06:22.667125 IP 10.0.0.1.54965 > 10.0.0.4.5001: UDP, length 1470
19:06:22.678427 IP 10.0.0.1.54965 > 10.0.0.4.5001: UDP, length 1470
19:06:22.689548 IP 10.0.0.1.54965 > 10.0.0.4.5001: UDP, length 1470
19:06:22.700674 IP 10.0.0.1.54965 > 10.0.0.4.5001: UDP, length 1470
19:06:22.711638 IP 10.0.0.1.54965 > 10.0.0.4.5001: UDP, length 1470
19:06:22.723317 IP 10.0.0.1.54965 > 10.0.0.4.5001: UDP, length 1470
19:06:22.734483 IP 10.0.0.1.54965 > 10.0.0.4.5001: UDP, length 1470
19:06:22.745384 IP 10.0.0.1.54965 > 10.0.0.4.5001: UDP, length 1470
19:06:22.756684 IP 10.0.0.1.54965 > 10.0.0.4.5001: UDP, length 1470
19:06:22.767762 IP 10.0.0.1.54965 > 10.0.0.4.5001: UDP, length 1470
19:06:22.779332 IP 10.0.0.1.54965 > 10.0.0.4.5001: UDP, length 1470
19:06:22.790289 IP 10.0.0.1.54965 > 10.0.0.4.5001: UDP, length 1470
19:06:22.801474 IP 10.0.0.1.54965 > 10.0.0.4.5001: UDP, length 1470
19:06:22.812649 IP 10.0.0.1.54965 > 10.0.0.4.5001: UDP, length 1470
19:06:22.824010 IP 10.0.0.1.54965 > 10.0.0.4.5001: UDP, length 1470
19:06:22.835133 IP 10.0.0.1.54965 > 10.0.0.4.5001: UDP, length 1470
19:06:22.846892 IP 10.0.0.1.54965 > 10.0.0.4.5001: UDP, length 1470
19:06:22.858268 IP 10.0.0.1.54965 > 10.0.0.4.5001: UDP, length 1470
19:06:22.868971 IP 10.0.0.1.54965 > 10.0.0.4.5001: UDP, length 1470
19:06:22.880015 IP 10.0.0.1.54965 > 10.0.0.4.5001: UDP, length 1470
19:06:22.891308 IP 10.0.0.1.54965 > 10.0.0.4.5001: UDP, length 1470
19:06:22.902790 IP 10.0.0.1.54965 > 10.0.0.4.5001: UDP, length 1470
19:06:22.913844 IP 10.0.0.1.54965 > 10.0.0.4.5001: UDP, length 1470
19:06:22.924974 IP 10.0.0.1.54965 > 10.0.0.4.5001: UDP, length 1470
19:06:22.936107 IP 10.0.0.1.54965 > 10.0.0.4.5001: UDP, length 1470
19:06:22.947557 IP 10.0.0.1.54965 > 10.0.0.4.5001: UDP, length 1470
19:06:22.958350 IP 10.0.0.1.54965 > 10.0.0.4.5001: UDP, length 1470
19:06:22.969686 IP 10.0.0.1.54965 > 10.0.0.4.5001: UDP, length 1470
19:06:22.980944 IP 10.0.0.1.54965 > 10.0.0.4.5001: UDP, length 1470
19:06:22.992049 IP 10.0.0.1.54965 > 10.0.0.4.5001: UDP, length 1470
19:06:23.003158 IP 10.0.0.1.54965 > 10.0.0.4.5001: UDP, length 1470
19:06:23.015037 IP 10.0.0.1.54965 > 10.0.0.4.5001: UDP, length 1470
19:06:23.025996 IP 10.0.0.1.54965 > 10.0.0.4.5001: UDP, length 1470
19:06:23.037009 IP 10.0.0.1.54965 > 10.0.0.4.5001: UDP, length 1470
19:06:23.048243 IP 10.0.0.1.54965 > 10.0.0.4.5001: UDP, length 1470
19:06:23.059667 IP 10.0.0.1.54965 > 10.0.0.4.5001: UDP, length 1470
19:06:23.070665 IP 10.0.0.1.54965 > 10.0.0.4.5001: UDP, length 1470
19:06:23.081784 IP 10.0.0.1.54965 > 10.0.0.4.5001: UDP, length 1470
19:06:23.093130 IP 10.0.0.1.54965 > 10.0.0.4.5001: UDP, length 1470
19:06:23.104847 IP 10.0.0.1.54965 > 10.0.0.4.5001: UDP, length 1470
19:06:23.116036 IP 10.0.0.1.54965 > 10.0.0.4.5001: UDP, length 1470
19:06:23.127061 IP 10.0.0.1.54965 > 10.0.0.4.5001: UDP, length 1470
19:06:23.137887 IP 10.0.0.1.54965 > 10.0.0.4.5001: UDP, length 1470
19:06:23.149270 IP 10.0.0.1.54965 > 10.0.0.4.5001: UDP, length 1470
19:06:23.160294 IP 10.0.0.1.54965 > 10.0.0.4.5001: UDP, length 1470
19:06:23.171595 IP 10.0.0.1.54965 > 10.0.0.4.5001: UDP, length 1470
19:06:23.182884 IP 10.0.0.1.54965 > 10.0.0.4.5001: UDP, length 1470
19:06:23.195008 IP 10.0.0.1.54965 > 10.0.0.4.5001: UDP, length 1470
19:06:23.205573 IP 10.0.0.1.54965 > 10.0.0.4.5001: UDP, length 1470
19:06:23.216553 IP 10.0.0.1.54965 > 10.0.0.4.5001: UDP, length 1470
19:06:23.227606 IP 10.0.0.1.54965 > 10.0.0.4.5001: UDP, length 1470
19:06:23.239319 IP 10.0.0.1.54965 > 10.0.0.4.5001: UDP, length 1470
19:06:23.250357 IP 10.0.0.1.54965 > 10.0.0.4.5001: UDP, length 1470
19:06:23.261654 IP 10.0.0.1.54965 > 10.0.0.4.5001: UDP, length 1470
19:06:23.273087 IP 10.0.0.1.54965 > 10.0.0.4.5001: UDP, length 1470
19:06:23.283849 IP 10.0.0.1.54965 > 10.0.0.4.5001: UDP, length 1470
19:06:23.294888 IP 10.0.0.1.54965 > 10.0.0.4.5001: UDP, length 1470
19:06:23.306209 IP 10.0.0.1.54965 > 10.0.0.4.5001: UDP, length 1470
19:06:23.317962 IP 10.0.0.1.54965 > 10.0.0.4.5001: UDP, length 1470
19:06:23.328807 IP 10.0.0.1.54965 > 10.0.0.4.5001: UDP, length 1470
19:06:23.339808 IP 10.0.0.1.54965 > 10.0.0.4.5001: UDP, length 1470
19:06:23.351332 IP 10.0.0.1.54965 > 10.0.0.4.5001: UDP, length 1470
19:06:23.362692 IP 10.0.0.1.54965 > 10.0.0.4.5001: UDP, length 1470
19:06:23.373680 IP 10.0.0.1.54965 > 10.0.0.4.5001: UDP, length 1470
19:06:23.384809 IP 10.0.0.1.54965 > 10.0.0.4.5001: UDP, length 1470
19:06:23.395897 IP 10.0.0.1.54965 > 10.0.0.4.5001: UDP, length 1470
19:06:23.407271 IP 10.0.0.1.54965 > 10.0.0.4.5001: UDP, length 1470
19:06:23.418434 IP 10.0.0.1.54965 > 10.0.0.4.5001: UDP, length 1470
19:06:23.429867 IP 10.0.0.1.54965 > 10.0.0.4.5001: UDP, length 1470
19:06:23.440875 IP 10.0.0.1.54965 > 10.0.0.4.5001: UDP, length 1470
19:06:23.451993 IP 10.0.0.1.54965 > 10.0.0.4.5001: UDP, length 1470
19:06:23.462966 IP 10.0.0.1.54965 > 10.0.0.4.5001: UDP, length 1470
19:06:23.474705 IP 10.0.0.1.54965 > 10.0.0.4.5001: UDP, length 1470
19:06:23.485895 IP 10.0.0.1.54965 > 10.0.0.4.5001: UDP, length 1470
19:06:23.497036 IP 10.0.0.1.54965 > 10.0.0.4.5001: UDP, length 1470
19:06:23.508175 IP 10.0.0.1.54965 > 10.0.0.4.5001: UDP, length 1470
19:06:23.519344 IP 10.0.0.1.54965 > 10.0.0.4.5001: UDP, length 1470
19:06:23.530976 IP 10.0.0.1.54965 > 10.0.0.4.5001: UDP, length 1470
19:06:23.541711 IP 10.0.0.1.54965 > 10.0.0.4.5001: UDP, length 1470
19:06:23.553130 IP 10.0.0.1.54965 > 10.0.0.4.5001: UDP, length 1470
19:06:23.564178 IP 10.0.0.1.54965 > 10.0.0.4.5001: UDP, length 1470
19:06:23.575208 IP 10.0.0.1.54965 > 10.0.0.4.5001: UDP, length 1470
19:06:23.586959 IP 10.0.0.1.54965 > 10.0.0.4.5001: UDP, length 1470
19:06:23.598154 IP 10.0.0.1.54965 > 10.0.0.4.5001: UDP, length 1470
19:06:23.609461 IP 10.0.0.1.54965 > 10.0.0.4.5001: UDP, length 1470
19:06:23.620339 IP 10.0.0.1.54965 > 10.0.0.4.5001: UDP, length 1470
19:06:23.631361 IP 10.0.0.1.54965 > 10.0.0.4.5001: UDP, length 1470
19:06:23.642774 IP 10.0.0.1.54965 > 10.0.0.4.5001: UDP, length 1470
19:06:23.653697 IP 10.0.0.1.54965 > 10.0.0.4.5001: UDP, length 1470
19:06:23.665196 IP 10.0.0.1.54965 > 10.0.0.4.5001: UDP, length 1470
19:06:23.676339 IP 10.0.0.1.54965 > 10.0.0.4.5001: UDP, length 1470
19:06:23.687444 IP 10.0.0.1.54965 > 10.0.0.4.5001: UDP, length 1470
19:06:23.699130 IP 10.0.0.1.54965 > 10.0.0.4.5001: UDP, length 1470
19:06:23.710265 IP 10.0.0.1.54965 > 10.0.0.4.5001: UDP, length 1470
19:06:23.721402 IP 10.0.0.1.54965 > 10.0.0.4.5001: UDP, length 1470
19:06:23.732496 IP 10.0.0.1.54965 > 10.0.0.4.5001: UDP, length 1470
19:06:23.743472 IP 10.0.0.1.54965 > 10.0.0.4.5001: UDP, length 1470
19:06:23.755043 IP 10.0.0.1.54965 > 10.0.0.4.5001: UDP, length 1470
19:06:23.766325 IP 10.0.0.1.54965 > 10.0.0.4.5001: UDP, length 1470
19:06:23.777295 IP 10.0.0.1.54965 > 10.0.0.4.5001: UDP, length 1470
19:06:23.788418 IP 10.0.0.1.54965 > 10.0.0.4.5001: UDP, length 1470
19:06:23.799648 IP 10.0.0.1.54965 > 10.0.0.4.5001: UDP, length 1470
19:06:23.811189 IP 10.0.0.1.54965 > 10.0.0.4.5001: UDP, length 1470
19:06:23.821978 IP 10.0.0.1.54965 > 10.0.0.4.5001: UDP, length 1470
19:06:23.833551 IP 10.0.0.1.54965 > 10.0.0.4.5001: UDP, length 1470
19:06:23.844638 IP 10.0.0.1.54965 > 10.0.0.4.5001: UDP, length 1470
19:06:23.855702 IP 10.0.0.1.54965 > 10.0.0.4.5001: UDP, length 1470
19:06:23.867301 IP 10.0.0.1.54965 > 10.0.0.4.5001: UDP, length 1470
19:06:23.878492 IP 10.0.0.1.54965 > 10.0.0.4.5001: UDP, length 1470
19:06:23.889751 IP 10.0.0.1.54965 > 10.0.0.4.5001: UDP, length 1470
19:06:23.900739 IP 10.0.0.1.54965 > 10.0.0.4.5001: UDP, length 1470
19:06:23.911796 IP 10.0.0.1.54965 > 10.0.0.4.5001: UDP, length 1470
19:06:23.923292 IP 10.0.0.1.54965 > 10.0.0.4.5001: UDP, length 1470
19:06:23.934175 IP 10.0.0.1.54965 > 10.0.0.4.5001: UDP, length 1470
19:06:23.945482 IP 10.0.0.1.54965 > 10.0.0.4.5001: UDP, length 1470
19:06:23.956794 IP 10.0.0.1.54965 > 10.0.0.4.5001: UDP, length 1470
19:06:23.967936 IP 10.0.0.1.54965 > 10.0.0.4.5001: UDP, length 1470
19:06:23.979177 IP 10.0.0.1.54965 > 10.0.0.4.5001: UDP, length 1470
19:06:23.990686 IP 10.0.0.1.54965 > 10.0.0.4.5001: UDP, length 1470
19:06:24.001762 IP 10.0.0.1.54965 > 10.0.0.4.5001: UDP, length 1470
19:06:24.012877 IP 10.0.0.1.54965 > 10.0.0.4.5001: UDP, length 1470
19:06:24.023986 IP 10.0.0.1.54965 > 10.0.0.4.5001: UDP, length 1470
19:06:24.035200 IP 10.0.0.1.54965 > 10.0.0.4.5001: UDP, length 1470
19:06:24.047024 IP 10.0.0.1.54965 > 10.0.0.4.5001: UDP, length 1470
19:06:24.057901 IP 10.0.0.1.54965 > 10.0.0.4.5001: UDP, length 1470
19:06:24.069010 IP 10.0.0.1.54965 > 10.0.0.4.5001: UDP, length 1470
19:06:24.080064 IP 10.0.0.1.54965 > 10.0.0.4.5001: UDP, length 1470
19:06:24.091391 IP 10.0.0.1.54965 > 10.0.0.4.5001: UDP, length 1470
19:06:24.102507 IP 10.0.0.1.54965 > 10.0.0.4.5001: UDP, length 1470
19:06:24.113773 IP 10.0.0.1.54965 > 10.0.0.4.5001: UDP, length 1470
19:06:24.125207 IP 10.0.0.1.54965 > 10.0.0.4.5001: UDP, length 1470
19:06:24.136192 IP 10.0.0.1.54965 > 10.0.0.4.5001: UDP, length 1470
19:06:24.147082 IP 10.0.0.1.54965 > 10.0.0.4.5001: UDP, length 1470
19:06:24.158501 IP 10.0.0.1.54965 > 10.0.0.4.5001: UDP, length 1470
19:06:24.170275 IP 10.0.0.1.54965 > 10.0.0.4.5001: UDP, length 1470
19:06:24.181176 IP 10.0.0.1.54965 > 10.0.0.4.5001: UDP, length 1470
19:06:24.192214 IP 10.0.0.1.54965 > 10.0.0.4.5001: UDP, length 1470
19:06:24.203329 IP 10.0.0.1.54965 > 10.0.0.4.5001: UDP, length 1470
19:06:24.215072 IP 10.0.0.1.54965 > 10.0.0.4.5001: UDP, length 1470
19:06:24.225994 IP 10.0.0.1.54965 > 10.0.0.4.5001: UDP, length 1470
19:06:24.237362 IP 10.0.0.1.54965 > 10.0.0.4.5001: UDP, length 1470
19:06:24.248351 IP 10.0.0.1.54965 > 10.0.0.4.5001: UDP, length 1470
19:06:24.259477 IP 10.0.0.1.54965 > 10.0.0.4.5001: UDP, length 1470
19:06:24.271724 IP 10.0.0.1.54965 > 10.0.0.4.5001: UDP, length 1470
19:06:24.282743 IP 10.0.0.1.54965 > 10.0.0.4.5001: UDP, length 1470
19:06:24.293357 IP 10.0.0.1.54965 > 10.0.0.4.5001: UDP, length 1470
19:06:24.304535 IP 10.0.0.1.54965 > 10.0.0.4.5001: UDP, length 1470
19:06:24.315582 IP 10.0.0.1.54965 > 10.0.0.4.5001: UDP, length 1470
19:06:24.327314 IP 10.0.0.1.54965 > 10.0.0.4.5001: UDP, length 1470
19:06:24.338244 IP 10.0.0.1.54965 > 10.0.0.4.5001: UDP, length 1470
19:06:24.349526 IP 10.0.0.1.54965 > 10.0.0.4.5001: UDP, length 1470
19:06:24.360573 IP 10.0.0.1.54965 > 10.0.0.4.5001: UDP, length 1470
19:06:24.371449 IP 10.0.0.1.54965 > 10.0.0.4.5001: UDP, length 1470
19:06:24.383299 IP 10.0.0.1.54965 > 10.0.0.4.5001: UDP, length 1470
19:06:24.394443 IP 10.0.0.1.54965 > 10.0.0.4.5001: UDP, length 1470
19:06:24.405558 IP 10.0.0.1.54965 > 10.0.0.4.5001: UDP, length 1470
19:06:24.416519 IP 10.0.0.1.54965 > 10.0.0.4.5001: UDP, length 1470
19:06:24.427824 IP 10.0.0.1.54965 > 10.0.0.4.5001: UDP, length 1470
19:06:24.439098 IP 10.0.0.1.54965 > 10.0.0.4.5001: UDP, length 1470
19:06:24.450534 IP 10.0.0.1.54965 > 10.0.0.4.5001: UDP, length 1470
19:06:24.461869 IP 10.0.0.1.54965 > 10.0.0.4.5001: UDP, length 1470
19:06:24.472627 IP 10.0.0.1.54965 > 10.0.0.4.5001: UDP, length 1470
19:06:24.483836 IP 10.0.0.1.54965 > 10.0.0.4.5001: UDP, length 1470
19:06:24.495389 IP 10.0.0.1.54965 > 10.0.0.4.5001: UDP, length 1470
19:06:24.506500 IP 10.0.0.1.54965 > 10.0.0.4.5001: UDP, length 1470
19:06:24.517504 IP 10.0.0.1.54965 > 10.0.0.4.5001: UDP, length 1470
19:06:24.528851 IP 10.0.0.1.54965 > 10.0.0.4.5001: UDP, length 1470
19:06:24.539902 IP 10.0.0.1.54965 > 10.0.0.4.5001: UDP, length 1470
19:06:24.551330 IP 10.0.0.1.54965 > 10.0.0.4.5001: UDP, length 1470
19:06:24.562744 IP 10.0.0.1.54965 > 10.0.0.4.5001: UDP, length 1470
19:06:24.573494 IP 10.0.0.1.54965 > 10.0.0.4.5001: UDP, length 1470
19:06:24.584716 IP 10.0.0.1.54965 > 10.0.0.4.5001: UDP, length 1470
19:06:24.596019 IP 10.0.0.1.54965 > 10.0.0.4.5001: UDP, length 1470
19:06:24.607171 IP 10.0.0.1.54965 > 10.0.0.4.5001: UDP, length 1470
19:06:24.618772 IP 10.0.0.1.54965 > 10.0.0.4.5001: UDP, length 1470
19:06:24.629390 IP 10.0.0.1.54965 > 10.0.0.4.5001: UDP, length 1470
19:06:24.640790 IP 10.0.0.1.54965 > 10.0.0.4.5001: UDP, length 1470
19:06:24.652235 IP 10.0.0.1.54965 > 10.0.0.4.5001: UDP, length 1470
19:06:24.663514 IP 10.0.0.1.54965 > 10.0.0.4.5001: UDP, length 1470
19:06:24.674959 IP 10.0.0.1.54965 > 10.0.0.4.5001: UDP, length 1470
19:06:24.685692 IP 10.0.0.1.54965 > 10.0.0.4.5001: UDP, length 1470
19:06:24.696857 IP 10.0.0.1.54965 > 10.0.0.4.5001: UDP, length 1470
19:06:24.707864 IP 10.0.0.1.54965 > 10.0.0.4.5001: UDP, length 1470
19:06:24.719212 IP 10.0.0.1.54965 > 10.0.0.4.5001: UDP, length 1470
19:06:24.730688 IP 10.0.0.1.54965 > 10.0.0.4.5001: UDP, length 1470
19:06:24.741864 IP 10.0.0.1.54965 > 10.0.0.4.5001: UDP, length 1470
19:06:24.753144 IP 10.0.0.1.54965 > 10.0.0.4.5001: UDP, length 1470
19:06:24.764222 IP 10.0.0.1.54965 > 10.0.0.4.5001: UDP, length 1470
19:06:24.775291 IP 10.0.0.1.54965 > 10.0.0.4.5001: UDP, length 1470
19:06:24.786833 IP 10.0.0.1.54965 > 10.0.0.4.5001: UDP, length 1470
19:06:24.798029 IP 10.0.0.1.54965 > 10.0.0.4.5001: UDP, length 1470
19:06:24.809376 IP 10.0.0.1.54965 > 10.0.0.4.5001: UDP, length 1470
19:06:24.820384 IP 10.0.0.1.54965 > 10.0.0.4.5001: UDP, length 1470
19:06:24.831422 IP 10.0.0.1.54965 > 10.0.0.4.5001: UDP, length 1470
19:06:24.842872 IP 10.0.0.1.54965 > 10.0.0.4.5001: UDP, length 1470
19:06:24.854277 IP 10.0.0.1.54965 > 10.0.0.4.5001: UDP, length 1470
19:06:24.865464 IP 10.0.0.1.54965 > 10.0.0.4.5001: UDP, length 1470
19:06:24.876437 IP 10.0.0.1.54965 > 10.0.0.4.5001: UDP, length 1470
19:06:24.887691 IP 10.0.0.1.54965 > 10.0.0.4.5001: UDP, length 1470
19:06:24.899111 IP 10.0.0.1.54965 > 10.0.0.4.5001: UDP, length 1470
19:06:24.910375 IP 10.0.0.1.54965 > 10.0.0.4.5001: UDP, length 1470
19:06:24.921504 IP 10.0.0.1.54965 > 10.0.0.4.5001: UDP, length 1470
19:06:24.932648 IP 10.0.0.1.54965 > 10.0.0.4.5001: UDP, length 1470
19:06:24.943651 IP 10.0.0.1.54965 > 10.0.0.4.5001: UDP, length 1470
19:06:24.955351 IP 10.0.0.1.54965 > 10.0.0.4.5001: UDP, length 1470
19:06:24.966436 IP 10.0.0.1.54965 > 10.0.0.4.5001: UDP, length 1470
19:06:24.977491 IP 10.0.0.1.54965 > 10.0.0.4.5001: UDP, length 1470
19:06:24.988377 IP 10.0.0.1.54965 > 10.0.0.4.5001: UDP, length 1470
19:06:24.999675 IP 10.0.0.1.54965 > 10.0.0.4.5001: UDP, length 1470
19:06:25.011006 IP 10.0.0.1.54965 > 10.0.0.4.5001: UDP, length 1470
19:06:25.022579 IP 10.0.0.1.54965 > 10.0.0.4.5001: UDP, length 1470
19:06:25.033371 IP 10.0.0.1.54965 > 10.0.0.4.5001: UDP, length 1470
19:06:25.044657 IP 10.0.0.1.54965 > 10.0.0.4.5001: UDP, length 1470
19:06:25.055814 IP 10.0.0.1.54965 > 10.0.0.4.5001: UDP, length 1470
19:06:25.067130 IP 10.0.0.1.54965 > 10.0.0.4.5001: UDP, length 1470
19:06:25.078169 IP 10.0.0.1.54965 > 10.0.0.4.5001: UDP, length 1470
19:06:25.089641 IP 10.0.0.1.54965 > 10.0.0.4.5001: UDP, length 1470
19:06:25.100800 IP 10.0.0.1.54965 > 10.0.0.4.5001: UDP, length 1470
19:06:25.111948 IP 10.0.0.1.54965 > 10.0.0.4.5001: UDP, length 1470
19:06:25.123068 IP 10.0.0.1.54965 > 10.0.0.4.5001: UDP, length 1470
19:06:25.134513 IP 10.0.0.1.54965 > 10.0.0.4.5001: UDP, length 1470

