19:05:42.562948 IP 10.0.0.1.34711 > 10.0.0.3.5001: UDP, length 1470
19:05:42.574112 IP 10.0.0.1.34711 > 10.0.0.3.5001: UDP, length 1470
19:05:42.585343 IP 10.0.0.1.34711 > 10.0.0.3.5001: UDP, length 1470
19:05:42.596549 IP 10.0.0.1.34711 > 10.0.0.3.5001: UDP, length 1470
19:05:42.607675 IP 10.0.0.1.34711 > 10.0.0.3.5001: UDP, length 1470
19:05:42.619291 IP 10.0.0.1.34711 > 10.0.0.3.5001: UDP, length 1470
19:05:42.630065 IP 10.0.0.1.34711 > 10.0.0.3.5001: UDP, length 1470
19:05:42.641470 IP 10.0.0.1.34711 > 10.0.0.3.5001: UDP, length 1470
19:05:42.652710 IP 10.0.0.1.34711 > 10.0.0.3.5001: UDP, length 1470
19:05:42.663607 IP 10.0.0.1.34711 > 10.0.0.3.5001: UDP, length 1470
19:05:42.675328 IP 10.0.0.1.34711 > 10.0.0.3.5001: UDP, length 1470
19:05:42.686780 IP 10.0.0.1.34711 > 10.0.0.3.5001: UDP, length 1470
19:05:42.697300 IP 10.0.0.1.34711 > 10.0.0.3.5001: UDP, length 1470
19:05:42.708502 IP 10.0.0.1.34711 > 10.0.0.3.5001: UDP, length 1470
19:05:42.719614 IP 10.0.0.1.34711 > 10.0.0.3.5001: UDP, length 1470
19:05:42.730930 IP 10.0.0.1.34711 > 10.0.0.3.5001: UDP, length 1470
19:05:42.742330 IP 10.0.0.1.34711 > 10.0.0.3.5001: UDP, length 1470
19:05:42.753479 IP 10.0.0.1.34711 > 10.0.0.3.5001: UDP, length 1470
19:05:42.764605 IP 10.0.0.1.34711 > 10.0.0.3.5001: UDP, length 1470
19:05:42.775796 IP 10.0.0.1.34711 > 10.0.0.3.5001: UDP, length 1470
19:05:42.787112 IP 10.0.0.1.34711 > 10.0.0.3.5001: UDP, length 1470
19:05:42.798048 IP 10.0.0.1.34711 > 10.0.0.3.5001: UDP, length 1470
19:05:42.809672 IP 10.0.0.1.34711 > 10.0.0.3.5001: UDP, length 1470
19:05:42.820810 IP 10.0.0.1.34711 > 10.0.0.3.5001: UDP, length 1470
19:05:42.831892 IP 10.0.0.1.34711 > 10.0.0.3.5001: UDP, length 1470
19:05:42.842906 IP 10.0.0.1.34711 > 10.0.0.3.5001: UDP, length 1470
19:05:42.854489 IP 10.0.0.1.34711 > 10.0.0.3.5001: UDP, length 1470
19:05:42.865427 IP 10.0.0.1.34711 > 10.0.0.3.5001: UDP, length 1470
19:05:42.877082 IP 10.0.0.1.34711 > 10.0.0.3.5001: UDP, length 1470
19:05:42.888159 IP 10.0.0.1.34711 > 10.0.0.3.5001: UDP, length 1470
19:05:42.899345 IP 10.0.0.1.34711 > 10.0.0.3.5001: UDP, length 1470
19:05:42.910351 IP 10.0.0.1.34711 > 10.0.0.3.5001: UDP, length 1470
19:05:42.921717 IP 10.0.0.1.34711 > 10.0.0.3.5001: UDP, length 1470
19:05:42.932945 IP 10.0.0.1.34711 > 10.0.0.3.5001: UDP, length 1470
19:05:42.943929 IP 10.0.0.1.34711 > 10.0.0.3.5001: UDP, length 1470
19:05:42.955145 IP 10.0.0.1.34711 > 10.0.0.3.5001: UDP, length 1470
19:05:42.966311 IP 10.0.0.1.34711 > 10.0.0.3.5001: UDP, length 1470
19:05:42.977942 IP 10.0.0.1.34711 > 10.0.0.3.5001: UDP, length 1470
19:05:42.989146 IP 10.0.0.1.34711 > 10.0.0.3.5001: UDP, length 1470
19:05:43.000172 IP 10.0.0.1.34711 > 10.0.0.3.5001: UDP, length 1470
19:05:43.011306 IP 10.0.0.1.34711 > 10.0.0.3.5001: UDP, length 1470
19:05:43.022989 IP 10.0.0.1.34711 > 10.0.0.3.5001: UDP, length 1470
19:05:43.034034 IP 10.0.0.1.34711 > 10.0.0.3.5001: UDP, length 1470
19:05:43.045212 IP 10.0.0.1.34711 > 10.0.0.3.5001: UDP, length 1470
19:05:43.056120 IP 10.0.0.1.34711 > 10.0.0.3.5001: UDP, length 1470
19:05:43.067340 IP 10.0.0.1.34711 > 10.0.0.3.5001: UDP, length 1470
19:05:43.079023 IP 10.0.0.1.34711 > 10.0.0.3.5001: UDP, length 1470
19:05:43.090168 IP 10.0.0.1.34711 > 10.0.0.3.5001: UDP, length 1470
19:05:43.101279 IP 10.0.0.1.34711 > 10.0.0.3.5001: UDP, length 1470
19:05:43.112377 IP 10.0.0.1.34711 > 10.0.0.3.5001: UDP, length 1470
19:05:43.123364 IP 10.0.0.1.34711 > 10.0.0.3.5001: UDP, length 1470
19:05:43.135127 IP 10.0.0.1.34711 > 10.0.0.3.5001: UDP, length 1470
19:05:43.146226 IP 10.0.0.1.34711 > 10.0.0.3.5001: UDP, length 1470
19:05:43.157300 IP 10.0.0.1.34711 > 10.0.0.3.5001: UDP, length 1470
19:05:43.168484 IP 10.0.0.1.34711 > 10.0.0.3.5001: UDP, length 1470
19:05:43.179445 IP 10.0.0.1.34711 > 10.0.0.3.5001: UDP, length 1470
19:05:43.191156 IP 10.0.0.1.34711 > 10.0.0.3.5001: UDP, length 1470
19:05:43.202318 IP 10.0.0.1.34711 > 10.0.0.3.5001: UDP, length 1470
19:05:43.213121 IP 10.0.0.1.34711 > 10.0.0.3.5001: UDP, length 1470
19:05:43.224370 IP 10.0.0.1.34711 > 10.0.0.3.5001: UDP, length 1470
19:05:43.235639 IP 10.0.0.1.34711 > 10.0.0.3.5001: UDP, length 1470
19:05:43.247196 IP 10.0.0.1.34711 > 10.0.0.3.5001: UDP, length 1470
19:05:43.258385 IP 10.0.0.1.34711 > 10.0.0.3.5001: UDP, length 1470
19:05:43.269135 IP 10.0.0.1.34711 > 10.0.0.3.5001: UDP, length 1470
19:05:43.280705 IP 10.0.0.1.34711 > 10.0.0.3.5001: UDP, length 1470
19:05:43.292422 IP 10.0.0.1.34711 > 10.0.0.3.5001: UDP, length 1470
19:05:43.303495 IP 10.0.0.1.34711 > 10.0.0.3.5001: UDP, length 1470
19:05:43.314686 IP 10.0.0.1.34711 > 10.0.0.3.5001: UDP, length 1470
19:05:43.325964 IP 10.0.0.1.34711 > 10.0.0.3.5001: UDP, length 1470
19:05:43.336648 IP 10.0.0.1.34711 > 10.0.0.3.5001: UDP, length 1470
19:05:43.347959 IP 10.0.0.1.34711 > 10.0.0.3.5001: UDP, length 1470
19:05:43.359378 IP 10.0.0.1.34711 > 10.0.0.3.5001: UDP, length 1470
19:05:43.370278 IP 10.0.0.1.34711 > 10.0.0.3.5001: UDP, length 1470
19:05:43.381604 IP 10.0.0.1.34711 > 10.0.0.3.5001: UDP, length 1470
19:05:43.392859 IP 10.0.0.1.34711 > 10.0.0.3.5001: UDP, length 1470
19:05:43.403963 IP 10.0.0.1.34711 > 10.0.0.3.5001: UDP, length 1470
19:05:43.415254 IP 10.0.0.1.34711 > 10.0.0.3.5001: UDP, length 1470
19:05:43.426764 IP 10.0.0.1.34711 > 10.0.0.3.5001: UDP, length 1470
19:05:43.437807 IP 10.0.0.1.34711 > 10.0.0.3.5001: UDP, length 1470
19:05:43.448807 IP 10.0.0.1.34711 > 10.0.0.3.5001: UDP, length 1470
19:05:43.459854 IP 10.0.0.1.34711 > 10.0.0.3.5001: UDP, length 1470
19:05:43.471067 IP 10.0.0.1.34711 > 10.0.0.3.5001: UDP, length 1470
19:05:43.482893 IP 10.0.0.1.34711 > 10.0.0.3.5001: UDP, length 1470
19:05:43.493941 IP 10.0.0.1.34711 > 10.0.0.3.5001: UDP, length 1470
19:05:43.504991 IP 10.0.0.1.34711 > 10.0.0.3.5001: UDP, length 1470
19:05:43.516032 IP 10.0.0.1.34711 > 10.0.0.3.5001: UDP, length 1470
19:05:43.527259 IP 10.0.0.1.34711 > 10.0.0.3.5001: UDP, length 1470
19:05:43.538690 IP 10.0.0.1.34711 > 10.0.0.3.5001: UDP, length 1470
19:05:43.550078 IP 10.0.0.1.34711 > 10.0.0.3.5001: UDP, length 1470
19:05:43.561088 IP 10.0.0.1.34711 > 10.0.0.3.5001: UDP, length 1470
19:05:43.572196 IP 10.0.0.1.34711 > 10.0.0.3.5001: UDP, length 1470
19:05:43.583209 IP 10.0.0.1.34711 > 10.0.0.3.5001: UDP, length 1470
19:05:43.594985 IP 10.0.0.1.34711 > 10.0.0.3.5001: UDP, length 1470
19:05:43.606067 IP 10.0.0.1.34711 > 10.0.0.3.5001: UDP, length 1470
19:05:43.616969 IP 10.0.0.1.34711 > 10.0.0.3.5001: UDP, length 1470
19:05:43.628266 IP 10.0.0.1.34711 > 10.0.0.3.5001: UDP, length 1470
19:05:43.639285 IP 10.0.0.1.34711 > 10.0.0.3.5001: UDP, length 1470
19:05:43.651010 IP 10.0.0.1.34711 > 10.0.0.3.5001: UDP, length 1470
19:05:43.662066 IP 10.0.0.1.34711 > 10.0.0.3.5001: UDP, length 1470
19:05:43.673285 IP 10.0.0.1.34711 > 10.0.0.3.5001: UDP, length 1470
19:05:43.684381 IP 10.0.0.1.34711 > 10.0.0.3.5001: UDP, length 1470
19:05:43.695366 IP 10.0.0.1.34711 > 10.0.0.3.5001: UDP, length 1470
19:05:43.706780 IP 10.0.0.1.34711 > 10.0.0.3.5001: UDP, length 1470
19:05:43.717968 IP 10.0.0.1.34711 > 10.0.0.3.5001: UDP, length 1470
19:05:43.729306 IP 10.0.0.1.34711 > 10.0.0.3.5001: UDP, length 1470
19:05:43.740275 IP 10.0.0.1.34711 > 10.0.0.3.5001: UDP, length 1470
19:05:43.751322 IP 10.0.0.1.34711 > 10.0.0.3.5001: UDP, length 1470
19:05:43.763308 IP 10.0.0.1.34711 > 10.0.0.3.5001: UDP, length 1470
19:05:43.774320 IP 10.0.0.1.34711 > 10.0.0.3.5001: UDP, length 1470
19:05:43.785501 IP 10.0.0.1.34711 > 10.0.0.3.5001: UDP, length 1470
19:05:43.796576 IP 10.0.0.1.34711 > 10.0.0.3.5001: UDP, length 1470
19:05:43.807639 IP 10.0.0.1.34711 > 10.0.0.3.5001: UDP, length 1470
19:05:43.818984 IP 10.0.0.1.34711 > 10.0.0.3.5001: UDP, length 1470
19:05:43.830412 IP 10.0.0.1.34711 > 10.0.0.3.5001: UDP, length 1470
19:05:43.841302 IP 10.0.0.1.34711 > 10.0.0.3.5001: UDP, length 1470
19:05:43.852564 IP 10.0.0.1.34711 > 10.0.0.3.5001: UDP, length 1470
19:05:43.863782 IP 10.0.0.1.34711 > 10.0.0.3.5001: UDP, length 1470
19:05:43.875126 IP 10.0.0.1.34711 > 10.0.0.3.5001: UDP, length 1470
19:05:43.886541 IP 10.0.0.1.34711 > 10.0.0.3.5001: UDP, length 1470
19:05:43.897737 IP 10.0.0.1.34711 > 10.0.0.3.5001: UDP, length 1470
19:05:43.908715 IP 10.0.0.1.34711 > 10.0.0.3.5001: UDP, length 1470
19:05:43.919765 IP 10.0.0.1.34711 > 10.0.0.3.5001: UDP, length 1470
19:05:43.931317 IP 10.0.0.1.34711 > 10.0.0.3.5001: UDP, length 1470
19:05:43.942258 IP 10.0.0.1.34711 > 10.0.0.3.5001: UDP, length 1470
19:05:43.953547 IP 10.0.0.1.34711 > 10.0.0.3.5001: UDP, length 1470
19:05:43.964644 IP 10.0.0.1.34711 > 10.0.0.3.5001: UDP, length 1470
19:05:43.975752 IP 10.0.0.1.34711 > 10.0.0.3.5001: UDP, length 1470
19:05:43.987306 IP 10.0.0.1.34711 > 10.0.0.3.5001: UDP, length 1470
19:05:43.998787 IP 10.0.0.1.34711 > 10.0.0.3.5001: UDP, length 1470
19:05:44.009587 IP 10.0.0.1.34711 > 10.0.0.3.5001: UDP, length 1470
19:05:44.020805 IP 10.0.0.1.34711 > 10.0.0.3.5001: UDP, length 1470
19:05:44.032014 IP 10.0.0.1.34711 > 10.0.0.3.5001: UDP, length 1470
19:05:44.043056 IP 10.0.0.1.34711 > 10.0.0.3.5001: UDP, length 1470
19:05:44.054717 IP 10.0.0.1.34711 > 10.0.0.3.5001: UDP, length 1470
19:05:44.065834 IP 10.0.0.1.34711 > 10.0.0.3.5001: UDP, length 1470
19:05:44.076973 IP 10.0.0.1.34711 > 10.0.0.3.5001: UDP, length 1470
19:05:44.087887 IP 10.0.0.1.34711 > 10.0.0.3.5001: UDP, length 1470
19:05:44.099343 IP 10.0.0.1.34711 > 10.0.0.3.5001: UDP, length 1470
19:05:44.110817 IP 10.0.0.1.34711 > 10.0.0.3.5001: UDP, length 1470
19:05:44.121748 IP 10.0.0.1.34711 > 10.0.0.3.5001: UDP, length 1470
19:05:44.132990 IP 10.0.0.1.34711 > 10.0.0.3.5001: UDP, length 1470
19:05:44.144224 IP 10.0.0.1.34711 > 10.0.0.3.5001: UDP, length 1470
19:05:44.155384 IP 10.0.0.1.34711 > 10.0.0.3.5001: UDP, length 1470
19:05:44.166835 IP 10.0.0.1.34711 > 10.0.0.3.5001: UDP, length 1470
19:05:44.177569 IP 10.0.0.1.34711 > 10.0.0.3.5001: UDP, length 1470
19:05:44.189035 IP 10.0.0.1.34711 > 10.0.0.3.5001: UDP, length 1470
19:05:44.200258 IP 10.0.0.1.34711 > 10.0.0.3.5001: UDP, length 1470
19:05:44.211548 IP 10.0.0.1.34711 > 10.0.0.3.5001: UDP, length 1470
19:05:44.222953 IP 10.0.0.1.34711 > 10.0.0.3.5001: UDP, length 1470
19:05:44.234089 IP 10.0.0.1.34711 > 10.0.0.3.5001: UDP, length 1470
19:05:44.244939 IP 10.0.0.1.34711 > 10.0.0.3.5001: UDP, length 1470
19:05:44.256295 IP 10.0.0.1.34711 > 10.0.0.3.5001: UDP, length 1470
19:05:44.267355 IP 10.0.0.1.34711 > 10.0.0.3.5001: UDP, length 1470
19:05:44.278931 IP 10.0.0.1.34711 > 10.0.0.3.5001: UDP, length 1470
19:05:44.290097 IP 10.0.0.1.34711 > 10.0.0.3.5001: UDP, length 1470
19:05:44.301251 IP 10.0.0.1.34711 > 10.0.0.3.5001: UDP, length 1470
19:05:44.312346 IP 10.0.0.1.34711 > 10.0.0.3.5001: UDP, length 1470
19:05:44.323391 IP 10.0.0.1.34711 > 10.0.0.3.5001: UDP, length 1470
19:05:44.334903 IP 10.0.0.1.34711 > 10.0.0.3.5001: UDP, length 1470
19:05:44.345926 IP 10.0.0.1.34711 > 10.0.0.3.5001: UDP, length 1470
19:05:44.357358 IP 10.0.0.1.34711 > 10.0.0.3.5001: UDP, length 1470
19:05:44.368466 IP 10.0.0.1.34711 > 10.0.0.3.5001: UDP, length 1470
19:05:44.379493 IP 10.0.0.1.34711 > 10.0.0.3.5001: UDP, length 1470
19:05:44.391273 IP 10.0.0.1.34711 > 10.0.0.3.5001: UDP, length 1470
19:05:44.402330 IP 10.0.0.1.34711 > 10.0.0.3.5001: UDP, length 1470
19:05:44.413437 IP 10.0.0.1.34711 > 10.0.0.3.5001: UDP, length 1470
19:05:44.424539 IP 10.0.0.1.34711 > 10.0.0.3.5001: UDP, length 1470
19:05:44.435563 IP 10.0.0.1.34711 > 10.0.0.3.5001: UDP, length 1470
19:05:44.447319 IP 10.0.0.1.34711 > 10.0.0.3.5001: UDP, length 1470
19:05:44.458428 IP 10.0.0.1.34711 > 10.0.0.3.5001: UDP, length 1470
19:05:44.469189 IP 10.0.0.1.34711 > 10.0.0.3.5001: UDP, length 1470
19:05:44.480657 IP 10.0.0.1.34711 > 10.0.0.3.5001: UDP, length 1470
19:05:44.491787 IP 10.0.0.1.34711 > 10.0.0.3.5001: UDP, length 1470
19:05:44.503296 IP 10.0.0.1.34711 > 10.0.0.3.5001: UDP, length 1470
19:05:44.514507 IP 10.0.0.1.34711 > 10.0.0.3.5001: UDP, length 1470
19:05:44.525785 IP 10.0.0.1.34711 > 10.0.0.3.5001: UDP, length 1470
19:05:44.536790 IP 10.0.0.1.34711 > 10.0.0.3.5001: UDP, length 1470
19:05:44.547779 IP 10.0.0.1.34711 > 10.0.0.3.5001: UDP, length 1470
19:05:44.559112 IP 10.0.0.1.34711 > 10.0.0.3.5001: UDP, length 1470
19:05:44.570698 IP 10.0.0.1.34711 > 10.0.0.3.5001: UDP, length 1470
19:05:44.581806 IP 10.0.0.1.34711 > 10.0.0.3.5001: UDP, length 1470
19:05:44.592675 IP 10.0.0.1.34711 > 10.0.0.3.5001: UDP, length 1470
19:05:44.603835 IP 10.0.0.1.34711 > 10.0.0.3.5001: UDP, length 1470
19:05:44.615304 IP 10.0.0.1.34711 > 10.0.0.3.5001: UDP, length 1470
19:05:44.626504 IP 10.0.0.1.34711 > 10.0.0.3.5001: UDP, length 1470
19:05:44.637725 IP 10.0.0.1.34711 > 10.0.0.3.5001: UDP, length 1470
19:05:44.648865 IP 10.0.0.1.34711 > 10.0.0.3.5001: UDP, length 1470
19:05:44.660048 IP 10.0.0.1.34711 > 10.0.0.3.5001: UDP, length 1470
19:05:44.671176 IP 10.0.0.1.34711 > 10.0.0.3.5001: UDP, length 1470
19:05:44.682882 IP 10.0.0.1.34711 > 10.0.0.3.5001: UDP, length 1470
19:05:44.693903 IP 10.0.0.1.34711 > 10.0.0.3.5001: UDP, length 1470
19:05:44.705028 IP 10.0.0.1.34711 > 10.0.0.3.5001: UDP, length 1470
19:05:44.716120 IP 10.0.0.1.34711 > 10.0.0.3.5001: UDP, length 1470
19:05:44.727352 IP 10.0.0.1.34711 > 10.0.0.3.5001: UDP, length 1470
19:05:44.738791 IP 10.0.0.1.34711 > 10.0.0.3.5001: UDP, length 1470
19:05:44.750024 IP 10.0.0.1.34711 > 10.0.0.3.5001: UDP, length 1470
19:05:44.761078 IP 10.0.0.1.34711 > 10.0.0.3.5001: UDP, length 1470
19:05:44.772884 IP 10.0.0.1.34711 > 10.0.0.3.5001: UDP, length 1470
19:05:44.783948 IP 10.0.0.1.34711 > 10.0.0.3.5001: UDP, length 1470
19:05:44.794530 IP 10.0.0.1.34711 > 10.0.0.3.5001: UDP, length 1470
19:05:44.805684 IP 10.0.0.1.34711 > 10.0.0.3.5001: UDP, length 1470
19:05:44.817822 IP 10.0.0.1.34711 > 10.0.0.3.5001: UDP, length 1470
19:05:44.828637 IP 10.0.0.1.34711 > 10.0.0.3.5001: UDP, length 1470
19:05:44.839225 IP 10.0.0.1.34711 > 10.0.0.3.5001: UDP, length 1470
19:05:44.850939 IP 10.0.0.1.34711 > 10.0.0.3.5001: UDP, length 1470
19:05:44.861925 IP 10.0.0.1.34711 > 10.0.0.3.5001: UDP, length 1470
19:05:44.873274 IP 10.0.0.1.34711 > 10.0.0.3.5001: UDP, length 1470
19:05:44.884641 IP 10.0.0.1.34711 > 10.0.0.3.5001: UDP, length 1470
19:05:44.896141 IP 10.0.0.1.34711 > 10.0.0.3.5001: UDP, length 1470
19:05:44.906842 IP 10.0.0.1.34711 > 10.0.0.3.5001: UDP, length 1470
19:05:44.918359 IP 10.0.0.1.34711 > 10.0.0.3.5001: UDP, length 1470
19:05:44.929419 IP 10.0.0.1.34711 > 10.0.0.3.5001: UDP, length 1470
19:05:44.940633 IP 10.0.0.1.34711 > 10.0.0.3.5001: UDP, length 1470
19:05:44.951460 IP 10.0.0.1.34711 > 10.0.0.3.5001: UDP, length 1470
19:05:44.962759 IP 10.0.0.1.34711 > 10.0.0.3.5001: UDP, length 1470
19:05:44.974170 IP 10.0.0.1.34711 > 10.0.0.3.5001: UDP, length 1470
19:05:44.985490 IP 10.0.0.1.34711 > 10.0.0.3.5001: UDP, length 1470
19:05:44.996608 IP 10.0.0.1.34711 > 10.0.0.3.5001: UDP, length 1470
19:05:45.007634 IP 10.0.0.1.34711 > 10.0.0.3.5001: UDP, length 1470
19:05:45.019319 IP 10.0.0.1.34711 > 10.0.0.3.5001: UDP, length 1470
19:05:45.030575 IP 10.0.0.1.34711 > 10.0.0.3.5001: UDP, length 1470
19:05:45.041401 IP 10.0.0.1.34711 > 10.0.0.3.5001: UDP, length 1470
19:05:45.052630 IP 10.0.0.1.34711 > 10.0.0.3.5001: UDP, length 1470
19:05:45.063808 IP 10.0.0.1.34711 > 10.0.0.3.5001: UDP, length 1470
19:05:45.075114 IP 10.0.0.1.34711 > 10.0.0.3.5001: UDP, length 1470
19:05:45.086543 IP 10.0.0.1.34711 > 10.0.0.3.5001: UDP, length 1470
19:05:45.097664 IP 10.0.0.1.34711 > 10.0.0.3.5001: UDP, length 1470
19:05:45.108663 IP 10.0.0.1.34711 > 10.0.0.3.5001: UDP, length 1470
19:05:45.119769 IP 10.0.0.1.34711 > 10.0.0.3.5001: UDP, length 1470
19:05:45.130967 IP 10.0.0.1.34711 > 10.0.0.3.5001: UDP, length 1470
19:05:45.142350 IP 10.0.0.1.34711 > 10.0.0.3.5001: UDP, length 1470
19:05:45.153665 IP 10.0.0.1.34711 > 10.0.0.3.5001: UDP, length 1470
19:05:45.164810 IP 10.0.0.1.34711 > 10.0.0.3.5001: UDP, length 1470
19:05:45.175886 IP 10.0.0.1.34711 > 10.0.0.3.5001: UDP, length 1470
19:05:45.187300 IP 10.0.0.1.34711 > 10.0.0.3.5001: UDP, length 1470
19:05:45.198766 IP 10.0.0.1.34711 > 10.0.0.3.5001: UDP, length 1470
19:05:45.209816 IP 10.0.0.1.34711 > 10.0.0.3.5001: UDP, length 1470
19:05:45.220972 IP 10.0.0.1.34711 > 10.0.0.3.5001: UDP, length 1470
19:05:45.232288 IP 10.0.0.1.34711 > 10.0.0.3.5001: UDP, length 1470
19:05:45.245088 IP 10.0.0.1.34711 > 10.0.0.3.5001: UDP, length 1470
19:05:45.254771 IP 10.0.0.1.34711 > 10.0.0.3.5001: UDP, length 1470
19:05:45.265790 IP 10.0.0.1.34711 > 10.0.0.3.5001: UDP, length 1470
19:05:45.276891 IP 10.0.0.1.34711 > 10.0.0.3.5001: UDP, length 1470
19:05:45.287989 IP 10.0.0.1.34711 > 10.0.0.3.5001: UDP, length 1470
19:05:45.299393 IP 10.0.0.1.34711 > 10.0.0.3.5001: UDP, length 1470
19:05:45.310390 IP 10.0.0.1.34711 > 10.0.0.3.5001: UDP, length 1470
19:05:45.322486 IP 10.0.0.1.34711 > 10.0.0.3.5001: UDP, length 1470
19:05:45.333878 IP 10.0.0.1.34711 > 10.0.0.3.5001: UDP, length 1470
19:05:45.344457 IP 10.0.0.1.34711 > 10.0.0.3.5001: UDP, length 1470
19:05:45.356385 IP 10.0.0.1.34711 > 10.0.0.3.5001: UDP, length 1470
19:05:45.367134 IP 10.0.0.1.34711 > 10.0.0.3.5001: UDP, length 1470
19:05:45.377948 IP 10.0.0.1.34711 > 10.0.0.3.5001: UDP, length 1470
19:05:45.389025 IP 10.0.0.1.34711 > 10.0.0.3.5001: UDP, length 1470
19:05:45.400205 IP 10.0.0.1.34711 > 10.0.0.3.5001: UDP, length 1470
19:05:45.411218 IP 10.0.0.1.34711 > 10.0.0.3.5001: UDP, length 1470
19:05:45.423060 IP 10.0.0.1.34711 > 10.0.0.3.5001: UDP, length 1470
19:05:45.434090 IP 10.0.0.1.34711 > 10.0.0.3.5001: UDP, length 1470
19:05:45.445254 IP 10.0.0.1.34711 > 10.0.0.3.5001: UDP, length 1470
19:05:45.456347 IP 10.0.0.1.34711 > 10.0.0.3.5001: UDP, length 1470
19:05:45.467416 IP 10.0.0.1.34711 > 10.0.0.3.5001: UDP, length 1470
19:05:45.478963 IP 10.0.0.1.34711 > 10.0.0.3.5001: UDP, length 1470
19:05:45.490123 IP 10.0.0.1.34711 > 10.0.0.3.5001: UDP, length 1470
19:05:45.501299 IP 10.0.0.1.34711 > 10.0.0.3.5001: UDP, length 1470
19:05:45.512442 IP 10.0.0.1.34711 > 10.0.0.3.5001: UDP, length 1470
19:05:45.523336 IP 10.0.0.1.34711 > 10.0.0.3.5001: UDP, length 1470
19:05:45.535209 IP 10.0.0.1.34711 > 10.0.0.3.5001: UDP, length 1470
19:05:45.546268 IP 10.0.0.1.34711 > 10.0.0.3.5001: UDP, length 1470
19:05:45.557602 IP 10.0.0.1.34711 > 10.0.0.3.5001: UDP, length 1470
19:05:45.568475 IP 10.0.0.1.34711 > 10.0.0.3.5001: UDP, length 1470
19:05:45.579505 IP 10.0.0.1.34711 > 10.0.0.3.5001: UDP, length 1470
19:05:45.591262 IP 10.0.0.1.34711 > 10.0.0.3.5001: UDP, length 1470
19:05:45.602135 IP 10.0.0.1.34711 > 10.0.0.3.5001: UDP, length 1470
19:05:45.613415 IP 10.0.0.1.34711 > 10.0.0.3.5001: UDP, length 1470
19:05:45.624573 IP 10.0.0.1.34711 > 10.0.0.3.5001: UDP, length 1470
19:05:45.635768 IP 10.0.0.1.34711 > 10.0.0.3.5001: UDP, length 1470
19:05:45.647160 IP 10.0.0.1.34711 > 10.0.0.3.5001: UDP, length 1470
19:05:45.658404 IP 10.0.0.1.34711 > 10.0.0.3.5001: UDP, length 1470
19:05:45.669630 IP 10.0.0.1.34711 > 10.0.0.3.5001: UDP, length 1470
19:05:45.680677 IP 10.0.0.1.34711 > 10.0.0.3.5001: UDP, length 1470
19:05:45.691739 IP 10.0.0.1.34711 > 10.0.0.3.5001: UDP, length 1470
19:05:45.703423 IP 10.0.0.1.34711 > 10.0.0.3.5001: UDP, length 1470
19:05:45.714218 IP 10.0.0.1.34711 > 10.0.0.3.5001: UDP, length 1470
19:05:45.725622 IP 10.0.0.1.34711 > 10.0.0.3.5001: UDP, length 1470
19:05:45.736749 IP 10.0.0.1.34711 > 10.0.0.3.5001: UDP, length 1470
19:05:45.747804 IP 10.0.0.1.34711 > 10.0.0.3.5001: UDP, length 1470
19:05:45.759318 IP 10.0.0.1.34711 > 10.0.0.3.5001: UDP, length 1470
19:05:45.770300 IP 10.0.0.1.34711 > 10.0.0.3.5001: UDP, length 1470
19:05:45.781664 IP 10.0.0.1.34711 > 10.0.0.3.5001: UDP, length 1470
19:05:45.792850 IP 10.0.0.1.34711 > 10.0.0.3.5001: UDP, length 1470
19:05:45.803984 IP 10.0.0.1.34711 > 10.0.0.3.5001: UDP, length 1470
19:05:45.815057 IP 10.0.0.1.34711 > 10.0.0.3.5001: UDP, length 1470
19:05:45.826278 IP 10.0.0.1.34711 > 10.0.0.3.5001: UDP, length 1470
19:05:45.837610 IP 10.0.0.1.34711 > 10.0.0.3.5001: UDP, length 1470
19:05:45.848694 IP 10.0.0.1.34711 > 10.0.0.3.5001: UDP, length 1470
19:05:45.859870 IP 10.0.0.1.34711 > 10.0.0.3.5001: UDP, length 1470
19:05:45.871316 IP 10.0.0.1.34711 > 10.0.0.3.5001: UDP, length 1470
19:05:45.882819 IP 10.0.0.1.34711 > 10.0.0.3.5001: UDP, length 1470
19:05:45.894053 IP 10.0.0.1.34711 > 10.0.0.3.5001: UDP, length 1470
19:05:45.905015 IP 10.0.0.1.34711 > 10.0.0.3.5001: UDP, length 1470
19:05:45.916124 IP 10.0.0.1.34711 > 10.0.0.3.5001: UDP, length 1470
19:05:45.927397 IP 10.0.0.1.34711 > 10.0.0.3.5001: UDP, length 1470
19:05:45.938386 IP 10.0.0.1.34711 > 10.0.0.3.5001: UDP, length 1470
19:05:45.949942 IP 10.0.0.1.34711 > 10.0.0.3.5001: UDP, length 1470
19:05:45.961128 IP 10.0.0.1.34711 > 10.0.0.3.5001: UDP, length 1470
19:05:45.972160 IP 10.0.0.1.34711 > 10.0.0.3.5001: UDP, length 1470
19:05:45.983257 IP 10.0.0.1.34711 > 10.0.0.3.5001: UDP, length 1470
19:05:45.995053 IP 10.0.0.1.34711 > 10.0.0.3.5001: UDP, length 1470
19:05:46.006070 IP 10.0.0.1.34711 > 10.0.0.3.5001: UDP, length 1470
19:05:46.017182 IP 10.0.0.1.34711 > 10.0.0.3.5001: UDP, length 1470
19:05:46.028265 IP 10.0.0.1.34711 > 10.0.0.3.5001: UDP, length 1470
19:05:46.039327 IP 10.0.0.1.34711 > 10.0.0.3.5001: UDP, length 1470
19:05:46.051071 IP 10.0.0.1.34711 > 10.0.0.3.5001: UDP, length 1470
19:05:46.061671 IP 10.0.0.1.34711 > 10.0.0.3.5001: UDP, length 1470
19:05:46.073261 IP 10.0.0.1.34711 > 10.0.0.3.5001: UDP, length 1470
19:05:46.084354 IP 10.0.0.1.34711 > 10.0.0.3.5001: UDP, length 1470
19:05:46.095614 IP 10.0.0.1.34711 > 10.0.0.3.5001: UDP, length 1470
19:05:46.106850 IP 10.0.0.1.34711 > 10.0.0.3.5001: UDP, length 1470
19:05:46.118250 IP 10.0.0.1.34711 > 10.0.0.3.5001: UDP, length 1470
19:05:46.129377 IP 10.0.0.1.34711 > 10.0.0.3.5001: UDP, length 1470
19:05:46.140485 IP 10.0.0.1.34711 > 10.0.0.3.5001: UDP, length 1470
19:05:46.151539 IP 10.0.0.1.34711 > 10.0.0.3.5001: UDP, length 1470
19:05:46.162824 IP 10.0.0.1.34711 > 10.0.0.3.5001: UDP, length 1470
19:05:46.174286 IP 10.0.0.1.34711 > 10.0.0.3.5001: UDP, length 1470
19:05:46.185387 IP 10.0.0.1.34711 > 10.0.0.3.5001: UDP, length 1470
19:05:46.196531 IP 10.0.0.1.34711 > 10.0.0.3.5001: UDP, length 1470
19:05:46.207559 IP 10.0.0.1.34711 > 10.0.0.3.5001: UDP, length 1470
19:05:46.219299 IP 10.0.0.1.34711 > 10.0.0.3.5001: UDP, length 1470
19:05:46.230347 IP 10.0.0.1.34711 > 10.0.0.3.5001: UDP, length 1470
19:05:46.241964 IP 10.0.0.1.34711 > 10.0.0.3.5001: UDP, length 1470
19:05:46.252607 IP 10.0.0.1.34711 > 10.0.0.3.5001: UDP, length 1470
19:05:46.263798 IP 10.0.0.1.34711 > 10.0.0.3.5001: UDP, length 1470
19:05:46.275088 IP 10.0.0.1.34711 > 10.0.0.3.5001: UDP, length 1470
19:05:46.286327 IP 10.0.0.1.34711 > 10.0.0.3.5001: UDP, length 1470
19:05:46.297646 IP 10.0.0.1.34711 > 10.0.0.3.5001: UDP, length 1470
19:05:46.308719 IP 10.0.0.1.34711 > 10.0.0.3.5001: UDP, length 1470
19:05:46.322278 IP 10.0.0.1.34711 > 10.0.0.3.5001: UDP, length 1470
19:05:46.331166 IP 10.0.0.1.34711 > 10.0.0.3.5001: UDP, length 1470
19:05:46.342232 IP 10.0.0.1.34711 > 10.0.0.3.5001: UDP, length 1470
19:05:46.353535 IP 10.0.0.1.34711 > 10.0.0.3.5001: UDP, length 1470
19:05:46.364622 IP 10.0.0.1.34711 > 10.0.0.3.5001: UDP, length 1470
19:05:46.375898 IP 10.0.0.1.34711 > 10.0.0.3.5001: UDP, length 1470
19:05:46.387341 IP 10.0.0.1.34711 > 10.0.0.3.5001: UDP, length 1470
19:05:46.398639 IP 10.0.0.1.34711 > 10.0.0.3.5001: UDP, length 1470
19:05:46.409688 IP 10.0.0.1.34711 > 10.0.0.3.5001: UDP, length 1470
19:05:46.420849 IP 10.0.0.1.34711 > 10.0.0.3.5001: UDP, length 1470
19:05:46.432019 IP 10.0.0.1.34711 > 10.0.0.3.5001: UDP, length 1470
19:05:46.443070 IP 10.0.0.1.34711 > 10.0.0.3.5001: UDP, length 1470
19:05:46.454988 IP 10.0.0.1.34711 > 10.0.0.3.5001: UDP, length 1470
19:05:46.465740 IP 10.0.0.1.34711 > 10.0.0.3.5001: UDP, length 1470
19:05:46.477147 IP 10.0.0.1.34711 > 10.0.0.3.5001: UDP, length 1470
19:05:46.488087 IP 10.0.0.1.34711 > 10.0.0.3.5001: UDP, length 1470
19:05:46.499329 IP 10.0.0.1.34711 > 10.0.0.3.5001: UDP, length 1470
19:05:46.510667 IP 10.0.0.1.34711 > 10.0.0.3.5001: UDP, length 1470
19:05:46.521899 IP 10.0.0.1.34711 > 10.0.0.3.5001: UDP, length 1470
19:05:46.533033 IP 10.0.0.1.34711 > 10.0.0.3.5001: UDP, length 1470
19:05:46.544185 IP 10.0.0.1.34711 > 10.0.0.3.5001: UDP, length 1470
19:05:46.555270 IP 10.0.0.1.34711 > 10.0.0.3.5001: UDP, length 1470
19:05:46.566501 IP 10.0.0.1.34711 > 10.0.0.3.5001: UDP, length 1470
19:05:46.577785 IP 10.0.0.1.34711 > 10.0.0.3.5001: UDP, length 1470
19:05:46.588987 IP 10.0.0.1.34711 > 10.0.0.3.5001: UDP, length 1470
19:05:46.600252 IP 10.0.0.1.34711 > 10.0.0.3.5001: UDP, length 1470
19:05:46.611277 IP 10.0.0.1.34711 > 10.0.0.3.5001: UDP, length 1470
19:05:46.623089 IP 10.0.0.1.34711 > 10.0.0.3.5001: UDP, length 1470
19:05:46.634129 IP 10.0.0.1.34711 > 10.0.0.3.5001: UDP, length 1470
19:05:46.645222 IP 10.0.0.1.34711 > 10.0.0.3.5001: UDP, length 1470
19:05:46.656240 IP 10.0.0.1.34711 > 10.0.0.3.5001: UDP, length 1470
19:05:46.667381 IP 10.0.0.1.34711 > 10.0.0.3.5001: UDP, length 1470
19:05:46.679111 IP 10.0.0.1.34711 > 10.0.0.3.5001: UDP, length 1470
19:05:46.690234 IP 10.0.0.1.34711 > 10.0.0.3.5001: UDP, length 1470
19:05:46.701315 IP 10.0.0.1.34711 > 10.0.0.3.5001: UDP, length 1470
19:05:46.712483 IP 10.0.0.1.34711 > 10.0.0.3.5001: UDP, length 1470
19:05:46.723441 IP 10.0.0.1.34711 > 10.0.0.3.5001: UDP, length 1470
19:05:46.734994 IP 10.0.0.1.34711 > 10.0.0.3.5001: UDP, length 1470
19:05:46.746184 IP 10.0.0.1.34711 > 10.0.0.3.5001: UDP, length 1470
19:05:46.757392 IP 10.0.0.1.34711 > 10.0.0.3.5001: UDP, length 1470
19:05:46.768385 IP 10.0.0.1.34711 > 10.0.0.3.5001: UDP, length 1470
19:05:46.779569 IP 10.0.0.1.34711 > 10.0.0.3.5001: UDP, length 1470
19:05:46.791393 IP 10.0.0.1.34711 > 10.0.0.3.5001: UDP, length 1470
19:05:46.802117 IP 10.0.0.1.34711 > 10.0.0.3.5001: UDP, length 1470
19:05:46.813489 IP 10.0.0.1.34711 > 10.0.0.3.5001: UDP, length 1470
19:05:46.824606 IP 10.0.0.1.34711 > 10.0.0.3.5001: UDP, length 1470
19:05:46.835564 IP 10.0.0.1.34711 > 10.0.0.3.5001: UDP, length 1470
19:05:46.846810 IP 10.0.0.1.34711 > 10.0.0.3.5001: UDP, length 1470
19:05:46.858038 IP 10.0.0.1.34711 > 10.0.0.3.5001: UDP, length 1470
19:05:46.869456 IP 10.0.0.1.34711 > 10.0.0.3.5001: UDP, length 1470
19:05:46.881310 IP 10.0.0.1.34711 > 10.0.0.3.5001: UDP, length 1470
19:05:46.892283 IP 10.0.0.1.34711 > 10.0.0.3.5001: UDP, length 1470
19:05:46.903190 IP 10.0.0.1.34711 > 10.0.0.3.5001: UDP, length 1470
19:05:46.914700 IP 10.0.0.1.34711 > 10.0.0.3.5001: UDP, length 1470
19:05:46.925849 IP 10.0.0.1.34711 > 10.0.0.3.5001: UDP, length 1470
19:05:46.936811 IP 10.0.0.1.34711 > 10.0.0.3.5001: UDP, length 1470
19:05:46.947976 IP 10.0.0.1.34711 > 10.0.0.3.5001: UDP, length 1470
19:05:46.959125 IP 10.0.0.1.34711 > 10.0.0.3.5001: UDP, length 1470
19:05:46.970396 IP 10.0.0.1.34711 > 10.0.0.3.5001: UDP, length 1470
19:05:46.981750 IP 10.0.0.1.34711 > 10.0.0.3.5001: UDP, length 1470
19:05:46.992713 IP 10.0.0.1.34711 > 10.0.0.3.5001: UDP, length 1470
19:05:47.003965 IP 10.0.0.1.34711 > 10.0.0.3.5001: UDP, length 1470
19:05:47.015128 IP 10.0.0.1.34711 > 10.0.0.3.5001: UDP, length 1470
19:05:47.026453 IP 10.0.0.1.34711 > 10.0.0.3.5001: UDP, length 1470
19:05:47.037535 IP 10.0.0.1.34711 > 10.0.0.3.5001: UDP, length 1470
19:05:47.048971 IP 10.0.0.1.34711 > 10.0.0.3.5001: UDP, length 1470
19:05:47.060092 IP 10.0.0.1.34711 > 10.0.0.3.5001: UDP, length 1470
19:05:47.071254 IP 10.0.0.1.34711 > 10.0.0.3.5001: UDP, length 1470
19:05:47.082901 IP 10.0.0.1.34711 > 10.0.0.3.5001: UDP, length 1470
19:05:47.093840 IP 10.0.0.1.34711 > 10.0.0.3.5001: UDP, length 1470
19:05:47.105098 IP 10.0.0.1.34711 > 10.0.0.3.5001: UDP, length 1470
19:05:47.116202 IP 10.0.0.1.34711 > 10.0.0.3.5001: UDP, length 1470
19:05:47.127286 IP 10.0.0.1.34711 > 10.0.0.3.5001: UDP, length 1470
19:05:47.138948 IP 10.0.0.1.34711 > 10.0.0.3.5001: UDP, length 1470
19:05:47.149971 IP 10.0.0.1.34711 > 10.0.0.3.5001: UDP, length 1470
19:05:47.161094 IP 10.0.0.1.34711 > 10.0.0.3.5001: UDP, length 1470
19:05:47.172244 IP 10.0.0.1.34711 > 10.0.0.3.5001: UDP, length 1470
19:05:47.183283 IP 10.0.0.1.34711 > 10.0.0.3.5001: UDP, length 1470
19:05:47.194764 IP 10.0.0.1.34711 > 10.0.0.3.5001: UDP, length 1470
19:05:47.206061 IP 10.0.0.1.34711 > 10.0.0.3.5001: UDP, length 1470
19:05:47.217238 IP 10.0.0.1.34711 > 10.0.0.3.5001: UDP, length 1470
19:05:47.228360 IP 10.0.0.1.34711 > 10.0.0.3.5001: UDP, length 1470
19:05:47.239401 IP 10.0.0.1.34711 > 10.0.0.3.5001: UDP, length 1470
19:05:47.250866 IP 10.0.0.1.34711 > 10.0.0.3.5001: UDP, length 1470
19:05:47.262248 IP 10.0.0.1.34711 > 10.0.0.3.5001: UDP, length 1470
19:05:47.273806 IP 10.0.0.1.34711 > 10.0.0.3.5001: UDP, length 1470
19:05:47.284447 IP 10.0.0.1.34711 > 10.0.0.3.5001: UDP, length 1470
19:05:47.295459 IP 10.0.0.1.34711 > 10.0.0.3.5001: UDP, length 1470
19:05:47.307202 IP 10.0.0.1.34711 > 10.0.0.3.5001: UDP, length 1470
19:05:47.318274 IP 10.0.0.1.34711 > 10.0.0.3.5001: UDP, length 1470
19:05:47.329379 IP 10.0.0.1.34711 > 10.0.0.3.5001: UDP, length 1470
19:05:47.340550 IP 10.0.0.1.34711 > 10.0.0.3.5001: UDP, length 1470
19:05:47.351568 IP 10.0.0.1.34711 > 10.0.0.3.5001: UDP, length 1470
19:05:47.362831 IP 10.0.0.1.34711 > 10.0.0.3.5001: UDP, length 1470
19:05:47.374324 IP 10.0.0.1.34711 > 10.0.0.3.5001: UDP, length 1470
19:05:47.385534 IP 10.0.0.1.34711 > 10.0.0.3.5001: UDP, length 1470
19:05:47.396630 IP 10.0.0.1.34711 > 10.0.0.3.5001: UDP, length 1470
19:05:47.407632 IP 10.0.0.1.34711 > 10.0.0.3.5001: UDP, length 1470
19:05:47.419193 IP 10.0.0.1.34711 > 10.0.0.3.5001: UDP, length 1470
19:05:47.430504 IP 10.0.0.1.34711 > 10.0.0.3.5001: UDP, length 1470
19:05:47.441444 IP 10.0.0.1.34711 > 10.0.0.3.5001: UDP, length 1470
19:05:47.452604 IP 10.0.0.1.34711 > 10.0.0.3.5001: UDP, length 1470
19:05:47.463613 IP 10.0.0.1.34711 > 10.0.0.3.5001: UDP, length 1470
19:05:47.474967 IP 10.0.0.1.34711 > 10.0.0.3.5001: UDP, length 1470
19:05:47.486811 IP 10.0.0.1.34711 > 10.0.0.3.5001: UDP, length 1470
19:05:47.497368 IP 10.0.0.1.34711 > 10.0.0.3.5001: UDP, length 1470
19:05:47.508735 IP 10.0.0.1.34711 > 10.0.0.3.5001: UDP, length 1470
19:05:47.519954 IP 10.0.0.1.34711 > 10.0.0.3.5001: UDP, length 1470
19:05:47.531153 IP 10.0.0.1.34711 > 10.0.0.3.5001: UDP, length 1470
19:05:47.542488 IP 10.0.0.1.34711 > 10.0.0.3.5001: UDP, length 1470
19:05:47.553963 IP 10.0.0.1.34711 > 10.0.0.3.5001: UDP, length 1470
19:05:47.805424 IP 10.0.0.1.34711 > 10.0.0.3.5001: UDP, length 1470
19:05:48.056287 IP 10.0.0.1.34711 > 10.0.0.3.5001: UDP, length 1470
19:05:48.307632 IP 10.0.0.1.34711 > 10.0.0.3.5001: UDP, length 1470
19:05:48.558749 IP 10.0.0.1.34711 > 10.0.0.3.5001: UDP, length 1470
19:05:48.809558 IP 10.0.0.1.34711 > 10.0.0.3.5001: UDP, length 1470
19:05:49.060819 IP 10.0.0.1.34711 > 10.0.0.3.5001: UDP, length 1470
19:05:49.312486 IP 10.0.0.1.34711 > 10.0.0.3.5001: UDP, length 1470
19:05:49.563175 IP 10.0.0.1.34711 > 10.0.0.3.5001: UDP, length 1470
19:05:49.814356 IP 10.0.0.1.34711 > 10.0.0.3.5001: UDP, length 1470
