19:05:22.553370 IP 10.0.0.1.34711 > 10.0.0.3.5001: UDP, length 1470
19:05:22.555582 IP 10.0.0.1.34711 > 10.0.0.3.5001: UDP, length 1470
19:05:22.565878 IP 10.0.0.1.34711 > 10.0.0.3.5001: UDP, length 1470
19:05:22.577437 IP 10.0.0.1.34711 > 10.0.0.3.5001: UDP, length 1470
19:05:22.588303 IP 10.0.0.1.34711 > 10.0.0.3.5001: UDP, length 1470
19:05:22.599496 IP 10.0.0.1.34711 > 10.0.0.3.5001: UDP, length 1470
19:05:22.611154 IP 10.0.0.1.34711 > 10.0.0.3.5001: UDP, length 1470
19:05:22.622842 IP 10.0.0.1.34711 > 10.0.0.3.5001: UDP, length 1470
19:05:22.633227 IP 10.0.0.1.34711 > 10.0.0.3.5001: UDP, length 1470
19:05:22.644565 IP 10.0.0.1.34711 > 10.0.0.3.5001: UDP, length 1470
19:05:22.655540 IP 10.0.0.1.34711 > 10.0.0.3.5001: UDP, length 1470
19:05:22.667305 IP 10.0.0.1.34711 > 10.0.0.3.5001: UDP, length 1470
19:05:22.678324 IP 10.0.0.1.34711 > 10.0.0.3.5001: UDP, length 1470
19:05:22.689234 IP 10.0.0.1.34711 > 10.0.0.3.5001: UDP, length 1470
19:05:22.700458 IP 10.0.0.1.34711 > 10.0.0.3.5001: UDP, length 1470
19:05:22.711891 IP 10.0.0.1.34711 > 10.0.0.3.5001: UDP, length 1470
19:05:22.722932 IP 10.0.0.1.34711 > 10.0.0.3.5001: UDP, length 1470
19:05:22.734686 IP 10.0.0.1.34711 > 10.0.0.3.5001: UDP, length 1470
19:05:22.745357 IP 10.0.0.1.34711 > 10.0.0.3.5001: UDP, length 1470
19:05:22.756586 IP 10.0.0.1.34711 > 10.0.0.3.5001: UDP, length 1470
19:05:22.767786 IP 10.0.0.1.34711 > 10.0.0.3.5001: UDP, length 1470
19:05:22.778920 IP 10.0.0.1.34711 > 10.0.0.3.5001: UDP, length 1470
19:05:22.790223 IP 10.0.0.1.34711 > 10.0.0.3.5001: UDP, length 1470
19:05:22.802937 IP 10.0.0.1.34711 > 10.0.0.3.5001: UDP, length 1470
19:05:22.812737 IP 10.0.0.1.34711 > 10.0.0.3.5001: UDP, length 1470
19:05:22.824351 IP 10.0.0.1.34711 > 10.0.0.3.5001: UDP, length 1470
19:05:22.834946 IP 10.0.0.1.34711 > 10.0.0.3.5001: UDP, length 1470
19:05:22.846223 IP 10.0.0.1.34711 > 10.0.0.3.5001: UDP, length 1470
19:05:22.857653 IP 10.0.0.1.34711 > 10.0.0.3.5001: UDP, length 1470
19:05:22.868748 IP 10.0.0.1.34711 > 10.0.0.3.5001: UDP, length 1470
19:05:22.880157 IP 10.0.0.1.34711 > 10.0.0.3.5001: UDP, length 1470
19:05:22.891345 IP 10.0.0.1.34711 > 10.0.0.3.5001: UDP, length 1470
19:05:22.902950 IP 10.0.0.1.34711 > 10.0.0.3.5001: UDP, length 1470
19:05:22.913710 IP 10.0.0.1.34711 > 10.0.0.3.5001: UDP, length 1470
19:05:22.924688 IP 10.0.0.1.34711 > 10.0.0.3.5001: UDP, length 1470
19:05:22.936082 IP 10.0.0.1.34711 > 10.0.0.3.5001: UDP, length 1470
19:05:22.947620 IP 10.0.0.1.34711 > 10.0.0.3.5001: UDP, length 1470
19:05:22.958462 IP 10.0.0.1.34711 > 10.0.0.3.5001: UDP, length 1470
19:05:22.969997 IP 10.0.0.1.34711 > 10.0.0.3.5001: UDP, length 1470
19:05:22.980932 IP 10.0.0.1.34711 > 10.0.0.3.5001: UDP, length 1470
19:05:22.992418 IP 10.0.0.1.34711 > 10.0.0.3.5001: UDP, length 1470
19:05:23.003402 IP 10.0.0.1.34711 > 10.0.0.3.5001: UDP, length 1470
19:05:23.014437 IP 10.0.0.1.34711 > 10.0.0.3.5001: UDP, length 1470
19:05:23.026283 IP 10.0.0.1.34711 > 10.0.0.3.5001: UDP, length 1470
19:05:23.037137 IP 10.0.0.1.34711 > 10.0.0.3.5001: UDP, length 1470
19:05:23.048216 IP 10.0.0.1.34711 > 10.0.0.3.5001: UDP, length 1470
19:05:23.059995 IP 10.0.0.1.34711 > 10.0.0.3.5001: UDP, length 1470
19:05:23.071070 IP 10.0.0.1.34711 > 10.0.0.3.5001: UDP, length 1470
19:05:23.081914 IP 10.0.0.1.34711 > 10.0.0.3.5001: UDP, length 1470
19:05:23.093016 IP 10.0.0.1.34711 > 10.0.0.3.5001: UDP, length 1470
19:05:23.104238 IP 10.0.0.1.34711 > 10.0.0.3.5001: UDP, length 1470
19:05:23.115493 IP 10.0.0.1.34711 > 10.0.0.3.5001: UDP, length 1470
19:05:23.126854 IP 10.0.0.1.34711 > 10.0.0.3.5001: UDP, length 1470
19:05:23.137931 IP 10.0.0.1.34711 > 10.0.0.3.5001: UDP, length 1470
19:05:23.149035 IP 10.0.0.1.34711 > 10.0.0.3.5001: UDP, length 1470
19:05:23.160257 IP 10.0.0.1.34711 > 10.0.0.3.5001: UDP, length 1470
19:05:23.171878 IP 10.0.0.1.34711 > 10.0.0.3.5001: UDP, length 1470
19:05:23.183103 IP 10.0.0.1.34711 > 10.0.0.3.5001: UDP, length 1470
19:05:23.193964 IP 10.0.0.1.34711 > 10.0.0.3.5001: UDP, length 1470
19:05:23.205808 IP 10.0.0.1.34711 > 10.0.0.3.5001: UDP, length 1470
19:05:23.216779 IP 10.0.0.1.34711 > 10.0.0.3.5001: UDP, length 1470
19:05:23.227735 IP 10.0.0.1.34711 > 10.0.0.3.5001: UDP, length 1470
19:05:23.239123 IP 10.0.0.1.34711 > 10.0.0.3.5001: UDP, length 1470
19:05:23.250415 IP 10.0.0.1.34711 > 10.0.0.3.5001: UDP, length 1470
19:05:23.261453 IP 10.0.0.1.34711 > 10.0.0.3.5001: UDP, length 1470
19:05:23.272524 IP 10.0.0.1.34711 > 10.0.0.3.5001: UDP, length 1470
19:05:23.283811 IP 10.0.0.1.34711 > 10.0.0.3.5001: UDP, length 1470
19:05:23.295131 IP 10.0.0.1.34711 > 10.0.0.3.5001: UDP, length 1470
19:05:23.306234 IP 10.0.0.1.34711 > 10.0.0.3.5001: UDP, length 1470
19:05:23.317295 IP 10.0.0.1.34711 > 10.0.0.3.5001: UDP, length 1470
19:05:23.328575 IP 10.0.0.1.34711 > 10.0.0.3.5001: UDP, length 1470
19:05:23.339801 IP 10.0.0.1.34711 > 10.0.0.3.5001: UDP, length 1470
19:05:23.351144 IP 10.0.0.1.34711 > 10.0.0.3.5001: UDP, length 1470
19:05:23.362108 IP 10.0.0.1.34711 > 10.0.0.3.5001: UDP, length 1470
19:05:23.373371 IP 10.0.0.1.34711 > 10.0.0.3.5001: UDP, length 1470
19:05:23.384536 IP 10.0.0.1.34711 > 10.0.0.3.5001: UDP, length 1470
19:05:23.395792 IP 10.0.0.1.34711 > 10.0.0.3.5001: UDP, length 1470
19:05:23.407004 IP 10.0.0.1.34711 > 10.0.0.3.5001: UDP, length 1470
19:05:23.418332 IP 10.0.0.1.34711 > 10.0.0.3.5001: UDP, length 1470
19:05:23.429755 IP 10.0.0.1.34711 > 10.0.0.3.5001: UDP, length 1470
19:05:23.441067 IP 10.0.0.1.34711 > 10.0.0.3.5001: UDP, length 1470
19:05:23.452042 IP 10.0.0.1.34711 > 10.0.0.3.5001: UDP, length 1470
19:05:23.463132 IP 10.0.0.1.34711 > 10.0.0.3.5001: UDP, length 1470
19:05:23.474531 IP 10.0.0.1.34711 > 10.0.0.3.5001: UDP, length 1470
19:05:23.485529 IP 10.0.0.1.34711 > 10.0.0.3.5001: UDP, length 1470
19:05:23.496660 IP 10.0.0.1.34711 > 10.0.0.3.5001: UDP, length 1470
19:05:23.508327 IP 10.0.0.1.34711 > 10.0.0.3.5001: UDP, length 1470
19:05:23.519260 IP 10.0.0.1.34711 > 10.0.0.3.5001: UDP, length 1470
19:05:23.530395 IP 10.0.0.1.34711 > 10.0.0.3.5001: UDP, length 1470
19:05:23.541674 IP 10.0.0.1.34711 > 10.0.0.3.5001: UDP, length 1470
19:05:23.552749 IP 10.0.0.1.34711 > 10.0.0.3.5001: UDP, length 1470
19:05:23.563925 IP 10.0.0.1.34711 > 10.0.0.3.5001: UDP, length 1470
19:05:23.575222 IP 10.0.0.1.34711 > 10.0.0.3.5001: UDP, length 1470
19:05:23.586541 IP 10.0.0.1.34711 > 10.0.0.3.5001: UDP, length 1470
19:05:23.598121 IP 10.0.0.1.34711 > 10.0.0.3.5001: UDP, length 1470
19:05:23.609449 IP 10.0.0.1.34711 > 10.0.0.3.5001: UDP, length 1470
19:05:23.620205 IP 10.0.0.1.34711 > 10.0.0.3.5001: UDP, length 1470
19:05:23.631333 IP 10.0.0.1.34711 > 10.0.0.3.5001: UDP, length 1470
19:05:23.642631 IP 10.0.0.1.34711 > 10.0.0.3.5001: UDP, length 1470
19:05:23.654816 IP 10.0.0.1.34711 > 10.0.0.3.5001: UDP, length 1470
19:05:23.665211 IP 10.0.0.1.34711 > 10.0.0.3.5001: UDP, length 1470
19:05:23.676383 IP 10.0.0.1.34711 > 10.0.0.3.5001: UDP, length 1470
19:05:23.687486 IP 10.0.0.1.34711 > 10.0.0.3.5001: UDP, length 1470
19:05:23.699630 IP 10.0.0.1.34711 > 10.0.0.3.5001: UDP, length 1470
19:05:23.710488 IP 10.0.0.1.34711 > 10.0.0.3.5001: UDP, length 1470
19:05:23.721001 IP 10.0.0.1.34711 > 10.0.0.3.5001: UDP, length 1470
19:05:23.732452 IP 10.0.0.1.34711 > 10.0.0.3.5001: UDP, length 1470
19:05:23.743469 IP 10.0.0.1.34711 > 10.0.0.3.5001: UDP, length 1470
19:05:23.754733 IP 10.0.0.1.34711 > 10.0.0.3.5001: UDP, length 1470
19:05:23.766222 IP 10.0.0.1.34711 > 10.0.0.3.5001: UDP, length 1470
19:05:23.777393 IP 10.0.0.1.34711 > 10.0.0.3.5001: UDP, length 1470
19:05:23.788454 IP 10.0.0.1.34711 > 10.0.0.3.5001: UDP, length 1470
19:05:23.799604 IP 10.0.0.1.34711 > 10.0.0.3.5001: UDP, length 1470
19:05:23.810633 IP 10.0.0.1.34711 > 10.0.0.3.5001: UDP, length 1470
19:05:23.822194 IP 10.0.0.1.34711 > 10.0.0.3.5001: UDP, length 1470
19:05:23.833204 IP 10.0.0.1.34711 > 10.0.0.3.5001: UDP, length 1470
19:05:23.844399 IP 10.0.0.1.34711 > 10.0.0.3.5001: UDP, length 1470
19:05:23.855583 IP 10.0.0.1.34711 > 10.0.0.3.5001: UDP, length 1470
19:05:23.866882 IP 10.0.0.1.34711 > 10.0.0.3.5001: UDP, length 1470
19:05:23.878280 IP 10.0.0.1.34711 > 10.0.0.3.5001: UDP, length 1470
19:05:23.889333 IP 10.0.0.1.34711 > 10.0.0.3.5001: UDP, length 1470
19:05:23.900709 IP 10.0.0.1.34711 > 10.0.0.3.5001: UDP, length 1470
19:05:23.911781 IP 10.0.0.1.34711 > 10.0.0.3.5001: UDP, length 1470
19:05:23.923172 IP 10.0.0.1.34711 > 10.0.0.3.5001: UDP, length 1470
19:05:23.934491 IP 10.0.0.1.34711 > 10.0.0.3.5001: UDP, length 1470
19:05:23.945552 IP 10.0.0.1.34711 > 10.0.0.3.5001: UDP, length 1470
19:05:23.956459 IP 10.0.0.1.34711 > 10.0.0.3.5001: UDP, length 1470
19:05:23.967803 IP 10.0.0.1.34711 > 10.0.0.3.5001: UDP, length 1470
19:05:23.978963 IP 10.0.0.1.34711 > 10.0.0.3.5001: UDP, length 1470
19:05:23.990307 IP 10.0.0.1.34711 > 10.0.0.3.5001: UDP, length 1470
19:05:24.001759 IP 10.0.0.1.34711 > 10.0.0.3.5001: UDP, length 1470
19:05:24.012996 IP 10.0.0.1.34711 > 10.0.0.3.5001: UDP, length 1470
19:05:24.024012 IP 10.0.0.1.34711 > 10.0.0.3.5001: UDP, length 1470
19:05:24.035068 IP 10.0.0.1.34711 > 10.0.0.3.5001: UDP, length 1470
19:05:24.046595 IP 10.0.0.1.34711 > 10.0.0.3.5001: UDP, length 1470
19:05:24.057686 IP 10.0.0.1.34711 > 10.0.0.3.5001: UDP, length 1470
19:05:24.068828 IP 10.0.0.1.34711 > 10.0.0.3.5001: UDP, length 1470
19:05:24.080071 IP 10.0.0.1.34711 > 10.0.0.3.5001: UDP, length 1470
19:05:24.091292 IP 10.0.0.1.34711 > 10.0.0.3.5001: UDP, length 1470
19:05:24.102531 IP 10.0.0.1.34711 > 10.0.0.3.5001: UDP, length 1470
19:05:24.114002 IP 10.0.0.1.34711 > 10.0.0.3.5001: UDP, length 1470
19:05:24.125257 IP 10.0.0.1.34711 > 10.0.0.3.5001: UDP, length 1470
19:05:24.136309 IP 10.0.0.1.34711 > 10.0.0.3.5001: UDP, length 1470
19:05:24.147347 IP 10.0.0.1.34711 > 10.0.0.3.5001: UDP, length 1470
19:05:24.158911 IP 10.0.0.1.34711 > 10.0.0.3.5001: UDP, length 1470
19:05:24.170202 IP 10.0.0.1.34711 > 10.0.0.3.5001: UDP, length 1470
19:05:24.181309 IP 10.0.0.1.34711 > 10.0.0.3.5001: UDP, length 1470
19:05:24.192316 IP 10.0.0.1.34711 > 10.0.0.3.5001: UDP, length 1470
19:05:24.203558 IP 10.0.0.1.34711 > 10.0.0.3.5001: UDP, length 1470
19:05:24.215224 IP 10.0.0.1.34711 > 10.0.0.3.5001: UDP, length 1470
19:05:24.226024 IP 10.0.0.1.34711 > 10.0.0.3.5001: UDP, length 1470
19:05:24.237200 IP 10.0.0.1.34711 > 10.0.0.3.5001: UDP, length 1470
19:05:24.248390 IP 10.0.0.1.34711 > 10.0.0.3.5001: UDP, length 1470
19:05:24.259589 IP 10.0.0.1.34711 > 10.0.0.3.5001: UDP, length 1470
19:05:24.271074 IP 10.0.0.1.34711 > 10.0.0.3.5001: UDP, length 1470
19:05:24.282207 IP 10.0.0.1.34711 > 10.0.0.3.5001: UDP, length 1470
19:05:24.293663 IP 10.0.0.1.34711 > 10.0.0.3.5001: UDP, length 1470
19:05:24.304398 IP 10.0.0.1.34711 > 10.0.0.3.5001: UDP, length 1470
19:05:24.315526 IP 10.0.0.1.34711 > 10.0.0.3.5001: UDP, length 1470
19:05:24.326864 IP 10.0.0.1.34711 > 10.0.0.3.5001: UDP, length 1470
19:05:24.338399 IP 10.0.0.1.34711 > 10.0.0.3.5001: UDP, length 1470
19:05:24.349287 IP 10.0.0.1.34711 > 10.0.0.3.5001: UDP, length 1470
19:05:24.360479 IP 10.0.0.1.34711 > 10.0.0.3.5001: UDP, length 1470
19:05:24.371711 IP 10.0.0.1.34711 > 10.0.0.3.5001: UDP, length 1470
19:05:24.383312 IP 10.0.0.1.34711 > 10.0.0.3.5001: UDP, length 1470
19:05:24.394599 IP 10.0.0.1.34711 > 10.0.0.3.5001: UDP, length 1470
19:05:24.405484 IP 10.0.0.1.34711 > 10.0.0.3.5001: UDP, length 1470
19:05:24.416541 IP 10.0.0.1.34711 > 10.0.0.3.5001: UDP, length 1470
19:05:24.428074 IP 10.0.0.1.34711 > 10.0.0.3.5001: UDP, length 1470
19:05:24.439277 IP 10.0.0.1.34711 > 10.0.0.3.5001: UDP, length 1470
19:05:24.450287 IP 10.0.0.1.34711 > 10.0.0.3.5001: UDP, length 1470
19:05:24.461859 IP 10.0.0.1.34711 > 10.0.0.3.5001: UDP, length 1470
19:05:24.472698 IP 10.0.0.1.34711 > 10.0.0.3.5001: UDP, length 1470
19:05:24.483838 IP 10.0.0.1.34711 > 10.0.0.3.5001: UDP, length 1470
19:05:24.495351 IP 10.0.0.1.34711 > 10.0.0.3.5001: UDP, length 1470
19:05:24.506437 IP 10.0.0.1.34711 > 10.0.0.3.5001: UDP, length 1470
19:05:24.517535 IP 10.0.0.1.34711 > 10.0.0.3.5001: UDP, length 1470
19:05:24.528524 IP 10.0.0.1.34711 > 10.0.0.3.5001: UDP, length 1470
19:05:24.539715 IP 10.0.0.1.34711 > 10.0.0.3.5001: UDP, length 1470
19:05:24.551152 IP 10.0.0.1.34711 > 10.0.0.3.5001: UDP, length 1470
19:05:24.562369 IP 10.0.0.1.34711 > 10.0.0.3.5001: UDP, length 1470
19:05:24.573983 IP 10.0.0.1.34711 > 10.0.0.3.5001: UDP, length 1470
19:05:24.584863 IP 10.0.0.1.34711 > 10.0.0.3.5001: UDP, length 1470
19:05:24.595963 IP 10.0.0.1.34711 > 10.0.0.3.5001: UDP, length 1470
19:05:24.607005 IP 10.0.0.1.34711 > 10.0.0.3.5001: UDP, length 1470
19:05:24.618889 IP 10.0.0.1.34711 > 10.0.0.3.5001: UDP, length 1470
19:05:24.629856 IP 10.0.0.1.34711 > 10.0.0.3.5001: UDP, length 1470
19:05:24.641025 IP 10.0.0.1.34711 > 10.0.0.3.5001: UDP, length 1470
19:05:24.651994 IP 10.0.0.1.34711 > 10.0.0.3.5001: UDP, length 1470
19:05:24.663160 IP 10.0.0.1.34711 > 10.0.0.3.5001: UDP, length 1470
19:05:24.674851 IP 10.0.0.1.34711 > 10.0.0.3.5001: UDP, length 1470
19:05:24.687585 IP 10.0.0.1.34711 > 10.0.0.3.5001: UDP, length 1470
19:05:24.699745 IP 10.0.0.1.34711 > 10.0.0.3.5001: UDP, length 1470
19:05:24.708176 IP 10.0.0.1.34711 > 10.0.0.3.5001: UDP, length 1470
19:05:24.719378 IP 10.0.0.1.34711 > 10.0.0.3.5001: UDP, length 1470
19:05:24.730730 IP 10.0.0.1.34711 > 10.0.0.3.5001: UDP, length 1470
19:05:24.741803 IP 10.0.0.1.34711 > 10.0.0.3.5001: UDP, length 1470
19:05:24.753072 IP 10.0.0.1.34711 > 10.0.0.3.5001: UDP, length 1470
19:05:24.764101 IP 10.0.0.1.34711 > 10.0.0.3.5001: UDP, length 1470
19:05:24.775946 IP 10.0.0.1.34711 > 10.0.0.3.5001: UDP, length 1470
19:05:24.787058 IP 10.0.0.1.34711 > 10.0.0.3.5001: UDP, length 1470
19:05:24.798456 IP 10.0.0.1.34711 > 10.0.0.3.5001: UDP, length 1470
19:05:24.808896 IP 10.0.0.1.34711 > 10.0.0.3.5001: UDP, length 1470
19:05:24.820279 IP 10.0.0.1.34711 > 10.0.0.3.5001: UDP, length 1470
19:05:24.831382 IP 10.0.0.1.34711 > 10.0.0.3.5001: UDP, length 1470
19:05:24.842738 IP 10.0.0.1.34711 > 10.0.0.3.5001: UDP, length 1470
19:05:24.853978 IP 10.0.0.1.34711 > 10.0.0.3.5001: UDP, length 1470
19:05:24.865323 IP 10.0.0.1.34711 > 10.0.0.3.5001: UDP, length 1470
19:05:24.876522 IP 10.0.0.1.34711 > 10.0.0.3.5001: UDP, length 1470
19:05:24.887577 IP 10.0.0.1.34711 > 10.0.0.3.5001: UDP, length 1470
19:05:24.898877 IP 10.0.0.1.34711 > 10.0.0.3.5001: UDP, length 1470
19:05:24.910860 IP 10.0.0.1.34711 > 10.0.0.3.5001: UDP, length 1470
19:05:24.921406 IP 10.0.0.1.34711 > 10.0.0.3.5001: UDP, length 1470
19:05:24.932620 IP 10.0.0.1.34711 > 10.0.0.3.5001: UDP, length 1470
19:05:24.943776 IP 10.0.0.1.34711 > 10.0.0.3.5001: UDP, length 1470
19:05:24.955547 IP 10.0.0.1.34711 > 10.0.0.3.5001: UDP, length 1470
19:05:24.966112 IP 10.0.0.1.34711 > 10.0.0.3.5001: UDP, length 1470
19:05:24.977314 IP 10.0.0.1.34711 > 10.0.0.3.5001: UDP, length 1470
19:05:24.988678 IP 10.0.0.1.34711 > 10.0.0.3.5001: UDP, length 1470
19:05:24.999759 IP 10.0.0.1.34711 > 10.0.0.3.5001: UDP, length 1470
19:05:25.010950 IP 10.0.0.1.34711 > 10.0.0.3.5001: UDP, length 1470
19:05:25.022330 IP 10.0.0.1.34711 > 10.0.0.3.5001: UDP, length 1470
19:05:25.033821 IP 10.0.0.1.34711 > 10.0.0.3.5001: UDP, length 1470
19:05:25.044620 IP 10.0.0.1.34711 > 10.0.0.3.5001: UDP, length 1470
19:05:25.055875 IP 10.0.0.1.34711 > 10.0.0.3.5001: UDP, length 1470
19:05:25.067306 IP 10.0.0.1.34711 > 10.0.0.3.5001: UDP, length 1470
19:05:25.078264 IP 10.0.0.1.34711 > 10.0.0.3.5001: UDP, length 1470
19:05:25.089520 IP 10.0.0.1.34711 > 10.0.0.3.5001: UDP, length 1470
19:05:25.102196 IP 10.0.0.1.34711 > 10.0.0.3.5001: UDP, length 1470
19:05:25.112285 IP 10.0.0.1.34711 > 10.0.0.3.5001: UDP, length 1470
19:05:25.122857 IP 10.0.0.1.34711 > 10.0.0.3.5001: UDP, length 1470
19:05:25.134419 IP 10.0.0.1.34711 > 10.0.0.3.5001: UDP, length 1470
19:05:25.145393 IP 10.0.0.1.34711 > 10.0.0.3.5001: UDP, length 1470
19:05:25.156455 IP 10.0.0.1.34711 > 10.0.0.3.5001: UDP, length 1470
19:05:25.168588 IP 10.0.0.1.34711 > 10.0.0.3.5001: UDP, length 1470
19:05:25.179454 IP 10.0.0.1.34711 > 10.0.0.3.5001: UDP, length 1470
19:05:25.190327 IP 10.0.0.1.34711 > 10.0.0.3.5001: UDP, length 1470
19:05:25.201825 IP 10.0.0.1.34711 > 10.0.0.3.5001: UDP, length 1470
19:05:25.212957 IP 10.0.0.1.34711 > 10.0.0.3.5001: UDP, length 1470
19:05:25.223989 IP 10.0.0.1.34711 > 10.0.0.3.5001: UDP, length 1470
19:05:25.235490 IP 10.0.0.1.34711 > 10.0.0.3.5001: UDP, length 1470
19:05:25.246708 IP 10.0.0.1.34711 > 10.0.0.3.5001: UDP, length 1470
19:05:25.257799 IP 10.0.0.1.34711 > 10.0.0.3.5001: UDP, length 1470
19:05:25.268940 IP 10.0.0.1.34711 > 10.0.0.3.5001: UDP, length 1470
19:05:25.280292 IP 10.0.0.1.34711 > 10.0.0.3.5001: UDP, length 1470
19:05:25.291159 IP 10.0.0.1.34711 > 10.0.0.3.5001: UDP, length 1470
19:05:25.302396 IP 10.0.0.1.34711 > 10.0.0.3.5001: UDP, length 1470
19:05:25.313796 IP 10.0.0.1.34711 > 10.0.0.3.5001: UDP, length 1470
19:05:25.325261 IP 10.0.0.1.34711 > 10.0.0.3.5001: UDP, length 1470
19:05:25.336391 IP 10.0.0.1.34711 > 10.0.0.3.5001: UDP, length 1470
19:05:25.347361 IP 10.0.0.1.34711 > 10.0.0.3.5001: UDP, length 1470
19:05:25.359106 IP 10.0.0.1.34711 > 10.0.0.3.5001: UDP, length 1470
19:05:25.370160 IP 10.0.0.1.34711 > 10.0.0.3.5001: UDP, length 1470
19:05:25.381022 IP 10.0.0.1.34711 > 10.0.0.3.5001: UDP, length 1470
19:05:25.392503 IP 10.0.0.1.34711 > 10.0.0.3.5001: UDP, length 1470
19:05:25.403393 IP 10.0.0.1.34711 > 10.0.0.3.5001: UDP, length 1470
19:05:25.415412 IP 10.0.0.1.34711 > 10.0.0.3.5001: UDP, length 1470
19:05:25.425932 IP 10.0.0.1.34711 > 10.0.0.3.5001: UDP, length 1470
19:05:25.436966 IP 10.0.0.1.34711 > 10.0.0.3.5001: UDP, length 1470
19:05:25.448476 IP 10.0.0.1.34711 > 10.0.0.3.5001: UDP, length 1470
19:05:25.459535 IP 10.0.0.1.34711 > 10.0.0.3.5001: UDP, length 1470
19:05:25.472036 IP 10.0.0.1.34711 > 10.0.0.3.5001: UDP, length 1470
19:05:25.482610 IP 10.0.0.1.34711 > 10.0.0.3.5001: UDP, length 1470
19:05:25.493158 IP 10.0.0.1.34711 > 10.0.0.3.5001: UDP, length 1470
19:05:25.505138 IP 10.0.0.1.34711 > 10.0.0.3.5001: UDP, length 1470
19:05:25.515928 IP 10.0.0.1.34711 > 10.0.0.3.5001: UDP, length 1470
19:05:25.526790 IP 10.0.0.1.34711 > 10.0.0.3.5001: UDP, length 1470
19:05:25.539148 IP 10.0.0.1.34711 > 10.0.0.3.5001: UDP, length 1470
19:05:25.549775 IP 10.0.0.1.34711 > 10.0.0.3.5001: UDP, length 1470
19:05:25.560318 IP 10.0.0.1.34711 > 10.0.0.3.5001: UDP, length 1470
19:05:25.572188 IP 10.0.0.1.34711 > 10.0.0.3.5001: UDP, length 1470
19:05:25.582894 IP 10.0.0.1.34711 > 10.0.0.3.5001: UDP, length 1470
19:05:25.594041 IP 10.0.0.1.34711 > 10.0.0.3.5001: UDP, length 1470
19:05:25.606251 IP 10.0.0.1.34711 > 10.0.0.3.5001: UDP, length 1470
19:05:25.616835 IP 10.0.0.1.34711 > 10.0.0.3.5001: UDP, length 1470
19:05:25.627535 IP 10.0.0.1.34711 > 10.0.0.3.5001: UDP, length 1470
19:05:25.639228 IP 10.0.0.1.34711 > 10.0.0.3.5001: UDP, length 1470
19:05:25.650301 IP 10.0.0.1.34711 > 10.0.0.3.5001: UDP, length 1470
19:05:25.661509 IP 10.0.0.1.34711 > 10.0.0.3.5001: UDP, length 1470
19:05:25.672681 IP 10.0.0.1.34711 > 10.0.0.3.5001: UDP, length 1470
19:05:25.683713 IP 10.0.0.1.34711 > 10.0.0.3.5001: UDP, length 1470
19:05:25.695236 IP 10.0.0.1.34711 > 10.0.0.3.5001: UDP, length 1470
19:05:25.706546 IP 10.0.0.1.34711 > 10.0.0.3.5001: UDP, length 1470
19:05:25.717810 IP 10.0.0.1.34711 > 10.0.0.3.5001: UDP, length 1470
19:05:25.729011 IP 10.0.0.1.34711 > 10.0.0.3.5001: UDP, length 1470
19:05:25.740063 IP 10.0.0.1.34711 > 10.0.0.3.5001: UDP, length 1470
19:05:25.750877 IP 10.0.0.1.34711 > 10.0.0.3.5001: UDP, length 1470
19:05:25.762291 IP 10.0.0.1.34711 > 10.0.0.3.5001: UDP, length 1470
19:05:25.773766 IP 10.0.0.1.34711 > 10.0.0.3.5001: UDP, length 1470
19:05:25.784786 IP 10.0.0.1.34711 > 10.0.0.3.5001: UDP, length 1470
19:05:25.796006 IP 10.0.0.1.34711 > 10.0.0.3.5001: UDP, length 1470
19:05:25.807075 IP 10.0.0.1.34711 > 10.0.0.3.5001: UDP, length 1470
19:05:25.818990 IP 10.0.0.1.34711 > 10.0.0.3.5001: UDP, length 1470
19:05:25.829882 IP 10.0.0.1.34711 > 10.0.0.3.5001: UDP, length 1470
19:05:25.840990 IP 10.0.0.1.34711 > 10.0.0.3.5001: UDP, length 1470
19:05:25.852126 IP 10.0.0.1.34711 > 10.0.0.3.5001: UDP, length 1470
19:05:25.863275 IP 10.0.0.1.34711 > 10.0.0.3.5001: UDP, length 1470
19:05:25.874745 IP 10.0.0.1.34711 > 10.0.0.3.5001: UDP, length 1470
19:05:25.886225 IP 10.0.0.1.34711 > 10.0.0.3.5001: UDP, length 1470
19:05:25.897001 IP 10.0.0.1.34711 > 10.0.0.3.5001: UDP, length 1470
19:05:25.908100 IP 10.0.0.1.34711 > 10.0.0.3.5001: UDP, length 1470
19:05:25.919242 IP 10.0.0.1.34711 > 10.0.0.3.5001: UDP, length 1470
19:05:25.930965 IP 10.0.0.1.34711 > 10.0.0.3.5001: UDP, length 1470
19:05:25.942014 IP 10.0.0.1.34711 > 10.0.0.3.5001: UDP, length 1470
19:05:25.953214 IP 10.0.0.1.34711 > 10.0.0.3.5001: UDP, length 1470
19:05:25.964316 IP 10.0.0.1.34711 > 10.0.0.3.5001: UDP, length 1470
19:05:25.975303 IP 10.0.0.1.34711 > 10.0.0.3.5001: UDP, length 1470
19:05:25.987106 IP 10.0.0.1.34711 > 10.0.0.3.5001: UDP, length 1470
19:05:25.998130 IP 10.0.0.1.34711 > 10.0.0.3.5001: UDP, length 1470
19:05:26.009177 IP 10.0.0.1.34711 > 10.0.0.3.5001: UDP, length 1470
19:05:26.020405 IP 10.0.0.1.34711 > 10.0.0.3.5001: UDP, length 1470
19:05:26.031453 IP 10.0.0.1.34711 > 10.0.0.3.5001: UDP, length 1470
19:05:26.043035 IP 10.0.0.1.34711 > 10.0.0.3.5001: UDP, length 1470
19:05:26.054236 IP 10.0.0.1.34711 > 10.0.0.3.5001: UDP, length 1470
19:05:26.065130 IP 10.0.0.1.34711 > 10.0.0.3.5001: UDP, length 1470
19:05:26.076473 IP 10.0.0.1.34711 > 10.0.0.3.5001: UDP, length 1470
19:05:26.087535 IP 10.0.0.1.34711 > 10.0.0.3.5001: UDP, length 1470
19:05:26.099188 IP 10.0.0.1.34711 > 10.0.0.3.5001: UDP, length 1470
19:05:26.110179 IP 10.0.0.1.34711 > 10.0.0.3.5001: UDP, length 1470
19:05:26.121510 IP 10.0.0.1.34711 > 10.0.0.3.5001: UDP, length 1470
19:05:26.132535 IP 10.0.0.1.34711 > 10.0.0.3.5001: UDP, length 1470
19:05:26.143692 IP 10.0.0.1.34711 > 10.0.0.3.5001: UDP, length 1470
19:05:26.155210 IP 10.0.0.1.34711 > 10.0.0.3.5001: UDP, length 1470
19:05:26.166354 IP 10.0.0.1.34711 > 10.0.0.3.5001: UDP, length 1470
19:05:26.177280 IP 10.0.0.1.34711 > 10.0.0.3.5001: UDP, length 1470
19:05:26.188617 IP 10.0.0.1.34711 > 10.0.0.3.5001: UDP, length 1470
19:05:26.200270 IP 10.0.0.1.34711 > 10.0.0.3.5001: UDP, length 1470
19:05:26.211282 IP 10.0.0.1.34711 > 10.0.0.3.5001: UDP, length 1470
19:05:26.222539 IP 10.0.0.1.34711 > 10.0.0.3.5001: UDP, length 1470
19:05:26.233906 IP 10.0.0.1.34711 > 10.0.0.3.5001: UDP, length 1470
19:05:26.244533 IP 10.0.0.1.34711 > 10.0.0.3.5001: UDP, length 1470
19:05:26.255796 IP 10.0.0.1.34711 > 10.0.0.3.5001: UDP, length 1470
19:05:26.266980 IP 10.0.0.1.34711 > 10.0.0.3.5001: UDP, length 1470
19:05:26.278198 IP 10.0.0.1.34711 > 10.0.0.3.5001: UDP, length 1470
19:05:26.289758 IP 10.0.0.1.34711 > 10.0.0.3.5001: UDP, length 1470
19:05:26.300755 IP 10.0.0.1.34711 > 10.0.0.3.5001: UDP, length 1470
19:05:26.311942 IP 10.0.0.1.34711 > 10.0.0.3.5001: UDP, length 1470
19:05:26.323394 IP 10.0.0.1.34711 > 10.0.0.3.5001: UDP, length 1470
19:05:26.334361 IP 10.0.0.1.34711 > 10.0.0.3.5001: UDP, length 1470
19:05:26.345795 IP 10.0.0.1.34711 > 10.0.0.3.5001: UDP, length 1470
19:05:26.356889 IP 10.0.0.1.34711 > 10.0.0.3.5001: UDP, length 1470
19:05:26.368022 IP 10.0.0.1.34711 > 10.0.0.3.5001: UDP, length 1470
19:05:26.379271 IP 10.0.0.1.34711 > 10.0.0.3.5001: UDP, length 1470
19:05:26.390780 IP 10.0.0.1.34711 > 10.0.0.3.5001: UDP, length 1470
19:05:26.401731 IP 10.0.0.1.34711 > 10.0.0.3.5001: UDP, length 1470
19:05:26.412867 IP 10.0.0.1.34711 > 10.0.0.3.5001: UDP, length 1470
19:05:26.424244 IP 10.0.0.1.34711 > 10.0.0.3.5001: UDP, length 1470
19:05:26.435233 IP 10.0.0.1.34711 > 10.0.0.3.5001: UDP, length 1470
19:05:26.446826 IP 10.0.0.1.34711 > 10.0.0.3.5001: UDP, length 1470
19:05:26.458012 IP 10.0.0.1.34711 > 10.0.0.3.5001: UDP, length 1470
19:05:26.469100 IP 10.0.0.1.34711 > 10.0.0.3.5001: UDP, length 1470
19:05:26.480162 IP 10.0.0.1.34711 > 10.0.0.3.5001: UDP, length 1470
19:05:26.491358 IP 10.0.0.1.34711 > 10.0.0.3.5001: UDP, length 1470
19:05:26.502945 IP 10.0.0.1.34711 > 10.0.0.3.5001: UDP, length 1470
19:05:26.513984 IP 10.0.0.1.34711 > 10.0.0.3.5001: UDP, length 1470
19:05:26.525227 IP 10.0.0.1.34711 > 10.0.0.3.5001: UDP, length 1470
19:05:26.536287 IP 10.0.0.1.34711 > 10.0.0.3.5001: UDP, length 1470
19:05:26.547411 IP 10.0.0.1.34711 > 10.0.0.3.5001: UDP, length 1470
19:05:26.559222 IP 10.0.0.1.34711 > 10.0.0.3.5001: UDP, length 1470
19:05:26.569816 IP 10.0.0.1.34711 > 10.0.0.3.5001: UDP, length 1470
19:05:26.581078 IP 10.0.0.1.34711 > 10.0.0.3.5001: UDP, length 1470
19:05:26.592441 IP 10.0.0.1.34711 > 10.0.0.3.5001: UDP, length 1470
19:05:26.603515 IP 10.0.0.1.34711 > 10.0.0.3.5001: UDP, length 1470
19:05:26.615096 IP 10.0.0.1.34711 > 10.0.0.3.5001: UDP, length 1470
19:05:26.626050 IP 10.0.0.1.34711 > 10.0.0.3.5001: UDP, length 1470
19:05:26.637398 IP 10.0.0.1.34711 > 10.0.0.3.5001: UDP, length 1470
19:05:26.648455 IP 10.0.0.1.34711 > 10.0.0.3.5001: UDP, length 1470
19:05:26.659455 IP 10.0.0.1.34711 > 10.0.0.3.5001: UDP, length 1470
19:05:26.671279 IP 10.0.0.1.34711 > 10.0.0.3.5001: UDP, length 1470
19:05:26.682341 IP 10.0.0.1.34711 > 10.0.0.3.5001: UDP, length 1470
19:05:26.693443 IP 10.0.0.1.34711 > 10.0.0.3.5001: UDP, length 1470
19:05:26.704518 IP 10.0.0.1.34711 > 10.0.0.3.5001: UDP, length 1470
19:05:26.715503 IP 10.0.0.1.34711 > 10.0.0.3.5001: UDP, length 1470
19:05:26.726974 IP 10.0.0.1.34711 > 10.0.0.3.5001: UDP, length 1470
19:05:26.738138 IP 10.0.0.1.34711 > 10.0.0.3.5001: UDP, length 1470
19:05:26.749335 IP 10.0.0.1.34711 > 10.0.0.3.5001: UDP, length 1470
19:05:26.760357 IP 10.0.0.1.34711 > 10.0.0.3.5001: UDP, length 1470
19:05:26.771729 IP 10.0.0.1.34711 > 10.0.0.3.5001: UDP, length 1470
19:05:26.783954 IP 10.0.0.1.34711 > 10.0.0.3.5001: UDP, length 1470
19:05:26.795222 IP 10.0.0.1.34711 > 10.0.0.3.5001: UDP, length 1470
19:05:26.805667 IP 10.0.0.1.34711 > 10.0.0.3.5001: UDP, length 1470
19:05:26.816642 IP 10.0.0.1.34711 > 10.0.0.3.5001: UDP, length 1470
19:05:26.827706 IP 10.0.0.1.34711 > 10.0.0.3.5001: UDP, length 1470
19:05:26.838944 IP 10.0.0.1.34711 > 10.0.0.3.5001: UDP, length 1470
19:05:26.850554 IP 10.0.0.1.34711 > 10.0.0.3.5001: UDP, length 1470
19:05:26.861778 IP 10.0.0.1.34711 > 10.0.0.3.5001: UDP, length 1470
19:05:26.872812 IP 10.0.0.1.34711 > 10.0.0.3.5001: UDP, length 1470
19:05:26.883768 IP 10.0.0.1.34711 > 10.0.0.3.5001: UDP, length 1470
19:05:26.894997 IP 10.0.0.1.34711 > 10.0.0.3.5001: UDP, length 1470
19:05:26.906294 IP 10.0.0.1.34711 > 10.0.0.3.5001: UDP, length 1470
19:05:26.917745 IP 10.0.0.1.34711 > 10.0.0.3.5001: UDP, length 1470
19:05:26.928923 IP 10.0.0.1.34711 > 10.0.0.3.5001: UDP, length 1470
19:05:26.939994 IP 10.0.0.1.34711 > 10.0.0.3.5001: UDP, length 1470
19:05:26.951422 IP 10.0.0.1.34711 > 10.0.0.3.5001: UDP, length 1470
19:05:26.962327 IP 10.0.0.1.34711 > 10.0.0.3.5001: UDP, length 1470
19:05:26.973854 IP 10.0.0.1.34711 > 10.0.0.3.5001: UDP, length 1470
19:05:26.984967 IP 10.0.0.1.34711 > 10.0.0.3.5001: UDP, length 1470
19:05:26.996019 IP 10.0.0.1.34711 > 10.0.0.3.5001: UDP, length 1470
19:05:27.007145 IP 10.0.0.1.34711 > 10.0.0.3.5001: UDP, length 1470
19:05:27.018774 IP 10.0.0.1.34711 > 10.0.0.3.5001: UDP, length 1470
19:05:27.029803 IP 10.0.0.1.34711 > 10.0.0.3.5001: UDP, length 1470
19:05:27.040979 IP 10.0.0.1.34711 > 10.0.0.3.5001: UDP, length 1470
19:05:27.052273 IP 10.0.0.1.34711 > 10.0.0.3.5001: UDP, length 1470
19:05:27.063248 IP 10.0.0.1.34711 > 10.0.0.3.5001: UDP, length 1470
19:05:27.074945 IP 10.0.0.1.34711 > 10.0.0.3.5001: UDP, length 1470
19:05:27.087083 IP 10.0.0.1.34711 > 10.0.0.3.5001: UDP, length 1470
19:05:27.096894 IP 10.0.0.1.34711 > 10.0.0.3.5001: UDP, length 1470
19:05:27.108141 IP 10.0.0.1.34711 > 10.0.0.3.5001: UDP, length 1470
19:05:27.119335 IP 10.0.0.1.34711 > 10.0.0.3.5001: UDP, length 1470
19:05:27.130822 IP 10.0.0.1.34711 > 10.0.0.3.5001: UDP, length 1470
19:05:27.141835 IP 10.0.0.1.34711 > 10.0.0.3.5001: UDP, length 1470
19:05:27.153198 IP 10.0.0.1.34711 > 10.0.0.3.5001: UDP, length 1470
19:05:27.164298 IP 10.0.0.1.34711 > 10.0.0.3.5001: UDP, length 1470
19:05:27.175283 IP 10.0.0.1.34711 > 10.0.0.3.5001: UDP, length 1470
19:05:27.187116 IP 10.0.0.1.34711 > 10.0.0.3.5001: UDP, length 1470
19:05:27.198182 IP 10.0.0.1.34711 > 10.0.0.3.5001: UDP, length 1470
19:05:27.209034 IP 10.0.0.1.34711 > 10.0.0.3.5001: UDP, length 1470
19:05:27.220403 IP 10.0.0.1.34711 > 10.0.0.3.5001: UDP, length 1470
19:05:27.231559 IP 10.0.0.1.34711 > 10.0.0.3.5001: UDP, length 1470
19:05:27.242840 IP 10.0.0.1.34711 > 10.0.0.3.5001: UDP, length 1470
19:05:27.254111 IP 10.0.0.1.34711 > 10.0.0.3.5001: UDP, length 1470
19:05:27.265397 IP 10.0.0.1.34711 > 10.0.0.3.5001: UDP, length 1470
19:05:27.276384 IP 10.0.0.1.34711 > 10.0.0.3.5001: UDP, length 1470
19:05:27.287473 IP 10.0.0.1.34711 > 10.0.0.3.5001: UDP, length 1470
19:05:27.298916 IP 10.0.0.1.34711 > 10.0.0.3.5001: UDP, length 1470
19:05:27.310323 IP 10.0.0.1.34711 > 10.0.0.3.5001: UDP, length 1470
19:05:27.321353 IP 10.0.0.1.34711 > 10.0.0.3.5001: UDP, length 1470
19:05:27.332532 IP 10.0.0.1.34711 > 10.0.0.3.5001: UDP, length 1470
19:05:27.343544 IP 10.0.0.1.34711 > 10.0.0.3.5001: UDP, length 1470
19:05:27.355202 IP 10.0.0.1.34711 > 10.0.0.3.5001: UDP, length 1470
19:05:27.366261 IP 10.0.0.1.34711 > 10.0.0.3.5001: UDP, length 1470
19:05:27.377234 IP 10.0.0.1.34711 > 10.0.0.3.5001: UDP, length 1470
19:05:27.388694 IP 10.0.0.1.34711 > 10.0.0.3.5001: UDP, length 1470
19:05:27.399845 IP 10.0.0.1.34711 > 10.0.0.3.5001: UDP, length 1470
19:05:27.410841 IP 10.0.0.1.34711 > 10.0.0.3.5001: UDP, length 1470
19:05:27.422740 IP 10.0.0.1.34711 > 10.0.0.3.5001: UDP, length 1470
19:05:27.433717 IP 10.0.0.1.34711 > 10.0.0.3.5001: UDP, length 1470
19:05:27.444746 IP 10.0.0.1.34711 > 10.0.0.3.5001: UDP, length 1470
19:05:27.455846 IP 10.0.0.1.34711 > 10.0.0.3.5001: UDP, length 1470
19:05:27.467182 IP 10.0.0.1.34711 > 10.0.0.3.5001: UDP, length 1470
19:05:27.478808 IP 10.0.0.1.34711 > 10.0.0.3.5001: UDP, length 1470
19:05:27.489771 IP 10.0.0.1.34711 > 10.0.0.3.5001: UDP, length 1470
19:05:27.500762 IP 10.0.0.1.34711 > 10.0.0.3.5001: UDP, length 1470
19:05:27.511928 IP 10.0.0.1.34711 > 10.0.0.3.5001: UDP, length 1470
19:05:27.522892 IP 10.0.0.1.34711 > 10.0.0.3.5001: UDP, length 1470
19:05:27.534504 IP 10.0.0.1.34711 > 10.0.0.3.5001: UDP, length 1470
19:05:27.545623 IP 10.0.0.1.34711 > 10.0.0.3.5001: UDP, length 1470
19:05:27.557062 IP 10.0.0.1.34711 > 10.0.0.3.5001: UDP, length 1470
19:05:27.568085 IP 10.0.0.1.34711 > 10.0.0.3.5001: UDP, length 1470
19:05:27.579393 IP 10.0.0.1.34711 > 10.0.0.3.5001: UDP, length 1470
19:05:27.590477 IP 10.0.0.1.34711 > 10.0.0.3.5001: UDP, length 1470
19:05:27.602188 IP 10.0.0.1.34711 > 10.0.0.3.5001: UDP, length 1470
19:05:27.613230 IP 10.0.0.1.34711 > 10.0.0.3.5001: UDP, length 1470
19:05:27.624314 IP 10.0.0.1.34711 > 10.0.0.3.5001: UDP, length 1470
19:05:27.635510 IP 10.0.0.1.34711 > 10.0.0.3.5001: UDP, length 1470
19:05:27.646807 IP 10.0.0.1.34711 > 10.0.0.3.5001: UDP, length 1470
19:05:27.657766 IP 10.0.0.1.34711 > 10.0.0.3.5001: UDP, length 1470
19:05:27.668924 IP 10.0.0.1.34711 > 10.0.0.3.5001: UDP, length 1470
19:05:27.680039 IP 10.0.0.1.34711 > 10.0.0.3.5001: UDP, length 1470
19:05:27.691123 IP 10.0.0.1.34711 > 10.0.0.3.5001: UDP, length 1470
19:05:27.702959 IP 10.0.0.1.34711 > 10.0.0.3.5001: UDP, length 1470
19:05:27.714981 IP 10.0.0.1.34711 > 10.0.0.3.5001: UDP, length 1470
19:05:27.726260 IP 10.0.0.1.34711 > 10.0.0.3.5001: UDP, length 1470
19:05:27.736724 IP 10.0.0.1.34711 > 10.0.0.3.5001: UDP, length 1470
19:05:27.748088 IP 10.0.0.1.34711 > 10.0.0.3.5001: UDP, length 1470
19:05:27.759838 IP 10.0.0.1.34711 > 10.0.0.3.5001: UDP, length 1470
19:05:27.770015 IP 10.0.0.1.34711 > 10.0.0.3.5001: UDP, length 1470
19:05:27.781714 IP 10.0.0.1.34711 > 10.0.0.3.5001: UDP, length 1470
19:05:27.792508 IP 10.0.0.1.34711 > 10.0.0.3.5001: UDP, length 1470
19:05:27.804619 IP 10.0.0.1.34711 > 10.0.0.3.5001: UDP, length 1470
19:05:27.815470 IP 10.0.0.1.34711 > 10.0.0.3.5001: UDP, length 1470
19:05:27.825782 IP 10.0.0.1.34711 > 10.0.0.3.5001: UDP, length 1470
19:05:27.837444 IP 10.0.0.1.34711 > 10.0.0.3.5001: UDP, length 1470
19:05:27.848571 IP 10.0.0.1.34711 > 10.0.0.3.5001: UDP, length 1470
19:05:27.859370 IP 10.0.0.1.34711 > 10.0.0.3.5001: UDP, length 1470
19:05:27.870824 IP 10.0.0.1.34711 > 10.0.0.3.5001: UDP, length 1470
19:05:27.882576 IP 10.0.0.1.34711 > 10.0.0.3.5001: UDP, length 1470
19:05:27.893881 IP 10.0.0.1.34711 > 10.0.0.3.5001: UDP, length 1470
19:05:27.904349 IP 10.0.0.1.34711 > 10.0.0.3.5001: UDP, length 1470
19:05:27.915694 IP 10.0.0.1.34711 > 10.0.0.3.5001: UDP, length 1470
19:05:27.926862 IP 10.0.0.1.34711 > 10.0.0.3.5001: UDP, length 1470
19:05:27.938584 IP 10.0.0.1.34711 > 10.0.0.3.5001: UDP, length 1470
19:05:27.949552 IP 10.0.0.1.34711 > 10.0.0.3.5001: UDP, length 1470
19:05:27.960906 IP 10.0.0.1.34711 > 10.0.0.3.5001: UDP, length 1470
19:05:27.972067 IP 10.0.0.1.34711 > 10.0.0.3.5001: UDP, length 1470
19:05:27.982760 IP 10.0.0.1.34711 > 10.0.0.3.5001: UDP, length 1470
19:05:27.994055 IP 10.0.0.1.34711 > 10.0.0.3.5001: UDP, length 1470
19:05:28.005402 IP 10.0.0.1.34711 > 10.0.0.3.5001: UDP, length 1470
19:05:28.017284 IP 10.0.0.1.34711 > 10.0.0.3.5001: UDP, length 1470
19:05:28.028448 IP 10.0.0.1.34711 > 10.0.0.3.5001: UDP, length 1470
19:05:28.039230 IP 10.0.0.1.34711 > 10.0.0.3.5001: UDP, length 1470
19:05:28.050231 IP 10.0.0.1.34711 > 10.0.0.3.5001: UDP, length 1470
19:05:28.061676 IP 10.0.0.1.34711 > 10.0.0.3.5001: UDP, length 1470
19:05:28.072811 IP 10.0.0.1.34711 > 10.0.0.3.5001: UDP, length 1470
19:05:28.083805 IP 10.0.0.1.34711 > 10.0.0.3.5001: UDP, length 1470
19:05:28.094987 IP 10.0.0.1.34711 > 10.0.0.3.5001: UDP, length 1470
19:05:28.106755 IP 10.0.0.1.34711 > 10.0.0.3.5001: UDP, length 1470
19:05:28.117792 IP 10.0.0.1.34711 > 10.0.0.3.5001: UDP, length 1470
19:05:28.129100 IP 10.0.0.1.34711 > 10.0.0.3.5001: UDP, length 1470
19:05:28.140073 IP 10.0.0.1.34711 > 10.0.0.3.5001: UDP, length 1470
19:05:28.151081 IP 10.0.0.1.34711 > 10.0.0.3.5001: UDP, length 1470
19:05:28.162428 IP 10.0.0.1.34711 > 10.0.0.3.5001: UDP, length 1470
19:05:28.175091 IP 10.0.0.1.34711 > 10.0.0.3.5001: UDP, length 1470
19:05:28.184822 IP 10.0.0.1.34711 > 10.0.0.3.5001: UDP, length 1470
19:05:28.196121 IP 10.0.0.1.34711 > 10.0.0.3.5001: UDP, length 1470
19:05:28.207197 IP 10.0.0.1.34711 > 10.0.0.3.5001: UDP, length 1470
19:05:28.218903 IP 10.0.0.1.34711 > 10.0.0.3.5001: UDP, length 1470
19:05:28.229626 IP 10.0.0.1.34711 > 10.0.0.3.5001: UDP, length 1470
19:05:28.240666 IP 10.0.0.1.34711 > 10.0.0.3.5001: UDP, length 1470
19:05:28.252207 IP 10.0.0.1.34711 > 10.0.0.3.5001: UDP, length 1470
19:05:28.263338 IP 10.0.0.1.34711 > 10.0.0.3.5001: UDP, length 1470
19:05:28.274458 IP 10.0.0.1.34711 > 10.0.0.3.5001: UDP, length 1470
19:05:28.285954 IP 10.0.0.1.34711 > 10.0.0.3.5001: UDP, length 1470
19:05:28.297341 IP 10.0.0.1.34711 > 10.0.0.3.5001: UDP, length 1470
19:05:28.308490 IP 10.0.0.1.34711 > 10.0.0.3.5001: UDP, length 1470
19:05:28.319247 IP 10.0.0.1.34711 > 10.0.0.3.5001: UDP, length 1470
19:05:28.330687 IP 10.0.0.1.34711 > 10.0.0.3.5001: UDP, length 1470
19:05:28.341808 IP 10.0.0.1.34711 > 10.0.0.3.5001: UDP, length 1470
19:05:28.353149 IP 10.0.0.1.34711 > 10.0.0.3.5001: UDP, length 1470
19:05:28.364107 IP 10.0.0.1.34711 > 10.0.0.3.5001: UDP, length 1470
19:05:28.375473 IP 10.0.0.1.34711 > 10.0.0.3.5001: UDP, length 1470
19:05:28.386776 IP 10.0.0.1.34711 > 10.0.0.3.5001: UDP, length 1470
19:05:28.399155 IP 10.0.0.1.34711 > 10.0.0.3.5001: UDP, length 1470
19:05:28.409543 IP 10.0.0.1.34711 > 10.0.0.3.5001: UDP, length 1470
19:05:28.420514 IP 10.0.0.1.34711 > 10.0.0.3.5001: UDP, length 1470
19:05:28.431442 IP 10.0.0.1.34711 > 10.0.0.3.5001: UDP, length 1470
19:05:28.442633 IP 10.0.0.1.34711 > 10.0.0.3.5001: UDP, length 1470
19:05:28.453983 IP 10.0.0.1.34711 > 10.0.0.3.5001: UDP, length 1470
19:05:28.465488 IP 10.0.0.1.34711 > 10.0.0.3.5001: UDP, length 1470
19:05:28.476596 IP 10.0.0.1.34711 > 10.0.0.3.5001: UDP, length 1470
19:05:28.487611 IP 10.0.0.1.34711 > 10.0.0.3.5001: UDP, length 1470
19:05:28.498983 IP 10.0.0.1.34711 > 10.0.0.3.5001: UDP, length 1470
19:05:28.510024 IP 10.0.0.1.34711 > 10.0.0.3.5001: UDP, length 1470
19:05:28.521230 IP 10.0.0.1.34711 > 10.0.0.3.5001: UDP, length 1470
19:05:28.532340 IP 10.0.0.1.34711 > 10.0.0.3.5001: UDP, length 1470
19:05:28.543526 IP 10.0.0.1.34711 > 10.0.0.3.5001: UDP, length 1470
19:05:28.554997 IP 10.0.0.1.34711 > 10.0.0.3.5001: UDP, length 1470
19:05:28.566241 IP 10.0.0.1.34711 > 10.0.0.3.5001: UDP, length 1470
19:05:28.577312 IP 10.0.0.1.34711 > 10.0.0.3.5001: UDP, length 1470
19:05:28.588736 IP 10.0.0.1.34711 > 10.0.0.3.5001: UDP, length 1470
19:05:28.599868 IP 10.0.0.1.34711 > 10.0.0.3.5001: UDP, length 1470
19:05:28.611142 IP 10.0.0.1.34711 > 10.0.0.3.5001: UDP, length 1470
19:05:28.622447 IP 10.0.0.1.34711 > 10.0.0.3.5001: UDP, length 1470
19:05:28.633333 IP 10.0.0.1.34711 > 10.0.0.3.5001: UDP, length 1470
19:05:28.644447 IP 10.0.0.1.34711 > 10.0.0.3.5001: UDP, length 1470
19:05:28.655881 IP 10.0.0.1.34711 > 10.0.0.3.5001: UDP, length 1470
19:05:28.667408 IP 10.0.0.1.34711 > 10.0.0.3.5001: UDP, length 1470
19:05:28.678928 IP 10.0.0.1.34711 > 10.0.0.3.5001: UDP, length 1470
19:05:28.690023 IP 10.0.0.1.34711 > 10.0.0.3.5001: UDP, length 1470
19:05:28.701083 IP 10.0.0.1.34711 > 10.0.0.3.5001: UDP, length 1470
19:05:28.712446 IP 10.0.0.1.34711 > 10.0.0.3.5001: UDP, length 1470
19:05:28.723231 IP 10.0.0.1.34711 > 10.0.0.3.5001: UDP, length 1470
19:05:28.734764 IP 10.0.0.1.34711 > 10.0.0.3.5001: UDP, length 1470
19:05:28.746035 IP 10.0.0.1.34711 > 10.0.0.3.5001: UDP, length 1470
19:05:28.757171 IP 10.0.0.1.34711 > 10.0.0.3.5001: UDP, length 1470
19:05:28.768242 IP 10.0.0.1.34711 > 10.0.0.3.5001: UDP, length 1470
19:05:28.779474 IP 10.0.0.1.34711 > 10.0.0.3.5001: UDP, length 1470
19:05:28.790926 IP 10.0.0.1.34711 > 10.0.0.3.5001: UDP, length 1470
19:05:28.802024 IP 10.0.0.1.34711 > 10.0.0.3.5001: UDP, length 1470
19:05:28.812940 IP 10.0.0.1.34711 > 10.0.0.3.5001: UDP, length 1470
19:05:28.823965 IP 10.0.0.1.34711 > 10.0.0.3.5001: UDP, length 1470
19:05:28.835315 IP 10.0.0.1.34711 > 10.0.0.3.5001: UDP, length 1470
19:05:28.846492 IP 10.0.0.1.34711 > 10.0.0.3.5001: UDP, length 1470
19:05:28.858400 IP 10.0.0.1.34711 > 10.0.0.3.5001: UDP, length 1470
19:05:28.869434 IP 10.0.0.1.34711 > 10.0.0.3.5001: UDP, length 1470
19:05:28.880585 IP 10.0.0.1.34711 > 10.0.0.3.5001: UDP, length 1470
19:05:28.891791 IP 10.0.0.1.34711 > 10.0.0.3.5001: UDP, length 1470
19:05:28.902525 IP 10.0.0.1.34711 > 10.0.0.3.5001: UDP, length 1470
19:05:28.914159 IP 10.0.0.1.34711 > 10.0.0.3.5001: UDP, length 1470
19:05:28.925831 IP 10.0.0.1.34711 > 10.0.0.3.5001: UDP, length 1470
19:05:28.936595 IP 10.0.0.1.34711 > 10.0.0.3.5001: UDP, length 1470
19:05:28.947306 IP 10.0.0.1.34711 > 10.0.0.3.5001: UDP, length 1470
19:05:28.958985 IP 10.0.0.1.34711 > 10.0.0.3.5001: UDP, length 1470
19:05:28.970222 IP 10.0.0.1.34711 > 10.0.0.3.5001: UDP, length 1470
19:05:28.981218 IP 10.0.0.1.34711 > 10.0.0.3.5001: UDP, length 1470
19:05:28.992364 IP 10.0.0.1.34711 > 10.0.0.3.5001: UDP, length 1470
19:05:29.003554 IP 10.0.0.1.34711 > 10.0.0.3.5001: UDP, length 1470
19:05:29.015025 IP 10.0.0.1.34711 > 10.0.0.3.5001: UDP, length 1470
19:05:29.026890 IP 10.0.0.1.34711 > 10.0.0.3.5001: UDP, length 1470
19:05:29.037169 IP 10.0.0.1.34711 > 10.0.0.3.5001: UDP, length 1470
19:05:29.048265 IP 10.0.0.1.34711 > 10.0.0.3.5001: UDP, length 1470
19:05:29.059520 IP 10.0.0.1.34711 > 10.0.0.3.5001: UDP, length 1470
19:05:29.071826 IP 10.0.0.1.34711 > 10.0.0.3.5001: UDP, length 1470
19:05:29.083601 IP 10.0.0.1.34711 > 10.0.0.3.5001: UDP, length 1470
19:05:29.093098 IP 10.0.0.1.34711 > 10.0.0.3.5001: UDP, length 1470
19:05:29.104699 IP 10.0.0.1.34711 > 10.0.0.3.5001: UDP, length 1470
19:05:29.115665 IP 10.0.0.1.34711 > 10.0.0.3.5001: UDP, length 1470
19:05:29.126936 IP 10.0.0.1.34711 > 10.0.0.3.5001: UDP, length 1470
