19:05:55.131964 IP 10.0.0.1.54965 > 10.0.0.4.5001: UDP, length 1470
19:05:55.144621 IP 10.0.0.1.54965 > 10.0.0.4.5001: UDP, length 1470
19:05:55.155943 IP 10.0.0.1.54965 > 10.0.0.4.5001: UDP, length 1470
19:05:55.168115 IP 10.0.0.1.54965 > 10.0.0.4.5001: UDP, length 1470
19:05:55.179092 IP 10.0.0.1.54965 > 10.0.0.4.5001: UDP, length 1470
19:05:55.189690 IP 10.0.0.1.54965 > 10.0.0.4.5001: UDP, length 1470
19:05:55.201486 IP 10.0.0.1.54965 > 10.0.0.4.5001: UDP, length 1470
19:05:55.212675 IP 10.0.0.1.54965 > 10.0.0.4.5001: UDP, length 1470
19:05:55.223088 IP 10.0.0.1.54965 > 10.0.0.4.5001: UDP, length 1470
19:05:55.234695 IP 10.0.0.1.54965 > 10.0.0.4.5001: UDP, length 1470
19:05:55.245732 IP 10.0.0.1.54965 > 10.0.0.4.5001: UDP, length 1470
19:05:55.256841 IP 10.0.0.1.54965 > 10.0.0.4.5001: UDP, length 1470
19:05:55.268166 IP 10.0.0.1.54965 > 10.0.0.4.5001: UDP, length 1470
19:05:55.279255 IP 10.0.0.1.54965 > 10.0.0.4.5001: UDP, length 1470
19:05:55.290520 IP 10.0.0.1.54965 > 10.0.0.4.5001: UDP, length 1470
19:05:55.301884 IP 10.0.0.1.54965 > 10.0.0.4.5001: UDP, length 1470
19:05:55.313157 IP 10.0.0.1.54965 > 10.0.0.4.5001: UDP, length 1470
19:05:55.324163 IP 10.0.0.1.54965 > 10.0.0.4.5001: UDP, length 1470
19:05:55.335365 IP 10.0.0.1.54965 > 10.0.0.4.5001: UDP, length 1470
19:05:55.346980 IP 10.0.0.1.54965 > 10.0.0.4.5001: UDP, length 1470
19:05:55.358033 IP 10.0.0.1.54965 > 10.0.0.4.5001: UDP, length 1470
19:05:55.369088 IP 10.0.0.1.54965 > 10.0.0.4.5001: UDP, length 1470
19:05:55.380205 IP 10.0.0.1.54965 > 10.0.0.4.5001: UDP, length 1470
19:05:55.391385 IP 10.0.0.1.54965 > 10.0.0.4.5001: UDP, length 1470
19:05:55.402790 IP 10.0.0.1.54965 > 10.0.0.4.5001: UDP, length 1470
19:05:55.413949 IP 10.0.0.1.54965 > 10.0.0.4.5001: UDP, length 1470
19:05:55.425225 IP 10.0.0.1.54965 > 10.0.0.4.5001: UDP, length 1470
19:05:55.436885 IP 10.0.0.1.54965 > 10.0.0.4.5001: UDP, length 1470
19:05:55.447401 IP 10.0.0.1.54965 > 10.0.0.4.5001: UDP, length 1470
19:05:55.458727 IP 10.0.0.1.54965 > 10.0.0.4.5001: UDP, length 1470
19:05:55.470066 IP 10.0.0.1.54965 > 10.0.0.4.5001: UDP, length 1470
19:05:55.481116 IP 10.0.0.1.54965 > 10.0.0.4.5001: UDP, length 1470
19:05:55.492415 IP 10.0.0.1.54965 > 10.0.0.4.5001: UDP, length 1470
19:05:55.503642 IP 10.0.0.1.54965 > 10.0.0.4.5001: UDP, length 1470
19:05:55.514885 IP 10.0.0.1.54965 > 10.0.0.4.5001: UDP, length 1470
19:05:55.526221 IP 10.0.0.1.54965 > 10.0.0.4.5001: UDP, length 1470
19:05:55.537350 IP 10.0.0.1.54965 > 10.0.0.4.5001: UDP, length 1470
19:05:55.548739 IP 10.0.0.1.54965 > 10.0.0.4.5001: UDP, length 1470
19:05:55.559692 IP 10.0.0.1.54965 > 10.0.0.4.5001: UDP, length 1470
19:05:55.571002 IP 10.0.0.1.54965 > 10.0.0.4.5001: UDP, length 1470
19:05:55.582907 IP 10.0.0.1.54965 > 10.0.0.4.5001: UDP, length 1470
19:05:55.593515 IP 10.0.0.1.54965 > 10.0.0.4.5001: UDP, length 1470
19:05:55.604849 IP 10.0.0.1.54965 > 10.0.0.4.5001: UDP, length 1470
19:05:55.615874 IP 10.0.0.1.54965 > 10.0.0.4.5001: UDP, length 1470
19:05:55.627042 IP 10.0.0.1.54965 > 10.0.0.4.5001: UDP, length 1470
19:05:55.638565 IP 10.0.0.1.54965 > 10.0.0.4.5001: UDP, length 1470
19:05:55.649657 IP 10.0.0.1.54965 > 10.0.0.4.5001: UDP, length 1470
19:05:55.660670 IP 10.0.0.1.54965 > 10.0.0.4.5001: UDP, length 1470
19:05:55.671721 IP 10.0.0.1.54965 > 10.0.0.4.5001: UDP, length 1470
19:05:55.682899 IP 10.0.0.1.54965 > 10.0.0.4.5001: UDP, length 1470
19:05:55.694135 IP 10.0.0.1.54965 > 10.0.0.4.5001: UDP, length 1470
19:05:55.705663 IP 10.0.0.1.54965 > 10.0.0.4.5001: UDP, length 1470
19:05:55.717246 IP 10.0.0.1.54965 > 10.0.0.4.5001: UDP, length 1470
19:05:55.728108 IP 10.0.0.1.54965 > 10.0.0.4.5001: UDP, length 1470
19:05:55.740830 IP 10.0.0.1.54965 > 10.0.0.4.5001: UDP, length 1470
19:05:55.751261 IP 10.0.0.1.54965 > 10.0.0.4.5001: UDP, length 1470
19:05:55.761864 IP 10.0.0.1.54965 > 10.0.0.4.5001: UDP, length 1470
19:05:55.772941 IP 10.0.0.1.54965 > 10.0.0.4.5001: UDP, length 1470
19:05:55.783918 IP 10.0.0.1.54965 > 10.0.0.4.5001: UDP, length 1470
19:05:55.795081 IP 10.0.0.1.54965 > 10.0.0.4.5001: UDP, length 1470
19:05:55.806432 IP 10.0.0.1.54965 > 10.0.0.4.5001: UDP, length 1470
19:05:55.817967 IP 10.0.0.1.54965 > 10.0.0.4.5001: UDP, length 1470
19:05:55.828948 IP 10.0.0.1.54965 > 10.0.0.4.5001: UDP, length 1470
19:05:55.840082 IP 10.0.0.1.54965 > 10.0.0.4.5001: UDP, length 1470
19:05:55.851255 IP 10.0.0.1.54965 > 10.0.0.4.5001: UDP, length 1470
19:05:55.862622 IP 10.0.0.1.54965 > 10.0.0.4.5001: UDP, length 1470
19:05:55.873749 IP 10.0.0.1.54965 > 10.0.0.4.5001: UDP, length 1470
19:05:55.884978 IP 10.0.0.1.54965 > 10.0.0.4.5001: UDP, length 1470
19:05:55.896740 IP 10.0.0.1.54965 > 10.0.0.4.5001: UDP, length 1470
19:05:55.907370 IP 10.0.0.1.54965 > 10.0.0.4.5001: UDP, length 1470
19:05:55.918900 IP 10.0.0.1.54965 > 10.0.0.4.5001: UDP, length 1470
19:05:55.930050 IP 10.0.0.1.54965 > 10.0.0.4.5001: UDP, length 1470
19:05:55.940871 IP 10.0.0.1.54965 > 10.0.0.4.5001: UDP, length 1470
19:05:55.952063 IP 10.0.0.1.54965 > 10.0.0.4.5001: UDP, length 1470
19:05:55.963331 IP 10.0.0.1.54965 > 10.0.0.4.5001: UDP, length 1470
19:05:55.974603 IP 10.0.0.1.54965 > 10.0.0.4.5001: UDP, length 1470
19:05:55.986105 IP 10.0.0.1.54965 > 10.0.0.4.5001: UDP, length 1470
19:05:55.997152 IP 10.0.0.1.54965 > 10.0.0.4.5001: UDP, length 1470
19:05:56.008168 IP 10.0.0.1.54965 > 10.0.0.4.5001: UDP, length 1470
19:05:56.019409 IP 10.0.0.1.54965 > 10.0.0.4.5001: UDP, length 1470
19:05:56.030950 IP 10.0.0.1.54965 > 10.0.0.4.5001: UDP, length 1470
19:05:56.042091 IP 10.0.0.1.54965 > 10.0.0.4.5001: UDP, length 1470
19:05:56.053301 IP 10.0.0.1.54965 > 10.0.0.4.5001: UDP, length 1470
19:05:56.064588 IP 10.0.0.1.54965 > 10.0.0.4.5001: UDP, length 1470
19:05:56.075530 IP 10.0.0.1.54965 > 10.0.0.4.5001: UDP, length 1470
19:05:56.087320 IP 10.0.0.1.54965 > 10.0.0.4.5001: UDP, length 1470
19:05:56.098053 IP 10.0.0.1.54965 > 10.0.0.4.5001: UDP, length 1470
19:05:56.109370 IP 10.0.0.1.54965 > 10.0.0.4.5001: UDP, length 1470
19:05:56.120572 IP 10.0.0.1.54965 > 10.0.0.4.5001: UDP, length 1470
19:05:56.131640 IP 10.0.0.1.54965 > 10.0.0.4.5001: UDP, length 1470
19:05:56.142771 IP 10.0.0.1.54965 > 10.0.0.4.5001: UDP, length 1470
19:05:56.154701 IP 10.0.0.1.54965 > 10.0.0.4.5001: UDP, length 1470
19:05:56.165781 IP 10.0.0.1.54965 > 10.0.0.4.5001: UDP, length 1470
19:05:56.176677 IP 10.0.0.1.54965 > 10.0.0.4.5001: UDP, length 1470
19:05:56.187846 IP 10.0.0.1.54965 > 10.0.0.4.5001: UDP, length 1470
19:05:56.198905 IP 10.0.0.1.54965 > 10.0.0.4.5001: UDP, length 1470
19:05:56.210474 IP 10.0.0.1.54965 > 10.0.0.4.5001: UDP, length 1470
19:05:56.221748 IP 10.0.0.1.54965 > 10.0.0.4.5001: UDP, length 1470
19:05:56.232567 IP 10.0.0.1.54965 > 10.0.0.4.5001: UDP, length 1470
19:05:56.243814 IP 10.0.0.1.54965 > 10.0.0.4.5001: UDP, length 1470
19:05:56.254938 IP 10.0.0.1.54965 > 10.0.0.4.5001: UDP, length 1470
19:05:56.266399 IP 10.0.0.1.54965 > 10.0.0.4.5001: UDP, length 1470
19:05:56.277663 IP 10.0.0.1.54965 > 10.0.0.4.5001: UDP, length 1470
19:05:56.288765 IP 10.0.0.1.54965 > 10.0.0.4.5001: UDP, length 1470
19:05:56.299972 IP 10.0.0.1.54965 > 10.0.0.4.5001: UDP, length 1470
19:05:56.311020 IP 10.0.0.1.54965 > 10.0.0.4.5001: UDP, length 1470
19:05:56.322729 IP 10.0.0.1.54965 > 10.0.0.4.5001: UDP, length 1470
19:05:56.333708 IP 10.0.0.1.54965 > 10.0.0.4.5001: UDP, length 1470
19:05:56.344896 IP 10.0.0.1.54965 > 10.0.0.4.5001: UDP, length 1470
19:05:56.356035 IP 10.0.0.1.54965 > 10.0.0.4.5001: UDP, length 1470
19:05:56.367118 IP 10.0.0.1.54965 > 10.0.0.4.5001: UDP, length 1470
19:05:56.378313 IP 10.0.0.1.54965 > 10.0.0.4.5001: UDP, length 1470
19:05:56.389897 IP 10.0.0.1.54965 > 10.0.0.4.5001: UDP, length 1470
19:05:56.401018 IP 10.0.0.1.54965 > 10.0.0.4.5001: UDP, length 1470
19:05:56.412002 IP 10.0.0.1.54965 > 10.0.0.4.5001: UDP, length 1470
19:05:56.423146 IP 10.0.0.1.54965 > 10.0.0.4.5001: UDP, length 1470
19:05:56.434481 IP 10.0.0.1.54965 > 10.0.0.4.5001: UDP, length 1470
19:05:56.446088 IP 10.0.0.1.54965 > 10.0.0.4.5001: UDP, length 1470
19:05:56.456957 IP 10.0.0.1.54965 > 10.0.0.4.5001: UDP, length 1470
19:05:56.468262 IP 10.0.0.1.54965 > 10.0.0.4.5001: UDP, length 1470
19:05:56.479191 IP 10.0.0.1.54965 > 10.0.0.4.5001: UDP, length 1470
19:05:56.490542 IP 10.0.0.1.54965 > 10.0.0.4.5001: UDP, length 1470
19:05:56.502166 IP 10.0.0.1.54965 > 10.0.0.4.5001: UDP, length 1470
19:05:56.513313 IP 10.0.0.1.54965 > 10.0.0.4.5001: UDP, length 1470
19:05:56.524071 IP 10.0.0.1.54965 > 10.0.0.4.5001: UDP, length 1470
19:05:56.535298 IP 10.0.0.1.54965 > 10.0.0.4.5001: UDP, length 1470
19:05:56.546513 IP 10.0.0.1.54965 > 10.0.0.4.5001: UDP, length 1470
19:05:56.557782 IP 10.0.0.1.54965 > 10.0.0.4.5001: UDP, length 1470
19:05:56.569556 IP 10.0.0.1.54965 > 10.0.0.4.5001: UDP, length 1470
19:05:56.580563 IP 10.0.0.1.54965 > 10.0.0.4.5001: UDP, length 1470
19:05:56.591433 IP 10.0.0.1.54965 > 10.0.0.4.5001: UDP, length 1470
19:05:56.603291 IP 10.0.0.1.54965 > 10.0.0.4.5001: UDP, length 1470
19:05:56.614060 IP 10.0.0.1.54965 > 10.0.0.4.5001: UDP, length 1470
19:05:56.625272 IP 10.0.0.1.54965 > 10.0.0.4.5001: UDP, length 1470
19:05:56.636513 IP 10.0.0.1.54965 > 10.0.0.4.5001: UDP, length 1470
19:05:56.647658 IP 10.0.0.1.54965 > 10.0.0.4.5001: UDP, length 1470
19:05:56.659215 IP 10.0.0.1.54965 > 10.0.0.4.5001: UDP, length 1470
19:05:56.670206 IP 10.0.0.1.54965 > 10.0.0.4.5001: UDP, length 1470
19:05:56.681558 IP 10.0.0.1.54965 > 10.0.0.4.5001: UDP, length 1470
19:05:56.692645 IP 10.0.0.1.54965 > 10.0.0.4.5001: UDP, length 1470
19:05:56.703637 IP 10.0.0.1.54965 > 10.0.0.4.5001: UDP, length 1470
19:05:56.715163 IP 10.0.0.1.54965 > 10.0.0.4.5001: UDP, length 1470
19:05:56.726468 IP 10.0.0.1.54965 > 10.0.0.4.5001: UDP, length 1470
19:05:56.737585 IP 10.0.0.1.54965 > 10.0.0.4.5001: UDP, length 1470
19:05:56.748651 IP 10.0.0.1.54965 > 10.0.0.4.5001: UDP, length 1470
19:05:56.759868 IP 10.0.0.1.54965 > 10.0.0.4.5001: UDP, length 1470
19:05:56.771803 IP 10.0.0.1.54965 > 10.0.0.4.5001: UDP, length 1470
19:05:56.782442 IP 10.0.0.1.54965 > 10.0.0.4.5001: UDP, length 1470
19:05:56.793923 IP 10.0.0.1.54965 > 10.0.0.4.5001: UDP, length 1470
19:05:56.805086 IP 10.0.0.1.54965 > 10.0.0.4.5001: UDP, length 1470
19:05:56.815960 IP 10.0.0.1.54965 > 10.0.0.4.5001: UDP, length 1470
19:05:56.827398 IP 10.0.0.1.54965 > 10.0.0.4.5001: UDP, length 1470
19:05:56.838567 IP 10.0.0.1.54965 > 10.0.0.4.5001: UDP, length 1470
19:05:56.849919 IP 10.0.0.1.54965 > 10.0.0.4.5001: UDP, length 1470
19:05:56.861033 IP 10.0.0.1.54965 > 10.0.0.4.5001: UDP, length 1470
19:05:56.872448 IP 10.0.0.1.54965 > 10.0.0.4.5001: UDP, length 1470
19:05:56.883339 IP 10.0.0.1.54965 > 10.0.0.4.5001: UDP, length 1470
19:05:56.894931 IP 10.0.0.1.54965 > 10.0.0.4.5001: UDP, length 1470
19:05:56.905921 IP 10.0.0.1.54965 > 10.0.0.4.5001: UDP, length 1470
19:05:56.916986 IP 10.0.0.1.54965 > 10.0.0.4.5001: UDP, length 1470
19:05:56.928201 IP 10.0.0.1.54965 > 10.0.0.4.5001: UDP, length 1470
19:05:56.939306 IP 10.0.0.1.54965 > 10.0.0.4.5001: UDP, length 1470
19:05:56.950666 IP 10.0.0.1.54965 > 10.0.0.4.5001: UDP, length 1470
19:05:56.961995 IP 10.0.0.1.54965 > 10.0.0.4.5001: UDP, length 1470
19:05:56.973188 IP 10.0.0.1.54965 > 10.0.0.4.5001: UDP, length 1470
19:05:56.984059 IP 10.0.0.1.54965 > 10.0.0.4.5001: UDP, length 1470
19:05:56.995103 IP 10.0.0.1.54965 > 10.0.0.4.5001: UDP, length 1470
19:05:57.006952 IP 10.0.0.1.54965 > 10.0.0.4.5001: UDP, length 1470
19:05:57.017826 IP 10.0.0.1.54965 > 10.0.0.4.5001: UDP, length 1470
19:05:57.029258 IP 10.0.0.1.54965 > 10.0.0.4.5001: UDP, length 1470
19:05:57.040371 IP 10.0.0.1.54965 > 10.0.0.4.5001: UDP, length 1470
19:05:57.051187 IP 10.0.0.1.54965 > 10.0.0.4.5001: UDP, length 1470
19:05:57.062989 IP 10.0.0.1.54965 > 10.0.0.4.5001: UDP, length 1470
19:05:57.074065 IP 10.0.0.1.54965 > 10.0.0.4.5001: UDP, length 1470
19:05:57.085812 IP 10.0.0.1.54965 > 10.0.0.4.5001: UDP, length 1470
19:05:57.097824 IP 10.0.0.1.54965 > 10.0.0.4.5001: UDP, length 1470
19:05:57.107295 IP 10.0.0.1.54965 > 10.0.0.4.5001: UDP, length 1470
19:05:57.118784 IP 10.0.0.1.54965 > 10.0.0.4.5001: UDP, length 1470
19:05:57.130096 IP 10.0.0.1.54965 > 10.0.0.4.5001: UDP, length 1470
19:05:57.141082 IP 10.0.0.1.54965 > 10.0.0.4.5001: UDP, length 1470
19:05:57.152460 IP 10.0.0.1.54965 > 10.0.0.4.5001: UDP, length 1470
19:05:57.163442 IP 10.0.0.1.54965 > 10.0.0.4.5001: UDP, length 1470
19:05:57.175194 IP 10.0.0.1.54965 > 10.0.0.4.5001: UDP, length 1470
19:05:57.186360 IP 10.0.0.1.54965 > 10.0.0.4.5001: UDP, length 1470
19:05:57.197392 IP 10.0.0.1.54965 > 10.0.0.4.5001: UDP, length 1470
19:05:57.208421 IP 10.0.0.1.54965 > 10.0.0.4.5001: UDP, length 1470
19:05:57.219496 IP 10.0.0.1.54965 > 10.0.0.4.5001: UDP, length 1470
19:05:57.230921 IP 10.0.0.1.54965 > 10.0.0.4.5001: UDP, length 1470
19:05:57.242749 IP 10.0.0.1.54965 > 10.0.0.4.5001: UDP, length 1470
19:05:57.253244 IP 10.0.0.1.54965 > 10.0.0.4.5001: UDP, length 1470
19:05:57.264597 IP 10.0.0.1.54965 > 10.0.0.4.5001: UDP, length 1470
19:05:57.275819 IP 10.0.0.1.54965 > 10.0.0.4.5001: UDP, length 1470
19:05:57.287174 IP 10.0.0.1.54965 > 10.0.0.4.5001: UDP, length 1470
19:05:57.298862 IP 10.0.0.1.54965 > 10.0.0.4.5001: UDP, length 1470
19:05:57.309590 IP 10.0.0.1.54965 > 10.0.0.4.5001: UDP, length 1470
19:05:57.320607 IP 10.0.0.1.54965 > 10.0.0.4.5001: UDP, length 1470
19:05:57.331695 IP 10.0.0.1.54965 > 10.0.0.4.5001: UDP, length 1470
19:05:57.342989 IP 10.0.0.1.54965 > 10.0.0.4.5001: UDP, length 1470
19:05:57.354455 IP 10.0.0.1.54965 > 10.0.0.4.5001: UDP, length 1470
19:05:57.365646 IP 10.0.0.1.54965 > 10.0.0.4.5001: UDP, length 1470
19:05:57.376718 IP 10.0.0.1.54965 > 10.0.0.4.5001: UDP, length 1470
19:05:57.387862 IP 10.0.0.1.54965 > 10.0.0.4.5001: UDP, length 1470
19:05:57.399406 IP 10.0.0.1.54965 > 10.0.0.4.5001: UDP, length 1470
19:05:57.410296 IP 10.0.0.1.54965 > 10.0.0.4.5001: UDP, length 1470
19:05:57.421573 IP 10.0.0.1.54965 > 10.0.0.4.5001: UDP, length 1470
19:05:57.432851 IP 10.0.0.1.54965 > 10.0.0.4.5001: UDP, length 1470
19:05:57.444058 IP 10.0.0.1.54965 > 10.0.0.4.5001: UDP, length 1470
19:05:57.455081 IP 10.0.0.1.54965 > 10.0.0.4.5001: UDP, length 1470
19:05:57.466731 IP 10.0.0.1.54965 > 10.0.0.4.5001: UDP, length 1470
19:05:57.477669 IP 10.0.0.1.54965 > 10.0.0.4.5001: UDP, length 1470
19:05:57.488720 IP 10.0.0.1.54965 > 10.0.0.4.5001: UDP, length 1470
19:05:57.499821 IP 10.0.0.1.54965 > 10.0.0.4.5001: UDP, length 1470
19:05:57.510969 IP 10.0.0.1.54965 > 10.0.0.4.5001: UDP, length 1470
19:05:57.522762 IP 10.0.0.1.54965 > 10.0.0.4.5001: UDP, length 1470
19:05:57.533802 IP 10.0.0.1.54965 > 10.0.0.4.5001: UDP, length 1470
19:05:57.544986 IP 10.0.0.1.54965 > 10.0.0.4.5001: UDP, length 1470
19:05:57.555979 IP 10.0.0.1.54965 > 10.0.0.4.5001: UDP, length 1470
19:05:57.567374 IP 10.0.0.1.54965 > 10.0.0.4.5001: UDP, length 1470
19:05:57.578505 IP 10.0.0.1.54965 > 10.0.0.4.5001: UDP, length 1470
19:05:57.590078 IP 10.0.0.1.54965 > 10.0.0.4.5001: UDP, length 1470
19:05:57.601051 IP 10.0.0.1.54965 > 10.0.0.4.5001: UDP, length 1470
19:05:57.612215 IP 10.0.0.1.54965 > 10.0.0.4.5001: UDP, length 1470
19:05:57.623154 IP 10.0.0.1.54965 > 10.0.0.4.5001: UDP, length 1470
19:05:57.634968 IP 10.0.0.1.54965 > 10.0.0.4.5001: UDP, length 1470
19:05:57.645950 IP 10.0.0.1.54965 > 10.0.0.4.5001: UDP, length 1470
19:05:57.657217 IP 10.0.0.1.54965 > 10.0.0.4.5001: UDP, length 1470
19:05:57.668328 IP 10.0.0.1.54965 > 10.0.0.4.5001: UDP, length 1470
19:05:57.679293 IP 10.0.0.1.54965 > 10.0.0.4.5001: UDP, length 1470
19:05:57.691053 IP 10.0.0.1.54965 > 10.0.0.4.5001: UDP, length 1470
19:05:57.702013 IP 10.0.0.1.54965 > 10.0.0.4.5001: UDP, length 1470
19:05:57.713218 IP 10.0.0.1.54965 > 10.0.0.4.5001: UDP, length 1470
19:05:57.724399 IP 10.0.0.1.54965 > 10.0.0.4.5001: UDP, length 1470
19:05:57.735407 IP 10.0.0.1.54965 > 10.0.0.4.5001: UDP, length 1470
19:05:57.746745 IP 10.0.0.1.54965 > 10.0.0.4.5001: UDP, length 1470
19:05:57.758087 IP 10.0.0.1.54965 > 10.0.0.4.5001: UDP, length 1470
19:05:57.770165 IP 10.0.0.1.54965 > 10.0.0.4.5001: UDP, length 1470
19:05:57.781415 IP 10.0.0.1.54965 > 10.0.0.4.5001: UDP, length 1470
19:05:57.791539 IP 10.0.0.1.54965 > 10.0.0.4.5001: UDP, length 1470
19:05:57.803324 IP 10.0.0.1.54965 > 10.0.0.4.5001: UDP, length 1470
19:05:57.814159 IP 10.0.0.1.54965 > 10.0.0.4.5001: UDP, length 1470
19:05:57.825529 IP 10.0.0.1.54965 > 10.0.0.4.5001: UDP, length 1470
19:05:57.836614 IP 10.0.0.1.54965 > 10.0.0.4.5001: UDP, length 1470
19:05:57.847712 IP 10.0.0.1.54965 > 10.0.0.4.5001: UDP, length 1470
19:05:57.859314 IP 10.0.0.1.54965 > 10.0.0.4.5001: UDP, length 1470
19:05:57.870517 IP 10.0.0.1.54965 > 10.0.0.4.5001: UDP, length 1470
19:05:57.881738 IP 10.0.0.1.54965 > 10.0.0.4.5001: UDP, length 1470
19:05:57.892632 IP 10.0.0.1.54965 > 10.0.0.4.5001: UDP, length 1470
19:05:57.903607 IP 10.0.0.1.54965 > 10.0.0.4.5001: UDP, length 1470
19:05:57.914867 IP 10.0.0.1.54965 > 10.0.0.4.5001: UDP, length 1470
19:05:57.926242 IP 10.0.0.1.54965 > 10.0.0.4.5001: UDP, length 1470
19:05:57.937590 IP 10.0.0.1.54965 > 10.0.0.4.5001: UDP, length 1470
19:05:57.948782 IP 10.0.0.1.54965 > 10.0.0.4.5001: UDP, length 1470
19:05:57.959762 IP 10.0.0.1.54965 > 10.0.0.4.5001: UDP, length 1470
19:05:57.971343 IP 10.0.0.1.54965 > 10.0.0.4.5001: UDP, length 1470
19:05:57.982746 IP 10.0.0.1.54965 > 10.0.0.4.5001: UDP, length 1470
19:05:57.993700 IP 10.0.0.1.54965 > 10.0.0.4.5001: UDP, length 1470
19:05:58.004645 IP 10.0.0.1.54965 > 10.0.0.4.5001: UDP, length 1470
19:05:58.015859 IP 10.0.0.1.54965 > 10.0.0.4.5001: UDP, length 1470
19:05:58.027198 IP 10.0.0.1.54965 > 10.0.0.4.5001: UDP, length 1470
19:05:58.038681 IP 10.0.0.1.54965 > 10.0.0.4.5001: UDP, length 1470
19:05:58.049695 IP 10.0.0.1.54965 > 10.0.0.4.5001: UDP, length 1470
19:05:58.060639 IP 10.0.0.1.54965 > 10.0.0.4.5001: UDP, length 1470
19:05:58.072000 IP 10.0.0.1.54965 > 10.0.0.4.5001: UDP, length 1470
19:05:58.083497 IP 10.0.0.1.54965 > 10.0.0.4.5001: UDP, length 1470
19:05:58.095188 IP 10.0.0.1.54965 > 10.0.0.4.5001: UDP, length 1470
19:05:58.105916 IP 10.0.0.1.54965 > 10.0.0.4.5001: UDP, length 1470
19:05:58.117074 IP 10.0.0.1.54965 > 10.0.0.4.5001: UDP, length 1470
19:05:58.128162 IP 10.0.0.1.54965 > 10.0.0.4.5001: UDP, length 1470
19:05:58.139231 IP 10.0.0.1.54965 > 10.0.0.4.5001: UDP, length 1470
19:05:58.150915 IP 10.0.0.1.54965 > 10.0.0.4.5001: UDP, length 1470
19:05:58.161995 IP 10.0.0.1.54965 > 10.0.0.4.5001: UDP, length 1470
19:05:58.173084 IP 10.0.0.1.54965 > 10.0.0.4.5001: UDP, length 1470
19:05:58.184175 IP 10.0.0.1.54965 > 10.0.0.4.5001: UDP, length 1470
19:05:58.195249 IP 10.0.0.1.54965 > 10.0.0.4.5001: UDP, length 1470
19:05:58.206937 IP 10.0.0.1.54965 > 10.0.0.4.5001: UDP, length 1470
19:05:58.217809 IP 10.0.0.1.54965 > 10.0.0.4.5001: UDP, length 1470
19:05:58.228838 IP 10.0.0.1.54965 > 10.0.0.4.5001: UDP, length 1470
19:05:58.240301 IP 10.0.0.1.54965 > 10.0.0.4.5001: UDP, length 1470
19:05:58.251347 IP 10.0.0.1.54965 > 10.0.0.4.5001: UDP, length 1470
19:05:58.263054 IP 10.0.0.1.54965 > 10.0.0.4.5001: UDP, length 1470
19:05:58.274213 IP 10.0.0.1.54965 > 10.0.0.4.5001: UDP, length 1470
19:05:58.284973 IP 10.0.0.1.54965 > 10.0.0.4.5001: UDP, length 1470
19:05:58.296371 IP 10.0.0.1.54965 > 10.0.0.4.5001: UDP, length 1470
19:05:58.307434 IP 10.0.0.1.54965 > 10.0.0.4.5001: UDP, length 1470
19:05:58.319302 IP 10.0.0.1.54965 > 10.0.0.4.5001: UDP, length 1470
19:05:58.330041 IP 10.0.0.1.54965 > 10.0.0.4.5001: UDP, length 1470
19:05:58.340837 IP 10.0.0.1.54965 > 10.0.0.4.5001: UDP, length 1470
19:05:58.352320 IP 10.0.0.1.54965 > 10.0.0.4.5001: UDP, length 1470
19:05:58.363395 IP 10.0.0.1.54965 > 10.0.0.4.5001: UDP, length 1470
19:05:58.375196 IP 10.0.0.1.54965 > 10.0.0.4.5001: UDP, length 1470
19:05:58.386292 IP 10.0.0.1.54965 > 10.0.0.4.5001: UDP, length 1470
19:05:58.397696 IP 10.0.0.1.54965 > 10.0.0.4.5001: UDP, length 1470
19:05:58.408581 IP 10.0.0.1.54965 > 10.0.0.4.5001: UDP, length 1470
19:05:58.419652 IP 10.0.0.1.54965 > 10.0.0.4.5001: UDP, length 1470
19:05:58.431275 IP 10.0.0.1.54965 > 10.0.0.4.5001: UDP, length 1470
19:05:58.442139 IP 10.0.0.1.54965 > 10.0.0.4.5001: UDP, length 1470
19:05:58.453614 IP 10.0.0.1.54965 > 10.0.0.4.5001: UDP, length 1470
19:05:58.464564 IP 10.0.0.1.54965 > 10.0.0.4.5001: UDP, length 1470
19:05:58.475644 IP 10.0.0.1.54965 > 10.0.0.4.5001: UDP, length 1470
19:05:58.487280 IP 10.0.0.1.54965 > 10.0.0.4.5001: UDP, length 1470
19:05:58.498501 IP 10.0.0.1.54965 > 10.0.0.4.5001: UDP, length 1470
19:05:58.509736 IP 10.0.0.1.54965 > 10.0.0.4.5001: UDP, length 1470
19:05:58.520725 IP 10.0.0.1.54965 > 10.0.0.4.5001: UDP, length 1470
19:05:58.531740 IP 10.0.0.1.54965 > 10.0.0.4.5001: UDP, length 1470
19:05:58.543058 IP 10.0.0.1.54965 > 10.0.0.4.5001: UDP, length 1470
19:05:58.554192 IP 10.0.0.1.54965 > 10.0.0.4.5001: UDP, length 1470
19:05:58.565415 IP 10.0.0.1.54965 > 10.0.0.4.5001: UDP, length 1470
19:05:58.576529 IP 10.0.0.1.54965 > 10.0.0.4.5001: UDP, length 1470
19:05:58.587720 IP 10.0.0.1.54965 > 10.0.0.4.5001: UDP, length 1470
19:05:58.600244 IP 10.0.0.1.54965 > 10.0.0.4.5001: UDP, length 1470
19:05:58.611308 IP 10.0.0.1.54965 > 10.0.0.4.5001: UDP, length 1470
19:05:58.621581 IP 10.0.0.1.54965 > 10.0.0.4.5001: UDP, length 1470
19:05:58.632813 IP 10.0.0.1.54965 > 10.0.0.4.5001: UDP, length 1470
19:05:58.643852 IP 10.0.0.1.54965 > 10.0.0.4.5001: UDP, length 1470
19:05:58.655028 IP 10.0.0.1.54965 > 10.0.0.4.5001: UDP, length 1470
19:05:58.666763 IP 10.0.0.1.54965 > 10.0.0.4.5001: UDP, length 1470
19:05:58.677810 IP 10.0.0.1.54965 > 10.0.0.4.5001: UDP, length 1470
19:05:58.688758 IP 10.0.0.1.54965 > 10.0.0.4.5001: UDP, length 1470
19:05:58.700000 IP 10.0.0.1.54965 > 10.0.0.4.5001: UDP, length 1470
19:05:58.711188 IP 10.0.0.1.54965 > 10.0.0.4.5001: UDP, length 1470
19:05:58.722755 IP 10.0.0.1.54965 > 10.0.0.4.5001: UDP, length 1470
19:05:58.734001 IP 10.0.0.1.54965 > 10.0.0.4.5001: UDP, length 1470
19:05:58.744863 IP 10.0.0.1.54965 > 10.0.0.4.5001: UDP, length 1470
19:05:58.756204 IP 10.0.0.1.54965 > 10.0.0.4.5001: UDP, length 1470
19:05:58.767979 IP 10.0.0.1.54965 > 10.0.0.4.5001: UDP, length 1470
19:05:58.779401 IP 10.0.0.1.54965 > 10.0.0.4.5001: UDP, length 1470
19:05:58.789894 IP 10.0.0.1.54965 > 10.0.0.4.5001: UDP, length 1470
19:05:58.801161 IP 10.0.0.1.54965 > 10.0.0.4.5001: UDP, length 1470
19:05:58.812155 IP 10.0.0.1.54965 > 10.0.0.4.5001: UDP, length 1470
19:05:58.823285 IP 10.0.0.1.54965 > 10.0.0.4.5001: UDP, length 1470
19:05:58.834689 IP 10.0.0.1.54965 > 10.0.0.4.5001: UDP, length 1470
19:05:58.846164 IP 10.0.0.1.54965 > 10.0.0.4.5001: UDP, length 1470
19:05:58.857143 IP 10.0.0.1.54965 > 10.0.0.4.5001: UDP, length 1470
19:05:58.868305 IP 10.0.0.1.54965 > 10.0.0.4.5001: UDP, length 1470
19:05:58.879455 IP 10.0.0.1.54965 > 10.0.0.4.5001: UDP, length 1470
19:05:58.892603 IP 10.0.0.1.54965 > 10.0.0.4.5001: UDP, length 1470
19:05:58.903110 IP 10.0.0.1.54965 > 10.0.0.4.5001: UDP, length 1470
19:05:58.913271 IP 10.0.0.1.54965 > 10.0.0.4.5001: UDP, length 1470
19:05:58.924377 IP 10.0.0.1.54965 > 10.0.0.4.5001: UDP, length 1470
19:05:58.935399 IP 10.0.0.1.54965 > 10.0.0.4.5001: UDP, length 1470
19:05:58.947237 IP 10.0.0.1.54965 > 10.0.0.4.5001: UDP, length 1470
19:05:58.958037 IP 10.0.0.1.54965 > 10.0.0.4.5001: UDP, length 1470
19:05:58.969352 IP 10.0.0.1.54965 > 10.0.0.4.5001: UDP, length 1470
19:05:58.980450 IP 10.0.0.1.54965 > 10.0.0.4.5001: UDP, length 1470
19:05:58.991447 IP 10.0.0.1.54965 > 10.0.0.4.5001: UDP, length 1470
19:05:59.003281 IP 10.0.0.1.54965 > 10.0.0.4.5001: UDP, length 1470
19:05:59.013919 IP 10.0.0.1.54965 > 10.0.0.4.5001: UDP, length 1470
19:05:59.025281 IP 10.0.0.1.54965 > 10.0.0.4.5001: UDP, length 1470
19:05:59.036600 IP 10.0.0.1.54965 > 10.0.0.4.5001: UDP, length 1470
19:05:59.047691 IP 10.0.0.1.54965 > 10.0.0.4.5001: UDP, length 1470
19:05:59.059154 IP 10.0.0.1.54965 > 10.0.0.4.5001: UDP, length 1470
19:05:59.070128 IP 10.0.0.1.54965 > 10.0.0.4.5001: UDP, length 1470
19:05:59.081917 IP 10.0.0.1.54965 > 10.0.0.4.5001: UDP, length 1470
19:05:59.092741 IP 10.0.0.1.54965 > 10.0.0.4.5001: UDP, length 1470
19:05:59.103682 IP 10.0.0.1.54965 > 10.0.0.4.5001: UDP, length 1470
19:05:59.114863 IP 10.0.0.1.54965 > 10.0.0.4.5001: UDP, length 1470
19:05:59.126150 IP 10.0.0.1.54965 > 10.0.0.4.5001: UDP, length 1470
19:05:59.137610 IP 10.0.0.1.54965 > 10.0.0.4.5001: UDP, length 1470
19:05:59.148733 IP 10.0.0.1.54965 > 10.0.0.4.5001: UDP, length 1470
19:05:59.159805 IP 10.0.0.1.54965 > 10.0.0.4.5001: UDP, length 1470
19:05:59.171335 IP 10.0.0.1.54965 > 10.0.0.4.5001: UDP, length 1470
19:05:59.182108 IP 10.0.0.1.54965 > 10.0.0.4.5001: UDP, length 1470
19:05:59.193570 IP 10.0.0.1.54965 > 10.0.0.4.5001: UDP, length 1470
19:05:59.204884 IP 10.0.0.1.54965 > 10.0.0.4.5001: UDP, length 1470
19:05:59.215978 IP 10.0.0.1.54965 > 10.0.0.4.5001: UDP, length 1470
19:05:59.227207 IP 10.0.0.1.54965 > 10.0.0.4.5001: UDP, length 1470
19:05:59.238748 IP 10.0.0.1.54965 > 10.0.0.4.5001: UDP, length 1470
19:05:59.249521 IP 10.0.0.1.54965 > 10.0.0.4.5001: UDP, length 1470
19:05:59.260887 IP 10.0.0.1.54965 > 10.0.0.4.5001: UDP, length 1470
19:05:59.272624 IP 10.0.0.1.54965 > 10.0.0.4.5001: UDP, length 1470
19:05:59.283268 IP 10.0.0.1.54965 > 10.0.0.4.5001: UDP, length 1470
19:05:59.294720 IP 10.0.0.1.54965 > 10.0.0.4.5001: UDP, length 1470
19:05:59.305905 IP 10.0.0.1.54965 > 10.0.0.4.5001: UDP, length 1470
19:05:59.317008 IP 10.0.0.1.54965 > 10.0.0.4.5001: UDP, length 1470
19:05:59.328311 IP 10.0.0.1.54965 > 10.0.0.4.5001: UDP, length 1470
19:05:59.339056 IP 10.0.0.1.54965 > 10.0.0.4.5001: UDP, length 1470
19:05:59.350545 IP 10.0.0.1.54965 > 10.0.0.4.5001: UDP, length 1470
19:05:59.361903 IP 10.0.0.1.54965 > 10.0.0.4.5001: UDP, length 1470
19:05:59.373121 IP 10.0.0.1.54965 > 10.0.0.4.5001: UDP, length 1470
19:05:59.384250 IP 10.0.0.1.54965 > 10.0.0.4.5001: UDP, length 1470
19:05:59.395316 IP 10.0.0.1.54965 > 10.0.0.4.5001: UDP, length 1470
19:05:59.407459 IP 10.0.0.1.54965 > 10.0.0.4.5001: UDP, length 1470
19:05:59.418885 IP 10.0.0.1.54965 > 10.0.0.4.5001: UDP, length 1470
19:05:59.428918 IP 10.0.0.1.54965 > 10.0.0.4.5001: UDP, length 1470
19:05:59.440138 IP 10.0.0.1.54965 > 10.0.0.4.5001: UDP, length 1470
19:05:59.451355 IP 10.0.0.1.54965 > 10.0.0.4.5001: UDP, length 1470
19:05:59.463087 IP 10.0.0.1.54965 > 10.0.0.4.5001: UDP, length 1470
19:05:59.474181 IP 10.0.0.1.54965 > 10.0.0.4.5001: UDP, length 1470
19:05:59.485271 IP 10.0.0.1.54965 > 10.0.0.4.5001: UDP, length 1470
19:05:59.496420 IP 10.0.0.1.54965 > 10.0.0.4.5001: UDP, length 1470
19:05:59.507510 IP 10.0.0.1.54965 > 10.0.0.4.5001: UDP, length 1470
19:05:59.518919 IP 10.0.0.1.54965 > 10.0.0.4.5001: UDP, length 1470
19:05:59.529830 IP 10.0.0.1.54965 > 10.0.0.4.5001: UDP, length 1470
19:05:59.541004 IP 10.0.0.1.54965 > 10.0.0.4.5001: UDP, length 1470
19:05:59.552451 IP 10.0.0.1.54965 > 10.0.0.4.5001: UDP, length 1470
19:05:59.563480 IP 10.0.0.1.54965 > 10.0.0.4.5001: UDP, length 1470
19:05:59.575024 IP 10.0.0.1.54965 > 10.0.0.4.5001: UDP, length 1470
19:05:59.586307 IP 10.0.0.1.54965 > 10.0.0.4.5001: UDP, length 1470
19:05:59.597384 IP 10.0.0.1.54965 > 10.0.0.4.5001: UDP, length 1470
19:05:59.608511 IP 10.0.0.1.54965 > 10.0.0.4.5001: UDP, length 1470
19:05:59.619498 IP 10.0.0.1.54965 > 10.0.0.4.5001: UDP, length 1470
19:05:59.630849 IP 10.0.0.1.54965 > 10.0.0.4.5001: UDP, length 1470
19:05:59.641874 IP 10.0.0.1.54965 > 10.0.0.4.5001: UDP, length 1470
19:05:59.653288 IP 10.0.0.1.54965 > 10.0.0.4.5001: UDP, length 1470
19:05:59.664342 IP 10.0.0.1.54965 > 10.0.0.4.5001: UDP, length 1470
19:05:59.675612 IP 10.0.0.1.54965 > 10.0.0.4.5001: UDP, length 1470
19:05:59.687224 IP 10.0.0.1.54965 > 10.0.0.4.5001: UDP, length 1470
19:05:59.698679 IP 10.0.0.1.54965 > 10.0.0.4.5001: UDP, length 1470
19:05:59.709759 IP 10.0.0.1.54965 > 10.0.0.4.5001: UDP, length 1470
19:05:59.720760 IP 10.0.0.1.54965 > 10.0.0.4.5001: UDP, length 1470
19:05:59.731896 IP 10.0.0.1.54965 > 10.0.0.4.5001: UDP, length 1470
19:05:59.742904 IP 10.0.0.1.54965 > 10.0.0.4.5001: UDP, length 1470
19:05:59.754524 IP 10.0.0.1.54965 > 10.0.0.4.5001: UDP, length 1470
19:05:59.765815 IP 10.0.0.1.54965 > 10.0.0.4.5001: UDP, length 1470
19:05:59.776800 IP 10.0.0.1.54965 > 10.0.0.4.5001: UDP, length 1470
19:05:59.787959 IP 10.0.0.1.54965 > 10.0.0.4.5001: UDP, length 1470
19:05:59.799333 IP 10.0.0.1.54965 > 10.0.0.4.5001: UDP, length 1470
19:05:59.810203 IP 10.0.0.1.54965 > 10.0.0.4.5001: UDP, length 1470
19:05:59.821626 IP 10.0.0.1.54965 > 10.0.0.4.5001: UDP, length 1470
19:05:59.832963 IP 10.0.0.1.54965 > 10.0.0.4.5001: UDP, length 1470
19:05:59.844057 IP 10.0.0.1.54965 > 10.0.0.4.5001: UDP, length 1470
19:05:59.855044 IP 10.0.0.1.54965 > 10.0.0.4.5001: UDP, length 1470
19:05:59.866831 IP 10.0.0.1.54965 > 10.0.0.4.5001: UDP, length 1470
19:05:59.877877 IP 10.0.0.1.54965 > 10.0.0.4.5001: UDP, length 1470
19:05:59.888921 IP 10.0.0.1.54965 > 10.0.0.4.5001: UDP, length 1470
19:05:59.900092 IP 10.0.0.1.54965 > 10.0.0.4.5001: UDP, length 1470
19:05:59.911343 IP 10.0.0.1.54965 > 10.0.0.4.5001: UDP, length 1470
19:05:59.924365 IP 10.0.0.1.54965 > 10.0.0.4.5001: UDP, length 1470
19:05:59.933832 IP 10.0.0.1.54965 > 10.0.0.4.5001: UDP, length 1470
19:05:59.944956 IP 10.0.0.1.54965 > 10.0.0.4.5001: UDP, length 1470
19:05:59.956107 IP 10.0.0.1.54965 > 10.0.0.4.5001: UDP, length 1470
19:05:59.967307 IP 10.0.0.1.54965 > 10.0.0.4.5001: UDP, length 1470
19:05:59.978685 IP 10.0.0.1.54965 > 10.0.0.4.5001: UDP, length 1470
19:05:59.990144 IP 10.0.0.1.54965 > 10.0.0.4.5001: UDP, length 1470
19:06:00.001002 IP 10.0.0.1.54965 > 10.0.0.4.5001: UDP, length 1470
19:06:00.012319 IP 10.0.0.1.54965 > 10.0.0.4.5001: UDP, length 1470
19:06:00.023226 IP 10.0.0.1.54965 > 10.0.0.4.5001: UDP, length 1470
19:06:00.035912 IP 10.0.0.1.54965 > 10.0.0.4.5001: UDP, length 1470
19:06:00.046819 IP 10.0.0.1.54965 > 10.0.0.4.5001: UDP, length 1470
19:06:00.057259 IP 10.0.0.1.54965 > 10.0.0.4.5001: UDP, length 1470
19:06:00.068339 IP 10.0.0.1.54965 > 10.0.0.4.5001: UDP, length 1470
19:06:00.079402 IP 10.0.0.1.54965 > 10.0.0.4.5001: UDP, length 1470
19:06:00.090705 IP 10.0.0.1.54965 > 10.0.0.4.5001: UDP, length 1470
19:06:00.101802 IP 10.0.0.1.54965 > 10.0.0.4.5001: UDP, length 1470
19:06:00.113196 IP 10.0.0.1.54965 > 10.0.0.4.5001: UDP, length 1470
19:06:00.124450 IP 10.0.0.1.54965 > 10.0.0.4.5001: UDP, length 1470
19:06:00.135608 IP 10.0.0.1.54965 > 10.0.0.4.5001: UDP, length 1470
19:06:00.146632 IP 10.0.0.1.54965 > 10.0.0.4.5001: UDP, length 1470
19:06:00.157790 IP 10.0.0.1.54965 > 10.0.0.4.5001: UDP, length 1470
19:06:00.169393 IP 10.0.0.1.54965 > 10.0.0.4.5001: UDP, length 1470
19:06:00.180620 IP 10.0.0.1.54965 > 10.0.0.4.5001: UDP, length 1470
19:06:00.191630 IP 10.0.0.1.54965 > 10.0.0.4.5001: UDP, length 1470
19:06:00.203279 IP 10.0.0.1.54965 > 10.0.0.4.5001: UDP, length 1470
19:06:00.214326 IP 10.0.0.1.54965 > 10.0.0.4.5001: UDP, length 1470
19:06:00.225493 IP 10.0.0.1.54965 > 10.0.0.4.5001: UDP, length 1470
19:06:00.236579 IP 10.0.0.1.54965 > 10.0.0.4.5001: UDP, length 1470
19:06:00.247672 IP 10.0.0.1.54965 > 10.0.0.4.5001: UDP, length 1470
19:06:00.258919 IP 10.0.0.1.54965 > 10.0.0.4.5001: UDP, length 1470
19:06:00.270154 IP 10.0.0.1.54965 > 10.0.0.4.5001: UDP, length 1470
19:06:00.281471 IP 10.0.0.1.54965 > 10.0.0.4.5001: UDP, length 1470
19:06:00.292527 IP 10.0.0.1.54965 > 10.0.0.4.5001: UDP, length 1470
19:06:00.303685 IP 10.0.0.1.54965 > 10.0.0.4.5001: UDP, length 1470
19:06:00.314956 IP 10.0.0.1.54965 > 10.0.0.4.5001: UDP, length 1470
19:06:00.326769 IP 10.0.0.1.54965 > 10.0.0.4.5001: UDP, length 1470
19:06:00.337678 IP 10.0.0.1.54965 > 10.0.0.4.5001: UDP, length 1470
19:06:00.348866 IP 10.0.0.1.54965 > 10.0.0.4.5001: UDP, length 1470
19:06:00.359873 IP 10.0.0.1.54965 > 10.0.0.4.5001: UDP, length 1470
19:06:00.371129 IP 10.0.0.1.54965 > 10.0.0.4.5001: UDP, length 1470
19:06:00.382542 IP 10.0.0.1.54965 > 10.0.0.4.5001: UDP, length 1470
19:06:00.393538 IP 10.0.0.1.54965 > 10.0.0.4.5001: UDP, length 1470
19:06:00.404938 IP 10.0.0.1.54965 > 10.0.0.4.5001: UDP, length 1470
19:06:00.416089 IP 10.0.0.1.54965 > 10.0.0.4.5001: UDP, length 1470
19:06:00.427337 IP 10.0.0.1.54965 > 10.0.0.4.5001: UDP, length 1470
19:06:00.438313 IP 10.0.0.1.54965 > 10.0.0.4.5001: UDP, length 1470
19:06:00.449720 IP 10.0.0.1.54965 > 10.0.0.4.5001: UDP, length 1470
19:06:00.460945 IP 10.0.0.1.54965 > 10.0.0.4.5001: UDP, length 1470
19:06:00.472011 IP 10.0.0.1.54965 > 10.0.0.4.5001: UDP, length 1470
19:06:00.483228 IP 10.0.0.1.54965 > 10.0.0.4.5001: UDP, length 1470
19:06:00.494868 IP 10.0.0.1.54965 > 10.0.0.4.5001: UDP, length 1470
19:06:00.505928 IP 10.0.0.1.54965 > 10.0.0.4.5001: UDP, length 1470
19:06:00.517043 IP 10.0.0.1.54965 > 10.0.0.4.5001: UDP, length 1470
19:06:00.528113 IP 10.0.0.1.54965 > 10.0.0.4.5001: UDP, length 1470
19:06:00.539319 IP 10.0.0.1.54965 > 10.0.0.4.5001: UDP, length 1470
19:06:00.550902 IP 10.0.0.1.54965 > 10.0.0.4.5001: UDP, length 1470
19:06:00.561972 IP 10.0.0.1.54965 > 10.0.0.4.5001: UDP, length 1470
19:06:00.573100 IP 10.0.0.1.54965 > 10.0.0.4.5001: UDP, length 1470
19:06:00.584235 IP 10.0.0.1.54965 > 10.0.0.4.5001: UDP, length 1470
19:06:00.595421 IP 10.0.0.1.54965 > 10.0.0.4.5001: UDP, length 1470
19:06:00.606682 IP 10.0.0.1.54965 > 10.0.0.4.5001: UDP, length 1470
19:06:00.618104 IP 10.0.0.1.54965 > 10.0.0.4.5001: UDP, length 1470
19:06:00.628994 IP 10.0.0.1.54965 > 10.0.0.4.5001: UDP, length 1470
19:06:00.640363 IP 10.0.0.1.54965 > 10.0.0.4.5001: UDP, length 1470
19:06:00.651368 IP 10.0.0.1.54965 > 10.0.0.4.5001: UDP, length 1470
19:06:00.663043 IP 10.0.0.1.54965 > 10.0.0.4.5001: UDP, length 1470
19:06:00.674170 IP 10.0.0.1.54965 > 10.0.0.4.5001: UDP, length 1470
19:06:00.685393 IP 10.0.0.1.54965 > 10.0.0.4.5001: UDP, length 1470
19:06:00.696246 IP 10.0.0.1.54965 > 10.0.0.4.5001: UDP, length 1470
19:06:00.707405 IP 10.0.0.1.54965 > 10.0.0.4.5001: UDP, length 1470
19:06:00.719312 IP 10.0.0.1.54965 > 10.0.0.4.5001: UDP, length 1470
19:06:00.729844 IP 10.0.0.1.54965 > 10.0.0.4.5001: UDP, length 1470
19:06:00.741139 IP 10.0.0.1.54965 > 10.0.0.4.5001: UDP, length 1470
19:06:00.752537 IP 10.0.0.1.54965 > 10.0.0.4.5001: UDP, length 1470
19:06:00.763605 IP 10.0.0.1.54965 > 10.0.0.4.5001: UDP, length 1470
19:06:00.774984 IP 10.0.0.1.54965 > 10.0.0.4.5001: UDP, length 1470
19:06:00.785966 IP 10.0.0.1.54965 > 10.0.0.4.5001: UDP, length 1470
19:06:00.797595 IP 10.0.0.1.54965 > 10.0.0.4.5001: UDP, length 1470
19:06:00.808474 IP 10.0.0.1.54965 > 10.0.0.4.5001: UDP, length 1470
19:06:00.819694 IP 10.0.0.1.54965 > 10.0.0.4.5001: UDP, length 1470
19:06:00.831329 IP 10.0.0.1.54965 > 10.0.0.4.5001: UDP, length 1470
19:06:00.842028 IP 10.0.0.1.54965 > 10.0.0.4.5001: UDP, length 1470
19:06:00.853526 IP 10.0.0.1.54965 > 10.0.0.4.5001: UDP, length 1470
19:06:00.864642 IP 10.0.0.1.54965 > 10.0.0.4.5001: UDP, length 1470
19:06:00.875692 IP 10.0.0.1.54965 > 10.0.0.4.5001: UDP, length 1470
19:06:00.887039 IP 10.0.0.1.54965 > 10.0.0.4.5001: UDP, length 1470
19:06:00.898094 IP 10.0.0.1.54965 > 10.0.0.4.5001: UDP, length 1470
19:06:00.909442 IP 10.0.0.1.54965 > 10.0.0.4.5001: UDP, length 1470
19:06:00.920744 IP 10.0.0.1.54965 > 10.0.0.4.5001: UDP, length 1470
19:06:00.931921 IP 10.0.0.1.54965 > 10.0.0.4.5001: UDP, length 1470
19:06:00.943986 IP 10.0.0.1.54965 > 10.0.0.4.5001: UDP, length 1470
19:06:00.954850 IP 10.0.0.1.54965 > 10.0.0.4.5001: UDP, length 1470
19:06:00.965598 IP 10.0.0.1.54965 > 10.0.0.4.5001: UDP, length 1470
19:06:00.976781 IP 10.0.0.1.54965 > 10.0.0.4.5001: UDP, length 1470
19:06:00.987914 IP 10.0.0.1.54965 > 10.0.0.4.5001: UDP, length 1470
19:06:00.999489 IP 10.0.0.1.54965 > 10.0.0.4.5001: UDP, length 1470
19:06:01.010394 IP 10.0.0.1.54965 > 10.0.0.4.5001: UDP, length 1470
19:06:01.021847 IP 10.0.0.1.54965 > 10.0.0.4.5001: UDP, length 1470
19:06:01.032954 IP 10.0.0.1.54965 > 10.0.0.4.5001: UDP, length 1470
19:06:01.044130 IP 10.0.0.1.54965 > 10.0.0.4.5001: UDP, length 1470
19:06:01.055129 IP 10.0.0.1.54965 > 10.0.0.4.5001: UDP, length 1470
19:06:01.066536 IP 10.0.0.1.54965 > 10.0.0.4.5001: UDP, length 1470
19:06:01.078021 IP 10.0.0.1.54965 > 10.0.0.4.5001: UDP, length 1470
19:06:01.089082 IP 10.0.0.1.54965 > 10.0.0.4.5001: UDP, length 1470
19:06:01.100129 IP 10.0.0.1.54965 > 10.0.0.4.5001: UDP, length 1470
19:06:01.111318 IP 10.0.0.1.54965 > 10.0.0.4.5001: UDP, length 1470
19:06:01.122938 IP 10.0.0.1.54965 > 10.0.0.4.5001: UDP, length 1470
19:06:01.133704 IP 10.0.0.1.54965 > 10.0.0.4.5001: UDP, length 1470
19:06:01.144900 IP 10.0.0.1.54965 > 10.0.0.4.5001: UDP, length 1470
19:06:01.155976 IP 10.0.0.1.54965 > 10.0.0.4.5001: UDP, length 1470
19:06:01.168043 IP 10.0.0.1.54965 > 10.0.0.4.5001: UDP, length 1470
19:06:01.179171 IP 10.0.0.1.54965 > 10.0.0.4.5001: UDP, length 1470
19:06:01.189789 IP 10.0.0.1.54965 > 10.0.0.4.5001: UDP, length 1470
19:06:01.200965 IP 10.0.0.1.54965 > 10.0.0.4.5001: UDP, length 1470
19:06:01.212362 IP 10.0.0.1.54965 > 10.0.0.4.5001: UDP, length 1470
19:06:01.223447 IP 10.0.0.1.54965 > 10.0.0.4.5001: UDP, length 1470
19:06:01.235062 IP 10.0.0.1.54965 > 10.0.0.4.5001: UDP, length 1470
19:06:01.245780 IP 10.0.0.1.54965 > 10.0.0.4.5001: UDP, length 1470
19:06:01.257218 IP 10.0.0.1.54965 > 10.0.0.4.5001: UDP, length 1470
19:06:01.268400 IP 10.0.0.1.54965 > 10.0.0.4.5001: UDP, length 1470
19:06:01.279478 IP 10.0.0.1.54965 > 10.0.0.4.5001: UDP, length 1470
19:06:01.291190 IP 10.0.0.1.54965 > 10.0.0.4.5001: UDP, length 1470
19:06:01.302049 IP 10.0.0.1.54965 > 10.0.0.4.5001: UDP, length 1470
19:06:01.313466 IP 10.0.0.1.54965 > 10.0.0.4.5001: UDP, length 1470
19:06:01.324498 IP 10.0.0.1.54965 > 10.0.0.4.5001: UDP, length 1470
19:06:01.335437 IP 10.0.0.1.54965 > 10.0.0.4.5001: UDP, length 1470
19:06:01.347155 IP 10.0.0.1.54965 > 10.0.0.4.5001: UDP, length 1470
19:06:01.358256 IP 10.0.0.1.54965 > 10.0.0.4.5001: UDP, length 1470
19:06:01.369349 IP 10.0.0.1.54965 > 10.0.0.4.5001: UDP, length 1470
19:06:01.380532 IP 10.0.0.1.54965 > 10.0.0.4.5001: UDP, length 1470
19:06:01.391697 IP 10.0.0.1.54965 > 10.0.0.4.5001: UDP, length 1470
19:06:01.403012 IP 10.0.0.1.54965 > 10.0.0.4.5001: UDP, length 1470
19:06:01.414321 IP 10.0.0.1.54965 > 10.0.0.4.5001: UDP, length 1470
19:06:01.425554 IP 10.0.0.1.54965 > 10.0.0.4.5001: UDP, length 1470
19:06:01.436730 IP 10.0.0.1.54965 > 10.0.0.4.5001: UDP, length 1470
19:06:01.447854 IP 10.0.0.1.54965 > 10.0.0.4.5001: UDP, length 1470
19:06:01.459352 IP 10.0.0.1.54965 > 10.0.0.4.5001: UDP, length 1470
19:06:01.470630 IP 10.0.0.1.54965 > 10.0.0.4.5001: UDP, length 1470
19:06:01.481702 IP 10.0.0.1.54965 > 10.0.0.4.5001: UDP, length 1470
19:06:01.492718 IP 10.0.0.1.54965 > 10.0.0.4.5001: UDP, length 1470
19:06:01.503984 IP 10.0.0.1.54965 > 10.0.0.4.5001: UDP, length 1470
19:06:01.515142 IP 10.0.0.1.54965 > 10.0.0.4.5001: UDP, length 1470
19:06:01.526352 IP 10.0.0.1.54965 > 10.0.0.4.5001: UDP, length 1470
19:06:01.537676 IP 10.0.0.1.54965 > 10.0.0.4.5001: UDP, length 1470
19:06:01.548725 IP 10.0.0.1.54965 > 10.0.0.4.5001: UDP, length 1470
19:06:01.560059 IP 10.0.0.1.54965 > 10.0.0.4.5001: UDP, length 1470
19:06:01.571322 IP 10.0.0.1.54965 > 10.0.0.4.5001: UDP, length 1470
19:06:01.582825 IP 10.0.0.1.54965 > 10.0.0.4.5001: UDP, length 1470
19:06:01.593875 IP 10.0.0.1.54965 > 10.0.0.4.5001: UDP, length 1470
19:06:01.604900 IP 10.0.0.1.54965 > 10.0.0.4.5001: UDP, length 1470
19:06:01.616009 IP 10.0.0.1.54965 > 10.0.0.4.5001: UDP, length 1470
19:06:01.627287 IP 10.0.0.1.54965 > 10.0.0.4.5001: UDP, length 1470
19:06:01.638872 IP 10.0.0.1.54965 > 10.0.0.4.5001: UDP, length 1470
19:06:01.649712 IP 10.0.0.1.54965 > 10.0.0.4.5001: UDP, length 1470
19:06:01.660773 IP 10.0.0.1.54965 > 10.0.0.4.5001: UDP, length 1470
19:06:01.672008 IP 10.0.0.1.54965 > 10.0.0.4.5001: UDP, length 1470
19:06:01.684195 IP 10.0.0.1.54965 > 10.0.0.4.5001: UDP, length 1470
19:06:01.694723 IP 10.0.0.1.54965 > 10.0.0.4.5001: UDP, length 1470
19:06:01.705697 IP 10.0.0.1.54965 > 10.0.0.4.5001: UDP, length 1470
19:06:01.717079 IP 10.0.0.1.54965 > 10.0.0.4.5001: UDP, length 1470
