19:06:25.142377 IP 10.0.0.1.54965 > 10.0.0.4.5001: UDP, length 1470
19:06:25.151280 IP 10.0.0.1.54965 > 10.0.0.4.5001: UDP, length 1470
19:06:25.156651 IP 10.0.0.1.54965 > 10.0.0.4.5001: UDP, length 1470
19:06:25.168026 IP 10.0.0.1.54965 > 10.0.0.4.5001: UDP, length 1470
19:06:25.179253 IP 10.0.0.1.54965 > 10.0.0.4.5001: UDP, length 1470
19:06:25.190862 IP 10.0.0.1.54965 > 10.0.0.4.5001: UDP, length 1470
19:06:25.201498 IP 10.0.0.1.54965 > 10.0.0.4.5001: UDP, length 1470
19:06:25.212644 IP 10.0.0.1.54965 > 10.0.0.4.5001: UDP, length 1470
19:06:25.224012 IP 10.0.0.1.54965 > 10.0.0.4.5001: UDP, length 1470
19:06:25.235013 IP 10.0.0.1.54965 > 10.0.0.4.5001: UDP, length 1470
19:06:25.246709 IP 10.0.0.1.54965 > 10.0.0.4.5001: UDP, length 1470
19:06:25.257907 IP 10.0.0.1.54965 > 10.0.0.4.5001: UDP, length 1470
19:06:25.268833 IP 10.0.0.1.54965 > 10.0.0.4.5001: UDP, length 1470
19:06:25.279926 IP 10.0.0.1.54965 > 10.0.0.4.5001: UDP, length 1470
19:06:25.291109 IP 10.0.0.1.54965 > 10.0.0.4.5001: UDP, length 1470
19:06:25.302430 IP 10.0.0.1.54965 > 10.0.0.4.5001: UDP, length 1470
19:06:25.314450 IP 10.0.0.1.54965 > 10.0.0.4.5001: UDP, length 1470
19:06:25.325159 IP 10.0.0.1.54965 > 10.0.0.4.5001: UDP, length 1470
19:06:25.336185 IP 10.0.0.1.54965 > 10.0.0.4.5001: UDP, length 1470
19:06:25.347520 IP 10.0.0.1.54965 > 10.0.0.4.5001: UDP, length 1470
19:06:25.359036 IP 10.0.0.1.54965 > 10.0.0.4.5001: UDP, length 1470
19:06:25.370076 IP 10.0.0.1.54965 > 10.0.0.4.5001: UDP, length 1470
19:06:25.380781 IP 10.0.0.1.54965 > 10.0.0.4.5001: UDP, length 1470
19:06:25.392307 IP 10.0.0.1.54965 > 10.0.0.4.5001: UDP, length 1470
19:06:25.403515 IP 10.0.0.1.54965 > 10.0.0.4.5001: UDP, length 1470
19:06:25.414834 IP 10.0.0.1.54965 > 10.0.0.4.5001: UDP, length 1470
19:06:25.425882 IP 10.0.0.1.54965 > 10.0.0.4.5001: UDP, length 1470
19:06:25.437349 IP 10.0.0.1.54965 > 10.0.0.4.5001: UDP, length 1470
19:06:25.448445 IP 10.0.0.1.54965 > 10.0.0.4.5001: UDP, length 1470
19:06:25.459541 IP 10.0.0.1.54965 > 10.0.0.4.5001: UDP, length 1470
19:06:25.471198 IP 10.0.0.1.54965 > 10.0.0.4.5001: UDP, length 1470
19:06:25.481950 IP 10.0.0.1.54965 > 10.0.0.4.5001: UDP, length 1470
19:06:25.493263 IP 10.0.0.1.54965 > 10.0.0.4.5001: UDP, length 1470
19:06:25.504366 IP 10.0.0.1.54965 > 10.0.0.4.5001: UDP, length 1470
19:06:25.516276 IP 10.0.0.1.54965 > 10.0.0.4.5001: UDP, length 1470
19:06:25.527070 IP 10.0.0.1.54965 > 10.0.0.4.5001: UDP, length 1470
19:06:25.538210 IP 10.0.0.1.54965 > 10.0.0.4.5001: UDP, length 1470
19:06:25.549995 IP 10.0.0.1.54965 > 10.0.0.4.5001: UDP, length 1470
19:06:25.560575 IP 10.0.0.1.54965 > 10.0.0.4.5001: UDP, length 1470
19:06:25.572752 IP 10.0.0.1.54965 > 10.0.0.4.5001: UDP, length 1470
19:06:25.582919 IP 10.0.0.1.54965 > 10.0.0.4.5001: UDP, length 1470
19:06:25.594101 IP 10.0.0.1.54965 > 10.0.0.4.5001: UDP, length 1470
19:06:25.605244 IP 10.0.0.1.54965 > 10.0.0.4.5001: UDP, length 1470
19:06:25.616481 IP 10.0.0.1.54965 > 10.0.0.4.5001: UDP, length 1470
19:06:25.627828 IP 10.0.0.1.54965 > 10.0.0.4.5001: UDP, length 1470
19:06:25.638938 IP 10.0.0.1.54965 > 10.0.0.4.5001: UDP, length 1470
19:06:25.650736 IP 10.0.0.1.54965 > 10.0.0.4.5001: UDP, length 1470
19:06:25.661159 IP 10.0.0.1.54965 > 10.0.0.4.5001: UDP, length 1470
19:06:25.673231 IP 10.0.0.1.54965 > 10.0.0.4.5001: UDP, length 1470
19:06:25.684285 IP 10.0.0.1.54965 > 10.0.0.4.5001: UDP, length 1470
19:06:25.695111 IP 10.0.0.1.54965 > 10.0.0.4.5001: UDP, length 1470
19:06:25.706817 IP 10.0.0.1.54965 > 10.0.0.4.5001: UDP, length 1470
19:06:25.717688 IP 10.0.0.1.54965 > 10.0.0.4.5001: UDP, length 1470
19:06:25.728908 IP 10.0.0.1.54965 > 10.0.0.4.5001: UDP, length 1470
19:06:25.739943 IP 10.0.0.1.54965 > 10.0.0.4.5001: UDP, length 1470
19:06:25.750917 IP 10.0.0.1.54965 > 10.0.0.4.5001: UDP, length 1470
19:06:25.762158 IP 10.0.0.1.54965 > 10.0.0.4.5001: UDP, length 1470
19:06:25.773688 IP 10.0.0.1.54965 > 10.0.0.4.5001: UDP, length 1470
19:06:25.784790 IP 10.0.0.1.54965 > 10.0.0.4.5001: UDP, length 1470
19:06:25.796114 IP 10.0.0.1.54965 > 10.0.0.4.5001: UDP, length 1470
19:06:25.807162 IP 10.0.0.1.54965 > 10.0.0.4.5001: UDP, length 1470
19:06:25.818522 IP 10.0.0.1.54965 > 10.0.0.4.5001: UDP, length 1470
19:06:25.829863 IP 10.0.0.1.54965 > 10.0.0.4.5001: UDP, length 1470
19:06:25.842754 IP 10.0.0.1.54965 > 10.0.0.4.5001: UDP, length 1470
19:06:25.851997 IP 10.0.0.1.54965 > 10.0.0.4.5001: UDP, length 1470
19:06:25.863193 IP 10.0.0.1.54965 > 10.0.0.4.5001: UDP, length 1470
19:06:25.874775 IP 10.0.0.1.54965 > 10.0.0.4.5001: UDP, length 1470
19:06:25.885686 IP 10.0.0.1.54965 > 10.0.0.4.5001: UDP, length 1470
19:06:25.897003 IP 10.0.0.1.54965 > 10.0.0.4.5001: UDP, length 1470
19:06:25.908114 IP 10.0.0.1.54965 > 10.0.0.4.5001: UDP, length 1470
19:06:25.919444 IP 10.0.0.1.54965 > 10.0.0.4.5001: UDP, length 1470
19:06:25.931452 IP 10.0.0.1.54965 > 10.0.0.4.5001: UDP, length 1470
19:06:25.941737 IP 10.0.0.1.54965 > 10.0.0.4.5001: UDP, length 1470
19:06:25.953426 IP 10.0.0.1.54965 > 10.0.0.4.5001: UDP, length 1470
19:06:25.964787 IP 10.0.0.1.54965 > 10.0.0.4.5001: UDP, length 1470
19:06:25.976118 IP 10.0.0.1.54965 > 10.0.0.4.5001: UDP, length 1470
19:06:25.987565 IP 10.0.0.1.54965 > 10.0.0.4.5001: UDP, length 1470
19:06:25.997801 IP 10.0.0.1.54965 > 10.0.0.4.5001: UDP, length 1470
19:06:26.009236 IP 10.0.0.1.54965 > 10.0.0.4.5001: UDP, length 1470
19:06:26.020569 IP 10.0.0.1.54965 > 10.0.0.4.5001: UDP, length 1470
19:06:26.031905 IP 10.0.0.1.54965 > 10.0.0.4.5001: UDP, length 1470
19:06:26.042605 IP 10.0.0.1.54965 > 10.0.0.4.5001: UDP, length 1470
19:06:26.054078 IP 10.0.0.1.54965 > 10.0.0.4.5001: UDP, length 1470
19:06:26.065009 IP 10.0.0.1.54965 > 10.0.0.4.5001: UDP, length 1470
19:06:26.076265 IP 10.0.0.1.54965 > 10.0.0.4.5001: UDP, length 1470
19:06:26.087432 IP 10.0.0.1.54965 > 10.0.0.4.5001: UDP, length 1470
19:06:26.098798 IP 10.0.0.1.54965 > 10.0.0.4.5001: UDP, length 1470
19:06:26.110119 IP 10.0.0.1.54965 > 10.0.0.4.5001: UDP, length 1470
19:06:26.121335 IP 10.0.0.1.54965 > 10.0.0.4.5001: UDP, length 1470
19:06:26.132584 IP 10.0.0.1.54965 > 10.0.0.4.5001: UDP, length 1470
19:06:26.143495 IP 10.0.0.1.54965 > 10.0.0.4.5001: UDP, length 1470
19:06:26.154759 IP 10.0.0.1.54965 > 10.0.0.4.5001: UDP, length 1470
19:06:26.166323 IP 10.0.0.1.54965 > 10.0.0.4.5001: UDP, length 1470
19:06:26.177786 IP 10.0.0.1.54965 > 10.0.0.4.5001: UDP, length 1470
19:06:26.188597 IP 10.0.0.1.54965 > 10.0.0.4.5001: UDP, length 1470
19:06:26.199666 IP 10.0.0.1.54965 > 10.0.0.4.5001: UDP, length 1470
19:06:26.211648 IP 10.0.0.1.54965 > 10.0.0.4.5001: UDP, length 1470
19:06:26.222445 IP 10.0.0.1.54965 > 10.0.0.4.5001: UDP, length 1470
19:06:26.234130 IP 10.0.0.1.54965 > 10.0.0.4.5001: UDP, length 1470
19:06:26.245007 IP 10.0.0.1.54965 > 10.0.0.4.5001: UDP, length 1470
19:06:26.256385 IP 10.0.0.1.54965 > 10.0.0.4.5001: UDP, length 1470
19:06:26.267116 IP 10.0.0.1.54965 > 10.0.0.4.5001: UDP, length 1470
19:06:26.278344 IP 10.0.0.1.54965 > 10.0.0.4.5001: UDP, length 1470
19:06:26.289268 IP 10.0.0.1.54965 > 10.0.0.4.5001: UDP, length 1470
19:06:26.300761 IP 10.0.0.1.54965 > 10.0.0.4.5001: UDP, length 1470
19:06:26.311769 IP 10.0.0.1.54965 > 10.0.0.4.5001: UDP, length 1470
19:06:26.323015 IP 10.0.0.1.54965 > 10.0.0.4.5001: UDP, length 1470
19:06:26.334671 IP 10.0.0.1.54965 > 10.0.0.4.5001: UDP, length 1470
19:06:26.345901 IP 10.0.0.1.54965 > 10.0.0.4.5001: UDP, length 1470
19:06:26.356730 IP 10.0.0.1.54965 > 10.0.0.4.5001: UDP, length 1470
19:06:26.367706 IP 10.0.0.1.54965 > 10.0.0.4.5001: UDP, length 1470
19:06:26.378953 IP 10.0.0.1.54965 > 10.0.0.4.5001: UDP, length 1470
19:06:26.390332 IP 10.0.0.1.54965 > 10.0.0.4.5001: UDP, length 1470
19:06:26.401664 IP 10.0.0.1.54965 > 10.0.0.4.5001: UDP, length 1470
19:06:26.413558 IP 10.0.0.1.54965 > 10.0.0.4.5001: UDP, length 1470
19:06:26.423954 IP 10.0.0.1.54965 > 10.0.0.4.5001: UDP, length 1470
19:06:26.435717 IP 10.0.0.1.54965 > 10.0.0.4.5001: UDP, length 1470
19:06:26.446667 IP 10.0.0.1.54965 > 10.0.0.4.5001: UDP, length 1470
19:06:26.457604 IP 10.0.0.1.54965 > 10.0.0.4.5001: UDP, length 1470
19:06:26.468877 IP 10.0.0.1.54965 > 10.0.0.4.5001: UDP, length 1470
19:06:26.480001 IP 10.0.0.1.54965 > 10.0.0.4.5001: UDP, length 1470
19:06:26.491118 IP 10.0.0.1.54965 > 10.0.0.4.5001: UDP, length 1470
19:06:26.502864 IP 10.0.0.1.54965 > 10.0.0.4.5001: UDP, length 1470
19:06:26.513971 IP 10.0.0.1.54965 > 10.0.0.4.5001: UDP, length 1470
19:06:26.525479 IP 10.0.0.1.54965 > 10.0.0.4.5001: UDP, length 1470
19:06:26.536148 IP 10.0.0.1.54965 > 10.0.0.4.5001: UDP, length 1470
19:06:26.547602 IP 10.0.0.1.54965 > 10.0.0.4.5001: UDP, length 1470
19:06:26.558684 IP 10.0.0.1.54965 > 10.0.0.4.5001: UDP, length 1470
19:06:26.570715 IP 10.0.0.1.54965 > 10.0.0.4.5001: UDP, length 1470
19:06:26.581265 IP 10.0.0.1.54965 > 10.0.0.4.5001: UDP, length 1470
19:06:26.592709 IP 10.0.0.1.54965 > 10.0.0.4.5001: UDP, length 1470
19:06:26.603213 IP 10.0.0.1.54965 > 10.0.0.4.5001: UDP, length 1470
19:06:26.614871 IP 10.0.0.1.54965 > 10.0.0.4.5001: UDP, length 1470
19:06:26.625962 IP 10.0.0.1.54965 > 10.0.0.4.5001: UDP, length 1470
19:06:26.637397 IP 10.0.0.1.54965 > 10.0.0.4.5001: UDP, length 1470
19:06:26.648185 IP 10.0.0.1.54965 > 10.0.0.4.5001: UDP, length 1470
19:06:26.659442 IP 10.0.0.1.54965 > 10.0.0.4.5001: UDP, length 1470
19:06:26.670846 IP 10.0.0.1.54965 > 10.0.0.4.5001: UDP, length 1470
19:06:26.682183 IP 10.0.0.1.54965 > 10.0.0.4.5001: UDP, length 1470
19:06:26.693415 IP 10.0.0.1.54965 > 10.0.0.4.5001: UDP, length 1470
19:06:26.704527 IP 10.0.0.1.54965 > 10.0.0.4.5001: UDP, length 1470
19:06:26.715622 IP 10.0.0.1.54965 > 10.0.0.4.5001: UDP, length 1470
19:06:26.727274 IP 10.0.0.1.54965 > 10.0.0.4.5001: UDP, length 1470
19:06:26.738702 IP 10.0.0.1.54965 > 10.0.0.4.5001: UDP, length 1470
19:06:26.749560 IP 10.0.0.1.54965 > 10.0.0.4.5001: UDP, length 1470
19:06:26.761115 IP 10.0.0.1.54965 > 10.0.0.4.5001: UDP, length 1470
19:06:26.772113 IP 10.0.0.1.54965 > 10.0.0.4.5001: UDP, length 1470
19:06:26.783286 IP 10.0.0.1.54965 > 10.0.0.4.5001: UDP, length 1470
19:06:26.794881 IP 10.0.0.1.54965 > 10.0.0.4.5001: UDP, length 1470
19:06:26.805461 IP 10.0.0.1.54965 > 10.0.0.4.5001: UDP, length 1470
19:06:26.816663 IP 10.0.0.1.54965 > 10.0.0.4.5001: UDP, length 1470
19:06:26.827849 IP 10.0.0.1.54965 > 10.0.0.4.5001: UDP, length 1470
19:06:26.838938 IP 10.0.0.1.54965 > 10.0.0.4.5001: UDP, length 1470
19:06:26.850278 IP 10.0.0.1.54965 > 10.0.0.4.5001: UDP, length 1470
19:06:26.861370 IP 10.0.0.1.54965 > 10.0.0.4.5001: UDP, length 1470
19:06:26.872643 IP 10.0.0.1.54965 > 10.0.0.4.5001: UDP, length 1470
19:06:26.883812 IP 10.0.0.1.54965 > 10.0.0.4.5001: UDP, length 1470
19:06:26.894808 IP 10.0.0.1.54965 > 10.0.0.4.5001: UDP, length 1470
19:06:26.906713 IP 10.0.0.1.54965 > 10.0.0.4.5001: UDP, length 1470
19:06:26.917717 IP 10.0.0.1.54965 > 10.0.0.4.5001: UDP, length 1470
19:06:26.928512 IP 10.0.0.1.54965 > 10.0.0.4.5001: UDP, length 1470
19:06:26.939910 IP 10.0.0.1.54965 > 10.0.0.4.5001: UDP, length 1470
19:06:26.951132 IP 10.0.0.1.54965 > 10.0.0.4.5001: UDP, length 1470
19:06:26.962226 IP 10.0.0.1.54965 > 10.0.0.4.5001: UDP, length 1470
19:06:26.973669 IP 10.0.0.1.54965 > 10.0.0.4.5001: UDP, length 1470
19:06:26.984777 IP 10.0.0.1.54965 > 10.0.0.4.5001: UDP, length 1470
19:06:26.995785 IP 10.0.0.1.54965 > 10.0.0.4.5001: UDP, length 1470
19:06:27.007265 IP 10.0.0.1.54965 > 10.0.0.4.5001: UDP, length 1470
19:06:27.018531 IP 10.0.0.1.54965 > 10.0.0.4.5001: UDP, length 1470
19:06:27.030712 IP 10.0.0.1.54965 > 10.0.0.4.5001: UDP, length 1470
19:06:27.041587 IP 10.0.0.1.54965 > 10.0.0.4.5001: UDP, length 1470
19:06:27.052612 IP 10.0.0.1.54965 > 10.0.0.4.5001: UDP, length 1470
19:06:27.063274 IP 10.0.0.1.54965 > 10.0.0.4.5001: UDP, length 1470
19:06:27.074487 IP 10.0.0.1.54965 > 10.0.0.4.5001: UDP, length 1470
19:06:27.085735 IP 10.0.0.1.54965 > 10.0.0.4.5001: UDP, length 1470
19:06:27.097017 IP 10.0.0.1.54965 > 10.0.0.4.5001: UDP, length 1470
19:06:27.108094 IP 10.0.0.1.54965 > 10.0.0.4.5001: UDP, length 1470
19:06:27.119268 IP 10.0.0.1.54965 > 10.0.0.4.5001: UDP, length 1470
19:06:27.130928 IP 10.0.0.1.54965 > 10.0.0.4.5001: UDP, length 1470
19:06:27.141624 IP 10.0.0.1.54965 > 10.0.0.4.5001: UDP, length 1470
19:06:27.153148 IP 10.0.0.1.54965 > 10.0.0.4.5001: UDP, length 1470
19:06:27.164049 IP 10.0.0.1.54965 > 10.0.0.4.5001: UDP, length 1470
19:06:27.175337 IP 10.0.0.1.54965 > 10.0.0.4.5001: UDP, length 1470
19:06:27.187132 IP 10.0.0.1.54965 > 10.0.0.4.5001: UDP, length 1470
19:06:27.198546 IP 10.0.0.1.54965 > 10.0.0.4.5001: UDP, length 1470
19:06:27.209317 IP 10.0.0.1.54965 > 10.0.0.4.5001: UDP, length 1470
19:06:27.220260 IP 10.0.0.1.54965 > 10.0.0.4.5001: UDP, length 1470
19:06:27.232481 IP 10.0.0.1.54965 > 10.0.0.4.5001: UDP, length 1470
19:06:27.242850 IP 10.0.0.1.54965 > 10.0.0.4.5001: UDP, length 1470
19:06:27.253873 IP 10.0.0.1.54965 > 10.0.0.4.5001: UDP, length 1470
19:06:27.265152 IP 10.0.0.1.54965 > 10.0.0.4.5001: UDP, length 1470
19:06:27.276413 IP 10.0.0.1.54965 > 10.0.0.4.5001: UDP, length 1470
19:06:27.287451 IP 10.0.0.1.54965 > 10.0.0.4.5001: UDP, length 1470
19:06:27.299174 IP 10.0.0.1.54965 > 10.0.0.4.5001: UDP, length 1470
19:06:27.310300 IP 10.0.0.1.54965 > 10.0.0.4.5001: UDP, length 1470
19:06:27.321307 IP 10.0.0.1.54965 > 10.0.0.4.5001: UDP, length 1470
19:06:27.332988 IP 10.0.0.1.54965 > 10.0.0.4.5001: UDP, length 1470
19:06:27.343518 IP 10.0.0.1.54965 > 10.0.0.4.5001: UDP, length 1470
19:06:27.355587 IP 10.0.0.1.54965 > 10.0.0.4.5001: UDP, length 1470
19:06:27.366883 IP 10.0.0.1.54965 > 10.0.0.4.5001: UDP, length 1470
19:06:27.377539 IP 10.0.0.1.54965 > 10.0.0.4.5001: UDP, length 1470
19:06:27.389413 IP 10.0.0.1.54965 > 10.0.0.4.5001: UDP, length 1470
19:06:27.399537 IP 10.0.0.1.54965 > 10.0.0.4.5001: UDP, length 1470
19:06:27.410811 IP 10.0.0.1.54965 > 10.0.0.4.5001: UDP, length 1470
19:06:27.421999 IP 10.0.0.1.54965 > 10.0.0.4.5001: UDP, length 1470
19:06:27.433466 IP 10.0.0.1.54965 > 10.0.0.4.5001: UDP, length 1470
19:06:27.444519 IP 10.0.0.1.54965 > 10.0.0.4.5001: UDP, length 1470
19:06:27.455634 IP 10.0.0.1.54965 > 10.0.0.4.5001: UDP, length 1470
19:06:27.466762 IP 10.0.0.1.54965 > 10.0.0.4.5001: UDP, length 1470
19:06:27.478477 IP 10.0.0.1.54965 > 10.0.0.4.5001: UDP, length 1470
19:06:27.490219 IP 10.0.0.1.54965 > 10.0.0.4.5001: UDP, length 1470
19:06:27.500989 IP 10.0.0.1.54965 > 10.0.0.4.5001: UDP, length 1470
19:06:27.511855 IP 10.0.0.1.54965 > 10.0.0.4.5001: UDP, length 1470
19:06:27.523468 IP 10.0.0.1.54965 > 10.0.0.4.5001: UDP, length 1470
19:06:27.535354 IP 10.0.0.1.54965 > 10.0.0.4.5001: UDP, length 1470
19:06:27.545715 IP 10.0.0.1.54965 > 10.0.0.4.5001: UDP, length 1470
19:06:27.557072 IP 10.0.0.1.54965 > 10.0.0.4.5001: UDP, length 1470
19:06:27.568436 IP 10.0.0.1.54965 > 10.0.0.4.5001: UDP, length 1470
19:06:27.579698 IP 10.0.0.1.54965 > 10.0.0.4.5001: UDP, length 1470
19:06:27.591010 IP 10.0.0.1.54965 > 10.0.0.4.5001: UDP, length 1470
19:06:27.602441 IP 10.0.0.1.54965 > 10.0.0.4.5001: UDP, length 1470
19:06:27.612873 IP 10.0.0.1.54965 > 10.0.0.4.5001: UDP, length 1470
19:06:27.624243 IP 10.0.0.1.54965 > 10.0.0.4.5001: UDP, length 1470
19:06:27.635589 IP 10.0.0.1.54965 > 10.0.0.4.5001: UDP, length 1470
19:06:27.646729 IP 10.0.0.1.54965 > 10.0.0.4.5001: UDP, length 1470
19:06:27.657725 IP 10.0.0.1.54965 > 10.0.0.4.5001: UDP, length 1470
19:06:27.668949 IP 10.0.0.1.54965 > 10.0.0.4.5001: UDP, length 1470
19:06:27.680112 IP 10.0.0.1.54965 > 10.0.0.4.5001: UDP, length 1470
19:06:27.691100 IP 10.0.0.1.54965 > 10.0.0.4.5001: UDP, length 1470
19:06:27.702738 IP 10.0.0.1.54965 > 10.0.0.4.5001: UDP, length 1470
19:06:27.713950 IP 10.0.0.1.54965 > 10.0.0.4.5001: UDP, length 1470
19:06:27.725052 IP 10.0.0.1.54965 > 10.0.0.4.5001: UDP, length 1470
19:06:27.736148 IP 10.0.0.1.54965 > 10.0.0.4.5001: UDP, length 1470
19:06:27.747816 IP 10.0.0.1.54965 > 10.0.0.4.5001: UDP, length 1470
19:06:27.758915 IP 10.0.0.1.54965 > 10.0.0.4.5001: UDP, length 1470
19:06:27.769976 IP 10.0.0.1.54965 > 10.0.0.4.5001: UDP, length 1470
19:06:27.781154 IP 10.0.0.1.54965 > 10.0.0.4.5001: UDP, length 1470
19:06:27.792732 IP 10.0.0.1.54965 > 10.0.0.4.5001: UDP, length 1470
19:06:27.803364 IP 10.0.0.1.54965 > 10.0.0.4.5001: UDP, length 1470
19:06:27.814960 IP 10.0.0.1.54965 > 10.0.0.4.5001: UDP, length 1470
19:06:27.826862 IP 10.0.0.1.54965 > 10.0.0.4.5001: UDP, length 1470
19:06:27.837720 IP 10.0.0.1.54965 > 10.0.0.4.5001: UDP, length 1470
19:06:27.848708 IP 10.0.0.1.54965 > 10.0.0.4.5001: UDP, length 1470
19:06:27.860084 IP 10.0.0.1.54965 > 10.0.0.4.5001: UDP, length 1470
19:06:27.871431 IP 10.0.0.1.54965 > 10.0.0.4.5001: UDP, length 1470
19:06:27.882369 IP 10.0.0.1.54965 > 10.0.0.4.5001: UDP, length 1470
19:06:27.893703 IP 10.0.0.1.54965 > 10.0.0.4.5001: UDP, length 1470
19:06:27.904167 IP 10.0.0.1.54965 > 10.0.0.4.5001: UDP, length 1470
19:06:27.915545 IP 10.0.0.1.54965 > 10.0.0.4.5001: UDP, length 1470
19:06:27.926905 IP 10.0.0.1.54965 > 10.0.0.4.5001: UDP, length 1470
19:06:27.938051 IP 10.0.0.1.54965 > 10.0.0.4.5001: UDP, length 1470
19:06:27.949324 IP 10.0.0.1.54965 > 10.0.0.4.5001: UDP, length 1470
19:06:27.960332 IP 10.0.0.1.54965 > 10.0.0.4.5001: UDP, length 1470
19:06:27.971463 IP 10.0.0.1.54965 > 10.0.0.4.5001: UDP, length 1470
19:06:27.982913 IP 10.0.0.1.54965 > 10.0.0.4.5001: UDP, length 1470
19:06:27.994370 IP 10.0.0.1.54965 > 10.0.0.4.5001: UDP, length 1470
19:06:28.005187 IP 10.0.0.1.54965 > 10.0.0.4.5001: UDP, length 1470
19:06:28.016534 IP 10.0.0.1.54965 > 10.0.0.4.5001: UDP, length 1470
19:06:28.027799 IP 10.0.0.1.54965 > 10.0.0.4.5001: UDP, length 1470
19:06:28.039867 IP 10.0.0.1.54965 > 10.0.0.4.5001: UDP, length 1470
19:06:28.050263 IP 10.0.0.1.54965 > 10.0.0.4.5001: UDP, length 1470
19:06:28.061203 IP 10.0.0.1.54965 > 10.0.0.4.5001: UDP, length 1470
19:06:28.073277 IP 10.0.0.1.54965 > 10.0.0.4.5001: UDP, length 1470
19:06:28.084585 IP 10.0.0.1.54965 > 10.0.0.4.5001: UDP, length 1470
19:06:28.095253 IP 10.0.0.1.54965 > 10.0.0.4.5001: UDP, length 1470
19:06:28.106119 IP 10.0.0.1.54965 > 10.0.0.4.5001: UDP, length 1470
19:06:28.117572 IP 10.0.0.1.54965 > 10.0.0.4.5001: UDP, length 1470
19:06:28.128761 IP 10.0.0.1.54965 > 10.0.0.4.5001: UDP, length 1470
19:06:28.139920 IP 10.0.0.1.54965 > 10.0.0.4.5001: UDP, length 1470
19:06:28.150877 IP 10.0.0.1.54965 > 10.0.0.4.5001: UDP, length 1470
19:06:28.162707 IP 10.0.0.1.54965 > 10.0.0.4.5001: UDP, length 1470
19:06:28.173728 IP 10.0.0.1.54965 > 10.0.0.4.5001: UDP, length 1470
19:06:28.184876 IP 10.0.0.1.54965 > 10.0.0.4.5001: UDP, length 1470
19:06:28.195978 IP 10.0.0.1.54965 > 10.0.0.4.5001: UDP, length 1470
19:06:28.207030 IP 10.0.0.1.54965 > 10.0.0.4.5001: UDP, length 1470
19:06:28.218949 IP 10.0.0.1.54965 > 10.0.0.4.5001: UDP, length 1470
19:06:28.230330 IP 10.0.0.1.54965 > 10.0.0.4.5001: UDP, length 1470
19:06:28.241736 IP 10.0.0.1.54965 > 10.0.0.4.5001: UDP, length 1470
19:06:28.252050 IP 10.0.0.1.54965 > 10.0.0.4.5001: UDP, length 1470
19:06:28.263742 IP 10.0.0.1.54965 > 10.0.0.4.5001: UDP, length 1470
19:06:28.274759 IP 10.0.0.1.54965 > 10.0.0.4.5001: UDP, length 1470
19:06:28.285878 IP 10.0.0.1.54965 > 10.0.0.4.5001: UDP, length 1470
19:06:28.297135 IP 10.0.0.1.54965 > 10.0.0.4.5001: UDP, length 1470
19:06:28.308528 IP 10.0.0.1.54965 > 10.0.0.4.5001: UDP, length 1470
19:06:28.319386 IP 10.0.0.1.54965 > 10.0.0.4.5001: UDP, length 1470
19:06:28.330494 IP 10.0.0.1.54965 > 10.0.0.4.5001: UDP, length 1470
19:06:28.341618 IP 10.0.0.1.54965 > 10.0.0.4.5001: UDP, length 1470
19:06:28.353179 IP 10.0.0.1.54965 > 10.0.0.4.5001: UDP, length 1470
19:06:28.364346 IP 10.0.0.1.54965 > 10.0.0.4.5001: UDP, length 1470
19:06:28.375459 IP 10.0.0.1.54965 > 10.0.0.4.5001: UDP, length 1470
19:06:28.386949 IP 10.0.0.1.54965 > 10.0.0.4.5001: UDP, length 1470
19:06:28.398178 IP 10.0.0.1.54965 > 10.0.0.4.5001: UDP, length 1470
19:06:28.409334 IP 10.0.0.1.54965 > 10.0.0.4.5001: UDP, length 1470
19:06:28.420417 IP 10.0.0.1.54965 > 10.0.0.4.5001: UDP, length 1470
19:06:28.431439 IP 10.0.0.1.54965 > 10.0.0.4.5001: UDP, length 1470
19:06:28.442914 IP 10.0.0.1.54965 > 10.0.0.4.5001: UDP, length 1470
19:06:28.454727 IP 10.0.0.1.54965 > 10.0.0.4.5001: UDP, length 1470
19:06:28.465345 IP 10.0.0.1.54965 > 10.0.0.4.5001: UDP, length 1470
19:06:28.476121 IP 10.0.0.1.54965 > 10.0.0.4.5001: UDP, length 1470
19:06:28.487738 IP 10.0.0.1.54965 > 10.0.0.4.5001: UDP, length 1470
19:06:28.499102 IP 10.0.0.1.54965 > 10.0.0.4.5001: UDP, length 1470
19:06:28.510280 IP 10.0.0.1.54965 > 10.0.0.4.5001: UDP, length 1470
19:06:28.521034 IP 10.0.0.1.54965 > 10.0.0.4.5001: UDP, length 1470
19:06:28.532460 IP 10.0.0.1.54965 > 10.0.0.4.5001: UDP, length 1470
19:06:28.543551 IP 10.0.0.1.54965 > 10.0.0.4.5001: UDP, length 1470
19:06:28.555126 IP 10.0.0.1.54965 > 10.0.0.4.5001: UDP, length 1470
19:06:28.566245 IP 10.0.0.1.54965 > 10.0.0.4.5001: UDP, length 1470
19:06:28.577495 IP 10.0.0.1.54965 > 10.0.0.4.5001: UDP, length 1470
19:06:28.588757 IP 10.0.0.1.54965 > 10.0.0.4.5001: UDP, length 1470
19:06:28.600097 IP 10.0.0.1.54965 > 10.0.0.4.5001: UDP, length 1470
19:06:28.611017 IP 10.0.0.1.54965 > 10.0.0.4.5001: UDP, length 1470
19:06:28.622485 IP 10.0.0.1.54965 > 10.0.0.4.5001: UDP, length 1470
19:06:28.634028 IP 10.0.0.1.54965 > 10.0.0.4.5001: UDP, length 1470
19:06:28.644654 IP 10.0.0.1.54965 > 10.0.0.4.5001: UDP, length 1470
19:06:28.655681 IP 10.0.0.1.54965 > 10.0.0.4.5001: UDP, length 1470
19:06:28.666802 IP 10.0.0.1.54965 > 10.0.0.4.5001: UDP, length 1470
19:06:28.678114 IP 10.0.0.1.54965 > 10.0.0.4.5001: UDP, length 1470
19:06:28.689355 IP 10.0.0.1.54965 > 10.0.0.4.5001: UDP, length 1470
19:06:28.700876 IP 10.0.0.1.54965 > 10.0.0.4.5001: UDP, length 1470
19:06:28.711871 IP 10.0.0.1.54965 > 10.0.0.4.5001: UDP, length 1470
19:06:28.723335 IP 10.0.0.1.54965 > 10.0.0.4.5001: UDP, length 1470
19:06:28.734525 IP 10.0.0.1.54965 > 10.0.0.4.5001: UDP, length 1470
19:06:28.745558 IP 10.0.0.1.54965 > 10.0.0.4.5001: UDP, length 1470
19:06:28.756862 IP 10.0.0.1.54965 > 10.0.0.4.5001: UDP, length 1470
19:06:28.767916 IP 10.0.0.1.54965 > 10.0.0.4.5001: UDP, length 1470
19:06:28.779177 IP 10.0.0.1.54965 > 10.0.0.4.5001: UDP, length 1470
19:06:28.790632 IP 10.0.0.1.54965 > 10.0.0.4.5001: UDP, length 1470
19:06:28.801633 IP 10.0.0.1.54965 > 10.0.0.4.5001: UDP, length 1470
19:06:28.813576 IP 10.0.0.1.54965 > 10.0.0.4.5001: UDP, length 1470
19:06:28.824576 IP 10.0.0.1.54965 > 10.0.0.4.5001: UDP, length 1470
19:06:28.835272 IP 10.0.0.1.54965 > 10.0.0.4.5001: UDP, length 1470
19:06:28.846717 IP 10.0.0.1.54965 > 10.0.0.4.5001: UDP, length 1470
19:06:28.858447 IP 10.0.0.1.54965 > 10.0.0.4.5001: UDP, length 1470
19:06:28.869759 IP 10.0.0.1.54965 > 10.0.0.4.5001: UDP, length 1470
19:06:28.881171 IP 10.0.0.1.54965 > 10.0.0.4.5001: UDP, length 1470
19:06:28.891382 IP 10.0.0.1.54965 > 10.0.0.4.5001: UDP, length 1470
19:06:28.902377 IP 10.0.0.1.54965 > 10.0.0.4.5001: UDP, length 1470
19:06:28.913783 IP 10.0.0.1.54965 > 10.0.0.4.5001: UDP, length 1470
19:06:28.925123 IP 10.0.0.1.54965 > 10.0.0.4.5001: UDP, length 1470
19:06:28.936327 IP 10.0.0.1.54965 > 10.0.0.4.5001: UDP, length 1470
19:06:28.947438 IP 10.0.0.1.54965 > 10.0.0.4.5001: UDP, length 1470
19:06:28.958953 IP 10.0.0.1.54965 > 10.0.0.4.5001: UDP, length 1470
19:06:28.970222 IP 10.0.0.1.54965 > 10.0.0.4.5001: UDP, length 1470
19:06:28.981245 IP 10.0.0.1.54965 > 10.0.0.4.5001: UDP, length 1470
19:06:28.992038 IP 10.0.0.1.54965 > 10.0.0.4.5001: UDP, length 1470
19:06:29.003502 IP 10.0.0.1.54965 > 10.0.0.4.5001: UDP, length 1470
19:06:29.015309 IP 10.0.0.1.54965 > 10.0.0.4.5001: UDP, length 1470
19:06:29.025771 IP 10.0.0.1.54965 > 10.0.0.4.5001: UDP, length 1470
19:06:29.037849 IP 10.0.0.1.54965 > 10.0.0.4.5001: UDP, length 1470
19:06:29.048187 IP 10.0.0.1.54965 > 10.0.0.4.5001: UDP, length 1470
19:06:29.059420 IP 10.0.0.1.54965 > 10.0.0.4.5001: UDP, length 1470
19:06:29.071511 IP 10.0.0.1.54965 > 10.0.0.4.5001: UDP, length 1470
19:06:29.082361 IP 10.0.0.1.54965 > 10.0.0.4.5001: UDP, length 1470
19:06:29.093406 IP 10.0.0.1.54965 > 10.0.0.4.5001: UDP, length 1470
19:06:29.104488 IP 10.0.0.1.54965 > 10.0.0.4.5001: UDP, length 1470
19:06:29.115607 IP 10.0.0.1.54965 > 10.0.0.4.5001: UDP, length 1470
19:06:29.127191 IP 10.0.0.1.54965 > 10.0.0.4.5001: UDP, length 1470
19:06:29.138492 IP 10.0.0.1.54965 > 10.0.0.4.5001: UDP, length 1470
19:06:29.149443 IP 10.0.0.1.54965 > 10.0.0.4.5001: UDP, length 1470
19:06:29.160927 IP 10.0.0.1.54965 > 10.0.0.4.5001: UDP, length 1470
19:06:29.171509 IP 10.0.0.1.54965 > 10.0.0.4.5001: UDP, length 1470
19:06:29.183399 IP 10.0.0.1.54965 > 10.0.0.4.5001: UDP, length 1470
19:06:29.194680 IP 10.0.0.1.54965 > 10.0.0.4.5001: UDP, length 1470
19:06:29.205330 IP 10.0.0.1.54965 > 10.0.0.4.5001: UDP, length 1470
19:06:29.217216 IP 10.0.0.1.54965 > 10.0.0.4.5001: UDP, length 1470
19:06:29.228329 IP 10.0.0.1.54965 > 10.0.0.4.5001: UDP, length 1470
19:06:29.239141 IP 10.0.0.1.54965 > 10.0.0.4.5001: UDP, length 1470
19:06:29.250358 IP 10.0.0.1.54965 > 10.0.0.4.5001: UDP, length 1470
19:06:29.262041 IP 10.0.0.1.54965 > 10.0.0.4.5001: UDP, length 1470
19:06:29.272458 IP 10.0.0.1.54965 > 10.0.0.4.5001: UDP, length 1470
19:06:29.283771 IP 10.0.0.1.54965 > 10.0.0.4.5001: UDP, length 1470
19:06:29.295019 IP 10.0.0.1.54965 > 10.0.0.4.5001: UDP, length 1470
19:06:29.306471 IP 10.0.0.1.54965 > 10.0.0.4.5001: UDP, length 1470
19:06:29.317636 IP 10.0.0.1.54965 > 10.0.0.4.5001: UDP, length 1470
19:06:29.328911 IP 10.0.0.1.54965 > 10.0.0.4.5001: UDP, length 1470
19:06:29.339793 IP 10.0.0.1.54965 > 10.0.0.4.5001: UDP, length 1470
19:06:29.351244 IP 10.0.0.1.54965 > 10.0.0.4.5001: UDP, length 1470
19:06:29.362883 IP 10.0.0.1.54965 > 10.0.0.4.5001: UDP, length 1470
19:06:29.373886 IP 10.0.0.1.54965 > 10.0.0.4.5001: UDP, length 1470
19:06:29.384988 IP 10.0.0.1.54965 > 10.0.0.4.5001: UDP, length 1470
19:06:29.396572 IP 10.0.0.1.54965 > 10.0.0.4.5001: UDP, length 1470
19:06:29.407165 IP 10.0.0.1.54965 > 10.0.0.4.5001: UDP, length 1470
19:06:29.418825 IP 10.0.0.1.54965 > 10.0.0.4.5001: UDP, length 1470
19:06:29.429929 IP 10.0.0.1.54965 > 10.0.0.4.5001: UDP, length 1470
19:06:29.441464 IP 10.0.0.1.54965 > 10.0.0.4.5001: UDP, length 1470
19:06:29.452650 IP 10.0.0.1.54965 > 10.0.0.4.5001: UDP, length 1470
19:06:29.464395 IP 10.0.0.1.54965 > 10.0.0.4.5001: UDP, length 1470
19:06:29.474860 IP 10.0.0.1.54965 > 10.0.0.4.5001: UDP, length 1470
19:06:29.485965 IP 10.0.0.1.54965 > 10.0.0.4.5001: UDP, length 1470
19:06:29.496697 IP 10.0.0.1.54965 > 10.0.0.4.5001: UDP, length 1470
19:06:29.507883 IP 10.0.0.1.54965 > 10.0.0.4.5001: UDP, length 1470
19:06:29.519193 IP 10.0.0.1.54965 > 10.0.0.4.5001: UDP, length 1470
19:06:29.530780 IP 10.0.0.1.54965 > 10.0.0.4.5001: UDP, length 1470
19:06:29.541584 IP 10.0.0.1.54965 > 10.0.0.4.5001: UDP, length 1470
19:06:29.552920 IP 10.0.0.1.54965 > 10.0.0.4.5001: UDP, length 1470
19:06:29.564170 IP 10.0.0.1.54965 > 10.0.0.4.5001: UDP, length 1470
19:06:29.575538 IP 10.0.0.1.54965 > 10.0.0.4.5001: UDP, length 1470
19:06:29.587045 IP 10.0.0.1.54965 > 10.0.0.4.5001: UDP, length 1470
19:06:29.597998 IP 10.0.0.1.54965 > 10.0.0.4.5001: UDP, length 1470
19:06:29.609294 IP 10.0.0.1.54965 > 10.0.0.4.5001: UDP, length 1470
19:06:29.620228 IP 10.0.0.1.54965 > 10.0.0.4.5001: UDP, length 1470
19:06:29.632452 IP 10.0.0.1.54965 > 10.0.0.4.5001: UDP, length 1470
19:06:29.642765 IP 10.0.0.1.54965 > 10.0.0.4.5001: UDP, length 1470
19:06:29.654217 IP 10.0.0.1.54965 > 10.0.0.4.5001: UDP, length 1470
19:06:29.664985 IP 10.0.0.1.54965 > 10.0.0.4.5001: UDP, length 1470
19:06:29.676418 IP 10.0.0.1.54965 > 10.0.0.4.5001: UDP, length 1470
19:06:29.687584 IP 10.0.0.1.54965 > 10.0.0.4.5001: UDP, length 1470
19:06:29.698860 IP 10.0.0.1.54965 > 10.0.0.4.5001: UDP, length 1470
19:06:29.710166 IP 10.0.0.1.54965 > 10.0.0.4.5001: UDP, length 1470
19:06:29.721672 IP 10.0.0.1.54965 > 10.0.0.4.5001: UDP, length 1470
19:06:29.732606 IP 10.0.0.1.54965 > 10.0.0.4.5001: UDP, length 1470
19:06:29.743671 IP 10.0.0.1.54965 > 10.0.0.4.5001: UDP, length 1470
19:06:29.755207 IP 10.0.0.1.54965 > 10.0.0.4.5001: UDP, length 1470
19:06:29.766433 IP 10.0.0.1.54965 > 10.0.0.4.5001: UDP, length 1470
19:06:29.777426 IP 10.0.0.1.54965 > 10.0.0.4.5001: UDP, length 1470
19:06:29.788498 IP 10.0.0.1.54965 > 10.0.0.4.5001: UDP, length 1470
19:06:29.799762 IP 10.0.0.1.54965 > 10.0.0.4.5001: UDP, length 1470
19:06:29.810970 IP 10.0.0.1.54965 > 10.0.0.4.5001: UDP, length 1470
19:06:29.822644 IP 10.0.0.1.54965 > 10.0.0.4.5001: UDP, length 1470
19:06:29.833789 IP 10.0.0.1.54965 > 10.0.0.4.5001: UDP, length 1470
19:06:29.844697 IP 10.0.0.1.54965 > 10.0.0.4.5001: UDP, length 1470
19:06:29.855802 IP 10.0.0.1.54965 > 10.0.0.4.5001: UDP, length 1470
19:06:29.867350 IP 10.0.0.1.54965 > 10.0.0.4.5001: UDP, length 1470
19:06:29.878367 IP 10.0.0.1.54965 > 10.0.0.4.5001: UDP, length 1470
19:06:29.889670 IP 10.0.0.1.54965 > 10.0.0.4.5001: UDP, length 1470
19:06:29.901369 IP 10.0.0.1.54965 > 10.0.0.4.5001: UDP, length 1470
19:06:29.911976 IP 10.0.0.1.54965 > 10.0.0.4.5001: UDP, length 1470
19:06:29.924044 IP 10.0.0.1.54965 > 10.0.0.4.5001: UDP, length 1470
19:06:29.935248 IP 10.0.0.1.54965 > 10.0.0.4.5001: UDP, length 1470
19:06:29.945820 IP 10.0.0.1.54965 > 10.0.0.4.5001: UDP, length 1470
19:06:29.957554 IP 10.0.0.1.54965 > 10.0.0.4.5001: UDP, length 1470
19:06:29.968950 IP 10.0.0.1.54965 > 10.0.0.4.5001: UDP, length 1470
19:06:29.980194 IP 10.0.0.1.54965 > 10.0.0.4.5001: UDP, length 1470
19:06:29.991431 IP 10.0.0.1.54965 > 10.0.0.4.5001: UDP, length 1470
19:06:30.002774 IP 10.0.0.1.54965 > 10.0.0.4.5001: UDP, length 1470
19:06:30.013221 IP 10.0.0.1.54965 > 10.0.0.4.5001: UDP, length 1470
19:06:30.024563 IP 10.0.0.1.54965 > 10.0.0.4.5001: UDP, length 1470
19:06:30.035078 IP 10.0.0.1.54965 > 10.0.0.4.5001: UDP, length 1470
19:06:30.046343 IP 10.0.0.1.54965 > 10.0.0.4.5001: UDP, length 1470
19:06:30.057453 IP 10.0.0.1.54965 > 10.0.0.4.5001: UDP, length 1470
19:06:30.069078 IP 10.0.0.1.54965 > 10.0.0.4.5001: UDP, length 1470
19:06:30.080202 IP 10.0.0.1.54965 > 10.0.0.4.5001: UDP, length 1470
19:06:30.091179 IP 10.0.0.1.54965 > 10.0.0.4.5001: UDP, length 1470
19:06:30.102908 IP 10.0.0.1.54965 > 10.0.0.4.5001: UDP, length 1470
19:06:30.113990 IP 10.0.0.1.54965 > 10.0.0.4.5001: UDP, length 1470
19:06:30.125567 IP 10.0.0.1.54965 > 10.0.0.4.5001: UDP, length 1470
19:06:30.136215 IP 10.0.0.1.54965 > 10.0.0.4.5001: UDP, length 1470
19:06:30.147295 IP 10.0.0.1.54965 > 10.0.0.4.5001: UDP, length 1470
19:06:30.159123 IP 10.0.0.1.54965 > 10.0.0.4.5001: UDP, length 1470
19:06:30.169904 IP 10.0.0.1.54965 > 10.0.0.4.5001: UDP, length 1470
19:06:30.182013 IP 10.0.0.1.54965 > 10.0.0.4.5001: UDP, length 1470
19:06:30.192210 IP 10.0.0.1.54965 > 10.0.0.4.5001: UDP, length 1470
19:06:30.203290 IP 10.0.0.1.54965 > 10.0.0.4.5001: UDP, length 1470
19:06:30.214711 IP 10.0.0.1.54965 > 10.0.0.4.5001: UDP, length 1470
19:06:30.226096 IP 10.0.0.1.54965 > 10.0.0.4.5001: UDP, length 1470
19:06:30.237293 IP 10.0.0.1.54965 > 10.0.0.4.5001: UDP, length 1470
19:06:30.248355 IP 10.0.0.1.54965 > 10.0.0.4.5001: UDP, length 1470
19:06:30.259371 IP 10.0.0.1.54965 > 10.0.0.4.5001: UDP, length 1470
19:06:30.271787 IP 10.0.0.1.54965 > 10.0.0.4.5001: UDP, length 1470
19:06:30.282512 IP 10.0.0.1.54965 > 10.0.0.4.5001: UDP, length 1470
19:06:30.293401 IP 10.0.0.1.54965 > 10.0.0.4.5001: UDP, length 1470
19:06:30.304477 IP 10.0.0.1.54965 > 10.0.0.4.5001: UDP, length 1470
19:06:30.315668 IP 10.0.0.1.54965 > 10.0.0.4.5001: UDP, length 1470
19:06:30.327272 IP 10.0.0.1.54965 > 10.0.0.4.5001: UDP, length 1470
19:06:30.338240 IP 10.0.0.1.54965 > 10.0.0.4.5001: UDP, length 1470
19:06:30.349349 IP 10.0.0.1.54965 > 10.0.0.4.5001: UDP, length 1470
19:06:30.361093 IP 10.0.0.1.54965 > 10.0.0.4.5001: UDP, length 1470
19:06:30.372840 IP 10.0.0.1.54965 > 10.0.0.4.5001: UDP, length 1470
19:06:30.383937 IP 10.0.0.1.54965 > 10.0.0.4.5001: UDP, length 1470
19:06:30.395228 IP 10.0.0.1.54965 > 10.0.0.4.5001: UDP, length 1470
19:06:30.405334 IP 10.0.0.1.54965 > 10.0.0.4.5001: UDP, length 1470
19:06:30.416478 IP 10.0.0.1.54965 > 10.0.0.4.5001: UDP, length 1470
19:06:30.427675 IP 10.0.0.1.54965 > 10.0.0.4.5001: UDP, length 1470
19:06:30.438995 IP 10.0.0.1.54965 > 10.0.0.4.5001: UDP, length 1470
19:06:30.450452 IP 10.0.0.1.54965 > 10.0.0.4.5001: UDP, length 1470
19:06:30.461567 IP 10.0.0.1.54965 > 10.0.0.4.5001: UDP, length 1470
19:06:30.472805 IP 10.0.0.1.54965 > 10.0.0.4.5001: UDP, length 1470
19:06:30.483949 IP 10.0.0.1.54965 > 10.0.0.4.5001: UDP, length 1470
19:06:30.495102 IP 10.0.0.1.54965 > 10.0.0.4.5001: UDP, length 1470
19:06:30.506515 IP 10.0.0.1.54965 > 10.0.0.4.5001: UDP, length 1470
19:06:30.517818 IP 10.0.0.1.54965 > 10.0.0.4.5001: UDP, length 1470
19:06:30.529051 IP 10.0.0.1.54965 > 10.0.0.4.5001: UDP, length 1470
19:06:30.539984 IP 10.0.0.1.54965 > 10.0.0.4.5001: UDP, length 1470
19:06:30.551653 IP 10.0.0.1.54965 > 10.0.0.4.5001: UDP, length 1470
19:06:30.562730 IP 10.0.0.1.54965 > 10.0.0.4.5001: UDP, length 1470
19:06:30.573871 IP 10.0.0.1.54965 > 10.0.0.4.5001: UDP, length 1470
19:06:30.584767 IP 10.0.0.1.54965 > 10.0.0.4.5001: UDP, length 1470
19:06:30.595906 IP 10.0.0.1.54965 > 10.0.0.4.5001: UDP, length 1470
19:06:30.607291 IP 10.0.0.1.54965 > 10.0.0.4.5001: UDP, length 1470
19:06:30.618826 IP 10.0.0.1.54965 > 10.0.0.4.5001: UDP, length 1470
19:06:30.630063 IP 10.0.0.1.54965 > 10.0.0.4.5001: UDP, length 1470
19:06:30.641494 IP 10.0.0.1.54965 > 10.0.0.4.5001: UDP, length 1470
19:06:30.651919 IP 10.0.0.1.54965 > 10.0.0.4.5001: UDP, length 1470
19:06:30.663041 IP 10.0.0.1.54965 > 10.0.0.4.5001: UDP, length 1470
19:06:30.674864 IP 10.0.0.1.54965 > 10.0.0.4.5001: UDP, length 1470
19:06:30.686021 IP 10.0.0.1.54965 > 10.0.0.4.5001: UDP, length 1470
19:06:30.697175 IP 10.0.0.1.54965 > 10.0.0.4.5001: UDP, length 1470
19:06:30.708237 IP 10.0.0.1.54965 > 10.0.0.4.5001: UDP, length 1470
19:06:30.719233 IP 10.0.0.1.54965 > 10.0.0.4.5001: UDP, length 1470
19:06:30.731150 IP 10.0.0.1.54965 > 10.0.0.4.5001: UDP, length 1470
19:06:30.742243 IP 10.0.0.1.54965 > 10.0.0.4.5001: UDP, length 1470
19:06:30.753058 IP 10.0.0.1.54965 > 10.0.0.4.5001: UDP, length 1470
19:06:30.764896 IP 10.0.0.1.54965 > 10.0.0.4.5001: UDP, length 1470
19:06:30.775389 IP 10.0.0.1.54965 > 10.0.0.4.5001: UDP, length 1470
19:06:30.787083 IP 10.0.0.1.54965 > 10.0.0.4.5001: UDP, length 1470
19:06:30.798207 IP 10.0.0.1.54965 > 10.0.0.4.5001: UDP, length 1470
19:06:30.809020 IP 10.0.0.1.54965 > 10.0.0.4.5001: UDP, length 1470
19:06:30.820788 IP 10.0.0.1.54965 > 10.0.0.4.5001: UDP, length 1470
19:06:30.831538 IP 10.0.0.1.54965 > 10.0.0.4.5001: UDP, length 1470
19:06:30.842685 IP 10.0.0.1.54965 > 10.0.0.4.5001: UDP, length 1470
19:06:30.853949 IP 10.0.0.1.54965 > 10.0.0.4.5001: UDP, length 1470
19:06:30.865259 IP 10.0.0.1.54965 > 10.0.0.4.5001: UDP, length 1470
19:06:30.876461 IP 10.0.0.1.54965 > 10.0.0.4.5001: UDP, length 1470
19:06:30.887579 IP 10.0.0.1.54965 > 10.0.0.4.5001: UDP, length 1470
19:06:30.899087 IP 10.0.0.1.54965 > 10.0.0.4.5001: UDP, length 1470
19:06:30.910278 IP 10.0.0.1.54965 > 10.0.0.4.5001: UDP, length 1470
19:06:30.921438 IP 10.0.0.1.54965 > 10.0.0.4.5001: UDP, length 1470
19:06:30.932554 IP 10.0.0.1.54965 > 10.0.0.4.5001: UDP, length 1470
19:06:30.943654 IP 10.0.0.1.54965 > 10.0.0.4.5001: UDP, length 1470
19:06:30.955416 IP 10.0.0.1.54965 > 10.0.0.4.5001: UDP, length 1470
19:06:30.966686 IP 10.0.0.1.54965 > 10.0.0.4.5001: UDP, length 1470
19:06:30.977271 IP 10.0.0.1.54965 > 10.0.0.4.5001: UDP, length 1470
19:06:30.988658 IP 10.0.0.1.54965 > 10.0.0.4.5001: UDP, length 1470
19:06:30.999818 IP 10.0.0.1.54965 > 10.0.0.4.5001: UDP, length 1470
19:06:31.011751 IP 10.0.0.1.54965 > 10.0.0.4.5001: UDP, length 1470
19:06:31.022696 IP 10.0.0.1.54965 > 10.0.0.4.5001: UDP, length 1470
19:06:31.034530 IP 10.0.0.1.54965 > 10.0.0.4.5001: UDP, length 1470
19:06:31.044943 IP 10.0.0.1.54965 > 10.0.0.4.5001: UDP, length 1470
19:06:31.056821 IP 10.0.0.1.54965 > 10.0.0.4.5001: UDP, length 1470
19:06:31.068025 IP 10.0.0.1.54965 > 10.0.0.4.5001: UDP, length 1470
19:06:31.078395 IP 10.0.0.1.54965 > 10.0.0.4.5001: UDP, length 1470
19:06:31.089870 IP 10.0.0.1.54965 > 10.0.0.4.5001: UDP, length 1470
19:06:31.102007 IP 10.0.0.1.54965 > 10.0.0.4.5001: UDP, length 1470
19:06:31.111675 IP 10.0.0.1.54965 > 10.0.0.4.5001: UDP, length 1470
19:06:31.123323 IP 10.0.0.1.54965 > 10.0.0.4.5001: UDP, length 1470
19:06:31.134160 IP 10.0.0.1.54965 > 10.0.0.4.5001: UDP, length 1470
19:06:31.145404 IP 10.0.0.1.54965 > 10.0.0.4.5001: UDP, length 1470
19:06:31.156794 IP 10.0.0.1.54965 > 10.0.0.4.5001: UDP, length 1470

